Sheet: Table 1 - Data Set WORK.PRDSALE
A1: Country | B1: Region | C1: Division | D1: Product type | E1: Product | F1: Quarter | G1: Month | H1: Year | I1: Predicted Sales | J1: Actual Sales | K1: Difference
A2: CANADA | B2: EAST | C2: CONSUMER | D2: FURNITURE | E2: SOFA | F2: 1 | G2: Jan | H2: 1993 | I2: 425.00 | J2: 5.00 | K2: -420
A3: CANADA | B3: EAST | C3: CONSUMER | D3: FURNITURE | E3: SOFA | F3: 1 | G3: Feb | H3: 1993 | I3: 215.00 | J3: 164.00 | K3: -51
A4: CANADA | B4: EAST | C4: CONSUMER | D4: FURNITURE | E4: SOFA | F4: 1 | G4: Mar | H4: 1993 | I4: 948.00 | J4: 422.00 | K4: -526
A5: CANADA | B5: EAST | C5: CONSUMER | D5: FURNITURE | E5: SOFA | F5: 2 | G5: Apr | H5: 1993 | I5: 544.00 | J5: 424.00 | K5: -120
A6: CANADA | B6: EAST | C6: CONSUMER | D6: FURNITURE | E6: SOFA | F6: 2 | G6: May | H6: 1993 | I6: 764.00 | J6: 854.00 | K6: 90
A7: CANADA | B7: EAST | C7: CONSUMER | D7: FURNITURE | E7: SOFA | F7: 2 | G7: Jun | H7: 1993 | I7: 446.00 | J7: 168.00 | K7: -278
A8: CANADA | B8: EAST | C8: CONSUMER | D8: FURNITURE | E8: SOFA | F8: 3 | G8: Jul | H8: 1993 | I8: 957.00 | J8: 8.00 | K8: -949
A9: CANADA | B9: EAST | C9: CONSUMER | D9: FURNITURE | E9: SOFA | F9: 3 | G9: Aug | H9: 1993 | I9: 967.00 | J9: 748.00 | K9: -219
A10: CANADA | B10: EAST | C10: CONSUMER | D10: FURNITURE | E10: SOFA | F10: 3 | G10: Sep | H10: 1993 | I10: 11.00 | J10: 682.00 | K10: 671
A11: CANADA | B11: EAST | C11: CONSUMER | D11: FURNITURE | E11: SOFA | F11: 4 | G11: Oct | H11: 1993 | I11: 110.00 | J11: 300.00 | K11: 190
A12: CANADA | B12: EAST | C12: CONSUMER | D12: FURNITURE | E12: SOFA | F12: 4 | G12: Nov | H12: 1993 | I12: 263.00 | J12: 672.00 | K12: 409
A13: CANADA | B13: EAST | C13: CONSUMER | D13: FURNITURE | E13: SOFA | F13: 4 | G13: Dec | H13: 1993 | I13: 215.00 | J13: 894.00 | K13: 679
A14: CANADA | B14: EAST | C14: CONSUMER | D14: FURNITURE | E14: BED | F14: 1 | G14: Jan | H14: 1993 | I14: 414.00 | J14: 284.00 | K14: -130
A15: CANADA | B15: EAST | C15: CONSUMER | D15: FURNITURE | E15: BED | F15: 1 | G15: Feb | H15: 1993 | I15: 770.00 | J15: 705.00 | K15: -65
A16: CANADA | B16: EAST | C16: CONSUMER | D16: FURNITURE | E16: BED | F16: 1 | G16: Mar | H16: 1993 | I16: 679.00 | J16: 737.00 | K16: 58
A17: CANADA | B17: EAST | C17: CONSUMER | D17: FURNITURE | E17: BED | F17: 2 | G17: Apr | H17: 1993 | I17: 7.00 | J17: 745.00 | K17: 738
A18: CANADA | B18: EAST | C18: CONSUMER | D18: FURNITURE | E18: BED | F18: 2 | G18: May | H18: 1993 | I18: 713.00 | J18: 633.00 | K18: -80
A19: CANADA | B19: EAST | C19: CONSUMER | D19: FURNITURE | E19: BED | F19: 2 | G19: Jun | H19: 1993 | I19: 851.00 | J19: 983.00 | K19: 132
A20: CANADA | B20: EAST | C20: CONSUMER | D20: FURNITURE | E20: BED | F20: 3 | G20: Jul | H20: 1993 | I20: 944.00 | J20: 591.00 | K20: -353
A21: CANADA | B21: EAST | C21: CONSUMER | D21: FURNITURE | E21: BED | F21: 3 | G21: Aug | H21: 1993 | I21: 130.00 | J21: 42.00 | K21: -88
A22: CANADA | B22: EAST | C22: CONSUMER | D22: FURNITURE | E22: BED | F22: 3 | G22: Sep | H22: 1993 | I22: 485.00 | J22: 771.00 | K22: 286
A23: CANADA | B23: EAST | C23: CONSUMER | D23: FURNITURE | E23: BED | F23: 4 | G23: Oct | H23: 1993 | I23: 23.00 | J23: 465.00 | K23: 442
A24: CANADA | B24: EAST | C24: CONSUMER | D24: FURNITURE | E24: BED | F24: 4 | G24: Nov | H24: 1993 | I24: 193.00 | J24: 296.00 | K24: 103
A25: CANADA | B25: EAST | C25: CONSUMER | D25: FURNITURE | E25: BED | F25: 4 | G25: Dec | H25: 1993 | I25: 7.00 | J25: 890.00 | K25: 883
A26: CANADA | B26: EAST | C26: CONSUMER | D26: OFFICE | E26: TABLE | F26: 1 | G26: Jan | H26: 1993 | I26: 807.00 | J26: 197.00 | K26: -610
A27: CANADA | B27: EAST | C27: CONSUMER | D27: OFFICE | E27: TABLE | F27: 1 | G27: Feb | H27: 1993 | I27: 861.00 | J27: 51.00 | K27: -810
A28: CANADA | B28: EAST | C28: CONSUMER | D28: OFFICE | E28: TABLE | F28: 1 | G28: Mar | H28: 1993 | I28: 873.00 | J28: 570.00 | K28: -303
A29: CANADA | B29: EAST | C29: CONSUMER | D29: OFFICE | E29: TABLE | F29: 2 | G29: Apr | H29: 1993 | I29: 933.00 | J29: 423.00 | K29: -510
A30: CANADA | B30: EAST | C30: CONSUMER | D30: OFFICE | E30: TABLE | F30: 2 | G30: May | H30: 1993 | I30: 355.00 | J30: 524.00 | K30: 169
A31: CANADA | B31: EAST | C31: CONSUMER | D31: OFFICE | E31: TABLE | F31: 2 | G31: Jun | H31: 1993 | I31: 794.00 | J31: 416.00 | K31: -378
A32: CANADA | B32: EAST | C32: CONSUMER | D32: OFFICE | E32: TABLE | F32: 3 | G32: Jul | H32: 1993 | I32: 645.00 | J32: 789.00 | K32: 144
A33: CANADA | B33: EAST | C33: CONSUMER | D33: OFFICE | E33: TABLE | F33: 3 | G33: Aug | H33: 1993 | I33: 700.00 | J33: 551.00 | K33: -149
A34: CANADA | B34: EAST | C34: CONSUMER | D34: OFFICE | E34: TABLE | F34: 3 | G34: Sep | H34: 1993 | I34: 831.00 | J34: 400.00 | K34: -431
A35: CANADA | B35: EAST | C35: CONSUMER | D35: OFFICE | E35: TABLE | F35: 4 | G35: Oct | H35: 1993 | I35: 800.00 | J35: 361.00 | K35: -439
A36: CANADA | B36: EAST | C36: CONSUMER | D36: OFFICE | E36: TABLE | F36: 4 | G36: Nov | H36: 1993 | I36: 830.00 | J36: 189.00 | K36: -641
A37: CANADA | B37: EAST | C37: CONSUMER | D37: OFFICE | E37: TABLE | F37: 4 | G37: Dec | H37: 1993 | I37: 828.00 | J37: 554.00 | K37: -274
A38: CANADA | B38: EAST | C38: CONSUMER | D38: OFFICE | E38: CHAIR | F38: 1 | G38: Jan | H38: 1993 | I38: 986.00 | J38: 401.00 | K38: -585
A39: CANADA | B39: EAST | C39: CONSUMER | D39: OFFICE | E39: CHAIR | F39: 1 | G39: Feb | H39: 1993 | I39: 544.00 | J39: 181.00 | K39: -363
A40: CANADA | B40: EAST | C40: CONSUMER | D40: OFFICE | E40: CHAIR | F40: 1 | G40: Mar | H40: 1993 | I40: 182.00 | J40: 995.00 | K40: 813
A41: CANADA | B41: EAST | C41: CONSUMER | D41: OFFICE | E41: CHAIR | F41: 2 | G41: Apr | H41: 1993 | I41: 197.00 | J41: 120.00 | K41: -77
A42: CANADA | B42: EAST | C42: CONSUMER | D42: OFFICE | E42: CHAIR | F42: 2 | G42: May | H42: 1993 | I42: 435.00 | J42: 119.00 | K42: -316
A43: CANADA | B43: EAST | C43: CONSUMER | D43: OFFICE | E43: CHAIR | F43: 2 | G43: Jun | H43: 1993 | I43: 974.00 | J43: 319.00 | K43: -655
A44: CANADA | B44: EAST | C44: CONSUMER | D44: OFFICE | E44: CHAIR | F44: 3 | G44: Jul | H44: 1993 | I44: 524.00 | J44: 333.00 | K44: -191
A45: CANADA | B45: EAST | C45: CONSUMER | D45: OFFICE | E45: CHAIR | F45: 3 | G45: Aug | H45: 1993 | I45: 688.00 | J45: 923.00 | K45: 235
A46: CANADA | B46: EAST | C46: CONSUMER | D46: OFFICE | E46: CHAIR | F46: 3 | G46: Sep | H46: 1993 | I46: 750.00 | J46: 634.00 | K46: -116
A47: CANADA | B47: EAST | C47: CONSUMER | D47: OFFICE | E47: CHAIR | F47: 4 | G47: Oct | H47: 1993 | I47: 155.00 | J47: 493.00 | K47: 338
A48: CANADA | B48: EAST | C48: CONSUMER | D48: OFFICE | E48: CHAIR | F48: 4 | G48: Nov | H48: 1993 | I48: 860.00 | J48: 461.00 | K48: -399
A49: CANADA | B49: EAST | C49: CONSUMER | D49: OFFICE | E49: CHAIR | F49: 4 | G49: Dec | H49: 1993 | I49: 102.00 | J49: 304.00 | K49: 202
A50: CANADA | B50: EAST | C50: CONSUMER | D50: OFFICE | E50: DESK | F50: 1 | G50: Jan | H50: 1993 | I50: 225.00 | J50: 973.00 | K50: 748
A51: CANADA | B51: EAST | C51: CONSUMER | D51: OFFICE | E51: DESK | F51: 1 | G51: Feb | H51: 1993 | I51: 402.00 | J51: 511.00 | K51: 109
A52: CANADA | B52: EAST | C52: CONSUMER | D52: OFFICE | E52: DESK | F52: 1 | G52: Mar | H52: 1993 | I52: 697.00 | J52: 30.00 | K52: -667
A53: CANADA | B53: EAST | C53: CONSUMER | D53: OFFICE | E53: DESK | F53: 2 | G53: Apr | H53: 1993 | I53: 567.00 | J53: 895.00 | K53: 328
A54: CANADA | B54: EAST | C54: CONSUMER | D54: OFFICE | E54: DESK | F54: 2 | G54: May | H54: 1993 | I54: 231.00 | J54: 557.00 | K54: 326
A55: CANADA | B55: EAST | C55: CONSUMER | D55: OFFICE | E55: DESK | F55: 2 | G55: Jun | H55: 1993 | I55: 372.00 | J55: 282.00 | K55: -90
A56: CANADA | B56: EAST | C56: CONSUMER | D56: OFFICE | E56: DESK | F56: 3 | G56: Jul | H56: 1993 | I56: 15.00 | J56: 909.00 | K56: 894
A57: CANADA | B57: EAST | C57: CONSUMER | D57: OFFICE | E57: DESK | F57: 3 | G57: Aug | H57: 1993 | I57: 866.00 | J57: 276.00 | K57: -590
A58: CANADA | B58: EAST | C58: CONSUMER | D58: OFFICE | E58: DESK | F58: 3 | G58: Sep | H58: 1993 | I58: 452.00 | J58: 234.00 | K58: -218
A59: CANADA | B59: EAST | C59: CONSUMER | D59: OFFICE | E59: DESK | F59: 4 | G59: Oct | H59: 1993 | I59: 663.00 | J59: 479.00 | K59: -184
A60: CANADA | B60: EAST | C60: CONSUMER | D60: OFFICE | E60: DESK | F60: 4 | G60: Nov | H60: 1993 | I60: 982.00 | J60: 782.00 | K60: -200
A61: CANADA | B61: EAST | C61: CONSUMER | D61: OFFICE | E61: DESK | F61: 4 | G61: Dec | H61: 1993 | I61: 813.00 | J61: 755.00 | K61: -58
A62: CANADA | B62: EAST | C62: CONSUMER | D62: FURNITURE | E62: SOFA | F62: 1 | G62: Jan | H62: 1994 | I62: 965.00 | J62: 944.00 | K62: -21
A63: CANADA | B63: EAST | C63: CONSUMER | D63: FURNITURE | E63: SOFA | F63: 1 | G63: Feb | H63: 1994 | I63: 423.00 | J63: 403.00 | K63: -20
A64: CANADA | B64: EAST | C64: CONSUMER | D64: FURNITURE | E64: SOFA | F64: 1 | G64: Mar | H64: 1994 | I64: 753.00 | J64: 596.00 | K64: -157
A65: CANADA | B65: EAST | C65: CONSUMER | D65: FURNITURE | E65: SOFA | F65: 2 | G65: Apr | H65: 1994 | I65: 770.00 | J65: 481.00 | K65: -289
A66: CANADA | B66: EAST | C66: CONSUMER | D66: FURNITURE | E66: SOFA | F66: 2 | G66: May | H66: 1994 | I66: 263.00 | J66: 503.00 | K66: 240
A67: CANADA | B67: EAST | C67: CONSUMER | D67: FURNITURE | E67: SOFA | F67: 2 | G67: Jun | H67: 1994 | I67: 79.00 | J67: 126.00 | K67: 47
A68: CANADA | B68: EAST | C68: CONSUMER | D68: FURNITURE | E68: SOFA | F68: 3 | G68: Jul | H68: 1994 | I68: 441.00 | J68: 721.00 | K68: 280
A69: CANADA | B69: EAST | C69: CONSUMER | D69: FURNITURE | E69: SOFA | F69: 3 | G69: Aug | H69: 1994 | I69: 858.00 | J69: 271.00 | K69: -587
A70: CANADA | B70: EAST | C70: CONSUMER | D70: FURNITURE | E70: SOFA | F70: 3 | G70: Sep | H70: 1994 | I70: 667.00 | J70: 721.00 | K70: 54
A71: CANADA | B71: EAST | C71: CONSUMER | D71: FURNITURE | E71: SOFA | F71: 4 | G71: Oct | H71: 1994 | I71: 193.00 | J71: 157.00 | K71: -36
A72: CANADA | B72: EAST | C72: CONSUMER | D72: FURNITURE | E72: SOFA | F72: 4 | G72: Nov | H72: 1994 | I72: 394.00 | J72: 991.00 | K72: 597
A73: CANADA | B73: EAST | C73: CONSUMER | D73: FURNITURE | E73: SOFA | F73: 4 | G73: Dec | H73: 1994 | I73: 680.00 | J73: 499.00 | K73: -181
A74: CANADA | B74: EAST | C74: CONSUMER | D74: FURNITURE | E74: BED | F74: 1 | G74: Jan | H74: 1994 | I74: 919.00 | J74: 312.00 | K74: -607
A75: CANADA | B75: EAST | C75: CONSUMER | D75: FURNITURE | E75: BED | F75: 1 | G75: Feb | H75: 1994 | I75: 768.00 | J75: 777.00 | K75: 9
A76: CANADA | B76: EAST | C76: CONSUMER | D76: FURNITURE | E76: BED | F76: 1 | G76: Mar | H76: 1994 | I76: 854.00 | J76: 364.00 | K76: -490
A77: CANADA | B77: EAST | C77: CONSUMER | D77: FURNITURE | E77: BED | F77: 2 | G77: Apr | H77: 1994 | I77: 411.00 | J77: 601.00 | K77: 190
A78: CANADA | B78: EAST | C78: CONSUMER | D78: FURNITURE | E78: BED | F78: 2 | G78: May | H78: 1994 | I78: 736.00 | J78: 823.00 | K78: 87
A79: CANADA | B79: EAST | C79: CONSUMER | D79: FURNITURE | E79: BED | F79: 2 | G79: Jun | H79: 1994 | I79: 10.00 | J79: 847.00 | K79: 837
A80: CANADA | B80: EAST | C80: CONSUMER | D80: FURNITURE | E80: BED | F80: 3 | G80: Jul | H80: 1994 | I80: 311.00 | J80: 490.00 | K80: 179
A81: CANADA | B81: EAST | C81: CONSUMER | D81: FURNITURE | E81: BED | F81: 3 | G81: Aug | H81: 1994 | I81: 348.00 | J81: 387.00 | K81: 39
A82: CANADA | B82: EAST | C82: CONSUMER | D82: FURNITURE | E82: BED | F82: 3 | G82: Sep | H82: 1994 | I82: 458.00 | J82: 688.00 | K82: 230
A83: CANADA | B83: EAST | C83: CONSUMER | D83: FURNITURE | E83: BED | F83: 4 | G83: Oct | H83: 1994 | I83: 195.00 | J83: 650.00 | K83: 455
A84: CANADA | B84: EAST | C84: CONSUMER | D84: FURNITURE | E84: BED | F84: 4 | G84: Nov | H84: 1994 | I84: 658.00 | J84: 447.00 | K84: -211
A85: CANADA | B85: EAST | C85: CONSUMER | D85: FURNITURE | E85: BED | F85: 4 | G85: Dec | H85: 1994 | I85: 704.00 | J85: 91.00 | K85: -613
A86: CANADA | B86: EAST | C86: CONSUMER | D86: OFFICE | E86: TABLE | F86: 1 | G86: Jan | H86: 1994 | I86: 12.00 | J86: 585.00 | K86: 573
A87: CANADA | B87: EAST | C87: CONSUMER | D87: OFFICE | E87: TABLE | F87: 1 | G87: Feb | H87: 1994 | I87: 501.00 | J87: 281.00 | K87: -220
A88: CANADA | B88: EAST | C88: CONSUMER | D88: OFFICE | E88: TABLE | F88: 1 | G88: Mar | H88: 1994 | I88: 914.00 | J88: 629.00 | K88: -285
A89: CANADA | B89: EAST | C89: CONSUMER | D89: OFFICE | E89: TABLE | F89: 2 | G89: Apr | H89: 1994 | I89: 685.00 | J89: 43.00 | K89: -642
A90: CANADA | B90: EAST | C90: CONSUMER | D90: OFFICE | E90: TABLE | F90: 2 | G90: May | H90: 1994 | I90: 755.00 | J90: 533.00 | K90: -222
A91: CANADA | B91: EAST | C91: CONSUMER | D91: OFFICE | E91: TABLE | F91: 2 | G91: Jun | H91: 1994 | I91: 708.00 | J91: 882.00 | K91: 174
A92: CANADA | B92: EAST | C92: CONSUMER | D92: OFFICE | E92: TABLE | F92: 3 | G92: Jul | H92: 1994 | I92: 595.00 | J92: 790.00 | K92: 195
A93: CANADA | B93: EAST | C93: CONSUMER | D93: OFFICE | E93: TABLE | F93: 3 | G93: Aug | H93: 1994 | I93: 32.00 | J93: 600.00 | K93: 568
A94: CANADA | B94: EAST | C94: CONSUMER | D94: OFFICE | E94: TABLE | F94: 3 | G94: Sep | H94: 1994 | I94: 49.00 | J94: 148.00 | K94: 99
A95: CANADA | B95: EAST | C95: CONSUMER | D95: OFFICE | E95: TABLE | F95: 4 | G95: Oct | H95: 1994 | I95: 727.00 | J95: 237.00 | K95: -490
A96: CANADA | B96: EAST | C96: CONSUMER | D96: OFFICE | E96: TABLE | F96: 4 | G96: Nov | H96: 1994 | I96: 239.00 | J96: 488.00 | K96: 249
A97: CANADA | B97: EAST | C97: CONSUMER | D97: OFFICE | E97: TABLE | F97: 4 | G97: Dec | H97: 1994 | I97: 273.00 | J97: 457.00 | K97: 184
A98: CANADA | B98: EAST | C98: CONSUMER | D98: OFFICE | E98: CHAIR | F98: 1 | G98: Jan | H98: 1994 | I98: 425.00 | J98: 641.00 | K98: 216
A99: CANADA | B99: EAST | C99: CONSUMER | D99: OFFICE | E99: CHAIR | F99: 1 | G99: Feb | H99: 1994 | I99: 224.00 | J99: 992.00 | K99: 768
A100: CANADA | B100: EAST | C100: CONSUMER | D100: OFFICE | E100: CHAIR | F100: 1 | G100: Mar | H100: 1994 | I100: 408.00 | J100: 202.00 | K100: -206
A101: CANADA | B101: EAST | C101: CONSUMER | D101: OFFICE | E101: CHAIR | F101: 2 | G101: Apr | H101: 1994 | I101: 524.00 | J101: 770.00 | K101: 246
A102: CANADA | B102: EAST | C102: CONSUMER | D102: OFFICE | E102: CHAIR | F102: 2 | G102: May | H102: 1994 | I102: 816.00 | J102: 202.00 | K102: -614
A103: CANADA | B103: EAST | C103: CONSUMER | D103: OFFICE | E103: CHAIR | F103: 2 | G103: Jun | H103: 1994 | I103: 515.00 | J103: 14.00 | K103: -501
A104: CANADA | B104: EAST | C104: CONSUMER | D104: OFFICE | E104: CHAIR | F104: 3 | G104: Jul | H104: 1994 | I104: 793.00 | J104: 134.00 | K104: -659
A105: CANADA | B105: EAST | C105: CONSUMER | D105: OFFICE | E105: CHAIR | F105: 3 | G105: Aug | H105: 1994 | I105: 460.00 | J105: 977.00 | K105: 517
A106: CANADA | B106: EAST | C106: CONSUMER | D106: OFFICE | E106: CHAIR | F106: 3 | G106: Sep | H106: 1994 | I106: 732.00 | J106: 174.00 | K106: -558
A107: CANADA | B107: EAST | C107: CONSUMER | D107: OFFICE | E107: CHAIR | F107: 4 | G107: Oct | H107: 1994 | I107: 435.00 | J107: 429.00 | K107: -6
A108: CANADA | B108: EAST | C108: CONSUMER | D108: OFFICE | E108: CHAIR | F108: 4 | G108: Nov | H108: 1994 | I108: 38.00 | J108: 514.00 | K108: 476
A109: CANADA | B109: EAST | C109: CONSUMER | D109: OFFICE | E109: CHAIR | F109: 4 | G109: Dec | H109: 1994 | I109: 616.00 | J109: 784.00 | K109: 168
A110: CANADA | B110: EAST | C110: CONSUMER | D110: OFFICE | E110: DESK | F110: 1 | G110: Jan | H110: 1994 | I110: 523.00 | J110: 689.00 | K110: 166
A111: CANADA | B111: EAST | C111: CONSUMER | D111: OFFICE | E111: DESK | F111: 1 | G111: Feb | H111: 1994 | I111: 871.00 | J111: 496.00 | K111: -375
A112: CANADA | B112: EAST | C112: CONSUMER | D112: OFFICE | E112: DESK | F112: 1 | G112: Mar | H112: 1994 | I112: 511.00 | J112: 24.00 | K112: -487
A113: CANADA | B113: EAST | C113: CONSUMER | D113: OFFICE | E113: DESK | F113: 2 | G113: Apr | H113: 1994 | I113: 819.00 | J113: 379.00 | K113: -440
A114: CANADA | B114: EAST | C114: CONSUMER | D114: OFFICE | E114: DESK | F114: 2 | G114: May | H114: 1994 | I114: 525.00 | J114: 441.00 | K114: -84
A115: CANADA | B115: EAST | C115: CONSUMER | D115: OFFICE | E115: DESK | F115: 2 | G115: Jun | H115: 1994 | I115: 13.00 | J115: 49.00 | K115: 36
A116: CANADA | B116: EAST | C116: CONSUMER | D116: OFFICE | E116: DESK | F116: 3 | G116: Jul | H116: 1994 | I116: 694.00 | J116: 243.00 | K116: -451
A117: CANADA | B117: EAST | C117: CONSUMER | D117: OFFICE | E117: DESK | F117: 3 | G117: Aug | H117: 1994 | I117: 782.00 | J117: 295.00 | K117: -487
A118: CANADA | B118: EAST | C118: CONSUMER | D118: OFFICE | E118: DESK | F118: 3 | G118: Sep | H118: 1994 | I118: 839.00 | J118: 395.00 | K118: -444
A119: CANADA | B119: EAST | C119: CONSUMER | D119: OFFICE | E119: DESK | F119: 4 | G119: Oct | H119: 1994 | I119: 461.00 | J119: 929.00 | K119: 468
A120: CANADA | B120: EAST | C120: CONSUMER | D120: OFFICE | E120: DESK | F120: 4 | G120: Nov | H120: 1994 | I120: 303.00 | J120: 997.00 | K120: 694
A121: CANADA | B121: EAST | C121: CONSUMER | D121: OFFICE | E121: DESK | F121: 4 | G121: Dec | H121: 1994 | I121: 421.00 | J121: 889.00 | K121: 468
A122: CANADA | B122: EAST | C122: EDUCATION | D122: FURNITURE | E122: SOFA | F122: 1 | G122: Jan | H122: 1993 | I122: 850.00 | J122: 925.00 | K122: 75
A123: CANADA | B123: EAST | C123: EDUCATION | D123: FURNITURE | E123: SOFA | F123: 1 | G123: Feb | H123: 1993 | I123: 297.00 | J123: 999.00 | K123: 702
A124: CANADA | B124: EAST | C124: EDUCATION | D124: FURNITURE | E124: SOFA | F124: 1 | G124: Mar | H124: 1993 | I124: 846.00 | J124: 608.00 | K124: -238
A125: CANADA | B125: EAST | C125: EDUCATION | D125: FURNITURE | E125: SOFA | F125: 2 | G125: Apr | H125: 1993 | I125: 533.00 | J125: 642.00 | K125: 109
A126: CANADA | B126: EAST | C126: EDUCATION | D126: FURNITURE | E126: SOFA | F126: 2 | G126: May | H126: 1993 | I126: 646.00 | J126: 656.00 | K126: 10
A127: CANADA | B127: EAST | C127: EDUCATION | D127: FURNITURE | E127: SOFA | F127: 2 | G127: Jun | H127: 1993 | I127: 486.00 | J127: 948.00 | K127: 462
A128: CANADA | B128: EAST | C128: EDUCATION | D128: FURNITURE | E128: SOFA | F128: 3 | G128: Jul | H128: 1993 | I128: 717.00 | J128: 612.00 | K128: -105
A129: CANADA | B129: EAST | C129: EDUCATION | D129: FURNITURE | E129: SOFA | F129: 3 | G129: Aug | H129: 1993 | I129: 564.00 | J129: 114.00 | K129: -450
A130: CANADA | B130: EAST | C130: EDUCATION | D130: FURNITURE | E130: SOFA | F130: 3 | G130: Sep | H130: 1993 | I130: 230.00 | J130: 685.00 | K130: 455
A131: CANADA | B131: EAST | C131: EDUCATION | D131: FURNITURE | E131: SOFA | F131: 4 | G131: Oct | H131: 1993 | I131: 494.00 | J131: 657.00 | K131: 163
A132: CANADA | B132: EAST | C132: EDUCATION | D132: FURNITURE | E132: SOFA | F132: 4 | G132: Nov | H132: 1993 | I132: 903.00 | J132: 608.00 | K132: -295
A133: CANADA | B133: EAST | C133: EDUCATION | D133: FURNITURE | E133: SOFA | F133: 4 | G133: Dec | H133: 1993 | I133: 266.00 | J133: 353.00 | K133: 87
A134: CANADA | B134: EAST | C134: EDUCATION | D134: FURNITURE | E134: BED | F134: 1 | G134: Jan | H134: 1993 | I134: 585.00 | J134: 220.00 | K134: -365
A135: CANADA | B135: EAST | C135: EDUCATION | D135: FURNITURE | E135: BED | F135: 1 | G135: Feb | H135: 1993 | I135: 267.00 | J135: 444.00 | K135: 177
A136: CANADA | B136: EAST | C136: EDUCATION | D136: FURNITURE | E136: BED | F136: 1 | G136: Mar | H136: 1993 | I136: 487.00 | J136: 178.00 | K136: -309
A137: CANADA | B137: EAST | C137: EDUCATION | D137: FURNITURE | E137: BED | F137: 2 | G137: Apr | H137: 1993 | I137: 764.00 | J137: 756.00 | K137: -8
A138: CANADA | B138: EAST | C138: EDUCATION | D138: FURNITURE | E138: BED | F138: 2 | G138: May | H138: 1993 | I138: 312.00 | J138: 329.00 | K138: 17
A139: CANADA | B139: EAST | C139: EDUCATION | D139: FURNITURE | E139: BED | F139: 2 | G139: Jun | H139: 1993 | I139: 531.00 | J139: 910.00 | K139: 379
A140: CANADA | B140: EAST | C140: EDUCATION | D140: FURNITURE | E140: BED | F140: 3 | G140: Jul | H140: 1993 | I140: 536.00 | J140: 530.00 | K140: -6
A141: CANADA | B141: EAST | C141: EDUCATION | D141: FURNITURE | E141: BED | F141: 3 | G141: Aug | H141: 1993 | I141: 773.00 | J141: 101.00 | K141: -672
A142: CANADA | B142: EAST | C142: EDUCATION | D142: FURNITURE | E142: BED | F142: 3 | G142: Sep | H142: 1993 | I142: 143.00 | J142: 515.00 | K142: 372
A143: CANADA | B143: EAST | C143: EDUCATION | D143: FURNITURE | E143: BED | F143: 4 | G143: Oct | H143: 1993 | I143: 126.00 | J143: 730.00 | K143: 604
A144: CANADA | B144: EAST | C144: EDUCATION | D144: FURNITURE | E144: BED | F144: 4 | G144: Nov | H144: 1993 | I144: 862.00 | J144: 993.00 | K144: 131
A145: CANADA | B145: EAST | C145: EDUCATION | D145: FURNITURE | E145: BED | F145: 4 | G145: Dec | H145: 1993 | I145: 754.00 | J145: 954.00 | K145: 200
A146: CANADA | B146: EAST | C146: EDUCATION | D146: OFFICE | E146: TABLE | F146: 1 | G146: Jan | H146: 1993 | I146: 209.00 | J146: 688.00 | K146: 479
A147: CANADA | B147: EAST | C147: EDUCATION | D147: OFFICE | E147: TABLE | F147: 1 | G147: Feb | H147: 1993 | I147: 51.00 | J147: 544.00 | K147: 493
A148: CANADA | B148: EAST | C148: EDUCATION | D148: OFFICE | E148: TABLE | F148: 1 | G148: Mar | H148: 1993 | I148: 135.00 | J148: 954.00 | K148: 819
A149: CANADA | B149: EAST | C149: EDUCATION | D149: OFFICE | E149: TABLE | F149: 2 | G149: Apr | H149: 1993 | I149: 47.00 | J149: 445.00 | K149: 398
A150: CANADA | B150: EAST | C150: EDUCATION | D150: OFFICE | E150: TABLE | F150: 2 | G150: May | H150: 1993 | I150: 379.00 | J150: 829.00 | K150: 450
A151: CANADA | B151: EAST | C151: EDUCATION | D151: OFFICE | E151: TABLE | F151: 2 | G151: Jun | H151: 1993 | I151: 758.00 | J151: 464.00 | K151: -294
A152: CANADA | B152: EAST | C152: EDUCATION | D152: OFFICE | E152: TABLE | F152: 3 | G152: Jul | H152: 1993 | I152: 475.00 | J152: 968.00 | K152: 493
A153: CANADA | B153: EAST | C153: EDUCATION | D153: OFFICE | E153: TABLE | F153: 3 | G153: Aug | H153: 1993 | I153: 343.00 | J153: 842.00 | K153: 499
A154: CANADA | B154: EAST | C154: EDUCATION | D154: OFFICE | E154: TABLE | F154: 3 | G154: Sep | H154: 1993 | I154: 507.00 | J154: 721.00 | K154: 214
A155: CANADA | B155: EAST | C155: EDUCATION | D155: OFFICE | E155: TABLE | F155: 4 | G155: Oct | H155: 1993 | I155: 269.00 | J155: 966.00 | K155: 697
A156: CANADA | B156: EAST | C156: EDUCATION | D156: OFFICE | E156: TABLE | F156: 4 | G156: Nov | H156: 1993 | I156: 699.00 | J156: 332.00 | K156: -367
A157: CANADA | B157: EAST | C157: EDUCATION | D157: OFFICE | E157: TABLE | F157: 4 | G157: Dec | H157: 1993 | I157: 824.00 | J157: 328.00 | K157: -496
A158: CANADA | B158: EAST | C158: EDUCATION | D158: OFFICE | E158: CHAIR | F158: 1 | G158: Jan | H158: 1993 | I158: 282.00 | J158: 35.00 | K158: -247
A159: CANADA | B159: EAST | C159: EDUCATION | D159: OFFICE | E159: CHAIR | F159: 1 | G159: Feb | H159: 1993 | I159: 538.00 | J159: 995.00 | K159: 457
A160: CANADA | B160: EAST | C160: EDUCATION | D160: OFFICE | E160: CHAIR | F160: 1 | G160: Mar | H160: 1993 | I160: 679.00 | J160: 670.00 | K160: -9
A161: CANADA | B161: EAST | C161: EDUCATION | D161: OFFICE | E161: CHAIR | F161: 2 | G161: Apr | H161: 1993 | I161: 601.00 | J161: 406.00 | K161: -195
A162: CANADA | B162: EAST | C162: EDUCATION | D162: OFFICE | E162: CHAIR | F162: 2 | G162: May | H162: 1993 | I162: 577.00 | J162: 825.00 | K162: 248
A163: CANADA | B163: EAST | C163: EDUCATION | D163: OFFICE | E163: CHAIR | F163: 2 | G163: Jun | H163: 1993 | I163: 908.00 | J163: 467.00 | K163: -441
A164: CANADA | B164: EAST | C164: EDUCATION | D164: OFFICE | E164: CHAIR | F164: 3 | G164: Jul | H164: 1993 | I164: 819.00 | J164: 709.00 | K164: -110
A165: CANADA | B165: EAST | C165: EDUCATION | D165: OFFICE | E165: CHAIR | F165: 3 | G165: Aug | H165: 1993 | I165: 687.00 | J165: 522.00 | K165: -165
A166: CANADA | B166: EAST | C166: EDUCATION | D166: OFFICE | E166: CHAIR | F166: 3 | G166: Sep | H166: 1993 | I166: 157.00 | J166: 688.00 | K166: 531
A167: CANADA | B167: EAST | C167: EDUCATION | D167: OFFICE | E167: CHAIR | F167: 4 | G167: Oct | H167: 1993 | I167: 111.00 | J167: 956.00 | K167: 845
A168: CANADA | B168: EAST | C168: EDUCATION | D168: OFFICE | E168: CHAIR | F168: 4 | G168: Nov | H168: 1993 | I168: 31.00 | J168: 129.00 | K168: 98
A169: CANADA | B169: EAST | C169: EDUCATION | D169: OFFICE | E169: CHAIR | F169: 4 | G169: Dec | H169: 1993 | I169: 790.00 | J169: 687.00 | K169: -103
A170: CANADA | B170: EAST | C170: EDUCATION | D170: OFFICE | E170: DESK | F170: 1 | G170: Jan | H170: 1993 | I170: 386.00 | J170: 240.00 | K170: -146
A171: CANADA | B171: EAST | C171: EDUCATION | D171: OFFICE | E171: DESK | F171: 1 | G171: Feb | H171: 1993 | I171: 113.00 | J171: 605.00 | K171: 492
A172: CANADA | B172: EAST | C172: EDUCATION | D172: OFFICE | E172: DESK | F172: 1 | G172: Mar | H172: 1993 | I172: 68.00 | J172: 274.00 | K172: 206
A173: CANADA | B173: EAST | C173: EDUCATION | D173: OFFICE | E173: DESK | F173: 2 | G173: Apr | H173: 1993 | I173: 885.00 | J173: 422.00 | K173: -463
A174: CANADA | B174: EAST | C174: EDUCATION | D174: OFFICE | E174: DESK | F174: 2 | G174: May | H174: 1993 | I174: 575.00 | J174: 763.00 | K174: 188
A175: CANADA | B175: EAST | C175: EDUCATION | D175: OFFICE | E175: DESK | F175: 2 | G175: Jun | H175: 1993 | I175: 743.00 | J175: 561.00 | K175: -182
A176: CANADA | B176: EAST | C176: EDUCATION | D176: OFFICE | E176: DESK | F176: 3 | G176: Jul | H176: 1993 | I176: 816.00 | J176: 339.00 | K176: -477
A177: CANADA | B177: EAST | C177: EDUCATION | D177: OFFICE | E177: DESK | F177: 3 | G177: Aug | H177: 1993 | I177: 203.00 | J177: 877.00 | K177: 674
A178: CANADA | B178: EAST | C178: EDUCATION | D178: OFFICE | E178: DESK | F178: 3 | G178: Sep | H178: 1993 | I178: 581.00 | J178: 192.00 | K178: -389
A179: CANADA | B179: EAST | C179: EDUCATION | D179: OFFICE | E179: DESK | F179: 4 | G179: Oct | H179: 1993 | I179: 815.00 | J179: 604.00 | K179: -211
A180: CANADA | B180: EAST | C180: EDUCATION | D180: OFFICE | E180: DESK | F180: 4 | G180: Nov | H180: 1993 | I180: 333.00 | J180: 55.00 | K180: -278
A181: CANADA | B181: EAST | C181: EDUCATION | D181: OFFICE | E181: DESK | F181: 4 | G181: Dec | H181: 1993 | I181: 40.00 | J181: 87.00 | K181: 47
A182: CANADA | B182: EAST | C182: EDUCATION | D182: FURNITURE | E182: SOFA | F182: 1 | G182: Jan | H182: 1994 | I182: 190.00 | J182: 107.00 | K182: -83
A183: CANADA | B183: EAST | C183: EDUCATION | D183: FURNITURE | E183: SOFA | F183: 1 | G183: Feb | H183: 1994 | I183: 139.00 | J183: 354.00 | K183: 215
A184: CANADA | B184: EAST | C184: EDUCATION | D184: FURNITURE | E184: SOFA | F184: 1 | G184: Mar | H184: 1994 | I184: 217.00 | J184: 101.00 | K184: -116
A185: CANADA | B185: EAST | C185: EDUCATION | D185: FURNITURE | E185: SOFA | F185: 2 | G185: Apr | H185: 1994 | I185: 560.00 | J185: 553.00 | K185: -7
A186: CANADA | B186: EAST | C186: EDUCATION | D186: FURNITURE | E186: SOFA | F186: 2 | G186: May | H186: 1994 | I186: 148.00 | J186: 877.00 | K186: 729
A187: CANADA | B187: EAST | C187: EDUCATION | D187: FURNITURE | E187: SOFA | F187: 2 | G187: Jun | H187: 1994 | I187: 762.00 | J187: 431.00 | K187: -331
A188: CANADA | B188: EAST | C188: EDUCATION | D188: FURNITURE | E188: SOFA | F188: 3 | G188: Jul | H188: 1994 | I188: 457.00 | J188: 511.00 | K188: 54
A189: CANADA | B189: EAST | C189: EDUCATION | D189: FURNITURE | E189: SOFA | F189: 3 | G189: Aug | H189: 1994 | I189: 532.00 | J189: 157.00 | K189: -375
A190: CANADA | B190: EAST | C190: EDUCATION | D190: FURNITURE | E190: SOFA | F190: 3 | G190: Sep | H190: 1994 | I190: 629.00 | J190: 520.00 | K190: -109
A191: CANADA | B191: EAST | C191: EDUCATION | D191: FURNITURE | E191: SOFA | F191: 4 | G191: Oct | H191: 1994 | I191: 491.00 | J191: 114.00 | K191: -377
A192: CANADA | B192: EAST | C192: EDUCATION | D192: FURNITURE | E192: SOFA | F192: 4 | G192: Nov | H192: 1994 | I192: 0.00 | J192: 277.00 | K192: 277
A193: CANADA | B193: EAST | C193: EDUCATION | D193: FURNITURE | E193: SOFA | F193: 4 | G193: Dec | H193: 1994 | I193: 979.00 | J193: 561.00 | K193: -418
A194: CANADA | B194: EAST | C194: EDUCATION | D194: FURNITURE | E194: BED | F194: 1 | G194: Jan | H194: 1994 | I194: 410.00 | J194: 267.00 | K194: -143
A195: CANADA | B195: EAST | C195: EDUCATION | D195: FURNITURE | E195: BED | F195: 1 | G195: Feb | H195: 1994 | I195: 701.00 | J195: 347.00 | K195: -354
A196: CANADA | B196: EAST | C196: EDUCATION | D196: FURNITURE | E196: BED | F196: 1 | G196: Mar | H196: 1994 | I196: 204.00 | J196: 991.00 | K196: 787
A197: CANADA | B197: EAST | C197: EDUCATION | D197: FURNITURE | E197: BED | F197: 2 | G197: Apr | H197: 1994 | I197: 509.00 | J197: 923.00 | K197: 414
A198: CANADA | B198: EAST | C198: EDUCATION | D198: FURNITURE | E198: BED | F198: 2 | G198: May | H198: 1994 | I198: 378.00 | J198: 437.00 | K198: 59
A199: CANADA | B199: EAST | C199: EDUCATION | D199: FURNITURE | E199: BED | F199: 2 | G199: Jun | H199: 1994 | I199: 507.00 | J199: 737.00 | K199: 230
A200: CANADA | B200: EAST | C200: EDUCATION | D200: FURNITURE | E200: BED | F200: 3 | G200: Jul | H200: 1994 | I200: 49.00 | J200: 104.00 | K200: 55
A201: CANADA | B201: EAST | C201: EDUCATION | D201: FURNITURE | E201: BED | F201: 3 | G201: Aug | H201: 1994 | I201: 876.00 | J201: 840.00 | K201: -36
A202: CANADA | B202: EAST | C202: EDUCATION | D202: FURNITURE | E202: BED | F202: 3 | G202: Sep | H202: 1994 | I202: 66.00 | J202: 704.00 | K202: 638
A203: CANADA | B203: EAST | C203: EDUCATION | D203: FURNITURE | E203: BED | F203: 4 | G203: Oct | H203: 1994 | I203: 819.00 | J203: 889.00 | K203: 70
A204: CANADA | B204: EAST | C204: EDUCATION | D204: FURNITURE | E204: BED | F204: 4 | G204: Nov | H204: 1994 | I204: 351.00 | J204: 107.00 | K204: -244
A205: CANADA | B205: EAST | C205: EDUCATION | D205: FURNITURE | E205: BED | F205: 4 | G205: Dec | H205: 1994 | I205: 201.00 | J205: 571.00 | K205: 370
A206: CANADA | B206: EAST | C206: EDUCATION | D206: OFFICE | E206: TABLE | F206: 1 | G206: Jan | H206: 1994 | I206: 497.00 | J206: 355.00 | K206: -142
A207: CANADA | B207: EAST | C207: EDUCATION | D207: OFFICE | E207: TABLE | F207: 1 | G207: Feb | H207: 1994 | I207: 44.00 | J207: 506.00 | K207: 462
A208: CANADA | B208: EAST | C208: EDUCATION | D208: OFFICE | E208: TABLE | F208: 1 | G208: Mar | H208: 1994 | I208: 522.00 | J208: 585.00 | K208: 63
A209: CANADA | B209: EAST | C209: EDUCATION | D209: OFFICE | E209: TABLE | F209: 2 | G209: Apr | H209: 1994 | I209: 378.00 | J209: 634.00 | K209: 256
A210: CANADA | B210: EAST | C210: EDUCATION | D210: OFFICE | E210: TABLE | F210: 2 | G210: May | H210: 1994 | I210: 689.00 | J210: 662.00 | K210: -27
A211: CANADA | B211: EAST | C211: EDUCATION | D211: OFFICE | E211: TABLE | F211: 2 | G211: Jun | H211: 1994 | I211: 90.00 | J211: 783.00 | K211: 693
A212: CANADA | B212: EAST | C212: EDUCATION | D212: OFFICE | E212: TABLE | F212: 3 | G212: Jul | H212: 1994 | I212: 720.00 | J212: 786.00 | K212: 66
A213: CANADA | B213: EAST | C213: EDUCATION | D213: OFFICE | E213: TABLE | F213: 3 | G213: Aug | H213: 1994 | I213: 343.00 | J213: 710.00 | K213: 367
A214: CANADA | B214: EAST | C214: EDUCATION | D214: OFFICE | E214: TABLE | F214: 3 | G214: Sep | H214: 1994 | I214: 457.00 | J214: 950.00 | K214: 493
A215: CANADA | B215: EAST | C215: EDUCATION | D215: OFFICE | E215: TABLE | F215: 4 | G215: Oct | H215: 1994 | I215: 947.00 | J215: 274.00 | K215: -673
A216: CANADA | B216: EAST | C216: EDUCATION | D216: OFFICE | E216: TABLE | F216: 4 | G216: Nov | H216: 1994 | I216: 834.00 | J216: 406.00 | K216: -428
A217: CANADA | B217: EAST | C217: EDUCATION | D217: OFFICE | E217: TABLE | F217: 4 | G217: Dec | H217: 1994 | I217: 71.00 | J217: 515.00 | K217: 444
A218: CANADA | B218: EAST | C218: EDUCATION | D218: OFFICE | E218: CHAIR | F218: 1 | G218: Jan | H218: 1994 | I218: 795.00 | J218: 877.00 | K218: 82
A219: CANADA | B219: EAST | C219: EDUCATION | D219: OFFICE | E219: CHAIR | F219: 1 | G219: Feb | H219: 1994 | I219: 379.00 | J219: 845.00 | K219: 466
A220: CANADA | B220: EAST | C220: EDUCATION | D220: OFFICE | E220: CHAIR | F220: 1 | G220: Mar | H220: 1994 | I220: 114.00 | J220: 425.00 | K220: 311
A221: CANADA | B221: EAST | C221: EDUCATION | D221: OFFICE | E221: CHAIR | F221: 2 | G221: Apr | H221: 1994 | I221: 475.00 | J221: 899.00 | K221: 424
A222: CANADA | B222: EAST | C222: EDUCATION | D222: OFFICE | E222: CHAIR | F222: 2 | G222: May | H222: 1994 | I222: 747.00 | J222: 987.00 | K222: 240
A223: CANADA | B223: EAST | C223: EDUCATION | D223: OFFICE | E223: CHAIR | F223: 2 | G223: Jun | H223: 1994 | I223: 372.00 | J223: 641.00 | K223: 269
A224: CANADA | B224: EAST | C224: EDUCATION | D224: OFFICE | E224: CHAIR | F224: 3 | G224: Jul | H224: 1994 | I224: 415.00 | J224: 448.00 | K224: 33
A225: CANADA | B225: EAST | C225: EDUCATION | D225: OFFICE | E225: CHAIR | F225: 3 | G225: Aug | H225: 1994 | I225: 955.00 | J225: 341.00 | K225: -614
A226: CANADA | B226: EAST | C226: EDUCATION | D226: OFFICE | E226: CHAIR | F226: 3 | G226: Sep | H226: 1994 | I226: 356.00 | J226: 137.00 | K226: -219
A227: CANADA | B227: EAST | C227: EDUCATION | D227: OFFICE | E227: CHAIR | F227: 4 | G227: Oct | H227: 1994 | I227: 316.00 | J227: 235.00 | K227: -81
A228: CANADA | B228: EAST | C228: EDUCATION | D228: OFFICE | E228: CHAIR | F228: 4 | G228: Nov | H228: 1994 | I228: 351.00 | J228: 482.00 | K228: 131
A229: CANADA | B229: EAST | C229: EDUCATION | D229: OFFICE | E229: CHAIR | F229: 4 | G229: Dec | H229: 1994 | I229: 164.00 | J229: 678.00 | K229: 514
A230: CANADA | B230: EAST | C230: EDUCATION | D230: OFFICE | E230: DESK | F230: 1 | G230: Jan | H230: 1994 | I230: 672.00 | J230: 942.00 | K230: 270
A231: CANADA | B231: EAST | C231: EDUCATION | D231: OFFICE | E231: DESK | F231: 1 | G231: Feb | H231: 1994 | I231: 23.00 | J231: 912.00 | K231: 889
A232: CANADA | B232: EAST | C232: EDUCATION | D232: OFFICE | E232: DESK | F232: 1 | G232: Mar | H232: 1994 | I232: 948.00 | J232: 768.00 | K232: -180
A233: CANADA | B233: EAST | C233: EDUCATION | D233: OFFICE | E233: DESK | F233: 2 | G233: Apr | H233: 1994 | I233: 291.00 | J233: 951.00 | K233: 660
A234: CANADA | B234: EAST | C234: EDUCATION | D234: OFFICE | E234: DESK | F234: 2 | G234: May | H234: 1994 | I234: 839.00 | J234: 768.00 | K234: -71
A235: CANADA | B235: EAST | C235: EDUCATION | D235: OFFICE | E235: DESK | F235: 2 | G235: Jun | H235: 1994 | I235: 864.00 | J235: 978.00 | K235: 114
A236: CANADA | B236: EAST | C236: EDUCATION | D236: OFFICE | E236: DESK | F236: 3 | G236: Jul | H236: 1994 | I236: 337.00 | J236: 20.00 | K236: -317
A237: CANADA | B237: EAST | C237: EDUCATION | D237: OFFICE | E237: DESK | F237: 3 | G237: Aug | H237: 1994 | I237: 95.00 | J237: 298.00 | K237: 203
A238: CANADA | B238: EAST | C238: EDUCATION | D238: OFFICE | E238: DESK | F238: 3 | G238: Sep | H238: 1994 | I238: 535.00 | J238: 193.00 | K238: -342
A239: CANADA | B239: EAST | C239: EDUCATION | D239: OFFICE | E239: DESK | F239: 4 | G239: Oct | H239: 1994 | I239: 191.00 | J239: 336.00 | K239: 145
A240: CANADA | B240: EAST | C240: EDUCATION | D240: OFFICE | E240: DESK | F240: 4 | G240: Nov | H240: 1994 | I240: 412.00 | J240: 617.00 | K240: 205
A241: CANADA | B241: EAST | C241: EDUCATION | D241: OFFICE | E241: DESK | F241: 4 | G241: Dec | H241: 1994 | I241: 711.00 | J241: 709.00 | K241: -2
A242: CANADA | B242: WEST | C242: CONSUMER | D242: FURNITURE | E242: SOFA | F242: 1 | G242: Jan | H242: 1993 | I242: 730.00 | J242: 951.00 | K242: 221
A243: CANADA | B243: WEST | C243: CONSUMER | D243: FURNITURE | E243: SOFA | F243: 1 | G243: Feb | H243: 1993 | I243: 408.00 | J243: 394.00 | K243: -14
A244: CANADA | B244: WEST | C244: CONSUMER | D244: FURNITURE | E244: SOFA | F244: 1 | G244: Mar | H244: 1993 | I244: 982.00 | J244: 615.00 | K244: -367
A245: CANADA | B245: WEST | C245: CONSUMER | D245: FURNITURE | E245: SOFA | F245: 2 | G245: Apr | H245: 1993 | I245: 499.00 | J245: 653.00 | K245: 154
A246: CANADA | B246: WEST | C246: CONSUMER | D246: FURNITURE | E246: SOFA | F246: 2 | G246: May | H246: 1993 | I246: 307.00 | J246: 180.00 | K246: -127
A247: CANADA | B247: WEST | C247: CONSUMER | D247: FURNITURE | E247: SOFA | F247: 2 | G247: Jun | H247: 1993 | I247: 741.00 | J247: 649.00 | K247: -92
A248: CANADA | B248: WEST | C248: CONSUMER | D248: FURNITURE | E248: SOFA | F248: 3 | G248: Jul | H248: 1993 | I248: 640.00 | J248: 921.00 | K248: 281
A249: CANADA | B249: WEST | C249: CONSUMER | D249: FURNITURE | E249: SOFA | F249: 3 | G249: Aug | H249: 1993 | I249: 300.00 | J249: 11.00 | K249: -289
A250: CANADA | B250: WEST | C250: CONSUMER | D250: FURNITURE | E250: SOFA | F250: 3 | G250: Sep | H250: 1993 | I250: 929.00 | J250: 696.00 | K250: -233
A251: CANADA | B251: WEST | C251: CONSUMER | D251: FURNITURE | E251: SOFA | F251: 4 | G251: Oct | H251: 1993 | I251: 309.00 | J251: 795.00 | K251: 486
A252: CANADA | B252: WEST | C252: CONSUMER | D252: FURNITURE | E252: SOFA | F252: 4 | G252: Nov | H252: 1993 | I252: 340.00 | J252: 550.00 | K252: 210
A253: CANADA | B253: WEST | C253: CONSUMER | D253: FURNITURE | E253: SOFA | F253: 4 | G253: Dec | H253: 1993 | I253: 228.00 | J253: 320.00 | K253: 92
A254: CANADA | B254: WEST | C254: CONSUMER | D254: FURNITURE | E254: BED | F254: 1 | G254: Jan | H254: 1993 | I254: 570.00 | J254: 141.00 | K254: -429
A255: CANADA | B255: WEST | C255: CONSUMER | D255: FURNITURE | E255: BED | F255: 1 | G255: Feb | H255: 1993 | I255: 375.00 | J255: 64.00 | K255: -311
A256: CANADA | B256: WEST | C256: CONSUMER | D256: FURNITURE | E256: BED | F256: 1 | G256: Mar | H256: 1993 | I256: 298.00 | J256: 207.00 | K256: -91
A257: CANADA | B257: WEST | C257: CONSUMER | D257: FURNITURE | E257: BED | F257: 2 | G257: Apr | H257: 1993 | I257: 32.00 | J257: 435.00 | K257: 403
A258: CANADA | B258: WEST | C258: CONSUMER | D258: FURNITURE | E258: BED | F258: 2 | G258: May | H258: 1993 | I258: 760.00 | J258: 96.00 | K258: -664
A259: CANADA | B259: WEST | C259: CONSUMER | D259: FURNITURE | E259: BED | F259: 2 | G259: Jun | H259: 1993 | I259: 338.00 | J259: 252.00 | K259: -86
A260: CANADA | B260: WEST | C260: CONSUMER | D260: FURNITURE | E260: BED | F260: 3 | G260: Jul | H260: 1993 | I260: 149.00 | J260: 956.00 | K260: 807
A261: CANADA | B261: WEST | C261: CONSUMER | D261: FURNITURE | E261: BED | F261: 3 | G261: Aug | H261: 1993 | I261: 343.00 | J261: 633.00 | K261: 290
A262: CANADA | B262: WEST | C262: CONSUMER | D262: FURNITURE | E262: BED | F262: 3 | G262: Sep | H262: 1993 | I262: 151.00 | J262: 190.00 | K262: 39
A263: CANADA | B263: WEST | C263: CONSUMER | D263: FURNITURE | E263: BED | F263: 4 | G263: Oct | H263: 1993 | I263: 44.00 | J263: 227.00 | K263: 183
A264: CANADA | B264: WEST | C264: CONSUMER | D264: FURNITURE | E264: BED | F264: 4 | G264: Nov | H264: 1993 | I264: 583.00 | J264: 24.00 | K264: -559
A265: CANADA | B265: WEST | C265: CONSUMER | D265: FURNITURE | E265: BED | F265: 4 | G265: Dec | H265: 1993 | I265: 230.00 | J265: 420.00 | K265: 190
A266: CANADA | B266: WEST | C266: CONSUMER | D266: OFFICE | E266: TABLE | F266: 1 | G266: Jan | H266: 1993 | I266: 133.00 | J266: 795.00 | K266: 662
A267: CANADA | B267: WEST | C267: CONSUMER | D267: OFFICE | E267: TABLE | F267: 1 | G267: Feb | H267: 1993 | I267: 273.00 | J267: 301.00 | K267: 28
A268: CANADA | B268: WEST | C268: CONSUMER | D268: OFFICE | E268: TABLE | F268: 1 | G268: Mar | H268: 1993 | I268: 86.00 | J268: 304.00 | K268: 218
A269: CANADA | B269: WEST | C269: CONSUMER | D269: OFFICE | E269: TABLE | F269: 2 | G269: Apr | H269: 1993 | I269: 400.00 | J269: 49.00 | K269: -351
A270: CANADA | B270: WEST | C270: CONSUMER | D270: OFFICE | E270: TABLE | F270: 2 | G270: May | H270: 1993 | I270: 364.00 | J270: 576.00 | K270: 212
A271: CANADA | B271: WEST | C271: CONSUMER | D271: OFFICE | E271: TABLE | F271: 2 | G271: Jun | H271: 1993 | I271: 63.00 | J271: 669.00 | K271: 606
A272: CANADA | B272: WEST | C272: CONSUMER | D272: OFFICE | E272: TABLE | F272: 3 | G272: Jul | H272: 1993 | I272: 929.00 | J272: 325.00 | K272: -604
A273: CANADA | B273: WEST | C273: CONSUMER | D273: OFFICE | E273: TABLE | F273: 3 | G273: Aug | H273: 1993 | I273: 344.00 | J273: 272.00 | K273: -72
A274: CANADA | B274: WEST | C274: CONSUMER | D274: OFFICE | E274: TABLE | F274: 3 | G274: Sep | H274: 1993 | I274: 768.00 | J274: 80.00 | K274: -688
A275: CANADA | B275: WEST | C275: CONSUMER | D275: OFFICE | E275: TABLE | F275: 4 | G275: Oct | H275: 1993 | I275: 668.00 | J275: 46.00 | K275: -622
A276: CANADA | B276: WEST | C276: CONSUMER | D276: OFFICE | E276: TABLE | F276: 4 | G276: Nov | H276: 1993 | I276: 407.00 | J276: 223.00 | K276: -184
A277: CANADA | B277: WEST | C277: CONSUMER | D277: OFFICE | E277: TABLE | F277: 4 | G277: Dec | H277: 1993 | I277: 536.00 | J277: 774.00 | K277: 238
A278: CANADA | B278: WEST | C278: CONSUMER | D278: OFFICE | E278: CHAIR | F278: 1 | G278: Jan | H278: 1993 | I278: 445.00 | J278: 292.00 | K278: -153
A279: CANADA | B279: WEST | C279: CONSUMER | D279: OFFICE | E279: CHAIR | F279: 1 | G279: Feb | H279: 1993 | I279: 632.00 | J279: 540.00 | K279: -92
A280: CANADA | B280: WEST | C280: CONSUMER | D280: OFFICE | E280: CHAIR | F280: 1 | G280: Mar | H280: 1993 | I280: 855.00 | J280: 21.00 | K280: -834
A281: CANADA | B281: WEST | C281: CONSUMER | D281: OFFICE | E281: CHAIR | F281: 2 | G281: Apr | H281: 1993 | I281: 36.00 | J281: 100.00 | K281: 64
A282: CANADA | B282: WEST | C282: CONSUMER | D282: OFFICE | E282: CHAIR | F282: 2 | G282: May | H282: 1993 | I282: 250.00 | J282: 49.00 | K282: -201
A283: CANADA | B283: WEST | C283: CONSUMER | D283: OFFICE | E283: CHAIR | F283: 2 | G283: Jun | H283: 1993 | I283: 427.00 | J283: 353.00 | K283: -74
A284: CANADA | B284: WEST | C284: CONSUMER | D284: OFFICE | E284: CHAIR | F284: 3 | G284: Jul | H284: 1993 | I284: 367.00 | J284: 911.00 | K284: 544
A285: CANADA | B285: WEST | C285: CONSUMER | D285: OFFICE | E285: CHAIR | F285: 3 | G285: Aug | H285: 1993 | I285: 245.00 | J285: 823.00 | K285: 578
A286: CANADA | B286: WEST | C286: CONSUMER | D286: OFFICE | E286: CHAIR | F286: 3 | G286: Sep | H286: 1993 | I286: 893.00 | J286: 278.00 | K286: -615
A287: CANADA | B287: WEST | C287: CONSUMER | D287: OFFICE | E287: CHAIR | F287: 4 | G287: Oct | H287: 1993 | I287: 490.00 | J287: 576.00 | K287: 86
A288: CANADA | B288: WEST | C288: CONSUMER | D288: OFFICE | E288: CHAIR | F288: 4 | G288: Nov | H288: 1993 | I288: 88.00 | J288: 655.00 | K288: 567
A289: CANADA | B289: WEST | C289: CONSUMER | D289: OFFICE | E289: CHAIR | F289: 4 | G289: Dec | H289: 1993 | I289: 964.00 | J289: 763.00 | K289: -201
A290: CANADA | B290: WEST | C290: CONSUMER | D290: OFFICE | E290: DESK | F290: 1 | G290: Jan | H290: 1993 | I290: 873.00 | J290: 693.00 | K290: -180
A291: CANADA | B291: WEST | C291: CONSUMER | D291: OFFICE | E291: DESK | F291: 1 | G291: Feb | H291: 1993 | I291: 459.00 | J291: 903.00 | K291: 444
A292: CANADA | B292: WEST | C292: CONSUMER | D292: OFFICE | E292: DESK | F292: 1 | G292: Mar | H292: 1993 | I292: 224.00 | J292: 791.00 | K292: 567
A293: CANADA | B293: WEST | C293: CONSUMER | D293: OFFICE | E293: DESK | F293: 2 | G293: Apr | H293: 1993 | I293: 562.00 | J293: 108.00 | K293: -454
A294: CANADA | B294: WEST | C294: CONSUMER | D294: OFFICE | E294: DESK | F294: 2 | G294: May | H294: 1993 | I294: 199.00 | J294: 845.00 | K294: 646
A295: CANADA | B295: WEST | C295: CONSUMER | D295: OFFICE | E295: DESK | F295: 2 | G295: Jun | H295: 1993 | I295: 275.00 | J295: 452.00 | K295: 177
A296: CANADA | B296: WEST | C296: CONSUMER | D296: OFFICE | E296: DESK | F296: 3 | G296: Jul | H296: 1993 | I296: 355.00 | J296: 479.00 | K296: 124
A297: CANADA | B297: WEST | C297: CONSUMER | D297: OFFICE | E297: DESK | F297: 3 | G297: Aug | H297: 1993 | I297: 947.00 | J297: 410.00 | K297: -537
A298: CANADA | B298: WEST | C298: CONSUMER | D298: OFFICE | E298: DESK | F298: 3 | G298: Sep | H298: 1993 | I298: 454.00 | J298: 379.00 | K298: -75
A299: CANADA | B299: WEST | C299: CONSUMER | D299: OFFICE | E299: DESK | F299: 4 | G299: Oct | H299: 1993 | I299: 450.00 | J299: 740.00 | K299: 290
A300: CANADA | B300: WEST | C300: CONSUMER | D300: OFFICE | E300: DESK | F300: 4 | G300: Nov | H300: 1993 | I300: 575.00 | J300: 471.00 | K300: -104
A301: CANADA | B301: WEST | C301: CONSUMER | D301: OFFICE | E301: DESK | F301: 4 | G301: Dec | H301: 1993 | I301: 6.00 | J301: 325.00 | K301: 319
A302: CANADA | B302: WEST | C302: CONSUMER | D302: FURNITURE | E302: SOFA | F302: 1 | G302: Jan | H302: 1994 | I302: 1000.00 | J302: 845.00 | K302: -155
A303: CANADA | B303: WEST | C303: CONSUMER | D303: FURNITURE | E303: SOFA | F303: 1 | G303: Feb | H303: 1994 | I303: 21.00 | J303: 245.00 | K303: 224
A304: CANADA | B304: WEST | C304: CONSUMER | D304: FURNITURE | E304: SOFA | F304: 1 | G304: Mar | H304: 1994 | I304: 583.00 | J304: 142.00 | K304: -441
A305: CANADA | B305: WEST | C305: CONSUMER | D305: FURNITURE | E305: SOFA | F305: 2 | G305: Apr | H305: 1994 | I305: 506.00 | J305: 717.00 | K305: 211
A306: CANADA | B306: WEST | C306: CONSUMER | D306: FURNITURE | E306: SOFA | F306: 2 | G306: May | H306: 1994 | I306: 405.00 | J306: 3.00 | K306: -402
A307: CANADA | B307: WEST | C307: CONSUMER | D307: FURNITURE | E307: SOFA | F307: 2 | G307: Jun | H307: 1994 | I307: 556.00 | J307: 790.00 | K307: 234
A308: CANADA | B308: WEST | C308: CONSUMER | D308: FURNITURE | E308: SOFA | F308: 3 | G308: Jul | H308: 1994 | I308: 72.00 | J308: 646.00 | K308: 574
A309: CANADA | B309: WEST | C309: CONSUMER | D309: FURNITURE | E309: SOFA | F309: 3 | G309: Aug | H309: 1994 | I309: 103.00 | J309: 230.00 | K309: 127
A310: CANADA | B310: WEST | C310: CONSUMER | D310: FURNITURE | E310: SOFA | F310: 3 | G310: Sep | H310: 1994 | I310: 262.00 | J310: 938.00 | K310: 676
A311: CANADA | B311: WEST | C311: CONSUMER | D311: FURNITURE | E311: SOFA | F311: 4 | G311: Oct | H311: 1994 | I311: 102.00 | J311: 629.00 | K311: 527
A312: CANADA | B312: WEST | C312: CONSUMER | D312: FURNITURE | E312: SOFA | F312: 4 | G312: Nov | H312: 1994 | I312: 841.00 | J312: 317.00 | K312: -524
A313: CANADA | B313: WEST | C313: CONSUMER | D313: FURNITURE | E313: SOFA | F313: 4 | G313: Dec | H313: 1994 | I313: 159.00 | J313: 812.00 | K313: 653
A314: CANADA | B314: WEST | C314: CONSUMER | D314: FURNITURE | E314: BED | F314: 1 | G314: Jan | H314: 1994 | I314: 907.00 | J314: 910.00 | K314: 3
A315: CANADA | B315: WEST | C315: CONSUMER | D315: FURNITURE | E315: BED | F315: 1 | G315: Feb | H315: 1994 | I315: 783.00 | J315: 709.00 | K315: -74
A316: CANADA | B316: WEST | C316: CONSUMER | D316: FURNITURE | E316: BED | F316: 1 | G316: Mar | H316: 1994 | I316: 117.00 | J316: 810.00 | K316: 693
A317: CANADA | B317: WEST | C317: CONSUMER | D317: FURNITURE | E317: BED | F317: 2 | G317: Apr | H317: 1994 | I317: 416.00 | J317: 723.00 | K317: 307
A318: CANADA | B318: WEST | C318: CONSUMER | D318: FURNITURE | E318: BED | F318: 2 | G318: May | H318: 1994 | I318: 318.00 | J318: 911.00 | K318: 593
A319: CANADA | B319: WEST | C319: CONSUMER | D319: FURNITURE | E319: BED | F319: 2 | G319: Jun | H319: 1994 | I319: 888.00 | J319: 230.00 | K319: -658
A320: CANADA | B320: WEST | C320: CONSUMER | D320: FURNITURE | E320: BED | F320: 3 | G320: Jul | H320: 1994 | I320: 60.00 | J320: 448.00 | K320: 388
A321: CANADA | B321: WEST | C321: CONSUMER | D321: FURNITURE | E321: BED | F321: 3 | G321: Aug | H321: 1994 | I321: 596.00 | J321: 945.00 | K321: 349
A322: CANADA | B322: WEST | C322: CONSUMER | D322: FURNITURE | E322: BED | F322: 3 | G322: Sep | H322: 1994 | I322: 576.00 | J322: 508.00 | K322: -68
A323: CANADA | B323: WEST | C323: CONSUMER | D323: FURNITURE | E323: BED | F323: 4 | G323: Oct | H323: 1994 | I323: 576.00 | J323: 262.00 | K323: -314
A324: CANADA | B324: WEST | C324: CONSUMER | D324: FURNITURE | E324: BED | F324: 4 | G324: Nov | H324: 1994 | I324: 280.00 | J324: 441.00 | K324: 161
A325: CANADA | B325: WEST | C325: CONSUMER | D325: FURNITURE | E325: BED | F325: 4 | G325: Dec | H325: 1994 | I325: 219.00 | J325: 15.00 | K325: -204
A326: CANADA | B326: WEST | C326: CONSUMER | D326: OFFICE | E326: TABLE | F326: 1 | G326: Jan | H326: 1994 | I326: 657.00 | J326: 784.00 | K326: 127
A327: CANADA | B327: WEST | C327: CONSUMER | D327: OFFICE | E327: TABLE | F327: 1 | G327: Feb | H327: 1994 | I327: 215.00 | J327: 92.00 | K327: -123
A328: CANADA | B328: WEST | C328: CONSUMER | D328: OFFICE | E328: TABLE | F328: 1 | G328: Mar | H328: 1994 | I328: 966.00 | J328: 67.00 | K328: -899
A329: CANADA | B329: WEST | C329: CONSUMER | D329: OFFICE | E329: TABLE | F329: 2 | G329: Apr | H329: 1994 | I329: 674.00 | J329: 747.00 | K329: 73
A330: CANADA | B330: WEST | C330: CONSUMER | D330: OFFICE | E330: TABLE | F330: 2 | G330: May | H330: 1994 | I330: 574.00 | J330: 686.00 | K330: 112
A331: CANADA | B331: WEST | C331: CONSUMER | D331: OFFICE | E331: TABLE | F331: 2 | G331: Jun | H331: 1994 | I331: 266.00 | J331: 93.00 | K331: -173
A332: CANADA | B332: WEST | C332: CONSUMER | D332: OFFICE | E332: TABLE | F332: 3 | G332: Jul | H332: 1994 | I332: 680.00 | J332: 192.00 | K332: -488
A333: CANADA | B333: WEST | C333: CONSUMER | D333: OFFICE | E333: TABLE | F333: 3 | G333: Aug | H333: 1994 | I333: 362.00 | J333: 51.00 | K333: -311
A334: CANADA | B334: WEST | C334: CONSUMER | D334: OFFICE | E334: TABLE | F334: 3 | G334: Sep | H334: 1994 | I334: 412.00 | J334: 498.00 | K334: 86
A335: CANADA | B335: WEST | C335: CONSUMER | D335: OFFICE | E335: TABLE | F335: 4 | G335: Oct | H335: 1994 | I335: 431.00 | J335: 546.00 | K335: 115
A336: CANADA | B336: WEST | C336: CONSUMER | D336: OFFICE | E336: TABLE | F336: 4 | G336: Nov | H336: 1994 | I336: 94.00 | J336: 485.00 | K336: 391
A337: CANADA | B337: WEST | C337: CONSUMER | D337: OFFICE | E337: TABLE | F337: 4 | G337: Dec | H337: 1994 | I337: 345.00 | J337: 925.00 | K337: 580
A338: CANADA | B338: WEST | C338: CONSUMER | D338: OFFICE | E338: CHAIR | F338: 1 | G338: Jan | H338: 1994 | I338: 62.00 | J338: 88.00 | K338: 26
A339: CANADA | B339: WEST | C339: CONSUMER | D339: OFFICE | E339: CHAIR | F339: 1 | G339: Feb | H339: 1994 | I339: 506.00 | J339: 746.00 | K339: 240
A340: CANADA | B340: WEST | C340: CONSUMER | D340: OFFICE | E340: CHAIR | F340: 1 | G340: Mar | H340: 1994 | I340: 680.00 | J340: 927.00 | K340: 247
A341: CANADA | B341: WEST | C341: CONSUMER | D341: OFFICE | E341: CHAIR | F341: 2 | G341: Apr | H341: 1994 | I341: 153.00 | J341: 297.00 | K341: 144
A342: CANADA | B342: WEST | C342: CONSUMER | D342: OFFICE | E342: CHAIR | F342: 2 | G342: May | H342: 1994 | I342: 403.00 | J342: 291.00 | K342: -112
A343: CANADA | B343: WEST | C343: CONSUMER | D343: OFFICE | E343: CHAIR | F343: 2 | G343: Jun | H343: 1994 | I343: 98.00 | J343: 838.00 | K343: 740
A344: CANADA | B344: WEST | C344: CONSUMER | D344: OFFICE | E344: CHAIR | F344: 3 | G344: Jul | H344: 1994 | I344: 376.00 | J344: 112.00 | K344: -264
A345: CANADA | B345: WEST | C345: CONSUMER | D345: OFFICE | E345: CHAIR | F345: 3 | G345: Aug | H345: 1994 | I345: 477.00 | J345: 509.00 | K345: 32
A346: CANADA | B346: WEST | C346: CONSUMER | D346: OFFICE | E346: CHAIR | F346: 3 | G346: Sep | H346: 1994 | I346: 50.00 | J346: 472.00 | K346: 422
A347: CANADA | B347: WEST | C347: CONSUMER | D347: OFFICE | E347: CHAIR | F347: 4 | G347: Oct | H347: 1994 | I347: 592.00 | J347: 495.00 | K347: -97
A348: CANADA | B348: WEST | C348: CONSUMER | D348: OFFICE | E348: CHAIR | F348: 4 | G348: Nov | H348: 1994 | I348: 813.00 | J348: 1000.00 | K348: 187
A349: CANADA | B349: WEST | C349: CONSUMER | D349: OFFICE | E349: CHAIR | F349: 4 | G349: Dec | H349: 1994 | I349: 740.00 | J349: 241.00 | K349: -499
A350: CANADA | B350: WEST | C350: CONSUMER | D350: OFFICE | E350: DESK | F350: 1 | G350: Jan | H350: 1994 | I350: 847.00 | J350: 455.00 | K350: -392
A351: CANADA | B351: WEST | C351: CONSUMER | D351: OFFICE | E351: DESK | F351: 1 | G351: Feb | H351: 1994 | I351: 338.00 | J351: 563.00 | K351: 225
A352: CANADA | B352: WEST | C352: CONSUMER | D352: OFFICE | E352: DESK | F352: 1 | G352: Mar | H352: 1994 | I352: 517.00 | J352: 879.00 | K352: 362
A353: CANADA | B353: WEST | C353: CONSUMER | D353: OFFICE | E353: DESK | F353: 2 | G353: Apr | H353: 1994 | I353: 630.00 | J353: 312.00 | K353: -318
A354: CANADA | B354: WEST | C354: CONSUMER | D354: OFFICE | E354: DESK | F354: 2 | G354: May | H354: 1994 | I354: 381.00 | J354: 587.00 | K354: 206
A355: CANADA | B355: WEST | C355: CONSUMER | D355: OFFICE | E355: DESK | F355: 2 | G355: Jun | H355: 1994 | I355: 864.00 | J355: 628.00 | K355: -236
A356: CANADA | B356: WEST | C356: CONSUMER | D356: OFFICE | E356: DESK | F356: 3 | G356: Jul | H356: 1994 | I356: 416.00 | J356: 486.00 | K356: 70
A357: CANADA | B357: WEST | C357: CONSUMER | D357: OFFICE | E357: DESK | F357: 3 | G357: Aug | H357: 1994 | I357: 852.00 | J357: 811.00 | K357: -41
A358: CANADA | B358: WEST | C358: CONSUMER | D358: OFFICE | E358: DESK | F358: 3 | G358: Sep | H358: 1994 | I358: 815.00 | J358: 990.00 | K358: 175
A359: CANADA | B359: WEST | C359: CONSUMER | D359: OFFICE | E359: DESK | F359: 4 | G359: Oct | H359: 1994 | I359: 23.00 | J359: 35.00 | K359: 12
A360: CANADA | B360: WEST | C360: CONSUMER | D360: OFFICE | E360: DESK | F360: 4 | G360: Nov | H360: 1994 | I360: 527.00 | J360: 764.00 | K360: 237
A361: CANADA | B361: WEST | C361: CONSUMER | D361: OFFICE | E361: DESK | F361: 4 | G361: Dec | H361: 1994 | I361: 693.00 | J361: 619.00 | K361: -74
A362: CANADA | B362: WEST | C362: EDUCATION | D362: FURNITURE | E362: SOFA | F362: 1 | G362: Jan | H362: 1993 | I362: 421.00 | J362: 72.00 | K362: -349
A363: CANADA | B363: WEST | C363: EDUCATION | D363: FURNITURE | E363: SOFA | F363: 1 | G363: Feb | H363: 1993 | I363: 433.00 | J363: 926.00 | K363: 493
A364: CANADA | B364: WEST | C364: EDUCATION | D364: FURNITURE | E364: SOFA | F364: 1 | G364: Mar | H364: 1993 | I364: 394.00 | J364: 850.00 | K364: 456
A365: CANADA | B365: WEST | C365: EDUCATION | D365: FURNITURE | E365: SOFA | F365: 2 | G365: Apr | H365: 1993 | I365: 338.00 | J365: 826.00 | K365: 488
A366: CANADA | B366: WEST | C366: EDUCATION | D366: FURNITURE | E366: SOFA | F366: 2 | G366: May | H366: 1993 | I366: 764.00 | J366: 651.00 | K366: -113
A367: CANADA | B367: WEST | C367: EDUCATION | D367: FURNITURE | E367: SOFA | F367: 2 | G367: Jun | H367: 1993 | I367: 216.00 | J367: 854.00 | K367: 638
A368: CANADA | B368: WEST | C368: EDUCATION | D368: FURNITURE | E368: SOFA | F368: 3 | G368: Jul | H368: 1993 | I368: 96.00 | J368: 899.00 | K368: 803
A369: CANADA | B369: WEST | C369: EDUCATION | D369: FURNITURE | E369: SOFA | F369: 3 | G369: Aug | H369: 1993 | I369: 550.00 | J369: 309.00 | K369: -241
A370: CANADA | B370: WEST | C370: EDUCATION | D370: FURNITURE | E370: SOFA | F370: 3 | G370: Sep | H370: 1993 | I370: 636.00 | J370: 943.00 | K370: 307
A371: CANADA | B371: WEST | C371: EDUCATION | D371: FURNITURE | E371: SOFA | F371: 4 | G371: Oct | H371: 1993 | I371: 427.00 | J371: 138.00 | K371: -289
A372: CANADA | B372: WEST | C372: EDUCATION | D372: FURNITURE | E372: SOFA | F372: 4 | G372: Nov | H372: 1993 | I372: 652.00 | J372: 99.00 | K372: -553
A373: CANADA | B373: WEST | C373: EDUCATION | D373: FURNITURE | E373: SOFA | F373: 4 | G373: Dec | H373: 1993 | I373: 478.00 | J373: 270.00 | K373: -208
A374: CANADA | B374: WEST | C374: EDUCATION | D374: FURNITURE | E374: BED | F374: 1 | G374: Jan | H374: 1993 | I374: 305.00 | J374: 211.00 | K374: -94
A375: CANADA | B375: WEST | C375: EDUCATION | D375: FURNITURE | E375: BED | F375: 1 | G375: Feb | H375: 1993 | I375: 318.00 | J375: 368.00 | K375: 50
A376: CANADA | B376: WEST | C376: EDUCATION | D376: FURNITURE | E376: BED | F376: 1 | G376: Mar | H376: 1993 | I376: 417.00 | J376: 778.00 | K376: 361
A377: CANADA | B377: WEST | C377: EDUCATION | D377: FURNITURE | E377: BED | F377: 2 | G377: Apr | H377: 1993 | I377: 623.00 | J377: 808.00 | K377: 185
A378: CANADA | B378: WEST | C378: EDUCATION | D378: FURNITURE | E378: BED | F378: 2 | G378: May | H378: 1993 | I378: 761.00 | J378: 46.00 | K378: -715
A379: CANADA | B379: WEST | C379: EDUCATION | D379: FURNITURE | E379: BED | F379: 2 | G379: Jun | H379: 1993 | I379: 272.00 | J379: 466.00 | K379: 194
A380: CANADA | B380: WEST | C380: EDUCATION | D380: FURNITURE | E380: BED | F380: 3 | G380: Jul | H380: 1993 | I380: 988.00 | J380: 18.00 | K380: -970
A381: CANADA | B381: WEST | C381: EDUCATION | D381: FURNITURE | E381: BED | F381: 3 | G381: Aug | H381: 1993 | I381: 821.00 | J381: 87.00 | K381: -734
A382: CANADA | B382: WEST | C382: EDUCATION | D382: FURNITURE | E382: BED | F382: 3 | G382: Sep | H382: 1993 | I382: 962.00 | J382: 765.00 | K382: -197
A383: CANADA | B383: WEST | C383: EDUCATION | D383: FURNITURE | E383: BED | F383: 4 | G383: Oct | H383: 1993 | I383: 615.00 | J383: 62.00 | K383: -553
A384: CANADA | B384: WEST | C384: EDUCATION | D384: FURNITURE | E384: BED | F384: 4 | G384: Nov | H384: 1993 | I384: 523.00 | J384: 13.00 | K384: -510
A385: CANADA | B385: WEST | C385: EDUCATION | D385: FURNITURE | E385: BED | F385: 4 | G385: Dec | H385: 1993 | I385: 806.00 | J385: 775.00 | K385: -31
A386: CANADA | B386: WEST | C386: EDUCATION | D386: OFFICE | E386: TABLE | F386: 1 | G386: Jan | H386: 1993 | I386: 925.00 | J386: 155.00 | K386: -770
A387: CANADA | B387: WEST | C387: EDUCATION | D387: OFFICE | E387: TABLE | F387: 1 | G387: Feb | H387: 1993 | I387: 395.00 | J387: 688.00 | K387: 293
A388: CANADA | B388: WEST | C388: EDUCATION | D388: OFFICE | E388: TABLE | F388: 1 | G388: Mar | H388: 1993 | I388: 749.00 | J388: 730.00 | K388: -19
A389: CANADA | B389: WEST | C389: EDUCATION | D389: OFFICE | E389: TABLE | F389: 2 | G389: Apr | H389: 1993 | I389: 279.00 | J389: 208.00 | K389: -71
A390: CANADA | B390: WEST | C390: EDUCATION | D390: OFFICE | E390: TABLE | F390: 2 | G390: May | H390: 1993 | I390: 288.00 | J390: 525.00 | K390: 237
A391: CANADA | B391: WEST | C391: EDUCATION | D391: OFFICE | E391: TABLE | F391: 2 | G391: Jun | H391: 1993 | I391: 509.00 | J391: 483.00 | K391: -26
A392: CANADA | B392: WEST | C392: EDUCATION | D392: OFFICE | E392: TABLE | F392: 3 | G392: Jul | H392: 1993 | I392: 255.00 | J392: 748.00 | K392: 493
A393: CANADA | B393: WEST | C393: EDUCATION | D393: OFFICE | E393: TABLE | F393: 3 | G393: Aug | H393: 1993 | I393: 214.00 | J393: 6.00 | K393: -208
A394: CANADA | B394: WEST | C394: EDUCATION | D394: OFFICE | E394: TABLE | F394: 3 | G394: Sep | H394: 1993 | I394: 473.00 | J394: 168.00 | K394: -305
A395: CANADA | B395: WEST | C395: EDUCATION | D395: OFFICE | E395: TABLE | F395: 4 | G395: Oct | H395: 1993 | I395: 702.00 | J395: 301.00 | K395: -401
A396: CANADA | B396: WEST | C396: EDUCATION | D396: OFFICE | E396: TABLE | F396: 4 | G396: Nov | H396: 1993 | I396: 814.00 | J396: 9.00 | K396: -805
A397: CANADA | B397: WEST | C397: EDUCATION | D397: OFFICE | E397: TABLE | F397: 4 | G397: Dec | H397: 1993 | I397: 231.00 | J397: 778.00 | K397: 547
A398: CANADA | B398: WEST | C398: EDUCATION | D398: OFFICE | E398: CHAIR | F398: 1 | G398: Jan | H398: 1993 | I398: 555.00 | J398: 251.00 | K398: -304
A399: CANADA | B399: WEST | C399: EDUCATION | D399: OFFICE | E399: CHAIR | F399: 1 | G399: Feb | H399: 1993 | I399: 455.00 | J399: 607.00 | K399: 152
A400: CANADA | B400: WEST | C400: EDUCATION | D400: OFFICE | E400: CHAIR | F400: 1 | G400: Mar | H400: 1993 | I400: 888.00 | J400: 127.00 | K400: -761
A401: CANADA | B401: WEST | C401: EDUCATION | D401: OFFICE | E401: CHAIR | F401: 2 | G401: Apr | H401: 1993 | I401: 652.00 | J401: 513.00 | K401: -139
A402: CANADA | B402: WEST | C402: EDUCATION | D402: OFFICE | E402: CHAIR | F402: 2 | G402: May | H402: 1993 | I402: 799.00 | J402: 146.00 | K402: -653
A403: CANADA | B403: WEST | C403: EDUCATION | D403: OFFICE | E403: CHAIR | F403: 2 | G403: Jun | H403: 1993 | I403: 249.00 | J403: 917.00 | K403: 668
A404: CANADA | B404: WEST | C404: EDUCATION | D404: OFFICE | E404: CHAIR | F404: 3 | G404: Jul | H404: 1993 | I404: 539.00 | J404: 776.00 | K404: 237
A405: CANADA | B405: WEST | C405: EDUCATION | D405: OFFICE | E405: CHAIR | F405: 3 | G405: Aug | H405: 1993 | I405: 198.00 | J405: 330.00 | K405: 132
A406: CANADA | B406: WEST | C406: EDUCATION | D406: OFFICE | E406: CHAIR | F406: 3 | G406: Sep | H406: 1993 | I406: 340.00 | J406: 981.00 | K406: 641
A407: CANADA | B407: WEST | C407: EDUCATION | D407: OFFICE | E407: CHAIR | F407: 4 | G407: Oct | H407: 1993 | I407: 152.00 | J407: 862.00 | K407: 710
A408: CANADA | B408: WEST | C408: EDUCATION | D408: OFFICE | E408: CHAIR | F408: 4 | G408: Nov | H408: 1993 | I408: 347.00 | J408: 612.00 | K408: 265
A409: CANADA | B409: WEST | C409: EDUCATION | D409: OFFICE | E409: CHAIR | F409: 4 | G409: Dec | H409: 1993 | I409: 565.00 | J409: 607.00 | K409: 42
A410: CANADA | B410: WEST | C410: EDUCATION | D410: OFFICE | E410: DESK | F410: 1 | G410: Jan | H410: 1993 | I410: 363.00 | J410: 586.00 | K410: 223
A411: CANADA | B411: WEST | C411: EDUCATION | D411: OFFICE | E411: DESK | F411: 1 | G411: Feb | H411: 1993 | I411: 910.00 | J411: 441.00 | K411: -469
A412: CANADA | B412: WEST | C412: EDUCATION | D412: OFFICE | E412: DESK | F412: 1 | G412: Mar | H412: 1993 | I412: 998.00 | J412: 597.00 | K412: -401
A413: CANADA | B413: WEST | C413: EDUCATION | D413: OFFICE | E413: DESK | F413: 2 | G413: Apr | H413: 1993 | I413: 95.00 | J413: 717.00 | K413: 622
A414: CANADA | B414: WEST | C414: EDUCATION | D414: OFFICE | E414: DESK | F414: 2 | G414: May | H414: 1993 | I414: 731.00 | J414: 713.00 | K414: -18
A415: CANADA | B415: WEST | C415: EDUCATION | D415: OFFICE | E415: DESK | F415: 2 | G415: Jun | H415: 1993 | I415: 718.00 | J415: 591.00 | K415: -127
A416: CANADA | B416: WEST | C416: EDUCATION | D416: OFFICE | E416: DESK | F416: 3 | G416: Jul | H416: 1993 | I416: 467.00 | J416: 492.00 | K416: 25
A417: CANADA | B417: WEST | C417: EDUCATION | D417: OFFICE | E417: DESK | F417: 3 | G417: Aug | H417: 1993 | I417: 126.00 | J417: 170.00 | K417: 44
A418: CANADA | B418: WEST | C418: EDUCATION | D418: OFFICE | E418: DESK | F418: 3 | G418: Sep | H418: 1993 | I418: 127.00 | J418: 684.00 | K418: 557
A419: CANADA | B419: WEST | C419: EDUCATION | D419: OFFICE | E419: DESK | F419: 4 | G419: Oct | H419: 1993 | I419: 746.00 | J419: 981.00 | K419: 235
A420: CANADA | B420: WEST | C420: EDUCATION | D420: OFFICE | E420: DESK | F420: 4 | G420: Nov | H420: 1993 | I420: 878.00 | J420: 966.00 | K420: 88
A421: CANADA | B421: WEST | C421: EDUCATION | D421: OFFICE | E421: DESK | F421: 4 | G421: Dec | H421: 1993 | I421: 27.00 | J421: 439.00 | K421: 412
A422: CANADA | B422: WEST | C422: EDUCATION | D422: FURNITURE | E422: SOFA | F422: 1 | G422: Jan | H422: 1994 | I422: 18.00 | J422: 862.00 | K422: 844
A423: CANADA | B423: WEST | C423: EDUCATION | D423: FURNITURE | E423: SOFA | F423: 1 | G423: Feb | H423: 1994 | I423: 40.00 | J423: 574.00 | K423: 534
A424: CANADA | B424: WEST | C424: EDUCATION | D424: FURNITURE | E424: SOFA | F424: 1 | G424: Mar | H424: 1994 | I424: 453.00 | J424: 359.00 | K424: -94
A425: CANADA | B425: WEST | C425: EDUCATION | D425: FURNITURE | E425: SOFA | F425: 2 | G425: Apr | H425: 1994 | I425: 987.00 | J425: 958.00 | K425: -29
A426: CANADA | B426: WEST | C426: EDUCATION | D426: FURNITURE | E426: SOFA | F426: 2 | G426: May | H426: 1994 | I426: 26.00 | J426: 791.00 | K426: 765
A427: CANADA | B427: WEST | C427: EDUCATION | D427: FURNITURE | E427: SOFA | F427: 2 | G427: Jun | H427: 1994 | I427: 101.00 | J427: 284.00 | K427: 183
A428: CANADA | B428: WEST | C428: EDUCATION | D428: FURNITURE | E428: SOFA | F428: 3 | G428: Jul | H428: 1994 | I428: 969.00 | J428: 190.00 | K428: -779
A429: CANADA | B429: WEST | C429: EDUCATION | D429: FURNITURE | E429: SOFA | F429: 3 | G429: Aug | H429: 1994 | I429: 492.00 | J429: 527.00 | K429: 35
A430: CANADA | B430: WEST | C430: EDUCATION | D430: FURNITURE | E430: SOFA | F430: 3 | G430: Sep | H430: 1994 | I430: 263.00 | J430: 112.00 | K430: -151
A431: CANADA | B431: WEST | C431: EDUCATION | D431: FURNITURE | E431: SOFA | F431: 4 | G431: Oct | H431: 1994 | I431: 593.00 | J431: 271.00 | K431: -322
A432: CANADA | B432: WEST | C432: EDUCATION | D432: FURNITURE | E432: SOFA | F432: 4 | G432: Nov | H432: 1994 | I432: 923.00 | J432: 643.00 | K432: -280
A433: CANADA | B433: WEST | C433: EDUCATION | D433: FURNITURE | E433: SOFA | F433: 4 | G433: Dec | H433: 1994 | I433: 146.00 | J433: 554.00 | K433: 408
A434: CANADA | B434: WEST | C434: EDUCATION | D434: FURNITURE | E434: BED | F434: 1 | G434: Jan | H434: 1994 | I434: 586.00 | J434: 636.00 | K434: 50
A435: CANADA | B435: WEST | C435: EDUCATION | D435: FURNITURE | E435: BED | F435: 1 | G435: Feb | H435: 1994 | I435: 520.00 | J435: 458.00 | K435: -62
A436: CANADA | B436: WEST | C436: EDUCATION | D436: FURNITURE | E436: BED | F436: 1 | G436: Mar | H436: 1994 | I436: 908.00 | J436: 206.00 | K436: -702
A437: CANADA | B437: WEST | C437: EDUCATION | D437: FURNITURE | E437: BED | F437: 2 | G437: Apr | H437: 1994 | I437: 30.00 | J437: 310.00 | K437: 280
A438: CANADA | B438: WEST | C438: EDUCATION | D438: FURNITURE | E438: BED | F438: 2 | G438: May | H438: 1994 | I438: 247.00 | J438: 813.00 | K438: 566
A439: CANADA | B439: WEST | C439: EDUCATION | D439: FURNITURE | E439: BED | F439: 2 | G439: Jun | H439: 1994 | I439: 647.00 | J439: 22.00 | K439: -625
A440: CANADA | B440: WEST | C440: EDUCATION | D440: FURNITURE | E440: BED | F440: 3 | G440: Jul | H440: 1994 | I440: 55.00 | J440: 742.00 | K440: 687
A441: CANADA | B441: WEST | C441: EDUCATION | D441: FURNITURE | E441: BED | F441: 3 | G441: Aug | H441: 1994 | I441: 154.00 | J441: 394.00 | K441: 240
A442: CANADA | B442: WEST | C442: EDUCATION | D442: FURNITURE | E442: BED | F442: 3 | G442: Sep | H442: 1994 | I442: 344.00 | J442: 957.00 | K442: 613
A443: CANADA | B443: WEST | C443: EDUCATION | D443: FURNITURE | E443: BED | F443: 4 | G443: Oct | H443: 1994 | I443: 95.00 | J443: 205.00 | K443: 110
A444: CANADA | B444: WEST | C444: EDUCATION | D444: FURNITURE | E444: BED | F444: 4 | G444: Nov | H444: 1994 | I444: 665.00 | J444: 198.00 | K444: -467
A445: CANADA | B445: WEST | C445: EDUCATION | D445: FURNITURE | E445: BED | F445: 4 | G445: Dec | H445: 1994 | I445: 145.00 | J445: 638.00 | K445: 493
A446: CANADA | B446: WEST | C446: EDUCATION | D446: OFFICE | E446: TABLE | F446: 1 | G446: Jan | H446: 1994 | I446: 422.00 | J446: 799.00 | K446: 377
A447: CANADA | B447: WEST | C447: EDUCATION | D447: OFFICE | E447: TABLE | F447: 1 | G447: Feb | H447: 1994 | I447: 572.00 | J447: 309.00 | K447: -263
A448: CANADA | B448: WEST | C448: EDUCATION | D448: OFFICE | E448: TABLE | F448: 1 | G448: Mar | H448: 1994 | I448: 363.00 | J448: 433.00 | K448: 70
A449: CANADA | B449: WEST | C449: EDUCATION | D449: OFFICE | E449: TABLE | F449: 2 | G449: Apr | H449: 1994 | I449: 919.00 | J449: 969.00 | K449: 50
A450: CANADA | B450: WEST | C450: EDUCATION | D450: OFFICE | E450: TABLE | F450: 2 | G450: May | H450: 1994 | I450: 355.00 | J450: 181.00 | K450: -174
A451: CANADA | B451: WEST | C451: EDUCATION | D451: OFFICE | E451: TABLE | F451: 2 | G451: Jun | H451: 1994 | I451: 992.00 | J451: 787.00 | K451: -205
A452: CANADA | B452: WEST | C452: EDUCATION | D452: OFFICE | E452: TABLE | F452: 3 | G452: Jul | H452: 1994 | I452: 147.00 | J452: 971.00 | K452: 824
A453: CANADA | B453: WEST | C453: EDUCATION | D453: OFFICE | E453: TABLE | F453: 3 | G453: Aug | H453: 1994 | I453: 183.00 | J453: 440.00 | K453: 257
A454: CANADA | B454: WEST | C454: EDUCATION | D454: OFFICE | E454: TABLE | F454: 3 | G454: Sep | H454: 1994 | I454: 375.00 | J454: 209.00 | K454: -166
A455: CANADA | B455: WEST | C455: EDUCATION | D455: OFFICE | E455: TABLE | F455: 4 | G455: Oct | H455: 1994 | I455: 77.00 | J455: 537.00 | K455: 460
A456: CANADA | B456: WEST | C456: EDUCATION | D456: OFFICE | E456: TABLE | F456: 4 | G456: Nov | H456: 1994 | I456: 308.00 | J456: 364.00 | K456: 56
A457: CANADA | B457: WEST | C457: EDUCATION | D457: OFFICE | E457: TABLE | F457: 4 | G457: Dec | H457: 1994 | I457: 660.00 | J457: 377.00 | K457: -283
A458: CANADA | B458: WEST | C458: EDUCATION | D458: OFFICE | E458: CHAIR | F458: 1 | G458: Jan | H458: 1994 | I458: 855.00 | J458: 786.00 | K458: -69
A459: CANADA | B459: WEST | C459: EDUCATION | D459: OFFICE | E459: CHAIR | F459: 1 | G459: Feb | H459: 1994 | I459: 87.00 | J459: 160.00 | K459: 73
A460: CANADA | B460: WEST | C460: EDUCATION | D460: OFFICE | E460: CHAIR | F460: 1 | G460: Mar | H460: 1994 | I460: 69.00 | J460: 199.00 | K460: 130
A461: CANADA | B461: WEST | C461: EDUCATION | D461: OFFICE | E461: CHAIR | F461: 2 | G461: Apr | H461: 1994 | I461: 807.00 | J461: 972.00 | K461: 165
A462: CANADA | B462: WEST | C462: EDUCATION | D462: OFFICE | E462: CHAIR | F462: 2 | G462: May | H462: 1994 | I462: 565.00 | J462: 870.00 | K462: 305
A463: CANADA | B463: WEST | C463: EDUCATION | D463: OFFICE | E463: CHAIR | F463: 2 | G463: Jun | H463: 1994 | I463: 798.00 | J463: 494.00 | K463: -304
A464: CANADA | B464: WEST | C464: EDUCATION | D464: OFFICE | E464: CHAIR | F464: 3 | G464: Jul | H464: 1994 | I464: 714.00 | J464: 975.00 | K464: 261
A465: CANADA | B465: WEST | C465: EDUCATION | D465: OFFICE | E465: CHAIR | F465: 3 | G465: Aug | H465: 1994 | I465: 17.00 | J465: 760.00 | K465: 743
A466: CANADA | B466: WEST | C466: EDUCATION | D466: OFFICE | E466: CHAIR | F466: 3 | G466: Sep | H466: 1994 | I466: 797.00 | J466: 180.00 | K466: -617
A467: CANADA | B467: WEST | C467: EDUCATION | D467: OFFICE | E467: CHAIR | F467: 4 | G467: Oct | H467: 1994 | I467: 422.00 | J467: 256.00 | K467: -166
A468: CANADA | B468: WEST | C468: EDUCATION | D468: OFFICE | E468: CHAIR | F468: 4 | G468: Nov | H468: 1994 | I468: 621.00 | J468: 422.00 | K468: -199
A469: CANADA | B469: WEST | C469: EDUCATION | D469: OFFICE | E469: CHAIR | F469: 4 | G469: Dec | H469: 1994 | I469: 661.00 | J469: 859.00 | K469: 198
A470: CANADA | B470: WEST | C470: EDUCATION | D470: OFFICE | E470: DESK | F470: 1 | G470: Jan | H470: 1994 | I470: 569.00 | J470: 151.00 | K470: -418
A471: CANADA | B471: WEST | C471: EDUCATION | D471: OFFICE | E471: DESK | F471: 1 | G471: Feb | H471: 1994 | I471: 812.00 | J471: 602.00 | K471: -210
A472: CANADA | B472: WEST | C472: EDUCATION | D472: OFFICE | E472: DESK | F472: 1 | G472: Mar | H472: 1994 | I472: 603.00 | J472: 187.00 | K472: -416
A473: CANADA | B473: WEST | C473: EDUCATION | D473: OFFICE | E473: DESK | F473: 2 | G473: Apr | H473: 1994 | I473: 506.00 | J473: 415.00 | K473: -91
A474: CANADA | B474: WEST | C474: EDUCATION | D474: OFFICE | E474: DESK | F474: 2 | G474: May | H474: 1994 | I474: 185.00 | J474: 61.00 | K474: -124
A475: CANADA | B475: WEST | C475: EDUCATION | D475: OFFICE | E475: DESK | F475: 2 | G475: Jun | H475: 1994 | I475: 692.00 | J475: 839.00 | K475: 147
A476: CANADA | B476: WEST | C476: EDUCATION | D476: OFFICE | E476: DESK | F476: 3 | G476: Jul | H476: 1994 | I476: 565.00 | J476: 596.00 | K476: 31
A477: CANADA | B477: WEST | C477: EDUCATION | D477: OFFICE | E477: DESK | F477: 3 | G477: Aug | H477: 1994 | I477: 512.00 | J477: 751.00 | K477: 239
A478: CANADA | B478: WEST | C478: EDUCATION | D478: OFFICE | E478: DESK | F478: 3 | G478: Sep | H478: 1994 | I478: 86.00 | J478: 460.00 | K478: 374
A479: CANADA | B479: WEST | C479: EDUCATION | D479: OFFICE | E479: DESK | F479: 4 | G479: Oct | H479: 1994 | I479: 399.00 | J479: 922.00 | K479: 523
A480: CANADA | B480: WEST | C480: EDUCATION | D480: OFFICE | E480: DESK | F480: 4 | G480: Nov | H480: 1994 | I480: 672.00 | J480: 153.00 | K480: -519
A481: CANADA | B481: WEST | C481: EDUCATION | D481: OFFICE | E481: DESK | F481: 4 | G481: Dec | H481: 1994 | I481: 801.00 | J481: 928.00 | K481: 127
A482: GERMANY | B482: EAST | C482: CONSUMER | D482: FURNITURE | E482: SOFA | F482: 1 | G482: Jan | H482: 1993 | I482: 874.00 | J482: 873.00 | K482: -1
A483: GERMANY | B483: EAST | C483: CONSUMER | D483: FURNITURE | E483: SOFA | F483: 1 | G483: Feb | H483: 1993 | I483: 578.00 | J483: 498.00 | K483: -80
A484: GERMANY | B484: EAST | C484: CONSUMER | D484: FURNITURE | E484: SOFA | F484: 1 | G484: Mar | H484: 1993 | I484: 768.00 | J484: 808.00 | K484: 40
A485: GERMANY | B485: EAST | C485: CONSUMER | D485: FURNITURE | E485: SOFA | F485: 2 | G485: Apr | H485: 1993 | I485: 178.00 | J485: 742.00 | K485: 564
A486: GERMANY | B486: EAST | C486: CONSUMER | D486: FURNITURE | E486: SOFA | F486: 2 | G486: May | H486: 1993 | I486: 916.00 | J486: 744.00 | K486: -172
A487: GERMANY | B487: EAST | C487: CONSUMER | D487: FURNITURE | E487: SOFA | F487: 2 | G487: Jun | H487: 1993 | I487: 917.00 | J487: 30.00 | K487: -887
A488: GERMANY | B488: EAST | C488: CONSUMER | D488: FURNITURE | E488: SOFA | F488: 3 | G488: Jul | H488: 1993 | I488: 633.00 | J488: 747.00 | K488: 114
A489: GERMANY | B489: EAST | C489: CONSUMER | D489: FURNITURE | E489: SOFA | F489: 3 | G489: Aug | H489: 1993 | I489: 107.00 | J489: 672.00 | K489: 565
A490: GERMANY | B490: EAST | C490: CONSUMER | D490: FURNITURE | E490: SOFA | F490: 3 | G490: Sep | H490: 1993 | I490: 523.00 | J490: 564.00 | K490: 41
A491: GERMANY | B491: EAST | C491: CONSUMER | D491: FURNITURE | E491: SOFA | F491: 4 | G491: Oct | H491: 1993 | I491: 924.00 | J491: 785.00 | K491: -139
A492: GERMANY | B492: EAST | C492: CONSUMER | D492: FURNITURE | E492: SOFA | F492: 4 | G492: Nov | H492: 1993 | I492: 481.00 | J492: 825.00 | K492: 344
A493: GERMANY | B493: EAST | C493: CONSUMER | D493: FURNITURE | E493: SOFA | F493: 4 | G493: Dec | H493: 1993 | I493: 240.00 | J493: 243.00 | K493: 3
A494: GERMANY | B494: EAST | C494: CONSUMER | D494: FURNITURE | E494: BED | F494: 1 | G494: Jan | H494: 1993 | I494: 232.00 | J494: 143.00 | K494: -89
A495: GERMANY | B495: EAST | C495: CONSUMER | D495: FURNITURE | E495: BED | F495: 1 | G495: Feb | H495: 1993 | I495: 993.00 | J495: 15.00 | K495: -978
A496: GERMANY | B496: EAST | C496: CONSUMER | D496: FURNITURE | E496: BED | F496: 1 | G496: Mar | H496: 1993 | I496: 652.00 | J496: 742.00 | K496: 90
A497: GERMANY | B497: EAST | C497: CONSUMER | D497: FURNITURE | E497: BED | F497: 2 | G497: Apr | H497: 1993 | I497: 761.00 | J497: 339.00 | K497: -422
A498: GERMANY | B498: EAST | C498: CONSUMER | D498: FURNITURE | E498: BED | F498: 2 | G498: May | H498: 1993 | I498: 428.00 | J498: 39.00 | K498: -389
A499: GERMANY | B499: EAST | C499: CONSUMER | D499: FURNITURE | E499: BED | F499: 2 | G499: Jun | H499: 1993 | I499: 4.00 | J499: 465.00 | K499: 461
A500: GERMANY | B500: EAST | C500: CONSUMER | D500: FURNITURE | E500: BED | F500: 3 | G500: Jul | H500: 1993 | I500: 101.00 | J500: 889.00 | K500: 788
A501: GERMANY | B501: EAST | C501: CONSUMER | D501: FURNITURE | E501: BED | F501: 3 | G501: Aug | H501: 1993 | I501: 869.00 | J501: 856.00 | K501: -13
A502: GERMANY | B502: EAST | C502: CONSUMER | D502: FURNITURE | E502: BED | F502: 3 | G502: Sep | H502: 1993 | I502: 271.00 | J502: 358.00 | K502: 87
A503: GERMANY | B503: EAST | C503: CONSUMER | D503: FURNITURE | E503: BED | F503: 4 | G503: Oct | H503: 1993 | I503: 633.00 | J503: 452.00 | K503: -181
A504: GERMANY | B504: EAST | C504: CONSUMER | D504: FURNITURE | E504: BED | F504: 4 | G504: Nov | H504: 1993 | I504: 481.00 | J504: 387.00 | K504: -94
A505: GERMANY | B505: EAST | C505: CONSUMER | D505: FURNITURE | E505: BED | F505: 4 | G505: Dec | H505: 1993 | I505: 302.00 | J505: 824.00 | K505: 522
A506: GERMANY | B506: EAST | C506: CONSUMER | D506: OFFICE | E506: TABLE | F506: 1 | G506: Jan | H506: 1993 | I506: 982.00 | J506: 166.00 | K506: -816
A507: GERMANY | B507: EAST | C507: CONSUMER | D507: OFFICE | E507: TABLE | F507: 1 | G507: Feb | H507: 1993 | I507: 614.00 | J507: 531.00 | K507: -83
A508: GERMANY | B508: EAST | C508: CONSUMER | D508: OFFICE | E508: TABLE | F508: 1 | G508: Mar | H508: 1993 | I508: 839.00 | J508: 963.00 | K508: 124
A509: GERMANY | B509: EAST | C509: CONSUMER | D509: OFFICE | E509: TABLE | F509: 2 | G509: Apr | H509: 1993 | I509: 388.00 | J509: 994.00 | K509: 606
A510: GERMANY | B510: EAST | C510: CONSUMER | D510: OFFICE | E510: TABLE | F510: 2 | G510: May | H510: 1993 | I510: 296.00 | J510: 978.00 | K510: 682
A511: GERMANY | B511: EAST | C511: CONSUMER | D511: OFFICE | E511: TABLE | F511: 2 | G511: Jun | H511: 1993 | I511: 429.00 | J511: 72.00 | K511: -357
A512: GERMANY | B512: EAST | C512: CONSUMER | D512: OFFICE | E512: TABLE | F512: 3 | G512: Jul | H512: 1993 | I512: 901.00 | J512: 33.00 | K512: -868
A513: GERMANY | B513: EAST | C513: CONSUMER | D513: OFFICE | E513: TABLE | F513: 3 | G513: Aug | H513: 1993 | I513: 350.00 | J513: 428.00 | K513: 78
A514: GERMANY | B514: EAST | C514: CONSUMER | D514: OFFICE | E514: TABLE | F514: 3 | G514: Sep | H514: 1993 | I514: 581.00 | J514: 413.00 | K514: -168
A515: GERMANY | B515: EAST | C515: CONSUMER | D515: OFFICE | E515: TABLE | F515: 4 | G515: Oct | H515: 1993 | I515: 583.00 | J515: 737.00 | K515: 154
A516: GERMANY | B516: EAST | C516: CONSUMER | D516: OFFICE | E516: TABLE | F516: 4 | G516: Nov | H516: 1993 | I516: 92.00 | J516: 85.00 | K516: -7
A517: GERMANY | B517: EAST | C517: CONSUMER | D517: OFFICE | E517: TABLE | F517: 4 | G517: Dec | H517: 1993 | I517: 647.00 | J517: 916.00 | K517: 269
A518: GERMANY | B518: EAST | C518: CONSUMER | D518: OFFICE | E518: CHAIR | F518: 1 | G518: Jan | H518: 1993 | I518: 336.00 | J518: 697.00 | K518: 361
A519: GERMANY | B519: EAST | C519: CONSUMER | D519: OFFICE | E519: CHAIR | F519: 1 | G519: Feb | H519: 1993 | I519: 299.00 | J519: 215.00 | K519: -84
A520: GERMANY | B520: EAST | C520: CONSUMER | D520: OFFICE | E520: CHAIR | F520: 1 | G520: Mar | H520: 1993 | I520: 747.00 | J520: 197.00 | K520: -550
A521: GERMANY | B521: EAST | C521: CONSUMER | D521: OFFICE | E521: CHAIR | F521: 2 | G521: Apr | H521: 1993 | I521: 154.00 | J521: 205.00 | K521: 51
A522: GERMANY | B522: EAST | C522: CONSUMER | D522: OFFICE | E522: CHAIR | F522: 2 | G522: May | H522: 1993 | I522: 486.00 | J522: 256.00 | K522: -230
A523: GERMANY | B523: EAST | C523: CONSUMER | D523: OFFICE | E523: CHAIR | F523: 2 | G523: Jun | H523: 1993 | I523: 251.00 | J523: 377.00 | K523: 126
A524: GERMANY | B524: EAST | C524: CONSUMER | D524: OFFICE | E524: CHAIR | F524: 3 | G524: Jul | H524: 1993 | I524: 225.00 | J524: 577.00 | K524: 352
A525: GERMANY | B525: EAST | C525: CONSUMER | D525: OFFICE | E525: CHAIR | F525: 3 | G525: Aug | H525: 1993 | I525: 77.00 | J525: 686.00 | K525: 609
A526: GERMANY | B526: EAST | C526: CONSUMER | D526: OFFICE | E526: CHAIR | F526: 3 | G526: Sep | H526: 1993 | I526: 74.00 | J526: 332.00 | K526: 258
A527: GERMANY | B527: EAST | C527: CONSUMER | D527: OFFICE | E527: CHAIR | F527: 4 | G527: Oct | H527: 1993 | I527: 596.00 | J527: 534.00 | K527: -62
A528: GERMANY | B528: EAST | C528: CONSUMER | D528: OFFICE | E528: CHAIR | F528: 4 | G528: Nov | H528: 1993 | I528: 493.00 | J528: 485.00 | K528: -8
A529: GERMANY | B529: EAST | C529: CONSUMER | D529: OFFICE | E529: CHAIR | F529: 4 | G529: Dec | H529: 1993 | I529: 782.00 | J529: 594.00 | K529: -188
A530: GERMANY | B530: EAST | C530: CONSUMER | D530: OFFICE | E530: DESK | F530: 1 | G530: Jan | H530: 1993 | I530: 511.00 | J530: 956.00 | K530: 445
A531: GERMANY | B531: EAST | C531: CONSUMER | D531: OFFICE | E531: DESK | F531: 1 | G531: Feb | H531: 1993 | I531: 505.00 | J531: 205.00 | K531: -300
A532: GERMANY | B532: EAST | C532: CONSUMER | D532: OFFICE | E532: DESK | F532: 1 | G532: Mar | H532: 1993 | I532: 720.00 | J532: 629.00 | K532: -91
A533: GERMANY | B533: EAST | C533: CONSUMER | D533: OFFICE | E533: DESK | F533: 2 | G533: Apr | H533: 1993 | I533: 823.00 | J533: 277.00 | K533: -546
A534: GERMANY | B534: EAST | C534: CONSUMER | D534: OFFICE | E534: DESK | F534: 2 | G534: May | H534: 1993 | I534: 21.00 | J534: 266.00 | K534: 245
A535: GERMANY | B535: EAST | C535: CONSUMER | D535: OFFICE | E535: DESK | F535: 2 | G535: Jun | H535: 1993 | I535: 142.00 | J535: 872.00 | K535: 730
A536: GERMANY | B536: EAST | C536: CONSUMER | D536: OFFICE | E536: DESK | F536: 3 | G536: Jul | H536: 1993 | I536: 95.00 | J536: 435.00 | K536: 340
A537: GERMANY | B537: EAST | C537: CONSUMER | D537: OFFICE | E537: DESK | F537: 3 | G537: Aug | H537: 1993 | I537: 398.00 | J537: 988.00 | K537: 590
A538: GERMANY | B538: EAST | C538: CONSUMER | D538: OFFICE | E538: DESK | F538: 3 | G538: Sep | H538: 1993 | I538: 328.00 | J538: 953.00 | K538: 625
A539: GERMANY | B539: EAST | C539: CONSUMER | D539: OFFICE | E539: DESK | F539: 4 | G539: Oct | H539: 1993 | I539: 151.00 | J539: 556.00 | K539: 405
A540: GERMANY | B540: EAST | C540: CONSUMER | D540: OFFICE | E540: DESK | F540: 4 | G540: Nov | H540: 1993 | I540: 978.00 | J540: 211.00 | K540: -767
A541: GERMANY | B541: EAST | C541: CONSUMER | D541: OFFICE | E541: DESK | F541: 4 | G541: Dec | H541: 1993 | I541: 918.00 | J541: 389.00 | K541: -529
A542: GERMANY | B542: EAST | C542: CONSUMER | D542: FURNITURE | E542: SOFA | F542: 1 | G542: Jan | H542: 1994 | I542: 819.00 | J542: 959.00 | K542: 140
A543: GERMANY | B543: EAST | C543: CONSUMER | D543: FURNITURE | E543: SOFA | F543: 1 | G543: Feb | H543: 1994 | I543: 602.00 | J543: 123.00 | K543: -479
A544: GERMANY | B544: EAST | C544: CONSUMER | D544: FURNITURE | E544: SOFA | F544: 1 | G544: Mar | H544: 1994 | I544: 538.00 | J544: 714.00 | K544: 176
A545: GERMANY | B545: EAST | C545: CONSUMER | D545: FURNITURE | E545: SOFA | F545: 2 | G545: Apr | H545: 1994 | I545: 632.00 | J545: 252.00 | K545: -380
A546: GERMANY | B546: EAST | C546: CONSUMER | D546: FURNITURE | E546: SOFA | F546: 2 | G546: May | H546: 1994 | I546: 952.00 | J546: 715.00 | K546: -237
A547: GERMANY | B547: EAST | C547: CONSUMER | D547: FURNITURE | E547: SOFA | F547: 2 | G547: Jun | H547: 1994 | I547: 480.00 | J547: 670.00 | K547: 190
A548: GERMANY | B548: EAST | C548: CONSUMER | D548: FURNITURE | E548: SOFA | F548: 3 | G548: Jul | H548: 1994 | I548: 700.00 | J548: 81.00 | K548: -619
A549: GERMANY | B549: EAST | C549: CONSUMER | D549: FURNITURE | E549: SOFA | F549: 3 | G549: Aug | H549: 1994 | I549: 726.00 | J549: 653.00 | K549: -73
A550: GERMANY | B550: EAST | C550: CONSUMER | D550: FURNITURE | E550: SOFA | F550: 3 | G550: Sep | H550: 1994 | I550: 526.00 | J550: 795.00 | K550: 269
A551: GERMANY | B551: EAST | C551: CONSUMER | D551: FURNITURE | E551: SOFA | F551: 4 | G551: Oct | H551: 1994 | I551: 410.00 | J551: 182.00 | K551: -228
A552: GERMANY | B552: EAST | C552: CONSUMER | D552: FURNITURE | E552: SOFA | F552: 4 | G552: Nov | H552: 1994 | I552: 307.00 | J552: 725.00 | K552: 418
A553: GERMANY | B553: EAST | C553: CONSUMER | D553: FURNITURE | E553: SOFA | F553: 4 | G553: Dec | H553: 1994 | I553: 73.00 | J553: 101.00 | K553: 28
A554: GERMANY | B554: EAST | C554: CONSUMER | D554: FURNITURE | E554: BED | F554: 1 | G554: Jan | H554: 1994 | I554: 245.00 | J554: 185.00 | K554: -60
A555: GERMANY | B555: EAST | C555: CONSUMER | D555: FURNITURE | E555: BED | F555: 1 | G555: Feb | H555: 1994 | I555: 941.00 | J555: 151.00 | K555: -790
A556: GERMANY | B556: EAST | C556: CONSUMER | D556: FURNITURE | E556: BED | F556: 1 | G556: Mar | H556: 1994 | I556: 721.00 | J556: 419.00 | K556: -302
A557: GERMANY | B557: EAST | C557: CONSUMER | D557: FURNITURE | E557: BED | F557: 2 | G557: Apr | H557: 1994 | I557: 893.00 | J557: 643.00 | K557: -250
A558: GERMANY | B558: EAST | C558: CONSUMER | D558: FURNITURE | E558: BED | F558: 2 | G558: May | H558: 1994 | I558: 898.00 | J558: 63.00 | K558: -835
A559: GERMANY | B559: EAST | C559: CONSUMER | D559: FURNITURE | E559: BED | F559: 2 | G559: Jun | H559: 1994 | I559: 94.00 | J559: 202.00 | K559: 108
A560: GERMANY | B560: EAST | C560: CONSUMER | D560: FURNITURE | E560: BED | F560: 3 | G560: Jul | H560: 1994 | I560: 962.00 | J560: 332.00 | K560: -630
A561: GERMANY | B561: EAST | C561: CONSUMER | D561: FURNITURE | E561: BED | F561: 3 | G561: Aug | H561: 1994 | I561: 71.00 | J561: 723.00 | K561: 652
A562: GERMANY | B562: EAST | C562: CONSUMER | D562: FURNITURE | E562: BED | F562: 3 | G562: Sep | H562: 1994 | I562: 108.00 | J562: 148.00 | K562: 40
A563: GERMANY | B563: EAST | C563: CONSUMER | D563: FURNITURE | E563: BED | F563: 4 | G563: Oct | H563: 1994 | I563: 71.00 | J563: 840.00 | K563: 769
A564: GERMANY | B564: EAST | C564: CONSUMER | D564: FURNITURE | E564: BED | F564: 4 | G564: Nov | H564: 1994 | I564: 767.00 | J564: 601.00 | K564: -166
A565: GERMANY | B565: EAST | C565: CONSUMER | D565: FURNITURE | E565: BED | F565: 4 | G565: Dec | H565: 1994 | I565: 323.00 | J565: 962.00 | K565: 639
A566: GERMANY | B566: EAST | C566: CONSUMER | D566: OFFICE | E566: TABLE | F566: 1 | G566: Jan | H566: 1994 | I566: 771.00 | J566: 785.00 | K566: 14
A567: GERMANY | B567: EAST | C567: CONSUMER | D567: OFFICE | E567: TABLE | F567: 1 | G567: Feb | H567: 1994 | I567: 26.00 | J567: 302.00 | K567: 276
A568: GERMANY | B568: EAST | C568: CONSUMER | D568: OFFICE | E568: TABLE | F568: 1 | G568: Mar | H568: 1994 | I568: 598.00 | J568: 1000.00 | K568: 402
A569: GERMANY | B569: EAST | C569: CONSUMER | D569: OFFICE | E569: TABLE | F569: 2 | G569: Apr | H569: 1994 | I569: 715.00 | J569: 458.00 | K569: -257
A570: GERMANY | B570: EAST | C570: CONSUMER | D570: OFFICE | E570: TABLE | F570: 2 | G570: May | H570: 1994 | I570: 74.00 | J570: 896.00 | K570: 822
A571: GERMANY | B571: EAST | C571: CONSUMER | D571: OFFICE | E571: TABLE | F571: 2 | G571: Jun | H571: 1994 | I571: 580.00 | J571: 615.00 | K571: 35
A572: GERMANY | B572: EAST | C572: CONSUMER | D572: OFFICE | E572: TABLE | F572: 3 | G572: Jul | H572: 1994 | I572: 848.00 | J572: 174.00 | K572: -674
A573: GERMANY | B573: EAST | C573: CONSUMER | D573: OFFICE | E573: TABLE | F573: 3 | G573: Aug | H573: 1994 | I573: 118.00 | J573: 651.00 | K573: 533
A574: GERMANY | B574: EAST | C574: CONSUMER | D574: OFFICE | E574: TABLE | F574: 3 | G574: Sep | H574: 1994 | I574: 54.00 | J574: 784.00 | K574: 730
A575: GERMANY | B575: EAST | C575: CONSUMER | D575: OFFICE | E575: TABLE | F575: 4 | G575: Oct | H575: 1994 | I575: 929.00 | J575: 121.00 | K575: -808
A576: GERMANY | B576: EAST | C576: CONSUMER | D576: OFFICE | E576: TABLE | F576: 4 | G576: Nov | H576: 1994 | I576: 393.00 | J576: 341.00 | K576: -52
A577: GERMANY | B577: EAST | C577: CONSUMER | D577: OFFICE | E577: TABLE | F577: 4 | G577: Dec | H577: 1994 | I577: 820.00 | J577: 615.00 | K577: -205
A578: GERMANY | B578: EAST | C578: CONSUMER | D578: OFFICE | E578: CHAIR | F578: 1 | G578: Jan | H578: 1994 | I578: 487.00 | J578: 413.00 | K578: -74
A579: GERMANY | B579: EAST | C579: CONSUMER | D579: OFFICE | E579: CHAIR | F579: 1 | G579: Feb | H579: 1994 | I579: 127.00 | J579: 13.00 | K579: -114
A580: GERMANY | B580: EAST | C580: CONSUMER | D580: OFFICE | E580: CHAIR | F580: 1 | G580: Mar | H580: 1994 | I580: 538.00 | J580: 483.00 | K580: -55
A581: GERMANY | B581: EAST | C581: CONSUMER | D581: OFFICE | E581: CHAIR | F581: 2 | G581: Apr | H581: 1994 | I581: 94.00 | J581: 820.00 | K581: 726
A582: GERMANY | B582: EAST | C582: CONSUMER | D582: OFFICE | E582: CHAIR | F582: 2 | G582: May | H582: 1994 | I582: 252.00 | J582: 745.00 | K582: 493
A583: GERMANY | B583: EAST | C583: CONSUMER | D583: OFFICE | E583: CHAIR | F583: 2 | G583: Jun | H583: 1994 | I583: 722.00 | J583: 79.00 | K583: -643
A584: GERMANY | B584: EAST | C584: CONSUMER | D584: OFFICE | E584: CHAIR | F584: 3 | G584: Jul | H584: 1994 | I584: 536.00 | J584: 36.00 | K584: -500
A585: GERMANY | B585: EAST | C585: CONSUMER | D585: OFFICE | E585: CHAIR | F585: 3 | G585: Aug | H585: 1994 | I585: 958.00 | J585: 950.00 | K585: -8
A586: GERMANY | B586: EAST | C586: CONSUMER | D586: OFFICE | E586: CHAIR | F586: 3 | G586: Sep | H586: 1994 | I586: 466.00 | J586: 74.00 | K586: -392
A587: GERMANY | B587: EAST | C587: CONSUMER | D587: OFFICE | E587: CHAIR | F587: 4 | G587: Oct | H587: 1994 | I587: 309.00 | J587: 458.00 | K587: 149
A588: GERMANY | B588: EAST | C588: CONSUMER | D588: OFFICE | E588: CHAIR | F588: 4 | G588: Nov | H588: 1994 | I588: 680.00 | J588: 609.00 | K588: -71
A589: GERMANY | B589: EAST | C589: CONSUMER | D589: OFFICE | E589: CHAIR | F589: 4 | G589: Dec | H589: 1994 | I589: 539.00 | J589: 429.00 | K589: -110
A590: GERMANY | B590: EAST | C590: CONSUMER | D590: OFFICE | E590: DESK | F590: 1 | G590: Jan | H590: 1994 | I590: 542.00 | J590: 351.00 | K590: -191
A591: GERMANY | B591: EAST | C591: CONSUMER | D591: OFFICE | E591: DESK | F591: 1 | G591: Feb | H591: 1994 | I591: 96.00 | J591: 14.00 | K591: -82
A592: GERMANY | B592: EAST | C592: CONSUMER | D592: OFFICE | E592: DESK | F592: 1 | G592: Mar | H592: 1994 | I592: 496.00 | J592: 181.00 | K592: -315
A593: GERMANY | B593: EAST | C593: CONSUMER | D593: OFFICE | E593: DESK | F593: 2 | G593: Apr | H593: 1994 | I593: 77.00 | J593: 452.00 | K593: 375
A594: GERMANY | B594: EAST | C594: CONSUMER | D594: OFFICE | E594: DESK | F594: 2 | G594: May | H594: 1994 | I594: 236.00 | J594: 511.00 | K594: 275
A595: GERMANY | B595: EAST | C595: CONSUMER | D595: OFFICE | E595: DESK | F595: 2 | G595: Jun | H595: 1994 | I595: 913.00 | J595: 193.00 | K595: -720
A596: GERMANY | B596: EAST | C596: CONSUMER | D596: OFFICE | E596: DESK | F596: 3 | G596: Jul | H596: 1994 | I596: 49.00 | J596: 797.00 | K596: 748
A597: GERMANY | B597: EAST | C597: CONSUMER | D597: OFFICE | E597: DESK | F597: 3 | G597: Aug | H597: 1994 | I597: 967.00 | J597: 988.00 | K597: 21
A598: GERMANY | B598: EAST | C598: CONSUMER | D598: OFFICE | E598: DESK | F598: 3 | G598: Sep | H598: 1994 | I598: 502.00 | J598: 487.00 | K598: -15
A599: GERMANY | B599: EAST | C599: CONSUMER | D599: OFFICE | E599: DESK | F599: 4 | G599: Oct | H599: 1994 | I599: 790.00 | J599: 941.00 | K599: 151
A600: GERMANY | B600: EAST | C600: CONSUMER | D600: OFFICE | E600: DESK | F600: 4 | G600: Nov | H600: 1994 | I600: 121.00 | J600: 577.00 | K600: 456
A601: GERMANY | B601: EAST | C601: CONSUMER | D601: OFFICE | E601: DESK | F601: 4 | G601: Dec | H601: 1994 | I601: 55.00 | J601: 456.00 | K601: 401
A602: GERMANY | B602: EAST | C602: EDUCATION | D602: FURNITURE | E602: SOFA | F602: 1 | G602: Jan | H602: 1993 | I602: 977.00 | J602: 996.00 | K602: 19
A603: GERMANY | B603: EAST | C603: EDUCATION | D603: FURNITURE | E603: SOFA | F603: 1 | G603: Feb | H603: 1993 | I603: 549.00 | J603: 554.00 | K603: 5
A604: GERMANY | B604: EAST | C604: EDUCATION | D604: FURNITURE | E604: SOFA | F604: 1 | G604: Mar | H604: 1993 | I604: 951.00 | J604: 540.00 | K604: -411
A605: GERMANY | B605: EAST | C605: EDUCATION | D605: FURNITURE | E605: SOFA | F605: 2 | G605: Apr | H605: 1993 | I605: 390.00 | J605: 140.00 | K605: -250
A606: GERMANY | B606: EAST | C606: EDUCATION | D606: FURNITURE | E606: SOFA | F606: 2 | G606: May | H606: 1993 | I606: 204.00 | J606: 554.00 | K606: 350
A607: GERMANY | B607: EAST | C607: EDUCATION | D607: FURNITURE | E607: SOFA | F607: 2 | G607: Jun | H607: 1993 | I607: 78.00 | J607: 724.00 | K607: 646
A608: GERMANY | B608: EAST | C608: EDUCATION | D608: FURNITURE | E608: SOFA | F608: 3 | G608: Jul | H608: 1993 | I608: 613.00 | J608: 693.00 | K608: 80
A609: GERMANY | B609: EAST | C609: EDUCATION | D609: FURNITURE | E609: SOFA | F609: 3 | G609: Aug | H609: 1993 | I609: 745.00 | J609: 866.00 | K609: 121
A610: GERMANY | B610: EAST | C610: EDUCATION | D610: FURNITURE | E610: SOFA | F610: 3 | G610: Sep | H610: 1993 | I610: 56.00 | J610: 833.00 | K610: 777
A611: GERMANY | B611: EAST | C611: EDUCATION | D611: FURNITURE | E611: SOFA | F611: 4 | G611: Oct | H611: 1993 | I611: 887.00 | J611: 164.00 | K611: -723
A612: GERMANY | B612: EAST | C612: EDUCATION | D612: FURNITURE | E612: SOFA | F612: 4 | G612: Nov | H612: 1993 | I612: 651.00 | J612: 753.00 | K612: 102
A613: GERMANY | B613: EAST | C613: EDUCATION | D613: FURNITURE | E613: SOFA | F613: 4 | G613: Dec | H613: 1993 | I613: 691.00 | J613: 60.00 | K613: -631
A614: GERMANY | B614: EAST | C614: EDUCATION | D614: FURNITURE | E614: BED | F614: 1 | G614: Jan | H614: 1993 | I614: 325.00 | J614: 641.00 | K614: 316
A615: GERMANY | B615: EAST | C615: EDUCATION | D615: FURNITURE | E615: BED | F615: 1 | G615: Feb | H615: 1993 | I615: 648.00 | J615: 494.00 | K615: -154
A616: GERMANY | B616: EAST | C616: EDUCATION | D616: FURNITURE | E616: BED | F616: 1 | G616: Mar | H616: 1993 | I616: 365.00 | J616: 428.00 | K616: 63
A617: GERMANY | B617: EAST | C617: EDUCATION | D617: FURNITURE | E617: BED | F617: 2 | G617: Apr | H617: 1993 | I617: 120.00 | J617: 936.00 | K617: 816
A618: GERMANY | B618: EAST | C618: EDUCATION | D618: FURNITURE | E618: BED | F618: 2 | G618: May | H618: 1993 | I618: 347.00 | J618: 597.00 | K618: 250
A619: GERMANY | B619: EAST | C619: EDUCATION | D619: FURNITURE | E619: BED | F619: 2 | G619: Jun | H619: 1993 | I619: 638.00 | J619: 728.00 | K619: 90
A620: GERMANY | B620: EAST | C620: EDUCATION | D620: FURNITURE | E620: BED | F620: 3 | G620: Jul | H620: 1993 | I620: 732.00 | J620: 933.00 | K620: 201
A621: GERMANY | B621: EAST | C621: EDUCATION | D621: FURNITURE | E621: BED | F621: 3 | G621: Aug | H621: 1993 | I621: 465.00 | J621: 663.00 | K621: 198
A622: GERMANY | B622: EAST | C622: EDUCATION | D622: FURNITURE | E622: BED | F622: 3 | G622: Sep | H622: 1993 | I622: 262.00 | J622: 394.00 | K622: 132
A623: GERMANY | B623: EAST | C623: EDUCATION | D623: FURNITURE | E623: BED | F623: 4 | G623: Oct | H623: 1993 | I623: 947.00 | J623: 334.00 | K623: -613
A624: GERMANY | B624: EAST | C624: EDUCATION | D624: FURNITURE | E624: BED | F624: 4 | G624: Nov | H624: 1993 | I624: 694.00 | J624: 114.00 | K624: -580
A625: GERMANY | B625: EAST | C625: EDUCATION | D625: FURNITURE | E625: BED | F625: 4 | G625: Dec | H625: 1993 | I625: 482.00 | J625: 89.00 | K625: -393
A626: GERMANY | B626: EAST | C626: EDUCATION | D626: OFFICE | E626: TABLE | F626: 1 | G626: Jan | H626: 1993 | I626: 408.00 | J626: 597.00 | K626: 189
A627: GERMANY | B627: EAST | C627: EDUCATION | D627: OFFICE | E627: TABLE | F627: 1 | G627: Feb | H627: 1993 | I627: 45.00 | J627: 185.00 | K627: 140
A628: GERMANY | B628: EAST | C628: EDUCATION | D628: OFFICE | E628: TABLE | F628: 1 | G628: Mar | H628: 1993 | I628: 522.00 | J628: 175.00 | K628: -347
A629: GERMANY | B629: EAST | C629: EDUCATION | D629: OFFICE | E629: TABLE | F629: 2 | G629: Apr | H629: 1993 | I629: 166.00 | J629: 576.00 | K629: 410
A630: GERMANY | B630: EAST | C630: EDUCATION | D630: OFFICE | E630: TABLE | F630: 2 | G630: May | H630: 1993 | I630: 885.00 | J630: 957.00 | K630: 72
A631: GERMANY | B631: EAST | C631: EDUCATION | D631: OFFICE | E631: TABLE | F631: 2 | G631: Jun | H631: 1993 | I631: 713.00 | J631: 993.00 | K631: 280
A632: GERMANY | B632: EAST | C632: EDUCATION | D632: OFFICE | E632: TABLE | F632: 3 | G632: Jul | H632: 1993 | I632: 838.00 | J632: 500.00 | K632: -338
A633: GERMANY | B633: EAST | C633: EDUCATION | D633: OFFICE | E633: TABLE | F633: 3 | G633: Aug | H633: 1993 | I633: 267.00 | J633: 410.00 | K633: 143
A634: GERMANY | B634: EAST | C634: EDUCATION | D634: OFFICE | E634: TABLE | F634: 3 | G634: Sep | H634: 1993 | I634: 967.00 | J634: 592.00 | K634: -375
A635: GERMANY | B635: EAST | C635: EDUCATION | D635: OFFICE | E635: TABLE | F635: 4 | G635: Oct | H635: 1993 | I635: 529.00 | J635: 64.00 | K635: -465
A636: GERMANY | B636: EAST | C636: EDUCATION | D636: OFFICE | E636: TABLE | F636: 4 | G636: Nov | H636: 1993 | I636: 656.00 | J636: 208.00 | K636: -448
A637: GERMANY | B637: EAST | C637: EDUCATION | D637: OFFICE | E637: TABLE | F637: 4 | G637: Dec | H637: 1993 | I637: 665.00 | J637: 273.00 | K637: -392
A638: GERMANY | B638: EAST | C638: EDUCATION | D638: OFFICE | E638: CHAIR | F638: 1 | G638: Jan | H638: 1993 | I638: 304.00 | J638: 468.00 | K638: 164
A639: GERMANY | B639: EAST | C639: EDUCATION | D639: OFFICE | E639: CHAIR | F639: 1 | G639: Feb | H639: 1993 | I639: 846.00 | J639: 430.00 | K639: -416
A640: GERMANY | B640: EAST | C640: EDUCATION | D640: OFFICE | E640: CHAIR | F640: 1 | G640: Mar | H640: 1993 | I640: 912.00 | J640: 893.00 | K640: -19
A641: GERMANY | B641: EAST | C641: EDUCATION | D641: OFFICE | E641: CHAIR | F641: 2 | G641: Apr | H641: 1993 | I641: 810.00 | J641: 519.00 | K641: -291
A642: GERMANY | B642: EAST | C642: EDUCATION | D642: OFFICE | E642: CHAIR | F642: 2 | G642: May | H642: 1993 | I642: 122.00 | J642: 267.00 | K642: 145
A643: GERMANY | B643: EAST | C643: EDUCATION | D643: OFFICE | E643: CHAIR | F643: 2 | G643: Jun | H643: 1993 | I643: 102.00 | J643: 908.00 | K643: 806
A644: GERMANY | B644: EAST | C644: EDUCATION | D644: OFFICE | E644: CHAIR | F644: 3 | G644: Jul | H644: 1993 | I644: 161.00 | J644: 176.00 | K644: 15
A645: GERMANY | B645: EAST | C645: EDUCATION | D645: OFFICE | E645: CHAIR | F645: 3 | G645: Aug | H645: 1993 | I645: 450.00 | J645: 673.00 | K645: 223
A646: GERMANY | B646: EAST | C646: EDUCATION | D646: OFFICE | E646: CHAIR | F646: 3 | G646: Sep | H646: 1993 | I646: 215.00 | J646: 798.00 | K646: 583
A647: GERMANY | B647: EAST | C647: EDUCATION | D647: OFFICE | E647: CHAIR | F647: 4 | G647: Oct | H647: 1993 | I647: 765.00 | J647: 291.00 | K647: -474
A648: GERMANY | B648: EAST | C648: EDUCATION | D648: OFFICE | E648: CHAIR | F648: 4 | G648: Nov | H648: 1993 | I648: 557.00 | J648: 583.00 | K648: 26
A649: GERMANY | B649: EAST | C649: EDUCATION | D649: OFFICE | E649: CHAIR | F649: 4 | G649: Dec | H649: 1993 | I649: 739.00 | J649: 442.00 | K649: -297
A650: GERMANY | B650: EAST | C650: EDUCATION | D650: OFFICE | E650: DESK | F650: 1 | G650: Jan | H650: 1993 | I650: 339.00 | J650: 352.00 | K650: 13
A651: GERMANY | B651: EAST | C651: EDUCATION | D651: OFFICE | E651: DESK | F651: 1 | G651: Feb | H651: 1993 | I651: 70.00 | J651: 234.00 | K651: 164
A652: GERMANY | B652: EAST | C652: EDUCATION | D652: OFFICE | E652: DESK | F652: 1 | G652: Mar | H652: 1993 | I652: 528.00 | J652: 167.00 | K652: -361
A653: GERMANY | B653: EAST | C653: EDUCATION | D653: OFFICE | E653: DESK | F653: 2 | G653: Apr | H653: 1993 | I653: 220.00 | J653: 606.00 | K653: 386
A654: GERMANY | B654: EAST | C654: EDUCATION | D654: OFFICE | E654: DESK | F654: 2 | G654: May | H654: 1993 | I654: 691.00 | J654: 670.00 | K654: -21
A655: GERMANY | B655: EAST | C655: EDUCATION | D655: OFFICE | E655: DESK | F655: 2 | G655: Jun | H655: 1993 | I655: 197.00 | J655: 764.00 | K655: 567
A656: GERMANY | B656: EAST | C656: EDUCATION | D656: OFFICE | E656: DESK | F656: 3 | G656: Jul | H656: 1993 | I656: 239.00 | J656: 659.00 | K656: 420
A657: GERMANY | B657: EAST | C657: EDUCATION | D657: OFFICE | E657: DESK | F657: 3 | G657: Aug | H657: 1993 | I657: 50.00 | J657: 996.00 | K657: 946
A658: GERMANY | B658: EAST | C658: EDUCATION | D658: OFFICE | E658: DESK | F658: 3 | G658: Sep | H658: 1993 | I658: 135.00 | J658: 424.00 | K658: 289
A659: GERMANY | B659: EAST | C659: EDUCATION | D659: OFFICE | E659: DESK | F659: 4 | G659: Oct | H659: 1993 | I659: 972.00 | J659: 899.00 | K659: -73
A660: GERMANY | B660: EAST | C660: EDUCATION | D660: OFFICE | E660: DESK | F660: 4 | G660: Nov | H660: 1993 | I660: 475.00 | J660: 392.00 | K660: -83
A661: GERMANY | B661: EAST | C661: EDUCATION | D661: OFFICE | E661: DESK | F661: 4 | G661: Dec | H661: 1993 | I661: 868.00 | J661: 555.00 | K661: -313
A662: GERMANY | B662: EAST | C662: EDUCATION | D662: FURNITURE | E662: SOFA | F662: 1 | G662: Jan | H662: 1994 | I662: 767.00 | J662: 688.00 | K662: -79
A663: GERMANY | B663: EAST | C663: EDUCATION | D663: FURNITURE | E663: SOFA | F663: 1 | G663: Feb | H663: 1994 | I663: 709.00 | J663: 883.00 | K663: 174
A664: GERMANY | B664: EAST | C664: EDUCATION | D664: FURNITURE | E664: SOFA | F664: 1 | G664: Mar | H664: 1994 | I664: 417.00 | J664: 109.00 | K664: -308
A665: GERMANY | B665: EAST | C665: EDUCATION | D665: FURNITURE | E665: SOFA | F665: 2 | G665: Apr | H665: 1994 | I665: 326.00 | J665: 950.00 | K665: 624
A666: GERMANY | B666: EAST | C666: EDUCATION | D666: FURNITURE | E666: SOFA | F666: 2 | G666: May | H666: 1994 | I666: 599.00 | J666: 438.00 | K666: -161
A667: GERMANY | B667: EAST | C667: EDUCATION | D667: FURNITURE | E667: SOFA | F667: 2 | G667: Jun | H667: 1994 | I667: 818.00 | J667: 286.00 | K667: -532
A668: GERMANY | B668: EAST | C668: EDUCATION | D668: FURNITURE | E668: SOFA | F668: 3 | G668: Jul | H668: 1994 | I668: 13.00 | J668: 342.00 | K668: 329
A669: GERMANY | B669: EAST | C669: EDUCATION | D669: FURNITURE | E669: SOFA | F669: 3 | G669: Aug | H669: 1994 | I669: 185.00 | J669: 383.00 | K669: 198
A670: GERMANY | B670: EAST | C670: EDUCATION | D670: FURNITURE | E670: SOFA | F670: 3 | G670: Sep | H670: 1994 | I670: 140.00 | J670: 80.00 | K670: -60
A671: GERMANY | B671: EAST | C671: EDUCATION | D671: FURNITURE | E671: SOFA | F671: 4 | G671: Oct | H671: 1994 | I671: 717.00 | J671: 322.00 | K671: -395
A672: GERMANY | B672: EAST | C672: EDUCATION | D672: FURNITURE | E672: SOFA | F672: 4 | G672: Nov | H672: 1994 | I672: 852.00 | J672: 749.00 | K672: -103
A673: GERMANY | B673: EAST | C673: EDUCATION | D673: FURNITURE | E673: SOFA | F673: 4 | G673: Dec | H673: 1994 | I673: 125.00 | J673: 606.00 | K673: 481
A674: GERMANY | B674: EAST | C674: EDUCATION | D674: FURNITURE | E674: BED | F674: 1 | G674: Jan | H674: 1994 | I674: 600.00 | J674: 874.00 | K674: 274
A675: GERMANY | B675: EAST | C675: EDUCATION | D675: FURNITURE | E675: BED | F675: 1 | G675: Feb | H675: 1994 | I675: 94.00 | J675: 674.00 | K675: 580
A676: GERMANY | B676: EAST | C676: EDUCATION | D676: FURNITURE | E676: BED | F676: 1 | G676: Mar | H676: 1994 | I676: 323.00 | J676: 347.00 | K676: 24
A677: GERMANY | B677: EAST | C677: EDUCATION | D677: FURNITURE | E677: BED | F677: 2 | G677: Apr | H677: 1994 | I677: 49.00 | J677: 105.00 | K677: 56
A678: GERMANY | B678: EAST | C678: EDUCATION | D678: FURNITURE | E678: BED | F678: 2 | G678: May | H678: 1994 | I678: 70.00 | J678: 286.00 | K678: 216
A679: GERMANY | B679: EAST | C679: EDUCATION | D679: FURNITURE | E679: BED | F679: 2 | G679: Jun | H679: 1994 | I679: 844.00 | J679: 669.00 | K679: -175
A680: GERMANY | B680: EAST | C680: EDUCATION | D680: FURNITURE | E680: BED | F680: 3 | G680: Jul | H680: 1994 | I680: 773.00 | J680: 786.00 | K680: 13
A681: GERMANY | B681: EAST | C681: EDUCATION | D681: FURNITURE | E681: BED | F681: 3 | G681: Aug | H681: 1994 | I681: 68.00 | J681: 104.00 | K681: 36
A682: GERMANY | B682: EAST | C682: EDUCATION | D682: FURNITURE | E682: BED | F682: 3 | G682: Sep | H682: 1994 | I682: 110.00 | J682: 770.00 | K682: 660
A683: GERMANY | B683: EAST | C683: EDUCATION | D683: FURNITURE | E683: BED | F683: 4 | G683: Oct | H683: 1994 | I683: 42.00 | J683: 263.00 | K683: 221
A684: GERMANY | B684: EAST | C684: EDUCATION | D684: FURNITURE | E684: BED | F684: 4 | G684: Nov | H684: 1994 | I684: 171.00 | J684: 900.00 | K684: 729
A685: GERMANY | B685: EAST | C685: EDUCATION | D685: FURNITURE | E685: BED | F685: 4 | G685: Dec | H685: 1994 | I685: 644.00 | J685: 630.00 | K685: -14
A686: GERMANY | B686: EAST | C686: EDUCATION | D686: OFFICE | E686: TABLE | F686: 1 | G686: Jan | H686: 1994 | I686: 419.00 | J686: 906.00 | K686: 487
A687: GERMANY | B687: EAST | C687: EDUCATION | D687: OFFICE | E687: TABLE | F687: 1 | G687: Feb | H687: 1994 | I687: 776.00 | J687: 429.00 | K687: -347
A688: GERMANY | B688: EAST | C688: EDUCATION | D688: OFFICE | E688: TABLE | F688: 1 | G688: Mar | H688: 1994 | I688: 971.00 | J688: 961.00 | K688: -10
A689: GERMANY | B689: EAST | C689: EDUCATION | D689: OFFICE | E689: TABLE | F689: 2 | G689: Apr | H689: 1994 | I689: 248.00 | J689: 338.00 | K689: 90
A690: GERMANY | B690: EAST | C690: EDUCATION | D690: OFFICE | E690: TABLE | F690: 2 | G690: May | H690: 1994 | I690: 486.00 | J690: 472.00 | K690: -14
A691: GERMANY | B691: EAST | C691: EDUCATION | D691: OFFICE | E691: TABLE | F691: 2 | G691: Jun | H691: 1994 | I691: 674.00 | J691: 903.00 | K691: 229
A692: GERMANY | B692: EAST | C692: EDUCATION | D692: OFFICE | E692: TABLE | F692: 3 | G692: Jul | H692: 1994 | I692: 603.00 | J692: 299.00 | K692: -304
A693: GERMANY | B693: EAST | C693: EDUCATION | D693: OFFICE | E693: TABLE | F693: 3 | G693: Aug | H693: 1994 | I693: 492.00 | J693: 948.00 | K693: 456
A694: GERMANY | B694: EAST | C694: EDUCATION | D694: OFFICE | E694: TABLE | F694: 3 | G694: Sep | H694: 1994 | I694: 512.00 | J694: 931.00 | K694: 419
A695: GERMANY | B695: EAST | C695: EDUCATION | D695: OFFICE | E695: TABLE | F695: 4 | G695: Oct | H695: 1994 | I695: 391.00 | J695: 570.00 | K695: 179
A696: GERMANY | B696: EAST | C696: EDUCATION | D696: OFFICE | E696: TABLE | F696: 4 | G696: Nov | H696: 1994 | I696: 313.00 | J696: 97.00 | K696: -216
A697: GERMANY | B697: EAST | C697: EDUCATION | D697: OFFICE | E697: TABLE | F697: 4 | G697: Dec | H697: 1994 | I697: 758.00 | J697: 674.00 | K697: -84
A698: GERMANY | B698: EAST | C698: EDUCATION | D698: OFFICE | E698: CHAIR | F698: 1 | G698: Jan | H698: 1994 | I698: 811.00 | J698: 951.00 | K698: 140
A699: GERMANY | B699: EAST | C699: EDUCATION | D699: OFFICE | E699: CHAIR | F699: 1 | G699: Feb | H699: 1994 | I699: 780.00 | J699: 430.00 | K699: -350
A700: GERMANY | B700: EAST | C700: EDUCATION | D700: OFFICE | E700: CHAIR | F700: 1 | G700: Mar | H700: 1994 | I700: 645.00 | J700: 559.00 | K700: -86
A701: GERMANY | B701: EAST | C701: EDUCATION | D701: OFFICE | E701: CHAIR | F701: 2 | G701: Apr | H701: 1994 | I701: 365.00 | J701: 726.00 | K701: 361
A702: GERMANY | B702: EAST | C702: EDUCATION | D702: OFFICE | E702: CHAIR | F702: 2 | G702: May | H702: 1994 | I702: 597.00 | J702: 944.00 | K702: 347
A703: GERMANY | B703: EAST | C703: EDUCATION | D703: OFFICE | E703: CHAIR | F703: 2 | G703: Jun | H703: 1994 | I703: 126.00 | J703: 497.00 | K703: 371
A704: GERMANY | B704: EAST | C704: EDUCATION | D704: OFFICE | E704: CHAIR | F704: 3 | G704: Jul | H704: 1994 | I704: 655.00 | J704: 388.00 | K704: -267
A705: GERMANY | B705: EAST | C705: EDUCATION | D705: OFFICE | E705: CHAIR | F705: 3 | G705: Aug | H705: 1994 | I705: 604.00 | J705: 81.00 | K705: -523
A706: GERMANY | B706: EAST | C706: EDUCATION | D706: OFFICE | E706: CHAIR | F706: 3 | G706: Sep | H706: 1994 | I706: 280.00 | J706: 111.00 | K706: -169
A707: GERMANY | B707: EAST | C707: EDUCATION | D707: OFFICE | E707: CHAIR | F707: 4 | G707: Oct | H707: 1994 | I707: 115.00 | J707: 288.00 | K707: 173
A708: GERMANY | B708: EAST | C708: EDUCATION | D708: OFFICE | E708: CHAIR | F708: 4 | G708: Nov | H708: 1994 | I708: 205.00 | J708: 845.00 | K708: 640
A709: GERMANY | B709: EAST | C709: EDUCATION | D709: OFFICE | E709: CHAIR | F709: 4 | G709: Dec | H709: 1994 | I709: 672.00 | J709: 745.00 | K709: 73
A710: GERMANY | B710: EAST | C710: EDUCATION | D710: OFFICE | E710: DESK | F710: 1 | G710: Jan | H710: 1994 | I710: 451.00 | J710: 860.00 | K710: 409
A711: GERMANY | B711: EAST | C711: EDUCATION | D711: OFFICE | E711: DESK | F711: 1 | G711: Feb | H711: 1994 | I711: 565.00 | J711: 114.00 | K711: -451
A712: GERMANY | B712: EAST | C712: EDUCATION | D712: OFFICE | E712: DESK | F712: 1 | G712: Mar | H712: 1994 | I712: 116.00 | J712: 943.00 | K712: 827
A713: GERMANY | B713: EAST | C713: EDUCATION | D713: OFFICE | E713: DESK | F713: 2 | G713: Apr | H713: 1994 | I713: 385.00 | J713: 365.00 | K713: -20
A714: GERMANY | B714: EAST | C714: EDUCATION | D714: OFFICE | E714: DESK | F714: 2 | G714: May | H714: 1994 | I714: 375.00 | J714: 249.00 | K714: -126
A715: GERMANY | B715: EAST | C715: EDUCATION | D715: OFFICE | E715: DESK | F715: 2 | G715: Jun | H715: 1994 | I715: 357.00 | J715: 192.00 | K715: -165
A716: GERMANY | B716: EAST | C716: EDUCATION | D716: OFFICE | E716: DESK | F716: 3 | G716: Jul | H716: 1994 | I716: 230.00 | J716: 328.00 | K716: 98
A717: GERMANY | B717: EAST | C717: EDUCATION | D717: OFFICE | E717: DESK | F717: 3 | G717: Aug | H717: 1994 | I717: 829.00 | J717: 311.00 | K717: -518
A718: GERMANY | B718: EAST | C718: EDUCATION | D718: OFFICE | E718: DESK | F718: 3 | G718: Sep | H718: 1994 | I718: 971.00 | J718: 576.00 | K718: -395
A719: GERMANY | B719: EAST | C719: EDUCATION | D719: OFFICE | E719: DESK | F719: 4 | G719: Oct | H719: 1994 | I719: 280.00 | J719: 915.00 | K719: 635
A720: GERMANY | B720: EAST | C720: EDUCATION | D720: OFFICE | E720: DESK | F720: 4 | G720: Nov | H720: 1994 | I720: 853.00 | J720: 522.00 | K720: -331
A721: GERMANY | B721: EAST | C721: EDUCATION | D721: OFFICE | E721: DESK | F721: 4 | G721: Dec | H721: 1994 | I721: 953.00 | J721: 625.00 | K721: -328
A722: GERMANY | B722: WEST | C722: CONSUMER | D722: FURNITURE | E722: SOFA | F722: 1 | G722: Jan | H722: 1993 | I722: 923.00 | J722: 872.00 | K722: -51
A723: GERMANY | B723: WEST | C723: CONSUMER | D723: FURNITURE | E723: SOFA | F723: 1 | G723: Feb | H723: 1993 | I723: 854.00 | J723: 748.00 | K723: -106
A724: GERMANY | B724: WEST | C724: CONSUMER | D724: FURNITURE | E724: SOFA | F724: 1 | G724: Mar | H724: 1993 | I724: 769.00 | J724: 749.00 | K724: -20
A725: GERMANY | B725: WEST | C725: CONSUMER | D725: FURNITURE | E725: SOFA | F725: 2 | G725: Apr | H725: 1993 | I725: 271.00 | J725: 876.00 | K725: 605
A726: GERMANY | B726: WEST | C726: CONSUMER | D726: FURNITURE | E726: SOFA | F726: 2 | G726: May | H726: 1993 | I726: 383.00 | J726: 860.00 | K726: 477
A727: GERMANY | B727: WEST | C727: CONSUMER | D727: FURNITURE | E727: SOFA | F727: 2 | G727: Jun | H727: 1993 | I727: 29.00 | J727: 900.00 | K727: 871
A728: GERMANY | B728: WEST | C728: CONSUMER | D728: FURNITURE | E728: SOFA | F728: 3 | G728: Jul | H728: 1993 | I728: 185.00 | J728: 705.00 | K728: 520
A729: GERMANY | B729: WEST | C729: CONSUMER | D729: FURNITURE | E729: SOFA | F729: 3 | G729: Aug | H729: 1993 | I729: 351.00 | J729: 913.00 | K729: 562
A730: GERMANY | B730: WEST | C730: CONSUMER | D730: FURNITURE | E730: SOFA | F730: 3 | G730: Sep | H730: 1993 | I730: 560.00 | J730: 315.00 | K730: -245
A731: GERMANY | B731: WEST | C731: CONSUMER | D731: FURNITURE | E731: SOFA | F731: 4 | G731: Oct | H731: 1993 | I731: 840.00 | J731: 466.00 | K731: -374
A732: GERMANY | B732: WEST | C732: CONSUMER | D732: FURNITURE | E732: SOFA | F732: 4 | G732: Nov | H732: 1993 | I732: 517.00 | J732: 233.00 | K732: -284
A733: GERMANY | B733: WEST | C733: CONSUMER | D733: FURNITURE | E733: SOFA | F733: 4 | G733: Dec | H733: 1993 | I733: 949.00 | J733: 906.00 | K733: -43
A734: GERMANY | B734: WEST | C734: CONSUMER | D734: FURNITURE | E734: BED | F734: 1 | G734: Jan | H734: 1993 | I734: 528.00 | J734: 494.00 | K734: -34
A735: GERMANY | B735: WEST | C735: CONSUMER | D735: FURNITURE | E735: BED | F735: 1 | G735: Feb | H735: 1993 | I735: 124.00 | J735: 771.00 | K735: 647
A736: GERMANY | B736: WEST | C736: CONSUMER | D736: FURNITURE | E736: BED | F736: 1 | G736: Mar | H736: 1993 | I736: 126.00 | J736: 49.00 | K736: -77
A737: GERMANY | B737: WEST | C737: CONSUMER | D737: FURNITURE | E737: BED | F737: 2 | G737: Apr | H737: 1993 | I737: 440.00 | J737: 322.00 | K737: -118
A738: GERMANY | B738: WEST | C738: CONSUMER | D738: FURNITURE | E738: BED | F738: 2 | G738: May | H738: 1993 | I738: 881.00 | J738: 878.00 | K738: -3
A739: GERMANY | B739: WEST | C739: CONSUMER | D739: FURNITURE | E739: BED | F739: 2 | G739: Jun | H739: 1993 | I739: 292.00 | J739: 827.00 | K739: 535
A740: GERMANY | B740: WEST | C740: CONSUMER | D740: FURNITURE | E740: BED | F740: 3 | G740: Jul | H740: 1993 | I740: 873.00 | J740: 852.00 | K740: -21
A741: GERMANY | B741: WEST | C741: CONSUMER | D741: FURNITURE | E741: BED | F741: 3 | G741: Aug | H741: 1993 | I741: 357.00 | J741: 716.00 | K741: 359
A742: GERMANY | B742: WEST | C742: CONSUMER | D742: FURNITURE | E742: BED | F742: 3 | G742: Sep | H742: 1993 | I742: 247.00 | J742: 81.00 | K742: -166
A743: GERMANY | B743: WEST | C743: CONSUMER | D743: FURNITURE | E743: BED | F743: 4 | G743: Oct | H743: 1993 | I743: 18.00 | J743: 916.00 | K743: 898
A744: GERMANY | B744: WEST | C744: CONSUMER | D744: FURNITURE | E744: BED | F744: 4 | G744: Nov | H744: 1993 | I744: 395.00 | J744: 673.00 | K744: 278
A745: GERMANY | B745: WEST | C745: CONSUMER | D745: FURNITURE | E745: BED | F745: 4 | G745: Dec | H745: 1993 | I745: 620.00 | J745: 242.00 | K745: -378
A746: GERMANY | B746: WEST | C746: CONSUMER | D746: OFFICE | E746: TABLE | F746: 1 | G746: Jan | H746: 1993 | I746: 59.00 | J746: 505.00 | K746: 446
A747: GERMANY | B747: WEST | C747: CONSUMER | D747: OFFICE | E747: TABLE | F747: 1 | G747: Feb | H747: 1993 | I747: 790.00 | J747: 823.00 | K747: 33
A748: GERMANY | B748: WEST | C748: CONSUMER | D748: OFFICE | E748: TABLE | F748: 1 | G748: Mar | H748: 1993 | I748: 574.00 | J748: 891.00 | K748: 317
A749: GERMANY | B749: WEST | C749: CONSUMER | D749: OFFICE | E749: TABLE | F749: 2 | G749: Apr | H749: 1993 | I749: 96.00 | J749: 840.00 | K749: 744
A750: GERMANY | B750: WEST | C750: CONSUMER | D750: OFFICE | E750: TABLE | F750: 2 | G750: May | H750: 1993 | I750: 376.00 | J750: 436.00 | K750: 60
A751: GERMANY | B751: WEST | C751: CONSUMER | D751: OFFICE | E751: TABLE | F751: 2 | G751: Jun | H751: 1993 | I751: 352.00 | J751: 168.00 | K751: -184
A752: GERMANY | B752: WEST | C752: CONSUMER | D752: OFFICE | E752: TABLE | F752: 3 | G752: Jul | H752: 1993 | I752: 741.00 | J752: 177.00 | K752: -564
A753: GERMANY | B753: WEST | C753: CONSUMER | D753: OFFICE | E753: TABLE | F753: 3 | G753: Aug | H753: 1993 | I753: 12.00 | J753: 727.00 | K753: 715
A754: GERMANY | B754: WEST | C754: CONSUMER | D754: OFFICE | E754: TABLE | F754: 3 | G754: Sep | H754: 1993 | I754: 157.00 | J754: 278.00 | K754: 121
A755: GERMANY | B755: WEST | C755: CONSUMER | D755: OFFICE | E755: TABLE | F755: 4 | G755: Oct | H755: 1993 | I755: 10.00 | J755: 443.00 | K755: 433
A756: GERMANY | B756: WEST | C756: CONSUMER | D756: OFFICE | E756: TABLE | F756: 4 | G756: Nov | H756: 1993 | I756: 544.00 | J756: 905.00 | K756: 361
A757: GERMANY | B757: WEST | C757: CONSUMER | D757: OFFICE | E757: TABLE | F757: 4 | G757: Dec | H757: 1993 | I757: 817.00 | J757: 881.00 | K757: 64
A758: GERMANY | B758: WEST | C758: CONSUMER | D758: OFFICE | E758: CHAIR | F758: 1 | G758: Jan | H758: 1993 | I758: 278.00 | J758: 168.00 | K758: -110
A759: GERMANY | B759: WEST | C759: CONSUMER | D759: OFFICE | E759: CHAIR | F759: 1 | G759: Feb | H759: 1993 | I759: 376.00 | J759: 512.00 | K759: 136
A760: GERMANY | B760: WEST | C760: CONSUMER | D760: OFFICE | E760: CHAIR | F760: 1 | G760: Mar | H760: 1993 | I760: 104.00 | J760: 291.00 | K760: 187
A761: GERMANY | B761: WEST | C761: CONSUMER | D761: OFFICE | E761: CHAIR | F761: 2 | G761: Apr | H761: 1993 | I761: 543.00 | J761: 776.00 | K761: 233
A762: GERMANY | B762: WEST | C762: CONSUMER | D762: OFFICE | E762: CHAIR | F762: 2 | G762: May | H762: 1993 | I762: 798.00 | J762: 271.00 | K762: -527
A763: GERMANY | B763: WEST | C763: CONSUMER | D763: OFFICE | E763: CHAIR | F763: 2 | G763: Jun | H763: 1993 | I763: 333.00 | J763: 946.00 | K763: 613
A764: GERMANY | B764: WEST | C764: CONSUMER | D764: OFFICE | E764: CHAIR | F764: 3 | G764: Jul | H764: 1993 | I764: 833.00 | J764: 195.00 | K764: -638
A765: GERMANY | B765: WEST | C765: CONSUMER | D765: OFFICE | E765: CHAIR | F765: 3 | G765: Aug | H765: 1993 | I765: 132.00 | J765: 165.00 | K765: 33
A766: GERMANY | B766: WEST | C766: CONSUMER | D766: OFFICE | E766: CHAIR | F766: 3 | G766: Sep | H766: 1993 | I766: 629.00 | J766: 238.00 | K766: -391
A767: GERMANY | B767: WEST | C767: CONSUMER | D767: OFFICE | E767: CHAIR | F767: 4 | G767: Oct | H767: 1993 | I767: 337.00 | J767: 409.00 | K767: 72
A768: GERMANY | B768: WEST | C768: CONSUMER | D768: OFFICE | E768: CHAIR | F768: 4 | G768: Nov | H768: 1993 | I768: 300.00 | J768: 720.00 | K768: 420
A769: GERMANY | B769: WEST | C769: CONSUMER | D769: OFFICE | E769: CHAIR | F769: 4 | G769: Dec | H769: 1993 | I769: 470.00 | J769: 309.00 | K769: -161
A770: GERMANY | B770: WEST | C770: CONSUMER | D770: OFFICE | E770: DESK | F770: 1 | G770: Jan | H770: 1993 | I770: 898.00 | J770: 636.00 | K770: -262
A771: GERMANY | B771: WEST | C771: CONSUMER | D771: OFFICE | E771: DESK | F771: 1 | G771: Feb | H771: 1993 | I771: 330.00 | J771: 52.00 | K771: -278
A772: GERMANY | B772: WEST | C772: CONSUMER | D772: OFFICE | E772: DESK | F772: 1 | G772: Mar | H772: 1993 | I772: 603.00 | J772: 184.00 | K772: -419
A773: GERMANY | B773: WEST | C773: CONSUMER | D773: OFFICE | E773: DESK | F773: 2 | G773: Apr | H773: 1993 | I773: 280.00 | J773: 739.00 | K773: 459
A774: GERMANY | B774: WEST | C774: CONSUMER | D774: OFFICE | E774: DESK | F774: 2 | G774: May | H774: 1993 | I774: 507.00 | J774: 841.00 | K774: 334
A775: GERMANY | B775: WEST | C775: CONSUMER | D775: OFFICE | E775: DESK | F775: 2 | G775: Jun | H775: 1993 | I775: 202.00 | J775: 65.00 | K775: -137
A776: GERMANY | B776: WEST | C776: CONSUMER | D776: OFFICE | E776: DESK | F776: 3 | G776: Jul | H776: 1993 | I776: 513.00 | J776: 623.00 | K776: 110
A777: GERMANY | B777: WEST | C777: CONSUMER | D777: OFFICE | E777: DESK | F777: 3 | G777: Aug | H777: 1993 | I777: 132.00 | J777: 517.00 | K777: 385
A778: GERMANY | B778: WEST | C778: CONSUMER | D778: OFFICE | E778: DESK | F778: 3 | G778: Sep | H778: 1993 | I778: 21.00 | J778: 636.00 | K778: 615
A779: GERMANY | B779: WEST | C779: CONSUMER | D779: OFFICE | E779: DESK | F779: 4 | G779: Oct | H779: 1993 | I779: 657.00 | J779: 845.00 | K779: 188
A780: GERMANY | B780: WEST | C780: CONSUMER | D780: OFFICE | E780: DESK | F780: 4 | G780: Nov | H780: 1993 | I780: 195.00 | J780: 232.00 | K780: 37
A781: GERMANY | B781: WEST | C781: CONSUMER | D781: OFFICE | E781: DESK | F781: 4 | G781: Dec | H781: 1993 | I781: 323.00 | J781: 26.00 | K781: -297
A782: GERMANY | B782: WEST | C782: CONSUMER | D782: FURNITURE | E782: SOFA | F782: 1 | G782: Jan | H782: 1994 | I782: 633.00 | J782: 148.00 | K782: -485
A783: GERMANY | B783: WEST | C783: CONSUMER | D783: FURNITURE | E783: SOFA | F783: 1 | G783: Feb | H783: 1994 | I783: 636.00 | J783: 661.00 | K783: 25
A784: GERMANY | B784: WEST | C784: CONSUMER | D784: FURNITURE | E784: SOFA | F784: 1 | G784: Mar | H784: 1994 | I784: 138.00 | J784: 847.00 | K784: 709
A785: GERMANY | B785: WEST | C785: CONSUMER | D785: FURNITURE | E785: SOFA | F785: 2 | G785: Apr | H785: 1994 | I785: 481.00 | J785: 768.00 | K785: 287
A786: GERMANY | B786: WEST | C786: CONSUMER | D786: FURNITURE | E786: SOFA | F786: 2 | G786: May | H786: 1994 | I786: 408.00 | J786: 866.00 | K786: 458
A787: GERMANY | B787: WEST | C787: CONSUMER | D787: FURNITURE | E787: SOFA | F787: 2 | G787: Jun | H787: 1994 | I787: 130.00 | J787: 475.00 | K787: 345
A788: GERMANY | B788: WEST | C788: CONSUMER | D788: FURNITURE | E788: SOFA | F788: 3 | G788: Jul | H788: 1994 | I788: 813.00 | J788: 112.00 | K788: -701
A789: GERMANY | B789: WEST | C789: CONSUMER | D789: FURNITURE | E789: SOFA | F789: 3 | G789: Aug | H789: 1994 | I789: 661.00 | J789: 136.00 | K789: -525
A790: GERMANY | B790: WEST | C790: CONSUMER | D790: FURNITURE | E790: SOFA | F790: 3 | G790: Sep | H790: 1994 | I790: 311.00 | J790: 763.00 | K790: 452
A791: GERMANY | B791: WEST | C791: CONSUMER | D791: FURNITURE | E791: SOFA | F791: 4 | G791: Oct | H791: 1994 | I791: 872.00 | J791: 388.00 | K791: -484
A792: GERMANY | B792: WEST | C792: CONSUMER | D792: FURNITURE | E792: SOFA | F792: 4 | G792: Nov | H792: 1994 | I792: 643.00 | J792: 996.00 | K792: 353
A793: GERMANY | B793: WEST | C793: CONSUMER | D793: FURNITURE | E793: SOFA | F793: 4 | G793: Dec | H793: 1994 | I793: 174.00 | J793: 486.00 | K793: 312
A794: GERMANY | B794: WEST | C794: CONSUMER | D794: FURNITURE | E794: BED | F794: 1 | G794: Jan | H794: 1994 | I794: 946.00 | J794: 914.00 | K794: -32
A795: GERMANY | B795: WEST | C795: CONSUMER | D795: FURNITURE | E795: BED | F795: 1 | G795: Feb | H795: 1994 | I795: 72.00 | J795: 902.00 | K795: 830
A796: GERMANY | B796: WEST | C796: CONSUMER | D796: FURNITURE | E796: BED | F796: 1 | G796: Mar | H796: 1994 | I796: 691.00 | J796: 707.00 | K796: 16
A797: GERMANY | B797: WEST | C797: CONSUMER | D797: FURNITURE | E797: BED | F797: 2 | G797: Apr | H797: 1994 | I797: 95.00 | J797: 223.00 | K797: 128
A798: GERMANY | B798: WEST | C798: CONSUMER | D798: FURNITURE | E798: BED | F798: 2 | G798: May | H798: 1994 | I798: 878.00 | J798: 619.00 | K798: -259
A799: GERMANY | B799: WEST | C799: CONSUMER | D799: FURNITURE | E799: BED | F799: 2 | G799: Jun | H799: 1994 | I799: 757.00 | J799: 254.00 | K799: -503
A800: GERMANY | B800: WEST | C800: CONSUMER | D800: FURNITURE | E800: BED | F800: 3 | G800: Jul | H800: 1994 | I800: 898.00 | J800: 688.00 | K800: -210
A801: GERMANY | B801: WEST | C801: CONSUMER | D801: FURNITURE | E801: BED | F801: 3 | G801: Aug | H801: 1994 | I801: 172.00 | J801: 477.00 | K801: 305
A802: GERMANY | B802: WEST | C802: CONSUMER | D802: FURNITURE | E802: BED | F802: 3 | G802: Sep | H802: 1994 | I802: 419.00 | J802: 280.00 | K802: -139
A803: GERMANY | B803: WEST | C803: CONSUMER | D803: FURNITURE | E803: BED | F803: 4 | G803: Oct | H803: 1994 | I803: 849.00 | J803: 546.00 | K803: -303
A804: GERMANY | B804: WEST | C804: CONSUMER | D804: FURNITURE | E804: BED | F804: 4 | G804: Nov | H804: 1994 | I804: 807.00 | J804: 630.00 | K804: -177
A805: GERMANY | B805: WEST | C805: CONSUMER | D805: FURNITURE | E805: BED | F805: 4 | G805: Dec | H805: 1994 | I805: 599.00 | J805: 455.00 | K805: -144
A806: GERMANY | B806: WEST | C806: CONSUMER | D806: OFFICE | E806: TABLE | F806: 1 | G806: Jan | H806: 1994 | I806: 754.00 | J806: 507.00 | K806: -247
A807: GERMANY | B807: WEST | C807: CONSUMER | D807: OFFICE | E807: TABLE | F807: 1 | G807: Feb | H807: 1994 | I807: 425.00 | J807: 363.00 | K807: -62
A808: GERMANY | B808: WEST | C808: CONSUMER | D808: OFFICE | E808: TABLE | F808: 1 | G808: Mar | H808: 1994 | I808: 492.00 | J808: 603.00 | K808: 111
A809: GERMANY | B809: WEST | C809: CONSUMER | D809: OFFICE | E809: TABLE | F809: 2 | G809: Apr | H809: 1994 | I809: 485.00 | J809: 473.00 | K809: -12
A810: GERMANY | B810: WEST | C810: CONSUMER | D810: OFFICE | E810: TABLE | F810: 2 | G810: May | H810: 1994 | I810: 369.00 | J810: 128.00 | K810: -241
A811: GERMANY | B811: WEST | C811: CONSUMER | D811: OFFICE | E811: TABLE | F811: 2 | G811: Jun | H811: 1994 | I811: 560.00 | J811: 105.00 | K811: -455
A812: GERMANY | B812: WEST | C812: CONSUMER | D812: OFFICE | E812: TABLE | F812: 3 | G812: Jul | H812: 1994 | I812: 651.00 | J812: 325.00 | K812: -326
A813: GERMANY | B813: WEST | C813: CONSUMER | D813: OFFICE | E813: TABLE | F813: 3 | G813: Aug | H813: 1994 | I813: 326.00 | J813: 711.00 | K813: 385
A814: GERMANY | B814: WEST | C814: CONSUMER | D814: OFFICE | E814: TABLE | F814: 3 | G814: Sep | H814: 1994 | I814: 180.00 | J814: 983.00 | K814: 803
A815: GERMANY | B815: WEST | C815: CONSUMER | D815: OFFICE | E815: TABLE | F815: 4 | G815: Oct | H815: 1994 | I815: 935.00 | J815: 241.00 | K815: -694
A816: GERMANY | B816: WEST | C816: CONSUMER | D816: OFFICE | E816: TABLE | F816: 4 | G816: Nov | H816: 1994 | I816: 403.00 | J816: 71.00 | K816: -332
A817: GERMANY | B817: WEST | C817: CONSUMER | D817: OFFICE | E817: TABLE | F817: 4 | G817: Dec | H817: 1994 | I817: 345.00 | J817: 395.00 | K817: 50
A818: GERMANY | B818: WEST | C818: CONSUMER | D818: OFFICE | E818: CHAIR | F818: 1 | G818: Jan | H818: 1994 | I818: 875.00 | J818: 812.00 | K818: -63
A819: GERMANY | B819: WEST | C819: CONSUMER | D819: OFFICE | E819: CHAIR | F819: 1 | G819: Feb | H819: 1994 | I819: 237.00 | J819: 441.00 | K819: 204
A820: GERMANY | B820: WEST | C820: CONSUMER | D820: OFFICE | E820: CHAIR | F820: 1 | G820: Mar | H820: 1994 | I820: 272.00 | J820: 500.00 | K820: 228
A821: GERMANY | B821: WEST | C821: CONSUMER | D821: OFFICE | E821: CHAIR | F821: 2 | G821: Apr | H821: 1994 | I821: 860.00 | J821: 517.00 | K821: -343
A822: GERMANY | B822: WEST | C822: CONSUMER | D822: OFFICE | E822: CHAIR | F822: 2 | G822: May | H822: 1994 | I822: 415.00 | J822: 924.00 | K822: 509
A823: GERMANY | B823: WEST | C823: CONSUMER | D823: OFFICE | E823: CHAIR | F823: 2 | G823: Jun | H823: 1994 | I823: 140.00 | J823: 572.00 | K823: 432
A824: GERMANY | B824: WEST | C824: CONSUMER | D824: OFFICE | E824: CHAIR | F824: 3 | G824: Jul | H824: 1994 | I824: 367.00 | J824: 768.00 | K824: 401
A825: GERMANY | B825: WEST | C825: CONSUMER | D825: OFFICE | E825: CHAIR | F825: 3 | G825: Aug | H825: 1994 | I825: 195.00 | J825: 692.00 | K825: 497
A826: GERMANY | B826: WEST | C826: CONSUMER | D826: OFFICE | E826: CHAIR | F826: 3 | G826: Sep | H826: 1994 | I826: 245.00 | J826: 28.00 | K826: -217
A827: GERMANY | B827: WEST | C827: CONSUMER | D827: OFFICE | E827: CHAIR | F827: 4 | G827: Oct | H827: 1994 | I827: 285.00 | J827: 202.00 | K827: -83
A828: GERMANY | B828: WEST | C828: CONSUMER | D828: OFFICE | E828: CHAIR | F828: 4 | G828: Nov | H828: 1994 | I828: 98.00 | J828: 76.00 | K828: -22
A829: GERMANY | B829: WEST | C829: CONSUMER | D829: OFFICE | E829: CHAIR | F829: 4 | G829: Dec | H829: 1994 | I829: 932.00 | J829: 421.00 | K829: -511
A830: GERMANY | B830: WEST | C830: CONSUMER | D830: OFFICE | E830: DESK | F830: 1 | G830: Jan | H830: 1994 | I830: 299.00 | J830: 680.00 | K830: 381
A831: GERMANY | B831: WEST | C831: CONSUMER | D831: OFFICE | E831: DESK | F831: 1 | G831: Feb | H831: 1994 | I831: 811.00 | J831: 364.00 | K831: -447
A832: GERMANY | B832: WEST | C832: CONSUMER | D832: OFFICE | E832: DESK | F832: 1 | G832: Mar | H832: 1994 | I832: 739.00 | J832: 572.00 | K832: -167
A833: GERMANY | B833: WEST | C833: CONSUMER | D833: OFFICE | E833: DESK | F833: 2 | G833: Apr | H833: 1994 | I833: 889.00 | J833: 145.00 | K833: -744
A834: GERMANY | B834: WEST | C834: CONSUMER | D834: OFFICE | E834: DESK | F834: 2 | G834: May | H834: 1994 | I834: 189.00 | J834: 644.00 | K834: 455
A835: GERMANY | B835: WEST | C835: CONSUMER | D835: OFFICE | E835: DESK | F835: 2 | G835: Jun | H835: 1994 | I835: 698.00 | J835: 87.00 | K835: -611
A836: GERMANY | B836: WEST | C836: CONSUMER | D836: OFFICE | E836: DESK | F836: 3 | G836: Jul | H836: 1994 | I836: 646.00 | J836: 620.00 | K836: -26
A837: GERMANY | B837: WEST | C837: CONSUMER | D837: OFFICE | E837: DESK | F837: 3 | G837: Aug | H837: 1994 | I837: 562.00 | J837: 535.00 | K837: -27
A838: GERMANY | B838: WEST | C838: CONSUMER | D838: OFFICE | E838: DESK | F838: 3 | G838: Sep | H838: 1994 | I838: 753.00 | J838: 661.00 | K838: -92
A839: GERMANY | B839: WEST | C839: CONSUMER | D839: OFFICE | E839: DESK | F839: 4 | G839: Oct | H839: 1994 | I839: 425.00 | J839: 884.00 | K839: 459
A840: GERMANY | B840: WEST | C840: CONSUMER | D840: OFFICE | E840: DESK | F840: 4 | G840: Nov | H840: 1994 | I840: 693.00 | J840: 689.00 | K840: -4
A841: GERMANY | B841: WEST | C841: CONSUMER | D841: OFFICE | E841: DESK | F841: 4 | G841: Dec | H841: 1994 | I841: 941.00 | J841: 646.00 | K841: -295
A842: GERMANY | B842: WEST | C842: EDUCATION | D842: FURNITURE | E842: SOFA | F842: 1 | G842: Jan | H842: 1993 | I842: 739.00 | J842: 982.00 | K842: 243
A843: GERMANY | B843: WEST | C843: EDUCATION | D843: FURNITURE | E843: SOFA | F843: 1 | G843: Feb | H843: 1993 | I843: 683.00 | J843: 593.00 | K843: -90
A844: GERMANY | B844: WEST | C844: EDUCATION | D844: FURNITURE | E844: SOFA | F844: 1 | G844: Mar | H844: 1993 | I844: 610.00 | J844: 702.00 | K844: 92
A845: GERMANY | B845: WEST | C845: EDUCATION | D845: FURNITURE | E845: SOFA | F845: 2 | G845: Apr | H845: 1993 | I845: 248.00 | J845: 528.00 | K845: 280
A846: GERMANY | B846: WEST | C846: EDUCATION | D846: FURNITURE | E846: SOFA | F846: 2 | G846: May | H846: 1993 | I846: 530.00 | J846: 873.00 | K846: 343
A847: GERMANY | B847: WEST | C847: EDUCATION | D847: FURNITURE | E847: SOFA | F847: 2 | G847: Jun | H847: 1993 | I847: 889.00 | J847: 301.00 | K847: -588
A848: GERMANY | B848: WEST | C848: EDUCATION | D848: FURNITURE | E848: SOFA | F848: 3 | G848: Jul | H848: 1993 | I848: 245.00 | J848: 769.00 | K848: 524
A849: GERMANY | B849: WEST | C849: EDUCATION | D849: FURNITURE | E849: SOFA | F849: 3 | G849: Aug | H849: 1993 | I849: 473.00 | J849: 724.00 | K849: 251
A850: GERMANY | B850: WEST | C850: EDUCATION | D850: FURNITURE | E850: SOFA | F850: 3 | G850: Sep | H850: 1993 | I850: 938.00 | J850: 466.00 | K850: -472
A851: GERMANY | B851: WEST | C851: EDUCATION | D851: FURNITURE | E851: SOFA | F851: 4 | G851: Oct | H851: 1993 | I851: 150.00 | J851: 774.00 | K851: 624
A852: GERMANY | B852: WEST | C852: EDUCATION | D852: FURNITURE | E852: SOFA | F852: 4 | G852: Nov | H852: 1993 | I852: 772.00 | J852: 111.00 | K852: -661
A853: GERMANY | B853: WEST | C853: EDUCATION | D853: FURNITURE | E853: SOFA | F853: 4 | G853: Dec | H853: 1993 | I853: 201.00 | J853: 954.00 | K853: 753
A854: GERMANY | B854: WEST | C854: EDUCATION | D854: FURNITURE | E854: BED | F854: 1 | G854: Jan | H854: 1993 | I854: 239.00 | J854: 597.00 | K854: 358
A855: GERMANY | B855: WEST | C855: EDUCATION | D855: FURNITURE | E855: BED | F855: 1 | G855: Feb | H855: 1993 | I855: 637.00 | J855: 649.00 | K855: 12
A856: GERMANY | B856: WEST | C856: EDUCATION | D856: FURNITURE | E856: BED | F856: 1 | G856: Mar | H856: 1993 | I856: 938.00 | J856: 3.00 | K856: -935
A857: GERMANY | B857: WEST | C857: EDUCATION | D857: FURNITURE | E857: BED | F857: 2 | G857: Apr | H857: 1993 | I857: 788.00 | J857: 731.00 | K857: -57
A858: GERMANY | B858: WEST | C858: EDUCATION | D858: FURNITURE | E858: BED | F858: 2 | G858: May | H858: 1993 | I858: 399.00 | J858: 181.00 | K858: -218
A859: GERMANY | B859: WEST | C859: EDUCATION | D859: FURNITURE | E859: BED | F859: 2 | G859: Jun | H859: 1993 | I859: 576.00 | J859: 468.00 | K859: -108
A860: GERMANY | B860: WEST | C860: EDUCATION | D860: FURNITURE | E860: BED | F860: 3 | G860: Jul | H860: 1993 | I860: 187.00 | J860: 891.00 | K860: 704
A861: GERMANY | B861: WEST | C861: EDUCATION | D861: FURNITURE | E861: BED | F861: 3 | G861: Aug | H861: 1993 | I861: 703.00 | J861: 226.00 | K861: -477
A862: GERMANY | B862: WEST | C862: EDUCATION | D862: FURNITURE | E862: BED | F862: 3 | G862: Sep | H862: 1993 | I862: 455.00 | J862: 28.00 | K862: -427
A863: GERMANY | B863: WEST | C863: EDUCATION | D863: FURNITURE | E863: BED | F863: 4 | G863: Oct | H863: 1993 | I863: 244.00 | J863: 609.00 | K863: 365
A864: GERMANY | B864: WEST | C864: EDUCATION | D864: FURNITURE | E864: BED | F864: 4 | G864: Nov | H864: 1993 | I864: 868.00 | J864: 224.00 | K864: -644
A865: GERMANY | B865: WEST | C865: EDUCATION | D865: FURNITURE | E865: BED | F865: 4 | G865: Dec | H865: 1993 | I865: 353.00 | J865: 230.00 | K865: -123
A866: GERMANY | B866: WEST | C866: EDUCATION | D866: OFFICE | E866: TABLE | F866: 1 | G866: Jan | H866: 1993 | I866: 441.00 | J866: 222.00 | K866: -219
A867: GERMANY | B867: WEST | C867: EDUCATION | D867: OFFICE | E867: TABLE | F867: 1 | G867: Feb | H867: 1993 | I867: 183.00 | J867: 678.00 | K867: 495
A868: GERMANY | B868: WEST | C868: EDUCATION | D868: OFFICE | E868: TABLE | F868: 1 | G868: Mar | H868: 1993 | I868: 459.00 | J868: 25.00 | K868: -434
A869: GERMANY | B869: WEST | C869: EDUCATION | D869: OFFICE | E869: TABLE | F869: 2 | G869: Apr | H869: 1993 | I869: 810.00 | J869: 57.00 | K869: -753
A870: GERMANY | B870: WEST | C870: EDUCATION | D870: OFFICE | E870: TABLE | F870: 2 | G870: May | H870: 1993 | I870: 268.00 | J870: 981.00 | K870: 713
A871: GERMANY | B871: WEST | C871: EDUCATION | D871: OFFICE | E871: TABLE | F871: 2 | G871: Jun | H871: 1993 | I871: 916.00 | J871: 740.00 | K871: -176
A872: GERMANY | B872: WEST | C872: EDUCATION | D872: OFFICE | E872: TABLE | F872: 3 | G872: Jul | H872: 1993 | I872: 742.00 | J872: 408.00 | K872: -334
A873: GERMANY | B873: WEST | C873: EDUCATION | D873: OFFICE | E873: TABLE | F873: 3 | G873: Aug | H873: 1993 | I873: 522.00 | J873: 966.00 | K873: 444
A874: GERMANY | B874: WEST | C874: EDUCATION | D874: OFFICE | E874: TABLE | F874: 3 | G874: Sep | H874: 1993 | I874: 299.00 | J874: 107.00 | K874: -192
A875: GERMANY | B875: WEST | C875: EDUCATION | D875: OFFICE | E875: TABLE | F875: 4 | G875: Oct | H875: 1993 | I875: 677.00 | J875: 488.00 | K875: -189
A876: GERMANY | B876: WEST | C876: EDUCATION | D876: OFFICE | E876: TABLE | F876: 4 | G876: Nov | H876: 1993 | I876: 709.00 | J876: 759.00 | K876: 50
A877: GERMANY | B877: WEST | C877: EDUCATION | D877: OFFICE | E877: TABLE | F877: 4 | G877: Dec | H877: 1993 | I877: 310.00 | J877: 504.00 | K877: 194
A878: GERMANY | B878: WEST | C878: EDUCATION | D878: OFFICE | E878: CHAIR | F878: 1 | G878: Jan | H878: 1993 | I878: 591.00 | J878: 774.00 | K878: 183
A879: GERMANY | B879: WEST | C879: EDUCATION | D879: OFFICE | E879: CHAIR | F879: 1 | G879: Feb | H879: 1993 | I879: 378.00 | J879: 645.00 | K879: 267
A880: GERMANY | B880: WEST | C880: EDUCATION | D880: OFFICE | E880: CHAIR | F880: 1 | G880: Mar | H880: 1993 | I880: 942.00 | J880: 986.00 | K880: 44
A881: GERMANY | B881: WEST | C881: EDUCATION | D881: OFFICE | E881: CHAIR | F881: 2 | G881: Apr | H881: 1993 | I881: 686.00 | J881: 296.00 | K881: -390
A882: GERMANY | B882: WEST | C882: EDUCATION | D882: OFFICE | E882: CHAIR | F882: 2 | G882: May | H882: 1993 | I882: 720.00 | J882: 936.00 | K882: 216
A883: GERMANY | B883: WEST | C883: EDUCATION | D883: OFFICE | E883: CHAIR | F883: 2 | G883: Jun | H883: 1993 | I883: 546.00 | J883: 341.00 | K883: -205
A884: GERMANY | B884: WEST | C884: EDUCATION | D884: OFFICE | E884: CHAIR | F884: 3 | G884: Jul | H884: 1993 | I884: 845.00 | J884: 32.00 | K884: -813
A885: GERMANY | B885: WEST | C885: EDUCATION | D885: OFFICE | E885: CHAIR | F885: 3 | G885: Aug | H885: 1993 | I885: 667.00 | J885: 277.00 | K885: -390
A886: GERMANY | B886: WEST | C886: EDUCATION | D886: OFFICE | E886: CHAIR | F886: 3 | G886: Sep | H886: 1993 | I886: 627.00 | J886: 548.00 | K886: -79
A887: GERMANY | B887: WEST | C887: EDUCATION | D887: OFFICE | E887: CHAIR | F887: 4 | G887: Oct | H887: 1993 | I887: 142.00 | J887: 727.00 | K887: 585
A888: GERMANY | B888: WEST | C888: EDUCATION | D888: OFFICE | E888: CHAIR | F888: 4 | G888: Nov | H888: 1993 | I888: 655.00 | J888: 812.00 | K888: 157
A889: GERMANY | B889: WEST | C889: EDUCATION | D889: OFFICE | E889: CHAIR | F889: 4 | G889: Dec | H889: 1993 | I889: 556.00 | J889: 168.00 | K889: -388
A890: GERMANY | B890: WEST | C890: EDUCATION | D890: OFFICE | E890: DESK | F890: 1 | G890: Jan | H890: 1993 | I890: 285.00 | J890: 100.00 | K890: -185
A891: GERMANY | B891: WEST | C891: EDUCATION | D891: OFFICE | E891: DESK | F891: 1 | G891: Feb | H891: 1993 | I891: 94.00 | J891: 465.00 | K891: 371
A892: GERMANY | B892: WEST | C892: EDUCATION | D892: OFFICE | E892: DESK | F892: 1 | G892: Mar | H892: 1993 | I892: 561.00 | J892: 350.00 | K892: -211
A893: GERMANY | B893: WEST | C893: EDUCATION | D893: OFFICE | E893: DESK | F893: 2 | G893: Apr | H893: 1993 | I893: 143.00 | J893: 991.00 | K893: 848
A894: GERMANY | B894: WEST | C894: EDUCATION | D894: OFFICE | E894: DESK | F894: 2 | G894: May | H894: 1993 | I894: 95.00 | J894: 910.00 | K894: 815
A895: GERMANY | B895: WEST | C895: EDUCATION | D895: OFFICE | E895: DESK | F895: 2 | G895: Jun | H895: 1993 | I895: 341.00 | J895: 206.00 | K895: -135
A896: GERMANY | B896: WEST | C896: EDUCATION | D896: OFFICE | E896: DESK | F896: 3 | G896: Jul | H896: 1993 | I896: 388.00 | J896: 263.00 | K896: -125
A897: GERMANY | B897: WEST | C897: EDUCATION | D897: OFFICE | E897: DESK | F897: 3 | G897: Aug | H897: 1993 | I897: 272.00 | J897: 374.00 | K897: 102
A898: GERMANY | B898: WEST | C898: EDUCATION | D898: OFFICE | E898: DESK | F898: 3 | G898: Sep | H898: 1993 | I898: 890.00 | J898: 875.00 | K898: -15
A899: GERMANY | B899: WEST | C899: EDUCATION | D899: OFFICE | E899: DESK | F899: 4 | G899: Oct | H899: 1993 | I899: 734.00 | J899: 810.00 | K899: 76
A900: GERMANY | B900: WEST | C900: EDUCATION | D900: OFFICE | E900: DESK | F900: 4 | G900: Nov | H900: 1993 | I900: 364.00 | J900: 398.00 | K900: 34
A901: GERMANY | B901: WEST | C901: EDUCATION | D901: OFFICE | E901: DESK | F901: 4 | G901: Dec | H901: 1993 | I901: 619.00 | J901: 565.00 | K901: -54
A902: GERMANY | B902: WEST | C902: EDUCATION | D902: FURNITURE | E902: SOFA | F902: 1 | G902: Jan | H902: 1994 | I902: 945.00 | J902: 780.00 | K902: -165
A903: GERMANY | B903: WEST | C903: EDUCATION | D903: FURNITURE | E903: SOFA | F903: 1 | G903: Feb | H903: 1994 | I903: 177.00 | J903: 210.00 | K903: 33
A904: GERMANY | B904: WEST | C904: EDUCATION | D904: FURNITURE | E904: SOFA | F904: 1 | G904: Mar | H904: 1994 | I904: 378.00 | J904: 93.00 | K904: -285
A905: GERMANY | B905: WEST | C905: EDUCATION | D905: FURNITURE | E905: SOFA | F905: 2 | G905: Apr | H905: 1994 | I905: 83.00 | J905: 332.00 | K905: 249
A906: GERMANY | B906: WEST | C906: EDUCATION | D906: FURNITURE | E906: SOFA | F906: 2 | G906: May | H906: 1994 | I906: 803.00 | J906: 186.00 | K906: -617
A907: GERMANY | B907: WEST | C907: EDUCATION | D907: FURNITURE | E907: SOFA | F907: 2 | G907: Jun | H907: 1994 | I907: 398.00 | J907: 782.00 | K907: 384
A908: GERMANY | B908: WEST | C908: EDUCATION | D908: FURNITURE | E908: SOFA | F908: 3 | G908: Jul | H908: 1994 | I908: 215.00 | J908: 41.00 | K908: -174
A909: GERMANY | B909: WEST | C909: EDUCATION | D909: FURNITURE | E909: SOFA | F909: 3 | G909: Aug | H909: 1994 | I909: 194.00 | J909: 222.00 | K909: 28
A910: GERMANY | B910: WEST | C910: EDUCATION | D910: FURNITURE | E910: SOFA | F910: 3 | G910: Sep | H910: 1994 | I910: 287.00 | J910: 992.00 | K910: 705
A911: GERMANY | B911: WEST | C911: EDUCATION | D911: FURNITURE | E911: SOFA | F911: 4 | G911: Oct | H911: 1994 | I911: 410.00 | J911: 477.00 | K911: 67
A912: GERMANY | B912: WEST | C912: EDUCATION | D912: FURNITURE | E912: SOFA | F912: 4 | G912: Nov | H912: 1994 | I912: 50.00 | J912: 948.00 | K912: 898
A913: GERMANY | B913: WEST | C913: EDUCATION | D913: FURNITURE | E913: SOFA | F913: 4 | G913: Dec | H913: 1994 | I913: 204.00 | J913: 817.00 | K913: 613
A914: GERMANY | B914: WEST | C914: EDUCATION | D914: FURNITURE | E914: BED | F914: 1 | G914: Jan | H914: 1994 | I914: 101.00 | J914: 216.00 | K914: 115
A915: GERMANY | B915: WEST | C915: EDUCATION | D915: FURNITURE | E915: BED | F915: 1 | G915: Feb | H915: 1994 | I915: 924.00 | J915: 282.00 | K915: -642
A916: GERMANY | B916: WEST | C916: EDUCATION | D916: FURNITURE | E916: BED | F916: 1 | G916: Mar | H916: 1994 | I916: 144.00 | J916: 501.00 | K916: 357
A917: GERMANY | B917: WEST | C917: EDUCATION | D917: FURNITURE | E917: BED | F917: 2 | G917: Apr | H917: 1994 | I917: 0.00 | J917: 320.00 | K917: 320
A918: GERMANY | B918: WEST | C918: EDUCATION | D918: FURNITURE | E918: BED | F918: 2 | G918: May | H918: 1994 | I918: 910.00 | J918: 720.00 | K918: -190
A919: GERMANY | B919: WEST | C919: EDUCATION | D919: FURNITURE | E919: BED | F919: 2 | G919: Jun | H919: 1994 | I919: 259.00 | J919: 464.00 | K919: 205
A920: GERMANY | B920: WEST | C920: EDUCATION | D920: FURNITURE | E920: BED | F920: 3 | G920: Jul | H920: 1994 | I920: 107.00 | J920: 363.00 | K920: 256
A921: GERMANY | B921: WEST | C921: EDUCATION | D921: FURNITURE | E921: BED | F921: 3 | G921: Aug | H921: 1994 | I921: 63.00 | J921: 49.00 | K921: -14
A922: GERMANY | B922: WEST | C922: EDUCATION | D922: FURNITURE | E922: BED | F922: 3 | G922: Sep | H922: 1994 | I922: 270.00 | J922: 223.00 | K922: -47
A923: GERMANY | B923: WEST | C923: EDUCATION | D923: FURNITURE | E923: BED | F923: 4 | G923: Oct | H923: 1994 | I923: 554.00 | J923: 452.00 | K923: -102
A924: GERMANY | B924: WEST | C924: EDUCATION | D924: FURNITURE | E924: BED | F924: 4 | G924: Nov | H924: 1994 | I924: 154.00 | J924: 210.00 | K924: 56
A925: GERMANY | B925: WEST | C925: EDUCATION | D925: FURNITURE | E925: BED | F925: 4 | G925: Dec | H925: 1994 | I925: 205.00 | J925: 444.00 | K925: 239
A926: GERMANY | B926: WEST | C926: EDUCATION | D926: OFFICE | E926: TABLE | F926: 1 | G926: Jan | H926: 1994 | I926: 160.00 | J926: 99.00 | K926: -61
A927: GERMANY | B927: WEST | C927: EDUCATION | D927: OFFICE | E927: TABLE | F927: 1 | G927: Feb | H927: 1994 | I927: 698.00 | J927: 503.00 | K927: -195
A928: GERMANY | B928: WEST | C928: EDUCATION | D928: OFFICE | E928: TABLE | F928: 1 | G928: Mar | H928: 1994 | I928: 540.00 | J928: 724.00 | K928: 184
A929: GERMANY | B929: WEST | C929: EDUCATION | D929: OFFICE | E929: TABLE | F929: 2 | G929: Apr | H929: 1994 | I929: 901.00 | J929: 309.00 | K929: -592
A930: GERMANY | B930: WEST | C930: EDUCATION | D930: OFFICE | E930: TABLE | F930: 2 | G930: May | H930: 1994 | I930: 34.00 | J930: 625.00 | K930: 591
A931: GERMANY | B931: WEST | C931: EDUCATION | D931: OFFICE | E931: TABLE | F931: 2 | G931: Jun | H931: 1994 | I931: 536.00 | J931: 294.00 | K931: -242
A932: GERMANY | B932: WEST | C932: EDUCATION | D932: OFFICE | E932: TABLE | F932: 3 | G932: Jul | H932: 1994 | I932: 780.00 | J932: 890.00 | K932: 110
A933: GERMANY | B933: WEST | C933: EDUCATION | D933: OFFICE | E933: TABLE | F933: 3 | G933: Aug | H933: 1994 | I933: 716.00 | J933: 501.00 | K933: -215
A934: GERMANY | B934: WEST | C934: EDUCATION | D934: OFFICE | E934: TABLE | F934: 3 | G934: Sep | H934: 1994 | I934: 532.00 | J934: 34.00 | K934: -498
A935: GERMANY | B935: WEST | C935: EDUCATION | D935: OFFICE | E935: TABLE | F935: 4 | G935: Oct | H935: 1994 | I935: 871.00 | J935: 203.00 | K935: -668
A936: GERMANY | B936: WEST | C936: EDUCATION | D936: OFFICE | E936: TABLE | F936: 4 | G936: Nov | H936: 1994 | I936: 199.00 | J936: 140.00 | K936: -59
A937: GERMANY | B937: WEST | C937: EDUCATION | D937: OFFICE | E937: TABLE | F937: 4 | G937: Dec | H937: 1994 | I937: 845.00 | J937: 845.00 | K937: 0
A938: GERMANY | B938: WEST | C938: EDUCATION | D938: OFFICE | E938: CHAIR | F938: 1 | G938: Jan | H938: 1994 | I938: 459.00 | J938: 150.00 | K938: -309
A939: GERMANY | B939: WEST | C939: EDUCATION | D939: OFFICE | E939: CHAIR | F939: 1 | G939: Feb | H939: 1994 | I939: 89.00 | J939: 136.00 | K939: 47
A940: GERMANY | B940: WEST | C940: EDUCATION | D940: OFFICE | E940: CHAIR | F940: 1 | G940: Mar | H940: 1994 | I940: 726.00 | J940: 695.00 | K940: -31
A941: GERMANY | B941: WEST | C941: EDUCATION | D941: OFFICE | E941: CHAIR | F941: 2 | G941: Apr | H941: 1994 | I941: 38.00 | J941: 363.00 | K941: 325
A942: GERMANY | B942: WEST | C942: EDUCATION | D942: OFFICE | E942: CHAIR | F942: 2 | G942: May | H942: 1994 | I942: 60.00 | J942: 853.00 | K942: 793
A943: GERMANY | B943: WEST | C943: EDUCATION | D943: OFFICE | E943: CHAIR | F943: 2 | G943: Jun | H943: 1994 | I943: 369.00 | J943: 621.00 | K943: 252
A944: GERMANY | B944: WEST | C944: EDUCATION | D944: OFFICE | E944: CHAIR | F944: 3 | G944: Jul | H944: 1994 | I944: 381.00 | J944: 764.00 | K944: 383
A945: GERMANY | B945: WEST | C945: EDUCATION | D945: OFFICE | E945: CHAIR | F945: 3 | G945: Aug | H945: 1994 | I945: 465.00 | J945: 669.00 | K945: 204
A946: GERMANY | B946: WEST | C946: EDUCATION | D946: OFFICE | E946: CHAIR | F946: 3 | G946: Sep | H946: 1994 | I946: 981.00 | J946: 772.00 | K946: -209
A947: GERMANY | B947: WEST | C947: EDUCATION | D947: OFFICE | E947: CHAIR | F947: 4 | G947: Oct | H947: 1994 | I947: 758.00 | J947: 228.00 | K947: -530
A948: GERMANY | B948: WEST | C948: EDUCATION | D948: OFFICE | E948: CHAIR | F948: 4 | G948: Nov | H948: 1994 | I948: 31.00 | J948: 261.00 | K948: 230
A949: GERMANY | B949: WEST | C949: EDUCATION | D949: OFFICE | E949: CHAIR | F949: 4 | G949: Dec | H949: 1994 | I949: 237.00 | J949: 821.00 | K949: 584
A950: GERMANY | B950: WEST | C950: EDUCATION | D950: OFFICE | E950: DESK | F950: 1 | G950: Jan | H950: 1994 | I950: 517.00 | J950: 417.00 | K950: -100
A951: GERMANY | B951: WEST | C951: EDUCATION | D951: OFFICE | E951: DESK | F951: 1 | G951: Feb | H951: 1994 | I951: 781.00 | J951: 291.00 | K951: -490
A952: GERMANY | B952: WEST | C952: EDUCATION | D952: OFFICE | E952: DESK | F952: 1 | G952: Mar | H952: 1994 | I952: 327.00 | J952: 251.00 | K952: -76
A953: GERMANY | B953: WEST | C953: EDUCATION | D953: OFFICE | E953: DESK | F953: 2 | G953: Apr | H953: 1994 | I953: 48.00 | J953: 449.00 | K953: 401
A954: GERMANY | B954: WEST | C954: EDUCATION | D954: OFFICE | E954: DESK | F954: 2 | G954: May | H954: 1994 | I954: 809.00 | J954: 774.00 | K954: -35
A955: GERMANY | B955: WEST | C955: EDUCATION | D955: OFFICE | E955: DESK | F955: 2 | G955: Jun | H955: 1994 | I955: 73.00 | J955: 386.00 | K955: 313
A956: GERMANY | B956: WEST | C956: EDUCATION | D956: OFFICE | E956: DESK | F956: 3 | G956: Jul | H956: 1994 | I956: 936.00 | J956: 22.00 | K956: -914
A957: GERMANY | B957: WEST | C957: EDUCATION | D957: OFFICE | E957: DESK | F957: 3 | G957: Aug | H957: 1994 | I957: 400.00 | J957: 940.00 | K957: 540
A958: GERMANY | B958: WEST | C958: EDUCATION | D958: OFFICE | E958: DESK | F958: 3 | G958: Sep | H958: 1994 | I958: 736.00 | J958: 132.00 | K958: -604
A959: GERMANY | B959: WEST | C959: EDUCATION | D959: OFFICE | E959: DESK | F959: 4 | G959: Oct | H959: 1994 | I959: 211.00 | J959: 103.00 | K959: -108
A960: GERMANY | B960: WEST | C960: EDUCATION | D960: OFFICE | E960: DESK | F960: 4 | G960: Nov | H960: 1994 | I960: 271.00 | J960: 152.00 | K960: -119
A961: GERMANY | B961: WEST | C961: EDUCATION | D961: OFFICE | E961: DESK | F961: 4 | G961: Dec | H961: 1994 | I961: 855.00 | J961: 952.00 | K961: 97
A962: U.S.A. | B962: EAST | C962: CONSUMER | D962: FURNITURE | E962: SOFA | F962: 1 | G962: Jan | H962: 1993 | I962: 204.00 | J962: 521.00 | K962: 317
A963: U.S.A. | B963: EAST | C963: CONSUMER | D963: FURNITURE | E963: SOFA | F963: 1 | G963: Feb | H963: 1993 | I963: 805.00 | J963: 751.00 | K963: -54
A964: U.S.A. | B964: EAST | C964: CONSUMER | D964: FURNITURE | E964: SOFA | F964: 1 | G964: Mar | H964: 1993 | I964: 549.00 | J964: 45.00 | K964: -504
A965: U.S.A. | B965: EAST | C965: CONSUMER | D965: FURNITURE | E965: SOFA | F965: 2 | G965: Apr | H965: 1993 | I965: 912.00 | J965: 144.00 | K965: -768
A966: U.S.A. | B966: EAST | C966: CONSUMER | D966: FURNITURE | E966: SOFA | F966: 2 | G966: May | H966: 1993 | I966: 427.00 | J966: 119.00 | K966: -308
A967: U.S.A. | B967: EAST | C967: CONSUMER | D967: FURNITURE | E967: SOFA | F967: 2 | G967: Jun | H967: 1993 | I967: 1.00 | J967: 728.00 | K967: 727
A968: U.S.A. | B968: EAST | C968: CONSUMER | D968: FURNITURE | E968: SOFA | F968: 3 | G968: Jul | H968: 1993 | I968: 540.00 | J968: 120.00 | K968: -420
A969: U.S.A. | B969: EAST | C969: CONSUMER | D969: FURNITURE | E969: SOFA | F969: 3 | G969: Aug | H969: 1993 | I969: 940.00 | J969: 657.00 | K969: -283
A970: U.S.A. | B970: EAST | C970: CONSUMER | D970: FURNITURE | E970: SOFA | F970: 3 | G970: Sep | H970: 1993 | I970: 644.00 | J970: 409.00 | K970: -235
A971: U.S.A. | B971: EAST | C971: CONSUMER | D971: FURNITURE | E971: SOFA | F971: 4 | G971: Oct | H971: 1993 | I971: 821.00 | J971: 881.00 | K971: 60
A972: U.S.A. | B972: EAST | C972: CONSUMER | D972: FURNITURE | E972: SOFA | F972: 4 | G972: Nov | H972: 1993 | I972: 560.00 | J972: 113.00 | K972: -447
A973: U.S.A. | B973: EAST | C973: CONSUMER | D973: FURNITURE | E973: SOFA | F973: 4 | G973: Dec | H973: 1993 | I973: 309.00 | J973: 831.00 | K973: 522
A974: U.S.A. | B974: EAST | C974: CONSUMER | D974: FURNITURE | E974: BED | F974: 1 | G974: Jan | H974: 1993 | I974: 278.00 | J974: 622.00 | K974: 344
A975: U.S.A. | B975: EAST | C975: CONSUMER | D975: FURNITURE | E975: BED | F975: 1 | G975: Feb | H975: 1993 | I975: 447.00 | J975: 689.00 | K975: 242
A976: U.S.A. | B976: EAST | C976: CONSUMER | D976: FURNITURE | E976: BED | F976: 1 | G976: Mar | H976: 1993 | I976: 170.00 | J976: 120.00 | K976: -50
A977: U.S.A. | B977: EAST | C977: CONSUMER | D977: FURNITURE | E977: BED | F977: 2 | G977: Apr | H977: 1993 | I977: 87.00 | J977: 374.00 | K977: 287
A978: U.S.A. | B978: EAST | C978: CONSUMER | D978: FURNITURE | E978: BED | F978: 2 | G978: May | H978: 1993 | I978: 384.00 | J978: 926.00 | K978: 542
A979: U.S.A. | B979: EAST | C979: CONSUMER | D979: FURNITURE | E979: BED | F979: 2 | G979: Jun | H979: 1993 | I979: 574.00 | J979: 687.00 | K979: 113
A980: U.S.A. | B980: EAST | C980: CONSUMER | D980: FURNITURE | E980: BED | F980: 3 | G980: Jul | H980: 1993 | I980: 585.00 | J980: 600.00 | K980: 15
A981: U.S.A. | B981: EAST | C981: CONSUMER | D981: FURNITURE | E981: BED | F981: 3 | G981: Aug | H981: 1993 | I981: 947.00 | J981: 779.00 | K981: -168
A982: U.S.A. | B982: EAST | C982: CONSUMER | D982: FURNITURE | E982: BED | F982: 3 | G982: Sep | H982: 1993 | I982: 984.00 | J982: 223.00 | K982: -761
A983: U.S.A. | B983: EAST | C983: CONSUMER | D983: FURNITURE | E983: BED | F983: 4 | G983: Oct | H983: 1993 | I983: 189.00 | J983: 628.00 | K983: 439
A984: U.S.A. | B984: EAST | C984: CONSUMER | D984: FURNITURE | E984: BED | F984: 4 | G984: Nov | H984: 1993 | I984: 364.00 | J984: 326.00 | K984: -38
A985: U.S.A. | B985: EAST | C985: CONSUMER | D985: FURNITURE | E985: BED | F985: 4 | G985: Dec | H985: 1993 | I985: 49.00 | J985: 836.00 | K985: 787
A986: U.S.A. | B986: EAST | C986: CONSUMER | D986: OFFICE | E986: TABLE | F986: 1 | G986: Jan | H986: 1993 | I986: 649.00 | J986: 805.00 | K986: 156
A987: U.S.A. | B987: EAST | C987: CONSUMER | D987: OFFICE | E987: TABLE | F987: 1 | G987: Feb | H987: 1993 | I987: 838.00 | J987: 860.00 | K987: 22
A988: U.S.A. | B988: EAST | C988: CONSUMER | D988: OFFICE | E988: TABLE | F988: 1 | G988: Mar | H988: 1993 | I988: 439.00 | J988: 104.00 | K988: -335
A989: U.S.A. | B989: EAST | C989: CONSUMER | D989: OFFICE | E989: TABLE | F989: 2 | G989: Apr | H989: 1993 | I989: 207.00 | J989: 434.00 | K989: 227
A990: U.S.A. | B990: EAST | C990: CONSUMER | D990: OFFICE | E990: TABLE | F990: 2 | G990: May | H990: 1993 | I990: 804.00 | J990: 912.00 | K990: 108
A991: U.S.A. | B991: EAST | C991: CONSUMER | D991: OFFICE | E991: TABLE | F991: 2 | G991: Jun | H991: 1993 | I991: 875.00 | J991: 571.00 | K991: -304
A992: U.S.A. | B992: EAST | C992: CONSUMER | D992: OFFICE | E992: TABLE | F992: 3 | G992: Jul | H992: 1993 | I992: 473.00 | J992: 267.00 | K992: -206
A993: U.S.A. | B993: EAST | C993: CONSUMER | D993: OFFICE | E993: TABLE | F993: 3 | G993: Aug | H993: 1993 | I993: 845.00 | J993: 415.00 | K993: -430
A994: U.S.A. | B994: EAST | C994: CONSUMER | D994: OFFICE | E994: TABLE | F994: 3 | G994: Sep | H994: 1993 | I994: 91.00 | J994: 261.00 | K994: 170
A995: U.S.A. | B995: EAST | C995: CONSUMER | D995: OFFICE | E995: TABLE | F995: 4 | G995: Oct | H995: 1993 | I995: 630.00 | J995: 746.00 | K995: 116
A996: U.S.A. | B996: EAST | C996: CONSUMER | D996: OFFICE | E996: TABLE | F996: 4 | G996: Nov | H996: 1993 | I996: 185.00 | J996: 30.00 | K996: -155
A997: U.S.A. | B997: EAST | C997: CONSUMER | D997: OFFICE | E997: TABLE | F997: 4 | G997: Dec | H997: 1993 | I997: 317.00 | J997: 662.00 | K997: 345
A998: U.S.A. | B998: EAST | C998: CONSUMER | D998: OFFICE | E998: CHAIR | F998: 1 | G998: Jan | H998: 1993 | I998: 789.00 | J998: 816.00 | K998: 27
A999: U.S.A. | B999: EAST | C999: CONSUMER | D999: OFFICE | E999: CHAIR | F999: 1 | G999: Feb | H999: 1993 | I999: 988.00 | J999: 437.00 | K999: -551
A1000: U.S.A. | B1000: EAST | C1000: CONSUMER | D1000: OFFICE | E1000: CHAIR | F1000: 1 | G1000: Mar | H1000: 1993 | I1000: 220.00 | J1000: 715.00 | K1000: 495
A1001: U.S.A. | B1001: EAST | C1001: CONSUMER | D1001: OFFICE | E1001: CHAIR | F1001: 2 | G1001: Apr | H1001: 1993 | I1001: 946.00 | J1001: 780.00 | K1001: -166
A1002: U.S.A. | B1002: EAST | C1002: CONSUMER | D1002: OFFICE | E1002: CHAIR | F1002: 2 | G1002: May | H1002: 1993 | I1002: 986.00 | J1002: 245.00 | K1002: -741
A1003: U.S.A. | B1003: EAST | C1003: CONSUMER | D1003: OFFICE | E1003: CHAIR | F1003: 2 | G1003: Jun | H1003: 1993 | I1003: 129.00 | J1003: 201.00 | K1003: 72
A1004: U.S.A. | B1004: EAST | C1004: CONSUMER | D1004: OFFICE | E1004: CHAIR | F1004: 3 | G1004: Jul | H1004: 1993 | I1004: 433.00 | J1004: 815.00 | K1004: 382
A1005: U.S.A. | B1005: EAST | C1005: CONSUMER | D1005: OFFICE | E1005: CHAIR | F1005: 3 | G1005: Aug | H1005: 1993 | I1005: 492.00 | J1005: 865.00 | K1005: 373
A1006: U.S.A. | B1006: EAST | C1006: CONSUMER | D1006: OFFICE | E1006: CHAIR | F1006: 3 | G1006: Sep | H1006: 1993 | I1006: 306.00 | J1006: 634.00 | K1006: 328
A1007: U.S.A. | B1007: EAST | C1007: CONSUMER | D1007: OFFICE | E1007: CHAIR | F1007: 4 | G1007: Oct | H1007: 1993 | I1007: 154.00 | J1007: 901.00 | K1007: 747
A1008: U.S.A. | B1008: EAST | C1008: CONSUMER | D1008: OFFICE | E1008: CHAIR | F1008: 4 | G1008: Nov | H1008: 1993 | I1008: 206.00 | J1008: 789.00 | K1008: 583
A1009: U.S.A. | B1009: EAST | C1009: CONSUMER | D1009: OFFICE | E1009: CHAIR | F1009: 4 | G1009: Dec | H1009: 1993 | I1009: 81.00 | J1009: 882.00 | K1009: 801
A1010: U.S.A. | B1010: EAST | C1010: CONSUMER | D1010: OFFICE | E1010: DESK | F1010: 1 | G1010: Jan | H1010: 1993 | I1010: 619.00 | J1010: 384.00 | K1010: -235
A1011: U.S.A. | B1011: EAST | C1011: CONSUMER | D1011: OFFICE | E1011: DESK | F1011: 1 | G1011: Feb | H1011: 1993 | I1011: 332.00 | J1011: 161.00 | K1011: -171
A1012: U.S.A. | B1012: EAST | C1012: CONSUMER | D1012: OFFICE | E1012: DESK | F1012: 1 | G1012: Mar | H1012: 1993 | I1012: 669.00 | J1012: 977.00 | K1012: 308
A1013: U.S.A. | B1013: EAST | C1013: CONSUMER | D1013: OFFICE | E1013: DESK | F1013: 2 | G1013: Apr | H1013: 1993 | I1013: 487.00 | J1013: 615.00 | K1013: 128
A1014: U.S.A. | B1014: EAST | C1014: CONSUMER | D1014: OFFICE | E1014: DESK | F1014: 2 | G1014: May | H1014: 1993 | I1014: 994.00 | J1014: 783.00 | K1014: -211
A1015: U.S.A. | B1015: EAST | C1015: CONSUMER | D1015: OFFICE | E1015: DESK | F1015: 2 | G1015: Jun | H1015: 1993 | I1015: 331.00 | J1015: 977.00 | K1015: 646
A1016: U.S.A. | B1016: EAST | C1016: CONSUMER | D1016: OFFICE | E1016: DESK | F1016: 3 | G1016: Jul | H1016: 1993 | I1016: 739.00 | J1016: 375.00 | K1016: -364
A1017: U.S.A. | B1017: EAST | C1017: CONSUMER | D1017: OFFICE | E1017: DESK | F1017: 3 | G1017: Aug | H1017: 1993 | I1017: 665.00 | J1017: 298.00 | K1017: -367
A1018: U.S.A. | B1018: EAST | C1018: CONSUMER | D1018: OFFICE | E1018: DESK | F1018: 3 | G1018: Sep | H1018: 1993 | I1018: 921.00 | J1018: 104.00 | K1018: -817
A1019: U.S.A. | B1019: EAST | C1019: CONSUMER | D1019: OFFICE | E1019: DESK | F1019: 4 | G1019: Oct | H1019: 1993 | I1019: 862.00 | J1019: 713.00 | K1019: -149
A1020: U.S.A. | B1020: EAST | C1020: CONSUMER | D1020: OFFICE | E1020: DESK | F1020: 4 | G1020: Nov | H1020: 1993 | I1020: 662.00 | J1020: 556.00 | K1020: -106
A1021: U.S.A. | B1021: EAST | C1021: CONSUMER | D1021: OFFICE | E1021: DESK | F1021: 4 | G1021: Dec | H1021: 1993 | I1021: 517.00 | J1021: 323.00 | K1021: -194
A1022: U.S.A. | B1022: EAST | C1022: CONSUMER | D1022: FURNITURE | E1022: SOFA | F1022: 1 | G1022: Jan | H1022: 1994 | I1022: 1000.00 | J1022: 129.00 | K1022: -871
A1023: U.S.A. | B1023: EAST | C1023: CONSUMER | D1023: FURNITURE | E1023: SOFA | F1023: 1 | G1023: Feb | H1023: 1994 | I1023: 945.00 | J1023: 76.00 | K1023: -869
A1024: U.S.A. | B1024: EAST | C1024: CONSUMER | D1024: FURNITURE | E1024: SOFA | F1024: 1 | G1024: Mar | H1024: 1994 | I1024: 931.00 | J1024: 260.00 | K1024: -671
A1025: U.S.A. | B1025: EAST | C1025: CONSUMER | D1025: FURNITURE | E1025: SOFA | F1025: 2 | G1025: Apr | H1025: 1994 | I1025: 504.00 | J1025: 882.00 | K1025: 378
A1026: U.S.A. | B1026: EAST | C1026: CONSUMER | D1026: FURNITURE | E1026: SOFA | F1026: 2 | G1026: May | H1026: 1994 | I1026: 950.00 | J1026: 157.00 | K1026: -793
A1027: U.S.A. | B1027: EAST | C1027: CONSUMER | D1027: FURNITURE | E1027: SOFA | F1027: 2 | G1027: Jun | H1027: 1994 | I1027: 278.00 | J1027: 443.00 | K1027: 165
A1028: U.S.A. | B1028: EAST | C1028: CONSUMER | D1028: FURNITURE | E1028: SOFA | F1028: 3 | G1028: Jul | H1028: 1994 | I1028: 225.00 | J1028: 111.00 | K1028: -114
A1029: U.S.A. | B1029: EAST | C1029: CONSUMER | D1029: FURNITURE | E1029: SOFA | F1029: 3 | G1029: Aug | H1029: 1994 | I1029: 6.00 | J1029: 497.00 | K1029: 491
A1030: U.S.A. | B1030: EAST | C1030: CONSUMER | D1030: FURNITURE | E1030: SOFA | F1030: 3 | G1030: Sep | H1030: 1994 | I1030: 124.00 | J1030: 321.00 | K1030: 197
A1031: U.S.A. | B1031: EAST | C1031: CONSUMER | D1031: FURNITURE | E1031: SOFA | F1031: 4 | G1031: Oct | H1031: 1994 | I1031: 206.00 | J1031: 194.00 | K1031: -12
A1032: U.S.A. | B1032: EAST | C1032: CONSUMER | D1032: FURNITURE | E1032: SOFA | F1032: 4 | G1032: Nov | H1032: 1994 | I1032: 320.00 | J1032: 684.00 | K1032: 364
A1033: U.S.A. | B1033: EAST | C1033: CONSUMER | D1033: FURNITURE | E1033: SOFA | F1033: 4 | G1033: Dec | H1033: 1994 | I1033: 270.00 | J1033: 634.00 | K1033: 364
A1034: U.S.A. | B1034: EAST | C1034: CONSUMER | D1034: FURNITURE | E1034: BED | F1034: 1 | G1034: Jan | H1034: 1994 | I1034: 851.00 | J1034: 361.00 | K1034: -490
A1035: U.S.A. | B1035: EAST | C1035: CONSUMER | D1035: FURNITURE | E1035: BED | F1035: 1 | G1035: Feb | H1035: 1994 | I1035: 643.00 | J1035: 444.00 | K1035: -199
A1036: U.S.A. | B1036: EAST | C1036: CONSUMER | D1036: FURNITURE | E1036: BED | F1036: 1 | G1036: Mar | H1036: 1994 | I1036: 143.00 | J1036: 501.00 | K1036: 358
A1037: U.S.A. | B1037: EAST | C1037: CONSUMER | D1037: FURNITURE | E1037: BED | F1037: 2 | G1037: Apr | H1037: 1994 | I1037: 763.00 | J1037: 743.00 | K1037: -20
A1038: U.S.A. | B1038: EAST | C1038: CONSUMER | D1038: FURNITURE | E1038: BED | F1038: 2 | G1038: May | H1038: 1994 | I1038: 987.00 | J1038: 861.00 | K1038: -126
A1039: U.S.A. | B1039: EAST | C1039: CONSUMER | D1039: FURNITURE | E1039: BED | F1039: 2 | G1039: Jun | H1039: 1994 | I1039: 264.00 | J1039: 203.00 | K1039: -61
A1040: U.S.A. | B1040: EAST | C1040: CONSUMER | D1040: FURNITURE | E1040: BED | F1040: 3 | G1040: Jul | H1040: 1994 | I1040: 439.00 | J1040: 762.00 | K1040: 323
A1041: U.S.A. | B1041: EAST | C1041: CONSUMER | D1041: FURNITURE | E1041: BED | F1041: 3 | G1041: Aug | H1041: 1994 | I1041: 750.00 | J1041: 705.00 | K1041: -45
A1042: U.S.A. | B1042: EAST | C1042: CONSUMER | D1042: FURNITURE | E1042: BED | F1042: 3 | G1042: Sep | H1042: 1994 | I1042: 37.00 | J1042: 153.00 | K1042: 116
A1043: U.S.A. | B1043: EAST | C1043: CONSUMER | D1043: FURNITURE | E1043: BED | F1043: 4 | G1043: Oct | H1043: 1994 | I1043: 95.00 | J1043: 436.00 | K1043: 341
A1044: U.S.A. | B1044: EAST | C1044: CONSUMER | D1044: FURNITURE | E1044: BED | F1044: 4 | G1044: Nov | H1044: 1994 | I1044: 79.00 | J1044: 428.00 | K1044: 349
A1045: U.S.A. | B1045: EAST | C1045: CONSUMER | D1045: FURNITURE | E1045: BED | F1045: 4 | G1045: Dec | H1045: 1994 | I1045: 832.00 | J1045: 804.00 | K1045: -28
A1046: U.S.A. | B1046: EAST | C1046: CONSUMER | D1046: OFFICE | E1046: TABLE | F1046: 1 | G1046: Jan | H1046: 1994 | I1046: 88.00 | J1046: 916.00 | K1046: 828
A1047: U.S.A. | B1047: EAST | C1047: CONSUMER | D1047: OFFICE | E1047: TABLE | F1047: 1 | G1047: Feb | H1047: 1994 | I1047: 607.00 | J1047: 415.00 | K1047: -192
A1048: U.S.A. | B1048: EAST | C1048: CONSUMER | D1048: OFFICE | E1048: TABLE | F1048: 1 | G1048: Mar | H1048: 1994 | I1048: 35.00 | J1048: 514.00 | K1048: 479
A1049: U.S.A. | B1049: EAST | C1049: CONSUMER | D1049: OFFICE | E1049: TABLE | F1049: 2 | G1049: Apr | H1049: 1994 | I1049: 680.00 | J1049: 756.00 | K1049: 76
A1050: U.S.A. | B1050: EAST | C1050: CONSUMER | D1050: OFFICE | E1050: TABLE | F1050: 2 | G1050: May | H1050: 1994 | I1050: 78.00 | J1050: 461.00 | K1050: 383
A1051: U.S.A. | B1051: EAST | C1051: CONSUMER | D1051: OFFICE | E1051: TABLE | F1051: 2 | G1051: Jun | H1051: 1994 | I1051: 117.00 | J1051: 460.00 | K1051: 343
A1052: U.S.A. | B1052: EAST | C1052: CONSUMER | D1052: OFFICE | E1052: TABLE | F1052: 3 | G1052: Jul | H1052: 1994 | I1052: 440.00 | J1052: 305.00 | K1052: -135
A1053: U.S.A. | B1053: EAST | C1053: CONSUMER | D1053: OFFICE | E1053: TABLE | F1053: 3 | G1053: Aug | H1053: 1994 | I1053: 652.00 | J1053: 198.00 | K1053: -454
A1054: U.S.A. | B1054: EAST | C1054: CONSUMER | D1054: OFFICE | E1054: TABLE | F1054: 3 | G1054: Sep | H1054: 1994 | I1054: 249.00 | J1054: 234.00 | K1054: -15
A1055: U.S.A. | B1055: EAST | C1055: CONSUMER | D1055: OFFICE | E1055: TABLE | F1055: 4 | G1055: Oct | H1055: 1994 | I1055: 658.00 | J1055: 638.00 | K1055: -20
A1056: U.S.A. | B1056: EAST | C1056: CONSUMER | D1056: OFFICE | E1056: TABLE | F1056: 4 | G1056: Nov | H1056: 1994 | I1056: 563.00 | J1056: 88.00 | K1056: -475
A1057: U.S.A. | B1057: EAST | C1057: CONSUMER | D1057: OFFICE | E1057: TABLE | F1057: 4 | G1057: Dec | H1057: 1994 | I1057: 737.00 | J1057: 751.00 | K1057: 14
A1058: U.S.A. | B1058: EAST | C1058: CONSUMER | D1058: OFFICE | E1058: CHAIR | F1058: 1 | G1058: Jan | H1058: 1994 | I1058: 882.00 | J1058: 953.00 | K1058: 71
A1059: U.S.A. | B1059: EAST | C1059: CONSUMER | D1059: OFFICE | E1059: CHAIR | F1059: 1 | G1059: Feb | H1059: 1994 | I1059: 848.00 | J1059: 862.00 | K1059: 14
A1060: U.S.A. | B1060: EAST | C1060: CONSUMER | D1060: OFFICE | E1060: CHAIR | F1060: 1 | G1060: Mar | H1060: 1994 | I1060: 664.00 | J1060: 628.00 | K1060: -36
A1061: U.S.A. | B1061: EAST | C1061: CONSUMER | D1061: OFFICE | E1061: CHAIR | F1061: 2 | G1061: Apr | H1061: 1994 | I1061: 389.00 | J1061: 765.00 | K1061: 376
A1062: U.S.A. | B1062: EAST | C1062: CONSUMER | D1062: OFFICE | E1062: CHAIR | F1062: 2 | G1062: May | H1062: 1994 | I1062: 182.00 | J1062: 741.00 | K1062: 559
A1063: U.S.A. | B1063: EAST | C1063: CONSUMER | D1063: OFFICE | E1063: CHAIR | F1063: 2 | G1063: Jun | H1063: 1994 | I1063: 505.00 | J1063: 61.00 | K1063: -444
A1064: U.S.A. | B1064: EAST | C1064: CONSUMER | D1064: OFFICE | E1064: CHAIR | F1064: 3 | G1064: Jul | H1064: 1994 | I1064: 861.00 | J1064: 470.00 | K1064: -391
A1065: U.S.A. | B1065: EAST | C1065: CONSUMER | D1065: OFFICE | E1065: CHAIR | F1065: 3 | G1065: Aug | H1065: 1994 | I1065: 263.00 | J1065: 869.00 | K1065: 606
A1066: U.S.A. | B1066: EAST | C1066: CONSUMER | D1066: OFFICE | E1066: CHAIR | F1066: 3 | G1066: Sep | H1066: 1994 | I1066: 400.00 | J1066: 650.00 | K1066: 250
A1067: U.S.A. | B1067: EAST | C1067: CONSUMER | D1067: OFFICE | E1067: CHAIR | F1067: 4 | G1067: Oct | H1067: 1994 | I1067: 556.00 | J1067: 750.00 | K1067: 194
A1068: U.S.A. | B1068: EAST | C1068: CONSUMER | D1068: OFFICE | E1068: CHAIR | F1068: 4 | G1068: Nov | H1068: 1994 | I1068: 497.00 | J1068: 602.00 | K1068: 105
A1069: U.S.A. | B1069: EAST | C1069: CONSUMER | D1069: OFFICE | E1069: CHAIR | F1069: 4 | G1069: Dec | H1069: 1994 | I1069: 181.00 | J1069: 54.00 | K1069: -127
A1070: U.S.A. | B1070: EAST | C1070: CONSUMER | D1070: OFFICE | E1070: DESK | F1070: 1 | G1070: Jan | H1070: 1994 | I1070: 352.00 | J1070: 391.00 | K1070: 39
A1071: U.S.A. | B1071: EAST | C1071: CONSUMER | D1071: OFFICE | E1071: DESK | F1071: 1 | G1071: Feb | H1071: 1994 | I1071: 166.00 | J1071: 593.00 | K1071: 427
A1072: U.S.A. | B1072: EAST | C1072: CONSUMER | D1072: OFFICE | E1072: DESK | F1072: 1 | G1072: Mar | H1072: 1994 | I1072: 859.00 | J1072: 906.00 | K1072: 47
A1073: U.S.A. | B1073: EAST | C1073: CONSUMER | D1073: OFFICE | E1073: DESK | F1073: 2 | G1073: Apr | H1073: 1994 | I1073: 571.00 | J1073: 130.00 | K1073: -441
A1074: U.S.A. | B1074: EAST | C1074: CONSUMER | D1074: OFFICE | E1074: DESK | F1074: 2 | G1074: May | H1074: 1994 | I1074: 976.00 | J1074: 613.00 | K1074: -363
A1075: U.S.A. | B1075: EAST | C1075: CONSUMER | D1075: OFFICE | E1075: DESK | F1075: 2 | G1075: Jun | H1075: 1994 | I1075: 466.00 | J1075: 58.00 | K1075: -408
A1076: U.S.A. | B1076: EAST | C1076: CONSUMER | D1076: OFFICE | E1076: DESK | F1076: 3 | G1076: Jul | H1076: 1994 | I1076: 79.00 | J1076: 314.00 | K1076: 235
A1077: U.S.A. | B1077: EAST | C1077: CONSUMER | D1077: OFFICE | E1077: DESK | F1077: 3 | G1077: Aug | H1077: 1994 | I1077: 864.00 | J1077: 67.00 | K1077: -797
A1078: U.S.A. | B1078: EAST | C1078: CONSUMER | D1078: OFFICE | E1078: DESK | F1078: 3 | G1078: Sep | H1078: 1994 | I1078: 623.00 | J1078: 654.00 | K1078: 31
A1079: U.S.A. | B1079: EAST | C1079: CONSUMER | D1079: OFFICE | E1079: DESK | F1079: 4 | G1079: Oct | H1079: 1994 | I1079: 170.00 | J1079: 312.00 | K1079: 142
A1080: U.S.A. | B1080: EAST | C1080: CONSUMER | D1080: OFFICE | E1080: DESK | F1080: 4 | G1080: Nov | H1080: 1994 | I1080: 662.00 | J1080: 349.00 | K1080: -313
A1081: U.S.A. | B1081: EAST | C1081: CONSUMER | D1081: OFFICE | E1081: DESK | F1081: 4 | G1081: Dec | H1081: 1994 | I1081: 763.00 | J1081: 415.00 | K1081: -348
A1082: U.S.A. | B1082: EAST | C1082: EDUCATION | D1082: FURNITURE | E1082: SOFA | F1082: 1 | G1082: Jan | H1082: 1993 | I1082: 975.00 | J1082: 4.00 | K1082: -971
A1083: U.S.A. | B1083: EAST | C1083: EDUCATION | D1083: FURNITURE | E1083: SOFA | F1083: 1 | G1083: Feb | H1083: 1993 | I1083: 455.00 | J1083: 813.00 | K1083: 358
A1084: U.S.A. | B1084: EAST | C1084: EDUCATION | D1084: FURNITURE | E1084: SOFA | F1084: 1 | G1084: Mar | H1084: 1993 | I1084: 260.00 | J1084: 773.00 | K1084: 513
A1085: U.S.A. | B1085: EAST | C1085: EDUCATION | D1085: FURNITURE | E1085: SOFA | F1085: 2 | G1085: Apr | H1085: 1993 | I1085: 69.00 | J1085: 205.00 | K1085: 136
A1086: U.S.A. | B1086: EAST | C1086: EDUCATION | D1086: FURNITURE | E1086: SOFA | F1086: 2 | G1086: May | H1086: 1993 | I1086: 147.00 | J1086: 657.00 | K1086: 510
A1087: U.S.A. | B1087: EAST | C1087: EDUCATION | D1087: FURNITURE | E1087: SOFA | F1087: 2 | G1087: Jun | H1087: 1993 | I1087: 533.00 | J1087: 154.00 | K1087: -379
A1088: U.S.A. | B1088: EAST | C1088: EDUCATION | D1088: FURNITURE | E1088: SOFA | F1088: 3 | G1088: Jul | H1088: 1993 | I1088: 881.00 | J1088: 747.00 | K1088: -134
A1089: U.S.A. | B1089: EAST | C1089: EDUCATION | D1089: FURNITURE | E1089: SOFA | F1089: 3 | G1089: Aug | H1089: 1993 | I1089: 457.00 | J1089: 787.00 | K1089: 330
A1090: U.S.A. | B1090: EAST | C1090: EDUCATION | D1090: FURNITURE | E1090: SOFA | F1090: 3 | G1090: Sep | H1090: 1993 | I1090: 441.00 | J1090: 867.00 | K1090: 426
A1091: U.S.A. | B1091: EAST | C1091: EDUCATION | D1091: FURNITURE | E1091: SOFA | F1091: 4 | G1091: Oct | H1091: 1993 | I1091: 859.00 | J1091: 307.00 | K1091: -552
A1092: U.S.A. | B1092: EAST | C1092: EDUCATION | D1092: FURNITURE | E1092: SOFA | F1092: 4 | G1092: Nov | H1092: 1993 | I1092: 177.00 | J1092: 571.00 | K1092: 394
A1093: U.S.A. | B1093: EAST | C1093: EDUCATION | D1093: FURNITURE | E1093: SOFA | F1093: 4 | G1093: Dec | H1093: 1993 | I1093: 633.00 | J1093: 92.00 | K1093: -541
A1094: U.S.A. | B1094: EAST | C1094: EDUCATION | D1094: FURNITURE | E1094: BED | F1094: 1 | G1094: Jan | H1094: 1993 | I1094: 378.00 | J1094: 129.00 | K1094: -249
A1095: U.S.A. | B1095: EAST | C1095: EDUCATION | D1095: FURNITURE | E1095: BED | F1095: 1 | G1095: Feb | H1095: 1993 | I1095: 569.00 | J1095: 187.00 | K1095: -382
A1096: U.S.A. | B1096: EAST | C1096: EDUCATION | D1096: FURNITURE | E1096: BED | F1096: 1 | G1096: Mar | H1096: 1993 | I1096: 186.00 | J1096: 670.00 | K1096: 484
A1097: U.S.A. | B1097: EAST | C1097: EDUCATION | D1097: FURNITURE | E1097: BED | F1097: 2 | G1097: Apr | H1097: 1993 | I1097: 875.00 | J1097: 678.00 | K1097: -197
A1098: U.S.A. | B1098: EAST | C1098: EDUCATION | D1098: FURNITURE | E1098: BED | F1098: 2 | G1098: May | H1098: 1993 | I1098: 636.00 | J1098: 423.00 | K1098: -213
A1099: U.S.A. | B1099: EAST | C1099: EDUCATION | D1099: FURNITURE | E1099: BED | F1099: 2 | G1099: Jun | H1099: 1993 | I1099: 360.00 | J1099: 389.00 | K1099: 29
A1100: U.S.A. | B1100: EAST | C1100: EDUCATION | D1100: FURNITURE | E1100: BED | F1100: 3 | G1100: Jul | H1100: 1993 | I1100: 677.00 | J1100: 257.00 | K1100: -420
A1101: U.S.A. | B1101: EAST | C1101: EDUCATION | D1101: FURNITURE | E1101: BED | F1101: 3 | G1101: Aug | H1101: 1993 | I1101: 708.00 | J1101: 780.00 | K1101: 72
A1102: U.S.A. | B1102: EAST | C1102: EDUCATION | D1102: FURNITURE | E1102: BED | F1102: 3 | G1102: Sep | H1102: 1993 | I1102: 158.00 | J1102: 159.00 | K1102: 1
A1103: U.S.A. | B1103: EAST | C1103: EDUCATION | D1103: FURNITURE | E1103: BED | F1103: 4 | G1103: Oct | H1103: 1993 | I1103: 384.00 | J1103: 97.00 | K1103: -287
A1104: U.S.A. | B1104: EAST | C1104: EDUCATION | D1104: FURNITURE | E1104: BED | F1104: 4 | G1104: Nov | H1104: 1993 | I1104: 927.00 | J1104: 479.00 | K1104: -448
A1105: U.S.A. | B1105: EAST | C1105: EDUCATION | D1105: FURNITURE | E1105: BED | F1105: 4 | G1105: Dec | H1105: 1993 | I1105: 134.00 | J1105: 9.00 | K1105: -125
A1106: U.S.A. | B1106: EAST | C1106: EDUCATION | D1106: OFFICE | E1106: TABLE | F1106: 1 | G1106: Jan | H1106: 1993 | I1106: 579.00 | J1106: 956.00 | K1106: 377
A1107: U.S.A. | B1107: EAST | C1107: EDUCATION | D1107: OFFICE | E1107: TABLE | F1107: 1 | G1107: Feb | H1107: 1993 | I1107: 131.00 | J1107: 276.00 | K1107: 145
A1108: U.S.A. | B1108: EAST | C1108: EDUCATION | D1108: OFFICE | E1108: TABLE | F1108: 1 | G1108: Mar | H1108: 1993 | I1108: 689.00 | J1108: 889.00 | K1108: 200
A1109: U.S.A. | B1109: EAST | C1109: EDUCATION | D1109: OFFICE | E1109: TABLE | F1109: 2 | G1109: Apr | H1109: 1993 | I1109: 908.00 | J1109: 708.00 | K1109: -200
A1110: U.S.A. | B1110: EAST | C1110: EDUCATION | D1110: OFFICE | E1110: TABLE | F1110: 2 | G1110: May | H1110: 1993 | I1110: 524.00 | J1110: 14.00 | K1110: -510
A1111: U.S.A. | B1111: EAST | C1111: EDUCATION | D1111: OFFICE | E1111: TABLE | F1111: 2 | G1111: Jun | H1111: 1993 | I1111: 336.00 | J1111: 904.00 | K1111: 568
A1112: U.S.A. | B1112: EAST | C1112: EDUCATION | D1112: OFFICE | E1112: TABLE | F1112: 3 | G1112: Jul | H1112: 1993 | I1112: 916.00 | J1112: 272.00 | K1112: -644
A1113: U.S.A. | B1113: EAST | C1113: EDUCATION | D1113: OFFICE | E1113: TABLE | F1113: 3 | G1113: Aug | H1113: 1993 | I1113: 236.00 | J1113: 257.00 | K1113: 21
A1114: U.S.A. | B1114: EAST | C1114: EDUCATION | D1114: OFFICE | E1114: TABLE | F1114: 3 | G1114: Sep | H1114: 1993 | I1114: 965.00 | J1114: 343.00 | K1114: -622
A1115: U.S.A. | B1115: EAST | C1115: EDUCATION | D1115: OFFICE | E1115: TABLE | F1115: 4 | G1115: Oct | H1115: 1993 | I1115: 350.00 | J1115: 80.00 | K1115: -270
A1116: U.S.A. | B1116: EAST | C1116: EDUCATION | D1116: OFFICE | E1116: TABLE | F1116: 4 | G1116: Nov | H1116: 1993 | I1116: 599.00 | J1116: 530.00 | K1116: -69
A1117: U.S.A. | B1117: EAST | C1117: EDUCATION | D1117: OFFICE | E1117: TABLE | F1117: 4 | G1117: Dec | H1117: 1993 | I1117: 901.00 | J1117: 340.00 | K1117: -561
A1118: U.S.A. | B1118: EAST | C1118: EDUCATION | D1118: OFFICE | E1118: CHAIR | F1118: 1 | G1118: Jan | H1118: 1993 | I1118: 524.00 | J1118: 229.00 | K1118: -295
A1119: U.S.A. | B1119: EAST | C1119: EDUCATION | D1119: OFFICE | E1119: CHAIR | F1119: 1 | G1119: Feb | H1119: 1993 | I1119: 902.00 | J1119: 786.00 | K1119: -116
A1120: U.S.A. | B1120: EAST | C1120: EDUCATION | D1120: OFFICE | E1120: CHAIR | F1120: 1 | G1120: Mar | H1120: 1993 | I1120: 212.00 | J1120: 92.00 | K1120: -120
A1121: U.S.A. | B1121: EAST | C1121: EDUCATION | D1121: OFFICE | E1121: CHAIR | F1121: 2 | G1121: Apr | H1121: 1993 | I1121: 762.00 | J1121: 455.00 | K1121: -307
A1122: U.S.A. | B1122: EAST | C1122: EDUCATION | D1122: OFFICE | E1122: CHAIR | F1122: 2 | G1122: May | H1122: 1993 | I1122: 182.00 | J1122: 409.00 | K1122: 227
A1123: U.S.A. | B1123: EAST | C1123: EDUCATION | D1123: OFFICE | E1123: CHAIR | F1123: 2 | G1123: Jun | H1123: 1993 | I1123: 442.00 | J1123: 166.00 | K1123: -276
A1124: U.S.A. | B1124: EAST | C1124: EDUCATION | D1124: OFFICE | E1124: CHAIR | F1124: 3 | G1124: Jul | H1124: 1993 | I1124: 919.00 | J1124: 277.00 | K1124: -642
A1125: U.S.A. | B1125: EAST | C1125: EDUCATION | D1125: OFFICE | E1125: CHAIR | F1125: 3 | G1125: Aug | H1125: 1993 | I1125: 67.00 | J1125: 92.00 | K1125: 25
A1126: U.S.A. | B1126: EAST | C1126: EDUCATION | D1126: OFFICE | E1126: CHAIR | F1126: 3 | G1126: Sep | H1126: 1993 | I1126: 741.00 | J1126: 631.00 | K1126: -110
A1127: U.S.A. | B1127: EAST | C1127: EDUCATION | D1127: OFFICE | E1127: CHAIR | F1127: 4 | G1127: Oct | H1127: 1993 | I1127: 617.00 | J1127: 390.00 | K1127: -227
A1128: U.S.A. | B1128: EAST | C1128: EDUCATION | D1128: OFFICE | E1128: CHAIR | F1128: 4 | G1128: Nov | H1128: 1993 | I1128: 214.00 | J1128: 403.00 | K1128: 189
A1129: U.S.A. | B1129: EAST | C1129: EDUCATION | D1129: OFFICE | E1129: CHAIR | F1129: 4 | G1129: Dec | H1129: 1993 | I1129: 202.00 | J1129: 964.00 | K1129: 762
A1130: U.S.A. | B1130: EAST | C1130: EDUCATION | D1130: OFFICE | E1130: DESK | F1130: 1 | G1130: Jan | H1130: 1993 | I1130: 975.00 | J1130: 794.00 | K1130: -181
A1131: U.S.A. | B1131: EAST | C1131: EDUCATION | D1131: OFFICE | E1131: DESK | F1131: 1 | G1131: Feb | H1131: 1993 | I1131: 820.00 | J1131: 892.00 | K1131: 72
A1132: U.S.A. | B1132: EAST | C1132: EDUCATION | D1132: OFFICE | E1132: DESK | F1132: 1 | G1132: Mar | H1132: 1993 | I1132: 123.00 | J1132: 728.00 | K1132: 605
A1133: U.S.A. | B1133: EAST | C1133: EDUCATION | D1133: OFFICE | E1133: DESK | F1133: 2 | G1133: Apr | H1133: 1993 | I1133: 135.00 | J1133: 744.00 | K1133: 609
A1134: U.S.A. | B1134: EAST | C1134: EDUCATION | D1134: OFFICE | E1134: DESK | F1134: 2 | G1134: May | H1134: 1993 | I1134: 535.00 | J1134: 678.00 | K1134: 143
A1135: U.S.A. | B1135: EAST | C1135: EDUCATION | D1135: OFFICE | E1135: DESK | F1135: 2 | G1135: Jun | H1135: 1993 | I1135: 971.00 | J1135: 768.00 | K1135: -203
A1136: U.S.A. | B1136: EAST | C1136: EDUCATION | D1136: OFFICE | E1136: DESK | F1136: 3 | G1136: Jul | H1136: 1993 | I1136: 166.00 | J1136: 234.00 | K1136: 68
A1137: U.S.A. | B1137: EAST | C1137: EDUCATION | D1137: OFFICE | E1137: DESK | F1137: 3 | G1137: Aug | H1137: 1993 | I1137: 814.00 | J1137: 333.00 | K1137: -481
A1138: U.S.A. | B1138: EAST | C1138: EDUCATION | D1138: OFFICE | E1138: DESK | F1138: 3 | G1138: Sep | H1138: 1993 | I1138: 557.00 | J1138: 968.00 | K1138: 411
A1139: U.S.A. | B1139: EAST | C1139: EDUCATION | D1139: OFFICE | E1139: DESK | F1139: 4 | G1139: Oct | H1139: 1993 | I1139: 820.00 | J1139: 119.00 | K1139: -701
A1140: U.S.A. | B1140: EAST | C1140: EDUCATION | D1140: OFFICE | E1140: DESK | F1140: 4 | G1140: Nov | H1140: 1993 | I1140: 486.00 | J1140: 469.00 | K1140: -17
A1141: U.S.A. | B1141: EAST | C1141: EDUCATION | D1141: OFFICE | E1141: DESK | F1141: 4 | G1141: Dec | H1141: 1993 | I1141: 429.00 | J1141: 261.00 | K1141: -168
A1142: U.S.A. | B1142: EAST | C1142: EDUCATION | D1142: FURNITURE | E1142: SOFA | F1142: 1 | G1142: Jan | H1142: 1994 | I1142: 382.00 | J1142: 269.00 | K1142: -113
A1143: U.S.A. | B1143: EAST | C1143: EDUCATION | D1143: FURNITURE | E1143: SOFA | F1143: 1 | G1143: Feb | H1143: 1994 | I1143: 707.00 | J1143: 764.00 | K1143: 57
A1144: U.S.A. | B1144: EAST | C1144: EDUCATION | D1144: FURNITURE | E1144: SOFA | F1144: 1 | G1144: Mar | H1144: 1994 | I1144: 566.00 | J1144: 662.00 | K1144: 96
A1145: U.S.A. | B1145: EAST | C1145: EDUCATION | D1145: FURNITURE | E1145: SOFA | F1145: 2 | G1145: Apr | H1145: 1994 | I1145: 349.00 | J1145: 818.00 | K1145: 469
A1146: U.S.A. | B1146: EAST | C1146: EDUCATION | D1146: FURNITURE | E1146: SOFA | F1146: 2 | G1146: May | H1146: 1994 | I1146: 128.00 | J1146: 617.00 | K1146: 489
A1147: U.S.A. | B1147: EAST | C1147: EDUCATION | D1147: FURNITURE | E1147: SOFA | F1147: 2 | G1147: Jun | H1147: 1994 | I1147: 231.00 | J1147: 649.00 | K1147: 418
A1148: U.S.A. | B1148: EAST | C1148: EDUCATION | D1148: FURNITURE | E1148: SOFA | F1148: 3 | G1148: Jul | H1148: 1994 | I1148: 258.00 | J1148: 895.00 | K1148: 637
A1149: U.S.A. | B1149: EAST | C1149: EDUCATION | D1149: FURNITURE | E1149: SOFA | F1149: 3 | G1149: Aug | H1149: 1994 | I1149: 812.00 | J1149: 750.00 | K1149: -62
A1150: U.S.A. | B1150: EAST | C1150: EDUCATION | D1150: FURNITURE | E1150: SOFA | F1150: 3 | G1150: Sep | H1150: 1994 | I1150: 362.00 | J1150: 738.00 | K1150: 376
A1151: U.S.A. | B1151: EAST | C1151: EDUCATION | D1151: FURNITURE | E1151: SOFA | F1151: 4 | G1151: Oct | H1151: 1994 | I1151: 133.00 | J1151: 107.00 | K1151: -26
A1152: U.S.A. | B1152: EAST | C1152: EDUCATION | D1152: FURNITURE | E1152: SOFA | F1152: 4 | G1152: Nov | H1152: 1994 | I1152: 60.00 | J1152: 278.00 | K1152: 218
A1153: U.S.A. | B1153: EAST | C1153: EDUCATION | D1153: FURNITURE | E1153: SOFA | F1153: 4 | G1153: Dec | H1153: 1994 | I1153: 88.00 | J1153: 32.00 | K1153: -56
A1154: U.S.A. | B1154: EAST | C1154: EDUCATION | D1154: FURNITURE | E1154: BED | F1154: 1 | G1154: Jan | H1154: 1994 | I1154: 273.00 | J1154: 614.00 | K1154: 341
A1155: U.S.A. | B1155: EAST | C1155: EDUCATION | D1155: FURNITURE | E1155: BED | F1155: 1 | G1155: Feb | H1155: 1994 | I1155: 27.00 | J1155: 261.00 | K1155: 234
A1156: U.S.A. | B1156: EAST | C1156: EDUCATION | D1156: FURNITURE | E1156: BED | F1156: 1 | G1156: Mar | H1156: 1994 | I1156: 209.00 | J1156: 115.00 | K1156: -94
A1157: U.S.A. | B1157: EAST | C1157: EDUCATION | D1157: FURNITURE | E1157: BED | F1157: 2 | G1157: Apr | H1157: 1994 | I1157: 470.00 | J1157: 358.00 | K1157: -112
A1158: U.S.A. | B1158: EAST | C1158: EDUCATION | D1158: FURNITURE | E1158: BED | F1158: 2 | G1158: May | H1158: 1994 | I1158: 219.00 | J1158: 133.00 | K1158: -86
A1159: U.S.A. | B1159: EAST | C1159: EDUCATION | D1159: FURNITURE | E1159: BED | F1159: 2 | G1159: Jun | H1159: 1994 | I1159: 907.00 | J1159: 891.00 | K1159: -16
A1160: U.S.A. | B1160: EAST | C1160: EDUCATION | D1160: FURNITURE | E1160: BED | F1160: 3 | G1160: Jul | H1160: 1994 | I1160: 778.00 | J1160: 702.00 | K1160: -76
A1161: U.S.A. | B1161: EAST | C1161: EDUCATION | D1161: FURNITURE | E1161: BED | F1161: 3 | G1161: Aug | H1161: 1994 | I1161: 998.00 | J1161: 58.00 | K1161: -940
A1162: U.S.A. | B1162: EAST | C1162: EDUCATION | D1162: FURNITURE | E1162: BED | F1162: 3 | G1162: Sep | H1162: 1994 | I1162: 194.00 | J1162: 606.00 | K1162: 412
A1163: U.S.A. | B1163: EAST | C1163: EDUCATION | D1163: FURNITURE | E1163: BED | F1163: 4 | G1163: Oct | H1163: 1994 | I1163: 933.00 | J1163: 668.00 | K1163: -265
A1164: U.S.A. | B1164: EAST | C1164: EDUCATION | D1164: FURNITURE | E1164: BED | F1164: 4 | G1164: Nov | H1164: 1994 | I1164: 708.00 | J1164: 813.00 | K1164: 105
A1165: U.S.A. | B1165: EAST | C1165: EDUCATION | D1165: FURNITURE | E1165: BED | F1165: 4 | G1165: Dec | H1165: 1994 | I1165: 949.00 | J1165: 450.00 | K1165: -499
A1166: U.S.A. | B1166: EAST | C1166: EDUCATION | D1166: OFFICE | E1166: TABLE | F1166: 1 | G1166: Jan | H1166: 1994 | I1166: 935.00 | J1166: 595.00 | K1166: -340
A1167: U.S.A. | B1167: EAST | C1167: EDUCATION | D1167: OFFICE | E1167: TABLE | F1167: 1 | G1167: Feb | H1167: 1994 | I1167: 667.00 | J1167: 47.00 | K1167: -620
A1168: U.S.A. | B1168: EAST | C1168: EDUCATION | D1168: OFFICE | E1168: TABLE | F1168: 1 | G1168: Mar | H1168: 1994 | I1168: 104.00 | J1168: 279.00 | K1168: 175
A1169: U.S.A. | B1169: EAST | C1169: EDUCATION | D1169: OFFICE | E1169: TABLE | F1169: 2 | G1169: Apr | H1169: 1994 | I1169: 803.00 | J1169: 293.00 | K1169: -510
A1170: U.S.A. | B1170: EAST | C1170: EDUCATION | D1170: OFFICE | E1170: TABLE | F1170: 2 | G1170: May | H1170: 1994 | I1170: 64.00 | J1170: 162.00 | K1170: 98
A1171: U.S.A. | B1171: EAST | C1171: EDUCATION | D1171: OFFICE | E1171: TABLE | F1171: 2 | G1171: Jun | H1171: 1994 | I1171: 825.00 | J1171: 935.00 | K1171: 110
A1172: U.S.A. | B1172: EAST | C1172: EDUCATION | D1172: OFFICE | E1172: TABLE | F1172: 3 | G1172: Jul | H1172: 1994 | I1172: 839.00 | J1172: 689.00 | K1172: -150
A1173: U.S.A. | B1173: EAST | C1173: EDUCATION | D1173: OFFICE | E1173: TABLE | F1173: 3 | G1173: Aug | H1173: 1994 | I1173: 184.00 | J1173: 484.00 | K1173: 300
A1174: U.S.A. | B1174: EAST | C1174: EDUCATION | D1174: OFFICE | E1174: TABLE | F1174: 3 | G1174: Sep | H1174: 1994 | I1174: 348.00 | J1174: 230.00 | K1174: -118
A1175: U.S.A. | B1175: EAST | C1175: EDUCATION | D1175: OFFICE | E1175: TABLE | F1175: 4 | G1175: Oct | H1175: 1994 | I1175: 904.00 | J1175: 164.00 | K1175: -740
A1176: U.S.A. | B1176: EAST | C1176: EDUCATION | D1176: OFFICE | E1176: TABLE | F1176: 4 | G1176: Nov | H1176: 1994 | I1176: 219.00 | J1176: 401.00 | K1176: 182
A1177: U.S.A. | B1177: EAST | C1177: EDUCATION | D1177: OFFICE | E1177: TABLE | F1177: 4 | G1177: Dec | H1177: 1994 | I1177: 381.00 | J1177: 607.00 | K1177: 226
A1178: U.S.A. | B1178: EAST | C1178: EDUCATION | D1178: OFFICE | E1178: CHAIR | F1178: 1 | G1178: Jan | H1178: 1994 | I1178: 788.00 | J1178: 223.00 | K1178: -565
A1179: U.S.A. | B1179: EAST | C1179: EDUCATION | D1179: OFFICE | E1179: CHAIR | F1179: 1 | G1179: Feb | H1179: 1994 | I1179: 639.00 | J1179: 684.00 | K1179: 45
A1180: U.S.A. | B1180: EAST | C1180: EDUCATION | D1180: OFFICE | E1180: CHAIR | F1180: 1 | G1180: Mar | H1180: 1994 | I1180: 336.00 | J1180: 645.00 | K1180: 309
A1181: U.S.A. | B1181: EAST | C1181: EDUCATION | D1181: OFFICE | E1181: CHAIR | F1181: 2 | G1181: Apr | H1181: 1994 | I1181: 937.00 | J1181: 470.00 | K1181: -467
A1182: U.S.A. | B1182: EAST | C1182: EDUCATION | D1182: OFFICE | E1182: CHAIR | F1182: 2 | G1182: May | H1182: 1994 | I1182: 399.00 | J1182: 424.00 | K1182: 25
A1183: U.S.A. | B1183: EAST | C1183: EDUCATION | D1183: OFFICE | E1183: CHAIR | F1183: 2 | G1183: Jun | H1183: 1994 | I1183: 21.00 | J1183: 862.00 | K1183: 841
A1184: U.S.A. | B1184: EAST | C1184: EDUCATION | D1184: OFFICE | E1184: CHAIR | F1184: 3 | G1184: Jul | H1184: 1994 | I1184: 125.00 | J1184: 736.00 | K1184: 611
A1185: U.S.A. | B1185: EAST | C1185: EDUCATION | D1185: OFFICE | E1185: CHAIR | F1185: 3 | G1185: Aug | H1185: 1994 | I1185: 635.00 | J1185: 554.00 | K1185: -81
A1186: U.S.A. | B1186: EAST | C1186: EDUCATION | D1186: OFFICE | E1186: CHAIR | F1186: 3 | G1186: Sep | H1186: 1994 | I1186: 229.00 | J1186: 790.00 | K1186: 561
A1187: U.S.A. | B1187: EAST | C1187: EDUCATION | D1187: OFFICE | E1187: CHAIR | F1187: 4 | G1187: Oct | H1187: 1994 | I1187: 770.00 | J1187: 115.00 | K1187: -655
A1188: U.S.A. | B1188: EAST | C1188: EDUCATION | D1188: OFFICE | E1188: CHAIR | F1188: 4 | G1188: Nov | H1188: 1994 | I1188: 622.00 | J1188: 853.00 | K1188: 231
A1189: U.S.A. | B1189: EAST | C1189: EDUCATION | D1189: OFFICE | E1189: CHAIR | F1189: 4 | G1189: Dec | H1189: 1994 | I1189: 109.00 | J1189: 643.00 | K1189: 534
A1190: U.S.A. | B1190: EAST | C1190: EDUCATION | D1190: OFFICE | E1190: DESK | F1190: 1 | G1190: Jan | H1190: 1994 | I1190: 65.00 | J1190: 984.00 | K1190: 919
A1191: U.S.A. | B1191: EAST | C1191: EDUCATION | D1191: OFFICE | E1191: DESK | F1191: 1 | G1191: Feb | H1191: 1994 | I1191: 977.00 | J1191: 845.00 | K1191: -132
A1192: U.S.A. | B1192: EAST | C1192: EDUCATION | D1192: OFFICE | E1192: DESK | F1192: 1 | G1192: Mar | H1192: 1994 | I1192: 410.00 | J1192: 374.00 | K1192: -36
A1193: U.S.A. | B1193: EAST | C1193: EDUCATION | D1193: OFFICE | E1193: DESK | F1193: 2 | G1193: Apr | H1193: 1994 | I1193: 150.00 | J1193: 687.00 | K1193: 537
A1194: U.S.A. | B1194: EAST | C1194: EDUCATION | D1194: OFFICE | E1194: DESK | F1194: 2 | G1194: May | H1194: 1994 | I1194: 630.00 | J1194: 157.00 | K1194: -473
A1195: U.S.A. | B1195: EAST | C1195: EDUCATION | D1195: OFFICE | E1195: DESK | F1195: 2 | G1195: Jun | H1195: 1994 | I1195: 488.00 | J1195: 49.00 | K1195: -439
A1196: U.S.A. | B1196: EAST | C1196: EDUCATION | D1196: OFFICE | E1196: DESK | F1196: 3 | G1196: Jul | H1196: 1994 | I1196: 112.00 | J1196: 817.00 | K1196: 705
A1197: U.S.A. | B1197: EAST | C1197: EDUCATION | D1197: OFFICE | E1197: DESK | F1197: 3 | G1197: Aug | H1197: 1994 | I1197: 598.00 | J1197: 223.00 | K1197: -375
A1198: U.S.A. | B1198: EAST | C1198: EDUCATION | D1198: OFFICE | E1198: DESK | F1198: 3 | G1198: Sep | H1198: 1994 | I1198: 705.00 | J1198: 433.00 | K1198: -272
A1199: U.S.A. | B1199: EAST | C1199: EDUCATION | D1199: OFFICE | E1199: DESK | F1199: 4 | G1199: Oct | H1199: 1994 | I1199: 226.00 | J1199: 41.00 | K1199: -185
A1200: U.S.A. | B1200: EAST | C1200: EDUCATION | D1200: OFFICE | E1200: DESK | F1200: 4 | G1200: Nov | H1200: 1994 | I1200: 979.00 | J1200: 396.00 | K1200: -583
A1201: U.S.A. | B1201: EAST | C1201: EDUCATION | D1201: OFFICE | E1201: DESK | F1201: 4 | G1201: Dec | H1201: 1994 | I1201: 19.00 | J1201: 131.00 | K1201: 112
A1202: U.S.A. | B1202: WEST | C1202: CONSUMER | D1202: FURNITURE | E1202: SOFA | F1202: 1 | G1202: Jan | H1202: 1993 | I1202: 596.00 | J1202: 197.00 | K1202: -399
A1203: U.S.A. | B1203: WEST | C1203: CONSUMER | D1203: FURNITURE | E1203: SOFA | F1203: 1 | G1203: Feb | H1203: 1993 | I1203: 263.00 | J1203: 828.00 | K1203: 565
A1204: U.S.A. | B1204: WEST | C1204: CONSUMER | D1204: FURNITURE | E1204: SOFA | F1204: 1 | G1204: Mar | H1204: 1993 | I1204: 194.00 | J1204: 461.00 | K1204: 267
A1205: U.S.A. | B1205: WEST | C1205: CONSUMER | D1205: FURNITURE | E1205: SOFA | F1205: 2 | G1205: Apr | H1205: 1993 | I1205: 895.00 | J1205: 35.00 | K1205: -860
A1206: U.S.A. | B1206: WEST | C1206: CONSUMER | D1206: FURNITURE | E1206: SOFA | F1206: 2 | G1206: May | H1206: 1993 | I1206: 502.00 | J1206: 88.00 | K1206: -414
A1207: U.S.A. | B1207: WEST | C1207: CONSUMER | D1207: FURNITURE | E1207: SOFA | F1207: 2 | G1207: Jun | H1207: 1993 | I1207: 342.00 | J1207: 832.00 | K1207: 490
A1208: U.S.A. | B1208: WEST | C1208: CONSUMER | D1208: FURNITURE | E1208: SOFA | F1208: 3 | G1208: Jul | H1208: 1993 | I1208: 421.00 | J1208: 900.00 | K1208: 479
A1209: U.S.A. | B1209: WEST | C1209: CONSUMER | D1209: FURNITURE | E1209: SOFA | F1209: 3 | G1209: Aug | H1209: 1993 | I1209: 901.00 | J1209: 368.00 | K1209: -533
A1210: U.S.A. | B1210: WEST | C1210: CONSUMER | D1210: FURNITURE | E1210: SOFA | F1210: 3 | G1210: Sep | H1210: 1993 | I1210: 474.00 | J1210: 201.00 | K1210: -273
A1211: U.S.A. | B1211: WEST | C1211: CONSUMER | D1211: FURNITURE | E1211: SOFA | F1211: 4 | G1211: Oct | H1211: 1993 | I1211: 571.00 | J1211: 758.00 | K1211: 187
A1212: U.S.A. | B1212: WEST | C1212: CONSUMER | D1212: FURNITURE | E1212: SOFA | F1212: 4 | G1212: Nov | H1212: 1993 | I1212: 511.00 | J1212: 504.00 | K1212: -7
A1213: U.S.A. | B1213: WEST | C1213: CONSUMER | D1213: FURNITURE | E1213: SOFA | F1213: 4 | G1213: Dec | H1213: 1993 | I1213: 379.00 | J1213: 864.00 | K1213: 485
A1214: U.S.A. | B1214: WEST | C1214: CONSUMER | D1214: FURNITURE | E1214: BED | F1214: 1 | G1214: Jan | H1214: 1993 | I1214: 912.00 | J1214: 585.00 | K1214: -327
A1215: U.S.A. | B1215: WEST | C1215: CONSUMER | D1215: FURNITURE | E1215: BED | F1215: 1 | G1215: Feb | H1215: 1993 | I1215: 429.00 | J1215: 127.00 | K1215: -302
A1216: U.S.A. | B1216: WEST | C1216: CONSUMER | D1216: FURNITURE | E1216: BED | F1216: 1 | G1216: Mar | H1216: 1993 | I1216: 580.00 | J1216: 669.00 | K1216: 89
A1217: U.S.A. | B1217: WEST | C1217: CONSUMER | D1217: FURNITURE | E1217: BED | F1217: 2 | G1217: Apr | H1217: 1993 | I1217: 179.00 | J1217: 708.00 | K1217: 529
A1218: U.S.A. | B1218: WEST | C1218: CONSUMER | D1218: FURNITURE | E1218: BED | F1218: 2 | G1218: May | H1218: 1993 | I1218: 119.00 | J1218: 830.00 | K1218: 711
A1219: U.S.A. | B1219: WEST | C1219: CONSUMER | D1219: FURNITURE | E1219: BED | F1219: 2 | G1219: Jun | H1219: 1993 | I1219: 369.00 | J1219: 550.00 | K1219: 181
A1220: U.S.A. | B1220: WEST | C1220: CONSUMER | D1220: FURNITURE | E1220: BED | F1220: 3 | G1220: Jul | H1220: 1993 | I1220: 882.00 | J1220: 762.00 | K1220: -120
A1221: U.S.A. | B1221: WEST | C1221: CONSUMER | D1221: FURNITURE | E1221: BED | F1221: 3 | G1221: Aug | H1221: 1993 | I1221: 727.00 | J1221: 468.00 | K1221: -259
A1222: U.S.A. | B1222: WEST | C1222: CONSUMER | D1222: FURNITURE | E1222: BED | F1222: 3 | G1222: Sep | H1222: 1993 | I1222: 823.00 | J1222: 151.00 | K1222: -672
A1223: U.S.A. | B1223: WEST | C1223: CONSUMER | D1223: FURNITURE | E1223: BED | F1223: 4 | G1223: Oct | H1223: 1993 | I1223: 783.00 | J1223: 103.00 | K1223: -680
A1224: U.S.A. | B1224: WEST | C1224: CONSUMER | D1224: FURNITURE | E1224: BED | F1224: 4 | G1224: Nov | H1224: 1993 | I1224: 884.00 | J1224: 876.00 | K1224: -8
A1225: U.S.A. | B1225: WEST | C1225: CONSUMER | D1225: FURNITURE | E1225: BED | F1225: 4 | G1225: Dec | H1225: 1993 | I1225: 891.00 | J1225: 881.00 | K1225: -10
A1226: U.S.A. | B1226: WEST | C1226: CONSUMER | D1226: OFFICE | E1226: TABLE | F1226: 1 | G1226: Jan | H1226: 1993 | I1226: 516.00 | J1226: 755.00 | K1226: 239
A1227: U.S.A. | B1227: WEST | C1227: CONSUMER | D1227: OFFICE | E1227: TABLE | F1227: 1 | G1227: Feb | H1227: 1993 | I1227: 779.00 | J1227: 331.00 | K1227: -448
A1228: U.S.A. | B1228: WEST | C1228: CONSUMER | D1228: OFFICE | E1228: TABLE | F1228: 1 | G1228: Mar | H1228: 1993 | I1228: 987.00 | J1228: 482.00 | K1228: -505
A1229: U.S.A. | B1229: WEST | C1229: CONSUMER | D1229: OFFICE | E1229: TABLE | F1229: 2 | G1229: Apr | H1229: 1993 | I1229: 318.00 | J1229: 632.00 | K1229: 314
A1230: U.S.A. | B1230: WEST | C1230: CONSUMER | D1230: OFFICE | E1230: TABLE | F1230: 2 | G1230: May | H1230: 1993 | I1230: 427.00 | J1230: 750.00 | K1230: 323
A1231: U.S.A. | B1231: WEST | C1231: CONSUMER | D1231: OFFICE | E1231: TABLE | F1231: 2 | G1231: Jun | H1231: 1993 | I1231: 86.00 | J1231: 618.00 | K1231: 532
A1232: U.S.A. | B1232: WEST | C1232: CONSUMER | D1232: OFFICE | E1232: TABLE | F1232: 3 | G1232: Jul | H1232: 1993 | I1232: 553.00 | J1232: 935.00 | K1232: 382
A1233: U.S.A. | B1233: WEST | C1233: CONSUMER | D1233: OFFICE | E1233: TABLE | F1233: 3 | G1233: Aug | H1233: 1993 | I1233: 315.00 | J1233: 716.00 | K1233: 401
A1234: U.S.A. | B1234: WEST | C1234: CONSUMER | D1234: OFFICE | E1234: TABLE | F1234: 3 | G1234: Sep | H1234: 1993 | I1234: 328.00 | J1234: 205.00 | K1234: -123
A1235: U.S.A. | B1235: WEST | C1235: CONSUMER | D1235: OFFICE | E1235: TABLE | F1235: 4 | G1235: Oct | H1235: 1993 | I1235: 521.00 | J1235: 215.00 | K1235: -306
A1236: U.S.A. | B1236: WEST | C1236: CONSUMER | D1236: OFFICE | E1236: TABLE | F1236: 4 | G1236: Nov | H1236: 1993 | I1236: 156.00 | J1236: 871.00 | K1236: 715
A1237: U.S.A. | B1237: WEST | C1237: CONSUMER | D1237: OFFICE | E1237: TABLE | F1237: 4 | G1237: Dec | H1237: 1993 | I1237: 841.00 | J1237: 552.00 | K1237: -289
A1238: U.S.A. | B1238: WEST | C1238: CONSUMER | D1238: OFFICE | E1238: CHAIR | F1238: 1 | G1238: Jan | H1238: 1993 | I1238: 588.00 | J1238: 792.00 | K1238: 204
A1239: U.S.A. | B1239: WEST | C1239: CONSUMER | D1239: OFFICE | E1239: CHAIR | F1239: 1 | G1239: Feb | H1239: 1993 | I1239: 506.00 | J1239: 175.00 | K1239: -331
A1240: U.S.A. | B1240: WEST | C1240: CONSUMER | D1240: OFFICE | E1240: CHAIR | F1240: 1 | G1240: Mar | H1240: 1993 | I1240: 382.00 | J1240: 208.00 | K1240: -174
A1241: U.S.A. | B1241: WEST | C1241: CONSUMER | D1241: OFFICE | E1241: CHAIR | F1241: 2 | G1241: Apr | H1241: 1993 | I1241: 132.00 | J1241: 354.00 | K1241: 222
A1242: U.S.A. | B1242: WEST | C1242: CONSUMER | D1242: OFFICE | E1242: CHAIR | F1242: 2 | G1242: May | H1242: 1993 | I1242: 652.00 | J1242: 163.00 | K1242: -489
A1243: U.S.A. | B1243: WEST | C1243: CONSUMER | D1243: OFFICE | E1243: CHAIR | F1243: 2 | G1243: Jun | H1243: 1993 | I1243: 723.00 | J1243: 336.00 | K1243: -387
A1244: U.S.A. | B1244: WEST | C1244: CONSUMER | D1244: OFFICE | E1244: CHAIR | F1244: 3 | G1244: Jul | H1244: 1993 | I1244: 682.00 | J1244: 804.00 | K1244: 122
A1245: U.S.A. | B1245: WEST | C1245: CONSUMER | D1245: OFFICE | E1245: CHAIR | F1245: 3 | G1245: Aug | H1245: 1993 | I1245: 382.00 | J1245: 863.00 | K1245: 481
A1246: U.S.A. | B1246: WEST | C1246: CONSUMER | D1246: OFFICE | E1246: CHAIR | F1246: 3 | G1246: Sep | H1246: 1993 | I1246: 125.00 | J1246: 326.00 | K1246: 201
A1247: U.S.A. | B1247: WEST | C1247: CONSUMER | D1247: OFFICE | E1247: CHAIR | F1247: 4 | G1247: Oct | H1247: 1993 | I1247: 321.00 | J1247: 568.00 | K1247: 247
A1248: U.S.A. | B1248: WEST | C1248: CONSUMER | D1248: OFFICE | E1248: CHAIR | F1248: 4 | G1248: Nov | H1248: 1993 | I1248: 922.00 | J1248: 691.00 | K1248: -231
A1249: U.S.A. | B1249: WEST | C1249: CONSUMER | D1249: OFFICE | E1249: CHAIR | F1249: 4 | G1249: Dec | H1249: 1993 | I1249: 884.00 | J1249: 152.00 | K1249: -732
A1250: U.S.A. | B1250: WEST | C1250: CONSUMER | D1250: OFFICE | E1250: DESK | F1250: 1 | G1250: Jan | H1250: 1993 | I1250: 342.00 | J1250: 793.00 | K1250: 451
A1251: U.S.A. | B1251: WEST | C1251: CONSUMER | D1251: OFFICE | E1251: DESK | F1251: 1 | G1251: Feb | H1251: 1993 | I1251: 215.00 | J1251: 129.00 | K1251: -86
A1252: U.S.A. | B1252: WEST | C1252: CONSUMER | D1252: OFFICE | E1252: DESK | F1252: 1 | G1252: Mar | H1252: 1993 | I1252: 52.00 | J1252: 481.00 | K1252: 429
A1253: U.S.A. | B1253: WEST | C1253: CONSUMER | D1253: OFFICE | E1253: DESK | F1253: 2 | G1253: Apr | H1253: 1993 | I1253: 292.00 | J1253: 406.00 | K1253: 114
A1254: U.S.A. | B1254: WEST | C1254: CONSUMER | D1254: OFFICE | E1254: DESK | F1254: 2 | G1254: May | H1254: 1993 | I1254: 862.00 | J1254: 512.00 | K1254: -350
A1255: U.S.A. | B1255: WEST | C1255: CONSUMER | D1255: OFFICE | E1255: DESK | F1255: 2 | G1255: Jun | H1255: 1993 | I1255: 309.00 | J1255: 668.00 | K1255: 359
A1256: U.S.A. | B1256: WEST | C1256: CONSUMER | D1256: OFFICE | E1256: DESK | F1256: 3 | G1256: Jul | H1256: 1993 | I1256: 886.00 | J1256: 551.00 | K1256: -335
A1257: U.S.A. | B1257: WEST | C1257: CONSUMER | D1257: OFFICE | E1257: DESK | F1257: 3 | G1257: Aug | H1257: 1993 | I1257: 172.00 | J1257: 124.00 | K1257: -48
A1258: U.S.A. | B1258: WEST | C1258: CONSUMER | D1258: OFFICE | E1258: DESK | F1258: 3 | G1258: Sep | H1258: 1993 | I1258: 912.00 | J1258: 655.00 | K1258: -257
A1259: U.S.A. | B1259: WEST | C1259: CONSUMER | D1259: OFFICE | E1259: DESK | F1259: 4 | G1259: Oct | H1259: 1993 | I1259: 666.00 | J1259: 523.00 | K1259: -143
A1260: U.S.A. | B1260: WEST | C1260: CONSUMER | D1260: OFFICE | E1260: DESK | F1260: 4 | G1260: Nov | H1260: 1993 | I1260: 656.00 | J1260: 739.00 | K1260: 83
A1261: U.S.A. | B1261: WEST | C1261: CONSUMER | D1261: OFFICE | E1261: DESK | F1261: 4 | G1261: Dec | H1261: 1993 | I1261: 145.00 | J1261: 87.00 | K1261: -58
A1262: U.S.A. | B1262: WEST | C1262: CONSUMER | D1262: FURNITURE | E1262: SOFA | F1262: 1 | G1262: Jan | H1262: 1994 | I1262: 68.00 | J1262: 574.00 | K1262: 506
A1263: U.S.A. | B1263: WEST | C1263: CONSUMER | D1263: FURNITURE | E1263: SOFA | F1263: 1 | G1263: Feb | H1263: 1994 | I1263: 210.00 | J1263: 61.00 | K1263: -149
A1264: U.S.A. | B1264: WEST | C1264: CONSUMER | D1264: FURNITURE | E1264: SOFA | F1264: 1 | G1264: Mar | H1264: 1994 | I1264: 478.00 | J1264: 565.00 | K1264: 87
A1265: U.S.A. | B1265: WEST | C1265: CONSUMER | D1265: FURNITURE | E1265: SOFA | F1265: 2 | G1265: Apr | H1265: 1994 | I1265: 296.00 | J1265: 475.00 | K1265: 179
A1266: U.S.A. | B1266: WEST | C1266: CONSUMER | D1266: FURNITURE | E1266: SOFA | F1266: 2 | G1266: May | H1266: 1994 | I1266: 664.00 | J1266: 44.00 | K1266: -620
A1267: U.S.A. | B1267: WEST | C1267: CONSUMER | D1267: FURNITURE | E1267: SOFA | F1267: 2 | G1267: Jun | H1267: 1994 | I1267: 880.00 | J1267: 145.00 | K1267: -735
A1268: U.S.A. | B1268: WEST | C1268: CONSUMER | D1268: FURNITURE | E1268: SOFA | F1268: 3 | G1268: Jul | H1268: 1994 | I1268: 607.00 | J1268: 813.00 | K1268: 206
A1269: U.S.A. | B1269: WEST | C1269: CONSUMER | D1269: FURNITURE | E1269: SOFA | F1269: 3 | G1269: Aug | H1269: 1994 | I1269: 97.00 | J1269: 703.00 | K1269: 606
A1270: U.S.A. | B1270: WEST | C1270: CONSUMER | D1270: FURNITURE | E1270: SOFA | F1270: 3 | G1270: Sep | H1270: 1994 | I1270: 908.00 | J1270: 757.00 | K1270: -151
A1271: U.S.A. | B1271: WEST | C1271: CONSUMER | D1271: FURNITURE | E1271: SOFA | F1271: 4 | G1271: Oct | H1271: 1994 | I1271: 152.00 | J1271: 96.00 | K1271: -56
A1272: U.S.A. | B1272: WEST | C1272: CONSUMER | D1272: FURNITURE | E1272: SOFA | F1272: 4 | G1272: Nov | H1272: 1994 | I1272: 622.00 | J1272: 860.00 | K1272: 238
A1273: U.S.A. | B1273: WEST | C1273: CONSUMER | D1273: FURNITURE | E1273: SOFA | F1273: 4 | G1273: Dec | H1273: 1994 | I1273: 309.00 | J1273: 750.00 | K1273: 441
A1274: U.S.A. | B1274: WEST | C1274: CONSUMER | D1274: FURNITURE | E1274: BED | F1274: 1 | G1274: Jan | H1274: 1994 | I1274: 909.00 | J1274: 116.00 | K1274: -793
A1275: U.S.A. | B1275: WEST | C1275: CONSUMER | D1275: FURNITURE | E1275: BED | F1275: 1 | G1275: Feb | H1275: 1994 | I1275: 765.00 | J1275: 677.00 | K1275: -88
A1276: U.S.A. | B1276: WEST | C1276: CONSUMER | D1276: FURNITURE | E1276: BED | F1276: 1 | G1276: Mar | H1276: 1994 | I1276: 180.00 | J1276: 477.00 | K1276: 297
A1277: U.S.A. | B1277: WEST | C1277: CONSUMER | D1277: FURNITURE | E1277: BED | F1277: 2 | G1277: Apr | H1277: 1994 | I1277: 712.00 | J1277: 154.00 | K1277: -558
A1278: U.S.A. | B1278: WEST | C1278: CONSUMER | D1278: FURNITURE | E1278: BED | F1278: 2 | G1278: May | H1278: 1994 | I1278: 175.00 | J1278: 331.00 | K1278: 156
A1279: U.S.A. | B1279: WEST | C1279: CONSUMER | D1279: FURNITURE | E1279: BED | F1279: 2 | G1279: Jun | H1279: 1994 | I1279: 869.00 | J1279: 784.00 | K1279: -85
A1280: U.S.A. | B1280: WEST | C1280: CONSUMER | D1280: FURNITURE | E1280: BED | F1280: 3 | G1280: Jul | H1280: 1994 | I1280: 820.00 | J1280: 563.00 | K1280: -257
A1281: U.S.A. | B1281: WEST | C1281: CONSUMER | D1281: FURNITURE | E1281: BED | F1281: 3 | G1281: Aug | H1281: 1994 | I1281: 554.00 | J1281: 229.00 | K1281: -325
A1282: U.S.A. | B1282: WEST | C1282: CONSUMER | D1282: FURNITURE | E1282: BED | F1282: 3 | G1282: Sep | H1282: 1994 | I1282: 126.00 | J1282: 451.00 | K1282: 325
A1283: U.S.A. | B1283: WEST | C1283: CONSUMER | D1283: FURNITURE | E1283: BED | F1283: 4 | G1283: Oct | H1283: 1994 | I1283: 760.00 | J1283: 974.00 | K1283: 214
A1284: U.S.A. | B1284: WEST | C1284: CONSUMER | D1284: FURNITURE | E1284: BED | F1284: 4 | G1284: Nov | H1284: 1994 | I1284: 446.00 | J1284: 484.00 | K1284: 38
A1285: U.S.A. | B1285: WEST | C1285: CONSUMER | D1285: FURNITURE | E1285: BED | F1285: 4 | G1285: Dec | H1285: 1994 | I1285: 254.00 | J1285: 69.00 | K1285: -185
A1286: U.S.A. | B1286: WEST | C1286: CONSUMER | D1286: OFFICE | E1286: TABLE | F1286: 1 | G1286: Jan | H1286: 1994 | I1286: 623.00 | J1286: 619.00 | K1286: -4
A1287: U.S.A. | B1287: WEST | C1287: CONSUMER | D1287: OFFICE | E1287: TABLE | F1287: 1 | G1287: Feb | H1287: 1994 | I1287: 849.00 | J1287: 701.00 | K1287: -148
A1288: U.S.A. | B1288: WEST | C1288: CONSUMER | D1288: OFFICE | E1288: TABLE | F1288: 1 | G1288: Mar | H1288: 1994 | I1288: 438.00 | J1288: 104.00 | K1288: -334
A1289: U.S.A. | B1289: WEST | C1289: CONSUMER | D1289: OFFICE | E1289: TABLE | F1289: 2 | G1289: Apr | H1289: 1994 | I1289: 719.00 | J1289: 114.00 | K1289: -605
A1290: U.S.A. | B1290: WEST | C1290: CONSUMER | D1290: OFFICE | E1290: TABLE | F1290: 2 | G1290: May | H1290: 1994 | I1290: 906.00 | J1290: 854.00 | K1290: -52
A1291: U.S.A. | B1291: WEST | C1291: CONSUMER | D1291: OFFICE | E1291: TABLE | F1291: 2 | G1291: Jun | H1291: 1994 | I1291: 267.00 | J1291: 563.00 | K1291: 296
A1292: U.S.A. | B1292: WEST | C1292: CONSUMER | D1292: OFFICE | E1292: TABLE | F1292: 3 | G1292: Jul | H1292: 1994 | I1292: 542.00 | J1292: 73.00 | K1292: -469
A1293: U.S.A. | B1293: WEST | C1293: CONSUMER | D1293: OFFICE | E1293: TABLE | F1293: 3 | G1293: Aug | H1293: 1994 | I1293: 552.00 | J1293: 427.00 | K1293: -125
A1294: U.S.A. | B1294: WEST | C1294: CONSUMER | D1294: OFFICE | E1294: TABLE | F1294: 3 | G1294: Sep | H1294: 1994 | I1294: 428.00 | J1294: 348.00 | K1294: -80
A1295: U.S.A. | B1295: WEST | C1295: CONSUMER | D1295: OFFICE | E1295: TABLE | F1295: 4 | G1295: Oct | H1295: 1994 | I1295: 158.00 | J1295: 148.00 | K1295: -10
A1296: U.S.A. | B1296: WEST | C1296: CONSUMER | D1296: OFFICE | E1296: TABLE | F1296: 4 | G1296: Nov | H1296: 1994 | I1296: 379.00 | J1296: 895.00 | K1296: 516
A1297: U.S.A. | B1297: WEST | C1297: CONSUMER | D1297: OFFICE | E1297: TABLE | F1297: 4 | G1297: Dec | H1297: 1994 | I1297: 142.00 | J1297: 394.00 | K1297: 252
A1298: U.S.A. | B1298: WEST | C1298: CONSUMER | D1298: OFFICE | E1298: CHAIR | F1298: 1 | G1298: Jan | H1298: 1994 | I1298: 38.00 | J1298: 565.00 | K1298: 527
A1299: U.S.A. | B1299: WEST | C1299: CONSUMER | D1299: OFFICE | E1299: CHAIR | F1299: 1 | G1299: Feb | H1299: 1994 | I1299: 194.00 | J1299: 38.00 | K1299: -156
A1300: U.S.A. | B1300: WEST | C1300: CONSUMER | D1300: OFFICE | E1300: CHAIR | F1300: 1 | G1300: Mar | H1300: 1994 | I1300: 996.00 | J1300: 185.00 | K1300: -811
A1301: U.S.A. | B1301: WEST | C1301: CONSUMER | D1301: OFFICE | E1301: CHAIR | F1301: 2 | G1301: Apr | H1301: 1994 | I1301: 532.00 | J1301: 318.00 | K1301: -214
A1302: U.S.A. | B1302: WEST | C1302: CONSUMER | D1302: OFFICE | E1302: CHAIR | F1302: 2 | G1302: May | H1302: 1994 | I1302: 391.00 | J1302: 960.00 | K1302: 569
A1303: U.S.A. | B1303: WEST | C1303: CONSUMER | D1303: OFFICE | E1303: CHAIR | F1303: 2 | G1303: Jun | H1303: 1994 | I1303: 104.00 | J1303: 122.00 | K1303: 18
A1304: U.S.A. | B1304: WEST | C1304: CONSUMER | D1304: OFFICE | E1304: CHAIR | F1304: 3 | G1304: Jul | H1304: 1994 | I1304: 22.00 | J1304: 400.00 | K1304: 378
A1305: U.S.A. | B1305: WEST | C1305: CONSUMER | D1305: OFFICE | E1305: CHAIR | F1305: 3 | G1305: Aug | H1305: 1994 | I1305: 650.00 | J1305: 301.00 | K1305: -349
A1306: U.S.A. | B1306: WEST | C1306: CONSUMER | D1306: OFFICE | E1306: CHAIR | F1306: 3 | G1306: Sep | H1306: 1994 | I1306: 143.00 | J1306: 909.00 | K1306: 766
A1307: U.S.A. | B1307: WEST | C1307: CONSUMER | D1307: OFFICE | E1307: CHAIR | F1307: 4 | G1307: Oct | H1307: 1994 | I1307: 999.00 | J1307: 433.00 | K1307: -566
A1308: U.S.A. | B1308: WEST | C1308: CONSUMER | D1308: OFFICE | E1308: CHAIR | F1308: 4 | G1308: Nov | H1308: 1994 | I1308: 415.00 | J1308: 508.00 | K1308: 93
A1309: U.S.A. | B1309: WEST | C1309: CONSUMER | D1309: OFFICE | E1309: CHAIR | F1309: 4 | G1309: Dec | H1309: 1994 | I1309: 350.00 | J1309: 648.00 | K1309: 298
A1310: U.S.A. | B1310: WEST | C1310: CONSUMER | D1310: OFFICE | E1310: DESK | F1310: 1 | G1310: Jan | H1310: 1994 | I1310: 664.00 | J1310: 890.00 | K1310: 226
A1311: U.S.A. | B1311: WEST | C1311: CONSUMER | D1311: OFFICE | E1311: DESK | F1311: 1 | G1311: Feb | H1311: 1994 | I1311: 639.00 | J1311: 665.00 | K1311: 26
A1312: U.S.A. | B1312: WEST | C1312: CONSUMER | D1312: OFFICE | E1312: DESK | F1312: 1 | G1312: Mar | H1312: 1994 | I1312: 707.00 | J1312: 329.00 | K1312: -378
A1313: U.S.A. | B1313: WEST | C1313: CONSUMER | D1313: OFFICE | E1313: DESK | F1313: 2 | G1313: Apr | H1313: 1994 | I1313: 891.00 | J1313: 417.00 | K1313: -474
A1314: U.S.A. | B1314: WEST | C1314: CONSUMER | D1314: OFFICE | E1314: DESK | F1314: 2 | G1314: May | H1314: 1994 | I1314: 466.00 | J1314: 828.00 | K1314: 362
A1315: U.S.A. | B1315: WEST | C1315: CONSUMER | D1315: OFFICE | E1315: DESK | F1315: 2 | G1315: Jun | H1315: 1994 | I1315: 451.00 | J1315: 298.00 | K1315: -153
A1316: U.S.A. | B1316: WEST | C1316: CONSUMER | D1316: OFFICE | E1316: DESK | F1316: 3 | G1316: Jul | H1316: 1994 | I1316: 451.00 | J1316: 356.00 | K1316: -95
A1317: U.S.A. | B1317: WEST | C1317: CONSUMER | D1317: OFFICE | E1317: DESK | F1317: 3 | G1317: Aug | H1317: 1994 | I1317: 874.00 | J1317: 909.00 | K1317: 35
A1318: U.S.A. | B1318: WEST | C1318: CONSUMER | D1318: OFFICE | E1318: DESK | F1318: 3 | G1318: Sep | H1318: 1994 | I1318: 805.00 | J1318: 251.00 | K1318: -554
A1319: U.S.A. | B1319: WEST | C1319: CONSUMER | D1319: OFFICE | E1319: DESK | F1319: 4 | G1319: Oct | H1319: 1994 | I1319: 426.00 | J1319: 526.00 | K1319: 100
A1320: U.S.A. | B1320: WEST | C1320: CONSUMER | D1320: OFFICE | E1320: DESK | F1320: 4 | G1320: Nov | H1320: 1994 | I1320: 932.00 | J1320: 652.00 | K1320: -280
A1321: U.S.A. | B1321: WEST | C1321: CONSUMER | D1321: OFFICE | E1321: DESK | F1321: 4 | G1321: Dec | H1321: 1994 | I1321: 581.00 | J1321: 573.00 | K1321: -8
A1322: U.S.A. | B1322: WEST | C1322: EDUCATION | D1322: FURNITURE | E1322: SOFA | F1322: 1 | G1322: Jan | H1322: 1993 | I1322: 896.00 | J1322: 404.00 | K1322: -492
A1323: U.S.A. | B1323: WEST | C1323: EDUCATION | D1323: FURNITURE | E1323: SOFA | F1323: 1 | G1323: Feb | H1323: 1993 | I1323: 973.00 | J1323: 22.00 | K1323: -951
A1324: U.S.A. | B1324: WEST | C1324: EDUCATION | D1324: FURNITURE | E1324: SOFA | F1324: 1 | G1324: Mar | H1324: 1993 | I1324: 161.00 | J1324: 744.00 | K1324: 583
A1325: U.S.A. | B1325: WEST | C1325: EDUCATION | D1325: FURNITURE | E1325: SOFA | F1325: 2 | G1325: Apr | H1325: 1993 | I1325: 934.00 | J1325: 804.00 | K1325: -130
A1326: U.S.A. | B1326: WEST | C1326: EDUCATION | D1326: FURNITURE | E1326: SOFA | F1326: 2 | G1326: May | H1326: 1993 | I1326: 697.00 | J1326: 101.00 | K1326: -596
A1327: U.S.A. | B1327: WEST | C1327: EDUCATION | D1327: FURNITURE | E1327: SOFA | F1327: 2 | G1327: Jun | H1327: 1993 | I1327: 116.00 | J1327: 293.00 | K1327: 177
A1328: U.S.A. | B1328: WEST | C1328: EDUCATION | D1328: FURNITURE | E1328: SOFA | F1328: 3 | G1328: Jul | H1328: 1993 | I1328: 84.00 | J1328: 266.00 | K1328: 182
A1329: U.S.A. | B1329: WEST | C1329: EDUCATION | D1329: FURNITURE | E1329: SOFA | F1329: 3 | G1329: Aug | H1329: 1993 | I1329: 604.00 | J1329: 372.00 | K1329: -232
A1330: U.S.A. | B1330: WEST | C1330: EDUCATION | D1330: FURNITURE | E1330: SOFA | F1330: 3 | G1330: Sep | H1330: 1993 | I1330: 371.00 | J1330: 38.00 | K1330: -333
A1331: U.S.A. | B1331: WEST | C1331: EDUCATION | D1331: FURNITURE | E1331: SOFA | F1331: 4 | G1331: Oct | H1331: 1993 | I1331: 783.00 | J1331: 385.00 | K1331: -398
A1332: U.S.A. | B1332: WEST | C1332: EDUCATION | D1332: FURNITURE | E1332: SOFA | F1332: 4 | G1332: Nov | H1332: 1993 | I1332: 335.00 | J1332: 262.00 | K1332: -73
A1333: U.S.A. | B1333: WEST | C1333: EDUCATION | D1333: FURNITURE | E1333: SOFA | F1333: 4 | G1333: Dec | H1333: 1993 | I1333: 321.00 | J1333: 961.00 | K1333: 640
A1334: U.S.A. | B1334: WEST | C1334: EDUCATION | D1334: FURNITURE | E1334: BED | F1334: 1 | G1334: Jan | H1334: 1993 | I1334: 846.00 | J1334: 18.00 | K1334: -828
A1335: U.S.A. | B1335: WEST | C1335: EDUCATION | D1335: FURNITURE | E1335: BED | F1335: 1 | G1335: Feb | H1335: 1993 | I1335: 933.00 | J1335: 512.00 | K1335: -421
A1336: U.S.A. | B1336: WEST | C1336: EDUCATION | D1336: FURNITURE | E1336: BED | F1336: 1 | G1336: Mar | H1336: 1993 | I1336: 237.00 | J1336: 337.00 | K1336: 100
A1337: U.S.A. | B1337: WEST | C1337: EDUCATION | D1337: FURNITURE | E1337: BED | F1337: 2 | G1337: Apr | H1337: 1993 | I1337: 964.00 | J1337: 167.00 | K1337: -797
A1338: U.S.A. | B1338: WEST | C1338: EDUCATION | D1338: FURNITURE | E1338: BED | F1338: 2 | G1338: May | H1338: 1993 | I1338: 382.00 | J1338: 749.00 | K1338: 367
A1339: U.S.A. | B1339: WEST | C1339: EDUCATION | D1339: FURNITURE | E1339: BED | F1339: 2 | G1339: Jun | H1339: 1993 | I1339: 610.00 | J1339: 890.00 | K1339: 280
A1340: U.S.A. | B1340: WEST | C1340: EDUCATION | D1340: FURNITURE | E1340: BED | F1340: 3 | G1340: Jul | H1340: 1993 | I1340: 148.00 | J1340: 910.00 | K1340: 762
A1341: U.S.A. | B1341: WEST | C1341: EDUCATION | D1341: FURNITURE | E1341: BED | F1341: 3 | G1341: Aug | H1341: 1993 | I1341: 837.00 | J1341: 403.00 | K1341: -434
A1342: U.S.A. | B1342: WEST | C1342: EDUCATION | D1342: FURNITURE | E1342: BED | F1342: 3 | G1342: Sep | H1342: 1993 | I1342: 85.00 | J1342: 403.00 | K1342: 318
A1343: U.S.A. | B1343: WEST | C1343: EDUCATION | D1343: FURNITURE | E1343: BED | F1343: 4 | G1343: Oct | H1343: 1993 | I1343: 425.00 | J1343: 661.00 | K1343: 236
A1344: U.S.A. | B1344: WEST | C1344: EDUCATION | D1344: FURNITURE | E1344: BED | F1344: 4 | G1344: Nov | H1344: 1993 | I1344: 633.00 | J1344: 485.00 | K1344: -148
A1345: U.S.A. | B1345: WEST | C1345: EDUCATION | D1345: FURNITURE | E1345: BED | F1345: 4 | G1345: Dec | H1345: 1993 | I1345: 515.00 | J1345: 789.00 | K1345: 274
A1346: U.S.A. | B1346: WEST | C1346: EDUCATION | D1346: OFFICE | E1346: TABLE | F1346: 1 | G1346: Jan | H1346: 1993 | I1346: 556.00 | J1346: 608.00 | K1346: 52
A1347: U.S.A. | B1347: WEST | C1347: EDUCATION | D1347: OFFICE | E1347: TABLE | F1347: 1 | G1347: Feb | H1347: 1993 | I1347: 202.00 | J1347: 840.00 | K1347: 638
A1348: U.S.A. | B1348: WEST | C1348: EDUCATION | D1348: OFFICE | E1348: TABLE | F1348: 1 | G1348: Mar | H1348: 1993 | I1348: 964.00 | J1348: 112.00 | K1348: -852
A1349: U.S.A. | B1349: WEST | C1349: EDUCATION | D1349: OFFICE | E1349: TABLE | F1349: 2 | G1349: Apr | H1349: 1993 | I1349: 112.00 | J1349: 288.00 | K1349: 176
A1350: U.S.A. | B1350: WEST | C1350: EDUCATION | D1350: OFFICE | E1350: TABLE | F1350: 2 | G1350: May | H1350: 1993 | I1350: 445.00 | J1350: 408.00 | K1350: -37
A1351: U.S.A. | B1351: WEST | C1351: EDUCATION | D1351: OFFICE | E1351: TABLE | F1351: 2 | G1351: Jun | H1351: 1993 | I1351: 884.00 | J1351: 876.00 | K1351: -8
A1352: U.S.A. | B1352: WEST | C1352: EDUCATION | D1352: OFFICE | E1352: TABLE | F1352: 3 | G1352: Jul | H1352: 1993 | I1352: 348.00 | J1352: 224.00 | K1352: -124
A1353: U.S.A. | B1353: WEST | C1353: EDUCATION | D1353: OFFICE | E1353: TABLE | F1353: 3 | G1353: Aug | H1353: 1993 | I1353: 564.00 | J1353: 133.00 | K1353: -431
A1354: U.S.A. | B1354: WEST | C1354: EDUCATION | D1354: OFFICE | E1354: TABLE | F1354: 3 | G1354: Sep | H1354: 1993 | I1354: 568.00 | J1354: 662.00 | K1354: 94
A1355: U.S.A. | B1355: WEST | C1355: EDUCATION | D1355: OFFICE | E1355: TABLE | F1355: 4 | G1355: Oct | H1355: 1993 | I1355: 882.00 | J1355: 68.00 | K1355: -814
A1356: U.S.A. | B1356: WEST | C1356: EDUCATION | D1356: OFFICE | E1356: TABLE | F1356: 4 | G1356: Nov | H1356: 1993 | I1356: 542.00 | J1356: 626.00 | K1356: 84
A1357: U.S.A. | B1357: WEST | C1357: EDUCATION | D1357: OFFICE | E1357: TABLE | F1357: 4 | G1357: Dec | H1357: 1993 | I1357: 119.00 | J1357: 678.00 | K1357: 559
A1358: U.S.A. | B1358: WEST | C1358: EDUCATION | D1358: OFFICE | E1358: CHAIR | F1358: 1 | G1358: Jan | H1358: 1993 | I1358: 261.00 | J1358: 251.00 | K1358: -10
A1359: U.S.A. | B1359: WEST | C1359: EDUCATION | D1359: OFFICE | E1359: CHAIR | F1359: 1 | G1359: Feb | H1359: 1993 | I1359: 122.00 | J1359: 783.00 | K1359: 661
A1360: U.S.A. | B1360: WEST | C1360: EDUCATION | D1360: OFFICE | E1360: CHAIR | F1360: 1 | G1360: Mar | H1360: 1993 | I1360: 296.00 | J1360: 425.00 | K1360: 129
A1361: U.S.A. | B1361: WEST | C1361: EDUCATION | D1361: OFFICE | E1361: CHAIR | F1361: 2 | G1361: Apr | H1361: 1993 | I1361: 391.00 | J1361: 859.00 | K1361: 468
A1362: U.S.A. | B1362: WEST | C1362: EDUCATION | D1362: OFFICE | E1362: CHAIR | F1362: 2 | G1362: May | H1362: 1993 | I1362: 75.00 | J1362: 314.00 | K1362: 239
A1363: U.S.A. | B1363: WEST | C1363: EDUCATION | D1363: OFFICE | E1363: CHAIR | F1363: 2 | G1363: Jun | H1363: 1993 | I1363: 731.00 | J1363: 153.00 | K1363: -578
A1364: U.S.A. | B1364: WEST | C1364: EDUCATION | D1364: OFFICE | E1364: CHAIR | F1364: 3 | G1364: Jul | H1364: 1993 | I1364: 883.00 | J1364: 955.00 | K1364: 72
A1365: U.S.A. | B1365: WEST | C1365: EDUCATION | D1365: OFFICE | E1365: CHAIR | F1365: 3 | G1365: Aug | H1365: 1993 | I1365: 707.00 | J1365: 654.00 | K1365: -53
A1366: U.S.A. | B1366: WEST | C1366: EDUCATION | D1366: OFFICE | E1366: CHAIR | F1366: 3 | G1366: Sep | H1366: 1993 | I1366: 97.00 | J1366: 693.00 | K1366: 596
A1367: U.S.A. | B1367: WEST | C1367: EDUCATION | D1367: OFFICE | E1367: CHAIR | F1367: 4 | G1367: Oct | H1367: 1993 | I1367: 390.00 | J1367: 757.00 | K1367: 367
A1368: U.S.A. | B1368: WEST | C1368: EDUCATION | D1368: OFFICE | E1368: CHAIR | F1368: 4 | G1368: Nov | H1368: 1993 | I1368: 237.00 | J1368: 221.00 | K1368: -16
A1369: U.S.A. | B1369: WEST | C1369: EDUCATION | D1369: OFFICE | E1369: CHAIR | F1369: 4 | G1369: Dec | H1369: 1993 | I1369: 496.00 | J1369: 942.00 | K1369: 446
A1370: U.S.A. | B1370: WEST | C1370: EDUCATION | D1370: OFFICE | E1370: DESK | F1370: 1 | G1370: Jan | H1370: 1993 | I1370: 144.00 | J1370: 796.00 | K1370: 652
A1371: U.S.A. | B1371: WEST | C1371: EDUCATION | D1371: OFFICE | E1371: DESK | F1371: 1 | G1371: Feb | H1371: 1993 | I1371: 142.00 | J1371: 257.00 | K1371: 115
A1372: U.S.A. | B1372: WEST | C1372: EDUCATION | D1372: OFFICE | E1372: DESK | F1372: 1 | G1372: Mar | H1372: 1993 | I1372: 273.00 | J1372: 611.00 | K1372: 338
A1373: U.S.A. | B1373: WEST | C1373: EDUCATION | D1373: OFFICE | E1373: DESK | F1373: 2 | G1373: Apr | H1373: 1993 | I1373: 915.00 | J1373: 6.00 | K1373: -909
A1374: U.S.A. | B1374: WEST | C1374: EDUCATION | D1374: OFFICE | E1374: DESK | F1374: 2 | G1374: May | H1374: 1993 | I1374: 920.00 | J1374: 125.00 | K1374: -795
A1375: U.S.A. | B1375: WEST | C1375: EDUCATION | D1375: OFFICE | E1375: DESK | F1375: 2 | G1375: Jun | H1375: 1993 | I1375: 294.00 | J1375: 745.00 | K1375: 451
A1376: U.S.A. | B1376: WEST | C1376: EDUCATION | D1376: OFFICE | E1376: DESK | F1376: 3 | G1376: Jul | H1376: 1993 | I1376: 681.00 | J1376: 437.00 | K1376: -244
A1377: U.S.A. | B1377: WEST | C1377: EDUCATION | D1377: OFFICE | E1377: DESK | F1377: 3 | G1377: Aug | H1377: 1993 | I1377: 86.00 | J1377: 906.00 | K1377: 820
A1378: U.S.A. | B1378: WEST | C1378: EDUCATION | D1378: OFFICE | E1378: DESK | F1378: 3 | G1378: Sep | H1378: 1993 | I1378: 764.00 | J1378: 844.00 | K1378: 80
A1379: U.S.A. | B1379: WEST | C1379: EDUCATION | D1379: OFFICE | E1379: DESK | F1379: 4 | G1379: Oct | H1379: 1993 | I1379: 269.00 | J1379: 413.00 | K1379: 144
A1380: U.S.A. | B1380: WEST | C1380: EDUCATION | D1380: OFFICE | E1380: DESK | F1380: 4 | G1380: Nov | H1380: 1993 | I1380: 138.00 | J1380: 869.00 | K1380: 731
A1381: U.S.A. | B1381: WEST | C1381: EDUCATION | D1381: OFFICE | E1381: DESK | F1381: 4 | G1381: Dec | H1381: 1993 | I1381: 834.00 | J1381: 403.00 | K1381: -431
A1382: U.S.A. | B1382: WEST | C1382: EDUCATION | D1382: FURNITURE | E1382: SOFA | F1382: 1 | G1382: Jan | H1382: 1994 | I1382: 177.00 | J1382: 831.00 | K1382: 654
A1383: U.S.A. | B1383: WEST | C1383: EDUCATION | D1383: FURNITURE | E1383: SOFA | F1383: 1 | G1383: Feb | H1383: 1994 | I1383: 371.00 | J1383: 579.00 | K1383: 208
A1384: U.S.A. | B1384: WEST | C1384: EDUCATION | D1384: FURNITURE | E1384: SOFA | F1384: 1 | G1384: Mar | H1384: 1994 | I1384: 583.00 | J1384: 301.00 | K1384: -282
A1385: U.S.A. | B1385: WEST | C1385: EDUCATION | D1385: FURNITURE | E1385: SOFA | F1385: 2 | G1385: Apr | H1385: 1994 | I1385: 364.00 | J1385: 693.00 | K1385: 329
A1386: U.S.A. | B1386: WEST | C1386: EDUCATION | D1386: FURNITURE | E1386: SOFA | F1386: 2 | G1386: May | H1386: 1994 | I1386: 343.00 | J1386: 895.00 | K1386: 552
A1387: U.S.A. | B1387: WEST | C1387: EDUCATION | D1387: FURNITURE | E1387: SOFA | F1387: 2 | G1387: Jun | H1387: 1994 | I1387: 854.00 | J1387: 320.00 | K1387: -534
A1388: U.S.A. | B1388: WEST | C1388: EDUCATION | D1388: FURNITURE | E1388: SOFA | F1388: 3 | G1388: Jul | H1388: 1994 | I1388: 691.00 | J1388: 284.00 | K1388: -407
A1389: U.S.A. | B1389: WEST | C1389: EDUCATION | D1389: FURNITURE | E1389: SOFA | F1389: 3 | G1389: Aug | H1389: 1994 | I1389: 387.00 | J1389: 362.00 | K1389: -25
A1390: U.S.A. | B1390: WEST | C1390: EDUCATION | D1390: FURNITURE | E1390: SOFA | F1390: 3 | G1390: Sep | H1390: 1994 | I1390: 298.00 | J1390: 132.00 | K1390: -166
A1391: U.S.A. | B1391: WEST | C1391: EDUCATION | D1391: FURNITURE | E1391: SOFA | F1391: 4 | G1391: Oct | H1391: 1994 | I1391: 635.00 | J1391: 42.00 | K1391: -593
A1392: U.S.A. | B1392: WEST | C1392: EDUCATION | D1392: FURNITURE | E1392: SOFA | F1392: 4 | G1392: Nov | H1392: 1994 | I1392: 81.00 | J1392: 118.00 | K1392: 37
A1393: U.S.A. | B1393: WEST | C1393: EDUCATION | D1393: FURNITURE | E1393: SOFA | F1393: 4 | G1393: Dec | H1393: 1994 | I1393: 375.00 | J1393: 42.00 | K1393: -333
A1394: U.S.A. | B1394: WEST | C1394: EDUCATION | D1394: FURNITURE | E1394: BED | F1394: 1 | G1394: Jan | H1394: 1994 | I1394: 512.00 | J1394: 415.00 | K1394: -97
A1395: U.S.A. | B1395: WEST | C1395: EDUCATION | D1395: FURNITURE | E1395: BED | F1395: 1 | G1395: Feb | H1395: 1994 | I1395: 156.00 | J1395: 418.00 | K1395: 262
A1396: U.S.A. | B1396: WEST | C1396: EDUCATION | D1396: FURNITURE | E1396: BED | F1396: 1 | G1396: Mar | H1396: 1994 | I1396: 464.00 | J1396: 163.00 | K1396: -301
A1397: U.S.A. | B1397: WEST | C1397: EDUCATION | D1397: FURNITURE | E1397: BED | F1397: 2 | G1397: Apr | H1397: 1994 | I1397: 813.00 | J1397: 298.00 | K1397: -515
A1398: U.S.A. | B1398: WEST | C1398: EDUCATION | D1398: FURNITURE | E1398: BED | F1398: 2 | G1398: May | H1398: 1994 | I1398: 455.00 | J1398: 584.00 | K1398: 129
A1399: U.S.A. | B1399: WEST | C1399: EDUCATION | D1399: FURNITURE | E1399: BED | F1399: 2 | G1399: Jun | H1399: 1994 | I1399: 366.00 | J1399: 797.00 | K1399: 431
A1400: U.S.A. | B1400: WEST | C1400: EDUCATION | D1400: FURNITURE | E1400: BED | F1400: 3 | G1400: Jul | H1400: 1994 | I1400: 734.00 | J1400: 767.00 | K1400: 33
A1401: U.S.A. | B1401: WEST | C1401: EDUCATION | D1401: FURNITURE | E1401: BED | F1401: 3 | G1401: Aug | H1401: 1994 | I1401: 451.00 | J1401: 984.00 | K1401: 533
A1402: U.S.A. | B1402: WEST | C1402: EDUCATION | D1402: FURNITURE | E1402: BED | F1402: 3 | G1402: Sep | H1402: 1994 | I1402: 134.00 | J1402: 388.00 | K1402: 254
A1403: U.S.A. | B1403: WEST | C1403: EDUCATION | D1403: FURNITURE | E1403: BED | F1403: 4 | G1403: Oct | H1403: 1994 | I1403: 547.00 | J1403: 924.00 | K1403: 377
A1404: U.S.A. | B1404: WEST | C1404: EDUCATION | D1404: FURNITURE | E1404: BED | F1404: 4 | G1404: Nov | H1404: 1994 | I1404: 802.00 | J1404: 566.00 | K1404: -236
A1405: U.S.A. | B1405: WEST | C1405: EDUCATION | D1405: FURNITURE | E1405: BED | F1405: 4 | G1405: Dec | H1405: 1994 | I1405: 61.00 | J1405: 390.00 | K1405: 329
A1406: U.S.A. | B1406: WEST | C1406: EDUCATION | D1406: OFFICE | E1406: TABLE | F1406: 1 | G1406: Jan | H1406: 1994 | I1406: 248.00 | J1406: 361.00 | K1406: 113
A1407: U.S.A. | B1407: WEST | C1407: EDUCATION | D1407: OFFICE | E1407: TABLE | F1407: 1 | G1407: Feb | H1407: 1994 | I1407: 868.00 | J1407: 464.00 | K1407: -404
A1408: U.S.A. | B1408: WEST | C1408: EDUCATION | D1408: OFFICE | E1408: TABLE | F1408: 1 | G1408: Mar | H1408: 1994 | I1408: 841.00 | J1408: 681.00 | K1408: -160
A1409: U.S.A. | B1409: WEST | C1409: EDUCATION | D1409: OFFICE | E1409: TABLE | F1409: 2 | G1409: Apr | H1409: 1994 | I1409: 484.00 | J1409: 377.00 | K1409: -107
A1410: U.S.A. | B1410: WEST | C1410: EDUCATION | D1410: OFFICE | E1410: TABLE | F1410: 2 | G1410: May | H1410: 1994 | I1410: 986.00 | J1410: 222.00 | K1410: -764
A1411: U.S.A. | B1411: WEST | C1411: EDUCATION | D1411: OFFICE | E1411: TABLE | F1411: 2 | G1411: Jun | H1411: 1994 | I1411: 39.00 | J1411: 972.00 | K1411: 933
A1412: U.S.A. | B1412: WEST | C1412: EDUCATION | D1412: OFFICE | E1412: TABLE | F1412: 3 | G1412: Jul | H1412: 1994 | I1412: 930.00 | J1412: 56.00 | K1412: -874
A1413: U.S.A. | B1413: WEST | C1413: EDUCATION | D1413: OFFICE | E1413: TABLE | F1413: 3 | G1413: Aug | H1413: 1994 | I1413: 252.00 | J1413: 695.00 | K1413: 443
A1414: U.S.A. | B1414: WEST | C1414: EDUCATION | D1414: OFFICE | E1414: TABLE | F1414: 3 | G1414: Sep | H1414: 1994 | I1414: 794.00 | J1414: 908.00 | K1414: 114
A1415: U.S.A. | B1415: WEST | C1415: EDUCATION | D1415: OFFICE | E1415: TABLE | F1415: 4 | G1415: Oct | H1415: 1994 | I1415: 658.00 | J1415: 328.00 | K1415: -330
A1416: U.S.A. | B1416: WEST | C1416: EDUCATION | D1416: OFFICE | E1416: TABLE | F1416: 4 | G1416: Nov | H1416: 1994 | I1416: 139.00 | J1416: 891.00 | K1416: 752
A1417: U.S.A. | B1417: WEST | C1417: EDUCATION | D1417: OFFICE | E1417: TABLE | F1417: 4 | G1417: Dec | H1417: 1994 | I1417: 331.00 | J1417: 265.00 | K1417: -66
A1418: U.S.A. | B1418: WEST | C1418: EDUCATION | D1418: OFFICE | E1418: CHAIR | F1418: 1 | G1418: Jan | H1418: 1994 | I1418: 814.00 | J1418: 31.00 | K1418: -783
A1419: U.S.A. | B1419: WEST | C1419: EDUCATION | D1419: OFFICE | E1419: CHAIR | F1419: 1 | G1419: Feb | H1419: 1994 | I1419: 765.00 | J1419: 540.00 | K1419: -225
A1420: U.S.A. | B1420: WEST | C1420: EDUCATION | D1420: OFFICE | E1420: CHAIR | F1420: 1 | G1420: Mar | H1420: 1994 | I1420: 308.00 | J1420: 352.00 | K1420: 44
A1421: U.S.A. | B1421: WEST | C1421: EDUCATION | D1421: OFFICE | E1421: CHAIR | F1421: 2 | G1421: Apr | H1421: 1994 | I1421: 327.00 | J1421: 904.00 | K1421: 577
A1422: U.S.A. | B1422: WEST | C1422: EDUCATION | D1422: OFFICE | E1422: CHAIR | F1422: 2 | G1422: May | H1422: 1994 | I1422: 266.00 | J1422: 436.00 | K1422: 170
A1423: U.S.A. | B1423: WEST | C1423: EDUCATION | D1423: OFFICE | E1423: CHAIR | F1423: 2 | G1423: Jun | H1423: 1994 | I1423: 699.00 | J1423: 281.00 | K1423: -418
A1424: U.S.A. | B1424: WEST | C1424: EDUCATION | D1424: OFFICE | E1424: CHAIR | F1424: 3 | G1424: Jul | H1424: 1994 | I1424: 599.00 | J1424: 801.00 | K1424: 202
A1425: U.S.A. | B1425: WEST | C1425: EDUCATION | D1425: OFFICE | E1425: CHAIR | F1425: 3 | G1425: Aug | H1425: 1994 | I1425: 950.00 | J1425: 273.00 | K1425: -677
A1426: U.S.A. | B1426: WEST | C1426: EDUCATION | D1426: OFFICE | E1426: CHAIR | F1426: 3 | G1426: Sep | H1426: 1994 | I1426: 117.00 | J1426: 716.00 | K1426: 599
A1427: U.S.A. | B1427: WEST | C1427: EDUCATION | D1427: OFFICE | E1427: CHAIR | F1427: 4 | G1427: Oct | H1427: 1994 | I1427: 632.00 | J1427: 902.00 | K1427: 270
A1428: U.S.A. | B1428: WEST | C1428: EDUCATION | D1428: OFFICE | E1428: CHAIR | F1428: 4 | G1428: Nov | H1428: 1994 | I1428: 35.00 | J1428: 341.00 | K1428: 306
A1429: U.S.A. | B1429: WEST | C1429: EDUCATION | D1429: OFFICE | E1429: CHAIR | F1429: 4 | G1429: Dec | H1429: 1994 | I1429: 562.00 | J1429: 155.00 | K1429: -407
A1430: U.S.A. | B1430: WEST | C1430: EDUCATION | D1430: OFFICE | E1430: DESK | F1430: 1 | G1430: Jan | H1430: 1994 | I1430: 112.00 | J1430: 137.00 | K1430: 25
A1431: U.S.A. | B1431: WEST | C1431: EDUCATION | D1431: OFFICE | E1431: DESK | F1431: 1 | G1431: Feb | H1431: 1994 | I1431: 921.00 | J1431: 922.00 | K1431: 1
A1432: U.S.A. | B1432: WEST | C1432: EDUCATION | D1432: OFFICE | E1432: DESK | F1432: 1 | G1432: Mar | H1432: 1994 | I1432: 859.00 | J1432: 202.00 | K1432: -657
A1433: U.S.A. | B1433: WEST | C1433: EDUCATION | D1433: OFFICE | E1433: DESK | F1433: 2 | G1433: Apr | H1433: 1994 | I1433: 442.00 | J1433: 955.00 | K1433: 513
A1434: U.S.A. | B1434: WEST | C1434: EDUCATION | D1434: OFFICE | E1434: DESK | F1434: 2 | G1434: May | H1434: 1994 | I1434: 593.00 | J1434: 781.00 | K1434: 188
A1435: U.S.A. | B1435: WEST | C1435: EDUCATION | D1435: OFFICE | E1435: DESK | F1435: 2 | G1435: Jun | H1435: 1994 | I1435: 346.00 | J1435: 12.00 | K1435: -334
A1436: U.S.A. | B1436: WEST | C1436: EDUCATION | D1436: OFFICE | E1436: DESK | F1436: 3 | G1436: Jul | H1436: 1994 | I1436: 312.00 | J1436: 931.00 | K1436: 619
A1437: U.S.A. | B1437: WEST | C1437: EDUCATION | D1437: OFFICE | E1437: DESK | F1437: 3 | G1437: Aug | H1437: 1994 | I1437: 690.00 | J1437: 95.00 | K1437: -595
A1438: U.S.A. | B1438: WEST | C1438: EDUCATION | D1438: OFFICE | E1438: DESK | F1438: 3 | G1438: Sep | H1438: 1994 | I1438: 344.00 | J1438: 795.00 | K1438: 451
A1439: U.S.A. | B1439: WEST | C1439: EDUCATION | D1439: OFFICE | E1439: DESK | F1439: 4 | G1439: Oct | H1439: 1994 | I1439: 784.00 | J1439: 542.00 | K1439: -242
A1440: U.S.A. | B1440: WEST | C1440: EDUCATION | D1440: OFFICE | E1440: DESK | F1440: 4 | G1440: Nov | H1440: 1994 | I1440: 639.00 | J1440: 935.00 | K1440: 296
A1441: U.S.A. | B1441: WEST | C1441: EDUCATION | D1441: OFFICE | E1441: DESK | F1441: 4 | G1441: Dec | H1441: 1994 | I1441: 726.00 | J1441: 269.00 | K1441: -457
I1442: =SUBTOTAL(9,R[-1440]C:R[-1]C) -> 706295.00 | J1442: =SUBTOTAL(9,R[-1440]C:R[-1]C) -> 730337.00 | K1442: =SUBTOTAL(9,R[-1440]C:R[-1]C) -> 24042

Sheet: Table 2 - Data Set WORK.PRDSALE
A1: Country | B1: Region | C1: Division | D1: Product Type | E1: Product | F1: Quarter | G1: Month | H1: Year | I1: Predicted Sales For Area | J1: Actual Sales Amount | K1: Difference
A2: CANADA | B2: EAST | C2: CONSUMER | D2: FURNITURE | E2: SOFA | F2: 1 | G2: Jan | H2: 1993 | I2: 425.00 | J2: 5.00 | K2: -420
A3: CANADA | B3: EAST | C3: CONSUMER | D3: FURNITURE | E3: SOFA | F3: 1 | G3: Feb | H3: 1993 | I3: 215.00 | J3: 164.00 | K3: -51
A4: CANADA | B4: EAST | C4: CONSUMER | D4: FURNITURE | E4: SOFA | F4: 1 | G4: Mar | H4: 1993 | I4: 948.00 | J4: 422.00 | K4: -526
A5: CANADA | B5: EAST | C5: CONSUMER | D5: FURNITURE | E5: SOFA | F5: 2 | G5: Apr | H5: 1993 | I5: 544.00 | J5: 424.00 | K5: -120
A6: CANADA | B6: EAST | C6: CONSUMER | D6: FURNITURE | E6: SOFA | F6: 2 | G6: May | H6: 1993 | I6: 764.00 | J6: 854.00 | K6: 90
A7: CANADA | B7: EAST | C7: CONSUMER | D7: FURNITURE | E7: SOFA | F7: 2 | G7: Jun | H7: 1993 | I7: 446.00 | J7: 168.00 | K7: -278
A8: CANADA | B8: EAST | C8: CONSUMER | D8: FURNITURE | E8: SOFA | F8: 3 | G8: Jul | H8: 1993 | I8: 957.00 | J8: 8.00 | K8: -949
A9: CANADA | B9: EAST | C9: CONSUMER | D9: FURNITURE | E9: SOFA | F9: 3 | G9: Aug | H9: 1993 | I9: 967.00 | J9: 748.00 | K9: -219
A10: CANADA | B10: EAST | C10: CONSUMER | D10: FURNITURE | E10: SOFA | F10: 3 | G10: Sep | H10: 1993 | I10: 11.00 | J10: 682.00 | K10: 671
A11: CANADA | B11: EAST | C11: CONSUMER | D11: FURNITURE | E11: SOFA | F11: 4 | G11: Oct | H11: 1993 | I11: 110.00 | J11: 300.00 | K11: 190
A12: CANADA | B12: EAST | C12: CONSUMER | D12: FURNITURE | E12: SOFA | F12: 4 | G12: Nov | H12: 1993 | I12: 263.00 | J12: 672.00 | K12: 409
A13: CANADA | B13: EAST | C13: CONSUMER | D13: FURNITURE | E13: SOFA | F13: 4 | G13: Dec | H13: 1993 | I13: 215.00 | J13: 894.00 | K13: 679
A14: CANADA | B14: EAST | C14: CONSUMER | D14: FURNITURE | E14: BED | F14: 1 | G14: Jan | H14: 1993 | I14: 414.00 | J14: 284.00 | K14: -130
A15: CANADA | B15: EAST | C15: CONSUMER | D15: FURNITURE | E15: BED | F15: 1 | G15: Feb | H15: 1993 | I15: 770.00 | J15: 705.00 | K15: -65
A16: CANADA | B16: EAST | C16: CONSUMER | D16: FURNITURE | E16: BED | F16: 1 | G16: Mar | H16: 1993 | I16: 679.00 | J16: 737.00 | K16: 58
A17: CANADA | B17: EAST | C17: CONSUMER | D17: FURNITURE | E17: BED | F17: 2 | G17: Apr | H17: 1993 | I17: 7.00 | J17: 745.00 | K17: 738
A18: CANADA | B18: EAST | C18: CONSUMER | D18: FURNITURE | E18: BED | F18: 2 | G18: May | H18: 1993 | I18: 713.00 | J18: 633.00 | K18: -80
A19: CANADA | B19: EAST | C19: CONSUMER | D19: FURNITURE | E19: BED | F19: 2 | G19: Jun | H19: 1993 | I19: 851.00 | J19: 983.00 | K19: 132
A20: CANADA | B20: EAST | C20: CONSUMER | D20: FURNITURE | E20: BED | F20: 3 | G20: Jul | H20: 1993 | I20: 944.00 | J20: 591.00 | K20: -353
A21: CANADA | B21: EAST | C21: CONSUMER | D21: FURNITURE | E21: BED | F21: 3 | G21: Aug | H21: 1993 | I21: 130.00 | J21: 42.00 | K21: -88
A22: CANADA | B22: EAST | C22: CONSUMER | D22: FURNITURE | E22: BED | F22: 3 | G22: Sep | H22: 1993 | I22: 485.00 | J22: 771.00 | K22: 286
A23: CANADA | B23: EAST | C23: CONSUMER | D23: FURNITURE | E23: BED | F23: 4 | G23: Oct | H23: 1993 | I23: 23.00 | J23: 465.00 | K23: 442
A24: CANADA | B24: EAST | C24: CONSUMER | D24: FURNITURE | E24: BED | F24: 4 | G24: Nov | H24: 1993 | I24: 193.00 | J24: 296.00 | K24: 103
A25: CANADA | B25: EAST | C25: CONSUMER | D25: FURNITURE | E25: BED | F25: 4 | G25: Dec | H25: 1993 | I25: 7.00 | J25: 890.00 | K25: 883
A26: CANADA | B26: EAST | C26: CONSUMER | D26: OFFICE | E26: TABLE | F26: 1 | G26: Jan | H26: 1993 | I26: 807.00 | J26: 197.00 | K26: -610
A27: CANADA | B27: EAST | C27: CONSUMER | D27: OFFICE | E27: TABLE | F27: 1 | G27: Feb | H27: 1993 | I27: 861.00 | J27: 51.00 | K27: -810
A28: CANADA | B28: EAST | C28: CONSUMER | D28: OFFICE | E28: TABLE | F28: 1 | G28: Mar | H28: 1993 | I28: 873.00 | J28: 570.00 | K28: -303
A29: CANADA | B29: EAST | C29: CONSUMER | D29: OFFICE | E29: TABLE | F29: 2 | G29: Apr | H29: 1993 | I29: 933.00 | J29: 423.00 | K29: -510
A30: CANADA | B30: EAST | C30: CONSUMER | D30: OFFICE | E30: TABLE | F30: 2 | G30: May | H30: 1993 | I30: 355.00 | J30: 524.00 | K30: 169
A31: CANADA | B31: EAST | C31: CONSUMER | D31: OFFICE | E31: TABLE | F31: 2 | G31: Jun | H31: 1993 | I31: 794.00 | J31: 416.00 | K31: -378
A32: CANADA | B32: EAST | C32: CONSUMER | D32: OFFICE | E32: TABLE | F32: 3 | G32: Jul | H32: 1993 | I32: 645.00 | J32: 789.00 | K32: 144
A33: CANADA | B33: EAST | C33: CONSUMER | D33: OFFICE | E33: TABLE | F33: 3 | G33: Aug | H33: 1993 | I33: 700.00 | J33: 551.00 | K33: -149
A34: CANADA | B34: EAST | C34: CONSUMER | D34: OFFICE | E34: TABLE | F34: 3 | G34: Sep | H34: 1993 | I34: 831.00 | J34: 400.00 | K34: -431
A35: CANADA | B35: EAST | C35: CONSUMER | D35: OFFICE | E35: TABLE | F35: 4 | G35: Oct | H35: 1993 | I35: 800.00 | J35: 361.00 | K35: -439
A36: CANADA | B36: EAST | C36: CONSUMER | D36: OFFICE | E36: TABLE | F36: 4 | G36: Nov | H36: 1993 | I36: 830.00 | J36: 189.00 | K36: -641
A37: CANADA | B37: EAST | C37: CONSUMER | D37: OFFICE | E37: TABLE | F37: 4 | G37: Dec | H37: 1993 | I37: 828.00 | J37: 554.00 | K37: -274
A38: CANADA | B38: EAST | C38: CONSUMER | D38: OFFICE | E38: CHAIR | F38: 1 | G38: Jan | H38: 1993 | I38: 986.00 | J38: 401.00 | K38: -585
A39: CANADA | B39: EAST | C39: CONSUMER | D39: OFFICE | E39: CHAIR | F39: 1 | G39: Feb | H39: 1993 | I39: 544.00 | J39: 181.00 | K39: -363
A40: CANADA | B40: EAST | C40: CONSUMER | D40: OFFICE | E40: CHAIR | F40: 1 | G40: Mar | H40: 1993 | I40: 182.00 | J40: 995.00 | K40: 813
A41: CANADA | B41: EAST | C41: CONSUMER | D41: OFFICE | E41: CHAIR | F41: 2 | G41: Apr | H41: 1993 | I41: 197.00 | J41: 120.00 | K41: -77
A42: CANADA | B42: EAST | C42: CONSUMER | D42: OFFICE | E42: CHAIR | F42: 2 | G42: May | H42: 1993 | I42: 435.00 | J42: 119.00 | K42: -316
A43: CANADA | B43: EAST | C43: CONSUMER | D43: OFFICE | E43: CHAIR | F43: 2 | G43: Jun | H43: 1993 | I43: 974.00 | J43: 319.00 | K43: -655
A44: CANADA | B44: EAST | C44: CONSUMER | D44: OFFICE | E44: CHAIR | F44: 3 | G44: Jul | H44: 1993 | I44: 524.00 | J44: 333.00 | K44: -191
A45: CANADA | B45: EAST | C45: CONSUMER | D45: OFFICE | E45: CHAIR | F45: 3 | G45: Aug | H45: 1993 | I45: 688.00 | J45: 923.00 | K45: 235
A46: CANADA | B46: EAST | C46: CONSUMER | D46: OFFICE | E46: CHAIR | F46: 3 | G46: Sep | H46: 1993 | I46: 750.00 | J46: 634.00 | K46: -116
A47: CANADA | B47: EAST | C47: CONSUMER | D47: OFFICE | E47: CHAIR | F47: 4 | G47: Oct | H47: 1993 | I47: 155.00 | J47: 493.00 | K47: 338
A48: CANADA | B48: EAST | C48: CONSUMER | D48: OFFICE | E48: CHAIR | F48: 4 | G48: Nov | H48: 1993 | I48: 860.00 | J48: 461.00 | K48: -399
A49: CANADA | B49: EAST | C49: CONSUMER | D49: OFFICE | E49: CHAIR | F49: 4 | G49: Dec | H49: 1993 | I49: 102.00 | J49: 304.00 | K49: 202
A50: CANADA | B50: EAST | C50: CONSUMER | D50: OFFICE | E50: DESK | F50: 1 | G50: Jan | H50: 1993 | I50: 225.00 | J50: 973.00 | K50: 748
A51: CANADA | B51: EAST | C51: CONSUMER | D51: OFFICE | E51: DESK | F51: 1 | G51: Feb | H51: 1993 | I51: 402.00 | J51: 511.00 | K51: 109
A52: CANADA | B52: EAST | C52: CONSUMER | D52: OFFICE | E52: DESK | F52: 1 | G52: Mar | H52: 1993 | I52: 697.00 | J52: 30.00 | K52: -667
A53: CANADA | B53: EAST | C53: CONSUMER | D53: OFFICE | E53: DESK | F53: 2 | G53: Apr | H53: 1993 | I53: 567.00 | J53: 895.00 | K53: 328
A54: CANADA | B54: EAST | C54: CONSUMER | D54: OFFICE | E54: DESK | F54: 2 | G54: May | H54: 1993 | I54: 231.00 | J54: 557.00 | K54: 326
A55: CANADA | B55: EAST | C55: CONSUMER | D55: OFFICE | E55: DESK | F55: 2 | G55: Jun | H55: 1993 | I55: 372.00 | J55: 282.00 | K55: -90
A56: CANADA | B56: EAST | C56: CONSUMER | D56: OFFICE | E56: DESK | F56: 3 | G56: Jul | H56: 1993 | I56: 15.00 | J56: 909.00 | K56: 894
A57: CANADA | B57: EAST | C57: CONSUMER | D57: OFFICE | E57: DESK | F57: 3 | G57: Aug | H57: 1993 | I57: 866.00 | J57: 276.00 | K57: -590
A58: CANADA | B58: EAST | C58: CONSUMER | D58: OFFICE | E58: DESK | F58: 3 | G58: Sep | H58: 1993 | I58: 452.00 | J58: 234.00 | K58: -218
A59: CANADA | B59: EAST | C59: CONSUMER | D59: OFFICE | E59: DESK | F59: 4 | G59: Oct | H59: 1993 | I59: 663.00 | J59: 479.00 | K59: -184
A60: CANADA | B60: EAST | C60: CONSUMER | D60: OFFICE | E60: DESK | F60: 4 | G60: Nov | H60: 1993 | I60: 982.00 | J60: 782.00 | K60: -200
A61: CANADA | B61: EAST | C61: CONSUMER | D61: OFFICE | E61: DESK | F61: 4 | G61: Dec | H61: 1993 | I61: 813.00 | J61: 755.00 | K61: -58
A62: CANADA | B62: EAST | C62: CONSUMER | D62: FURNITURE | E62: SOFA | F62: 1 | G62: Jan | H62: 1994 | I62: 965.00 | J62: 944.00 | K62: -21
A63: CANADA | B63: EAST | C63: CONSUMER | D63: FURNITURE | E63: SOFA | F63: 1 | G63: Feb | H63: 1994 | I63: 423.00 | J63: 403.00 | K63: -20
A64: CANADA | B64: EAST | C64: CONSUMER | D64: FURNITURE | E64: SOFA | F64: 1 | G64: Mar | H64: 1994 | I64: 753.00 | J64: 596.00 | K64: -157
A65: CANADA | B65: EAST | C65: CONSUMER | D65: FURNITURE | E65: SOFA | F65: 2 | G65: Apr | H65: 1994 | I65: 770.00 | J65: 481.00 | K65: -289
A66: CANADA | B66: EAST | C66: CONSUMER | D66: FURNITURE | E66: SOFA | F66: 2 | G66: May | H66: 1994 | I66: 263.00 | J66: 503.00 | K66: 240
A67: CANADA | B67: EAST | C67: CONSUMER | D67: FURNITURE | E67: SOFA | F67: 2 | G67: Jun | H67: 1994 | I67: 79.00 | J67: 126.00 | K67: 47
A68: CANADA | B68: EAST | C68: CONSUMER | D68: FURNITURE | E68: SOFA | F68: 3 | G68: Jul | H68: 1994 | I68: 441.00 | J68: 721.00 | K68: 280
A69: CANADA | B69: EAST | C69: CONSUMER | D69: FURNITURE | E69: SOFA | F69: 3 | G69: Aug | H69: 1994 | I69: 858.00 | J69: 271.00 | K69: -587
A70: CANADA | B70: EAST | C70: CONSUMER | D70: FURNITURE | E70: SOFA | F70: 3 | G70: Sep | H70: 1994 | I70: 667.00 | J70: 721.00 | K70: 54
A71: CANADA | B71: EAST | C71: CONSUMER | D71: FURNITURE | E71: SOFA | F71: 4 | G71: Oct | H71: 1994 | I71: 193.00 | J71: 157.00 | K71: -36
A72: CANADA | B72: EAST | C72: CONSUMER | D72: FURNITURE | E72: SOFA | F72: 4 | G72: Nov | H72: 1994 | I72: 394.00 | J72: 991.00 | K72: 597
A73: CANADA | B73: EAST | C73: CONSUMER | D73: FURNITURE | E73: SOFA | F73: 4 | G73: Dec | H73: 1994 | I73: 680.00 | J73: 499.00 | K73: -181
A74: CANADA | B74: EAST | C74: CONSUMER | D74: FURNITURE | E74: BED | F74: 1 | G74: Jan | H74: 1994 | I74: 919.00 | J74: 312.00 | K74: -607
A75: CANADA | B75: EAST | C75: CONSUMER | D75: FURNITURE | E75: BED | F75: 1 | G75: Feb | H75: 1994 | I75: 768.00 | J75: 777.00 | K75: 9
A76: CANADA | B76: EAST | C76: CONSUMER | D76: FURNITURE | E76: BED | F76: 1 | G76: Mar | H76: 1994 | I76: 854.00 | J76: 364.00 | K76: -490
A77: CANADA | B77: EAST | C77: CONSUMER | D77: FURNITURE | E77: BED | F77: 2 | G77: Apr | H77: 1994 | I77: 411.00 | J77: 601.00 | K77: 190
A78: CANADA | B78: EAST | C78: CONSUMER | D78: FURNITURE | E78: BED | F78: 2 | G78: May | H78: 1994 | I78: 736.00 | J78: 823.00 | K78: 87
A79: CANADA | B79: EAST | C79: CONSUMER | D79: FURNITURE | E79: BED | F79: 2 | G79: Jun | H79: 1994 | I79: 10.00 | J79: 847.00 | K79: 837
A80: CANADA | B80: EAST | C80: CONSUMER | D80: FURNITURE | E80: BED | F80: 3 | G80: Jul | H80: 1994 | I80: 311.00 | J80: 490.00 | K80: 179
A81: CANADA | B81: EAST | C81: CONSUMER | D81: FURNITURE | E81: BED | F81: 3 | G81: Aug | H81: 1994 | I81: 348.00 | J81: 387.00 | K81: 39
A82: CANADA | B82: EAST | C82: CONSUMER | D82: FURNITURE | E82: BED | F82: 3 | G82: Sep | H82: 1994 | I82: 458.00 | J82: 688.00 | K82: 230
A83: CANADA | B83: EAST | C83: CONSUMER | D83: FURNITURE | E83: BED | F83: 4 | G83: Oct | H83: 1994 | I83: 195.00 | J83: 650.00 | K83: 455
A84: CANADA | B84: EAST | C84: CONSUMER | D84: FURNITURE | E84: BED | F84: 4 | G84: Nov | H84: 1994 | I84: 658.00 | J84: 447.00 | K84: -211
A85: CANADA | B85: EAST | C85: CONSUMER | D85: FURNITURE | E85: BED | F85: 4 | G85: Dec | H85: 1994 | I85: 704.00 | J85: 91.00 | K85: -613
A86: CANADA | B86: EAST | C86: CONSUMER | D86: OFFICE | E86: TABLE | F86: 1 | G86: Jan | H86: 1994 | I86: 12.00 | J86: 585.00 | K86: 573
A87: CANADA | B87: EAST | C87: CONSUMER | D87: OFFICE | E87: TABLE | F87: 1 | G87: Feb | H87: 1994 | I87: 501.00 | J87: 281.00 | K87: -220
A88: CANADA | B88: EAST | C88: CONSUMER | D88: OFFICE | E88: TABLE | F88: 1 | G88: Mar | H88: 1994 | I88: 914.00 | J88: 629.00 | K88: -285
A89: CANADA | B89: EAST | C89: CONSUMER | D89: OFFICE | E89: TABLE | F89: 2 | G89: Apr | H89: 1994 | I89: 685.00 | J89: 43.00 | K89: -642
A90: CANADA | B90: EAST | C90: CONSUMER | D90: OFFICE | E90: TABLE | F90: 2 | G90: May | H90: 1994 | I90: 755.00 | J90: 533.00 | K90: -222
A91: CANADA | B91: EAST | C91: CONSUMER | D91: OFFICE | E91: TABLE | F91: 2 | G91: Jun | H91: 1994 | I91: 708.00 | J91: 882.00 | K91: 174
A92: CANADA | B92: EAST | C92: CONSUMER | D92: OFFICE | E92: TABLE | F92: 3 | G92: Jul | H92: 1994 | I92: 595.00 | J92: 790.00 | K92: 195
A93: CANADA | B93: EAST | C93: CONSUMER | D93: OFFICE | E93: TABLE | F93: 3 | G93: Aug | H93: 1994 | I93: 32.00 | J93: 600.00 | K93: 568
A94: CANADA | B94: EAST | C94: CONSUMER | D94: OFFICE | E94: TABLE | F94: 3 | G94: Sep | H94: 1994 | I94: 49.00 | J94: 148.00 | K94: 99
A95: CANADA | B95: EAST | C95: CONSUMER | D95: OFFICE | E95: TABLE | F95: 4 | G95: Oct | H95: 1994 | I95: 727.00 | J95: 237.00 | K95: -490
A96: CANADA | B96: EAST | C96: CONSUMER | D96: OFFICE | E96: TABLE | F96: 4 | G96: Nov | H96: 1994 | I96: 239.00 | J96: 488.00 | K96: 249
A97: CANADA | B97: EAST | C97: CONSUMER | D97: OFFICE | E97: TABLE | F97: 4 | G97: Dec | H97: 1994 | I97: 273.00 | J97: 457.00 | K97: 184
A98: CANADA | B98: EAST | C98: CONSUMER | D98: OFFICE | E98: CHAIR | F98: 1 | G98: Jan | H98: 1994 | I98: 425.00 | J98: 641.00 | K98: 216
A99: CANADA | B99: EAST | C99: CONSUMER | D99: OFFICE | E99: CHAIR | F99: 1 | G99: Feb | H99: 1994 | I99: 224.00 | J99: 992.00 | K99: 768
A100: CANADA | B100: EAST | C100: CONSUMER | D100: OFFICE | E100: CHAIR | F100: 1 | G100: Mar | H100: 1994 | I100: 408.00 | J100: 202.00 | K100: -206
A101: CANADA | B101: EAST | C101: CONSUMER | D101: OFFICE | E101: CHAIR | F101: 2 | G101: Apr | H101: 1994 | I101: 524.00 | J101: 770.00 | K101: 246
A102: CANADA | B102: EAST | C102: CONSUMER | D102: OFFICE | E102: CHAIR | F102: 2 | G102: May | H102: 1994 | I102: 816.00 | J102: 202.00 | K102: -614
A103: CANADA | B103: EAST | C103: CONSUMER | D103: OFFICE | E103: CHAIR | F103: 2 | G103: Jun | H103: 1994 | I103: 515.00 | J103: 14.00 | K103: -501
A104: CANADA | B104: EAST | C104: CONSUMER | D104: OFFICE | E104: CHAIR | F104: 3 | G104: Jul | H104: 1994 | I104: 793.00 | J104: 134.00 | K104: -659
A105: CANADA | B105: EAST | C105: CONSUMER | D105: OFFICE | E105: CHAIR | F105: 3 | G105: Aug | H105: 1994 | I105: 460.00 | J105: 977.00 | K105: 517
A106: CANADA | B106: EAST | C106: CONSUMER | D106: OFFICE | E106: CHAIR | F106: 3 | G106: Sep | H106: 1994 | I106: 732.00 | J106: 174.00 | K106: -558
A107: CANADA | B107: EAST | C107: CONSUMER | D107: OFFICE | E107: CHAIR | F107: 4 | G107: Oct | H107: 1994 | I107: 435.00 | J107: 429.00 | K107: -6
A108: CANADA | B108: EAST | C108: CONSUMER | D108: OFFICE | E108: CHAIR | F108: 4 | G108: Nov | H108: 1994 | I108: 38.00 | J108: 514.00 | K108: 476
A109: CANADA | B109: EAST | C109: CONSUMER | D109: OFFICE | E109: CHAIR | F109: 4 | G109: Dec | H109: 1994 | I109: 616.00 | J109: 784.00 | K109: 168
A110: CANADA | B110: EAST | C110: CONSUMER | D110: OFFICE | E110: DESK | F110: 1 | G110: Jan | H110: 1994 | I110: 523.00 | J110: 689.00 | K110: 166
A111: CANADA | B111: EAST | C111: CONSUMER | D111: OFFICE | E111: DESK | F111: 1 | G111: Feb | H111: 1994 | I111: 871.00 | J111: 496.00 | K111: -375
A112: CANADA | B112: EAST | C112: CONSUMER | D112: OFFICE | E112: DESK | F112: 1 | G112: Mar | H112: 1994 | I112: 511.00 | J112: 24.00 | K112: -487
A113: CANADA | B113: EAST | C113: CONSUMER | D113: OFFICE | E113: DESK | F113: 2 | G113: Apr | H113: 1994 | I113: 819.00 | J113: 379.00 | K113: -440
A114: CANADA | B114: EAST | C114: CONSUMER | D114: OFFICE | E114: DESK | F114: 2 | G114: May | H114: 1994 | I114: 525.00 | J114: 441.00 | K114: -84
A115: CANADA | B115: EAST | C115: CONSUMER | D115: OFFICE | E115: DESK | F115: 2 | G115: Jun | H115: 1994 | I115: 13.00 | J115: 49.00 | K115: 36
A116: CANADA | B116: EAST | C116: CONSUMER | D116: OFFICE | E116: DESK | F116: 3 | G116: Jul | H116: 1994 | I116: 694.00 | J116: 243.00 | K116: -451
A117: CANADA | B117: EAST | C117: CONSUMER | D117: OFFICE | E117: DESK | F117: 3 | G117: Aug | H117: 1994 | I117: 782.00 | J117: 295.00 | K117: -487
A118: CANADA | B118: EAST | C118: CONSUMER | D118: OFFICE | E118: DESK | F118: 3 | G118: Sep | H118: 1994 | I118: 839.00 | J118: 395.00 | K118: -444
A119: CANADA | B119: EAST | C119: CONSUMER | D119: OFFICE | E119: DESK | F119: 4 | G119: Oct | H119: 1994 | I119: 461.00 | J119: 929.00 | K119: 468
A120: CANADA | B120: EAST | C120: CONSUMER | D120: OFFICE | E120: DESK | F120: 4 | G120: Nov | H120: 1994 | I120: 303.00 | J120: 997.00 | K120: 694
A121: CANADA | B121: EAST | C121: CONSUMER | D121: OFFICE | E121: DESK | F121: 4 | G121: Dec | H121: 1994 | I121: 421.00 | J121: 889.00 | K121: 468
A122: CANADA | B122: EAST | C122: EDUCATION | D122: FURNITURE | E122: SOFA | F122: 1 | G122: Jan | H122: 1993 | I122: 850.00 | J122: 925.00 | K122: 75
A123: CANADA | B123: EAST | C123: EDUCATION | D123: FURNITURE | E123: SOFA | F123: 1 | G123: Feb | H123: 1993 | I123: 297.00 | J123: 999.00 | K123: 702
A124: CANADA | B124: EAST | C124: EDUCATION | D124: FURNITURE | E124: SOFA | F124: 1 | G124: Mar | H124: 1993 | I124: 846.00 | J124: 608.00 | K124: -238
A125: CANADA | B125: EAST | C125: EDUCATION | D125: FURNITURE | E125: SOFA | F125: 2 | G125: Apr | H125: 1993 | I125: 533.00 | J125: 642.00 | K125: 109
A126: CANADA | B126: EAST | C126: EDUCATION | D126: FURNITURE | E126: SOFA | F126: 2 | G126: May | H126: 1993 | I126: 646.00 | J126: 656.00 | K126: 10
A127: CANADA | B127: EAST | C127: EDUCATION | D127: FURNITURE | E127: SOFA | F127: 2 | G127: Jun | H127: 1993 | I127: 486.00 | J127: 948.00 | K127: 462
A128: CANADA | B128: EAST | C128: EDUCATION | D128: FURNITURE | E128: SOFA | F128: 3 | G128: Jul | H128: 1993 | I128: 717.00 | J128: 612.00 | K128: -105
A129: CANADA | B129: EAST | C129: EDUCATION | D129: FURNITURE | E129: SOFA | F129: 3 | G129: Aug | H129: 1993 | I129: 564.00 | J129: 114.00 | K129: -450
A130: CANADA | B130: EAST | C130: EDUCATION | D130: FURNITURE | E130: SOFA | F130: 3 | G130: Sep | H130: 1993 | I130: 230.00 | J130: 685.00 | K130: 455
A131: CANADA | B131: EAST | C131: EDUCATION | D131: FURNITURE | E131: SOFA | F131: 4 | G131: Oct | H131: 1993 | I131: 494.00 | J131: 657.00 | K131: 163
A132: CANADA | B132: EAST | C132: EDUCATION | D132: FURNITURE | E132: SOFA | F132: 4 | G132: Nov | H132: 1993 | I132: 903.00 | J132: 608.00 | K132: -295
A133: CANADA | B133: EAST | C133: EDUCATION | D133: FURNITURE | E133: SOFA | F133: 4 | G133: Dec | H133: 1993 | I133: 266.00 | J133: 353.00 | K133: 87
A134: CANADA | B134: EAST | C134: EDUCATION | D134: FURNITURE | E134: BED | F134: 1 | G134: Jan | H134: 1993 | I134: 585.00 | J134: 220.00 | K134: -365
A135: CANADA | B135: EAST | C135: EDUCATION | D135: FURNITURE | E135: BED | F135: 1 | G135: Feb | H135: 1993 | I135: 267.00 | J135: 444.00 | K135: 177
A136: CANADA | B136: EAST | C136: EDUCATION | D136: FURNITURE | E136: BED | F136: 1 | G136: Mar | H136: 1993 | I136: 487.00 | J136: 178.00 | K136: -309
A137: CANADA | B137: EAST | C137: EDUCATION | D137: FURNITURE | E137: BED | F137: 2 | G137: Apr | H137: 1993 | I137: 764.00 | J137: 756.00 | K137: -8
A138: CANADA | B138: EAST | C138: EDUCATION | D138: FURNITURE | E138: BED | F138: 2 | G138: May | H138: 1993 | I138: 312.00 | J138: 329.00 | K138: 17
A139: CANADA | B139: EAST | C139: EDUCATION | D139: FURNITURE | E139: BED | F139: 2 | G139: Jun | H139: 1993 | I139: 531.00 | J139: 910.00 | K139: 379
A140: CANADA | B140: EAST | C140: EDUCATION | D140: FURNITURE | E140: BED | F140: 3 | G140: Jul | H140: 1993 | I140: 536.00 | J140: 530.00 | K140: -6
A141: CANADA | B141: EAST | C141: EDUCATION | D141: FURNITURE | E141: BED | F141: 3 | G141: Aug | H141: 1993 | I141: 773.00 | J141: 101.00 | K141: -672
A142: CANADA | B142: EAST | C142: EDUCATION | D142: FURNITURE | E142: BED | F142: 3 | G142: Sep | H142: 1993 | I142: 143.00 | J142: 515.00 | K142: 372
A143: CANADA | B143: EAST | C143: EDUCATION | D143: FURNITURE | E143: BED | F143: 4 | G143: Oct | H143: 1993 | I143: 126.00 | J143: 730.00 | K143: 604
A144: CANADA | B144: EAST | C144: EDUCATION | D144: FURNITURE | E144: BED | F144: 4 | G144: Nov | H144: 1993 | I144: 862.00 | J144: 993.00 | K144: 131
A145: CANADA | B145: EAST | C145: EDUCATION | D145: FURNITURE | E145: BED | F145: 4 | G145: Dec | H145: 1993 | I145: 754.00 | J145: 954.00 | K145: 200
A146: CANADA | B146: EAST | C146: EDUCATION | D146: OFFICE | E146: TABLE | F146: 1 | G146: Jan | H146: 1993 | I146: 209.00 | J146: 688.00 | K146: 479
A147: CANADA | B147: EAST | C147: EDUCATION | D147: OFFICE | E147: TABLE | F147: 1 | G147: Feb | H147: 1993 | I147: 51.00 | J147: 544.00 | K147: 493
A148: CANADA | B148: EAST | C148: EDUCATION | D148: OFFICE | E148: TABLE | F148: 1 | G148: Mar | H148: 1993 | I148: 135.00 | J148: 954.00 | K148: 819
A149: CANADA | B149: EAST | C149: EDUCATION | D149: OFFICE | E149: TABLE | F149: 2 | G149: Apr | H149: 1993 | I149: 47.00 | J149: 445.00 | K149: 398
A150: CANADA | B150: EAST | C150: EDUCATION | D150: OFFICE | E150: TABLE | F150: 2 | G150: May | H150: 1993 | I150: 379.00 | J150: 829.00 | K150: 450
A151: CANADA | B151: EAST | C151: EDUCATION | D151: OFFICE | E151: TABLE | F151: 2 | G151: Jun | H151: 1993 | I151: 758.00 | J151: 464.00 | K151: -294
A152: CANADA | B152: EAST | C152: EDUCATION | D152: OFFICE | E152: TABLE | F152: 3 | G152: Jul | H152: 1993 | I152: 475.00 | J152: 968.00 | K152: 493
A153: CANADA | B153: EAST | C153: EDUCATION | D153: OFFICE | E153: TABLE | F153: 3 | G153: Aug | H153: 1993 | I153: 343.00 | J153: 842.00 | K153: 499
A154: CANADA | B154: EAST | C154: EDUCATION | D154: OFFICE | E154: TABLE | F154: 3 | G154: Sep | H154: 1993 | I154: 507.00 | J154: 721.00 | K154: 214
A155: CANADA | B155: EAST | C155: EDUCATION | D155: OFFICE | E155: TABLE | F155: 4 | G155: Oct | H155: 1993 | I155: 269.00 | J155: 966.00 | K155: 697
A156: CANADA | B156: EAST | C156: EDUCATION | D156: OFFICE | E156: TABLE | F156: 4 | G156: Nov | H156: 1993 | I156: 699.00 | J156: 332.00 | K156: -367
A157: CANADA | B157: EAST | C157: EDUCATION | D157: OFFICE | E157: TABLE | F157: 4 | G157: Dec | H157: 1993 | I157: 824.00 | J157: 328.00 | K157: -496
A158: CANADA | B158: EAST | C158: EDUCATION | D158: OFFICE | E158: CHAIR | F158: 1 | G158: Jan | H158: 1993 | I158: 282.00 | J158: 35.00 | K158: -247
A159: CANADA | B159: EAST | C159: EDUCATION | D159: OFFICE | E159: CHAIR | F159: 1 | G159: Feb | H159: 1993 | I159: 538.00 | J159: 995.00 | K159: 457
A160: CANADA | B160: EAST | C160: EDUCATION | D160: OFFICE | E160: CHAIR | F160: 1 | G160: Mar | H160: 1993 | I160: 679.00 | J160: 670.00 | K160: -9
A161: CANADA | B161: EAST | C161: EDUCATION | D161: OFFICE | E161: CHAIR | F161: 2 | G161: Apr | H161: 1993 | I161: 601.00 | J161: 406.00 | K161: -195
A162: CANADA | B162: EAST | C162: EDUCATION | D162: OFFICE | E162: CHAIR | F162: 2 | G162: May | H162: 1993 | I162: 577.00 | J162: 825.00 | K162: 248
A163: CANADA | B163: EAST | C163: EDUCATION | D163: OFFICE | E163: CHAIR | F163: 2 | G163: Jun | H163: 1993 | I163: 908.00 | J163: 467.00 | K163: -441
A164: CANADA | B164: EAST | C164: EDUCATION | D164: OFFICE | E164: CHAIR | F164: 3 | G164: Jul | H164: 1993 | I164: 819.00 | J164: 709.00 | K164: -110
A165: CANADA | B165: EAST | C165: EDUCATION | D165: OFFICE | E165: CHAIR | F165: 3 | G165: Aug | H165: 1993 | I165: 687.00 | J165: 522.00 | K165: -165
A166: CANADA | B166: EAST | C166: EDUCATION | D166: OFFICE | E166: CHAIR | F166: 3 | G166: Sep | H166: 1993 | I166: 157.00 | J166: 688.00 | K166: 531
A167: CANADA | B167: EAST | C167: EDUCATION | D167: OFFICE | E167: CHAIR | F167: 4 | G167: Oct | H167: 1993 | I167: 111.00 | J167: 956.00 | K167: 845
A168: CANADA | B168: EAST | C168: EDUCATION | D168: OFFICE | E168: CHAIR | F168: 4 | G168: Nov | H168: 1993 | I168: 31.00 | J168: 129.00 | K168: 98
A169: CANADA | B169: EAST | C169: EDUCATION | D169: OFFICE | E169: CHAIR | F169: 4 | G169: Dec | H169: 1993 | I169: 790.00 | J169: 687.00 | K169: -103
A170: CANADA | B170: EAST | C170: EDUCATION | D170: OFFICE | E170: DESK | F170: 1 | G170: Jan | H170: 1993 | I170: 386.00 | J170: 240.00 | K170: -146
A171: CANADA | B171: EAST | C171: EDUCATION | D171: OFFICE | E171: DESK | F171: 1 | G171: Feb | H171: 1993 | I171: 113.00 | J171: 605.00 | K171: 492
A172: CANADA | B172: EAST | C172: EDUCATION | D172: OFFICE | E172: DESK | F172: 1 | G172: Mar | H172: 1993 | I172: 68.00 | J172: 274.00 | K172: 206
A173: CANADA | B173: EAST | C173: EDUCATION | D173: OFFICE | E173: DESK | F173: 2 | G173: Apr | H173: 1993 | I173: 885.00 | J173: 422.00 | K173: -463
A174: CANADA | B174: EAST | C174: EDUCATION | D174: OFFICE | E174: DESK | F174: 2 | G174: May | H174: 1993 | I174: 575.00 | J174: 763.00 | K174: 188
A175: CANADA | B175: EAST | C175: EDUCATION | D175: OFFICE | E175: DESK | F175: 2 | G175: Jun | H175: 1993 | I175: 743.00 | J175: 561.00 | K175: -182
A176: CANADA | B176: EAST | C176: EDUCATION | D176: OFFICE | E176: DESK | F176: 3 | G176: Jul | H176: 1993 | I176: 816.00 | J176: 339.00 | K176: -477
A177: CANADA | B177: EAST | C177: EDUCATION | D177: OFFICE | E177: DESK | F177: 3 | G177: Aug | H177: 1993 | I177: 203.00 | J177: 877.00 | K177: 674
A178: CANADA | B178: EAST | C178: EDUCATION | D178: OFFICE | E178: DESK | F178: 3 | G178: Sep | H178: 1993 | I178: 581.00 | J178: 192.00 | K178: -389
A179: CANADA | B179: EAST | C179: EDUCATION | D179: OFFICE | E179: DESK | F179: 4 | G179: Oct | H179: 1993 | I179: 815.00 | J179: 604.00 | K179: -211
A180: CANADA | B180: EAST | C180: EDUCATION | D180: OFFICE | E180: DESK | F180: 4 | G180: Nov | H180: 1993 | I180: 333.00 | J180: 55.00 | K180: -278
A181: CANADA | B181: EAST | C181: EDUCATION | D181: OFFICE | E181: DESK | F181: 4 | G181: Dec | H181: 1993 | I181: 40.00 | J181: 87.00 | K181: 47
A182: CANADA | B182: EAST | C182: EDUCATION | D182: FURNITURE | E182: SOFA | F182: 1 | G182: Jan | H182: 1994 | I182: 190.00 | J182: 107.00 | K182: -83
A183: CANADA | B183: EAST | C183: EDUCATION | D183: FURNITURE | E183: SOFA | F183: 1 | G183: Feb | H183: 1994 | I183: 139.00 | J183: 354.00 | K183: 215
A184: CANADA | B184: EAST | C184: EDUCATION | D184: FURNITURE | E184: SOFA | F184: 1 | G184: Mar | H184: 1994 | I184: 217.00 | J184: 101.00 | K184: -116
A185: CANADA | B185: EAST | C185: EDUCATION | D185: FURNITURE | E185: SOFA | F185: 2 | G185: Apr | H185: 1994 | I185: 560.00 | J185: 553.00 | K185: -7
A186: CANADA | B186: EAST | C186: EDUCATION | D186: FURNITURE | E186: SOFA | F186: 2 | G186: May | H186: 1994 | I186: 148.00 | J186: 877.00 | K186: 729
A187: CANADA | B187: EAST | C187: EDUCATION | D187: FURNITURE | E187: SOFA | F187: 2 | G187: Jun | H187: 1994 | I187: 762.00 | J187: 431.00 | K187: -331
A188: CANADA | B188: EAST | C188: EDUCATION | D188: FURNITURE | E188: SOFA | F188: 3 | G188: Jul | H188: 1994 | I188: 457.00 | J188: 511.00 | K188: 54
A189: CANADA | B189: EAST | C189: EDUCATION | D189: FURNITURE | E189: SOFA | F189: 3 | G189: Aug | H189: 1994 | I189: 532.00 | J189: 157.00 | K189: -375
A190: CANADA | B190: EAST | C190: EDUCATION | D190: FURNITURE | E190: SOFA | F190: 3 | G190: Sep | H190: 1994 | I190: 629.00 | J190: 520.00 | K190: -109
A191: CANADA | B191: EAST | C191: EDUCATION | D191: FURNITURE | E191: SOFA | F191: 4 | G191: Oct | H191: 1994 | I191: 491.00 | J191: 114.00 | K191: -377
A192: CANADA | B192: EAST | C192: EDUCATION | D192: FURNITURE | E192: SOFA | F192: 4 | G192: Nov | H192: 1994 | I192: 0.00 | J192: 277.00 | K192: 277
A193: CANADA | B193: EAST | C193: EDUCATION | D193: FURNITURE | E193: SOFA | F193: 4 | G193: Dec | H193: 1994 | I193: 979.00 | J193: 561.00 | K193: -418
A194: CANADA | B194: EAST | C194: EDUCATION | D194: FURNITURE | E194: BED | F194: 1 | G194: Jan | H194: 1994 | I194: 410.00 | J194: 267.00 | K194: -143
A195: CANADA | B195: EAST | C195: EDUCATION | D195: FURNITURE | E195: BED | F195: 1 | G195: Feb | H195: 1994 | I195: 701.00 | J195: 347.00 | K195: -354
A196: CANADA | B196: EAST | C196: EDUCATION | D196: FURNITURE | E196: BED | F196: 1 | G196: Mar | H196: 1994 | I196: 204.00 | J196: 991.00 | K196: 787
A197: CANADA | B197: EAST | C197: EDUCATION | D197: FURNITURE | E197: BED | F197: 2 | G197: Apr | H197: 1994 | I197: 509.00 | J197: 923.00 | K197: 414
A198: CANADA | B198: EAST | C198: EDUCATION | D198: FURNITURE | E198: BED | F198: 2 | G198: May | H198: 1994 | I198: 378.00 | J198: 437.00 | K198: 59
A199: CANADA | B199: EAST | C199: EDUCATION | D199: FURNITURE | E199: BED | F199: 2 | G199: Jun | H199: 1994 | I199: 507.00 | J199: 737.00 | K199: 230
A200: CANADA | B200: EAST | C200: EDUCATION | D200: FURNITURE | E200: BED | F200: 3 | G200: Jul | H200: 1994 | I200: 49.00 | J200: 104.00 | K200: 55
A201: CANADA | B201: EAST | C201: EDUCATION | D201: FURNITURE | E201: BED | F201: 3 | G201: Aug | H201: 1994 | I201: 876.00 | J201: 840.00 | K201: -36
A202: CANADA | B202: EAST | C202: EDUCATION | D202: FURNITURE | E202: BED | F202: 3 | G202: Sep | H202: 1994 | I202: 66.00 | J202: 704.00 | K202: 638
A203: CANADA | B203: EAST | C203: EDUCATION | D203: FURNITURE | E203: BED | F203: 4 | G203: Oct | H203: 1994 | I203: 819.00 | J203: 889.00 | K203: 70
A204: CANADA | B204: EAST | C204: EDUCATION | D204: FURNITURE | E204: BED | F204: 4 | G204: Nov | H204: 1994 | I204: 351.00 | J204: 107.00 | K204: -244
A205: CANADA | B205: EAST | C205: EDUCATION | D205: FURNITURE | E205: BED | F205: 4 | G205: Dec | H205: 1994 | I205: 201.00 | J205: 571.00 | K205: 370
A206: CANADA | B206: EAST | C206: EDUCATION | D206: OFFICE | E206: TABLE | F206: 1 | G206: Jan | H206: 1994 | I206: 497.00 | J206: 355.00 | K206: -142
A207: CANADA | B207: EAST | C207: EDUCATION | D207: OFFICE | E207: TABLE | F207: 1 | G207: Feb | H207: 1994 | I207: 44.00 | J207: 506.00 | K207: 462
A208: CANADA | B208: EAST | C208: EDUCATION | D208: OFFICE | E208: TABLE | F208: 1 | G208: Mar | H208: 1994 | I208: 522.00 | J208: 585.00 | K208: 63
A209: CANADA | B209: EAST | C209: EDUCATION | D209: OFFICE | E209: TABLE | F209: 2 | G209: Apr | H209: 1994 | I209: 378.00 | J209: 634.00 | K209: 256
A210: CANADA | B210: EAST | C210: EDUCATION | D210: OFFICE | E210: TABLE | F210: 2 | G210: May | H210: 1994 | I210: 689.00 | J210: 662.00 | K210: -27
A211: CANADA | B211: EAST | C211: EDUCATION | D211: OFFICE | E211: TABLE | F211: 2 | G211: Jun | H211: 1994 | I211: 90.00 | J211: 783.00 | K211: 693
A212: CANADA | B212: EAST | C212: EDUCATION | D212: OFFICE | E212: TABLE | F212: 3 | G212: Jul | H212: 1994 | I212: 720.00 | J212: 786.00 | K212: 66
A213: CANADA | B213: EAST | C213: EDUCATION | D213: OFFICE | E213: TABLE | F213: 3 | G213: Aug | H213: 1994 | I213: 343.00 | J213: 710.00 | K213: 367
A214: CANADA | B214: EAST | C214: EDUCATION | D214: OFFICE | E214: TABLE | F214: 3 | G214: Sep | H214: 1994 | I214: 457.00 | J214: 950.00 | K214: 493
A215: CANADA | B215: EAST | C215: EDUCATION | D215: OFFICE | E215: TABLE | F215: 4 | G215: Oct | H215: 1994 | I215: 947.00 | J215: 274.00 | K215: -673
A216: CANADA | B216: EAST | C216: EDUCATION | D216: OFFICE | E216: TABLE | F216: 4 | G216: Nov | H216: 1994 | I216: 834.00 | J216: 406.00 | K216: -428
A217: CANADA | B217: EAST | C217: EDUCATION | D217: OFFICE | E217: TABLE | F217: 4 | G217: Dec | H217: 1994 | I217: 71.00 | J217: 515.00 | K217: 444
A218: CANADA | B218: EAST | C218: EDUCATION | D218: OFFICE | E218: CHAIR | F218: 1 | G218: Jan | H218: 1994 | I218: 795.00 | J218: 877.00 | K218: 82
A219: CANADA | B219: EAST | C219: EDUCATION | D219: OFFICE | E219: CHAIR | F219: 1 | G219: Feb | H219: 1994 | I219: 379.00 | J219: 845.00 | K219: 466
A220: CANADA | B220: EAST | C220: EDUCATION | D220: OFFICE | E220: CHAIR | F220: 1 | G220: Mar | H220: 1994 | I220: 114.00 | J220: 425.00 | K220: 311
A221: CANADA | B221: EAST | C221: EDUCATION | D221: OFFICE | E221: CHAIR | F221: 2 | G221: Apr | H221: 1994 | I221: 475.00 | J221: 899.00 | K221: 424
A222: CANADA | B222: EAST | C222: EDUCATION | D222: OFFICE | E222: CHAIR | F222: 2 | G222: May | H222: 1994 | I222: 747.00 | J222: 987.00 | K222: 240
A223: CANADA | B223: EAST | C223: EDUCATION | D223: OFFICE | E223: CHAIR | F223: 2 | G223: Jun | H223: 1994 | I223: 372.00 | J223: 641.00 | K223: 269
A224: CANADA | B224: EAST | C224: EDUCATION | D224: OFFICE | E224: CHAIR | F224: 3 | G224: Jul | H224: 1994 | I224: 415.00 | J224: 448.00 | K224: 33
A225: CANADA | B225: EAST | C225: EDUCATION | D225: OFFICE | E225: CHAIR | F225: 3 | G225: Aug | H225: 1994 | I225: 955.00 | J225: 341.00 | K225: -614
A226: CANADA | B226: EAST | C226: EDUCATION | D226: OFFICE | E226: CHAIR | F226: 3 | G226: Sep | H226: 1994 | I226: 356.00 | J226: 137.00 | K226: -219
A227: CANADA | B227: EAST | C227: EDUCATION | D227: OFFICE | E227: CHAIR | F227: 4 | G227: Oct | H227: 1994 | I227: 316.00 | J227: 235.00 | K227: -81
A228: CANADA | B228: EAST | C228: EDUCATION | D228: OFFICE | E228: CHAIR | F228: 4 | G228: Nov | H228: 1994 | I228: 351.00 | J228: 482.00 | K228: 131
A229: CANADA | B229: EAST | C229: EDUCATION | D229: OFFICE | E229: CHAIR | F229: 4 | G229: Dec | H229: 1994 | I229: 164.00 | J229: 678.00 | K229: 514
A230: CANADA | B230: EAST | C230: EDUCATION | D230: OFFICE | E230: DESK | F230: 1 | G230: Jan | H230: 1994 | I230: 672.00 | J230: 942.00 | K230: 270
A231: CANADA | B231: EAST | C231: EDUCATION | D231: OFFICE | E231: DESK | F231: 1 | G231: Feb | H231: 1994 | I231: 23.00 | J231: 912.00 | K231: 889
A232: CANADA | B232: EAST | C232: EDUCATION | D232: OFFICE | E232: DESK | F232: 1 | G232: Mar | H232: 1994 | I232: 948.00 | J232: 768.00 | K232: -180
A233: CANADA | B233: EAST | C233: EDUCATION | D233: OFFICE | E233: DESK | F233: 2 | G233: Apr | H233: 1994 | I233: 291.00 | J233: 951.00 | K233: 660
A234: CANADA | B234: EAST | C234: EDUCATION | D234: OFFICE | E234: DESK | F234: 2 | G234: May | H234: 1994 | I234: 839.00 | J234: 768.00 | K234: -71
A235: CANADA | B235: EAST | C235: EDUCATION | D235: OFFICE | E235: DESK | F235: 2 | G235: Jun | H235: 1994 | I235: 864.00 | J235: 978.00 | K235: 114
A236: CANADA | B236: EAST | C236: EDUCATION | D236: OFFICE | E236: DESK | F236: 3 | G236: Jul | H236: 1994 | I236: 337.00 | J236: 20.00 | K236: -317
A237: CANADA | B237: EAST | C237: EDUCATION | D237: OFFICE | E237: DESK | F237: 3 | G237: Aug | H237: 1994 | I237: 95.00 | J237: 298.00 | K237: 203
A238: CANADA | B238: EAST | C238: EDUCATION | D238: OFFICE | E238: DESK | F238: 3 | G238: Sep | H238: 1994 | I238: 535.00 | J238: 193.00 | K238: -342
A239: CANADA | B239: EAST | C239: EDUCATION | D239: OFFICE | E239: DESK | F239: 4 | G239: Oct | H239: 1994 | I239: 191.00 | J239: 336.00 | K239: 145
A240: CANADA | B240: EAST | C240: EDUCATION | D240: OFFICE | E240: DESK | F240: 4 | G240: Nov | H240: 1994 | I240: 412.00 | J240: 617.00 | K240: 205
A241: CANADA | B241: EAST | C241: EDUCATION | D241: OFFICE | E241: DESK | F241: 4 | G241: Dec | H241: 1994 | I241: 711.00 | J241: 709.00 | K241: -2
A242: CANADA | B242: WEST | C242: CONSUMER | D242: FURNITURE | E242: SOFA | F242: 1 | G242: Jan | H242: 1993 | I242: 730.00 | J242: 951.00 | K242: 221
A243: CANADA | B243: WEST | C243: CONSUMER | D243: FURNITURE | E243: SOFA | F243: 1 | G243: Feb | H243: 1993 | I243: 408.00 | J243: 394.00 | K243: -14
A244: CANADA | B244: WEST | C244: CONSUMER | D244: FURNITURE | E244: SOFA | F244: 1 | G244: Mar | H244: 1993 | I244: 982.00 | J244: 615.00 | K244: -367
A245: CANADA | B245: WEST | C245: CONSUMER | D245: FURNITURE | E245: SOFA | F245: 2 | G245: Apr | H245: 1993 | I245: 499.00 | J245: 653.00 | K245: 154
A246: CANADA | B246: WEST | C246: CONSUMER | D246: FURNITURE | E246: SOFA | F246: 2 | G246: May | H246: 1993 | I246: 307.00 | J246: 180.00 | K246: -127
A247: CANADA | B247: WEST | C247: CONSUMER | D247: FURNITURE | E247: SOFA | F247: 2 | G247: Jun | H247: 1993 | I247: 741.00 | J247: 649.00 | K247: -92
A248: CANADA | B248: WEST | C248: CONSUMER | D248: FURNITURE | E248: SOFA | F248: 3 | G248: Jul | H248: 1993 | I248: 640.00 | J248: 921.00 | K248: 281
A249: CANADA | B249: WEST | C249: CONSUMER | D249: FURNITURE | E249: SOFA | F249: 3 | G249: Aug | H249: 1993 | I249: 300.00 | J249: 11.00 | K249: -289
A250: CANADA | B250: WEST | C250: CONSUMER | D250: FURNITURE | E250: SOFA | F250: 3 | G250: Sep | H250: 1993 | I250: 929.00 | J250: 696.00 | K250: -233
A251: CANADA | B251: WEST | C251: CONSUMER | D251: FURNITURE | E251: SOFA | F251: 4 | G251: Oct | H251: 1993 | I251: 309.00 | J251: 795.00 | K251: 486
A252: CANADA | B252: WEST | C252: CONSUMER | D252: FURNITURE | E252: SOFA | F252: 4 | G252: Nov | H252: 1993 | I252: 340.00 | J252: 550.00 | K252: 210
A253: CANADA | B253: WEST | C253: CONSUMER | D253: FURNITURE | E253: SOFA | F253: 4 | G253: Dec | H253: 1993 | I253: 228.00 | J253: 320.00 | K253: 92
A254: CANADA | B254: WEST | C254: CONSUMER | D254: FURNITURE | E254: BED | F254: 1 | G254: Jan | H254: 1993 | I254: 570.00 | J254: 141.00 | K254: -429
A255: CANADA | B255: WEST | C255: CONSUMER | D255: FURNITURE | E255: BED | F255: 1 | G255: Feb | H255: 1993 | I255: 375.00 | J255: 64.00 | K255: -311
A256: CANADA | B256: WEST | C256: CONSUMER | D256: FURNITURE | E256: BED | F256: 1 | G256: Mar | H256: 1993 | I256: 298.00 | J256: 207.00 | K256: -91
A257: CANADA | B257: WEST | C257: CONSUMER | D257: FURNITURE | E257: BED | F257: 2 | G257: Apr | H257: 1993 | I257: 32.00 | J257: 435.00 | K257: 403
A258: CANADA | B258: WEST | C258: CONSUMER | D258: FURNITURE | E258: BED | F258: 2 | G258: May | H258: 1993 | I258: 760.00 | J258: 96.00 | K258: -664
A259: CANADA | B259: WEST | C259: CONSUMER | D259: FURNITURE | E259: BED | F259: 2 | G259: Jun | H259: 1993 | I259: 338.00 | J259: 252.00 | K259: -86
A260: CANADA | B260: WEST | C260: CONSUMER | D260: FURNITURE | E260: BED | F260: 3 | G260: Jul | H260: 1993 | I260: 149.00 | J260: 956.00 | K260: 807
A261: CANADA | B261: WEST | C261: CONSUMER | D261: FURNITURE | E261: BED | F261: 3 | G261: Aug | H261: 1993 | I261: 343.00 | J261: 633.00 | K261: 290
A262: CANADA | B262: WEST | C262: CONSUMER | D262: FURNITURE | E262: BED | F262: 3 | G262: Sep | H262: 1993 | I262: 151.00 | J262: 190.00 | K262: 39
A263: CANADA | B263: WEST | C263: CONSUMER | D263: FURNITURE | E263: BED | F263: 4 | G263: Oct | H263: 1993 | I263: 44.00 | J263: 227.00 | K263: 183
A264: CANADA | B264: WEST | C264: CONSUMER | D264: FURNITURE | E264: BED | F264: 4 | G264: Nov | H264: 1993 | I264: 583.00 | J264: 24.00 | K264: -559
A265: CANADA | B265: WEST | C265: CONSUMER | D265: FURNITURE | E265: BED | F265: 4 | G265: Dec | H265: 1993 | I265: 230.00 | J265: 420.00 | K265: 190
A266: CANADA | B266: WEST | C266: CONSUMER | D266: OFFICE | E266: TABLE | F266: 1 | G266: Jan | H266: 1993 | I266: 133.00 | J266: 795.00 | K266: 662
A267: CANADA | B267: WEST | C267: CONSUMER | D267: OFFICE | E267: TABLE | F267: 1 | G267: Feb | H267: 1993 | I267: 273.00 | J267: 301.00 | K267: 28
A268: CANADA | B268: WEST | C268: CONSUMER | D268: OFFICE | E268: TABLE | F268: 1 | G268: Mar | H268: 1993 | I268: 86.00 | J268: 304.00 | K268: 218
A269: CANADA | B269: WEST | C269: CONSUMER | D269: OFFICE | E269: TABLE | F269: 2 | G269: Apr | H269: 1993 | I269: 400.00 | J269: 49.00 | K269: -351
A270: CANADA | B270: WEST | C270: CONSUMER | D270: OFFICE | E270: TABLE | F270: 2 | G270: May | H270: 1993 | I270: 364.00 | J270: 576.00 | K270: 212
A271: CANADA | B271: WEST | C271: CONSUMER | D271: OFFICE | E271: TABLE | F271: 2 | G271: Jun | H271: 1993 | I271: 63.00 | J271: 669.00 | K271: 606
A272: CANADA | B272: WEST | C272: CONSUMER | D272: OFFICE | E272: TABLE | F272: 3 | G272: Jul | H272: 1993 | I272: 929.00 | J272: 325.00 | K272: -604
A273: CANADA | B273: WEST | C273: CONSUMER | D273: OFFICE | E273: TABLE | F273: 3 | G273: Aug | H273: 1993 | I273: 344.00 | J273: 272.00 | K273: -72
A274: CANADA | B274: WEST | C274: CONSUMER | D274: OFFICE | E274: TABLE | F274: 3 | G274: Sep | H274: 1993 | I274: 768.00 | J274: 80.00 | K274: -688
A275: CANADA | B275: WEST | C275: CONSUMER | D275: OFFICE | E275: TABLE | F275: 4 | G275: Oct | H275: 1993 | I275: 668.00 | J275: 46.00 | K275: -622
A276: CANADA | B276: WEST | C276: CONSUMER | D276: OFFICE | E276: TABLE | F276: 4 | G276: Nov | H276: 1993 | I276: 407.00 | J276: 223.00 | K276: -184
A277: CANADA | B277: WEST | C277: CONSUMER | D277: OFFICE | E277: TABLE | F277: 4 | G277: Dec | H277: 1993 | I277: 536.00 | J277: 774.00 | K277: 238
A278: CANADA | B278: WEST | C278: CONSUMER | D278: OFFICE | E278: CHAIR | F278: 1 | G278: Jan | H278: 1993 | I278: 445.00 | J278: 292.00 | K278: -153
A279: CANADA | B279: WEST | C279: CONSUMER | D279: OFFICE | E279: CHAIR | F279: 1 | G279: Feb | H279: 1993 | I279: 632.00 | J279: 540.00 | K279: -92
A280: CANADA | B280: WEST | C280: CONSUMER | D280: OFFICE | E280: CHAIR | F280: 1 | G280: Mar | H280: 1993 | I280: 855.00 | J280: 21.00 | K280: -834
A281: CANADA | B281: WEST | C281: CONSUMER | D281: OFFICE | E281: CHAIR | F281: 2 | G281: Apr | H281: 1993 | I281: 36.00 | J281: 100.00 | K281: 64
A282: CANADA | B282: WEST | C282: CONSUMER | D282: OFFICE | E282: CHAIR | F282: 2 | G282: May | H282: 1993 | I282: 250.00 | J282: 49.00 | K282: -201
A283: CANADA | B283: WEST | C283: CONSUMER | D283: OFFICE | E283: CHAIR | F283: 2 | G283: Jun | H283: 1993 | I283: 427.00 | J283: 353.00 | K283: -74
A284: CANADA | B284: WEST | C284: CONSUMER | D284: OFFICE | E284: CHAIR | F284: 3 | G284: Jul | H284: 1993 | I284: 367.00 | J284: 911.00 | K284: 544
A285: CANADA | B285: WEST | C285: CONSUMER | D285: OFFICE | E285: CHAIR | F285: 3 | G285: Aug | H285: 1993 | I285: 245.00 | J285: 823.00 | K285: 578
A286: CANADA | B286: WEST | C286: CONSUMER | D286: OFFICE | E286: CHAIR | F286: 3 | G286: Sep | H286: 1993 | I286: 893.00 | J286: 278.00 | K286: -615
A287: CANADA | B287: WEST | C287: CONSUMER | D287: OFFICE | E287: CHAIR | F287: 4 | G287: Oct | H287: 1993 | I287: 490.00 | J287: 576.00 | K287: 86
A288: CANADA | B288: WEST | C288: CONSUMER | D288: OFFICE | E288: CHAIR | F288: 4 | G288: Nov | H288: 1993 | I288: 88.00 | J288: 655.00 | K288: 567
A289: CANADA | B289: WEST | C289: CONSUMER | D289: OFFICE | E289: CHAIR | F289: 4 | G289: Dec | H289: 1993 | I289: 964.00 | J289: 763.00 | K289: -201
A290: CANADA | B290: WEST | C290: CONSUMER | D290: OFFICE | E290: DESK | F290: 1 | G290: Jan | H290: 1993 | I290: 873.00 | J290: 693.00 | K290: -180
A291: CANADA | B291: WEST | C291: CONSUMER | D291: OFFICE | E291: DESK | F291: 1 | G291: Feb | H291: 1993 | I291: 459.00 | J291: 903.00 | K291: 444
A292: CANADA | B292: WEST | C292: CONSUMER | D292: OFFICE | E292: DESK | F292: 1 | G292: Mar | H292: 1993 | I292: 224.00 | J292: 791.00 | K292: 567
A293: CANADA | B293: WEST | C293: CONSUMER | D293: OFFICE | E293: DESK | F293: 2 | G293: Apr | H293: 1993 | I293: 562.00 | J293: 108.00 | K293: -454
A294: CANADA | B294: WEST | C294: CONSUMER | D294: OFFICE | E294: DESK | F294: 2 | G294: May | H294: 1993 | I294: 199.00 | J294: 845.00 | K294: 646
A295: CANADA | B295: WEST | C295: CONSUMER | D295: OFFICE | E295: DESK | F295: 2 | G295: Jun | H295: 1993 | I295: 275.00 | J295: 452.00 | K295: 177
A296: CANADA | B296: WEST | C296: CONSUMER | D296: OFFICE | E296: DESK | F296: 3 | G296: Jul | H296: 1993 | I296: 355.00 | J296: 479.00 | K296: 124
A297: CANADA | B297: WEST | C297: CONSUMER | D297: OFFICE | E297: DESK | F297: 3 | G297: Aug | H297: 1993 | I297: 947.00 | J297: 410.00 | K297: -537
A298: CANADA | B298: WEST | C298: CONSUMER | D298: OFFICE | E298: DESK | F298: 3 | G298: Sep | H298: 1993 | I298: 454.00 | J298: 379.00 | K298: -75
A299: CANADA | B299: WEST | C299: CONSUMER | D299: OFFICE | E299: DESK | F299: 4 | G299: Oct | H299: 1993 | I299: 450.00 | J299: 740.00 | K299: 290
A300: CANADA | B300: WEST | C300: CONSUMER | D300: OFFICE | E300: DESK | F300: 4 | G300: Nov | H300: 1993 | I300: 575.00 | J300: 471.00 | K300: -104
A301: CANADA | B301: WEST | C301: CONSUMER | D301: OFFICE | E301: DESK | F301: 4 | G301: Dec | H301: 1993 | I301: 6.00 | J301: 325.00 | K301: 319
A302: CANADA | B302: WEST | C302: CONSUMER | D302: FURNITURE | E302: SOFA | F302: 1 | G302: Jan | H302: 1994 | I302: 1000.00 | J302: 845.00 | K302: -155
A303: CANADA | B303: WEST | C303: CONSUMER | D303: FURNITURE | E303: SOFA | F303: 1 | G303: Feb | H303: 1994 | I303: 21.00 | J303: 245.00 | K303: 224
A304: CANADA | B304: WEST | C304: CONSUMER | D304: FURNITURE | E304: SOFA | F304: 1 | G304: Mar | H304: 1994 | I304: 583.00 | J304: 142.00 | K304: -441
A305: CANADA | B305: WEST | C305: CONSUMER | D305: FURNITURE | E305: SOFA | F305: 2 | G305: Apr | H305: 1994 | I305: 506.00 | J305: 717.00 | K305: 211
A306: CANADA | B306: WEST | C306: CONSUMER | D306: FURNITURE | E306: SOFA | F306: 2 | G306: May | H306: 1994 | I306: 405.00 | J306: 3.00 | K306: -402
A307: CANADA | B307: WEST | C307: CONSUMER | D307: FURNITURE | E307: SOFA | F307: 2 | G307: Jun | H307: 1994 | I307: 556.00 | J307: 790.00 | K307: 234
A308: CANADA | B308: WEST | C308: CONSUMER | D308: FURNITURE | E308: SOFA | F308: 3 | G308: Jul | H308: 1994 | I308: 72.00 | J308: 646.00 | K308: 574
A309: CANADA | B309: WEST | C309: CONSUMER | D309: FURNITURE | E309: SOFA | F309: 3 | G309: Aug | H309: 1994 | I309: 103.00 | J309: 230.00 | K309: 127
A310: CANADA | B310: WEST | C310: CONSUMER | D310: FURNITURE | E310: SOFA | F310: 3 | G310: Sep | H310: 1994 | I310: 262.00 | J310: 938.00 | K310: 676
A311: CANADA | B311: WEST | C311: CONSUMER | D311: FURNITURE | E311: SOFA | F311: 4 | G311: Oct | H311: 1994 | I311: 102.00 | J311: 629.00 | K311: 527
A312: CANADA | B312: WEST | C312: CONSUMER | D312: FURNITURE | E312: SOFA | F312: 4 | G312: Nov | H312: 1994 | I312: 841.00 | J312: 317.00 | K312: -524
A313: CANADA | B313: WEST | C313: CONSUMER | D313: FURNITURE | E313: SOFA | F313: 4 | G313: Dec | H313: 1994 | I313: 159.00 | J313: 812.00 | K313: 653
A314: CANADA | B314: WEST | C314: CONSUMER | D314: FURNITURE | E314: BED | F314: 1 | G314: Jan | H314: 1994 | I314: 907.00 | J314: 910.00 | K314: 3
A315: CANADA | B315: WEST | C315: CONSUMER | D315: FURNITURE | E315: BED | F315: 1 | G315: Feb | H315: 1994 | I315: 783.00 | J315: 709.00 | K315: -74
A316: CANADA | B316: WEST | C316: CONSUMER | D316: FURNITURE | E316: BED | F316: 1 | G316: Mar | H316: 1994 | I316: 117.00 | J316: 810.00 | K316: 693
A317: CANADA | B317: WEST | C317: CONSUMER | D317: FURNITURE | E317: BED | F317: 2 | G317: Apr | H317: 1994 | I317: 416.00 | J317: 723.00 | K317: 307
A318: CANADA | B318: WEST | C318: CONSUMER | D318: FURNITURE | E318: BED | F318: 2 | G318: May | H318: 1994 | I318: 318.00 | J318: 911.00 | K318: 593
A319: CANADA | B319: WEST | C319: CONSUMER | D319: FURNITURE | E319: BED | F319: 2 | G319: Jun | H319: 1994 | I319: 888.00 | J319: 230.00 | K319: -658
A320: CANADA | B320: WEST | C320: CONSUMER | D320: FURNITURE | E320: BED | F320: 3 | G320: Jul | H320: 1994 | I320: 60.00 | J320: 448.00 | K320: 388
A321: CANADA | B321: WEST | C321: CONSUMER | D321: FURNITURE | E321: BED | F321: 3 | G321: Aug | H321: 1994 | I321: 596.00 | J321: 945.00 | K321: 349
A322: CANADA | B322: WEST | C322: CONSUMER | D322: FURNITURE | E322: BED | F322: 3 | G322: Sep | H322: 1994 | I322: 576.00 | J322: 508.00 | K322: -68
A323: CANADA | B323: WEST | C323: CONSUMER | D323: FURNITURE | E323: BED | F323: 4 | G323: Oct | H323: 1994 | I323: 576.00 | J323: 262.00 | K323: -314
A324: CANADA | B324: WEST | C324: CONSUMER | D324: FURNITURE | E324: BED | F324: 4 | G324: Nov | H324: 1994 | I324: 280.00 | J324: 441.00 | K324: 161
A325: CANADA | B325: WEST | C325: CONSUMER | D325: FURNITURE | E325: BED | F325: 4 | G325: Dec | H325: 1994 | I325: 219.00 | J325: 15.00 | K325: -204
A326: CANADA | B326: WEST | C326: CONSUMER | D326: OFFICE | E326: TABLE | F326: 1 | G326: Jan | H326: 1994 | I326: 657.00 | J326: 784.00 | K326: 127
A327: CANADA | B327: WEST | C327: CONSUMER | D327: OFFICE | E327: TABLE | F327: 1 | G327: Feb | H327: 1994 | I327: 215.00 | J327: 92.00 | K327: -123
A328: CANADA | B328: WEST | C328: CONSUMER | D328: OFFICE | E328: TABLE | F328: 1 | G328: Mar | H328: 1994 | I328: 966.00 | J328: 67.00 | K328: -899
A329: CANADA | B329: WEST | C329: CONSUMER | D329: OFFICE | E329: TABLE | F329: 2 | G329: Apr | H329: 1994 | I329: 674.00 | J329: 747.00 | K329: 73
A330: CANADA | B330: WEST | C330: CONSUMER | D330: OFFICE | E330: TABLE | F330: 2 | G330: May | H330: 1994 | I330: 574.00 | J330: 686.00 | K330: 112
A331: CANADA | B331: WEST | C331: CONSUMER | D331: OFFICE | E331: TABLE | F331: 2 | G331: Jun | H331: 1994 | I331: 266.00 | J331: 93.00 | K331: -173
A332: CANADA | B332: WEST | C332: CONSUMER | D332: OFFICE | E332: TABLE | F332: 3 | G332: Jul | H332: 1994 | I332: 680.00 | J332: 192.00 | K332: -488
A333: CANADA | B333: WEST | C333: CONSUMER | D333: OFFICE | E333: TABLE | F333: 3 | G333: Aug | H333: 1994 | I333: 362.00 | J333: 51.00 | K333: -311
A334: CANADA | B334: WEST | C334: CONSUMER | D334: OFFICE | E334: TABLE | F334: 3 | G334: Sep | H334: 1994 | I334: 412.00 | J334: 498.00 | K334: 86
A335: CANADA | B335: WEST | C335: CONSUMER | D335: OFFICE | E335: TABLE | F335: 4 | G335: Oct | H335: 1994 | I335: 431.00 | J335: 546.00 | K335: 115
A336: CANADA | B336: WEST | C336: CONSUMER | D336: OFFICE | E336: TABLE | F336: 4 | G336: Nov | H336: 1994 | I336: 94.00 | J336: 485.00 | K336: 391
A337: CANADA | B337: WEST | C337: CONSUMER | D337: OFFICE | E337: TABLE | F337: 4 | G337: Dec | H337: 1994 | I337: 345.00 | J337: 925.00 | K337: 580
A338: CANADA | B338: WEST | C338: CONSUMER | D338: OFFICE | E338: CHAIR | F338: 1 | G338: Jan | H338: 1994 | I338: 62.00 | J338: 88.00 | K338: 26
A339: CANADA | B339: WEST | C339: CONSUMER | D339: OFFICE | E339: CHAIR | F339: 1 | G339: Feb | H339: 1994 | I339: 506.00 | J339: 746.00 | K339: 240
A340: CANADA | B340: WEST | C340: CONSUMER | D340: OFFICE | E340: CHAIR | F340: 1 | G340: Mar | H340: 1994 | I340: 680.00 | J340: 927.00 | K340: 247
A341: CANADA | B341: WEST | C341: CONSUMER | D341: OFFICE | E341: CHAIR | F341: 2 | G341: Apr | H341: 1994 | I341: 153.00 | J341: 297.00 | K341: 144
A342: CANADA | B342: WEST | C342: CONSUMER | D342: OFFICE | E342: CHAIR | F342: 2 | G342: May | H342: 1994 | I342: 403.00 | J342: 291.00 | K342: -112
A343: CANADA | B343: WEST | C343: CONSUMER | D343: OFFICE | E343: CHAIR | F343: 2 | G343: Jun | H343: 1994 | I343: 98.00 | J343: 838.00 | K343: 740
A344: CANADA | B344: WEST | C344: CONSUMER | D344: OFFICE | E344: CHAIR | F344: 3 | G344: Jul | H344: 1994 | I344: 376.00 | J344: 112.00 | K344: -264
A345: CANADA | B345: WEST | C345: CONSUMER | D345: OFFICE | E345: CHAIR | F345: 3 | G345: Aug | H345: 1994 | I345: 477.00 | J345: 509.00 | K345: 32
A346: CANADA | B346: WEST | C346: CONSUMER | D346: OFFICE | E346: CHAIR | F346: 3 | G346: Sep | H346: 1994 | I346: 50.00 | J346: 472.00 | K346: 422
A347: CANADA | B347: WEST | C347: CONSUMER | D347: OFFICE | E347: CHAIR | F347: 4 | G347: Oct | H347: 1994 | I347: 592.00 | J347: 495.00 | K347: -97
A348: CANADA | B348: WEST | C348: CONSUMER | D348: OFFICE | E348: CHAIR | F348: 4 | G348: Nov | H348: 1994 | I348: 813.00 | J348: 1000.00 | K348: 187
A349: CANADA | B349: WEST | C349: CONSUMER | D349: OFFICE | E349: CHAIR | F349: 4 | G349: Dec | H349: 1994 | I349: 740.00 | J349: 241.00 | K349: -499
A350: CANADA | B350: WEST | C350: CONSUMER | D350: OFFICE | E350: DESK | F350: 1 | G350: Jan | H350: 1994 | I350: 847.00 | J350: 455.00 | K350: -392
A351: CANADA | B351: WEST | C351: CONSUMER | D351: OFFICE | E351: DESK | F351: 1 | G351: Feb | H351: 1994 | I351: 338.00 | J351: 563.00 | K351: 225
A352: CANADA | B352: WEST | C352: CONSUMER | D352: OFFICE | E352: DESK | F352: 1 | G352: Mar | H352: 1994 | I352: 517.00 | J352: 879.00 | K352: 362
A353: CANADA | B353: WEST | C353: CONSUMER | D353: OFFICE | E353: DESK | F353: 2 | G353: Apr | H353: 1994 | I353: 630.00 | J353: 312.00 | K353: -318
A354: CANADA | B354: WEST | C354: CONSUMER | D354: OFFICE | E354: DESK | F354: 2 | G354: May | H354: 1994 | I354: 381.00 | J354: 587.00 | K354: 206
A355: CANADA | B355: WEST | C355: CONSUMER | D355: OFFICE | E355: DESK | F355: 2 | G355: Jun | H355: 1994 | I355: 864.00 | J355: 628.00 | K355: -236
A356: CANADA | B356: WEST | C356: CONSUMER | D356: OFFICE | E356: DESK | F356: 3 | G356: Jul | H356: 1994 | I356: 416.00 | J356: 486.00 | K356: 70
A357: CANADA | B357: WEST | C357: CONSUMER | D357: OFFICE | E357: DESK | F357: 3 | G357: Aug | H357: 1994 | I357: 852.00 | J357: 811.00 | K357: -41
A358: CANADA | B358: WEST | C358: CONSUMER | D358: OFFICE | E358: DESK | F358: 3 | G358: Sep | H358: 1994 | I358: 815.00 | J358: 990.00 | K358: 175
A359: CANADA | B359: WEST | C359: CONSUMER | D359: OFFICE | E359: DESK | F359: 4 | G359: Oct | H359: 1994 | I359: 23.00 | J359: 35.00 | K359: 12
A360: CANADA | B360: WEST | C360: CONSUMER | D360: OFFICE | E360: DESK | F360: 4 | G360: Nov | H360: 1994 | I360: 527.00 | J360: 764.00 | K360: 237
A361: CANADA | B361: WEST | C361: CONSUMER | D361: OFFICE | E361: DESK | F361: 4 | G361: Dec | H361: 1994 | I361: 693.00 | J361: 619.00 | K361: -74
A362: CANADA | B362: WEST | C362: EDUCATION | D362: FURNITURE | E362: SOFA | F362: 1 | G362: Jan | H362: 1993 | I362: 421.00 | J362: 72.00 | K362: -349
A363: CANADA | B363: WEST | C363: EDUCATION | D363: FURNITURE | E363: SOFA | F363: 1 | G363: Feb | H363: 1993 | I363: 433.00 | J363: 926.00 | K363: 493
A364: CANADA | B364: WEST | C364: EDUCATION | D364: FURNITURE | E364: SOFA | F364: 1 | G364: Mar | H364: 1993 | I364: 394.00 | J364: 850.00 | K364: 456
A365: CANADA | B365: WEST | C365: EDUCATION | D365: FURNITURE | E365: SOFA | F365: 2 | G365: Apr | H365: 1993 | I365: 338.00 | J365: 826.00 | K365: 488
A366: CANADA | B366: WEST | C366: EDUCATION | D366: FURNITURE | E366: SOFA | F366: 2 | G366: May | H366: 1993 | I366: 764.00 | J366: 651.00 | K366: -113
A367: CANADA | B367: WEST | C367: EDUCATION | D367: FURNITURE | E367: SOFA | F367: 2 | G367: Jun | H367: 1993 | I367: 216.00 | J367: 854.00 | K367: 638
A368: CANADA | B368: WEST | C368: EDUCATION | D368: FURNITURE | E368: SOFA | F368: 3 | G368: Jul | H368: 1993 | I368: 96.00 | J368: 899.00 | K368: 803
A369: CANADA | B369: WEST | C369: EDUCATION | D369: FURNITURE | E369: SOFA | F369: 3 | G369: Aug | H369: 1993 | I369: 550.00 | J369: 309.00 | K369: -241
A370: CANADA | B370: WEST | C370: EDUCATION | D370: FURNITURE | E370: SOFA | F370: 3 | G370: Sep | H370: 1993 | I370: 636.00 | J370: 943.00 | K370: 307
A371: CANADA | B371: WEST | C371: EDUCATION | D371: FURNITURE | E371: SOFA | F371: 4 | G371: Oct | H371: 1993 | I371: 427.00 | J371: 138.00 | K371: -289
A372: CANADA | B372: WEST | C372: EDUCATION | D372: FURNITURE | E372: SOFA | F372: 4 | G372: Nov | H372: 1993 | I372: 652.00 | J372: 99.00 | K372: -553
A373: CANADA | B373: WEST | C373: EDUCATION | D373: FURNITURE | E373: SOFA | F373: 4 | G373: Dec | H373: 1993 | I373: 478.00 | J373: 270.00 | K373: -208
A374: CANADA | B374: WEST | C374: EDUCATION | D374: FURNITURE | E374: BED | F374: 1 | G374: Jan | H374: 1993 | I374: 305.00 | J374: 211.00 | K374: -94
A375: CANADA | B375: WEST | C375: EDUCATION | D375: FURNITURE | E375: BED | F375: 1 | G375: Feb | H375: 1993 | I375: 318.00 | J375: 368.00 | K375: 50
A376: CANADA | B376: WEST | C376: EDUCATION | D376: FURNITURE | E376: BED | F376: 1 | G376: Mar | H376: 1993 | I376: 417.00 | J376: 778.00 | K376: 361
A377: CANADA | B377: WEST | C377: EDUCATION | D377: FURNITURE | E377: BED | F377: 2 | G377: Apr | H377: 1993 | I377: 623.00 | J377: 808.00 | K377: 185
A378: CANADA | B378: WEST | C378: EDUCATION | D378: FURNITURE | E378: BED | F378: 2 | G378: May | H378: 1993 | I378: 761.00 | J378: 46.00 | K378: -715
A379: CANADA | B379: WEST | C379: EDUCATION | D379: FURNITURE | E379: BED | F379: 2 | G379: Jun | H379: 1993 | I379: 272.00 | J379: 466.00 | K379: 194
A380: CANADA | B380: WEST | C380: EDUCATION | D380: FURNITURE | E380: BED | F380: 3 | G380: Jul | H380: 1993 | I380: 988.00 | J380: 18.00 | K380: -970
A381: CANADA | B381: WEST | C381: EDUCATION | D381: FURNITURE | E381: BED | F381: 3 | G381: Aug | H381: 1993 | I381: 821.00 | J381: 87.00 | K381: -734
A382: CANADA | B382: WEST | C382: EDUCATION | D382: FURNITURE | E382: BED | F382: 3 | G382: Sep | H382: 1993 | I382: 962.00 | J382: 765.00 | K382: -197
A383: CANADA | B383: WEST | C383: EDUCATION | D383: FURNITURE | E383: BED | F383: 4 | G383: Oct | H383: 1993 | I383: 615.00 | J383: 62.00 | K383: -553
A384: CANADA | B384: WEST | C384: EDUCATION | D384: FURNITURE | E384: BED | F384: 4 | G384: Nov | H384: 1993 | I384: 523.00 | J384: 13.00 | K384: -510
A385: CANADA | B385: WEST | C385: EDUCATION | D385: FURNITURE | E385: BED | F385: 4 | G385: Dec | H385: 1993 | I385: 806.00 | J385: 775.00 | K385: -31
A386: CANADA | B386: WEST | C386: EDUCATION | D386: OFFICE | E386: TABLE | F386: 1 | G386: Jan | H386: 1993 | I386: 925.00 | J386: 155.00 | K386: -770
A387: CANADA | B387: WEST | C387: EDUCATION | D387: OFFICE | E387: TABLE | F387: 1 | G387: Feb | H387: 1993 | I387: 395.00 | J387: 688.00 | K387: 293
A388: CANADA | B388: WEST | C388: EDUCATION | D388: OFFICE | E388: TABLE | F388: 1 | G388: Mar | H388: 1993 | I388: 749.00 | J388: 730.00 | K388: -19
A389: CANADA | B389: WEST | C389: EDUCATION | D389: OFFICE | E389: TABLE | F389: 2 | G389: Apr | H389: 1993 | I389: 279.00 | J389: 208.00 | K389: -71
A390: CANADA | B390: WEST | C390: EDUCATION | D390: OFFICE | E390: TABLE | F390: 2 | G390: May | H390: 1993 | I390: 288.00 | J390: 525.00 | K390: 237
A391: CANADA | B391: WEST | C391: EDUCATION | D391: OFFICE | E391: TABLE | F391: 2 | G391: Jun | H391: 1993 | I391: 509.00 | J391: 483.00 | K391: -26
A392: CANADA | B392: WEST | C392: EDUCATION | D392: OFFICE | E392: TABLE | F392: 3 | G392: Jul | H392: 1993 | I392: 255.00 | J392: 748.00 | K392: 493
A393: CANADA | B393: WEST | C393: EDUCATION | D393: OFFICE | E393: TABLE | F393: 3 | G393: Aug | H393: 1993 | I393: 214.00 | J393: 6.00 | K393: -208
A394: CANADA | B394: WEST | C394: EDUCATION | D394: OFFICE | E394: TABLE | F394: 3 | G394: Sep | H394: 1993 | I394: 473.00 | J394: 168.00 | K394: -305
A395: CANADA | B395: WEST | C395: EDUCATION | D395: OFFICE | E395: TABLE | F395: 4 | G395: Oct | H395: 1993 | I395: 702.00 | J395: 301.00 | K395: -401
A396: CANADA | B396: WEST | C396: EDUCATION | D396: OFFICE | E396: TABLE | F396: 4 | G396: Nov | H396: 1993 | I396: 814.00 | J396: 9.00 | K396: -805
A397: CANADA | B397: WEST | C397: EDUCATION | D397: OFFICE | E397: TABLE | F397: 4 | G397: Dec | H397: 1993 | I397: 231.00 | J397: 778.00 | K397: 547
A398: CANADA | B398: WEST | C398: EDUCATION | D398: OFFICE | E398: CHAIR | F398: 1 | G398: Jan | H398: 1993 | I398: 555.00 | J398: 251.00 | K398: -304
A399: CANADA | B399: WEST | C399: EDUCATION | D399: OFFICE | E399: CHAIR | F399: 1 | G399: Feb | H399: 1993 | I399: 455.00 | J399: 607.00 | K399: 152
A400: CANADA | B400: WEST | C400: EDUCATION | D400: OFFICE | E400: CHAIR | F400: 1 | G400: Mar | H400: 1993 | I400: 888.00 | J400: 127.00 | K400: -761
A401: CANADA | B401: WEST | C401: EDUCATION | D401: OFFICE | E401: CHAIR | F401: 2 | G401: Apr | H401: 1993 | I401: 652.00 | J401: 513.00 | K401: -139
A402: CANADA | B402: WEST | C402: EDUCATION | D402: OFFICE | E402: CHAIR | F402: 2 | G402: May | H402: 1993 | I402: 799.00 | J402: 146.00 | K402: -653
A403: CANADA | B403: WEST | C403: EDUCATION | D403: OFFICE | E403: CHAIR | F403: 2 | G403: Jun | H403: 1993 | I403: 249.00 | J403: 917.00 | K403: 668
A404: CANADA | B404: WEST | C404: EDUCATION | D404: OFFICE | E404: CHAIR | F404: 3 | G404: Jul | H404: 1993 | I404: 539.00 | J404: 776.00 | K404: 237
A405: CANADA | B405: WEST | C405: EDUCATION | D405: OFFICE | E405: CHAIR | F405: 3 | G405: Aug | H405: 1993 | I405: 198.00 | J405: 330.00 | K405: 132
A406: CANADA | B406: WEST | C406: EDUCATION | D406: OFFICE | E406: CHAIR | F406: 3 | G406: Sep | H406: 1993 | I406: 340.00 | J406: 981.00 | K406: 641
A407: CANADA | B407: WEST | C407: EDUCATION | D407: OFFICE | E407: CHAIR | F407: 4 | G407: Oct | H407: 1993 | I407: 152.00 | J407: 862.00 | K407: 710
A408: CANADA | B408: WEST | C408: EDUCATION | D408: OFFICE | E408: CHAIR | F408: 4 | G408: Nov | H408: 1993 | I408: 347.00 | J408: 612.00 | K408: 265
A409: CANADA | B409: WEST | C409: EDUCATION | D409: OFFICE | E409: CHAIR | F409: 4 | G409: Dec | H409: 1993 | I409: 565.00 | J409: 607.00 | K409: 42
A410: CANADA | B410: WEST | C410: EDUCATION | D410: OFFICE | E410: DESK | F410: 1 | G410: Jan | H410: 1993 | I410: 363.00 | J410: 586.00 | K410: 223
A411: CANADA | B411: WEST | C411: EDUCATION | D411: OFFICE | E411: DESK | F411: 1 | G411: Feb | H411: 1993 | I411: 910.00 | J411: 441.00 | K411: -469
A412: CANADA | B412: WEST | C412: EDUCATION | D412: OFFICE | E412: DESK | F412: 1 | G412: Mar | H412: 1993 | I412: 998.00 | J412: 597.00 | K412: -401
A413: CANADA | B413: WEST | C413: EDUCATION | D413: OFFICE | E413: DESK | F413: 2 | G413: Apr | H413: 1993 | I413: 95.00 | J413: 717.00 | K413: 622
A414: CANADA | B414: WEST | C414: EDUCATION | D414: OFFICE | E414: DESK | F414: 2 | G414: May | H414: 1993 | I414: 731.00 | J414: 713.00 | K414: -18
A415: CANADA | B415: WEST | C415: EDUCATION | D415: OFFICE | E415: DESK | F415: 2 | G415: Jun | H415: 1993 | I415: 718.00 | J415: 591.00 | K415: -127
A416: CANADA | B416: WEST | C416: EDUCATION | D416: OFFICE | E416: DESK | F416: 3 | G416: Jul | H416: 1993 | I416: 467.00 | J416: 492.00 | K416: 25
A417: CANADA | B417: WEST | C417: EDUCATION | D417: OFFICE | E417: DESK | F417: 3 | G417: Aug | H417: 1993 | I417: 126.00 | J417: 170.00 | K417: 44
A418: CANADA | B418: WEST | C418: EDUCATION | D418: OFFICE | E418: DESK | F418: 3 | G418: Sep | H418: 1993 | I418: 127.00 | J418: 684.00 | K418: 557
A419: CANADA | B419: WEST | C419: EDUCATION | D419: OFFICE | E419: DESK | F419: 4 | G419: Oct | H419: 1993 | I419: 746.00 | J419: 981.00 | K419: 235
A420: CANADA | B420: WEST | C420: EDUCATION | D420: OFFICE | E420: DESK | F420: 4 | G420: Nov | H420: 1993 | I420: 878.00 | J420: 966.00 | K420: 88
A421: CANADA | B421: WEST | C421: EDUCATION | D421: OFFICE | E421: DESK | F421: 4 | G421: Dec | H421: 1993 | I421: 27.00 | J421: 439.00 | K421: 412
A422: CANADA | B422: WEST | C422: EDUCATION | D422: FURNITURE | E422: SOFA | F422: 1 | G422: Jan | H422: 1994 | I422: 18.00 | J422: 862.00 | K422: 844
A423: CANADA | B423: WEST | C423: EDUCATION | D423: FURNITURE | E423: SOFA | F423: 1 | G423: Feb | H423: 1994 | I423: 40.00 | J423: 574.00 | K423: 534
A424: CANADA | B424: WEST | C424: EDUCATION | D424: FURNITURE | E424: SOFA | F424: 1 | G424: Mar | H424: 1994 | I424: 453.00 | J424: 359.00 | K424: -94
A425: CANADA | B425: WEST | C425: EDUCATION | D425: FURNITURE | E425: SOFA | F425: 2 | G425: Apr | H425: 1994 | I425: 987.00 | J425: 958.00 | K425: -29
A426: CANADA | B426: WEST | C426: EDUCATION | D426: FURNITURE | E426: SOFA | F426: 2 | G426: May | H426: 1994 | I426: 26.00 | J426: 791.00 | K426: 765
A427: CANADA | B427: WEST | C427: EDUCATION | D427: FURNITURE | E427: SOFA | F427: 2 | G427: Jun | H427: 1994 | I427: 101.00 | J427: 284.00 | K427: 183
A428: CANADA | B428: WEST | C428: EDUCATION | D428: FURNITURE | E428: SOFA | F428: 3 | G428: Jul | H428: 1994 | I428: 969.00 | J428: 190.00 | K428: -779
A429: CANADA | B429: WEST | C429: EDUCATION | D429: FURNITURE | E429: SOFA | F429: 3 | G429: Aug | H429: 1994 | I429: 492.00 | J429: 527.00 | K429: 35
A430: CANADA | B430: WEST | C430: EDUCATION | D430: FURNITURE | E430: SOFA | F430: 3 | G430: Sep | H430: 1994 | I430: 263.00 | J430: 112.00 | K430: -151
A431: CANADA | B431: WEST | C431: EDUCATION | D431: FURNITURE | E431: SOFA | F431: 4 | G431: Oct | H431: 1994 | I431: 593.00 | J431: 271.00 | K431: -322
A432: CANADA | B432: WEST | C432: EDUCATION | D432: FURNITURE | E432: SOFA | F432: 4 | G432: Nov | H432: 1994 | I432: 923.00 | J432: 643.00 | K432: -280
A433: CANADA | B433: WEST | C433: EDUCATION | D433: FURNITURE | E433: SOFA | F433: 4 | G433: Dec | H433: 1994 | I433: 146.00 | J433: 554.00 | K433: 408
A434: CANADA | B434: WEST | C434: EDUCATION | D434: FURNITURE | E434: BED | F434: 1 | G434: Jan | H434: 1994 | I434: 586.00 | J434: 636.00 | K434: 50
A435: CANADA | B435: WEST | C435: EDUCATION | D435: FURNITURE | E435: BED | F435: 1 | G435: Feb | H435: 1994 | I435: 520.00 | J435: 458.00 | K435: -62
A436: CANADA | B436: WEST | C436: EDUCATION | D436: FURNITURE | E436: BED | F436: 1 | G436: Mar | H436: 1994 | I436: 908.00 | J436: 206.00 | K436: -702
A437: CANADA | B437: WEST | C437: EDUCATION | D437: FURNITURE | E437: BED | F437: 2 | G437: Apr | H437: 1994 | I437: 30.00 | J437: 310.00 | K437: 280
A438: CANADA | B438: WEST | C438: EDUCATION | D438: FURNITURE | E438: BED | F438: 2 | G438: May | H438: 1994 | I438: 247.00 | J438: 813.00 | K438: 566
A439: CANADA | B439: WEST | C439: EDUCATION | D439: FURNITURE | E439: BED | F439: 2 | G439: Jun | H439: 1994 | I439: 647.00 | J439: 22.00 | K439: -625
A440: CANADA | B440: WEST | C440: EDUCATION | D440: FURNITURE | E440: BED | F440: 3 | G440: Jul | H440: 1994 | I440: 55.00 | J440: 742.00 | K440: 687
A441: CANADA | B441: WEST | C441: EDUCATION | D441: FURNITURE | E441: BED | F441: 3 | G441: Aug | H441: 1994 | I441: 154.00 | J441: 394.00 | K441: 240
A442: CANADA | B442: WEST | C442: EDUCATION | D442: FURNITURE | E442: BED | F442: 3 | G442: Sep | H442: 1994 | I442: 344.00 | J442: 957.00 | K442: 613
A443: CANADA | B443: WEST | C443: EDUCATION | D443: FURNITURE | E443: BED | F443: 4 | G443: Oct | H443: 1994 | I443: 95.00 | J443: 205.00 | K443: 110
A444: CANADA | B444: WEST | C444: EDUCATION | D444: FURNITURE | E444: BED | F444: 4 | G444: Nov | H444: 1994 | I444: 665.00 | J444: 198.00 | K444: -467
A445: CANADA | B445: WEST | C445: EDUCATION | D445: FURNITURE | E445: BED | F445: 4 | G445: Dec | H445: 1994 | I445: 145.00 | J445: 638.00 | K445: 493
A446: CANADA | B446: WEST | C446: EDUCATION | D446: OFFICE | E446: TABLE | F446: 1 | G446: Jan | H446: 1994 | I446: 422.00 | J446: 799.00 | K446: 377
A447: CANADA | B447: WEST | C447: EDUCATION | D447: OFFICE | E447: TABLE | F447: 1 | G447: Feb | H447: 1994 | I447: 572.00 | J447: 309.00 | K447: -263
A448: CANADA | B448: WEST | C448: EDUCATION | D448: OFFICE | E448: TABLE | F448: 1 | G448: Mar | H448: 1994 | I448: 363.00 | J448: 433.00 | K448: 70
A449: CANADA | B449: WEST | C449: EDUCATION | D449: OFFICE | E449: TABLE | F449: 2 | G449: Apr | H449: 1994 | I449: 919.00 | J449: 969.00 | K449: 50
A450: CANADA | B450: WEST | C450: EDUCATION | D450: OFFICE | E450: TABLE | F450: 2 | G450: May | H450: 1994 | I450: 355.00 | J450: 181.00 | K450: -174
A451: CANADA | B451: WEST | C451: EDUCATION | D451: OFFICE | E451: TABLE | F451: 2 | G451: Jun | H451: 1994 | I451: 992.00 | J451: 787.00 | K451: -205
A452: CANADA | B452: WEST | C452: EDUCATION | D452: OFFICE | E452: TABLE | F452: 3 | G452: Jul | H452: 1994 | I452: 147.00 | J452: 971.00 | K452: 824
A453: CANADA | B453: WEST | C453: EDUCATION | D453: OFFICE | E453: TABLE | F453: 3 | G453: Aug | H453: 1994 | I453: 183.00 | J453: 440.00 | K453: 257
A454: CANADA | B454: WEST | C454: EDUCATION | D454: OFFICE | E454: TABLE | F454: 3 | G454: Sep | H454: 1994 | I454: 375.00 | J454: 209.00 | K454: -166
A455: CANADA | B455: WEST | C455: EDUCATION | D455: OFFICE | E455: TABLE | F455: 4 | G455: Oct | H455: 1994 | I455: 77.00 | J455: 537.00 | K455: 460
A456: CANADA | B456: WEST | C456: EDUCATION | D456: OFFICE | E456: TABLE | F456: 4 | G456: Nov | H456: 1994 | I456: 308.00 | J456: 364.00 | K456: 56
A457: CANADA | B457: WEST | C457: EDUCATION | D457: OFFICE | E457: TABLE | F457: 4 | G457: Dec | H457: 1994 | I457: 660.00 | J457: 377.00 | K457: -283
A458: CANADA | B458: WEST | C458: EDUCATION | D458: OFFICE | E458: CHAIR | F458: 1 | G458: Jan | H458: 1994 | I458: 855.00 | J458: 786.00 | K458: -69
A459: CANADA | B459: WEST | C459: EDUCATION | D459: OFFICE | E459: CHAIR | F459: 1 | G459: Feb | H459: 1994 | I459: 87.00 | J459: 160.00 | K459: 73
A460: CANADA | B460: WEST | C460: EDUCATION | D460: OFFICE | E460: CHAIR | F460: 1 | G460: Mar | H460: 1994 | I460: 69.00 | J460: 199.00 | K460: 130
A461: CANADA | B461: WEST | C461: EDUCATION | D461: OFFICE | E461: CHAIR | F461: 2 | G461: Apr | H461: 1994 | I461: 807.00 | J461: 972.00 | K461: 165
A462: CANADA | B462: WEST | C462: EDUCATION | D462: OFFICE | E462: CHAIR | F462: 2 | G462: May | H462: 1994 | I462: 565.00 | J462: 870.00 | K462: 305
A463: CANADA | B463: WEST | C463: EDUCATION | D463: OFFICE | E463: CHAIR | F463: 2 | G463: Jun | H463: 1994 | I463: 798.00 | J463: 494.00 | K463: -304
A464: CANADA | B464: WEST | C464: EDUCATION | D464: OFFICE | E464: CHAIR | F464: 3 | G464: Jul | H464: 1994 | I464: 714.00 | J464: 975.00 | K464: 261
A465: CANADA | B465: WEST | C465: EDUCATION | D465: OFFICE | E465: CHAIR | F465: 3 | G465: Aug | H465: 1994 | I465: 17.00 | J465: 760.00 | K465: 743
A466: CANADA | B466: WEST | C466: EDUCATION | D466: OFFICE | E466: CHAIR | F466: 3 | G466: Sep | H466: 1994 | I466: 797.00 | J466: 180.00 | K466: -617
A467: CANADA | B467: WEST | C467: EDUCATION | D467: OFFICE | E467: CHAIR | F467: 4 | G467: Oct | H467: 1994 | I467: 422.00 | J467: 256.00 | K467: -166
A468: CANADA | B468: WEST | C468: EDUCATION | D468: OFFICE | E468: CHAIR | F468: 4 | G468: Nov | H468: 1994 | I468: 621.00 | J468: 422.00 | K468: -199
A469: CANADA | B469: WEST | C469: EDUCATION | D469: OFFICE | E469: CHAIR | F469: 4 | G469: Dec | H469: 1994 | I469: 661.00 | J469: 859.00 | K469: 198
A470: CANADA | B470: WEST | C470: EDUCATION | D470: OFFICE | E470: DESK | F470: 1 | G470: Jan | H470: 1994 | I470: 569.00 | J470: 151.00 | K470: -418
A471: CANADA | B471: WEST | C471: EDUCATION | D471: OFFICE | E471: DESK | F471: 1 | G471: Feb | H471: 1994 | I471: 812.00 | J471: 602.00 | K471: -210
A472: CANADA | B472: WEST | C472: EDUCATION | D472: OFFICE | E472: DESK | F472: 1 | G472: Mar | H472: 1994 | I472: 603.00 | J472: 187.00 | K472: -416
A473: CANADA | B473: WEST | C473: EDUCATION | D473: OFFICE | E473: DESK | F473: 2 | G473: Apr | H473: 1994 | I473: 506.00 | J473: 415.00 | K473: -91
A474: CANADA | B474: WEST | C474: EDUCATION | D474: OFFICE | E474: DESK | F474: 2 | G474: May | H474: 1994 | I474: 185.00 | J474: 61.00 | K474: -124
A475: CANADA | B475: WEST | C475: EDUCATION | D475: OFFICE | E475: DESK | F475: 2 | G475: Jun | H475: 1994 | I475: 692.00 | J475: 839.00 | K475: 147
A476: CANADA | B476: WEST | C476: EDUCATION | D476: OFFICE | E476: DESK | F476: 3 | G476: Jul | H476: 1994 | I476: 565.00 | J476: 596.00 | K476: 31
A477: CANADA | B477: WEST | C477: EDUCATION | D477: OFFICE | E477: DESK | F477: 3 | G477: Aug | H477: 1994 | I477: 512.00 | J477: 751.00 | K477: 239
A478: CANADA | B478: WEST | C478: EDUCATION | D478: OFFICE | E478: DESK | F478: 3 | G478: Sep | H478: 1994 | I478: 86.00 | J478: 460.00 | K478: 374
A479: CANADA | B479: WEST | C479: EDUCATION | D479: OFFICE | E479: DESK | F479: 4 | G479: Oct | H479: 1994 | I479: 399.00 | J479: 922.00 | K479: 523
A480: CANADA | B480: WEST | C480: EDUCATION | D480: OFFICE | E480: DESK | F480: 4 | G480: Nov | H480: 1994 | I480: 672.00 | J480: 153.00 | K480: -519
A481: CANADA | B481: WEST | C481: EDUCATION | D481: OFFICE | E481: DESK | F481: 4 | G481: Dec | H481: 1994 | I481: 801.00 | J481: 928.00 | K481: 127
A482: GERMANY | B482: EAST | C482: CONSUMER | D482: FURNITURE | E482: SOFA | F482: 1 | G482: Jan | H482: 1993 | I482: 874.00 | J482: 873.00 | K482: -1
A483: GERMANY | B483: EAST | C483: CONSUMER | D483: FURNITURE | E483: SOFA | F483: 1 | G483: Feb | H483: 1993 | I483: 578.00 | J483: 498.00 | K483: -80
A484: GERMANY | B484: EAST | C484: CONSUMER | D484: FURNITURE | E484: SOFA | F484: 1 | G484: Mar | H484: 1993 | I484: 768.00 | J484: 808.00 | K484: 40
A485: GERMANY | B485: EAST | C485: CONSUMER | D485: FURNITURE | E485: SOFA | F485: 2 | G485: Apr | H485: 1993 | I485: 178.00 | J485: 742.00 | K485: 564
A486: GERMANY | B486: EAST | C486: CONSUMER | D486: FURNITURE | E486: SOFA | F486: 2 | G486: May | H486: 1993 | I486: 916.00 | J486: 744.00 | K486: -172
A487: GERMANY | B487: EAST | C487: CONSUMER | D487: FURNITURE | E487: SOFA | F487: 2 | G487: Jun | H487: 1993 | I487: 917.00 | J487: 30.00 | K487: -887
A488: GERMANY | B488: EAST | C488: CONSUMER | D488: FURNITURE | E488: SOFA | F488: 3 | G488: Jul | H488: 1993 | I488: 633.00 | J488: 747.00 | K488: 114
A489: GERMANY | B489: EAST | C489: CONSUMER | D489: FURNITURE | E489: SOFA | F489: 3 | G489: Aug | H489: 1993 | I489: 107.00 | J489: 672.00 | K489: 565
A490: GERMANY | B490: EAST | C490: CONSUMER | D490: FURNITURE | E490: SOFA | F490: 3 | G490: Sep | H490: 1993 | I490: 523.00 | J490: 564.00 | K490: 41
A491: GERMANY | B491: EAST | C491: CONSUMER | D491: FURNITURE | E491: SOFA | F491: 4 | G491: Oct | H491: 1993 | I491: 924.00 | J491: 785.00 | K491: -139
A492: GERMANY | B492: EAST | C492: CONSUMER | D492: FURNITURE | E492: SOFA | F492: 4 | G492: Nov | H492: 1993 | I492: 481.00 | J492: 825.00 | K492: 344
A493: GERMANY | B493: EAST | C493: CONSUMER | D493: FURNITURE | E493: SOFA | F493: 4 | G493: Dec | H493: 1993 | I493: 240.00 | J493: 243.00 | K493: 3
A494: GERMANY | B494: EAST | C494: CONSUMER | D494: FURNITURE | E494: BED | F494: 1 | G494: Jan | H494: 1993 | I494: 232.00 | J494: 143.00 | K494: -89
A495: GERMANY | B495: EAST | C495: CONSUMER | D495: FURNITURE | E495: BED | F495: 1 | G495: Feb | H495: 1993 | I495: 993.00 | J495: 15.00 | K495: -978
A496: GERMANY | B496: EAST | C496: CONSUMER | D496: FURNITURE | E496: BED | F496: 1 | G496: Mar | H496: 1993 | I496: 652.00 | J496: 742.00 | K496: 90
A497: GERMANY | B497: EAST | C497: CONSUMER | D497: FURNITURE | E497: BED | F497: 2 | G497: Apr | H497: 1993 | I497: 761.00 | J497: 339.00 | K497: -422
A498: GERMANY | B498: EAST | C498: CONSUMER | D498: FURNITURE | E498: BED | F498: 2 | G498: May | H498: 1993 | I498: 428.00 | J498: 39.00 | K498: -389
A499: GERMANY | B499: EAST | C499: CONSUMER | D499: FURNITURE | E499: BED | F499: 2 | G499: Jun | H499: 1993 | I499: 4.00 | J499: 465.00 | K499: 461
A500: GERMANY | B500: EAST | C500: CONSUMER | D500: FURNITURE | E500: BED | F500: 3 | G500: Jul | H500: 1993 | I500: 101.00 | J500: 889.00 | K500: 788
A501: GERMANY | B501: EAST | C501: CONSUMER | D501: FURNITURE | E501: BED | F501: 3 | G501: Aug | H501: 1993 | I501: 869.00 | J501: 856.00 | K501: -13
A502: GERMANY | B502: EAST | C502: CONSUMER | D502: FURNITURE | E502: BED | F502: 3 | G502: Sep | H502: 1993 | I502: 271.00 | J502: 358.00 | K502: 87
A503: GERMANY | B503: EAST | C503: CONSUMER | D503: FURNITURE | E503: BED | F503: 4 | G503: Oct | H503: 1993 | I503: 633.00 | J503: 452.00 | K503: -181
A504: GERMANY | B504: EAST | C504: CONSUMER | D504: FURNITURE | E504: BED | F504: 4 | G504: Nov | H504: 1993 | I504: 481.00 | J504: 387.00 | K504: -94
A505: GERMANY | B505: EAST | C505: CONSUMER | D505: FURNITURE | E505: BED | F505: 4 | G505: Dec | H505: 1993 | I505: 302.00 | J505: 824.00 | K505: 522
A506: GERMANY | B506: EAST | C506: CONSUMER | D506: OFFICE | E506: TABLE | F506: 1 | G506: Jan | H506: 1993 | I506: 982.00 | J506: 166.00 | K506: -816
A507: GERMANY | B507: EAST | C507: CONSUMER | D507: OFFICE | E507: TABLE | F507: 1 | G507: Feb | H507: 1993 | I507: 614.00 | J507: 531.00 | K507: -83
A508: GERMANY | B508: EAST | C508: CONSUMER | D508: OFFICE | E508: TABLE | F508: 1 | G508: Mar | H508: 1993 | I508: 839.00 | J508: 963.00 | K508: 124
A509: GERMANY | B509: EAST | C509: CONSUMER | D509: OFFICE | E509: TABLE | F509: 2 | G509: Apr | H509: 1993 | I509: 388.00 | J509: 994.00 | K509: 606
A510: GERMANY | B510: EAST | C510: CONSUMER | D510: OFFICE | E510: TABLE | F510: 2 | G510: May | H510: 1993 | I510: 296.00 | J510: 978.00 | K510: 682
A511: GERMANY | B511: EAST | C511: CONSUMER | D511: OFFICE | E511: TABLE | F511: 2 | G511: Jun | H511: 1993 | I511: 429.00 | J511: 72.00 | K511: -357
A512: GERMANY | B512: EAST | C512: CONSUMER | D512: OFFICE | E512: TABLE | F512: 3 | G512: Jul | H512: 1993 | I512: 901.00 | J512: 33.00 | K512: -868
A513: GERMANY | B513: EAST | C513: CONSUMER | D513: OFFICE | E513: TABLE | F513: 3 | G513: Aug | H513: 1993 | I513: 350.00 | J513: 428.00 | K513: 78
A514: GERMANY | B514: EAST | C514: CONSUMER | D514: OFFICE | E514: TABLE | F514: 3 | G514: Sep | H514: 1993 | I514: 581.00 | J514: 413.00 | K514: -168
A515: GERMANY | B515: EAST | C515: CONSUMER | D515: OFFICE | E515: TABLE | F515: 4 | G515: Oct | H515: 1993 | I515: 583.00 | J515: 737.00 | K515: 154
A516: GERMANY | B516: EAST | C516: CONSUMER | D516: OFFICE | E516: TABLE | F516: 4 | G516: Nov | H516: 1993 | I516: 92.00 | J516: 85.00 | K516: -7
A517: GERMANY | B517: EAST | C517: CONSUMER | D517: OFFICE | E517: TABLE | F517: 4 | G517: Dec | H517: 1993 | I517: 647.00 | J517: 916.00 | K517: 269
A518: GERMANY | B518: EAST | C518: CONSUMER | D518: OFFICE | E518: CHAIR | F518: 1 | G518: Jan | H518: 1993 | I518: 336.00 | J518: 697.00 | K518: 361
A519: GERMANY | B519: EAST | C519: CONSUMER | D519: OFFICE | E519: CHAIR | F519: 1 | G519: Feb | H519: 1993 | I519: 299.00 | J519: 215.00 | K519: -84
A520: GERMANY | B520: EAST | C520: CONSUMER | D520: OFFICE | E520: CHAIR | F520: 1 | G520: Mar | H520: 1993 | I520: 747.00 | J520: 197.00 | K520: -550
A521: GERMANY | B521: EAST | C521: CONSUMER | D521: OFFICE | E521: CHAIR | F521: 2 | G521: Apr | H521: 1993 | I521: 154.00 | J521: 205.00 | K521: 51
A522: GERMANY | B522: EAST | C522: CONSUMER | D522: OFFICE | E522: CHAIR | F522: 2 | G522: May | H522: 1993 | I522: 486.00 | J522: 256.00 | K522: -230
A523: GERMANY | B523: EAST | C523: CONSUMER | D523: OFFICE | E523: CHAIR | F523: 2 | G523: Jun | H523: 1993 | I523: 251.00 | J523: 377.00 | K523: 126
A524: GERMANY | B524: EAST | C524: CONSUMER | D524: OFFICE | E524: CHAIR | F524: 3 | G524: Jul | H524: 1993 | I524: 225.00 | J524: 577.00 | K524: 352
A525: GERMANY | B525: EAST | C525: CONSUMER | D525: OFFICE | E525: CHAIR | F525: 3 | G525: Aug | H525: 1993 | I525: 77.00 | J525: 686.00 | K525: 609
A526: GERMANY | B526: EAST | C526: CONSUMER | D526: OFFICE | E526: CHAIR | F526: 3 | G526: Sep | H526: 1993 | I526: 74.00 | J526: 332.00 | K526: 258
A527: GERMANY | B527: EAST | C527: CONSUMER | D527: OFFICE | E527: CHAIR | F527: 4 | G527: Oct | H527: 1993 | I527: 596.00 | J527: 534.00 | K527: -62
A528: GERMANY | B528: EAST | C528: CONSUMER | D528: OFFICE | E528: CHAIR | F528: 4 | G528: Nov | H528: 1993 | I528: 493.00 | J528: 485.00 | K528: -8
A529: GERMANY | B529: EAST | C529: CONSUMER | D529: OFFICE | E529: CHAIR | F529: 4 | G529: Dec | H529: 1993 | I529: 782.00 | J529: 594.00 | K529: -188
A530: GERMANY | B530: EAST | C530: CONSUMER | D530: OFFICE | E530: DESK | F530: 1 | G530: Jan | H530: 1993 | I530: 511.00 | J530: 956.00 | K530: 445
A531: GERMANY | B531: EAST | C531: CONSUMER | D531: OFFICE | E531: DESK | F531: 1 | G531: Feb | H531: 1993 | I531: 505.00 | J531: 205.00 | K531: -300
A532: GERMANY | B532: EAST | C532: CONSUMER | D532: OFFICE | E532: DESK | F532: 1 | G532: Mar | H532: 1993 | I532: 720.00 | J532: 629.00 | K532: -91
A533: GERMANY | B533: EAST | C533: CONSUMER | D533: OFFICE | E533: DESK | F533: 2 | G533: Apr | H533: 1993 | I533: 823.00 | J533: 277.00 | K533: -546
A534: GERMANY | B534: EAST | C534: CONSUMER | D534: OFFICE | E534: DESK | F534: 2 | G534: May | H534: 1993 | I534: 21.00 | J534: 266.00 | K534: 245
A535: GERMANY | B535: EAST | C535: CONSUMER | D535: OFFICE | E535: DESK | F535: 2 | G535: Jun | H535: 1993 | I535: 142.00 | J535: 872.00 | K535: 730
A536: GERMANY | B536: EAST | C536: CONSUMER | D536: OFFICE | E536: DESK | F536: 3 | G536: Jul | H536: 1993 | I536: 95.00 | J536: 435.00 | K536: 340
A537: GERMANY | B537: EAST | C537: CONSUMER | D537: OFFICE | E537: DESK | F537: 3 | G537: Aug | H537: 1993 | I537: 398.00 | J537: 988.00 | K537: 590
A538: GERMANY | B538: EAST | C538: CONSUMER | D538: OFFICE | E538: DESK | F538: 3 | G538: Sep | H538: 1993 | I538: 328.00 | J538: 953.00 | K538: 625
A539: GERMANY | B539: EAST | C539: CONSUMER | D539: OFFICE | E539: DESK | F539: 4 | G539: Oct | H539: 1993 | I539: 151.00 | J539: 556.00 | K539: 405
A540: GERMANY | B540: EAST | C540: CONSUMER | D540: OFFICE | E540: DESK | F540: 4 | G540: Nov | H540: 1993 | I540: 978.00 | J540: 211.00 | K540: -767
A541: GERMANY | B541: EAST | C541: CONSUMER | D541: OFFICE | E541: DESK | F541: 4 | G541: Dec | H541: 1993 | I541: 918.00 | J541: 389.00 | K541: -529
A542: GERMANY | B542: EAST | C542: CONSUMER | D542: FURNITURE | E542: SOFA | F542: 1 | G542: Jan | H542: 1994 | I542: 819.00 | J542: 959.00 | K542: 140
A543: GERMANY | B543: EAST | C543: CONSUMER | D543: FURNITURE | E543: SOFA | F543: 1 | G543: Feb | H543: 1994 | I543: 602.00 | J543: 123.00 | K543: -479
A544: GERMANY | B544: EAST | C544: CONSUMER | D544: FURNITURE | E544: SOFA | F544: 1 | G544: Mar | H544: 1994 | I544: 538.00 | J544: 714.00 | K544: 176
A545: GERMANY | B545: EAST | C545: CONSUMER | D545: FURNITURE | E545: SOFA | F545: 2 | G545: Apr | H545: 1994 | I545: 632.00 | J545: 252.00 | K545: -380
A546: GERMANY | B546: EAST | C546: CONSUMER | D546: FURNITURE | E546: SOFA | F546: 2 | G546: May | H546: 1994 | I546: 952.00 | J546: 715.00 | K546: -237
A547: GERMANY | B547: EAST | C547: CONSUMER | D547: FURNITURE | E547: SOFA | F547: 2 | G547: Jun | H547: 1994 | I547: 480.00 | J547: 670.00 | K547: 190
A548: GERMANY | B548: EAST | C548: CONSUMER | D548: FURNITURE | E548: SOFA | F548: 3 | G548: Jul | H548: 1994 | I548: 700.00 | J548: 81.00 | K548: -619
A549: GERMANY | B549: EAST | C549: CONSUMER | D549: FURNITURE | E549: SOFA | F549: 3 | G549: Aug | H549: 1994 | I549: 726.00 | J549: 653.00 | K549: -73
A550: GERMANY | B550: EAST | C550: CONSUMER | D550: FURNITURE | E550: SOFA | F550: 3 | G550: Sep | H550: 1994 | I550: 526.00 | J550: 795.00 | K550: 269
A551: GERMANY | B551: EAST | C551: CONSUMER | D551: FURNITURE | E551: SOFA | F551: 4 | G551: Oct | H551: 1994 | I551: 410.00 | J551: 182.00 | K551: -228
A552: GERMANY | B552: EAST | C552: CONSUMER | D552: FURNITURE | E552: SOFA | F552: 4 | G552: Nov | H552: 1994 | I552: 307.00 | J552: 725.00 | K552: 418
A553: GERMANY | B553: EAST | C553: CONSUMER | D553: FURNITURE | E553: SOFA | F553: 4 | G553: Dec | H553: 1994 | I553: 73.00 | J553: 101.00 | K553: 28
A554: GERMANY | B554: EAST | C554: CONSUMER | D554: FURNITURE | E554: BED | F554: 1 | G554: Jan | H554: 1994 | I554: 245.00 | J554: 185.00 | K554: -60
A555: GERMANY | B555: EAST | C555: CONSUMER | D555: FURNITURE | E555: BED | F555: 1 | G555: Feb | H555: 1994 | I555: 941.00 | J555: 151.00 | K555: -790
A556: GERMANY | B556: EAST | C556: CONSUMER | D556: FURNITURE | E556: BED | F556: 1 | G556: Mar | H556: 1994 | I556: 721.00 | J556: 419.00 | K556: -302
A557: GERMANY | B557: EAST | C557: CONSUMER | D557: FURNITURE | E557: BED | F557: 2 | G557: Apr | H557: 1994 | I557: 893.00 | J557: 643.00 | K557: -250
A558: GERMANY | B558: EAST | C558: CONSUMER | D558: FURNITURE | E558: BED | F558: 2 | G558: May | H558: 1994 | I558: 898.00 | J558: 63.00 | K558: -835
A559: GERMANY | B559: EAST | C559: CONSUMER | D559: FURNITURE | E559: BED | F559: 2 | G559: Jun | H559: 1994 | I559: 94.00 | J559: 202.00 | K559: 108
A560: GERMANY | B560: EAST | C560: CONSUMER | D560: FURNITURE | E560: BED | F560: 3 | G560: Jul | H560: 1994 | I560: 962.00 | J560: 332.00 | K560: -630
A561: GERMANY | B561: EAST | C561: CONSUMER | D561: FURNITURE | E561: BED | F561: 3 | G561: Aug | H561: 1994 | I561: 71.00 | J561: 723.00 | K561: 652
A562: GERMANY | B562: EAST | C562: CONSUMER | D562: FURNITURE | E562: BED | F562: 3 | G562: Sep | H562: 1994 | I562: 108.00 | J562: 148.00 | K562: 40
A563: GERMANY | B563: EAST | C563: CONSUMER | D563: FURNITURE | E563: BED | F563: 4 | G563: Oct | H563: 1994 | I563: 71.00 | J563: 840.00 | K563: 769
A564: GERMANY | B564: EAST | C564: CONSUMER | D564: FURNITURE | E564: BED | F564: 4 | G564: Nov | H564: 1994 | I564: 767.00 | J564: 601.00 | K564: -166
A565: GERMANY | B565: EAST | C565: CONSUMER | D565: FURNITURE | E565: BED | F565: 4 | G565: Dec | H565: 1994 | I565: 323.00 | J565: 962.00 | K565: 639
A566: GERMANY | B566: EAST | C566: CONSUMER | D566: OFFICE | E566: TABLE | F566: 1 | G566: Jan | H566: 1994 | I566: 771.00 | J566: 785.00 | K566: 14
A567: GERMANY | B567: EAST | C567: CONSUMER | D567: OFFICE | E567: TABLE | F567: 1 | G567: Feb | H567: 1994 | I567: 26.00 | J567: 302.00 | K567: 276
A568: GERMANY | B568: EAST | C568: CONSUMER | D568: OFFICE | E568: TABLE | F568: 1 | G568: Mar | H568: 1994 | I568: 598.00 | J568: 1000.00 | K568: 402
A569: GERMANY | B569: EAST | C569: CONSUMER | D569: OFFICE | E569: TABLE | F569: 2 | G569: Apr | H569: 1994 | I569: 715.00 | J569: 458.00 | K569: -257
A570: GERMANY | B570: EAST | C570: CONSUMER | D570: OFFICE | E570: TABLE | F570: 2 | G570: May | H570: 1994 | I570: 74.00 | J570: 896.00 | K570: 822
A571: GERMANY | B571: EAST | C571: CONSUMER | D571: OFFICE | E571: TABLE | F571: 2 | G571: Jun | H571: 1994 | I571: 580.00 | J571: 615.00 | K571: 35
A572: GERMANY | B572: EAST | C572: CONSUMER | D572: OFFICE | E572: TABLE | F572: 3 | G572: Jul | H572: 1994 | I572: 848.00 | J572: 174.00 | K572: -674
A573: GERMANY | B573: EAST | C573: CONSUMER | D573: OFFICE | E573: TABLE | F573: 3 | G573: Aug | H573: 1994 | I573: 118.00 | J573: 651.00 | K573: 533
A574: GERMANY | B574: EAST | C574: CONSUMER | D574: OFFICE | E574: TABLE | F574: 3 | G574: Sep | H574: 1994 | I574: 54.00 | J574: 784.00 | K574: 730
A575: GERMANY | B575: EAST | C575: CONSUMER | D575: OFFICE | E575: TABLE | F575: 4 | G575: Oct | H575: 1994 | I575: 929.00 | J575: 121.00 | K575: -808
A576: GERMANY | B576: EAST | C576: CONSUMER | D576: OFFICE | E576: TABLE | F576: 4 | G576: Nov | H576: 1994 | I576: 393.00 | J576: 341.00 | K576: -52
A577: GERMANY | B577: EAST | C577: CONSUMER | D577: OFFICE | E577: TABLE | F577: 4 | G577: Dec | H577: 1994 | I577: 820.00 | J577: 615.00 | K577: -205
A578: GERMANY | B578: EAST | C578: CONSUMER | D578: OFFICE | E578: CHAIR | F578: 1 | G578: Jan | H578: 1994 | I578: 487.00 | J578: 413.00 | K578: -74
A579: GERMANY | B579: EAST | C579: CONSUMER | D579: OFFICE | E579: CHAIR | F579: 1 | G579: Feb | H579: 1994 | I579: 127.00 | J579: 13.00 | K579: -114
A580: GERMANY | B580: EAST | C580: CONSUMER | D580: OFFICE | E580: CHAIR | F580: 1 | G580: Mar | H580: 1994 | I580: 538.00 | J580: 483.00 | K580: -55
A581: GERMANY | B581: EAST | C581: CONSUMER | D581: OFFICE | E581: CHAIR | F581: 2 | G581: Apr | H581: 1994 | I581: 94.00 | J581: 820.00 | K581: 726
A582: GERMANY | B582: EAST | C582: CONSUMER | D582: OFFICE | E582: CHAIR | F582: 2 | G582: May | H582: 1994 | I582: 252.00 | J582: 745.00 | K582: 493
A583: GERMANY | B583: EAST | C583: CONSUMER | D583: OFFICE | E583: CHAIR | F583: 2 | G583: Jun | H583: 1994 | I583: 722.00 | J583: 79.00 | K583: -643
A584: GERMANY | B584: EAST | C584: CONSUMER | D584: OFFICE | E584: CHAIR | F584: 3 | G584: Jul | H584: 1994 | I584: 536.00 | J584: 36.00 | K584: -500
A585: GERMANY | B585: EAST | C585: CONSUMER | D585: OFFICE | E585: CHAIR | F585: 3 | G585: Aug | H585: 1994 | I585: 958.00 | J585: 950.00 | K585: -8
A586: GERMANY | B586: EAST | C586: CONSUMER | D586: OFFICE | E586: CHAIR | F586: 3 | G586: Sep | H586: 1994 | I586: 466.00 | J586: 74.00 | K586: -392
A587: GERMANY | B587: EAST | C587: CONSUMER | D587: OFFICE | E587: CHAIR | F587: 4 | G587: Oct | H587: 1994 | I587: 309.00 | J587: 458.00 | K587: 149
A588: GERMANY | B588: EAST | C588: CONSUMER | D588: OFFICE | E588: CHAIR | F588: 4 | G588: Nov | H588: 1994 | I588: 680.00 | J588: 609.00 | K588: -71
A589: GERMANY | B589: EAST | C589: CONSUMER | D589: OFFICE | E589: CHAIR | F589: 4 | G589: Dec | H589: 1994 | I589: 539.00 | J589: 429.00 | K589: -110
A590: GERMANY | B590: EAST | C590: CONSUMER | D590: OFFICE | E590: DESK | F590: 1 | G590: Jan | H590: 1994 | I590: 542.00 | J590: 351.00 | K590: -191
A591: GERMANY | B591: EAST | C591: CONSUMER | D591: OFFICE | E591: DESK | F591: 1 | G591: Feb | H591: 1994 | I591: 96.00 | J591: 14.00 | K591: -82
A592: GERMANY | B592: EAST | C592: CONSUMER | D592: OFFICE | E592: DESK | F592: 1 | G592: Mar | H592: 1994 | I592: 496.00 | J592: 181.00 | K592: -315
A593: GERMANY | B593: EAST | C593: CONSUMER | D593: OFFICE | E593: DESK | F593: 2 | G593: Apr | H593: 1994 | I593: 77.00 | J593: 452.00 | K593: 375
A594: GERMANY | B594: EAST | C594: CONSUMER | D594: OFFICE | E594: DESK | F594: 2 | G594: May | H594: 1994 | I594: 236.00 | J594: 511.00 | K594: 275
A595: GERMANY | B595: EAST | C595: CONSUMER | D595: OFFICE | E595: DESK | F595: 2 | G595: Jun | H595: 1994 | I595: 913.00 | J595: 193.00 | K595: -720
A596: GERMANY | B596: EAST | C596: CONSUMER | D596: OFFICE | E596: DESK | F596: 3 | G596: Jul | H596: 1994 | I596: 49.00 | J596: 797.00 | K596: 748
A597: GERMANY | B597: EAST | C597: CONSUMER | D597: OFFICE | E597: DESK | F597: 3 | G597: Aug | H597: 1994 | I597: 967.00 | J597: 988.00 | K597: 21
A598: GERMANY | B598: EAST | C598: CONSUMER | D598: OFFICE | E598: DESK | F598: 3 | G598: Sep | H598: 1994 | I598: 502.00 | J598: 487.00 | K598: -15
A599: GERMANY | B599: EAST | C599: CONSUMER | D599: OFFICE | E599: DESK | F599: 4 | G599: Oct | H599: 1994 | I599: 790.00 | J599: 941.00 | K599: 151
A600: GERMANY | B600: EAST | C600: CONSUMER | D600: OFFICE | E600: DESK | F600: 4 | G600: Nov | H600: 1994 | I600: 121.00 | J600: 577.00 | K600: 456
A601: GERMANY | B601: EAST | C601: CONSUMER | D601: OFFICE | E601: DESK | F601: 4 | G601: Dec | H601: 1994 | I601: 55.00 | J601: 456.00 | K601: 401
A602: GERMANY | B602: EAST | C602: EDUCATION | D602: FURNITURE | E602: SOFA | F602: 1 | G602: Jan | H602: 1993 | I602: 977.00 | J602: 996.00 | K602: 19
A603: GERMANY | B603: EAST | C603: EDUCATION | D603: FURNITURE | E603: SOFA | F603: 1 | G603: Feb | H603: 1993 | I603: 549.00 | J603: 554.00 | K603: 5
A604: GERMANY | B604: EAST | C604: EDUCATION | D604: FURNITURE | E604: SOFA | F604: 1 | G604: Mar | H604: 1993 | I604: 951.00 | J604: 540.00 | K604: -411
A605: GERMANY | B605: EAST | C605: EDUCATION | D605: FURNITURE | E605: SOFA | F605: 2 | G605: Apr | H605: 1993 | I605: 390.00 | J605: 140.00 | K605: -250
A606: GERMANY | B606: EAST | C606: EDUCATION | D606: FURNITURE | E606: SOFA | F606: 2 | G606: May | H606: 1993 | I606: 204.00 | J606: 554.00 | K606: 350
A607: GERMANY | B607: EAST | C607: EDUCATION | D607: FURNITURE | E607: SOFA | F607: 2 | G607: Jun | H607: 1993 | I607: 78.00 | J607: 724.00 | K607: 646
A608: GERMANY | B608: EAST | C608: EDUCATION | D608: FURNITURE | E608: SOFA | F608: 3 | G608: Jul | H608: 1993 | I608: 613.00 | J608: 693.00 | K608: 80
A609: GERMANY | B609: EAST | C609: EDUCATION | D609: FURNITURE | E609: SOFA | F609: 3 | G609: Aug | H609: 1993 | I609: 745.00 | J609: 866.00 | K609: 121
A610: GERMANY | B610: EAST | C610: EDUCATION | D610: FURNITURE | E610: SOFA | F610: 3 | G610: Sep | H610: 1993 | I610: 56.00 | J610: 833.00 | K610: 777
A611: GERMANY | B611: EAST | C611: EDUCATION | D611: FURNITURE | E611: SOFA | F611: 4 | G611: Oct | H611: 1993 | I611: 887.00 | J611: 164.00 | K611: -723
A612: GERMANY | B612: EAST | C612: EDUCATION | D612: FURNITURE | E612: SOFA | F612: 4 | G612: Nov | H612: 1993 | I612: 651.00 | J612: 753.00 | K612: 102
A613: GERMANY | B613: EAST | C613: EDUCATION | D613: FURNITURE | E613: SOFA | F613: 4 | G613: Dec | H613: 1993 | I613: 691.00 | J613: 60.00 | K613: -631
A614: GERMANY | B614: EAST | C614: EDUCATION | D614: FURNITURE | E614: BED | F614: 1 | G614: Jan | H614: 1993 | I614: 325.00 | J614: 641.00 | K614: 316
A615: GERMANY | B615: EAST | C615: EDUCATION | D615: FURNITURE | E615: BED | F615: 1 | G615: Feb | H615: 1993 | I615: 648.00 | J615: 494.00 | K615: -154
A616: GERMANY | B616: EAST | C616: EDUCATION | D616: FURNITURE | E616: BED | F616: 1 | G616: Mar | H616: 1993 | I616: 365.00 | J616: 428.00 | K616: 63
A617: GERMANY | B617: EAST | C617: EDUCATION | D617: FURNITURE | E617: BED | F617: 2 | G617: Apr | H617: 1993 | I617: 120.00 | J617: 936.00 | K617: 816
A618: GERMANY | B618: EAST | C618: EDUCATION | D618: FURNITURE | E618: BED | F618: 2 | G618: May | H618: 1993 | I618: 347.00 | J618: 597.00 | K618: 250
A619: GERMANY | B619: EAST | C619: EDUCATION | D619: FURNITURE | E619: BED | F619: 2 | G619: Jun | H619: 1993 | I619: 638.00 | J619: 728.00 | K619: 90
A620: GERMANY | B620: EAST | C620: EDUCATION | D620: FURNITURE | E620: BED | F620: 3 | G620: Jul | H620: 1993 | I620: 732.00 | J620: 933.00 | K620: 201
A621: GERMANY | B621: EAST | C621: EDUCATION | D621: FURNITURE | E621: BED | F621: 3 | G621: Aug | H621: 1993 | I621: 465.00 | J621: 663.00 | K621: 198
A622: GERMANY | B622: EAST | C622: EDUCATION | D622: FURNITURE | E622: BED | F622: 3 | G622: Sep | H622: 1993 | I622: 262.00 | J622: 394.00 | K622: 132
A623: GERMANY | B623: EAST | C623: EDUCATION | D623: FURNITURE | E623: BED | F623: 4 | G623: Oct | H623: 1993 | I623: 947.00 | J623: 334.00 | K623: -613
A624: GERMANY | B624: EAST | C624: EDUCATION | D624: FURNITURE | E624: BED | F624: 4 | G624: Nov | H624: 1993 | I624: 694.00 | J624: 114.00 | K624: -580
A625: GERMANY | B625: EAST | C625: EDUCATION | D625: FURNITURE | E625: BED | F625: 4 | G625: Dec | H625: 1993 | I625: 482.00 | J625: 89.00 | K625: -393
A626: GERMANY | B626: EAST | C626: EDUCATION | D626: OFFICE | E626: TABLE | F626: 1 | G626: Jan | H626: 1993 | I626: 408.00 | J626: 597.00 | K626: 189
A627: GERMANY | B627: EAST | C627: EDUCATION | D627: OFFICE | E627: TABLE | F627: 1 | G627: Feb | H627: 1993 | I627: 45.00 | J627: 185.00 | K627: 140
A628: GERMANY | B628: EAST | C628: EDUCATION | D628: OFFICE | E628: TABLE | F628: 1 | G628: Mar | H628: 1993 | I628: 522.00 | J628: 175.00 | K628: -347
A629: GERMANY | B629: EAST | C629: EDUCATION | D629: OFFICE | E629: TABLE | F629: 2 | G629: Apr | H629: 1993 | I629: 166.00 | J629: 576.00 | K629: 410
A630: GERMANY | B630: EAST | C630: EDUCATION | D630: OFFICE | E630: TABLE | F630: 2 | G630: May | H630: 1993 | I630: 885.00 | J630: 957.00 | K630: 72
A631: GERMANY | B631: EAST | C631: EDUCATION | D631: OFFICE | E631: TABLE | F631: 2 | G631: Jun | H631: 1993 | I631: 713.00 | J631: 993.00 | K631: 280
A632: GERMANY | B632: EAST | C632: EDUCATION | D632: OFFICE | E632: TABLE | F632: 3 | G632: Jul | H632: 1993 | I632: 838.00 | J632: 500.00 | K632: -338
A633: GERMANY | B633: EAST | C633: EDUCATION | D633: OFFICE | E633: TABLE | F633: 3 | G633: Aug | H633: 1993 | I633: 267.00 | J633: 410.00 | K633: 143
A634: GERMANY | B634: EAST | C634: EDUCATION | D634: OFFICE | E634: TABLE | F634: 3 | G634: Sep | H634: 1993 | I634: 967.00 | J634: 592.00 | K634: -375
A635: GERMANY | B635: EAST | C635: EDUCATION | D635: OFFICE | E635: TABLE | F635: 4 | G635: Oct | H635: 1993 | I635: 529.00 | J635: 64.00 | K635: -465
A636: GERMANY | B636: EAST | C636: EDUCATION | D636: OFFICE | E636: TABLE | F636: 4 | G636: Nov | H636: 1993 | I636: 656.00 | J636: 208.00 | K636: -448
A637: GERMANY | B637: EAST | C637: EDUCATION | D637: OFFICE | E637: TABLE | F637: 4 | G637: Dec | H637: 1993 | I637: 665.00 | J637: 273.00 | K637: -392
A638: GERMANY | B638: EAST | C638: EDUCATION | D638: OFFICE | E638: CHAIR | F638: 1 | G638: Jan | H638: 1993 | I638: 304.00 | J638: 468.00 | K638: 164
A639: GERMANY | B639: EAST | C639: EDUCATION | D639: OFFICE | E639: CHAIR | F639: 1 | G639: Feb | H639: 1993 | I639: 846.00 | J639: 430.00 | K639: -416
A640: GERMANY | B640: EAST | C640: EDUCATION | D640: OFFICE | E640: CHAIR | F640: 1 | G640: Mar | H640: 1993 | I640: 912.00 | J640: 893.00 | K640: -19
A641: GERMANY | B641: EAST | C641: EDUCATION | D641: OFFICE | E641: CHAIR | F641: 2 | G641: Apr | H641: 1993 | I641: 810.00 | J641: 519.00 | K641: -291
A642: GERMANY | B642: EAST | C642: EDUCATION | D642: OFFICE | E642: CHAIR | F642: 2 | G642: May | H642: 1993 | I642: 122.00 | J642: 267.00 | K642: 145
A643: GERMANY | B643: EAST | C643: EDUCATION | D643: OFFICE | E643: CHAIR | F643: 2 | G643: Jun | H643: 1993 | I643: 102.00 | J643: 908.00 | K643: 806
A644: GERMANY | B644: EAST | C644: EDUCATION | D644: OFFICE | E644: CHAIR | F644: 3 | G644: Jul | H644: 1993 | I644: 161.00 | J644: 176.00 | K644: 15
A645: GERMANY | B645: EAST | C645: EDUCATION | D645: OFFICE | E645: CHAIR | F645: 3 | G645: Aug | H645: 1993 | I645: 450.00 | J645: 673.00 | K645: 223
A646: GERMANY | B646: EAST | C646: EDUCATION | D646: OFFICE | E646: CHAIR | F646: 3 | G646: Sep | H646: 1993 | I646: 215.00 | J646: 798.00 | K646: 583
A647: GERMANY | B647: EAST | C647: EDUCATION | D647: OFFICE | E647: CHAIR | F647: 4 | G647: Oct | H647: 1993 | I647: 765.00 | J647: 291.00 | K647: -474
A648: GERMANY | B648: EAST | C648: EDUCATION | D648: OFFICE | E648: CHAIR | F648: 4 | G648: Nov | H648: 1993 | I648: 557.00 | J648: 583.00 | K648: 26
A649: GERMANY | B649: EAST | C649: EDUCATION | D649: OFFICE | E649: CHAIR | F649: 4 | G649: Dec | H649: 1993 | I649: 739.00 | J649: 442.00 | K649: -297
A650: GERMANY | B650: EAST | C650: EDUCATION | D650: OFFICE | E650: DESK | F650: 1 | G650: Jan | H650: 1993 | I650: 339.00 | J650: 352.00 | K650: 13
A651: GERMANY | B651: EAST | C651: EDUCATION | D651: OFFICE | E651: DESK | F651: 1 | G651: Feb | H651: 1993 | I651: 70.00 | J651: 234.00 | K651: 164
A652: GERMANY | B652: EAST | C652: EDUCATION | D652: OFFICE | E652: DESK | F652: 1 | G652: Mar | H652: 1993 | I652: 528.00 | J652: 167.00 | K652: -361
A653: GERMANY | B653: EAST | C653: EDUCATION | D653: OFFICE | E653: DESK | F653: 2 | G653: Apr | H653: 1993 | I653: 220.00 | J653: 606.00 | K653: 386
A654: GERMANY | B654: EAST | C654: EDUCATION | D654: OFFICE | E654: DESK | F654: 2 | G654: May | H654: 1993 | I654: 691.00 | J654: 670.00 | K654: -21
A655: GERMANY | B655: EAST | C655: EDUCATION | D655: OFFICE | E655: DESK | F655: 2 | G655: Jun | H655: 1993 | I655: 197.00 | J655: 764.00 | K655: 567
A656: GERMANY | B656: EAST | C656: EDUCATION | D656: OFFICE | E656: DESK | F656: 3 | G656: Jul | H656: 1993 | I656: 239.00 | J656: 659.00 | K656: 420
A657: GERMANY | B657: EAST | C657: EDUCATION | D657: OFFICE | E657: DESK | F657: 3 | G657: Aug | H657: 1993 | I657: 50.00 | J657: 996.00 | K657: 946
A658: GERMANY | B658: EAST | C658: EDUCATION | D658: OFFICE | E658: DESK | F658: 3 | G658: Sep | H658: 1993 | I658: 135.00 | J658: 424.00 | K658: 289
A659: GERMANY | B659: EAST | C659: EDUCATION | D659: OFFICE | E659: DESK | F659: 4 | G659: Oct | H659: 1993 | I659: 972.00 | J659: 899.00 | K659: -73
A660: GERMANY | B660: EAST | C660: EDUCATION | D660: OFFICE | E660: DESK | F660: 4 | G660: Nov | H660: 1993 | I660: 475.00 | J660: 392.00 | K660: -83
A661: GERMANY | B661: EAST | C661: EDUCATION | D661: OFFICE | E661: DESK | F661: 4 | G661: Dec | H661: 1993 | I661: 868.00 | J661: 555.00 | K661: -313
A662: GERMANY | B662: EAST | C662: EDUCATION | D662: FURNITURE | E662: SOFA | F662: 1 | G662: Jan | H662: 1994 | I662: 767.00 | J662: 688.00 | K662: -79
A663: GERMANY | B663: EAST | C663: EDUCATION | D663: FURNITURE | E663: SOFA | F663: 1 | G663: Feb | H663: 1994 | I663: 709.00 | J663: 883.00 | K663: 174
A664: GERMANY | B664: EAST | C664: EDUCATION | D664: FURNITURE | E664: SOFA | F664: 1 | G664: Mar | H664: 1994 | I664: 417.00 | J664: 109.00 | K664: -308
A665: GERMANY | B665: EAST | C665: EDUCATION | D665: FURNITURE | E665: SOFA | F665: 2 | G665: Apr | H665: 1994 | I665: 326.00 | J665: 950.00 | K665: 624
A666: GERMANY | B666: EAST | C666: EDUCATION | D666: FURNITURE | E666: SOFA | F666: 2 | G666: May | H666: 1994 | I666: 599.00 | J666: 438.00 | K666: -161
A667: GERMANY | B667: EAST | C667: EDUCATION | D667: FURNITURE | E667: SOFA | F667: 2 | G667: Jun | H667: 1994 | I667: 818.00 | J667: 286.00 | K667: -532
A668: GERMANY | B668: EAST | C668: EDUCATION | D668: FURNITURE | E668: SOFA | F668: 3 | G668: Jul | H668: 1994 | I668: 13.00 | J668: 342.00 | K668: 329
A669: GERMANY | B669: EAST | C669: EDUCATION | D669: FURNITURE | E669: SOFA | F669: 3 | G669: Aug | H669: 1994 | I669: 185.00 | J669: 383.00 | K669: 198
A670: GERMANY | B670: EAST | C670: EDUCATION | D670: FURNITURE | E670: SOFA | F670: 3 | G670: Sep | H670: 1994 | I670: 140.00 | J670: 80.00 | K670: -60
A671: GERMANY | B671: EAST | C671: EDUCATION | D671: FURNITURE | E671: SOFA | F671: 4 | G671: Oct | H671: 1994 | I671: 717.00 | J671: 322.00 | K671: -395
A672: GERMANY | B672: EAST | C672: EDUCATION | D672: FURNITURE | E672: SOFA | F672: 4 | G672: Nov | H672: 1994 | I672: 852.00 | J672: 749.00 | K672: -103
A673: GERMANY | B673: EAST | C673: EDUCATION | D673: FURNITURE | E673: SOFA | F673: 4 | G673: Dec | H673: 1994 | I673: 125.00 | J673: 606.00 | K673: 481
A674: GERMANY | B674: EAST | C674: EDUCATION | D674: FURNITURE | E674: BED | F674: 1 | G674: Jan | H674: 1994 | I674: 600.00 | J674: 874.00 | K674: 274
A675: GERMANY | B675: EAST | C675: EDUCATION | D675: FURNITURE | E675: BED | F675: 1 | G675: Feb | H675: 1994 | I675: 94.00 | J675: 674.00 | K675: 580
A676: GERMANY | B676: EAST | C676: EDUCATION | D676: FURNITURE | E676: BED | F676: 1 | G676: Mar | H676: 1994 | I676: 323.00 | J676: 347.00 | K676: 24
A677: GERMANY | B677: EAST | C677: EDUCATION | D677: FURNITURE | E677: BED | F677: 2 | G677: Apr | H677: 1994 | I677: 49.00 | J677: 105.00 | K677: 56
A678: GERMANY | B678: EAST | C678: EDUCATION | D678: FURNITURE | E678: BED | F678: 2 | G678: May | H678: 1994 | I678: 70.00 | J678: 286.00 | K678: 216
A679: GERMANY | B679: EAST | C679: EDUCATION | D679: FURNITURE | E679: BED | F679: 2 | G679: Jun | H679: 1994 | I679: 844.00 | J679: 669.00 | K679: -175
A680: GERMANY | B680: EAST | C680: EDUCATION | D680: FURNITURE | E680: BED | F680: 3 | G680: Jul | H680: 1994 | I680: 773.00 | J680: 786.00 | K680: 13
A681: GERMANY | B681: EAST | C681: EDUCATION | D681: FURNITURE | E681: BED | F681: 3 | G681: Aug | H681: 1994 | I681: 68.00 | J681: 104.00 | K681: 36
A682: GERMANY | B682: EAST | C682: EDUCATION | D682: FURNITURE | E682: BED | F682: 3 | G682: Sep | H682: 1994 | I682: 110.00 | J682: 770.00 | K682: 660
A683: GERMANY | B683: EAST | C683: EDUCATION | D683: FURNITURE | E683: BED | F683: 4 | G683: Oct | H683: 1994 | I683: 42.00 | J683: 263.00 | K683: 221
A684: GERMANY | B684: EAST | C684: EDUCATION | D684: FURNITURE | E684: BED | F684: 4 | G684: Nov | H684: 1994 | I684: 171.00 | J684: 900.00 | K684: 729
A685: GERMANY | B685: EAST | C685: EDUCATION | D685: FURNITURE | E685: BED | F685: 4 | G685: Dec | H685: 1994 | I685: 644.00 | J685: 630.00 | K685: -14
A686: GERMANY | B686: EAST | C686: EDUCATION | D686: OFFICE | E686: TABLE | F686: 1 | G686: Jan | H686: 1994 | I686: 419.00 | J686: 906.00 | K686: 487
A687: GERMANY | B687: EAST | C687: EDUCATION | D687: OFFICE | E687: TABLE | F687: 1 | G687: Feb | H687: 1994 | I687: 776.00 | J687: 429.00 | K687: -347
A688: GERMANY | B688: EAST | C688: EDUCATION | D688: OFFICE | E688: TABLE | F688: 1 | G688: Mar | H688: 1994 | I688: 971.00 | J688: 961.00 | K688: -10
A689: GERMANY | B689: EAST | C689: EDUCATION | D689: OFFICE | E689: TABLE | F689: 2 | G689: Apr | H689: 1994 | I689: 248.00 | J689: 338.00 | K689: 90
A690: GERMANY | B690: EAST | C690: EDUCATION | D690: OFFICE | E690: TABLE | F690: 2 | G690: May | H690: 1994 | I690: 486.00 | J690: 472.00 | K690: -14
A691: GERMANY | B691: EAST | C691: EDUCATION | D691: OFFICE | E691: TABLE | F691: 2 | G691: Jun | H691: 1994 | I691: 674.00 | J691: 903.00 | K691: 229
A692: GERMANY | B692: EAST | C692: EDUCATION | D692: OFFICE | E692: TABLE | F692: 3 | G692: Jul | H692: 1994 | I692: 603.00 | J692: 299.00 | K692: -304
A693: GERMANY | B693: EAST | C693: EDUCATION | D693: OFFICE | E693: TABLE | F693: 3 | G693: Aug | H693: 1994 | I693: 492.00 | J693: 948.00 | K693: 456
A694: GERMANY | B694: EAST | C694: EDUCATION | D694: OFFICE | E694: TABLE | F694: 3 | G694: Sep | H694: 1994 | I694: 512.00 | J694: 931.00 | K694: 419
A695: GERMANY | B695: EAST | C695: EDUCATION | D695: OFFICE | E695: TABLE | F695: 4 | G695: Oct | H695: 1994 | I695: 391.00 | J695: 570.00 | K695: 179
A696: GERMANY | B696: EAST | C696: EDUCATION | D696: OFFICE | E696: TABLE | F696: 4 | G696: Nov | H696: 1994 | I696: 313.00 | J696: 97.00 | K696: -216
A697: GERMANY | B697: EAST | C697: EDUCATION | D697: OFFICE | E697: TABLE | F697: 4 | G697: Dec | H697: 1994 | I697: 758.00 | J697: 674.00 | K697: -84
A698: GERMANY | B698: EAST | C698: EDUCATION | D698: OFFICE | E698: CHAIR | F698: 1 | G698: Jan | H698: 1994 | I698: 811.00 | J698: 951.00 | K698: 140
A699: GERMANY | B699: EAST | C699: EDUCATION | D699: OFFICE | E699: CHAIR | F699: 1 | G699: Feb | H699: 1994 | I699: 780.00 | J699: 430.00 | K699: -350
A700: GERMANY | B700: EAST | C700: EDUCATION | D700: OFFICE | E700: CHAIR | F700: 1 | G700: Mar | H700: 1994 | I700: 645.00 | J700: 559.00 | K700: -86
A701: GERMANY | B701: EAST | C701: EDUCATION | D701: OFFICE | E701: CHAIR | F701: 2 | G701: Apr | H701: 1994 | I701: 365.00 | J701: 726.00 | K701: 361
A702: GERMANY | B702: EAST | C702: EDUCATION | D702: OFFICE | E702: CHAIR | F702: 2 | G702: May | H702: 1994 | I702: 597.00 | J702: 944.00 | K702: 347
A703: GERMANY | B703: EAST | C703: EDUCATION | D703: OFFICE | E703: CHAIR | F703: 2 | G703: Jun | H703: 1994 | I703: 126.00 | J703: 497.00 | K703: 371
A704: GERMANY | B704: EAST | C704: EDUCATION | D704: OFFICE | E704: CHAIR | F704: 3 | G704: Jul | H704: 1994 | I704: 655.00 | J704: 388.00 | K704: -267
A705: GERMANY | B705: EAST | C705: EDUCATION | D705: OFFICE | E705: CHAIR | F705: 3 | G705: Aug | H705: 1994 | I705: 604.00 | J705: 81.00 | K705: -523
A706: GERMANY | B706: EAST | C706: EDUCATION | D706: OFFICE | E706: CHAIR | F706: 3 | G706: Sep | H706: 1994 | I706: 280.00 | J706: 111.00 | K706: -169
A707: GERMANY | B707: EAST | C707: EDUCATION | D707: OFFICE | E707: CHAIR | F707: 4 | G707: Oct | H707: 1994 | I707: 115.00 | J707: 288.00 | K707: 173
A708: GERMANY | B708: EAST | C708: EDUCATION | D708: OFFICE | E708: CHAIR | F708: 4 | G708: Nov | H708: 1994 | I708: 205.00 | J708: 845.00 | K708: 640
A709: GERMANY | B709: EAST | C709: EDUCATION | D709: OFFICE | E709: CHAIR | F709: 4 | G709: Dec | H709: 1994 | I709: 672.00 | J709: 745.00 | K709: 73
A710: GERMANY | B710: EAST | C710: EDUCATION | D710: OFFICE | E710: DESK | F710: 1 | G710: Jan | H710: 1994 | I710: 451.00 | J710: 860.00 | K710: 409
A711: GERMANY | B711: EAST | C711: EDUCATION | D711: OFFICE | E711: DESK | F711: 1 | G711: Feb | H711: 1994 | I711: 565.00 | J711: 114.00 | K711: -451
A712: GERMANY | B712: EAST | C712: EDUCATION | D712: OFFICE | E712: DESK | F712: 1 | G712: Mar | H712: 1994 | I712: 116.00 | J712: 943.00 | K712: 827
A713: GERMANY | B713: EAST | C713: EDUCATION | D713: OFFICE | E713: DESK | F713: 2 | G713: Apr | H713: 1994 | I713: 385.00 | J713: 365.00 | K713: -20
A714: GERMANY | B714: EAST | C714: EDUCATION | D714: OFFICE | E714: DESK | F714: 2 | G714: May | H714: 1994 | I714: 375.00 | J714: 249.00 | K714: -126
A715: GERMANY | B715: EAST | C715: EDUCATION | D715: OFFICE | E715: DESK | F715: 2 | G715: Jun | H715: 1994 | I715: 357.00 | J715: 192.00 | K715: -165
A716: GERMANY | B716: EAST | C716: EDUCATION | D716: OFFICE | E716: DESK | F716: 3 | G716: Jul | H716: 1994 | I716: 230.00 | J716: 328.00 | K716: 98
A717: GERMANY | B717: EAST | C717: EDUCATION | D717: OFFICE | E717: DESK | F717: 3 | G717: Aug | H717: 1994 | I717: 829.00 | J717: 311.00 | K717: -518
A718: GERMANY | B718: EAST | C718: EDUCATION | D718: OFFICE | E718: DESK | F718: 3 | G718: Sep | H718: 1994 | I718: 971.00 | J718: 576.00 | K718: -395
A719: GERMANY | B719: EAST | C719: EDUCATION | D719: OFFICE | E719: DESK | F719: 4 | G719: Oct | H719: 1994 | I719: 280.00 | J719: 915.00 | K719: 635
A720: GERMANY | B720: EAST | C720: EDUCATION | D720: OFFICE | E720: DESK | F720: 4 | G720: Nov | H720: 1994 | I720: 853.00 | J720: 522.00 | K720: -331
A721: GERMANY | B721: EAST | C721: EDUCATION | D721: OFFICE | E721: DESK | F721: 4 | G721: Dec | H721: 1994 | I721: 953.00 | J721: 625.00 | K721: -328
A722: GERMANY | B722: WEST | C722: CONSUMER | D722: FURNITURE | E722: SOFA | F722: 1 | G722: Jan | H722: 1993 | I722: 923.00 | J722: 872.00 | K722: -51
A723: GERMANY | B723: WEST | C723: CONSUMER | D723: FURNITURE | E723: SOFA | F723: 1 | G723: Feb | H723: 1993 | I723: 854.00 | J723: 748.00 | K723: -106
A724: GERMANY | B724: WEST | C724: CONSUMER | D724: FURNITURE | E724: SOFA | F724: 1 | G724: Mar | H724: 1993 | I724: 769.00 | J724: 749.00 | K724: -20
A725: GERMANY | B725: WEST | C725: CONSUMER | D725: FURNITURE | E725: SOFA | F725: 2 | G725: Apr | H725: 1993 | I725: 271.00 | J725: 876.00 | K725: 605
A726: GERMANY | B726: WEST | C726: CONSUMER | D726: FURNITURE | E726: SOFA | F726: 2 | G726: May | H726: 1993 | I726: 383.00 | J726: 860.00 | K726: 477
A727: GERMANY | B727: WEST | C727: CONSUMER | D727: FURNITURE | E727: SOFA | F727: 2 | G727: Jun | H727: 1993 | I727: 29.00 | J727: 900.00 | K727: 871
A728: GERMANY | B728: WEST | C728: CONSUMER | D728: FURNITURE | E728: SOFA | F728: 3 | G728: Jul | H728: 1993 | I728: 185.00 | J728: 705.00 | K728: 520
A729: GERMANY | B729: WEST | C729: CONSUMER | D729: FURNITURE | E729: SOFA | F729: 3 | G729: Aug | H729: 1993 | I729: 351.00 | J729: 913.00 | K729: 562
A730: GERMANY | B730: WEST | C730: CONSUMER | D730: FURNITURE | E730: SOFA | F730: 3 | G730: Sep | H730: 1993 | I730: 560.00 | J730: 315.00 | K730: -245
A731: GERMANY | B731: WEST | C731: CONSUMER | D731: FURNITURE | E731: SOFA | F731: 4 | G731: Oct | H731: 1993 | I731: 840.00 | J731: 466.00 | K731: -374
A732: GERMANY | B732: WEST | C732: CONSUMER | D732: FURNITURE | E732: SOFA | F732: 4 | G732: Nov | H732: 1993 | I732: 517.00 | J732: 233.00 | K732: -284
A733: GERMANY | B733: WEST | C733: CONSUMER | D733: FURNITURE | E733: SOFA | F733: 4 | G733: Dec | H733: 1993 | I733: 949.00 | J733: 906.00 | K733: -43
A734: GERMANY | B734: WEST | C734: CONSUMER | D734: FURNITURE | E734: BED | F734: 1 | G734: Jan | H734: 1993 | I734: 528.00 | J734: 494.00 | K734: -34
A735: GERMANY | B735: WEST | C735: CONSUMER | D735: FURNITURE | E735: BED | F735: 1 | G735: Feb | H735: 1993 | I735: 124.00 | J735: 771.00 | K735: 647
A736: GERMANY | B736: WEST | C736: CONSUMER | D736: FURNITURE | E736: BED | F736: 1 | G736: Mar | H736: 1993 | I736: 126.00 | J736: 49.00 | K736: -77
A737: GERMANY | B737: WEST | C737: CONSUMER | D737: FURNITURE | E737: BED | F737: 2 | G737: Apr | H737: 1993 | I737: 440.00 | J737: 322.00 | K737: -118
A738: GERMANY | B738: WEST | C738: CONSUMER | D738: FURNITURE | E738: BED | F738: 2 | G738: May | H738: 1993 | I738: 881.00 | J738: 878.00 | K738: -3
A739: GERMANY | B739: WEST | C739: CONSUMER | D739: FURNITURE | E739: BED | F739: 2 | G739: Jun | H739: 1993 | I739: 292.00 | J739: 827.00 | K739: 535
A740: GERMANY | B740: WEST | C740: CONSUMER | D740: FURNITURE | E740: BED | F740: 3 | G740: Jul | H740: 1993 | I740: 873.00 | J740: 852.00 | K740: -21
A741: GERMANY | B741: WEST | C741: CONSUMER | D741: FURNITURE | E741: BED | F741: 3 | G741: Aug | H741: 1993 | I741: 357.00 | J741: 716.00 | K741: 359
A742: GERMANY | B742: WEST | C742: CONSUMER | D742: FURNITURE | E742: BED | F742: 3 | G742: Sep | H742: 1993 | I742: 247.00 | J742: 81.00 | K742: -166
A743: GERMANY | B743: WEST | C743: CONSUMER | D743: FURNITURE | E743: BED | F743: 4 | G743: Oct | H743: 1993 | I743: 18.00 | J743: 916.00 | K743: 898
A744: GERMANY | B744: WEST | C744: CONSUMER | D744: FURNITURE | E744: BED | F744: 4 | G744: Nov | H744: 1993 | I744: 395.00 | J744: 673.00 | K744: 278
A745: GERMANY | B745: WEST | C745: CONSUMER | D745: FURNITURE | E745: BED | F745: 4 | G745: Dec | H745: 1993 | I745: 620.00 | J745: 242.00 | K745: -378
A746: GERMANY | B746: WEST | C746: CONSUMER | D746: OFFICE | E746: TABLE | F746: 1 | G746: Jan | H746: 1993 | I746: 59.00 | J746: 505.00 | K746: 446
A747: GERMANY | B747: WEST | C747: CONSUMER | D747: OFFICE | E747: TABLE | F747: 1 | G747: Feb | H747: 1993 | I747: 790.00 | J747: 823.00 | K747: 33
A748: GERMANY | B748: WEST | C748: CONSUMER | D748: OFFICE | E748: TABLE | F748: 1 | G748: Mar | H748: 1993 | I748: 574.00 | J748: 891.00 | K748: 317
A749: GERMANY | B749: WEST | C749: CONSUMER | D749: OFFICE | E749: TABLE | F749: 2 | G749: Apr | H749: 1993 | I749: 96.00 | J749: 840.00 | K749: 744
A750: GERMANY | B750: WEST | C750: CONSUMER | D750: OFFICE | E750: TABLE | F750: 2 | G750: May | H750: 1993 | I750: 376.00 | J750: 436.00 | K750: 60
A751: GERMANY | B751: WEST | C751: CONSUMER | D751: OFFICE | E751: TABLE | F751: 2 | G751: Jun | H751: 1993 | I751: 352.00 | J751: 168.00 | K751: -184
A752: GERMANY | B752: WEST | C752: CONSUMER | D752: OFFICE | E752: TABLE | F752: 3 | G752: Jul | H752: 1993 | I752: 741.00 | J752: 177.00 | K752: -564
A753: GERMANY | B753: WEST | C753: CONSUMER | D753: OFFICE | E753: TABLE | F753: 3 | G753: Aug | H753: 1993 | I753: 12.00 | J753: 727.00 | K753: 715
A754: GERMANY | B754: WEST | C754: CONSUMER | D754: OFFICE | E754: TABLE | F754: 3 | G754: Sep | H754: 1993 | I754: 157.00 | J754: 278.00 | K754: 121
A755: GERMANY | B755: WEST | C755: CONSUMER | D755: OFFICE | E755: TABLE | F755: 4 | G755: Oct | H755: 1993 | I755: 10.00 | J755: 443.00 | K755: 433
A756: GERMANY | B756: WEST | C756: CONSUMER | D756: OFFICE | E756: TABLE | F756: 4 | G756: Nov | H756: 1993 | I756: 544.00 | J756: 905.00 | K756: 361
A757: GERMANY | B757: WEST | C757: CONSUMER | D757: OFFICE | E757: TABLE | F757: 4 | G757: Dec | H757: 1993 | I757: 817.00 | J757: 881.00 | K757: 64
A758: GERMANY | B758: WEST | C758: CONSUMER | D758: OFFICE | E758: CHAIR | F758: 1 | G758: Jan | H758: 1993 | I758: 278.00 | J758: 168.00 | K758: -110
A759: GERMANY | B759: WEST | C759: CONSUMER | D759: OFFICE | E759: CHAIR | F759: 1 | G759: Feb | H759: 1993 | I759: 376.00 | J759: 512.00 | K759: 136
A760: GERMANY | B760: WEST | C760: CONSUMER | D760: OFFICE | E760: CHAIR | F760: 1 | G760: Mar | H760: 1993 | I760: 104.00 | J760: 291.00 | K760: 187
A761: GERMANY | B761: WEST | C761: CONSUMER | D761: OFFICE | E761: CHAIR | F761: 2 | G761: Apr | H761: 1993 | I761: 543.00 | J761: 776.00 | K761: 233
A762: GERMANY | B762: WEST | C762: CONSUMER | D762: OFFICE | E762: CHAIR | F762: 2 | G762: May | H762: 1993 | I762: 798.00 | J762: 271.00 | K762: -527
A763: GERMANY | B763: WEST | C763: CONSUMER | D763: OFFICE | E763: CHAIR | F763: 2 | G763: Jun | H763: 1993 | I763: 333.00 | J763: 946.00 | K763: 613
A764: GERMANY | B764: WEST | C764: CONSUMER | D764: OFFICE | E764: CHAIR | F764: 3 | G764: Jul | H764: 1993 | I764: 833.00 | J764: 195.00 | K764: -638
A765: GERMANY | B765: WEST | C765: CONSUMER | D765: OFFICE | E765: CHAIR | F765: 3 | G765: Aug | H765: 1993 | I765: 132.00 | J765: 165.00 | K765: 33
A766: GERMANY | B766: WEST | C766: CONSUMER | D766: OFFICE | E766: CHAIR | F766: 3 | G766: Sep | H766: 1993 | I766: 629.00 | J766: 238.00 | K766: -391
A767: GERMANY | B767: WEST | C767: CONSUMER | D767: OFFICE | E767: CHAIR | F767: 4 | G767: Oct | H767: 1993 | I767: 337.00 | J767: 409.00 | K767: 72
A768: GERMANY | B768: WEST | C768: CONSUMER | D768: OFFICE | E768: CHAIR | F768: 4 | G768: Nov | H768: 1993 | I768: 300.00 | J768: 720.00 | K768: 420
A769: GERMANY | B769: WEST | C769: CONSUMER | D769: OFFICE | E769: CHAIR | F769: 4 | G769: Dec | H769: 1993 | I769: 470.00 | J769: 309.00 | K769: -161
A770: GERMANY | B770: WEST | C770: CONSUMER | D770: OFFICE | E770: DESK | F770: 1 | G770: Jan | H770: 1993 | I770: 898.00 | J770: 636.00 | K770: -262
A771: GERMANY | B771: WEST | C771: CONSUMER | D771: OFFICE | E771: DESK | F771: 1 | G771: Feb | H771: 1993 | I771: 330.00 | J771: 52.00 | K771: -278
A772: GERMANY | B772: WEST | C772: CONSUMER | D772: OFFICE | E772: DESK | F772: 1 | G772: Mar | H772: 1993 | I772: 603.00 | J772: 184.00 | K772: -419
A773: GERMANY | B773: WEST | C773: CONSUMER | D773: OFFICE | E773: DESK | F773: 2 | G773: Apr | H773: 1993 | I773: 280.00 | J773: 739.00 | K773: 459
A774: GERMANY | B774: WEST | C774: CONSUMER | D774: OFFICE | E774: DESK | F774: 2 | G774: May | H774: 1993 | I774: 507.00 | J774: 841.00 | K774: 334
A775: GERMANY | B775: WEST | C775: CONSUMER | D775: OFFICE | E775: DESK | F775: 2 | G775: Jun | H775: 1993 | I775: 202.00 | J775: 65.00 | K775: -137
A776: GERMANY | B776: WEST | C776: CONSUMER | D776: OFFICE | E776: DESK | F776: 3 | G776: Jul | H776: 1993 | I776: 513.00 | J776: 623.00 | K776: 110
A777: GERMANY | B777: WEST | C777: CONSUMER | D777: OFFICE | E777: DESK | F777: 3 | G777: Aug | H777: 1993 | I777: 132.00 | J777: 517.00 | K777: 385
A778: GERMANY | B778: WEST | C778: CONSUMER | D778: OFFICE | E778: DESK | F778: 3 | G778: Sep | H778: 1993 | I778: 21.00 | J778: 636.00 | K778: 615
A779: GERMANY | B779: WEST | C779: CONSUMER | D779: OFFICE | E779: DESK | F779: 4 | G779: Oct | H779: 1993 | I779: 657.00 | J779: 845.00 | K779: 188
A780: GERMANY | B780: WEST | C780: CONSUMER | D780: OFFICE | E780: DESK | F780: 4 | G780: Nov | H780: 1993 | I780: 195.00 | J780: 232.00 | K780: 37
A781: GERMANY | B781: WEST | C781: CONSUMER | D781: OFFICE | E781: DESK | F781: 4 | G781: Dec | H781: 1993 | I781: 323.00 | J781: 26.00 | K781: -297
A782: GERMANY | B782: WEST | C782: CONSUMER | D782: FURNITURE | E782: SOFA | F782: 1 | G782: Jan | H782: 1994 | I782: 633.00 | J782: 148.00 | K782: -485
A783: GERMANY | B783: WEST | C783: CONSUMER | D783: FURNITURE | E783: SOFA | F783: 1 | G783: Feb | H783: 1994 | I783: 636.00 | J783: 661.00 | K783: 25
A784: GERMANY | B784: WEST | C784: CONSUMER | D784: FURNITURE | E784: SOFA | F784: 1 | G784: Mar | H784: 1994 | I784: 138.00 | J784: 847.00 | K784: 709
A785: GERMANY | B785: WEST | C785: CONSUMER | D785: FURNITURE | E785: SOFA | F785: 2 | G785: Apr | H785: 1994 | I785: 481.00 | J785: 768.00 | K785: 287
A786: GERMANY | B786: WEST | C786: CONSUMER | D786: FURNITURE | E786: SOFA | F786: 2 | G786: May | H786: 1994 | I786: 408.00 | J786: 866.00 | K786: 458
A787: GERMANY | B787: WEST | C787: CONSUMER | D787: FURNITURE | E787: SOFA | F787: 2 | G787: Jun | H787: 1994 | I787: 130.00 | J787: 475.00 | K787: 345
A788: GERMANY | B788: WEST | C788: CONSUMER | D788: FURNITURE | E788: SOFA | F788: 3 | G788: Jul | H788: 1994 | I788: 813.00 | J788: 112.00 | K788: -701
A789: GERMANY | B789: WEST | C789: CONSUMER | D789: FURNITURE | E789: SOFA | F789: 3 | G789: Aug | H789: 1994 | I789: 661.00 | J789: 136.00 | K789: -525
A790: GERMANY | B790: WEST | C790: CONSUMER | D790: FURNITURE | E790: SOFA | F790: 3 | G790: Sep | H790: 1994 | I790: 311.00 | J790: 763.00 | K790: 452
A791: GERMANY | B791: WEST | C791: CONSUMER | D791: FURNITURE | E791: SOFA | F791: 4 | G791: Oct | H791: 1994 | I791: 872.00 | J791: 388.00 | K791: -484
A792: GERMANY | B792: WEST | C792: CONSUMER | D792: FURNITURE | E792: SOFA | F792: 4 | G792: Nov | H792: 1994 | I792: 643.00 | J792: 996.00 | K792: 353
A793: GERMANY | B793: WEST | C793: CONSUMER | D793: FURNITURE | E793: SOFA | F793: 4 | G793: Dec | H793: 1994 | I793: 174.00 | J793: 486.00 | K793: 312
A794: GERMANY | B794: WEST | C794: CONSUMER | D794: FURNITURE | E794: BED | F794: 1 | G794: Jan | H794: 1994 | I794: 946.00 | J794: 914.00 | K794: -32
A795: GERMANY | B795: WEST | C795: CONSUMER | D795: FURNITURE | E795: BED | F795: 1 | G795: Feb | H795: 1994 | I795: 72.00 | J795: 902.00 | K795: 830
A796: GERMANY | B796: WEST | C796: CONSUMER | D796: FURNITURE | E796: BED | F796: 1 | G796: Mar | H796: 1994 | I796: 691.00 | J796: 707.00 | K796: 16
A797: GERMANY | B797: WEST | C797: CONSUMER | D797: FURNITURE | E797: BED | F797: 2 | G797: Apr | H797: 1994 | I797: 95.00 | J797: 223.00 | K797: 128
A798: GERMANY | B798: WEST | C798: CONSUMER | D798: FURNITURE | E798: BED | F798: 2 | G798: May | H798: 1994 | I798: 878.00 | J798: 619.00 | K798: -259
A799: GERMANY | B799: WEST | C799: CONSUMER | D799: FURNITURE | E799: BED | F799: 2 | G799: Jun | H799: 1994 | I799: 757.00 | J799: 254.00 | K799: -503
A800: GERMANY | B800: WEST | C800: CONSUMER | D800: FURNITURE | E800: BED | F800: 3 | G800: Jul | H800: 1994 | I800: 898.00 | J800: 688.00 | K800: -210
A801: GERMANY | B801: WEST | C801: CONSUMER | D801: FURNITURE | E801: BED | F801: 3 | G801: Aug | H801: 1994 | I801: 172.00 | J801: 477.00 | K801: 305
A802: GERMANY | B802: WEST | C802: CONSUMER | D802: FURNITURE | E802: BED | F802: 3 | G802: Sep | H802: 1994 | I802: 419.00 | J802: 280.00 | K802: -139
A803: GERMANY | B803: WEST | C803: CONSUMER | D803: FURNITURE | E803: BED | F803: 4 | G803: Oct | H803: 1994 | I803: 849.00 | J803: 546.00 | K803: -303
A804: GERMANY | B804: WEST | C804: CONSUMER | D804: FURNITURE | E804: BED | F804: 4 | G804: Nov | H804: 1994 | I804: 807.00 | J804: 630.00 | K804: -177
A805: GERMANY | B805: WEST | C805: CONSUMER | D805: FURNITURE | E805: BED | F805: 4 | G805: Dec | H805: 1994 | I805: 599.00 | J805: 455.00 | K805: -144
A806: GERMANY | B806: WEST | C806: CONSUMER | D806: OFFICE | E806: TABLE | F806: 1 | G806: Jan | H806: 1994 | I806: 754.00 | J806: 507.00 | K806: -247
A807: GERMANY | B807: WEST | C807: CONSUMER | D807: OFFICE | E807: TABLE | F807: 1 | G807: Feb | H807: 1994 | I807: 425.00 | J807: 363.00 | K807: -62
A808: GERMANY | B808: WEST | C808: CONSUMER | D808: OFFICE | E808: TABLE | F808: 1 | G808: Mar | H808: 1994 | I808: 492.00 | J808: 603.00 | K808: 111
A809: GERMANY | B809: WEST | C809: CONSUMER | D809: OFFICE | E809: TABLE | F809: 2 | G809: Apr | H809: 1994 | I809: 485.00 | J809: 473.00 | K809: -12
A810: GERMANY | B810: WEST | C810: CONSUMER | D810: OFFICE | E810: TABLE | F810: 2 | G810: May | H810: 1994 | I810: 369.00 | J810: 128.00 | K810: -241
A811: GERMANY | B811: WEST | C811: CONSUMER | D811: OFFICE | E811: TABLE | F811: 2 | G811: Jun | H811: 1994 | I811: 560.00 | J811: 105.00 | K811: -455
A812: GERMANY | B812: WEST | C812: CONSUMER | D812: OFFICE | E812: TABLE | F812: 3 | G812: Jul | H812: 1994 | I812: 651.00 | J812: 325.00 | K812: -326
A813: GERMANY | B813: WEST | C813: CONSUMER | D813: OFFICE | E813: TABLE | F813: 3 | G813: Aug | H813: 1994 | I813: 326.00 | J813: 711.00 | K813: 385
A814: GERMANY | B814: WEST | C814: CONSUMER | D814: OFFICE | E814: TABLE | F814: 3 | G814: Sep | H814: 1994 | I814: 180.00 | J814: 983.00 | K814: 803
A815: GERMANY | B815: WEST | C815: CONSUMER | D815: OFFICE | E815: TABLE | F815: 4 | G815: Oct | H815: 1994 | I815: 935.00 | J815: 241.00 | K815: -694
A816: GERMANY | B816: WEST | C816: CONSUMER | D816: OFFICE | E816: TABLE | F816: 4 | G816: Nov | H816: 1994 | I816: 403.00 | J816: 71.00 | K816: -332
A817: GERMANY | B817: WEST | C817: CONSUMER | D817: OFFICE | E817: TABLE | F817: 4 | G817: Dec | H817: 1994 | I817: 345.00 | J817: 395.00 | K817: 50
A818: GERMANY | B818: WEST | C818: CONSUMER | D818: OFFICE | E818: CHAIR | F818: 1 | G818: Jan | H818: 1994 | I818: 875.00 | J818: 812.00 | K818: -63
A819: GERMANY | B819: WEST | C819: CONSUMER | D819: OFFICE | E819: CHAIR | F819: 1 | G819: Feb | H819: 1994 | I819: 237.00 | J819: 441.00 | K819: 204
A820: GERMANY | B820: WEST | C820: CONSUMER | D820: OFFICE | E820: CHAIR | F820: 1 | G820: Mar | H820: 1994 | I820: 272.00 | J820: 500.00 | K820: 228
A821: GERMANY | B821: WEST | C821: CONSUMER | D821: OFFICE | E821: CHAIR | F821: 2 | G821: Apr | H821: 1994 | I821: 860.00 | J821: 517.00 | K821: -343
A822: GERMANY | B822: WEST | C822: CONSUMER | D822: OFFICE | E822: CHAIR | F822: 2 | G822: May | H822: 1994 | I822: 415.00 | J822: 924.00 | K822: 509
A823: GERMANY | B823: WEST | C823: CONSUMER | D823: OFFICE | E823: CHAIR | F823: 2 | G823: Jun | H823: 1994 | I823: 140.00 | J823: 572.00 | K823: 432
A824: GERMANY | B824: WEST | C824: CONSUMER | D824: OFFICE | E824: CHAIR | F824: 3 | G824: Jul | H824: 1994 | I824: 367.00 | J824: 768.00 | K824: 401
A825: GERMANY | B825: WEST | C825: CONSUMER | D825: OFFICE | E825: CHAIR | F825: 3 | G825: Aug | H825: 1994 | I825: 195.00 | J825: 692.00 | K825: 497
A826: GERMANY | B826: WEST | C826: CONSUMER | D826: OFFICE | E826: CHAIR | F826: 3 | G826: Sep | H826: 1994 | I826: 245.00 | J826: 28.00 | K826: -217
A827: GERMANY | B827: WEST | C827: CONSUMER | D827: OFFICE | E827: CHAIR | F827: 4 | G827: Oct | H827: 1994 | I827: 285.00 | J827: 202.00 | K827: -83
A828: GERMANY | B828: WEST | C828: CONSUMER | D828: OFFICE | E828: CHAIR | F828: 4 | G828: Nov | H828: 1994 | I828: 98.00 | J828: 76.00 | K828: -22
A829: GERMANY | B829: WEST | C829: CONSUMER | D829: OFFICE | E829: CHAIR | F829: 4 | G829: Dec | H829: 1994 | I829: 932.00 | J829: 421.00 | K829: -511
A830: GERMANY | B830: WEST | C830: CONSUMER | D830: OFFICE | E830: DESK | F830: 1 | G830: Jan | H830: 1994 | I830: 299.00 | J830: 680.00 | K830: 381
A831: GERMANY | B831: WEST | C831: CONSUMER | D831: OFFICE | E831: DESK | F831: 1 | G831: Feb | H831: 1994 | I831: 811.00 | J831: 364.00 | K831: -447
A832: GERMANY | B832: WEST | C832: CONSUMER | D832: OFFICE | E832: DESK | F832: 1 | G832: Mar | H832: 1994 | I832: 739.00 | J832: 572.00 | K832: -167
A833: GERMANY | B833: WEST | C833: CONSUMER | D833: OFFICE | E833: DESK | F833: 2 | G833: Apr | H833: 1994 | I833: 889.00 | J833: 145.00 | K833: -744
A834: GERMANY | B834: WEST | C834: CONSUMER | D834: OFFICE | E834: DESK | F834: 2 | G834: May | H834: 1994 | I834: 189.00 | J834: 644.00 | K834: 455
A835: GERMANY | B835: WEST | C835: CONSUMER | D835: OFFICE | E835: DESK | F835: 2 | G835: Jun | H835: 1994 | I835: 698.00 | J835: 87.00 | K835: -611
A836: GERMANY | B836: WEST | C836: CONSUMER | D836: OFFICE | E836: DESK | F836: 3 | G836: Jul | H836: 1994 | I836: 646.00 | J836: 620.00 | K836: -26
A837: GERMANY | B837: WEST | C837: CONSUMER | D837: OFFICE | E837: DESK | F837: 3 | G837: Aug | H837: 1994 | I837: 562.00 | J837: 535.00 | K837: -27
A838: GERMANY | B838: WEST | C838: CONSUMER | D838: OFFICE | E838: DESK | F838: 3 | G838: Sep | H838: 1994 | I838: 753.00 | J838: 661.00 | K838: -92
A839: GERMANY | B839: WEST | C839: CONSUMER | D839: OFFICE | E839: DESK | F839: 4 | G839: Oct | H839: 1994 | I839: 425.00 | J839: 884.00 | K839: 459
A840: GERMANY | B840: WEST | C840: CONSUMER | D840: OFFICE | E840: DESK | F840: 4 | G840: Nov | H840: 1994 | I840: 693.00 | J840: 689.00 | K840: -4
A841: GERMANY | B841: WEST | C841: CONSUMER | D841: OFFICE | E841: DESK | F841: 4 | G841: Dec | H841: 1994 | I841: 941.00 | J841: 646.00 | K841: -295
A842: GERMANY | B842: WEST | C842: EDUCATION | D842: FURNITURE | E842: SOFA | F842: 1 | G842: Jan | H842: 1993 | I842: 739.00 | J842: 982.00 | K842: 243
A843: GERMANY | B843: WEST | C843: EDUCATION | D843: FURNITURE | E843: SOFA | F843: 1 | G843: Feb | H843: 1993 | I843: 683.00 | J843: 593.00 | K843: -90
A844: GERMANY | B844: WEST | C844: EDUCATION | D844: FURNITURE | E844: SOFA | F844: 1 | G844: Mar | H844: 1993 | I844: 610.00 | J844: 702.00 | K844: 92
A845: GERMANY | B845: WEST | C845: EDUCATION | D845: FURNITURE | E845: SOFA | F845: 2 | G845: Apr | H845: 1993 | I845: 248.00 | J845: 528.00 | K845: 280
A846: GERMANY | B846: WEST | C846: EDUCATION | D846: FURNITURE | E846: SOFA | F846: 2 | G846: May | H846: 1993 | I846: 530.00 | J846: 873.00 | K846: 343
A847: GERMANY | B847: WEST | C847: EDUCATION | D847: FURNITURE | E847: SOFA | F847: 2 | G847: Jun | H847: 1993 | I847: 889.00 | J847: 301.00 | K847: -588
A848: GERMANY | B848: WEST | C848: EDUCATION | D848: FURNITURE | E848: SOFA | F848: 3 | G848: Jul | H848: 1993 | I848: 245.00 | J848: 769.00 | K848: 524
A849: GERMANY | B849: WEST | C849: EDUCATION | D849: FURNITURE | E849: SOFA | F849: 3 | G849: Aug | H849: 1993 | I849: 473.00 | J849: 724.00 | K849: 251
A850: GERMANY | B850: WEST | C850: EDUCATION | D850: FURNITURE | E850: SOFA | F850: 3 | G850: Sep | H850: 1993 | I850: 938.00 | J850: 466.00 | K850: -472
A851: GERMANY | B851: WEST | C851: EDUCATION | D851: FURNITURE | E851: SOFA | F851: 4 | G851: Oct | H851: 1993 | I851: 150.00 | J851: 774.00 | K851: 624
A852: GERMANY | B852: WEST | C852: EDUCATION | D852: FURNITURE | E852: SOFA | F852: 4 | G852: Nov | H852: 1993 | I852: 772.00 | J852: 111.00 | K852: -661
A853: GERMANY | B853: WEST | C853: EDUCATION | D853: FURNITURE | E853: SOFA | F853: 4 | G853: Dec | H853: 1993 | I853: 201.00 | J853: 954.00 | K853: 753
A854: GERMANY | B854: WEST | C854: EDUCATION | D854: FURNITURE | E854: BED | F854: 1 | G854: Jan | H854: 1993 | I854: 239.00 | J854: 597.00 | K854: 358
A855: GERMANY | B855: WEST | C855: EDUCATION | D855: FURNITURE | E855: BED | F855: 1 | G855: Feb | H855: 1993 | I855: 637.00 | J855: 649.00 | K855: 12
A856: GERMANY | B856: WEST | C856: EDUCATION | D856: FURNITURE | E856: BED | F856: 1 | G856: Mar | H856: 1993 | I856: 938.00 | J856: 3.00 | K856: -935
A857: GERMANY | B857: WEST | C857: EDUCATION | D857: FURNITURE | E857: BED | F857: 2 | G857: Apr | H857: 1993 | I857: 788.00 | J857: 731.00 | K857: -57
A858: GERMANY | B858: WEST | C858: EDUCATION | D858: FURNITURE | E858: BED | F858: 2 | G858: May | H858: 1993 | I858: 399.00 | J858: 181.00 | K858: -218
A859: GERMANY | B859: WEST | C859: EDUCATION | D859: FURNITURE | E859: BED | F859: 2 | G859: Jun | H859: 1993 | I859: 576.00 | J859: 468.00 | K859: -108
A860: GERMANY | B860: WEST | C860: EDUCATION | D860: FURNITURE | E860: BED | F860: 3 | G860: Jul | H860: 1993 | I860: 187.00 | J860: 891.00 | K860: 704
A861: GERMANY | B861: WEST | C861: EDUCATION | D861: FURNITURE | E861: BED | F861: 3 | G861: Aug | H861: 1993 | I861: 703.00 | J861: 226.00 | K861: -477
A862: GERMANY | B862: WEST | C862: EDUCATION | D862: FURNITURE | E862: BED | F862: 3 | G862: Sep | H862: 1993 | I862: 455.00 | J862: 28.00 | K862: -427
A863: GERMANY | B863: WEST | C863: EDUCATION | D863: FURNITURE | E863: BED | F863: 4 | G863: Oct | H863: 1993 | I863: 244.00 | J863: 609.00 | K863: 365
A864: GERMANY | B864: WEST | C864: EDUCATION | D864: FURNITURE | E864: BED | F864: 4 | G864: Nov | H864: 1993 | I864: 868.00 | J864: 224.00 | K864: -644
A865: GERMANY | B865: WEST | C865: EDUCATION | D865: FURNITURE | E865: BED | F865: 4 | G865: Dec | H865: 1993 | I865: 353.00 | J865: 230.00 | K865: -123
A866: GERMANY | B866: WEST | C866: EDUCATION | D866: OFFICE | E866: TABLE | F866: 1 | G866: Jan | H866: 1993 | I866: 441.00 | J866: 222.00 | K866: -219
A867: GERMANY | B867: WEST | C867: EDUCATION | D867: OFFICE | E867: TABLE | F867: 1 | G867: Feb | H867: 1993 | I867: 183.00 | J867: 678.00 | K867: 495
A868: GERMANY | B868: WEST | C868: EDUCATION | D868: OFFICE | E868: TABLE | F868: 1 | G868: Mar | H868: 1993 | I868: 459.00 | J868: 25.00 | K868: -434
A869: GERMANY | B869: WEST | C869: EDUCATION | D869: OFFICE | E869: TABLE | F869: 2 | G869: Apr | H869: 1993 | I869: 810.00 | J869: 57.00 | K869: -753
A870: GERMANY | B870: WEST | C870: EDUCATION | D870: OFFICE | E870: TABLE | F870: 2 | G870: May | H870: 1993 | I870: 268.00 | J870: 981.00 | K870: 713
A871: GERMANY | B871: WEST | C871: EDUCATION | D871: OFFICE | E871: TABLE | F871: 2 | G871: Jun | H871: 1993 | I871: 916.00 | J871: 740.00 | K871: -176
A872: GERMANY | B872: WEST | C872: EDUCATION | D872: OFFICE | E872: TABLE | F872: 3 | G872: Jul | H872: 1993 | I872: 742.00 | J872: 408.00 | K872: -334
A873: GERMANY | B873: WEST | C873: EDUCATION | D873: OFFICE | E873: TABLE | F873: 3 | G873: Aug | H873: 1993 | I873: 522.00 | J873: 966.00 | K873: 444
A874: GERMANY | B874: WEST | C874: EDUCATION | D874: OFFICE | E874: TABLE | F874: 3 | G874: Sep | H874: 1993 | I874: 299.00 | J874: 107.00 | K874: -192
A875: GERMANY | B875: WEST | C875: EDUCATION | D875: OFFICE | E875: TABLE | F875: 4 | G875: Oct | H875: 1993 | I875: 677.00 | J875: 488.00 | K875: -189
A876: GERMANY | B876: WEST | C876: EDUCATION | D876: OFFICE | E876: TABLE | F876: 4 | G876: Nov | H876: 1993 | I876: 709.00 | J876: 759.00 | K876: 50
A877: GERMANY | B877: WEST | C877: EDUCATION | D877: OFFICE | E877: TABLE | F877: 4 | G877: Dec | H877: 1993 | I877: 310.00 | J877: 504.00 | K877: 194
A878: GERMANY | B878: WEST | C878: EDUCATION | D878: OFFICE | E878: CHAIR | F878: 1 | G878: Jan | H878: 1993 | I878: 591.00 | J878: 774.00 | K878: 183
A879: GERMANY | B879: WEST | C879: EDUCATION | D879: OFFICE | E879: CHAIR | F879: 1 | G879: Feb | H879: 1993 | I879: 378.00 | J879: 645.00 | K879: 267
A880: GERMANY | B880: WEST | C880: EDUCATION | D880: OFFICE | E880: CHAIR | F880: 1 | G880: Mar | H880: 1993 | I880: 942.00 | J880: 986.00 | K880: 44
A881: GERMANY | B881: WEST | C881: EDUCATION | D881: OFFICE | E881: CHAIR | F881: 2 | G881: Apr | H881: 1993 | I881: 686.00 | J881: 296.00 | K881: -390
A882: GERMANY | B882: WEST | C882: EDUCATION | D882: OFFICE | E882: CHAIR | F882: 2 | G882: May | H882: 1993 | I882: 720.00 | J882: 936.00 | K882: 216
A883: GERMANY | B883: WEST | C883: EDUCATION | D883: OFFICE | E883: CHAIR | F883: 2 | G883: Jun | H883: 1993 | I883: 546.00 | J883: 341.00 | K883: -205
A884: GERMANY | B884: WEST | C884: EDUCATION | D884: OFFICE | E884: CHAIR | F884: 3 | G884: Jul | H884: 1993 | I884: 845.00 | J884: 32.00 | K884: -813
A885: GERMANY | B885: WEST | C885: EDUCATION | D885: OFFICE | E885: CHAIR | F885: 3 | G885: Aug | H885: 1993 | I885: 667.00 | J885: 277.00 | K885: -390
A886: GERMANY | B886: WEST | C886: EDUCATION | D886: OFFICE | E886: CHAIR | F886: 3 | G886: Sep | H886: 1993 | I886: 627.00 | J886: 548.00 | K886: -79
A887: GERMANY | B887: WEST | C887: EDUCATION | D887: OFFICE | E887: CHAIR | F887: 4 | G887: Oct | H887: 1993 | I887: 142.00 | J887: 727.00 | K887: 585
A888: GERMANY | B888: WEST | C888: EDUCATION | D888: OFFICE | E888: CHAIR | F888: 4 | G888: Nov | H888: 1993 | I888: 655.00 | J888: 812.00 | K888: 157
A889: GERMANY | B889: WEST | C889: EDUCATION | D889: OFFICE | E889: CHAIR | F889: 4 | G889: Dec | H889: 1993 | I889: 556.00 | J889: 168.00 | K889: -388
A890: GERMANY | B890: WEST | C890: EDUCATION | D890: OFFICE | E890: DESK | F890: 1 | G890: Jan | H890: 1993 | I890: 285.00 | J890: 100.00 | K890: -185
A891: GERMANY | B891: WEST | C891: EDUCATION | D891: OFFICE | E891: DESK | F891: 1 | G891: Feb | H891: 1993 | I891: 94.00 | J891: 465.00 | K891: 371
A892: GERMANY | B892: WEST | C892: EDUCATION | D892: OFFICE | E892: DESK | F892: 1 | G892: Mar | H892: 1993 | I892: 561.00 | J892: 350.00 | K892: -211
A893: GERMANY | B893: WEST | C893: EDUCATION | D893: OFFICE | E893: DESK | F893: 2 | G893: Apr | H893: 1993 | I893: 143.00 | J893: 991.00 | K893: 848
A894: GERMANY | B894: WEST | C894: EDUCATION | D894: OFFICE | E894: DESK | F894: 2 | G894: May | H894: 1993 | I894: 95.00 | J894: 910.00 | K894: 815
A895: GERMANY | B895: WEST | C895: EDUCATION | D895: OFFICE | E895: DESK | F895: 2 | G895: Jun | H895: 1993 | I895: 341.00 | J895: 206.00 | K895: -135
A896: GERMANY | B896: WEST | C896: EDUCATION | D896: OFFICE | E896: DESK | F896: 3 | G896: Jul | H896: 1993 | I896: 388.00 | J896: 263.00 | K896: -125
A897: GERMANY | B897: WEST | C897: EDUCATION | D897: OFFICE | E897: DESK | F897: 3 | G897: Aug | H897: 1993 | I897: 272.00 | J897: 374.00 | K897: 102
A898: GERMANY | B898: WEST | C898: EDUCATION | D898: OFFICE | E898: DESK | F898: 3 | G898: Sep | H898: 1993 | I898: 890.00 | J898: 875.00 | K898: -15
A899: GERMANY | B899: WEST | C899: EDUCATION | D899: OFFICE | E899: DESK | F899: 4 | G899: Oct | H899: 1993 | I899: 734.00 | J899: 810.00 | K899: 76
A900: GERMANY | B900: WEST | C900: EDUCATION | D900: OFFICE | E900: DESK | F900: 4 | G900: Nov | H900: 1993 | I900: 364.00 | J900: 398.00 | K900: 34
A901: GERMANY | B901: WEST | C901: EDUCATION | D901: OFFICE | E901: DESK | F901: 4 | G901: Dec | H901: 1993 | I901: 619.00 | J901: 565.00 | K901: -54
A902: GERMANY | B902: WEST | C902: EDUCATION | D902: FURNITURE | E902: SOFA | F902: 1 | G902: Jan | H902: 1994 | I902: 945.00 | J902: 780.00 | K902: -165
A903: GERMANY | B903: WEST | C903: EDUCATION | D903: FURNITURE | E903: SOFA | F903: 1 | G903: Feb | H903: 1994 | I903: 177.00 | J903: 210.00 | K903: 33
A904: GERMANY | B904: WEST | C904: EDUCATION | D904: FURNITURE | E904: SOFA | F904: 1 | G904: Mar | H904: 1994 | I904: 378.00 | J904: 93.00 | K904: -285
A905: GERMANY | B905: WEST | C905: EDUCATION | D905: FURNITURE | E905: SOFA | F905: 2 | G905: Apr | H905: 1994 | I905: 83.00 | J905: 332.00 | K905: 249
A906: GERMANY | B906: WEST | C906: EDUCATION | D906: FURNITURE | E906: SOFA | F906: 2 | G906: May | H906: 1994 | I906: 803.00 | J906: 186.00 | K906: -617
A907: GERMANY | B907: WEST | C907: EDUCATION | D907: FURNITURE | E907: SOFA | F907: 2 | G907: Jun | H907: 1994 | I907: 398.00 | J907: 782.00 | K907: 384
A908: GERMANY | B908: WEST | C908: EDUCATION | D908: FURNITURE | E908: SOFA | F908: 3 | G908: Jul | H908: 1994 | I908: 215.00 | J908: 41.00 | K908: -174
A909: GERMANY | B909: WEST | C909: EDUCATION | D909: FURNITURE | E909: SOFA | F909: 3 | G909: Aug | H909: 1994 | I909: 194.00 | J909: 222.00 | K909: 28
A910: GERMANY | B910: WEST | C910: EDUCATION | D910: FURNITURE | E910: SOFA | F910: 3 | G910: Sep | H910: 1994 | I910: 287.00 | J910: 992.00 | K910: 705
A911: GERMANY | B911: WEST | C911: EDUCATION | D911: FURNITURE | E911: SOFA | F911: 4 | G911: Oct | H911: 1994 | I911: 410.00 | J911: 477.00 | K911: 67
A912: GERMANY | B912: WEST | C912: EDUCATION | D912: FURNITURE | E912: SOFA | F912: 4 | G912: Nov | H912: 1994 | I912: 50.00 | J912: 948.00 | K912: 898
A913: GERMANY | B913: WEST | C913: EDUCATION | D913: FURNITURE | E913: SOFA | F913: 4 | G913: Dec | H913: 1994 | I913: 204.00 | J913: 817.00 | K913: 613
A914: GERMANY | B914: WEST | C914: EDUCATION | D914: FURNITURE | E914: BED | F914: 1 | G914: Jan | H914: 1994 | I914: 101.00 | J914: 216.00 | K914: 115
A915: GERMANY | B915: WEST | C915: EDUCATION | D915: FURNITURE | E915: BED | F915: 1 | G915: Feb | H915: 1994 | I915: 924.00 | J915: 282.00 | K915: -642
A916: GERMANY | B916: WEST | C916: EDUCATION | D916: FURNITURE | E916: BED | F916: 1 | G916: Mar | H916: 1994 | I916: 144.00 | J916: 501.00 | K916: 357
A917: GERMANY | B917: WEST | C917: EDUCATION | D917: FURNITURE | E917: BED | F917: 2 | G917: Apr | H917: 1994 | I917: 0.00 | J917: 320.00 | K917: 320
A918: GERMANY | B918: WEST | C918: EDUCATION | D918: FURNITURE | E918: BED | F918: 2 | G918: May | H918: 1994 | I918: 910.00 | J918: 720.00 | K918: -190
A919: GERMANY | B919: WEST | C919: EDUCATION | D919: FURNITURE | E919: BED | F919: 2 | G919: Jun | H919: 1994 | I919: 259.00 | J919: 464.00 | K919: 205
A920: GERMANY | B920: WEST | C920: EDUCATION | D920: FURNITURE | E920: BED | F920: 3 | G920: Jul | H920: 1994 | I920: 107.00 | J920: 363.00 | K920: 256
A921: GERMANY | B921: WEST | C921: EDUCATION | D921: FURNITURE | E921: BED | F921: 3 | G921: Aug | H921: 1994 | I921: 63.00 | J921: 49.00 | K921: -14
A922: GERMANY | B922: WEST | C922: EDUCATION | D922: FURNITURE | E922: BED | F922: 3 | G922: Sep | H922: 1994 | I922: 270.00 | J922: 223.00 | K922: -47
A923: GERMANY | B923: WEST | C923: EDUCATION | D923: FURNITURE | E923: BED | F923: 4 | G923: Oct | H923: 1994 | I923: 554.00 | J923: 452.00 | K923: -102
A924: GERMANY | B924: WEST | C924: EDUCATION | D924: FURNITURE | E924: BED | F924: 4 | G924: Nov | H924: 1994 | I924: 154.00 | J924: 210.00 | K924: 56
A925: GERMANY | B925: WEST | C925: EDUCATION | D925: FURNITURE | E925: BED | F925: 4 | G925: Dec | H925: 1994 | I925: 205.00 | J925: 444.00 | K925: 239
A926: GERMANY | B926: WEST | C926: EDUCATION | D926: OFFICE | E926: TABLE | F926: 1 | G926: Jan | H926: 1994 | I926: 160.00 | J926: 99.00 | K926: -61
A927: GERMANY | B927: WEST | C927: EDUCATION | D927: OFFICE | E927: TABLE | F927: 1 | G927: Feb | H927: 1994 | I927: 698.00 | J927: 503.00 | K927: -195
A928: GERMANY | B928: WEST | C928: EDUCATION | D928: OFFICE | E928: TABLE | F928: 1 | G928: Mar | H928: 1994 | I928: 540.00 | J928: 724.00 | K928: 184
A929: GERMANY | B929: WEST | C929: EDUCATION | D929: OFFICE | E929: TABLE | F929: 2 | G929: Apr | H929: 1994 | I929: 901.00 | J929: 309.00 | K929: -592
A930: GERMANY | B930: WEST | C930: EDUCATION | D930: OFFICE | E930: TABLE | F930: 2 | G930: May | H930: 1994 | I930: 34.00 | J930: 625.00 | K930: 591
A931: GERMANY | B931: WEST | C931: EDUCATION | D931: OFFICE | E931: TABLE | F931: 2 | G931: Jun | H931: 1994 | I931: 536.00 | J931: 294.00 | K931: -242
A932: GERMANY | B932: WEST | C932: EDUCATION | D932: OFFICE | E932: TABLE | F932: 3 | G932: Jul | H932: 1994 | I932: 780.00 | J932: 890.00 | K932: 110
A933: GERMANY | B933: WEST | C933: EDUCATION | D933: OFFICE | E933: TABLE | F933: 3 | G933: Aug | H933: 1994 | I933: 716.00 | J933: 501.00 | K933: -215
A934: GERMANY | B934: WEST | C934: EDUCATION | D934: OFFICE | E934: TABLE | F934: 3 | G934: Sep | H934: 1994 | I934: 532.00 | J934: 34.00 | K934: -498
A935: GERMANY | B935: WEST | C935: EDUCATION | D935: OFFICE | E935: TABLE | F935: 4 | G935: Oct | H935: 1994 | I935: 871.00 | J935: 203.00 | K935: -668
A936: GERMANY | B936: WEST | C936: EDUCATION | D936: OFFICE | E936: TABLE | F936: 4 | G936: Nov | H936: 1994 | I936: 199.00 | J936: 140.00 | K936: -59
A937: GERMANY | B937: WEST | C937: EDUCATION | D937: OFFICE | E937: TABLE | F937: 4 | G937: Dec | H937: 1994 | I937: 845.00 | J937: 845.00 | K937: 0
A938: GERMANY | B938: WEST | C938: EDUCATION | D938: OFFICE | E938: CHAIR | F938: 1 | G938: Jan | H938: 1994 | I938: 459.00 | J938: 150.00 | K938: -309
A939: GERMANY | B939: WEST | C939: EDUCATION | D939: OFFICE | E939: CHAIR | F939: 1 | G939: Feb | H939: 1994 | I939: 89.00 | J939: 136.00 | K939: 47
A940: GERMANY | B940: WEST | C940: EDUCATION | D940: OFFICE | E940: CHAIR | F940: 1 | G940: Mar | H940: 1994 | I940: 726.00 | J940: 695.00 | K940: -31
A941: GERMANY | B941: WEST | C941: EDUCATION | D941: OFFICE | E941: CHAIR | F941: 2 | G941: Apr | H941: 1994 | I941: 38.00 | J941: 363.00 | K941: 325
A942: GERMANY | B942: WEST | C942: EDUCATION | D942: OFFICE | E942: CHAIR | F942: 2 | G942: May | H942: 1994 | I942: 60.00 | J942: 853.00 | K942: 793
A943: GERMANY | B943: WEST | C943: EDUCATION | D943: OFFICE | E943: CHAIR | F943: 2 | G943: Jun | H943: 1994 | I943: 369.00 | J943: 621.00 | K943: 252
A944: GERMANY | B944: WEST | C944: EDUCATION | D944: OFFICE | E944: CHAIR | F944: 3 | G944: Jul | H944: 1994 | I944: 381.00 | J944: 764.00 | K944: 383
A945: GERMANY | B945: WEST | C945: EDUCATION | D945: OFFICE | E945: CHAIR | F945: 3 | G945: Aug | H945: 1994 | I945: 465.00 | J945: 669.00 | K945: 204
A946: GERMANY | B946: WEST | C946: EDUCATION | D946: OFFICE | E946: CHAIR | F946: 3 | G946: Sep | H946: 1994 | I946: 981.00 | J946: 772.00 | K946: -209
A947: GERMANY | B947: WEST | C947: EDUCATION | D947: OFFICE | E947: CHAIR | F947: 4 | G947: Oct | H947: 1994 | I947: 758.00 | J947: 228.00 | K947: -530
A948: GERMANY | B948: WEST | C948: EDUCATION | D948: OFFICE | E948: CHAIR | F948: 4 | G948: Nov | H948: 1994 | I948: 31.00 | J948: 261.00 | K948: 230
A949: GERMANY | B949: WEST | C949: EDUCATION | D949: OFFICE | E949: CHAIR | F949: 4 | G949: Dec | H949: 1994 | I949: 237.00 | J949: 821.00 | K949: 584
A950: GERMANY | B950: WEST | C950: EDUCATION | D950: OFFICE | E950: DESK | F950: 1 | G950: Jan | H950: 1994 | I950: 517.00 | J950: 417.00 | K950: -100
A951: GERMANY | B951: WEST | C951: EDUCATION | D951: OFFICE | E951: DESK | F951: 1 | G951: Feb | H951: 1994 | I951: 781.00 | J951: 291.00 | K951: -490
A952: GERMANY | B952: WEST | C952: EDUCATION | D952: OFFICE | E952: DESK | F952: 1 | G952: Mar | H952: 1994 | I952: 327.00 | J952: 251.00 | K952: -76
A953: GERMANY | B953: WEST | C953: EDUCATION | D953: OFFICE | E953: DESK | F953: 2 | G953: Apr | H953: 1994 | I953: 48.00 | J953: 449.00 | K953: 401
A954: GERMANY | B954: WEST | C954: EDUCATION | D954: OFFICE | E954: DESK | F954: 2 | G954: May | H954: 1994 | I954: 809.00 | J954: 774.00 | K954: -35
A955: GERMANY | B955: WEST | C955: EDUCATION | D955: OFFICE | E955: DESK | F955: 2 | G955: Jun | H955: 1994 | I955: 73.00 | J955: 386.00 | K955: 313
A956: GERMANY | B956: WEST | C956: EDUCATION | D956: OFFICE | E956: DESK | F956: 3 | G956: Jul | H956: 1994 | I956: 936.00 | J956: 22.00 | K956: -914
A957: GERMANY | B957: WEST | C957: EDUCATION | D957: OFFICE | E957: DESK | F957: 3 | G957: Aug | H957: 1994 | I957: 400.00 | J957: 940.00 | K957: 540
A958: GERMANY | B958: WEST | C958: EDUCATION | D958: OFFICE | E958: DESK | F958: 3 | G958: Sep | H958: 1994 | I958: 736.00 | J958: 132.00 | K958: -604
A959: GERMANY | B959: WEST | C959: EDUCATION | D959: OFFICE | E959: DESK | F959: 4 | G959: Oct | H959: 1994 | I959: 211.00 | J959: 103.00 | K959: -108
A960: GERMANY | B960: WEST | C960: EDUCATION | D960: OFFICE | E960: DESK | F960: 4 | G960: Nov | H960: 1994 | I960: 271.00 | J960: 152.00 | K960: -119
A961: GERMANY | B961: WEST | C961: EDUCATION | D961: OFFICE | E961: DESK | F961: 4 | G961: Dec | H961: 1994 | I961: 855.00 | J961: 952.00 | K961: 97
A962: U.S.A. | B962: EAST | C962: CONSUMER | D962: FURNITURE | E962: SOFA | F962: 1 | G962: Jan | H962: 1993 | I962: 204.00 | J962: 521.00 | K962: 317
A963: U.S.A. | B963: EAST | C963: CONSUMER | D963: FURNITURE | E963: SOFA | F963: 1 | G963: Feb | H963: 1993 | I963: 805.00 | J963: 751.00 | K963: -54
A964: U.S.A. | B964: EAST | C964: CONSUMER | D964: FURNITURE | E964: SOFA | F964: 1 | G964: Mar | H964: 1993 | I964: 549.00 | J964: 45.00 | K964: -504
A965: U.S.A. | B965: EAST | C965: CONSUMER | D965: FURNITURE | E965: SOFA | F965: 2 | G965: Apr | H965: 1993 | I965: 912.00 | J965: 144.00 | K965: -768
A966: U.S.A. | B966: EAST | C966: CONSUMER | D966: FURNITURE | E966: SOFA | F966: 2 | G966: May | H966: 1993 | I966: 427.00 | J966: 119.00 | K966: -308
A967: U.S.A. | B967: EAST | C967: CONSUMER | D967: FURNITURE | E967: SOFA | F967: 2 | G967: Jun | H967: 1993 | I967: 1.00 | J967: 728.00 | K967: 727
A968: U.S.A. | B968: EAST | C968: CONSUMER | D968: FURNITURE | E968: SOFA | F968: 3 | G968: Jul | H968: 1993 | I968: 540.00 | J968: 120.00 | K968: -420
A969: U.S.A. | B969: EAST | C969: CONSUMER | D969: FURNITURE | E969: SOFA | F969: 3 | G969: Aug | H969: 1993 | I969: 940.00 | J969: 657.00 | K969: -283
A970: U.S.A. | B970: EAST | C970: CONSUMER | D970: FURNITURE | E970: SOFA | F970: 3 | G970: Sep | H970: 1993 | I970: 644.00 | J970: 409.00 | K970: -235
A971: U.S.A. | B971: EAST | C971: CONSUMER | D971: FURNITURE | E971: SOFA | F971: 4 | G971: Oct | H971: 1993 | I971: 821.00 | J971: 881.00 | K971: 60
A972: U.S.A. | B972: EAST | C972: CONSUMER | D972: FURNITURE | E972: SOFA | F972: 4 | G972: Nov | H972: 1993 | I972: 560.00 | J972: 113.00 | K972: -447
A973: U.S.A. | B973: EAST | C973: CONSUMER | D973: FURNITURE | E973: SOFA | F973: 4 | G973: Dec | H973: 1993 | I973: 309.00 | J973: 831.00 | K973: 522
A974: U.S.A. | B974: EAST | C974: CONSUMER | D974: FURNITURE | E974: BED | F974: 1 | G974: Jan | H974: 1993 | I974: 278.00 | J974: 622.00 | K974: 344
A975: U.S.A. | B975: EAST | C975: CONSUMER | D975: FURNITURE | E975: BED | F975: 1 | G975: Feb | H975: 1993 | I975: 447.00 | J975: 689.00 | K975: 242
A976: U.S.A. | B976: EAST | C976: CONSUMER | D976: FURNITURE | E976: BED | F976: 1 | G976: Mar | H976: 1993 | I976: 170.00 | J976: 120.00 | K976: -50
A977: U.S.A. | B977: EAST | C977: CONSUMER | D977: FURNITURE | E977: BED | F977: 2 | G977: Apr | H977: 1993 | I977: 87.00 | J977: 374.00 | K977: 287
A978: U.S.A. | B978: EAST | C978: CONSUMER | D978: FURNITURE | E978: BED | F978: 2 | G978: May | H978: 1993 | I978: 384.00 | J978: 926.00 | K978: 542
A979: U.S.A. | B979: EAST | C979: CONSUMER | D979: FURNITURE | E979: BED | F979: 2 | G979: Jun | H979: 1993 | I979: 574.00 | J979: 687.00 | K979: 113
A980: U.S.A. | B980: EAST | C980: CONSUMER | D980: FURNITURE | E980: BED | F980: 3 | G980: Jul | H980: 1993 | I980: 585.00 | J980: 600.00 | K980: 15
A981: U.S.A. | B981: EAST | C981: CONSUMER | D981: FURNITURE | E981: BED | F981: 3 | G981: Aug | H981: 1993 | I981: 947.00 | J981: 779.00 | K981: -168
A982: U.S.A. | B982: EAST | C982: CONSUMER | D982: FURNITURE | E982: BED | F982: 3 | G982: Sep | H982: 1993 | I982: 984.00 | J982: 223.00 | K982: -761
A983: U.S.A. | B983: EAST | C983: CONSUMER | D983: FURNITURE | E983: BED | F983: 4 | G983: Oct | H983: 1993 | I983: 189.00 | J983: 628.00 | K983: 439
A984: U.S.A. | B984: EAST | C984: CONSUMER | D984: FURNITURE | E984: BED | F984: 4 | G984: Nov | H984: 1993 | I984: 364.00 | J984: 326.00 | K984: -38
A985: U.S.A. | B985: EAST | C985: CONSUMER | D985: FURNITURE | E985: BED | F985: 4 | G985: Dec | H985: 1993 | I985: 49.00 | J985: 836.00 | K985: 787
A986: U.S.A. | B986: EAST | C986: CONSUMER | D986: OFFICE | E986: TABLE | F986: 1 | G986: Jan | H986: 1993 | I986: 649.00 | J986: 805.00 | K986: 156
A987: U.S.A. | B987: EAST | C987: CONSUMER | D987: OFFICE | E987: TABLE | F987: 1 | G987: Feb | H987: 1993 | I987: 838.00 | J987: 860.00 | K987: 22
A988: U.S.A. | B988: EAST | C988: CONSUMER | D988: OFFICE | E988: TABLE | F988: 1 | G988: Mar | H988: 1993 | I988: 439.00 | J988: 104.00 | K988: -335
A989: U.S.A. | B989: EAST | C989: CONSUMER | D989: OFFICE | E989: TABLE | F989: 2 | G989: Apr | H989: 1993 | I989: 207.00 | J989: 434.00 | K989: 227
A990: U.S.A. | B990: EAST | C990: CONSUMER | D990: OFFICE | E990: TABLE | F990: 2 | G990: May | H990: 1993 | I990: 804.00 | J990: 912.00 | K990: 108
A991: U.S.A. | B991: EAST | C991: CONSUMER | D991: OFFICE | E991: TABLE | F991: 2 | G991: Jun | H991: 1993 | I991: 875.00 | J991: 571.00 | K991: -304
A992: U.S.A. | B992: EAST | C992: CONSUMER | D992: OFFICE | E992: TABLE | F992: 3 | G992: Jul | H992: 1993 | I992: 473.00 | J992: 267.00 | K992: -206
A993: U.S.A. | B993: EAST | C993: CONSUMER | D993: OFFICE | E993: TABLE | F993: 3 | G993: Aug | H993: 1993 | I993: 845.00 | J993: 415.00 | K993: -430
A994: U.S.A. | B994: EAST | C994: CONSUMER | D994: OFFICE | E994: TABLE | F994: 3 | G994: Sep | H994: 1993 | I994: 91.00 | J994: 261.00 | K994: 170
A995: U.S.A. | B995: EAST | C995: CONSUMER | D995: OFFICE | E995: TABLE | F995: 4 | G995: Oct | H995: 1993 | I995: 630.00 | J995: 746.00 | K995: 116
A996: U.S.A. | B996: EAST | C996: CONSUMER | D996: OFFICE | E996: TABLE | F996: 4 | G996: Nov | H996: 1993 | I996: 185.00 | J996: 30.00 | K996: -155
A997: U.S.A. | B997: EAST | C997: CONSUMER | D997: OFFICE | E997: TABLE | F997: 4 | G997: Dec | H997: 1993 | I997: 317.00 | J997: 662.00 | K997: 345
A998: U.S.A. | B998: EAST | C998: CONSUMER | D998: OFFICE | E998: CHAIR | F998: 1 | G998: Jan | H998: 1993 | I998: 789.00 | J998: 816.00 | K998: 27
A999: U.S.A. | B999: EAST | C999: CONSUMER | D999: OFFICE | E999: CHAIR | F999: 1 | G999: Feb | H999: 1993 | I999: 988.00 | J999: 437.00 | K999: -551
A1000: U.S.A. | B1000: EAST | C1000: CONSUMER | D1000: OFFICE | E1000: CHAIR | F1000: 1 | G1000: Mar | H1000: 1993 | I1000: 220.00 | J1000: 715.00 | K1000: 495
A1001: U.S.A. | B1001: EAST | C1001: CONSUMER | D1001: OFFICE | E1001: CHAIR | F1001: 2 | G1001: Apr | H1001: 1993 | I1001: 946.00 | J1001: 780.00 | K1001: -166
A1002: U.S.A. | B1002: EAST | C1002: CONSUMER | D1002: OFFICE | E1002: CHAIR | F1002: 2 | G1002: May | H1002: 1993 | I1002: 986.00 | J1002: 245.00 | K1002: -741
A1003: U.S.A. | B1003: EAST | C1003: CONSUMER | D1003: OFFICE | E1003: CHAIR | F1003: 2 | G1003: Jun | H1003: 1993 | I1003: 129.00 | J1003: 201.00 | K1003: 72
A1004: U.S.A. | B1004: EAST | C1004: CONSUMER | D1004: OFFICE | E1004: CHAIR | F1004: 3 | G1004: Jul | H1004: 1993 | I1004: 433.00 | J1004: 815.00 | K1004: 382
A1005: U.S.A. | B1005: EAST | C1005: CONSUMER | D1005: OFFICE | E1005: CHAIR | F1005: 3 | G1005: Aug | H1005: 1993 | I1005: 492.00 | J1005: 865.00 | K1005: 373
A1006: U.S.A. | B1006: EAST | C1006: CONSUMER | D1006: OFFICE | E1006: CHAIR | F1006: 3 | G1006: Sep | H1006: 1993 | I1006: 306.00 | J1006: 634.00 | K1006: 328
A1007: U.S.A. | B1007: EAST | C1007: CONSUMER | D1007: OFFICE | E1007: CHAIR | F1007: 4 | G1007: Oct | H1007: 1993 | I1007: 154.00 | J1007: 901.00 | K1007: 747
A1008: U.S.A. | B1008: EAST | C1008: CONSUMER | D1008: OFFICE | E1008: CHAIR | F1008: 4 | G1008: Nov | H1008: 1993 | I1008: 206.00 | J1008: 789.00 | K1008: 583
A1009: U.S.A. | B1009: EAST | C1009: CONSUMER | D1009: OFFICE | E1009: CHAIR | F1009: 4 | G1009: Dec | H1009: 1993 | I1009: 81.00 | J1009: 882.00 | K1009: 801
A1010: U.S.A. | B1010: EAST | C1010: CONSUMER | D1010: OFFICE | E1010: DESK | F1010: 1 | G1010: Jan | H1010: 1993 | I1010: 619.00 | J1010: 384.00 | K1010: -235
A1011: U.S.A. | B1011: EAST | C1011: CONSUMER | D1011: OFFICE | E1011: DESK | F1011: 1 | G1011: Feb | H1011: 1993 | I1011: 332.00 | J1011: 161.00 | K1011: -171
A1012: U.S.A. | B1012: EAST | C1012: CONSUMER | D1012: OFFICE | E1012: DESK | F1012: 1 | G1012: Mar | H1012: 1993 | I1012: 669.00 | J1012: 977.00 | K1012: 308
A1013: U.S.A. | B1013: EAST | C1013: CONSUMER | D1013: OFFICE | E1013: DESK | F1013: 2 | G1013: Apr | H1013: 1993 | I1013: 487.00 | J1013: 615.00 | K1013: 128
A1014: U.S.A. | B1014: EAST | C1014: CONSUMER | D1014: OFFICE | E1014: DESK | F1014: 2 | G1014: May | H1014: 1993 | I1014: 994.00 | J1014: 783.00 | K1014: -211
A1015: U.S.A. | B1015: EAST | C1015: CONSUMER | D1015: OFFICE | E1015: DESK | F1015: 2 | G1015: Jun | H1015: 1993 | I1015: 331.00 | J1015: 977.00 | K1015: 646
A1016: U.S.A. | B1016: EAST | C1016: CONSUMER | D1016: OFFICE | E1016: DESK | F1016: 3 | G1016: Jul | H1016: 1993 | I1016: 739.00 | J1016: 375.00 | K1016: -364
A1017: U.S.A. | B1017: EAST | C1017: CONSUMER | D1017: OFFICE | E1017: DESK | F1017: 3 | G1017: Aug | H1017: 1993 | I1017: 665.00 | J1017: 298.00 | K1017: -367
A1018: U.S.A. | B1018: EAST | C1018: CONSUMER | D1018: OFFICE | E1018: DESK | F1018: 3 | G1018: Sep | H1018: 1993 | I1018: 921.00 | J1018: 104.00 | K1018: -817
A1019: U.S.A. | B1019: EAST | C1019: CONSUMER | D1019: OFFICE | E1019: DESK | F1019: 4 | G1019: Oct | H1019: 1993 | I1019: 862.00 | J1019: 713.00 | K1019: -149
A1020: U.S.A. | B1020: EAST | C1020: CONSUMER | D1020: OFFICE | E1020: DESK | F1020: 4 | G1020: Nov | H1020: 1993 | I1020: 662.00 | J1020: 556.00 | K1020: -106
A1021: U.S.A. | B1021: EAST | C1021: CONSUMER | D1021: OFFICE | E1021: DESK | F1021: 4 | G1021: Dec | H1021: 1993 | I1021: 517.00 | J1021: 323.00 | K1021: -194
A1022: U.S.A. | B1022: EAST | C1022: CONSUMER | D1022: FURNITURE | E1022: SOFA | F1022: 1 | G1022: Jan | H1022: 1994 | I1022: 1000.00 | J1022: 129.00 | K1022: -871
A1023: U.S.A. | B1023: EAST | C1023: CONSUMER | D1023: FURNITURE | E1023: SOFA | F1023: 1 | G1023: Feb | H1023: 1994 | I1023: 945.00 | J1023: 76.00 | K1023: -869
A1024: U.S.A. | B1024: EAST | C1024: CONSUMER | D1024: FURNITURE | E1024: SOFA | F1024: 1 | G1024: Mar | H1024: 1994 | I1024: 931.00 | J1024: 260.00 | K1024: -671
A1025: U.S.A. | B1025: EAST | C1025: CONSUMER | D1025: FURNITURE | E1025: SOFA | F1025: 2 | G1025: Apr | H1025: 1994 | I1025: 504.00 | J1025: 882.00 | K1025: 378
A1026: U.S.A. | B1026: EAST | C1026: CONSUMER | D1026: FURNITURE | E1026: SOFA | F1026: 2 | G1026: May | H1026: 1994 | I1026: 950.00 | J1026: 157.00 | K1026: -793
A1027: U.S.A. | B1027: EAST | C1027: CONSUMER | D1027: FURNITURE | E1027: SOFA | F1027: 2 | G1027: Jun | H1027: 1994 | I1027: 278.00 | J1027: 443.00 | K1027: 165
A1028: U.S.A. | B1028: EAST | C1028: CONSUMER | D1028: FURNITURE | E1028: SOFA | F1028: 3 | G1028: Jul | H1028: 1994 | I1028: 225.00 | J1028: 111.00 | K1028: -114
A1029: U.S.A. | B1029: EAST | C1029: CONSUMER | D1029: FURNITURE | E1029: SOFA | F1029: 3 | G1029: Aug | H1029: 1994 | I1029: 6.00 | J1029: 497.00 | K1029: 491
A1030: U.S.A. | B1030: EAST | C1030: CONSUMER | D1030: FURNITURE | E1030: SOFA | F1030: 3 | G1030: Sep | H1030: 1994 | I1030: 124.00 | J1030: 321.00 | K1030: 197
A1031: U.S.A. | B1031: EAST | C1031: CONSUMER | D1031: FURNITURE | E1031: SOFA | F1031: 4 | G1031: Oct | H1031: 1994 | I1031: 206.00 | J1031: 194.00 | K1031: -12
A1032: U.S.A. | B1032: EAST | C1032: CONSUMER | D1032: FURNITURE | E1032: SOFA | F1032: 4 | G1032: Nov | H1032: 1994 | I1032: 320.00 | J1032: 684.00 | K1032: 364
A1033: U.S.A. | B1033: EAST | C1033: CONSUMER | D1033: FURNITURE | E1033: SOFA | F1033: 4 | G1033: Dec | H1033: 1994 | I1033: 270.00 | J1033: 634.00 | K1033: 364
A1034: U.S.A. | B1034: EAST | C1034: CONSUMER | D1034: FURNITURE | E1034: BED | F1034: 1 | G1034: Jan | H1034: 1994 | I1034: 851.00 | J1034: 361.00 | K1034: -490
A1035: U.S.A. | B1035: EAST | C1035: CONSUMER | D1035: FURNITURE | E1035: BED | F1035: 1 | G1035: Feb | H1035: 1994 | I1035: 643.00 | J1035: 444.00 | K1035: -199
A1036: U.S.A. | B1036: EAST | C1036: CONSUMER | D1036: FURNITURE | E1036: BED | F1036: 1 | G1036: Mar | H1036: 1994 | I1036: 143.00 | J1036: 501.00 | K1036: 358
A1037: U.S.A. | B1037: EAST | C1037: CONSUMER | D1037: FURNITURE | E1037: BED | F1037: 2 | G1037: Apr | H1037: 1994 | I1037: 763.00 | J1037: 743.00 | K1037: -20
A1038: U.S.A. | B1038: EAST | C1038: CONSUMER | D1038: FURNITURE | E1038: BED | F1038: 2 | G1038: May | H1038: 1994 | I1038: 987.00 | J1038: 861.00 | K1038: -126
A1039: U.S.A. | B1039: EAST | C1039: CONSUMER | D1039: FURNITURE | E1039: BED | F1039: 2 | G1039: Jun | H1039: 1994 | I1039: 264.00 | J1039: 203.00 | K1039: -61
A1040: U.S.A. | B1040: EAST | C1040: CONSUMER | D1040: FURNITURE | E1040: BED | F1040: 3 | G1040: Jul | H1040: 1994 | I1040: 439.00 | J1040: 762.00 | K1040: 323
A1041: U.S.A. | B1041: EAST | C1041: CONSUMER | D1041: FURNITURE | E1041: BED | F1041: 3 | G1041: Aug | H1041: 1994 | I1041: 750.00 | J1041: 705.00 | K1041: -45
A1042: U.S.A. | B1042: EAST | C1042: CONSUMER | D1042: FURNITURE | E1042: BED | F1042: 3 | G1042: Sep | H1042: 1994 | I1042: 37.00 | J1042: 153.00 | K1042: 116
A1043: U.S.A. | B1043: EAST | C1043: CONSUMER | D1043: FURNITURE | E1043: BED | F1043: 4 | G1043: Oct | H1043: 1994 | I1043: 95.00 | J1043: 436.00 | K1043: 341
A1044: U.S.A. | B1044: EAST | C1044: CONSUMER | D1044: FURNITURE | E1044: BED | F1044: 4 | G1044: Nov | H1044: 1994 | I1044: 79.00 | J1044: 428.00 | K1044: 349
A1045: U.S.A. | B1045: EAST | C1045: CONSUMER | D1045: FURNITURE | E1045: BED | F1045: 4 | G1045: Dec | H1045: 1994 | I1045: 832.00 | J1045: 804.00 | K1045: -28
A1046: U.S.A. | B1046: EAST | C1046: CONSUMER | D1046: OFFICE | E1046: TABLE | F1046: 1 | G1046: Jan | H1046: 1994 | I1046: 88.00 | J1046: 916.00 | K1046: 828
A1047: U.S.A. | B1047: EAST | C1047: CONSUMER | D1047: OFFICE | E1047: TABLE | F1047: 1 | G1047: Feb | H1047: 1994 | I1047: 607.00 | J1047: 415.00 | K1047: -192
A1048: U.S.A. | B1048: EAST | C1048: CONSUMER | D1048: OFFICE | E1048: TABLE | F1048: 1 | G1048: Mar | H1048: 1994 | I1048: 35.00 | J1048: 514.00 | K1048: 479
A1049: U.S.A. | B1049: EAST | C1049: CONSUMER | D1049: OFFICE | E1049: TABLE | F1049: 2 | G1049: Apr | H1049: 1994 | I1049: 680.00 | J1049: 756.00 | K1049: 76
A1050: U.S.A. | B1050: EAST | C1050: CONSUMER | D1050: OFFICE | E1050: TABLE | F1050: 2 | G1050: May | H1050: 1994 | I1050: 78.00 | J1050: 461.00 | K1050: 383
A1051: U.S.A. | B1051: EAST | C1051: CONSUMER | D1051: OFFICE | E1051: TABLE | F1051: 2 | G1051: Jun | H1051: 1994 | I1051: 117.00 | J1051: 460.00 | K1051: 343
A1052: U.S.A. | B1052: EAST | C1052: CONSUMER | D1052: OFFICE | E1052: TABLE | F1052: 3 | G1052: Jul | H1052: 1994 | I1052: 440.00 | J1052: 305.00 | K1052: -135
A1053: U.S.A. | B1053: EAST | C1053: CONSUMER | D1053: OFFICE | E1053: TABLE | F1053: 3 | G1053: Aug | H1053: 1994 | I1053: 652.00 | J1053: 198.00 | K1053: -454
A1054: U.S.A. | B1054: EAST | C1054: CONSUMER | D1054: OFFICE | E1054: TABLE | F1054: 3 | G1054: Sep | H1054: 1994 | I1054: 249.00 | J1054: 234.00 | K1054: -15
A1055: U.S.A. | B1055: EAST | C1055: CONSUMER | D1055: OFFICE | E1055: TABLE | F1055: 4 | G1055: Oct | H1055: 1994 | I1055: 658.00 | J1055: 638.00 | K1055: -20
A1056: U.S.A. | B1056: EAST | C1056: CONSUMER | D1056: OFFICE | E1056: TABLE | F1056: 4 | G1056: Nov | H1056: 1994 | I1056: 563.00 | J1056: 88.00 | K1056: -475
A1057: U.S.A. | B1057: EAST | C1057: CONSUMER | D1057: OFFICE | E1057: TABLE | F1057: 4 | G1057: Dec | H1057: 1994 | I1057: 737.00 | J1057: 751.00 | K1057: 14
A1058: U.S.A. | B1058: EAST | C1058: CONSUMER | D1058: OFFICE | E1058: CHAIR | F1058: 1 | G1058: Jan | H1058: 1994 | I1058: 882.00 | J1058: 953.00 | K1058: 71
A1059: U.S.A. | B1059: EAST | C1059: CONSUMER | D1059: OFFICE | E1059: CHAIR | F1059: 1 | G1059: Feb | H1059: 1994 | I1059: 848.00 | J1059: 862.00 | K1059: 14
A1060: U.S.A. | B1060: EAST | C1060: CONSUMER | D1060: OFFICE | E1060: CHAIR | F1060: 1 | G1060: Mar | H1060: 1994 | I1060: 664.00 | J1060: 628.00 | K1060: -36
A1061: U.S.A. | B1061: EAST | C1061: CONSUMER | D1061: OFFICE | E1061: CHAIR | F1061: 2 | G1061: Apr | H1061: 1994 | I1061: 389.00 | J1061: 765.00 | K1061: 376
A1062: U.S.A. | B1062: EAST | C1062: CONSUMER | D1062: OFFICE | E1062: CHAIR | F1062: 2 | G1062: May | H1062: 1994 | I1062: 182.00 | J1062: 741.00 | K1062: 559
A1063: U.S.A. | B1063: EAST | C1063: CONSUMER | D1063: OFFICE | E1063: CHAIR | F1063: 2 | G1063: Jun | H1063: 1994 | I1063: 505.00 | J1063: 61.00 | K1063: -444
A1064: U.S.A. | B1064: EAST | C1064: CONSUMER | D1064: OFFICE | E1064: CHAIR | F1064: 3 | G1064: Jul | H1064: 1994 | I1064: 861.00 | J1064: 470.00 | K1064: -391
A1065: U.S.A. | B1065: EAST | C1065: CONSUMER | D1065: OFFICE | E1065: CHAIR | F1065: 3 | G1065: Aug | H1065: 1994 | I1065: 263.00 | J1065: 869.00 | K1065: 606
A1066: U.S.A. | B1066: EAST | C1066: CONSUMER | D1066: OFFICE | E1066: CHAIR | F1066: 3 | G1066: Sep | H1066: 1994 | I1066: 400.00 | J1066: 650.00 | K1066: 250
A1067: U.S.A. | B1067: EAST | C1067: CONSUMER | D1067: OFFICE | E1067: CHAIR | F1067: 4 | G1067: Oct | H1067: 1994 | I1067: 556.00 | J1067: 750.00 | K1067: 194
A1068: U.S.A. | B1068: EAST | C1068: CONSUMER | D1068: OFFICE | E1068: CHAIR | F1068: 4 | G1068: Nov | H1068: 1994 | I1068: 497.00 | J1068: 602.00 | K1068: 105
A1069: U.S.A. | B1069: EAST | C1069: CONSUMER | D1069: OFFICE | E1069: CHAIR | F1069: 4 | G1069: Dec | H1069: 1994 | I1069: 181.00 | J1069: 54.00 | K1069: -127
A1070: U.S.A. | B1070: EAST | C1070: CONSUMER | D1070: OFFICE | E1070: DESK | F1070: 1 | G1070: Jan | H1070: 1994 | I1070: 352.00 | J1070: 391.00 | K1070: 39
A1071: U.S.A. | B1071: EAST | C1071: CONSUMER | D1071: OFFICE | E1071: DESK | F1071: 1 | G1071: Feb | H1071: 1994 | I1071: 166.00 | J1071: 593.00 | K1071: 427
A1072: U.S.A. | B1072: EAST | C1072: CONSUMER | D1072: OFFICE | E1072: DESK | F1072: 1 | G1072: Mar | H1072: 1994 | I1072: 859.00 | J1072: 906.00 | K1072: 47
A1073: U.S.A. | B1073: EAST | C1073: CONSUMER | D1073: OFFICE | E1073: DESK | F1073: 2 | G1073: Apr | H1073: 1994 | I1073: 571.00 | J1073: 130.00 | K1073: -441
A1074: U.S.A. | B1074: EAST | C1074: CONSUMER | D1074: OFFICE | E1074: DESK | F1074: 2 | G1074: May | H1074: 1994 | I1074: 976.00 | J1074: 613.00 | K1074: -363
A1075: U.S.A. | B1075: EAST | C1075: CONSUMER | D1075: OFFICE | E1075: DESK | F1075: 2 | G1075: Jun | H1075: 1994 | I1075: 466.00 | J1075: 58.00 | K1075: -408
A1076: U.S.A. | B1076: EAST | C1076: CONSUMER | D1076: OFFICE | E1076: DESK | F1076: 3 | G1076: Jul | H1076: 1994 | I1076: 79.00 | J1076: 314.00 | K1076: 235
A1077: U.S.A. | B1077: EAST | C1077: CONSUMER | D1077: OFFICE | E1077: DESK | F1077: 3 | G1077: Aug | H1077: 1994 | I1077: 864.00 | J1077: 67.00 | K1077: -797
A1078: U.S.A. | B1078: EAST | C1078: CONSUMER | D1078: OFFICE | E1078: DESK | F1078: 3 | G1078: Sep | H1078: 1994 | I1078: 623.00 | J1078: 654.00 | K1078: 31
A1079: U.S.A. | B1079: EAST | C1079: CONSUMER | D1079: OFFICE | E1079: DESK | F1079: 4 | G1079: Oct | H1079: 1994 | I1079: 170.00 | J1079: 312.00 | K1079: 142
A1080: U.S.A. | B1080: EAST | C1080: CONSUMER | D1080: OFFICE | E1080: DESK | F1080: 4 | G1080: Nov | H1080: 1994 | I1080: 662.00 | J1080: 349.00 | K1080: -313
A1081: U.S.A. | B1081: EAST | C1081: CONSUMER | D1081: OFFICE | E1081: DESK | F1081: 4 | G1081: Dec | H1081: 1994 | I1081: 763.00 | J1081: 415.00 | K1081: -348
A1082: U.S.A. | B1082: EAST | C1082: EDUCATION | D1082: FURNITURE | E1082: SOFA | F1082: 1 | G1082: Jan | H1082: 1993 | I1082: 975.00 | J1082: 4.00 | K1082: -971
A1083: U.S.A. | B1083: EAST | C1083: EDUCATION | D1083: FURNITURE | E1083: SOFA | F1083: 1 | G1083: Feb | H1083: 1993 | I1083: 455.00 | J1083: 813.00 | K1083: 358
A1084: U.S.A. | B1084: EAST | C1084: EDUCATION | D1084: FURNITURE | E1084: SOFA | F1084: 1 | G1084: Mar | H1084: 1993 | I1084: 260.00 | J1084: 773.00 | K1084: 513
A1085: U.S.A. | B1085: EAST | C1085: EDUCATION | D1085: FURNITURE | E1085: SOFA | F1085: 2 | G1085: Apr | H1085: 1993 | I1085: 69.00 | J1085: 205.00 | K1085: 136
A1086: U.S.A. | B1086: EAST | C1086: EDUCATION | D1086: FURNITURE | E1086: SOFA | F1086: 2 | G1086: May | H1086: 1993 | I1086: 147.00 | J1086: 657.00 | K1086: 510
A1087: U.S.A. | B1087: EAST | C1087: EDUCATION | D1087: FURNITURE | E1087: SOFA | F1087: 2 | G1087: Jun | H1087: 1993 | I1087: 533.00 | J1087: 154.00 | K1087: -379
A1088: U.S.A. | B1088: EAST | C1088: EDUCATION | D1088: FURNITURE | E1088: SOFA | F1088: 3 | G1088: Jul | H1088: 1993 | I1088: 881.00 | J1088: 747.00 | K1088: -134
A1089: U.S.A. | B1089: EAST | C1089: EDUCATION | D1089: FURNITURE | E1089: SOFA | F1089: 3 | G1089: Aug | H1089: 1993 | I1089: 457.00 | J1089: 787.00 | K1089: 330
A1090: U.S.A. | B1090: EAST | C1090: EDUCATION | D1090: FURNITURE | E1090: SOFA | F1090: 3 | G1090: Sep | H1090: 1993 | I1090: 441.00 | J1090: 867.00 | K1090: 426
A1091: U.S.A. | B1091: EAST | C1091: EDUCATION | D1091: FURNITURE | E1091: SOFA | F1091: 4 | G1091: Oct | H1091: 1993 | I1091: 859.00 | J1091: 307.00 | K1091: -552
A1092: U.S.A. | B1092: EAST | C1092: EDUCATION | D1092: FURNITURE | E1092: SOFA | F1092: 4 | G1092: Nov | H1092: 1993 | I1092: 177.00 | J1092: 571.00 | K1092: 394
A1093: U.S.A. | B1093: EAST | C1093: EDUCATION | D1093: FURNITURE | E1093: SOFA | F1093: 4 | G1093: Dec | H1093: 1993 | I1093: 633.00 | J1093: 92.00 | K1093: -541
A1094: U.S.A. | B1094: EAST | C1094: EDUCATION | D1094: FURNITURE | E1094: BED | F1094: 1 | G1094: Jan | H1094: 1993 | I1094: 378.00 | J1094: 129.00 | K1094: -249
A1095: U.S.A. | B1095: EAST | C1095: EDUCATION | D1095: FURNITURE | E1095: BED | F1095: 1 | G1095: Feb | H1095: 1993 | I1095: 569.00 | J1095: 187.00 | K1095: -382
A1096: U.S.A. | B1096: EAST | C1096: EDUCATION | D1096: FURNITURE | E1096: BED | F1096: 1 | G1096: Mar | H1096: 1993 | I1096: 186.00 | J1096: 670.00 | K1096: 484
A1097: U.S.A. | B1097: EAST | C1097: EDUCATION | D1097: FURNITURE | E1097: BED | F1097: 2 | G1097: Apr | H1097: 1993 | I1097: 875.00 | J1097: 678.00 | K1097: -197
A1098: U.S.A. | B1098: EAST | C1098: EDUCATION | D1098: FURNITURE | E1098: BED | F1098: 2 | G1098: May | H1098: 1993 | I1098: 636.00 | J1098: 423.00 | K1098: -213
A1099: U.S.A. | B1099: EAST | C1099: EDUCATION | D1099: FURNITURE | E1099: BED | F1099: 2 | G1099: Jun | H1099: 1993 | I1099: 360.00 | J1099: 389.00 | K1099: 29
A1100: U.S.A. | B1100: EAST | C1100: EDUCATION | D1100: FURNITURE | E1100: BED | F1100: 3 | G1100: Jul | H1100: 1993 | I1100: 677.00 | J1100: 257.00 | K1100: -420
A1101: U.S.A. | B1101: EAST | C1101: EDUCATION | D1101: FURNITURE | E1101: BED | F1101: 3 | G1101: Aug | H1101: 1993 | I1101: 708.00 | J1101: 780.00 | K1101: 72
A1102: U.S.A. | B1102: EAST | C1102: EDUCATION | D1102: FURNITURE | E1102: BED | F1102: 3 | G1102: Sep | H1102: 1993 | I1102: 158.00 | J1102: 159.00 | K1102: 1
A1103: U.S.A. | B1103: EAST | C1103: EDUCATION | D1103: FURNITURE | E1103: BED | F1103: 4 | G1103: Oct | H1103: 1993 | I1103: 384.00 | J1103: 97.00 | K1103: -287
A1104: U.S.A. | B1104: EAST | C1104: EDUCATION | D1104: FURNITURE | E1104: BED | F1104: 4 | G1104: Nov | H1104: 1993 | I1104: 927.00 | J1104: 479.00 | K1104: -448
A1105: U.S.A. | B1105: EAST | C1105: EDUCATION | D1105: FURNITURE | E1105: BED | F1105: 4 | G1105: Dec | H1105: 1993 | I1105: 134.00 | J1105: 9.00 | K1105: -125
A1106: U.S.A. | B1106: EAST | C1106: EDUCATION | D1106: OFFICE | E1106: TABLE | F1106: 1 | G1106: Jan | H1106: 1993 | I1106: 579.00 | J1106: 956.00 | K1106: 377
A1107: U.S.A. | B1107: EAST | C1107: EDUCATION | D1107: OFFICE | E1107: TABLE | F1107: 1 | G1107: Feb | H1107: 1993 | I1107: 131.00 | J1107: 276.00 | K1107: 145
A1108: U.S.A. | B1108: EAST | C1108: EDUCATION | D1108: OFFICE | E1108: TABLE | F1108: 1 | G1108: Mar | H1108: 1993 | I1108: 689.00 | J1108: 889.00 | K1108: 200
A1109: U.S.A. | B1109: EAST | C1109: EDUCATION | D1109: OFFICE | E1109: TABLE | F1109: 2 | G1109: Apr | H1109: 1993 | I1109: 908.00 | J1109: 708.00 | K1109: -200
A1110: U.S.A. | B1110: EAST | C1110: EDUCATION | D1110: OFFICE | E1110: TABLE | F1110: 2 | G1110: May | H1110: 1993 | I1110: 524.00 | J1110: 14.00 | K1110: -510
A1111: U.S.A. | B1111: EAST | C1111: EDUCATION | D1111: OFFICE | E1111: TABLE | F1111: 2 | G1111: Jun | H1111: 1993 | I1111: 336.00 | J1111: 904.00 | K1111: 568
A1112: U.S.A. | B1112: EAST | C1112: EDUCATION | D1112: OFFICE | E1112: TABLE | F1112: 3 | G1112: Jul | H1112: 1993 | I1112: 916.00 | J1112: 272.00 | K1112: -644
A1113: U.S.A. | B1113: EAST | C1113: EDUCATION | D1113: OFFICE | E1113: TABLE | F1113: 3 | G1113: Aug | H1113: 1993 | I1113: 236.00 | J1113: 257.00 | K1113: 21
A1114: U.S.A. | B1114: EAST | C1114: EDUCATION | D1114: OFFICE | E1114: TABLE | F1114: 3 | G1114: Sep | H1114: 1993 | I1114: 965.00 | J1114: 343.00 | K1114: -622
A1115: U.S.A. | B1115: EAST | C1115: EDUCATION | D1115: OFFICE | E1115: TABLE | F1115: 4 | G1115: Oct | H1115: 1993 | I1115: 350.00 | J1115: 80.00 | K1115: -270
A1116: U.S.A. | B1116: EAST | C1116: EDUCATION | D1116: OFFICE | E1116: TABLE | F1116: 4 | G1116: Nov | H1116: 1993 | I1116: 599.00 | J1116: 530.00 | K1116: -69
A1117: U.S.A. | B1117: EAST | C1117: EDUCATION | D1117: OFFICE | E1117: TABLE | F1117: 4 | G1117: Dec | H1117: 1993 | I1117: 901.00 | J1117: 340.00 | K1117: -561
A1118: U.S.A. | B1118: EAST | C1118: EDUCATION | D1118: OFFICE | E1118: CHAIR | F1118: 1 | G1118: Jan | H1118: 1993 | I1118: 524.00 | J1118: 229.00 | K1118: -295
A1119: U.S.A. | B1119: EAST | C1119: EDUCATION | D1119: OFFICE | E1119: CHAIR | F1119: 1 | G1119: Feb | H1119: 1993 | I1119: 902.00 | J1119: 786.00 | K1119: -116
A1120: U.S.A. | B1120: EAST | C1120: EDUCATION | D1120: OFFICE | E1120: CHAIR | F1120: 1 | G1120: Mar | H1120: 1993 | I1120: 212.00 | J1120: 92.00 | K1120: -120
A1121: U.S.A. | B1121: EAST | C1121: EDUCATION | D1121: OFFICE | E1121: CHAIR | F1121: 2 | G1121: Apr | H1121: 1993 | I1121: 762.00 | J1121: 455.00 | K1121: -307
A1122: U.S.A. | B1122: EAST | C1122: EDUCATION | D1122: OFFICE | E1122: CHAIR | F1122: 2 | G1122: May | H1122: 1993 | I1122: 182.00 | J1122: 409.00 | K1122: 227
A1123: U.S.A. | B1123: EAST | C1123: EDUCATION | D1123: OFFICE | E1123: CHAIR | F1123: 2 | G1123: Jun | H1123: 1993 | I1123: 442.00 | J1123: 166.00 | K1123: -276
A1124: U.S.A. | B1124: EAST | C1124: EDUCATION | D1124: OFFICE | E1124: CHAIR | F1124: 3 | G1124: Jul | H1124: 1993 | I1124: 919.00 | J1124: 277.00 | K1124: -642
A1125: U.S.A. | B1125: EAST | C1125: EDUCATION | D1125: OFFICE | E1125: CHAIR | F1125: 3 | G1125: Aug | H1125: 1993 | I1125: 67.00 | J1125: 92.00 | K1125: 25
A1126: U.S.A. | B1126: EAST | C1126: EDUCATION | D1126: OFFICE | E1126: CHAIR | F1126: 3 | G1126: Sep | H1126: 1993 | I1126: 741.00 | J1126: 631.00 | K1126: -110
A1127: U.S.A. | B1127: EAST | C1127: EDUCATION | D1127: OFFICE | E1127: CHAIR | F1127: 4 | G1127: Oct | H1127: 1993 | I1127: 617.00 | J1127: 390.00 | K1127: -227
A1128: U.S.A. | B1128: EAST | C1128: EDUCATION | D1128: OFFICE | E1128: CHAIR | F1128: 4 | G1128: Nov | H1128: 1993 | I1128: 214.00 | J1128: 403.00 | K1128: 189
A1129: U.S.A. | B1129: EAST | C1129: EDUCATION | D1129: OFFICE | E1129: CHAIR | F1129: 4 | G1129: Dec | H1129: 1993 | I1129: 202.00 | J1129: 964.00 | K1129: 762
A1130: U.S.A. | B1130: EAST | C1130: EDUCATION | D1130: OFFICE | E1130: DESK | F1130: 1 | G1130: Jan | H1130: 1993 | I1130: 975.00 | J1130: 794.00 | K1130: -181
A1131: U.S.A. | B1131: EAST | C1131: EDUCATION | D1131: OFFICE | E1131: DESK | F1131: 1 | G1131: Feb | H1131: 1993 | I1131: 820.00 | J1131: 892.00 | K1131: 72
A1132: U.S.A. | B1132: EAST | C1132: EDUCATION | D1132: OFFICE | E1132: DESK | F1132: 1 | G1132: Mar | H1132: 1993 | I1132: 123.00 | J1132: 728.00 | K1132: 605
A1133: U.S.A. | B1133: EAST | C1133: EDUCATION | D1133: OFFICE | E1133: DESK | F1133: 2 | G1133: Apr | H1133: 1993 | I1133: 135.00 | J1133: 744.00 | K1133: 609
A1134: U.S.A. | B1134: EAST | C1134: EDUCATION | D1134: OFFICE | E1134: DESK | F1134: 2 | G1134: May | H1134: 1993 | I1134: 535.00 | J1134: 678.00 | K1134: 143
A1135: U.S.A. | B1135: EAST | C1135: EDUCATION | D1135: OFFICE | E1135: DESK | F1135: 2 | G1135: Jun | H1135: 1993 | I1135: 971.00 | J1135: 768.00 | K1135: -203
A1136: U.S.A. | B1136: EAST | C1136: EDUCATION | D1136: OFFICE | E1136: DESK | F1136: 3 | G1136: Jul | H1136: 1993 | I1136: 166.00 | J1136: 234.00 | K1136: 68
A1137: U.S.A. | B1137: EAST | C1137: EDUCATION | D1137: OFFICE | E1137: DESK | F1137: 3 | G1137: Aug | H1137: 1993 | I1137: 814.00 | J1137: 333.00 | K1137: -481
A1138: U.S.A. | B1138: EAST | C1138: EDUCATION | D1138: OFFICE | E1138: DESK | F1138: 3 | G1138: Sep | H1138: 1993 | I1138: 557.00 | J1138: 968.00 | K1138: 411
A1139: U.S.A. | B1139: EAST | C1139: EDUCATION | D1139: OFFICE | E1139: DESK | F1139: 4 | G1139: Oct | H1139: 1993 | I1139: 820.00 | J1139: 119.00 | K1139: -701
A1140: U.S.A. | B1140: EAST | C1140: EDUCATION | D1140: OFFICE | E1140: DESK | F1140: 4 | G1140: Nov | H1140: 1993 | I1140: 486.00 | J1140: 469.00 | K1140: -17
A1141: U.S.A. | B1141: EAST | C1141: EDUCATION | D1141: OFFICE | E1141: DESK | F1141: 4 | G1141: Dec | H1141: 1993 | I1141: 429.00 | J1141: 261.00 | K1141: -168
A1142: U.S.A. | B1142: EAST | C1142: EDUCATION | D1142: FURNITURE | E1142: SOFA | F1142: 1 | G1142: Jan | H1142: 1994 | I1142: 382.00 | J1142: 269.00 | K1142: -113
A1143: U.S.A. | B1143: EAST | C1143: EDUCATION | D1143: FURNITURE | E1143: SOFA | F1143: 1 | G1143: Feb | H1143: 1994 | I1143: 707.00 | J1143: 764.00 | K1143: 57
A1144: U.S.A. | B1144: EAST | C1144: EDUCATION | D1144: FURNITURE | E1144: SOFA | F1144: 1 | G1144: Mar | H1144: 1994 | I1144: 566.00 | J1144: 662.00 | K1144: 96
A1145: U.S.A. | B1145: EAST | C1145: EDUCATION | D1145: FURNITURE | E1145: SOFA | F1145: 2 | G1145: Apr | H1145: 1994 | I1145: 349.00 | J1145: 818.00 | K1145: 469
A1146: U.S.A. | B1146: EAST | C1146: EDUCATION | D1146: FURNITURE | E1146: SOFA | F1146: 2 | G1146: May | H1146: 1994 | I1146: 128.00 | J1146: 617.00 | K1146: 489
A1147: U.S.A. | B1147: EAST | C1147: EDUCATION | D1147: FURNITURE | E1147: SOFA | F1147: 2 | G1147: Jun | H1147: 1994 | I1147: 231.00 | J1147: 649.00 | K1147: 418
A1148: U.S.A. | B1148: EAST | C1148: EDUCATION | D1148: FURNITURE | E1148: SOFA | F1148: 3 | G1148: Jul | H1148: 1994 | I1148: 258.00 | J1148: 895.00 | K1148: 637
A1149: U.S.A. | B1149: EAST | C1149: EDUCATION | D1149: FURNITURE | E1149: SOFA | F1149: 3 | G1149: Aug | H1149: 1994 | I1149: 812.00 | J1149: 750.00 | K1149: -62
A1150: U.S.A. | B1150: EAST | C1150: EDUCATION | D1150: FURNITURE | E1150: SOFA | F1150: 3 | G1150: Sep | H1150: 1994 | I1150: 362.00 | J1150: 738.00 | K1150: 376
A1151: U.S.A. | B1151: EAST | C1151: EDUCATION | D1151: FURNITURE | E1151: SOFA | F1151: 4 | G1151: Oct | H1151: 1994 | I1151: 133.00 | J1151: 107.00 | K1151: -26
A1152: U.S.A. | B1152: EAST | C1152: EDUCATION | D1152: FURNITURE | E1152: SOFA | F1152: 4 | G1152: Nov | H1152: 1994 | I1152: 60.00 | J1152: 278.00 | K1152: 218
A1153: U.S.A. | B1153: EAST | C1153: EDUCATION | D1153: FURNITURE | E1153: SOFA | F1153: 4 | G1153: Dec | H1153: 1994 | I1153: 88.00 | J1153: 32.00 | K1153: -56
A1154: U.S.A. | B1154: EAST | C1154: EDUCATION | D1154: FURNITURE | E1154: BED | F1154: 1 | G1154: Jan | H1154: 1994 | I1154: 273.00 | J1154: 614.00 | K1154: 341
A1155: U.S.A. | B1155: EAST | C1155: EDUCATION | D1155: FURNITURE | E1155: BED | F1155: 1 | G1155: Feb | H1155: 1994 | I1155: 27.00 | J1155: 261.00 | K1155: 234
A1156: U.S.A. | B1156: EAST | C1156: EDUCATION | D1156: FURNITURE | E1156: BED | F1156: 1 | G1156: Mar | H1156: 1994 | I1156: 209.00 | J1156: 115.00 | K1156: -94
A1157: U.S.A. | B1157: EAST | C1157: EDUCATION | D1157: FURNITURE | E1157: BED | F1157: 2 | G1157: Apr | H1157: 1994 | I1157: 470.00 | J1157: 358.00 | K1157: -112
A1158: U.S.A. | B1158: EAST | C1158: EDUCATION | D1158: FURNITURE | E1158: BED | F1158: 2 | G1158: May | H1158: 1994 | I1158: 219.00 | J1158: 133.00 | K1158: -86
A1159: U.S.A. | B1159: EAST | C1159: EDUCATION | D1159: FURNITURE | E1159: BED | F1159: 2 | G1159: Jun | H1159: 1994 | I1159: 907.00 | J1159: 891.00 | K1159: -16
A1160: U.S.A. | B1160: EAST | C1160: EDUCATION | D1160: FURNITURE | E1160: BED | F1160: 3 | G1160: Jul | H1160: 1994 | I1160: 778.00 | J1160: 702.00 | K1160: -76
A1161: U.S.A. | B1161: EAST | C1161: EDUCATION | D1161: FURNITURE | E1161: BED | F1161: 3 | G1161: Aug | H1161: 1994 | I1161: 998.00 | J1161: 58.00 | K1161: -940
A1162: U.S.A. | B1162: EAST | C1162: EDUCATION | D1162: FURNITURE | E1162: BED | F1162: 3 | G1162: Sep | H1162: 1994 | I1162: 194.00 | J1162: 606.00 | K1162: 412
A1163: U.S.A. | B1163: EAST | C1163: EDUCATION | D1163: FURNITURE | E1163: BED | F1163: 4 | G1163: Oct | H1163: 1994 | I1163: 933.00 | J1163: 668.00 | K1163: -265
A1164: U.S.A. | B1164: EAST | C1164: EDUCATION | D1164: FURNITURE | E1164: BED | F1164: 4 | G1164: Nov | H1164: 1994 | I1164: 708.00 | J1164: 813.00 | K1164: 105
A1165: U.S.A. | B1165: EAST | C1165: EDUCATION | D1165: FURNITURE | E1165: BED | F1165: 4 | G1165: Dec | H1165: 1994 | I1165: 949.00 | J1165: 450.00 | K1165: -499
A1166: U.S.A. | B1166: EAST | C1166: EDUCATION | D1166: OFFICE | E1166: TABLE | F1166: 1 | G1166: Jan | H1166: 1994 | I1166: 935.00 | J1166: 595.00 | K1166: -340
A1167: U.S.A. | B1167: EAST | C1167: EDUCATION | D1167: OFFICE | E1167: TABLE | F1167: 1 | G1167: Feb | H1167: 1994 | I1167: 667.00 | J1167: 47.00 | K1167: -620
A1168: U.S.A. | B1168: EAST | C1168: EDUCATION | D1168: OFFICE | E1168: TABLE | F1168: 1 | G1168: Mar | H1168: 1994 | I1168: 104.00 | J1168: 279.00 | K1168: 175
A1169: U.S.A. | B1169: EAST | C1169: EDUCATION | D1169: OFFICE | E1169: TABLE | F1169: 2 | G1169: Apr | H1169: 1994 | I1169: 803.00 | J1169: 293.00 | K1169: -510
A1170: U.S.A. | B1170: EAST | C1170: EDUCATION | D1170: OFFICE | E1170: TABLE | F1170: 2 | G1170: May | H1170: 1994 | I1170: 64.00 | J1170: 162.00 | K1170: 98
A1171: U.S.A. | B1171: EAST | C1171: EDUCATION | D1171: OFFICE | E1171: TABLE | F1171: 2 | G1171: Jun | H1171: 1994 | I1171: 825.00 | J1171: 935.00 | K1171: 110
A1172: U.S.A. | B1172: EAST | C1172: EDUCATION | D1172: OFFICE | E1172: TABLE | F1172: 3 | G1172: Jul | H1172: 1994 | I1172: 839.00 | J1172: 689.00 | K1172: -150
A1173: U.S.A. | B1173: EAST | C1173: EDUCATION | D1173: OFFICE | E1173: TABLE | F1173: 3 | G1173: Aug | H1173: 1994 | I1173: 184.00 | J1173: 484.00 | K1173: 300
A1174: U.S.A. | B1174: EAST | C1174: EDUCATION | D1174: OFFICE | E1174: TABLE | F1174: 3 | G1174: Sep | H1174: 1994 | I1174: 348.00 | J1174: 230.00 | K1174: -118
A1175: U.S.A. | B1175: EAST | C1175: EDUCATION | D1175: OFFICE | E1175: TABLE | F1175: 4 | G1175: Oct | H1175: 1994 | I1175: 904.00 | J1175: 164.00 | K1175: -740
A1176: U.S.A. | B1176: EAST | C1176: EDUCATION | D1176: OFFICE | E1176: TABLE | F1176: 4 | G1176: Nov | H1176: 1994 | I1176: 219.00 | J1176: 401.00 | K1176: 182
A1177: U.S.A. | B1177: EAST | C1177: EDUCATION | D1177: OFFICE | E1177: TABLE | F1177: 4 | G1177: Dec | H1177: 1994 | I1177: 381.00 | J1177: 607.00 | K1177: 226
A1178: U.S.A. | B1178: EAST | C1178: EDUCATION | D1178: OFFICE | E1178: CHAIR | F1178: 1 | G1178: Jan | H1178: 1994 | I1178: 788.00 | J1178: 223.00 | K1178: -565
A1179: U.S.A. | B1179: EAST | C1179: EDUCATION | D1179: OFFICE | E1179: CHAIR | F1179: 1 | G1179: Feb | H1179: 1994 | I1179: 639.00 | J1179: 684.00 | K1179: 45
A1180: U.S.A. | B1180: EAST | C1180: EDUCATION | D1180: OFFICE | E1180: CHAIR | F1180: 1 | G1180: Mar | H1180: 1994 | I1180: 336.00 | J1180: 645.00 | K1180: 309
A1181: U.S.A. | B1181: EAST | C1181: EDUCATION | D1181: OFFICE | E1181: CHAIR | F1181: 2 | G1181: Apr | H1181: 1994 | I1181: 937.00 | J1181: 470.00 | K1181: -467
A1182: U.S.A. | B1182: EAST | C1182: EDUCATION | D1182: OFFICE | E1182: CHAIR | F1182: 2 | G1182: May | H1182: 1994 | I1182: 399.00 | J1182: 424.00 | K1182: 25
A1183: U.S.A. | B1183: EAST | C1183: EDUCATION | D1183: OFFICE | E1183: CHAIR | F1183: 2 | G1183: Jun | H1183: 1994 | I1183: 21.00 | J1183: 862.00 | K1183: 841
A1184: U.S.A. | B1184: EAST | C1184: EDUCATION | D1184: OFFICE | E1184: CHAIR | F1184: 3 | G1184: Jul | H1184: 1994 | I1184: 125.00 | J1184: 736.00 | K1184: 611
A1185: U.S.A. | B1185: EAST | C1185: EDUCATION | D1185: OFFICE | E1185: CHAIR | F1185: 3 | G1185: Aug | H1185: 1994 | I1185: 635.00 | J1185: 554.00 | K1185: -81
A1186: U.S.A. | B1186: EAST | C1186: EDUCATION | D1186: OFFICE | E1186: CHAIR | F1186: 3 | G1186: Sep | H1186: 1994 | I1186: 229.00 | J1186: 790.00 | K1186: 561
A1187: U.S.A. | B1187: EAST | C1187: EDUCATION | D1187: OFFICE | E1187: CHAIR | F1187: 4 | G1187: Oct | H1187: 1994 | I1187: 770.00 | J1187: 115.00 | K1187: -655
A1188: U.S.A. | B1188: EAST | C1188: EDUCATION | D1188: OFFICE | E1188: CHAIR | F1188: 4 | G1188: Nov | H1188: 1994 | I1188: 622.00 | J1188: 853.00 | K1188: 231
A1189: U.S.A. | B1189: EAST | C1189: EDUCATION | D1189: OFFICE | E1189: CHAIR | F1189: 4 | G1189: Dec | H1189: 1994 | I1189: 109.00 | J1189: 643.00 | K1189: 534
A1190: U.S.A. | B1190: EAST | C1190: EDUCATION | D1190: OFFICE | E1190: DESK | F1190: 1 | G1190: Jan | H1190: 1994 | I1190: 65.00 | J1190: 984.00 | K1190: 919
A1191: U.S.A. | B1191: EAST | C1191: EDUCATION | D1191: OFFICE | E1191: DESK | F1191: 1 | G1191: Feb | H1191: 1994 | I1191: 977.00 | J1191: 845.00 | K1191: -132
A1192: U.S.A. | B1192: EAST | C1192: EDUCATION | D1192: OFFICE | E1192: DESK | F1192: 1 | G1192: Mar | H1192: 1994 | I1192: 410.00 | J1192: 374.00 | K1192: -36
A1193: U.S.A. | B1193: EAST | C1193: EDUCATION | D1193: OFFICE | E1193: DESK | F1193: 2 | G1193: Apr | H1193: 1994 | I1193: 150.00 | J1193: 687.00 | K1193: 537
A1194: U.S.A. | B1194: EAST | C1194: EDUCATION | D1194: OFFICE | E1194: DESK | F1194: 2 | G1194: May | H1194: 1994 | I1194: 630.00 | J1194: 157.00 | K1194: -473
A1195: U.S.A. | B1195: EAST | C1195: EDUCATION | D1195: OFFICE | E1195: DESK | F1195: 2 | G1195: Jun | H1195: 1994 | I1195: 488.00 | J1195: 49.00 | K1195: -439
A1196: U.S.A. | B1196: EAST | C1196: EDUCATION | D1196: OFFICE | E1196: DESK | F1196: 3 | G1196: Jul | H1196: 1994 | I1196: 112.00 | J1196: 817.00 | K1196: 705
A1197: U.S.A. | B1197: EAST | C1197: EDUCATION | D1197: OFFICE | E1197: DESK | F1197: 3 | G1197: Aug | H1197: 1994 | I1197: 598.00 | J1197: 223.00 | K1197: -375
A1198: U.S.A. | B1198: EAST | C1198: EDUCATION | D1198: OFFICE | E1198: DESK | F1198: 3 | G1198: Sep | H1198: 1994 | I1198: 705.00 | J1198: 433.00 | K1198: -272
A1199: U.S.A. | B1199: EAST | C1199: EDUCATION | D1199: OFFICE | E1199: DESK | F1199: 4 | G1199: Oct | H1199: 1994 | I1199: 226.00 | J1199: 41.00 | K1199: -185
A1200: U.S.A. | B1200: EAST | C1200: EDUCATION | D1200: OFFICE | E1200: DESK | F1200: 4 | G1200: Nov | H1200: 1994 | I1200: 979.00 | J1200: 396.00 | K1200: -583
A1201: U.S.A. | B1201: EAST | C1201: EDUCATION | D1201: OFFICE | E1201: DESK | F1201: 4 | G1201: Dec | H1201: 1994 | I1201: 19.00 | J1201: 131.00 | K1201: 112
A1202: U.S.A. | B1202: WEST | C1202: CONSUMER | D1202: FURNITURE | E1202: SOFA | F1202: 1 | G1202: Jan | H1202: 1993 | I1202: 596.00 | J1202: 197.00 | K1202: -399
A1203: U.S.A. | B1203: WEST | C1203: CONSUMER | D1203: FURNITURE | E1203: SOFA | F1203: 1 | G1203: Feb | H1203: 1993 | I1203: 263.00 | J1203: 828.00 | K1203: 565
A1204: U.S.A. | B1204: WEST | C1204: CONSUMER | D1204: FURNITURE | E1204: SOFA | F1204: 1 | G1204: Mar | H1204: 1993 | I1204: 194.00 | J1204: 461.00 | K1204: 267
A1205: U.S.A. | B1205: WEST | C1205: CONSUMER | D1205: FURNITURE | E1205: SOFA | F1205: 2 | G1205: Apr | H1205: 1993 | I1205: 895.00 | J1205: 35.00 | K1205: -860
A1206: U.S.A. | B1206: WEST | C1206: CONSUMER | D1206: FURNITURE | E1206: SOFA | F1206: 2 | G1206: May | H1206: 1993 | I1206: 502.00 | J1206: 88.00 | K1206: -414
A1207: U.S.A. | B1207: WEST | C1207: CONSUMER | D1207: FURNITURE | E1207: SOFA | F1207: 2 | G1207: Jun | H1207: 1993 | I1207: 342.00 | J1207: 832.00 | K1207: 490
A1208: U.S.A. | B1208: WEST | C1208: CONSUMER | D1208: FURNITURE | E1208: SOFA | F1208: 3 | G1208: Jul | H1208: 1993 | I1208: 421.00 | J1208: 900.00 | K1208: 479
A1209: U.S.A. | B1209: WEST | C1209: CONSUMER | D1209: FURNITURE | E1209: SOFA | F1209: 3 | G1209: Aug | H1209: 1993 | I1209: 901.00 | J1209: 368.00 | K1209: -533
A1210: U.S.A. | B1210: WEST | C1210: CONSUMER | D1210: FURNITURE | E1210: SOFA | F1210: 3 | G1210: Sep | H1210: 1993 | I1210: 474.00 | J1210: 201.00 | K1210: -273
A1211: U.S.A. | B1211: WEST | C1211: CONSUMER | D1211: FURNITURE | E1211: SOFA | F1211: 4 | G1211: Oct | H1211: 1993 | I1211: 571.00 | J1211: 758.00 | K1211: 187
A1212: U.S.A. | B1212: WEST | C1212: CONSUMER | D1212: FURNITURE | E1212: SOFA | F1212: 4 | G1212: Nov | H1212: 1993 | I1212: 511.00 | J1212: 504.00 | K1212: -7
A1213: U.S.A. | B1213: WEST | C1213: CONSUMER | D1213: FURNITURE | E1213: SOFA | F1213: 4 | G1213: Dec | H1213: 1993 | I1213: 379.00 | J1213: 864.00 | K1213: 485
A1214: U.S.A. | B1214: WEST | C1214: CONSUMER | D1214: FURNITURE | E1214: BED | F1214: 1 | G1214: Jan | H1214: 1993 | I1214: 912.00 | J1214: 585.00 | K1214: -327
A1215: U.S.A. | B1215: WEST | C1215: CONSUMER | D1215: FURNITURE | E1215: BED | F1215: 1 | G1215: Feb | H1215: 1993 | I1215: 429.00 | J1215: 127.00 | K1215: -302
A1216: U.S.A. | B1216: WEST | C1216: CONSUMER | D1216: FURNITURE | E1216: BED | F1216: 1 | G1216: Mar | H1216: 1993 | I1216: 580.00 | J1216: 669.00 | K1216: 89
A1217: U.S.A. | B1217: WEST | C1217: CONSUMER | D1217: FURNITURE | E1217: BED | F1217: 2 | G1217: Apr | H1217: 1993 | I1217: 179.00 | J1217: 708.00 | K1217: 529
A1218: U.S.A. | B1218: WEST | C1218: CONSUMER | D1218: FURNITURE | E1218: BED | F1218: 2 | G1218: May | H1218: 1993 | I1218: 119.00 | J1218: 830.00 | K1218: 711
A1219: U.S.A. | B1219: WEST | C1219: CONSUMER | D1219: FURNITURE | E1219: BED | F1219: 2 | G1219: Jun | H1219: 1993 | I1219: 369.00 | J1219: 550.00 | K1219: 181
A1220: U.S.A. | B1220: WEST | C1220: CONSUMER | D1220: FURNITURE | E1220: BED | F1220: 3 | G1220: Jul | H1220: 1993 | I1220: 882.00 | J1220: 762.00 | K1220: -120
A1221: U.S.A. | B1221: WEST | C1221: CONSUMER | D1221: FURNITURE | E1221: BED | F1221: 3 | G1221: Aug | H1221: 1993 | I1221: 727.00 | J1221: 468.00 | K1221: -259
A1222: U.S.A. | B1222: WEST | C1222: CONSUMER | D1222: FURNITURE | E1222: BED | F1222: 3 | G1222: Sep | H1222: 1993 | I1222: 823.00 | J1222: 151.00 | K1222: -672
A1223: U.S.A. | B1223: WEST | C1223: CONSUMER | D1223: FURNITURE | E1223: BED | F1223: 4 | G1223: Oct | H1223: 1993 | I1223: 783.00 | J1223: 103.00 | K1223: -680
A1224: U.S.A. | B1224: WEST | C1224: CONSUMER | D1224: FURNITURE | E1224: BED | F1224: 4 | G1224: Nov | H1224: 1993 | I1224: 884.00 | J1224: 876.00 | K1224: -8
A1225: U.S.A. | B1225: WEST | C1225: CONSUMER | D1225: FURNITURE | E1225: BED | F1225: 4 | G1225: Dec | H1225: 1993 | I1225: 891.00 | J1225: 881.00 | K1225: -10
A1226: U.S.A. | B1226: WEST | C1226: CONSUMER | D1226: OFFICE | E1226: TABLE | F1226: 1 | G1226: Jan | H1226: 1993 | I1226: 516.00 | J1226: 755.00 | K1226: 239
A1227: U.S.A. | B1227: WEST | C1227: CONSUMER | D1227: OFFICE | E1227: TABLE | F1227: 1 | G1227: Feb | H1227: 1993 | I1227: 779.00 | J1227: 331.00 | K1227: -448
A1228: U.S.A. | B1228: WEST | C1228: CONSUMER | D1228: OFFICE | E1228: TABLE | F1228: 1 | G1228: Mar | H1228: 1993 | I1228: 987.00 | J1228: 482.00 | K1228: -505
A1229: U.S.A. | B1229: WEST | C1229: CONSUMER | D1229: OFFICE | E1229: TABLE | F1229: 2 | G1229: Apr | H1229: 1993 | I1229: 318.00 | J1229: 632.00 | K1229: 314
A1230: U.S.A. | B1230: WEST | C1230: CONSUMER | D1230: OFFICE | E1230: TABLE | F1230: 2 | G1230: May | H1230: 1993 | I1230: 427.00 | J1230: 750.00 | K1230: 323
A1231: U.S.A. | B1231: WEST | C1231: CONSUMER | D1231: OFFICE | E1231: TABLE | F1231: 2 | G1231: Jun | H1231: 1993 | I1231: 86.00 | J1231: 618.00 | K1231: 532
A1232: U.S.A. | B1232: WEST | C1232: CONSUMER | D1232: OFFICE | E1232: TABLE | F1232: 3 | G1232: Jul | H1232: 1993 | I1232: 553.00 | J1232: 935.00 | K1232: 382
A1233: U.S.A. | B1233: WEST | C1233: CONSUMER | D1233: OFFICE | E1233: TABLE | F1233: 3 | G1233: Aug | H1233: 1993 | I1233: 315.00 | J1233: 716.00 | K1233: 401
A1234: U.S.A. | B1234: WEST | C1234: CONSUMER | D1234: OFFICE | E1234: TABLE | F1234: 3 | G1234: Sep | H1234: 1993 | I1234: 328.00 | J1234: 205.00 | K1234: -123
A1235: U.S.A. | B1235: WEST | C1235: CONSUMER | D1235: OFFICE | E1235: TABLE | F1235: 4 | G1235: Oct | H1235: 1993 | I1235: 521.00 | J1235: 215.00 | K1235: -306
A1236: U.S.A. | B1236: WEST | C1236: CONSUMER | D1236: OFFICE | E1236: TABLE | F1236: 4 | G1236: Nov | H1236: 1993 | I1236: 156.00 | J1236: 871.00 | K1236: 715
A1237: U.S.A. | B1237: WEST | C1237: CONSUMER | D1237: OFFICE | E1237: TABLE | F1237: 4 | G1237: Dec | H1237: 1993 | I1237: 841.00 | J1237: 552.00 | K1237: -289
A1238: U.S.A. | B1238: WEST | C1238: CONSUMER | D1238: OFFICE | E1238: CHAIR | F1238: 1 | G1238: Jan | H1238: 1993 | I1238: 588.00 | J1238: 792.00 | K1238: 204
A1239: U.S.A. | B1239: WEST | C1239: CONSUMER | D1239: OFFICE | E1239: CHAIR | F1239: 1 | G1239: Feb | H1239: 1993 | I1239: 506.00 | J1239: 175.00 | K1239: -331
A1240: U.S.A. | B1240: WEST | C1240: CONSUMER | D1240: OFFICE | E1240: CHAIR | F1240: 1 | G1240: Mar | H1240: 1993 | I1240: 382.00 | J1240: 208.00 | K1240: -174
A1241: U.S.A. | B1241: WEST | C1241: CONSUMER | D1241: OFFICE | E1241: CHAIR | F1241: 2 | G1241: Apr | H1241: 1993 | I1241: 132.00 | J1241: 354.00 | K1241: 222
A1242: U.S.A. | B1242: WEST | C1242: CONSUMER | D1242: OFFICE | E1242: CHAIR | F1242: 2 | G1242: May | H1242: 1993 | I1242: 652.00 | J1242: 163.00 | K1242: -489
A1243: U.S.A. | B1243: WEST | C1243: CONSUMER | D1243: OFFICE | E1243: CHAIR | F1243: 2 | G1243: Jun | H1243: 1993 | I1243: 723.00 | J1243: 336.00 | K1243: -387
A1244: U.S.A. | B1244: WEST | C1244: CONSUMER | D1244: OFFICE | E1244: CHAIR | F1244: 3 | G1244: Jul | H1244: 1993 | I1244: 682.00 | J1244: 804.00 | K1244: 122
A1245: U.S.A. | B1245: WEST | C1245: CONSUMER | D1245: OFFICE | E1245: CHAIR | F1245: 3 | G1245: Aug | H1245: 1993 | I1245: 382.00 | J1245: 863.00 | K1245: 481
A1246: U.S.A. | B1246: WEST | C1246: CONSUMER | D1246: OFFICE | E1246: CHAIR | F1246: 3 | G1246: Sep | H1246: 1993 | I1246: 125.00 | J1246: 326.00 | K1246: 201
A1247: U.S.A. | B1247: WEST | C1247: CONSUMER | D1247: OFFICE | E1247: CHAIR | F1247: 4 | G1247: Oct | H1247: 1993 | I1247: 321.00 | J1247: 568.00 | K1247: 247
A1248: U.S.A. | B1248: WEST | C1248: CONSUMER | D1248: OFFICE | E1248: CHAIR | F1248: 4 | G1248: Nov | H1248: 1993 | I1248: 922.00 | J1248: 691.00 | K1248: -231
A1249: U.S.A. | B1249: WEST | C1249: CONSUMER | D1249: OFFICE | E1249: CHAIR | F1249: 4 | G1249: Dec | H1249: 1993 | I1249: 884.00 | J1249: 152.00 | K1249: -732
A1250: U.S.A. | B1250: WEST | C1250: CONSUMER | D1250: OFFICE | E1250: DESK | F1250: 1 | G1250: Jan | H1250: 1993 | I1250: 342.00 | J1250: 793.00 | K1250: 451
A1251: U.S.A. | B1251: WEST | C1251: CONSUMER | D1251: OFFICE | E1251: DESK | F1251: 1 | G1251: Feb | H1251: 1993 | I1251: 215.00 | J1251: 129.00 | K1251: -86
A1252: U.S.A. | B1252: WEST | C1252: CONSUMER | D1252: OFFICE | E1252: DESK | F1252: 1 | G1252: Mar | H1252: 1993 | I1252: 52.00 | J1252: 481.00 | K1252: 429
A1253: U.S.A. | B1253: WEST | C1253: CONSUMER | D1253: OFFICE | E1253: DESK | F1253: 2 | G1253: Apr | H1253: 1993 | I1253: 292.00 | J1253: 406.00 | K1253: 114
A1254: U.S.A. | B1254: WEST | C1254: CONSUMER | D1254: OFFICE | E1254: DESK | F1254: 2 | G1254: May | H1254: 1993 | I1254: 862.00 | J1254: 512.00 | K1254: -350
A1255: U.S.A. | B1255: WEST | C1255: CONSUMER | D1255: OFFICE | E1255: DESK | F1255: 2 | G1255: Jun | H1255: 1993 | I1255: 309.00 | J1255: 668.00 | K1255: 359
A1256: U.S.A. | B1256: WEST | C1256: CONSUMER | D1256: OFFICE | E1256: DESK | F1256: 3 | G1256: Jul | H1256: 1993 | I1256: 886.00 | J1256: 551.00 | K1256: -335
A1257: U.S.A. | B1257: WEST | C1257: CONSUMER | D1257: OFFICE | E1257: DESK | F1257: 3 | G1257: Aug | H1257: 1993 | I1257: 172.00 | J1257: 124.00 | K1257: -48
A1258: U.S.A. | B1258: WEST | C1258: CONSUMER | D1258: OFFICE | E1258: DESK | F1258: 3 | G1258: Sep | H1258: 1993 | I1258: 912.00 | J1258: 655.00 | K1258: -257
A1259: U.S.A. | B1259: WEST | C1259: CONSUMER | D1259: OFFICE | E1259: DESK | F1259: 4 | G1259: Oct | H1259: 1993 | I1259: 666.00 | J1259: 523.00 | K1259: -143
A1260: U.S.A. | B1260: WEST | C1260: CONSUMER | D1260: OFFICE | E1260: DESK | F1260: 4 | G1260: Nov | H1260: 1993 | I1260: 656.00 | J1260: 739.00 | K1260: 83
A1261: U.S.A. | B1261: WEST | C1261: CONSUMER | D1261: OFFICE | E1261: DESK | F1261: 4 | G1261: Dec | H1261: 1993 | I1261: 145.00 | J1261: 87.00 | K1261: -58
A1262: U.S.A. | B1262: WEST | C1262: CONSUMER | D1262: FURNITURE | E1262: SOFA | F1262: 1 | G1262: Jan | H1262: 1994 | I1262: 68.00 | J1262: 574.00 | K1262: 506
A1263: U.S.A. | B1263: WEST | C1263: CONSUMER | D1263: FURNITURE | E1263: SOFA | F1263: 1 | G1263: Feb | H1263: 1994 | I1263: 210.00 | J1263: 61.00 | K1263: -149
A1264: U.S.A. | B1264: WEST | C1264: CONSUMER | D1264: FURNITURE | E1264: SOFA | F1264: 1 | G1264: Mar | H1264: 1994 | I1264: 478.00 | J1264: 565.00 | K1264: 87
A1265: U.S.A. | B1265: WEST | C1265: CONSUMER | D1265: FURNITURE | E1265: SOFA | F1265: 2 | G1265: Apr | H1265: 1994 | I1265: 296.00 | J1265: 475.00 | K1265: 179
A1266: U.S.A. | B1266: WEST | C1266: CONSUMER | D1266: FURNITURE | E1266: SOFA | F1266: 2 | G1266: May | H1266: 1994 | I1266: 664.00 | J1266: 44.00 | K1266: -620
A1267: U.S.A. | B1267: WEST | C1267: CONSUMER | D1267: FURNITURE | E1267: SOFA | F1267: 2 | G1267: Jun | H1267: 1994 | I1267: 880.00 | J1267: 145.00 | K1267: -735
A1268: U.S.A. | B1268: WEST | C1268: CONSUMER | D1268: FURNITURE | E1268: SOFA | F1268: 3 | G1268: Jul | H1268: 1994 | I1268: 607.00 | J1268: 813.00 | K1268: 206
A1269: U.S.A. | B1269: WEST | C1269: CONSUMER | D1269: FURNITURE | E1269: SOFA | F1269: 3 | G1269: Aug | H1269: 1994 | I1269: 97.00 | J1269: 703.00 | K1269: 606
A1270: U.S.A. | B1270: WEST | C1270: CONSUMER | D1270: FURNITURE | E1270: SOFA | F1270: 3 | G1270: Sep | H1270: 1994 | I1270: 908.00 | J1270: 757.00 | K1270: -151
A1271: U.S.A. | B1271: WEST | C1271: CONSUMER | D1271: FURNITURE | E1271: SOFA | F1271: 4 | G1271: Oct | H1271: 1994 | I1271: 152.00 | J1271: 96.00 | K1271: -56
A1272: U.S.A. | B1272: WEST | C1272: CONSUMER | D1272: FURNITURE | E1272: SOFA | F1272: 4 | G1272: Nov | H1272: 1994 | I1272: 622.00 | J1272: 860.00 | K1272: 238
A1273: U.S.A. | B1273: WEST | C1273: CONSUMER | D1273: FURNITURE | E1273: SOFA | F1273: 4 | G1273: Dec | H1273: 1994 | I1273: 309.00 | J1273: 750.00 | K1273: 441
A1274: U.S.A. | B1274: WEST | C1274: CONSUMER | D1274: FURNITURE | E1274: BED | F1274: 1 | G1274: Jan | H1274: 1994 | I1274: 909.00 | J1274: 116.00 | K1274: -793
A1275: U.S.A. | B1275: WEST | C1275: CONSUMER | D1275: FURNITURE | E1275: BED | F1275: 1 | G1275: Feb | H1275: 1994 | I1275: 765.00 | J1275: 677.00 | K1275: -88
A1276: U.S.A. | B1276: WEST | C1276: CONSUMER | D1276: FURNITURE | E1276: BED | F1276: 1 | G1276: Mar | H1276: 1994 | I1276: 180.00 | J1276: 477.00 | K1276: 297
A1277: U.S.A. | B1277: WEST | C1277: CONSUMER | D1277: FURNITURE | E1277: BED | F1277: 2 | G1277: Apr | H1277: 1994 | I1277: 712.00 | J1277: 154.00 | K1277: -558
A1278: U.S.A. | B1278: WEST | C1278: CONSUMER | D1278: FURNITURE | E1278: BED | F1278: 2 | G1278: May | H1278: 1994 | I1278: 175.00 | J1278: 331.00 | K1278: 156
A1279: U.S.A. | B1279: WEST | C1279: CONSUMER | D1279: FURNITURE | E1279: BED | F1279: 2 | G1279: Jun | H1279: 1994 | I1279: 869.00 | J1279: 784.00 | K1279: -85
A1280: U.S.A. | B1280: WEST | C1280: CONSUMER | D1280: FURNITURE | E1280: BED | F1280: 3 | G1280: Jul | H1280: 1994 | I1280: 820.00 | J1280: 563.00 | K1280: -257
A1281: U.S.A. | B1281: WEST | C1281: CONSUMER | D1281: FURNITURE | E1281: BED | F1281: 3 | G1281: Aug | H1281: 1994 | I1281: 554.00 | J1281: 229.00 | K1281: -325
A1282: U.S.A. | B1282: WEST | C1282: CONSUMER | D1282: FURNITURE | E1282: BED | F1282: 3 | G1282: Sep | H1282: 1994 | I1282: 126.00 | J1282: 451.00 | K1282: 325
A1283: U.S.A. | B1283: WEST | C1283: CONSUMER | D1283: FURNITURE | E1283: BED | F1283: 4 | G1283: Oct | H1283: 1994 | I1283: 760.00 | J1283: 974.00 | K1283: 214
A1284: U.S.A. | B1284: WEST | C1284: CONSUMER | D1284: FURNITURE | E1284: BED | F1284: 4 | G1284: Nov | H1284: 1994 | I1284: 446.00 | J1284: 484.00 | K1284: 38
A1285: U.S.A. | B1285: WEST | C1285: CONSUMER | D1285: FURNITURE | E1285: BED | F1285: 4 | G1285: Dec | H1285: 1994 | I1285: 254.00 | J1285: 69.00 | K1285: -185
A1286: U.S.A. | B1286: WEST | C1286: CONSUMER | D1286: OFFICE | E1286: TABLE | F1286: 1 | G1286: Jan | H1286: 1994 | I1286: 623.00 | J1286: 619.00 | K1286: -4
A1287: U.S.A. | B1287: WEST | C1287: CONSUMER | D1287: OFFICE | E1287: TABLE | F1287: 1 | G1287: Feb | H1287: 1994 | I1287: 849.00 | J1287: 701.00 | K1287: -148
A1288: U.S.A. | B1288: WEST | C1288: CONSUMER | D1288: OFFICE | E1288: TABLE | F1288: 1 | G1288: Mar | H1288: 1994 | I1288: 438.00 | J1288: 104.00 | K1288: -334
A1289: U.S.A. | B1289: WEST | C1289: CONSUMER | D1289: OFFICE | E1289: TABLE | F1289: 2 | G1289: Apr | H1289: 1994 | I1289: 719.00 | J1289: 114.00 | K1289: -605
A1290: U.S.A. | B1290: WEST | C1290: CONSUMER | D1290: OFFICE | E1290: TABLE | F1290: 2 | G1290: May | H1290: 1994 | I1290: 906.00 | J1290: 854.00 | K1290: -52
A1291: U.S.A. | B1291: WEST | C1291: CONSUMER | D1291: OFFICE | E1291: TABLE | F1291: 2 | G1291: Jun | H1291: 1994 | I1291: 267.00 | J1291: 563.00 | K1291: 296
A1292: U.S.A. | B1292: WEST | C1292: CONSUMER | D1292: OFFICE | E1292: TABLE | F1292: 3 | G1292: Jul | H1292: 1994 | I1292: 542.00 | J1292: 73.00 | K1292: -469
A1293: U.S.A. | B1293: WEST | C1293: CONSUMER | D1293: OFFICE | E1293: TABLE | F1293: 3 | G1293: Aug | H1293: 1994 | I1293: 552.00 | J1293: 427.00 | K1293: -125
A1294: U.S.A. | B1294: WEST | C1294: CONSUMER | D1294: OFFICE | E1294: TABLE | F1294: 3 | G1294: Sep | H1294: 1994 | I1294: 428.00 | J1294: 348.00 | K1294: -80
A1295: U.S.A. | B1295: WEST | C1295: CONSUMER | D1295: OFFICE | E1295: TABLE | F1295: 4 | G1295: Oct | H1295: 1994 | I1295: 158.00 | J1295: 148.00 | K1295: -10
A1296: U.S.A. | B1296: WEST | C1296: CONSUMER | D1296: OFFICE | E1296: TABLE | F1296: 4 | G1296: Nov | H1296: 1994 | I1296: 379.00 | J1296: 895.00 | K1296: 516
A1297: U.S.A. | B1297: WEST | C1297: CONSUMER | D1297: OFFICE | E1297: TABLE | F1297: 4 | G1297: Dec | H1297: 1994 | I1297: 142.00 | J1297: 394.00 | K1297: 252
A1298: U.S.A. | B1298: WEST | C1298: CONSUMER | D1298: OFFICE | E1298: CHAIR | F1298: 1 | G1298: Jan | H1298: 1994 | I1298: 38.00 | J1298: 565.00 | K1298: 527
A1299: U.S.A. | B1299: WEST | C1299: CONSUMER | D1299: OFFICE | E1299: CHAIR | F1299: 1 | G1299: Feb | H1299: 1994 | I1299: 194.00 | J1299: 38.00 | K1299: -156
A1300: U.S.A. | B1300: WEST | C1300: CONSUMER | D1300: OFFICE | E1300: CHAIR | F1300: 1 | G1300: Mar | H1300: 1994 | I1300: 996.00 | J1300: 185.00 | K1300: -811
A1301: U.S.A. | B1301: WEST | C1301: CONSUMER | D1301: OFFICE | E1301: CHAIR | F1301: 2 | G1301: Apr | H1301: 1994 | I1301: 532.00 | J1301: 318.00 | K1301: -214
A1302: U.S.A. | B1302: WEST | C1302: CONSUMER | D1302: OFFICE | E1302: CHAIR | F1302: 2 | G1302: May | H1302: 1994 | I1302: 391.00 | J1302: 960.00 | K1302: 569
A1303: U.S.A. | B1303: WEST | C1303: CONSUMER | D1303: OFFICE | E1303: CHAIR | F1303: 2 | G1303: Jun | H1303: 1994 | I1303: 104.00 | J1303: 122.00 | K1303: 18
A1304: U.S.A. | B1304: WEST | C1304: CONSUMER | D1304: OFFICE | E1304: CHAIR | F1304: 3 | G1304: Jul | H1304: 1994 | I1304: 22.00 | J1304: 400.00 | K1304: 378
A1305: U.S.A. | B1305: WEST | C1305: CONSUMER | D1305: OFFICE | E1305: CHAIR | F1305: 3 | G1305: Aug | H1305: 1994 | I1305: 650.00 | J1305: 301.00 | K1305: -349
A1306: U.S.A. | B1306: WEST | C1306: CONSUMER | D1306: OFFICE | E1306: CHAIR | F1306: 3 | G1306: Sep | H1306: 1994 | I1306: 143.00 | J1306: 909.00 | K1306: 766
A1307: U.S.A. | B1307: WEST | C1307: CONSUMER | D1307: OFFICE | E1307: CHAIR | F1307: 4 | G1307: Oct | H1307: 1994 | I1307: 999.00 | J1307: 433.00 | K1307: -566
A1308: U.S.A. | B1308: WEST | C1308: CONSUMER | D1308: OFFICE | E1308: CHAIR | F1308: 4 | G1308: Nov | H1308: 1994 | I1308: 415.00 | J1308: 508.00 | K1308: 93
A1309: U.S.A. | B1309: WEST | C1309: CONSUMER | D1309: OFFICE | E1309: CHAIR | F1309: 4 | G1309: Dec | H1309: 1994 | I1309: 350.00 | J1309: 648.00 | K1309: 298
A1310: U.S.A. | B1310: WEST | C1310: CONSUMER | D1310: OFFICE | E1310: DESK | F1310: 1 | G1310: Jan | H1310: 1994 | I1310: 664.00 | J1310: 890.00 | K1310: 226
A1311: U.S.A. | B1311: WEST | C1311: CONSUMER | D1311: OFFICE | E1311: DESK | F1311: 1 | G1311: Feb | H1311: 1994 | I1311: 639.00 | J1311: 665.00 | K1311: 26
A1312: U.S.A. | B1312: WEST | C1312: CONSUMER | D1312: OFFICE | E1312: DESK | F1312: 1 | G1312: Mar | H1312: 1994 | I1312: 707.00 | J1312: 329.00 | K1312: -378
A1313: U.S.A. | B1313: WEST | C1313: CONSUMER | D1313: OFFICE | E1313: DESK | F1313: 2 | G1313: Apr | H1313: 1994 | I1313: 891.00 | J1313: 417.00 | K1313: -474
A1314: U.S.A. | B1314: WEST | C1314: CONSUMER | D1314: OFFICE | E1314: DESK | F1314: 2 | G1314: May | H1314: 1994 | I1314: 466.00 | J1314: 828.00 | K1314: 362
A1315: U.S.A. | B1315: WEST | C1315: CONSUMER | D1315: OFFICE | E1315: DESK | F1315: 2 | G1315: Jun | H1315: 1994 | I1315: 451.00 | J1315: 298.00 | K1315: -153
A1316: U.S.A. | B1316: WEST | C1316: CONSUMER | D1316: OFFICE | E1316: DESK | F1316: 3 | G1316: Jul | H1316: 1994 | I1316: 451.00 | J1316: 356.00 | K1316: -95
A1317: U.S.A. | B1317: WEST | C1317: CONSUMER | D1317: OFFICE | E1317: DESK | F1317: 3 | G1317: Aug | H1317: 1994 | I1317: 874.00 | J1317: 909.00 | K1317: 35
A1318: U.S.A. | B1318: WEST | C1318: CONSUMER | D1318: OFFICE | E1318: DESK | F1318: 3 | G1318: Sep | H1318: 1994 | I1318: 805.00 | J1318: 251.00 | K1318: -554
A1319: U.S.A. | B1319: WEST | C1319: CONSUMER | D1319: OFFICE | E1319: DESK | F1319: 4 | G1319: Oct | H1319: 1994 | I1319: 426.00 | J1319: 526.00 | K1319: 100
A1320: U.S.A. | B1320: WEST | C1320: CONSUMER | D1320: OFFICE | E1320: DESK | F1320: 4 | G1320: Nov | H1320: 1994 | I1320: 932.00 | J1320: 652.00 | K1320: -280
A1321: U.S.A. | B1321: WEST | C1321: CONSUMER | D1321: OFFICE | E1321: DESK | F1321: 4 | G1321: Dec | H1321: 1994 | I1321: 581.00 | J1321: 573.00 | K1321: -8
A1322: U.S.A. | B1322: WEST | C1322: EDUCATION | D1322: FURNITURE | E1322: SOFA | F1322: 1 | G1322: Jan | H1322: 1993 | I1322: 896.00 | J1322: 404.00 | K1322: -492
A1323: U.S.A. | B1323: WEST | C1323: EDUCATION | D1323: FURNITURE | E1323: SOFA | F1323: 1 | G1323: Feb | H1323: 1993 | I1323: 973.00 | J1323: 22.00 | K1323: -951
A1324: U.S.A. | B1324: WEST | C1324: EDUCATION | D1324: FURNITURE | E1324: SOFA | F1324: 1 | G1324: Mar | H1324: 1993 | I1324: 161.00 | J1324: 744.00 | K1324: 583
A1325: U.S.A. | B1325: WEST | C1325: EDUCATION | D1325: FURNITURE | E1325: SOFA | F1325: 2 | G1325: Apr | H1325: 1993 | I1325: 934.00 | J1325: 804.00 | K1325: -130
A1326: U.S.A. | B1326: WEST | C1326: EDUCATION | D1326: FURNITURE | E1326: SOFA | F1326: 2 | G1326: May | H1326: 1993 | I1326: 697.00 | J1326: 101.00 | K1326: -596
A1327: U.S.A. | B1327: WEST | C1327: EDUCATION | D1327: FURNITURE | E1327: SOFA | F1327: 2 | G1327: Jun | H1327: 1993 | I1327: 116.00 | J1327: 293.00 | K1327: 177
A1328: U.S.A. | B1328: WEST | C1328: EDUCATION | D1328: FURNITURE | E1328: SOFA | F1328: 3 | G1328: Jul | H1328: 1993 | I1328: 84.00 | J1328: 266.00 | K1328: 182
A1329: U.S.A. | B1329: WEST | C1329: EDUCATION | D1329: FURNITURE | E1329: SOFA | F1329: 3 | G1329: Aug | H1329: 1993 | I1329: 604.00 | J1329: 372.00 | K1329: -232
A1330: U.S.A. | B1330: WEST | C1330: EDUCATION | D1330: FURNITURE | E1330: SOFA | F1330: 3 | G1330: Sep | H1330: 1993 | I1330: 371.00 | J1330: 38.00 | K1330: -333
A1331: U.S.A. | B1331: WEST | C1331: EDUCATION | D1331: FURNITURE | E1331: SOFA | F1331: 4 | G1331: Oct | H1331: 1993 | I1331: 783.00 | J1331: 385.00 | K1331: -398
A1332: U.S.A. | B1332: WEST | C1332: EDUCATION | D1332: FURNITURE | E1332: SOFA | F1332: 4 | G1332: Nov | H1332: 1993 | I1332: 335.00 | J1332: 262.00 | K1332: -73
A1333: U.S.A. | B1333: WEST | C1333: EDUCATION | D1333: FURNITURE | E1333: SOFA | F1333: 4 | G1333: Dec | H1333: 1993 | I1333: 321.00 | J1333: 961.00 | K1333: 640
A1334: U.S.A. | B1334: WEST | C1334: EDUCATION | D1334: FURNITURE | E1334: BED | F1334: 1 | G1334: Jan | H1334: 1993 | I1334: 846.00 | J1334: 18.00 | K1334: -828
A1335: U.S.A. | B1335: WEST | C1335: EDUCATION | D1335: FURNITURE | E1335: BED | F1335: 1 | G1335: Feb | H1335: 1993 | I1335: 933.00 | J1335: 512.00 | K1335: -421
A1336: U.S.A. | B1336: WEST | C1336: EDUCATION | D1336: FURNITURE | E1336: BED | F1336: 1 | G1336: Mar | H1336: 1993 | I1336: 237.00 | J1336: 337.00 | K1336: 100
A1337: U.S.A. | B1337: WEST | C1337: EDUCATION | D1337: FURNITURE | E1337: BED | F1337: 2 | G1337: Apr | H1337: 1993 | I1337: 964.00 | J1337: 167.00 | K1337: -797
A1338: U.S.A. | B1338: WEST | C1338: EDUCATION | D1338: FURNITURE | E1338: BED | F1338: 2 | G1338: May | H1338: 1993 | I1338: 382.00 | J1338: 749.00 | K1338: 367
A1339: U.S.A. | B1339: WEST | C1339: EDUCATION | D1339: FURNITURE | E1339: BED | F1339: 2 | G1339: Jun | H1339: 1993 | I1339: 610.00 | J1339: 890.00 | K1339: 280
A1340: U.S.A. | B1340: WEST | C1340: EDUCATION | D1340: FURNITURE | E1340: BED | F1340: 3 | G1340: Jul | H1340: 1993 | I1340: 148.00 | J1340: 910.00 | K1340: 762
A1341: U.S.A. | B1341: WEST | C1341: EDUCATION | D1341: FURNITURE | E1341: BED | F1341: 3 | G1341: Aug | H1341: 1993 | I1341: 837.00 | J1341: 403.00 | K1341: -434
A1342: U.S.A. | B1342: WEST | C1342: EDUCATION | D1342: FURNITURE | E1342: BED | F1342: 3 | G1342: Sep | H1342: 1993 | I1342: 85.00 | J1342: 403.00 | K1342: 318
A1343: U.S.A. | B1343: WEST | C1343: EDUCATION | D1343: FURNITURE | E1343: BED | F1343: 4 | G1343: Oct | H1343: 1993 | I1343: 425.00 | J1343: 661.00 | K1343: 236
A1344: U.S.A. | B1344: WEST | C1344: EDUCATION | D1344: FURNITURE | E1344: BED | F1344: 4 | G1344: Nov | H1344: 1993 | I1344: 633.00 | J1344: 485.00 | K1344: -148
A1345: U.S.A. | B1345: WEST | C1345: EDUCATION | D1345: FURNITURE | E1345: BED | F1345: 4 | G1345: Dec | H1345: 1993 | I1345: 515.00 | J1345: 789.00 | K1345: 274
A1346: U.S.A. | B1346: WEST | C1346: EDUCATION | D1346: OFFICE | E1346: TABLE | F1346: 1 | G1346: Jan | H1346: 1993 | I1346: 556.00 | J1346: 608.00 | K1346: 52
A1347: U.S.A. | B1347: WEST | C1347: EDUCATION | D1347: OFFICE | E1347: TABLE | F1347: 1 | G1347: Feb | H1347: 1993 | I1347: 202.00 | J1347: 840.00 | K1347: 638
A1348: U.S.A. | B1348: WEST | C1348: EDUCATION | D1348: OFFICE | E1348: TABLE | F1348: 1 | G1348: Mar | H1348: 1993 | I1348: 964.00 | J1348: 112.00 | K1348: -852
A1349: U.S.A. | B1349: WEST | C1349: EDUCATION | D1349: OFFICE | E1349: TABLE | F1349: 2 | G1349: Apr | H1349: 1993 | I1349: 112.00 | J1349: 288.00 | K1349: 176
A1350: U.S.A. | B1350: WEST | C1350: EDUCATION | D1350: OFFICE | E1350: TABLE | F1350: 2 | G1350: May | H1350: 1993 | I1350: 445.00 | J1350: 408.00 | K1350: -37
A1351: U.S.A. | B1351: WEST | C1351: EDUCATION | D1351: OFFICE | E1351: TABLE | F1351: 2 | G1351: Jun | H1351: 1993 | I1351: 884.00 | J1351: 876.00 | K1351: -8
A1352: U.S.A. | B1352: WEST | C1352: EDUCATION | D1352: OFFICE | E1352: TABLE | F1352: 3 | G1352: Jul | H1352: 1993 | I1352: 348.00 | J1352: 224.00 | K1352: -124
A1353: U.S.A. | B1353: WEST | C1353: EDUCATION | D1353: OFFICE | E1353: TABLE | F1353: 3 | G1353: Aug | H1353: 1993 | I1353: 564.00 | J1353: 133.00 | K1353: -431
A1354: U.S.A. | B1354: WEST | C1354: EDUCATION | D1354: OFFICE | E1354: TABLE | F1354: 3 | G1354: Sep | H1354: 1993 | I1354: 568.00 | J1354: 662.00 | K1354: 94
A1355: U.S.A. | B1355: WEST | C1355: EDUCATION | D1355: OFFICE | E1355: TABLE | F1355: 4 | G1355: Oct | H1355: 1993 | I1355: 882.00 | J1355: 68.00 | K1355: -814
A1356: U.S.A. | B1356: WEST | C1356: EDUCATION | D1356: OFFICE | E1356: TABLE | F1356: 4 | G1356: Nov | H1356: 1993 | I1356: 542.00 | J1356: 626.00 | K1356: 84
A1357: U.S.A. | B1357: WEST | C1357: EDUCATION | D1357: OFFICE | E1357: TABLE | F1357: 4 | G1357: Dec | H1357: 1993 | I1357: 119.00 | J1357: 678.00 | K1357: 559
A1358: U.S.A. | B1358: WEST | C1358: EDUCATION | D1358: OFFICE | E1358: CHAIR | F1358: 1 | G1358: Jan | H1358: 1993 | I1358: 261.00 | J1358: 251.00 | K1358: -10
A1359: U.S.A. | B1359: WEST | C1359: EDUCATION | D1359: OFFICE | E1359: CHAIR | F1359: 1 | G1359: Feb | H1359: 1993 | I1359: 122.00 | J1359: 783.00 | K1359: 661
A1360: U.S.A. | B1360: WEST | C1360: EDUCATION | D1360: OFFICE | E1360: CHAIR | F1360: 1 | G1360: Mar | H1360: 1993 | I1360: 296.00 | J1360: 425.00 | K1360: 129
A1361: U.S.A. | B1361: WEST | C1361: EDUCATION | D1361: OFFICE | E1361: CHAIR | F1361: 2 | G1361: Apr | H1361: 1993 | I1361: 391.00 | J1361: 859.00 | K1361: 468
A1362: U.S.A. | B1362: WEST | C1362: EDUCATION | D1362: OFFICE | E1362: CHAIR | F1362: 2 | G1362: May | H1362: 1993 | I1362: 75.00 | J1362: 314.00 | K1362: 239
A1363: U.S.A. | B1363: WEST | C1363: EDUCATION | D1363: OFFICE | E1363: CHAIR | F1363: 2 | G1363: Jun | H1363: 1993 | I1363: 731.00 | J1363: 153.00 | K1363: -578
A1364: U.S.A. | B1364: WEST | C1364: EDUCATION | D1364: OFFICE | E1364: CHAIR | F1364: 3 | G1364: Jul | H1364: 1993 | I1364: 883.00 | J1364: 955.00 | K1364: 72
A1365: U.S.A. | B1365: WEST | C1365: EDUCATION | D1365: OFFICE | E1365: CHAIR | F1365: 3 | G1365: Aug | H1365: 1993 | I1365: 707.00 | J1365: 654.00 | K1365: -53
A1366: U.S.A. | B1366: WEST | C1366: EDUCATION | D1366: OFFICE | E1366: CHAIR | F1366: 3 | G1366: Sep | H1366: 1993 | I1366: 97.00 | J1366: 693.00 | K1366: 596
A1367: U.S.A. | B1367: WEST | C1367: EDUCATION | D1367: OFFICE | E1367: CHAIR | F1367: 4 | G1367: Oct | H1367: 1993 | I1367: 390.00 | J1367: 757.00 | K1367: 367
A1368: U.S.A. | B1368: WEST | C1368: EDUCATION | D1368: OFFICE | E1368: CHAIR | F1368: 4 | G1368: Nov | H1368: 1993 | I1368: 237.00 | J1368: 221.00 | K1368: -16
A1369: U.S.A. | B1369: WEST | C1369: EDUCATION | D1369: OFFICE | E1369: CHAIR | F1369: 4 | G1369: Dec | H1369: 1993 | I1369: 496.00 | J1369: 942.00 | K1369: 446
A1370: U.S.A. | B1370: WEST | C1370: EDUCATION | D1370: OFFICE | E1370: DESK | F1370: 1 | G1370: Jan | H1370: 1993 | I1370: 144.00 | J1370: 796.00 | K1370: 652
A1371: U.S.A. | B1371: WEST | C1371: EDUCATION | D1371: OFFICE | E1371: DESK | F1371: 1 | G1371: Feb | H1371: 1993 | I1371: 142.00 | J1371: 257.00 | K1371: 115
A1372: U.S.A. | B1372: WEST | C1372: EDUCATION | D1372: OFFICE | E1372: DESK | F1372: 1 | G1372: Mar | H1372: 1993 | I1372: 273.00 | J1372: 611.00 | K1372: 338
A1373: U.S.A. | B1373: WEST | C1373: EDUCATION | D1373: OFFICE | E1373: DESK | F1373: 2 | G1373: Apr | H1373: 1993 | I1373: 915.00 | J1373: 6.00 | K1373: -909
A1374: U.S.A. | B1374: WEST | C1374: EDUCATION | D1374: OFFICE | E1374: DESK | F1374: 2 | G1374: May | H1374: 1993 | I1374: 920.00 | J1374: 125.00 | K1374: -795
A1375: U.S.A. | B1375: WEST | C1375: EDUCATION | D1375: OFFICE | E1375: DESK | F1375: 2 | G1375: Jun | H1375: 1993 | I1375: 294.00 | J1375: 745.00 | K1375: 451
A1376: U.S.A. | B1376: WEST | C1376: EDUCATION | D1376: OFFICE | E1376: DESK | F1376: 3 | G1376: Jul | H1376: 1993 | I1376: 681.00 | J1376: 437.00 | K1376: -244
A1377: U.S.A. | B1377: WEST | C1377: EDUCATION | D1377: OFFICE | E1377: DESK | F1377: 3 | G1377: Aug | H1377: 1993 | I1377: 86.00 | J1377: 906.00 | K1377: 820
A1378: U.S.A. | B1378: WEST | C1378: EDUCATION | D1378: OFFICE | E1378: DESK | F1378: 3 | G1378: Sep | H1378: 1993 | I1378: 764.00 | J1378: 844.00 | K1378: 80
A1379: U.S.A. | B1379: WEST | C1379: EDUCATION | D1379: OFFICE | E1379: DESK | F1379: 4 | G1379: Oct | H1379: 1993 | I1379: 269.00 | J1379: 413.00 | K1379: 144
A1380: U.S.A. | B1380: WEST | C1380: EDUCATION | D1380: OFFICE | E1380: DESK | F1380: 4 | G1380: Nov | H1380: 1993 | I1380: 138.00 | J1380: 869.00 | K1380: 731
A1381: U.S.A. | B1381: WEST | C1381: EDUCATION | D1381: OFFICE | E1381: DESK | F1381: 4 | G1381: Dec | H1381: 1993 | I1381: 834.00 | J1381: 403.00 | K1381: -431
A1382: U.S.A. | B1382: WEST | C1382: EDUCATION | D1382: FURNITURE | E1382: SOFA | F1382: 1 | G1382: Jan | H1382: 1994 | I1382: 177.00 | J1382: 831.00 | K1382: 654
A1383: U.S.A. | B1383: WEST | C1383: EDUCATION | D1383: FURNITURE | E1383: SOFA | F1383: 1 | G1383: Feb | H1383: 1994 | I1383: 371.00 | J1383: 579.00 | K1383: 208
A1384: U.S.A. | B1384: WEST | C1384: EDUCATION | D1384: FURNITURE | E1384: SOFA | F1384: 1 | G1384: Mar | H1384: 1994 | I1384: 583.00 | J1384: 301.00 | K1384: -282
A1385: U.S.A. | B1385: WEST | C1385: EDUCATION | D1385: FURNITURE | E1385: SOFA | F1385: 2 | G1385: Apr | H1385: 1994 | I1385: 364.00 | J1385: 693.00 | K1385: 329
A1386: U.S.A. | B1386: WEST | C1386: EDUCATION | D1386: FURNITURE | E1386: SOFA | F1386: 2 | G1386: May | H1386: 1994 | I1386: 343.00 | J1386: 895.00 | K1386: 552
A1387: U.S.A. | B1387: WEST | C1387: EDUCATION | D1387: FURNITURE | E1387: SOFA | F1387: 2 | G1387: Jun | H1387: 1994 | I1387: 854.00 | J1387: 320.00 | K1387: -534
A1388: U.S.A. | B1388: WEST | C1388: EDUCATION | D1388: FURNITURE | E1388: SOFA | F1388: 3 | G1388: Jul | H1388: 1994 | I1388: 691.00 | J1388: 284.00 | K1388: -407
A1389: U.S.A. | B1389: WEST | C1389: EDUCATION | D1389: FURNITURE | E1389: SOFA | F1389: 3 | G1389: Aug | H1389: 1994 | I1389: 387.00 | J1389: 362.00 | K1389: -25
A1390: U.S.A. | B1390: WEST | C1390: EDUCATION | D1390: FURNITURE | E1390: SOFA | F1390: 3 | G1390: Sep | H1390: 1994 | I1390: 298.00 | J1390: 132.00 | K1390: -166
A1391: U.S.A. | B1391: WEST | C1391: EDUCATION | D1391: FURNITURE | E1391: SOFA | F1391: 4 | G1391: Oct | H1391: 1994 | I1391: 635.00 | J1391: 42.00 | K1391: -593
A1392: U.S.A. | B1392: WEST | C1392: EDUCATION | D1392: FURNITURE | E1392: SOFA | F1392: 4 | G1392: Nov | H1392: 1994 | I1392: 81.00 | J1392: 118.00 | K1392: 37
A1393: U.S.A. | B1393: WEST | C1393: EDUCATION | D1393: FURNITURE | E1393: SOFA | F1393: 4 | G1393: Dec | H1393: 1994 | I1393: 375.00 | J1393: 42.00 | K1393: -333
A1394: U.S.A. | B1394: WEST | C1394: EDUCATION | D1394: FURNITURE | E1394: BED | F1394: 1 | G1394: Jan | H1394: 1994 | I1394: 512.00 | J1394: 415.00 | K1394: -97
A1395: U.S.A. | B1395: WEST | C1395: EDUCATION | D1395: FURNITURE | E1395: BED | F1395: 1 | G1395: Feb | H1395: 1994 | I1395: 156.00 | J1395: 418.00 | K1395: 262
A1396: U.S.A. | B1396: WEST | C1396: EDUCATION | D1396: FURNITURE | E1396: BED | F1396: 1 | G1396: Mar | H1396: 1994 | I1396: 464.00 | J1396: 163.00 | K1396: -301
A1397: U.S.A. | B1397: WEST | C1397: EDUCATION | D1397: FURNITURE | E1397: BED | F1397: 2 | G1397: Apr | H1397: 1994 | I1397: 813.00 | J1397: 298.00 | K1397: -515
A1398: U.S.A. | B1398: WEST | C1398: EDUCATION | D1398: FURNITURE | E1398: BED | F1398: 2 | G1398: May | H1398: 1994 | I1398: 455.00 | J1398: 584.00 | K1398: 129
A1399: U.S.A. | B1399: WEST | C1399: EDUCATION | D1399: FURNITURE | E1399: BED | F1399: 2 | G1399: Jun | H1399: 1994 | I1399: 366.00 | J1399: 797.00 | K1399: 431
A1400: U.S.A. | B1400: WEST | C1400: EDUCATION | D1400: FURNITURE | E1400: BED | F1400: 3 | G1400: Jul | H1400: 1994 | I1400: 734.00 | J1400: 767.00 | K1400: 33
A1401: U.S.A. | B1401: WEST | C1401: EDUCATION | D1401: FURNITURE | E1401: BED | F1401: 3 | G1401: Aug | H1401: 1994 | I1401: 451.00 | J1401: 984.00 | K1401: 533
A1402: U.S.A. | B1402: WEST | C1402: EDUCATION | D1402: FURNITURE | E1402: BED | F1402: 3 | G1402: Sep | H1402: 1994 | I1402: 134.00 | J1402: 388.00 | K1402: 254
A1403: U.S.A. | B1403: WEST | C1403: EDUCATION | D1403: FURNITURE | E1403: BED | F1403: 4 | G1403: Oct | H1403: 1994 | I1403: 547.00 | J1403: 924.00 | K1403: 377
A1404: U.S.A. | B1404: WEST | C1404: EDUCATION | D1404: FURNITURE | E1404: BED | F1404: 4 | G1404: Nov | H1404: 1994 | I1404: 802.00 | J1404: 566.00 | K1404: -236
A1405: U.S.A. | B1405: WEST | C1405: EDUCATION | D1405: FURNITURE | E1405: BED | F1405: 4 | G1405: Dec | H1405: 1994 | I1405: 61.00 | J1405: 390.00 | K1405: 329
A1406: U.S.A. | B1406: WEST | C1406: EDUCATION | D1406: OFFICE | E1406: TABLE | F1406: 1 | G1406: Jan | H1406: 1994 | I1406: 248.00 | J1406: 361.00 | K1406: 113
A1407: U.S.A. | B1407: WEST | C1407: EDUCATION | D1407: OFFICE | E1407: TABLE | F1407: 1 | G1407: Feb | H1407: 1994 | I1407: 868.00 | J1407: 464.00 | K1407: -404
A1408: U.S.A. | B1408: WEST | C1408: EDUCATION | D1408: OFFICE | E1408: TABLE | F1408: 1 | G1408: Mar | H1408: 1994 | I1408: 841.00 | J1408: 681.00 | K1408: -160
A1409: U.S.A. | B1409: WEST | C1409: EDUCATION | D1409: OFFICE | E1409: TABLE | F1409: 2 | G1409: Apr | H1409: 1994 | I1409: 484.00 | J1409: 377.00 | K1409: -107
A1410: U.S.A. | B1410: WEST | C1410: EDUCATION | D1410: OFFICE | E1410: TABLE | F1410: 2 | G1410: May | H1410: 1994 | I1410: 986.00 | J1410: 222.00 | K1410: -764
A1411: U.S.A. | B1411: WEST | C1411: EDUCATION | D1411: OFFICE | E1411: TABLE | F1411: 2 | G1411: Jun | H1411: 1994 | I1411: 39.00 | J1411: 972.00 | K1411: 933
A1412: U.S.A. | B1412: WEST | C1412: EDUCATION | D1412: OFFICE | E1412: TABLE | F1412: 3 | G1412: Jul | H1412: 1994 | I1412: 930.00 | J1412: 56.00 | K1412: -874
A1413: U.S.A. | B1413: WEST | C1413: EDUCATION | D1413: OFFICE | E1413: TABLE | F1413: 3 | G1413: Aug | H1413: 1994 | I1413: 252.00 | J1413: 695.00 | K1413: 443
A1414: U.S.A. | B1414: WEST | C1414: EDUCATION | D1414: OFFICE | E1414: TABLE | F1414: 3 | G1414: Sep | H1414: 1994 | I1414: 794.00 | J1414: 908.00 | K1414: 114
A1415: U.S.A. | B1415: WEST | C1415: EDUCATION | D1415: OFFICE | E1415: TABLE | F1415: 4 | G1415: Oct | H1415: 1994 | I1415: 658.00 | J1415: 328.00 | K1415: -330
A1416: U.S.A. | B1416: WEST | C1416: EDUCATION | D1416: OFFICE | E1416: TABLE | F1416: 4 | G1416: Nov | H1416: 1994 | I1416: 139.00 | J1416: 891.00 | K1416: 752
A1417: U.S.A. | B1417: WEST | C1417: EDUCATION | D1417: OFFICE | E1417: TABLE | F1417: 4 | G1417: Dec | H1417: 1994 | I1417: 331.00 | J1417: 265.00 | K1417: -66
A1418: U.S.A. | B1418: WEST | C1418: EDUCATION | D1418: OFFICE | E1418: CHAIR | F1418: 1 | G1418: Jan | H1418: 1994 | I1418: 814.00 | J1418: 31.00 | K1418: -783
A1419: U.S.A. | B1419: WEST | C1419: EDUCATION | D1419: OFFICE | E1419: CHAIR | F1419: 1 | G1419: Feb | H1419: 1994 | I1419: 765.00 | J1419: 540.00 | K1419: -225
A1420: U.S.A. | B1420: WEST | C1420: EDUCATION | D1420: OFFICE | E1420: CHAIR | F1420: 1 | G1420: Mar | H1420: 1994 | I1420: 308.00 | J1420: 352.00 | K1420: 44
A1421: U.S.A. | B1421: WEST | C1421: EDUCATION | D1421: OFFICE | E1421: CHAIR | F1421: 2 | G1421: Apr | H1421: 1994 | I1421: 327.00 | J1421: 904.00 | K1421: 577
A1422: U.S.A. | B1422: WEST | C1422: EDUCATION | D1422: OFFICE | E1422: CHAIR | F1422: 2 | G1422: May | H1422: 1994 | I1422: 266.00 | J1422: 436.00 | K1422: 170
A1423: U.S.A. | B1423: WEST | C1423: EDUCATION | D1423: OFFICE | E1423: CHAIR | F1423: 2 | G1423: Jun | H1423: 1994 | I1423: 699.00 | J1423: 281.00 | K1423: -418
A1424: U.S.A. | B1424: WEST | C1424: EDUCATION | D1424: OFFICE | E1424: CHAIR | F1424: 3 | G1424: Jul | H1424: 1994 | I1424: 599.00 | J1424: 801.00 | K1424: 202
A1425: U.S.A. | B1425: WEST | C1425: EDUCATION | D1425: OFFICE | E1425: CHAIR | F1425: 3 | G1425: Aug | H1425: 1994 | I1425: 950.00 | J1425: 273.00 | K1425: -677
A1426: U.S.A. | B1426: WEST | C1426: EDUCATION | D1426: OFFICE | E1426: CHAIR | F1426: 3 | G1426: Sep | H1426: 1994 | I1426: 117.00 | J1426: 716.00 | K1426: 599
A1427: U.S.A. | B1427: WEST | C1427: EDUCATION | D1427: OFFICE | E1427: CHAIR | F1427: 4 | G1427: Oct | H1427: 1994 | I1427: 632.00 | J1427: 902.00 | K1427: 270
A1428: U.S.A. | B1428: WEST | C1428: EDUCATION | D1428: OFFICE | E1428: CHAIR | F1428: 4 | G1428: Nov | H1428: 1994 | I1428: 35.00 | J1428: 341.00 | K1428: 306
A1429: U.S.A. | B1429: WEST | C1429: EDUCATION | D1429: OFFICE | E1429: CHAIR | F1429: 4 | G1429: Dec | H1429: 1994 | I1429: 562.00 | J1429: 155.00 | K1429: -407
A1430: U.S.A. | B1430: WEST | C1430: EDUCATION | D1430: OFFICE | E1430: DESK | F1430: 1 | G1430: Jan | H1430: 1994 | I1430: 112.00 | J1430: 137.00 | K1430: 25
A1431: U.S.A. | B1431: WEST | C1431: EDUCATION | D1431: OFFICE | E1431: DESK | F1431: 1 | G1431: Feb | H1431: 1994 | I1431: 921.00 | J1431: 922.00 | K1431: 1
A1432: U.S.A. | B1432: WEST | C1432: EDUCATION | D1432: OFFICE | E1432: DESK | F1432: 1 | G1432: Mar | H1432: 1994 | I1432: 859.00 | J1432: 202.00 | K1432: -657
A1433: U.S.A. | B1433: WEST | C1433: EDUCATION | D1433: OFFICE | E1433: DESK | F1433: 2 | G1433: Apr | H1433: 1994 | I1433: 442.00 | J1433: 955.00 | K1433: 513
A1434: U.S.A. | B1434: WEST | C1434: EDUCATION | D1434: OFFICE | E1434: DESK | F1434: 2 | G1434: May | H1434: 1994 | I1434: 593.00 | J1434: 781.00 | K1434: 188
A1435: U.S.A. | B1435: WEST | C1435: EDUCATION | D1435: OFFICE | E1435: DESK | F1435: 2 | G1435: Jun | H1435: 1994 | I1435: 346.00 | J1435: 12.00 | K1435: -334
A1436: U.S.A. | B1436: WEST | C1436: EDUCATION | D1436: OFFICE | E1436: DESK | F1436: 3 | G1436: Jul | H1436: 1994 | I1436: 312.00 | J1436: 931.00 | K1436: 619
A1437: U.S.A. | B1437: WEST | C1437: EDUCATION | D1437: OFFICE | E1437: DESK | F1437: 3 | G1437: Aug | H1437: 1994 | I1437: 690.00 | J1437: 95.00 | K1437: -595
A1438: U.S.A. | B1438: WEST | C1438: EDUCATION | D1438: OFFICE | E1438: DESK | F1438: 3 | G1438: Sep | H1438: 1994 | I1438: 344.00 | J1438: 795.00 | K1438: 451
A1439: U.S.A. | B1439: WEST | C1439: EDUCATION | D1439: OFFICE | E1439: DESK | F1439: 4 | G1439: Oct | H1439: 1994 | I1439: 784.00 | J1439: 542.00 | K1439: -242
A1440: U.S.A. | B1440: WEST | C1440: EDUCATION | D1440: OFFICE | E1440: DESK | F1440: 4 | G1440: Nov | H1440: 1994 | I1440: 639.00 | J1440: 935.00 | K1440: 296
A1441: U.S.A. | B1441: WEST | C1441: EDUCATION | D1441: OFFICE | E1441: DESK | F1441: 4 | G1441: Dec | H1441: 1994 | I1441: 726.00 | J1441: 269.00 | K1441: -457
I1442: =SUBTOTAL(9,R[-1440]C:R[-1]C) -> 706295.00 | J1442: =SUBTOTAL(9,R[-1440]C:R[-1]C) -> 730337.00 | K1442: =SUBTOTAL(9,R[-1440]C:R[-1]C) -> 24042