Sheet: Canada
D1: Total Predicted Sales | E1: Total Actual Sales
A2: Region | B2: Division | C2: Product type | D2: 11081 | E2: 12483
A3: EAST | B3: CONSUMER | C3: FURNITURE
C4: OFFICE | D4: 21939 | E4: 16991
B5: EDUCATION | C5: FURNITURE | D5: 12972 | E5: 14467
C6: OFFICE | D6: 16434 | E6: 20189
B7: Division Total | D7: 62426 | E7: 64130
A8: WEST | B8: Division | C8: Product type | D8: 10286 | E8: 10380
B9: CONSUMER | C9: FURNITURE
C10: OFFICE | D10: 16042 | E10: 16371
B11: EDUCATION | C11: FURNITURE | D11: 12816 | E11: 11234
C12: OFFICE | D12: 17759 | E12: 18905
B13: Division Total | D13: 56903 | E13: 56890
A14: Grand Total | D14: 119329 | E14: 121020
A15: Country | B15: Region | C15: Division | D15: Product Type | E15: Product | F15: Quarter | G15: Month | H15: Year | I15: Predicted Sales | J15: Actual Sales | K15: Difference
A16: CANADA | B16: EAST | C16: CONSUMER | D16: FURNITURE | E16: SOFA | F16: 1 | G16: Jan | H16: 1993 | I16: 425.00 | J16: 5.00 | K16: RC[-1]-RC[-2] -> -420
A17: CANADA | B17: EAST | C17: CONSUMER | D17: FURNITURE | E17: SOFA | F17: 1 | G17: Feb | H17: 1993 | I17: 215.00 | J17: 164.00 | K17: RC[-1]-RC[-2] -> -51
A18: CANADA | B18: EAST | C18: CONSUMER | D18: FURNITURE | E18: SOFA | F18: 1 | G18: Mar | H18: 1993 | I18: 948.00 | J18: 422.00 | K18: RC[-1]-RC[-2] -> -526
A19: CANADA | B19: EAST | C19: CONSUMER | D19: FURNITURE | E19: SOFA | F19: 2 | G19: Apr | H19: 1993 | I19: 544.00 | J19: 424.00 | K19: RC[-1]-RC[-2] -> -120
A20: CANADA | B20: EAST | C20: CONSUMER | D20: FURNITURE | E20: SOFA | F20: 2 | G20: May | H20: 1993 | I20: 764.00 | J20: 854.00 | K20: RC[-1]-RC[-2] -> 90
A21: CANADA | B21: EAST | C21: CONSUMER | D21: FURNITURE | E21: SOFA | F21: 2 | G21: Jun | H21: 1993 | I21: 446.00 | J21: 168.00 | K21: RC[-1]-RC[-2] -> -278
A22: CANADA | B22: EAST | C22: CONSUMER | D22: FURNITURE | E22: SOFA | F22: 3 | G22: Jul | H22: 1993 | I22: 957.00 | J22: 8.00 | K22: RC[-1]-RC[-2] -> -949
A23: CANADA | B23: EAST | C23: CONSUMER | D23: FURNITURE | E23: SOFA | F23: 3 | G23: Aug | H23: 1993 | I23: 967.00 | J23: 748.00 | K23: RC[-1]-RC[-2] -> -219
A24: CANADA | B24: EAST | C24: CONSUMER | D24: FURNITURE | E24: SOFA | F24: 3 | G24: Sep | H24: 1993 | I24: 11.00 | J24: 682.00 | K24: RC[-1]-RC[-2] -> 671
A25: CANADA | B25: EAST | C25: CONSUMER | D25: FURNITURE | E25: SOFA | F25: 4 | G25: Oct | H25: 1993 | I25: 110.00 | J25: 300.00 | K25: RC[-1]-RC[-2] -> 190
A26: CANADA | B26: EAST | C26: CONSUMER | D26: FURNITURE | E26: SOFA | F26: 4 | G26: Nov | H26: 1993 | I26: 263.00 | J26: 672.00 | K26: RC[-1]-RC[-2] -> 409
A27: CANADA | B27: EAST | C27: CONSUMER | D27: FURNITURE | E27: SOFA | F27: 4 | G27: Dec | H27: 1993 | I27: 215.00 | J27: 894.00 | K27: RC[-1]-RC[-2] -> 679
A28: CANADA | B28: EAST | C28: CONSUMER | D28: FURNITURE | E28: BED | F28: 1 | G28: Jan | H28: 1993 | I28: 414.00 | J28: 284.00 | K28: RC[-1]-RC[-2] -> -130
A29: CANADA | B29: EAST | C29: CONSUMER | D29: FURNITURE | E29: BED | F29: 1 | G29: Feb | H29: 1993 | I29: 770.00 | J29: 705.00 | K29: RC[-1]-RC[-2] -> -65
A30: CANADA | B30: EAST | C30: CONSUMER | D30: FURNITURE | E30: BED | F30: 1 | G30: Mar | H30: 1993 | I30: 679.00 | J30: 737.00 | K30: RC[-1]-RC[-2] -> 58
A31: CANADA | B31: EAST | C31: CONSUMER | D31: FURNITURE | E31: BED | F31: 2 | G31: Apr | H31: 1993 | I31: 7.00 | J31: 745.00 | K31: RC[-1]-RC[-2] -> 738
A32: CANADA | B32: EAST | C32: CONSUMER | D32: FURNITURE | E32: BED | F32: 2 | G32: May | H32: 1993 | I32: 713.00 | J32: 633.00 | K32: RC[-1]-RC[-2] -> -80
A33: CANADA | B33: EAST | C33: CONSUMER | D33: FURNITURE | E33: BED | F33: 2 | G33: Jun | H33: 1993 | I33: 851.00 | J33: 983.00 | K33: RC[-1]-RC[-2] -> 132
A34: CANADA | B34: EAST | C34: CONSUMER | D34: FURNITURE | E34: BED | F34: 3 | G34: Jul | H34: 1993 | I34: 944.00 | J34: 591.00 | K34: RC[-1]-RC[-2] -> -353
A35: CANADA | B35: EAST | C35: CONSUMER | D35: FURNITURE | E35: BED | F35: 3 | G35: Aug | H35: 1993 | I35: 130.00 | J35: 42.00 | K35: RC[-1]-RC[-2] -> -88
A36: CANADA | B36: EAST | C36: CONSUMER | D36: FURNITURE | E36: BED | F36: 3 | G36: Sep | H36: 1993 | I36: 485.00 | J36: 771.00 | K36: RC[-1]-RC[-2] -> 286
A37: CANADA | B37: EAST | C37: CONSUMER | D37: FURNITURE | E37: BED | F37: 4 | G37: Oct | H37: 1993 | I37: 23.00 | J37: 465.00 | K37: RC[-1]-RC[-2] -> 442
A38: CANADA | B38: EAST | C38: CONSUMER | D38: FURNITURE | E38: BED | F38: 4 | G38: Nov | H38: 1993 | I38: 193.00 | J38: 296.00 | K38: RC[-1]-RC[-2] -> 103
A39: CANADA | B39: EAST | C39: CONSUMER | D39: FURNITURE | E39: BED | F39: 4 | G39: Dec | H39: 1993 | I39: 7.00 | J39: 890.00 | K39: RC[-1]-RC[-2] -> 883
A40: CANADA | B40: EAST | C40: CONSUMER | D40: OFFICE | E40: TABLE | F40: 1 | G40: Jan | H40: 1993 | I40: 807.00 | J40: 197.00 | K40: RC[-1]-RC[-2] -> -610
A41: CANADA | B41: EAST | C41: CONSUMER | D41: OFFICE | E41: TABLE | F41: 1 | G41: Feb | H41: 1993 | I41: 861.00 | J41: 51.00 | K41: RC[-1]-RC[-2] -> -810
A42: CANADA | B42: EAST | C42: CONSUMER | D42: OFFICE | E42: TABLE | F42: 1 | G42: Mar | H42: 1993 | I42: 873.00 | J42: 570.00 | K42: RC[-1]-RC[-2] -> -303
A43: CANADA | B43: EAST | C43: CONSUMER | D43: OFFICE | E43: TABLE | F43: 2 | G43: Apr | H43: 1993 | I43: 933.00 | J43: 423.00 | K43: RC[-1]-RC[-2] -> -510
A44: CANADA | B44: EAST | C44: CONSUMER | D44: OFFICE | E44: TABLE | F44: 2 | G44: May | H44: 1993 | I44: 355.00 | J44: 524.00 | K44: RC[-1]-RC[-2] -> 169
A45: CANADA | B45: EAST | C45: CONSUMER | D45: OFFICE | E45: TABLE | F45: 2 | G45: Jun | H45: 1993 | I45: 794.00 | J45: 416.00 | K45: RC[-1]-RC[-2] -> -378
A46: CANADA | B46: EAST | C46: CONSUMER | D46: OFFICE | E46: TABLE | F46: 3 | G46: Jul | H46: 1993 | I46: 645.00 | J46: 789.00 | K46: RC[-1]-RC[-2] -> 144
A47: CANADA | B47: EAST | C47: CONSUMER | D47: OFFICE | E47: TABLE | F47: 3 | G47: Aug | H47: 1993 | I47: 700.00 | J47: 551.00 | K47: RC[-1]-RC[-2] -> -149
A48: CANADA | B48: EAST | C48: CONSUMER | D48: OFFICE | E48: TABLE | F48: 3 | G48: Sep | H48: 1993 | I48: 831.00 | J48: 400.00 | K48: RC[-1]-RC[-2] -> -431
A49: CANADA | B49: EAST | C49: CONSUMER | D49: OFFICE | E49: TABLE | F49: 4 | G49: Oct | H49: 1993 | I49: 800.00 | J49: 361.00 | K49: RC[-1]-RC[-2] -> -439
A50: CANADA | B50: EAST | C50: CONSUMER | D50: OFFICE | E50: TABLE | F50: 4 | G50: Nov | H50: 1993 | I50: 830.00 | J50: 189.00 | K50: RC[-1]-RC[-2] -> -641
A51: CANADA | B51: EAST | C51: CONSUMER | D51: OFFICE | E51: TABLE | F51: 4 | G51: Dec | H51: 1993 | I51: 828.00 | J51: 554.00 | K51: RC[-1]-RC[-2] -> -274
A52: CANADA | B52: EAST | C52: CONSUMER | D52: OFFICE | E52: CHAIR | F52: 1 | G52: Jan | H52: 1993 | I52: 986.00 | J52: 401.00 | K52: RC[-1]-RC[-2] -> -585
A53: CANADA | B53: EAST | C53: CONSUMER | D53: OFFICE | E53: CHAIR | F53: 1 | G53: Feb | H53: 1993 | I53: 544.00 | J53: 181.00 | K53: RC[-1]-RC[-2] -> -363
A54: CANADA | B54: EAST | C54: CONSUMER | D54: OFFICE | E54: CHAIR | F54: 1 | G54: Mar | H54: 1993 | I54: 182.00 | J54: 995.00 | K54: RC[-1]-RC[-2] -> 813
A55: CANADA | B55: EAST | C55: CONSUMER | D55: OFFICE | E55: CHAIR | F55: 2 | G55: Apr | H55: 1993 | I55: 197.00 | J55: 120.00 | K55: RC[-1]-RC[-2] -> -77
A56: CANADA | B56: EAST | C56: CONSUMER | D56: OFFICE | E56: CHAIR | F56: 2 | G56: May | H56: 1993 | I56: 435.00 | J56: 119.00 | K56: RC[-1]-RC[-2] -> -316
A57: CANADA | B57: EAST | C57: CONSUMER | D57: OFFICE | E57: CHAIR | F57: 2 | G57: Jun | H57: 1993 | I57: 974.00 | J57: 319.00 | K57: RC[-1]-RC[-2] -> -655
A58: CANADA | B58: EAST | C58: CONSUMER | D58: OFFICE | E58: CHAIR | F58: 3 | G58: Jul | H58: 1993 | I58: 524.00 | J58: 333.00 | K58: RC[-1]-RC[-2] -> -191
A59: CANADA | B59: EAST | C59: CONSUMER | D59: OFFICE | E59: CHAIR | F59: 3 | G59: Aug | H59: 1993 | I59: 688.00 | J59: 923.00 | K59: RC[-1]-RC[-2] -> 235
A60: CANADA | B60: EAST | C60: CONSUMER | D60: OFFICE | E60: CHAIR | F60: 3 | G60: Sep | H60: 1993 | I60: 750.00 | J60: 634.00 | K60: RC[-1]-RC[-2] -> -116
A61: CANADA | B61: EAST | C61: CONSUMER | D61: OFFICE | E61: CHAIR | F61: 4 | G61: Oct | H61: 1993 | I61: 155.00 | J61: 493.00 | K61: RC[-1]-RC[-2] -> 338
A62: CANADA | B62: EAST | C62: CONSUMER | D62: OFFICE | E62: CHAIR | F62: 4 | G62: Nov | H62: 1993 | I62: 860.00 | J62: 461.00 | K62: RC[-1]-RC[-2] -> -399
A63: CANADA | B63: EAST | C63: CONSUMER | D63: OFFICE | E63: CHAIR | F63: 4 | G63: Dec | H63: 1993 | I63: 102.00 | J63: 304.00 | K63: RC[-1]-RC[-2] -> 202
A64: CANADA | B64: EAST | C64: CONSUMER | D64: OFFICE | E64: DESK | F64: 1 | G64: Jan | H64: 1993 | I64: 225.00 | J64: 973.00 | K64: RC[-1]-RC[-2] -> 748
A65: CANADA | B65: EAST | C65: CONSUMER | D65: OFFICE | E65: DESK | F65: 1 | G65: Feb | H65: 1993 | I65: 402.00 | J65: 511.00 | K65: RC[-1]-RC[-2] -> 109
A66: CANADA | B66: EAST | C66: CONSUMER | D66: OFFICE | E66: DESK | F66: 1 | G66: Mar | H66: 1993 | I66: 697.00 | J66: 30.00 | K66: RC[-1]-RC[-2] -> -667
A67: CANADA | B67: EAST | C67: CONSUMER | D67: OFFICE | E67: DESK | F67: 2 | G67: Apr | H67: 1993 | I67: 567.00 | J67: 895.00 | K67: RC[-1]-RC[-2] -> 328
A68: CANADA | B68: EAST | C68: CONSUMER | D68: OFFICE | E68: DESK | F68: 2 | G68: May | H68: 1993 | I68: 231.00 | J68: 557.00 | K68: RC[-1]-RC[-2] -> 326
A69: CANADA | B69: EAST | C69: CONSUMER | D69: OFFICE | E69: DESK | F69: 2 | G69: Jun | H69: 1993 | I69: 372.00 | J69: 282.00 | K69: RC[-1]-RC[-2] -> -90
A70: CANADA | B70: EAST | C70: CONSUMER | D70: OFFICE | E70: DESK | F70: 3 | G70: Jul | H70: 1993 | I70: 15.00 | J70: 909.00 | K70: RC[-1]-RC[-2] -> 894
A71: CANADA | B71: EAST | C71: CONSUMER | D71: OFFICE | E71: DESK | F71: 3 | G71: Aug | H71: 1993 | I71: 866.00 | J71: 276.00 | K71: RC[-1]-RC[-2] -> -590
A72: CANADA | B72: EAST | C72: CONSUMER | D72: OFFICE | E72: DESK | F72: 3 | G72: Sep | H72: 1993 | I72: 452.00 | J72: 234.00 | K72: RC[-1]-RC[-2] -> -218
A73: CANADA | B73: EAST | C73: CONSUMER | D73: OFFICE | E73: DESK | F73: 4 | G73: Oct | H73: 1993 | I73: 663.00 | J73: 479.00 | K73: RC[-1]-RC[-2] -> -184
A74: CANADA | B74: EAST | C74: CONSUMER | D74: OFFICE | E74: DESK | F74: 4 | G74: Nov | H74: 1993 | I74: 982.00 | J74: 782.00 | K74: RC[-1]-RC[-2] -> -200
A75: CANADA | B75: EAST | C75: CONSUMER | D75: OFFICE | E75: DESK | F75: 4 | G75: Dec | H75: 1993 | I75: 813.00 | J75: 755.00 | K75: RC[-1]-RC[-2] -> -58
A76: CANADA | B76: EAST | C76: EDUCATION | D76: FURNITURE | E76: SOFA | F76: 1 | G76: Jan | H76: 1993 | I76: 850.00 | J76: 925.00 | K76: RC[-1]-RC[-2] -> 75
A77: CANADA | B77: EAST | C77: EDUCATION | D77: FURNITURE | E77: SOFA | F77: 1 | G77: Feb | H77: 1993 | I77: 297.00 | J77: 999.00 | K77: RC[-1]-RC[-2] -> 702
A78: CANADA | B78: EAST | C78: EDUCATION | D78: FURNITURE | E78: SOFA | F78: 1 | G78: Mar | H78: 1993 | I78: 846.00 | J78: 608.00 | K78: RC[-1]-RC[-2] -> -238
A79: CANADA | B79: EAST | C79: EDUCATION | D79: FURNITURE | E79: SOFA | F79: 2 | G79: Apr | H79: 1993 | I79: 533.00 | J79: 642.00 | K79: RC[-1]-RC[-2] -> 109
A80: CANADA | B80: EAST | C80: EDUCATION | D80: FURNITURE | E80: SOFA | F80: 2 | G80: May | H80: 1993 | I80: 646.00 | J80: 656.00 | K80: RC[-1]-RC[-2] -> 10
A81: CANADA | B81: EAST | C81: EDUCATION | D81: FURNITURE | E81: SOFA | F81: 2 | G81: Jun | H81: 1993 | I81: 486.00 | J81: 948.00 | K81: RC[-1]-RC[-2] -> 462
A82: CANADA | B82: EAST | C82: EDUCATION | D82: FURNITURE | E82: SOFA | F82: 3 | G82: Jul | H82: 1993 | I82: 717.00 | J82: 612.00 | K82: RC[-1]-RC[-2] -> -105
A83: CANADA | B83: EAST | C83: EDUCATION | D83: FURNITURE | E83: SOFA | F83: 3 | G83: Aug | H83: 1993 | I83: 564.00 | J83: 114.00 | K83: RC[-1]-RC[-2] -> -450
A84: CANADA | B84: EAST | C84: EDUCATION | D84: FURNITURE | E84: SOFA | F84: 3 | G84: Sep | H84: 1993 | I84: 230.00 | J84: 685.00 | K84: RC[-1]-RC[-2] -> 455
A85: CANADA | B85: EAST | C85: EDUCATION | D85: FURNITURE | E85: SOFA | F85: 4 | G85: Oct | H85: 1993 | I85: 494.00 | J85: 657.00 | K85: RC[-1]-RC[-2] -> 163
A86: CANADA | B86: EAST | C86: EDUCATION | D86: FURNITURE | E86: SOFA | F86: 4 | G86: Nov | H86: 1993 | I86: 903.00 | J86: 608.00 | K86: RC[-1]-RC[-2] -> -295
A87: CANADA | B87: EAST | C87: EDUCATION | D87: FURNITURE | E87: SOFA | F87: 4 | G87: Dec | H87: 1993 | I87: 266.00 | J87: 353.00 | K87: RC[-1]-RC[-2] -> 87
A88: CANADA | B88: EAST | C88: EDUCATION | D88: FURNITURE | E88: BED | F88: 1 | G88: Jan | H88: 1993 | I88: 585.00 | J88: 220.00 | K88: RC[-1]-RC[-2] -> -365
A89: CANADA | B89: EAST | C89: EDUCATION | D89: FURNITURE | E89: BED | F89: 1 | G89: Feb | H89: 1993 | I89: 267.00 | J89: 444.00 | K89: RC[-1]-RC[-2] -> 177
A90: CANADA | B90: EAST | C90: EDUCATION | D90: FURNITURE | E90: BED | F90: 1 | G90: Mar | H90: 1993 | I90: 487.00 | J90: 178.00 | K90: RC[-1]-RC[-2] -> -309
A91: CANADA | B91: EAST | C91: EDUCATION | D91: FURNITURE | E91: BED | F91: 2 | G91: Apr | H91: 1993 | I91: 764.00 | J91: 756.00 | K91: RC[-1]-RC[-2] -> -8
A92: CANADA | B92: EAST | C92: EDUCATION | D92: FURNITURE | E92: BED | F92: 2 | G92: May | H92: 1993 | I92: 312.00 | J92: 329.00 | K92: RC[-1]-RC[-2] -> 17
A93: CANADA | B93: EAST | C93: EDUCATION | D93: FURNITURE | E93: BED | F93: 2 | G93: Jun | H93: 1993 | I93: 531.00 | J93: 910.00 | K93: RC[-1]-RC[-2] -> 379
A94: CANADA | B94: EAST | C94: EDUCATION | D94: FURNITURE | E94: BED | F94: 3 | G94: Jul | H94: 1993 | I94: 536.00 | J94: 530.00 | K94: RC[-1]-RC[-2] -> -6
A95: CANADA | B95: EAST | C95: EDUCATION | D95: FURNITURE | E95: BED | F95: 3 | G95: Aug | H95: 1993 | I95: 773.00 | J95: 101.00 | K95: RC[-1]-RC[-2] -> -672
A96: CANADA | B96: EAST | C96: EDUCATION | D96: FURNITURE | E96: BED | F96: 3 | G96: Sep | H96: 1993 | I96: 143.00 | J96: 515.00 | K96: RC[-1]-RC[-2] -> 372
A97: CANADA | B97: EAST | C97: EDUCATION | D97: FURNITURE | E97: BED | F97: 4 | G97: Oct | H97: 1993 | I97: 126.00 | J97: 730.00 | K97: RC[-1]-RC[-2] -> 604
A98: CANADA | B98: EAST | C98: EDUCATION | D98: FURNITURE | E98: BED | F98: 4 | G98: Nov | H98: 1993 | I98: 862.00 | J98: 993.00 | K98: RC[-1]-RC[-2] -> 131
A99: CANADA | B99: EAST | C99: EDUCATION | D99: FURNITURE | E99: BED | F99: 4 | G99: Dec | H99: 1993 | I99: 754.00 | J99: 954.00 | K99: RC[-1]-RC[-2] -> 200
A100: CANADA | B100: EAST | C100: EDUCATION | D100: OFFICE | E100: TABLE | F100: 1 | G100: Jan | H100: 1993 | I100: 209.00 | J100: 688.00 | K100: RC[-1]-RC[-2] -> 479
A101: CANADA | B101: EAST | C101: EDUCATION | D101: OFFICE | E101: TABLE | F101: 1 | G101: Feb | H101: 1993 | I101: 51.00 | J101: 544.00 | K101: RC[-1]-RC[-2] -> 493
A102: CANADA | B102: EAST | C102: EDUCATION | D102: OFFICE | E102: TABLE | F102: 1 | G102: Mar | H102: 1993 | I102: 135.00 | J102: 954.00 | K102: RC[-1]-RC[-2] -> 819
A103: CANADA | B103: EAST | C103: EDUCATION | D103: OFFICE | E103: TABLE | F103: 2 | G103: Apr | H103: 1993 | I103: 47.00 | J103: 445.00 | K103: RC[-1]-RC[-2] -> 398
A104: CANADA | B104: EAST | C104: EDUCATION | D104: OFFICE | E104: TABLE | F104: 2 | G104: May | H104: 1993 | I104: 379.00 | J104: 829.00 | K104: RC[-1]-RC[-2] -> 450
A105: CANADA | B105: EAST | C105: EDUCATION | D105: OFFICE | E105: TABLE | F105: 2 | G105: Jun | H105: 1993 | I105: 758.00 | J105: 464.00 | K105: RC[-1]-RC[-2] -> -294
A106: CANADA | B106: EAST | C106: EDUCATION | D106: OFFICE | E106: TABLE | F106: 3 | G106: Jul | H106: 1993 | I106: 475.00 | J106: 968.00 | K106: RC[-1]-RC[-2] -> 493
A107: CANADA | B107: EAST | C107: EDUCATION | D107: OFFICE | E107: TABLE | F107: 3 | G107: Aug | H107: 1993 | I107: 343.00 | J107: 842.00 | K107: RC[-1]-RC[-2] -> 499
A108: CANADA | B108: EAST | C108: EDUCATION | D108: OFFICE | E108: TABLE | F108: 3 | G108: Sep | H108: 1993 | I108: 507.00 | J108: 721.00 | K108: RC[-1]-RC[-2] -> 214
A109: CANADA | B109: EAST | C109: EDUCATION | D109: OFFICE | E109: TABLE | F109: 4 | G109: Oct | H109: 1993 | I109: 269.00 | J109: 966.00 | K109: RC[-1]-RC[-2] -> 697
A110: CANADA | B110: EAST | C110: EDUCATION | D110: OFFICE | E110: TABLE | F110: 4 | G110: Nov | H110: 1993 | I110: 699.00 | J110: 332.00 | K110: RC[-1]-RC[-2] -> -367
A111: CANADA | B111: EAST | C111: EDUCATION | D111: OFFICE | E111: TABLE | F111: 4 | G111: Dec | H111: 1993 | I111: 824.00 | J111: 328.00 | K111: RC[-1]-RC[-2] -> -496
A112: CANADA | B112: EAST | C112: EDUCATION | D112: OFFICE | E112: CHAIR | F112: 1 | G112: Jan | H112: 1993 | I112: 282.00 | J112: 35.00 | K112: RC[-1]-RC[-2] -> -247
A113: CANADA | B113: EAST | C113: EDUCATION | D113: OFFICE | E113: CHAIR | F113: 1 | G113: Feb | H113: 1993 | I113: 538.00 | J113: 995.00 | K113: RC[-1]-RC[-2] -> 457
A114: CANADA | B114: EAST | C114: EDUCATION | D114: OFFICE | E114: CHAIR | F114: 1 | G114: Mar | H114: 1993 | I114: 679.00 | J114: 670.00 | K114: RC[-1]-RC[-2] -> -9
A115: CANADA | B115: EAST | C115: EDUCATION | D115: OFFICE | E115: CHAIR | F115: 2 | G115: Apr | H115: 1993 | I115: 601.00 | J115: 406.00 | K115: RC[-1]-RC[-2] -> -195
A116: CANADA | B116: EAST | C116: EDUCATION | D116: OFFICE | E116: CHAIR | F116: 2 | G116: May | H116: 1993 | I116: 577.00 | J116: 825.00 | K116: RC[-1]-RC[-2] -> 248
A117: CANADA | B117: EAST | C117: EDUCATION | D117: OFFICE | E117: CHAIR | F117: 2 | G117: Jun | H117: 1993 | I117: 908.00 | J117: 467.00 | K117: RC[-1]-RC[-2] -> -441
A118: CANADA | B118: EAST | C118: EDUCATION | D118: OFFICE | E118: CHAIR | F118: 3 | G118: Jul | H118: 1993 | I118: 819.00 | J118: 709.00 | K118: RC[-1]-RC[-2] -> -110
A119: CANADA | B119: EAST | C119: EDUCATION | D119: OFFICE | E119: CHAIR | F119: 3 | G119: Aug | H119: 1993 | I119: 687.00 | J119: 522.00 | K119: RC[-1]-RC[-2] -> -165
A120: CANADA | B120: EAST | C120: EDUCATION | D120: OFFICE | E120: CHAIR | F120: 3 | G120: Sep | H120: 1993 | I120: 157.00 | J120: 688.00 | K120: RC[-1]-RC[-2] -> 531
A121: CANADA | B121: EAST | C121: EDUCATION | D121: OFFICE | E121: CHAIR | F121: 4 | G121: Oct | H121: 1993 | I121: 111.00 | J121: 956.00 | K121: RC[-1]-RC[-2] -> 845
A122: CANADA | B122: EAST | C122: EDUCATION | D122: OFFICE | E122: CHAIR | F122: 4 | G122: Nov | H122: 1993 | I122: 31.00 | J122: 129.00 | K122: RC[-1]-RC[-2] -> 98
A123: CANADA | B123: EAST | C123: EDUCATION | D123: OFFICE | E123: CHAIR | F123: 4 | G123: Dec | H123: 1993 | I123: 790.00 | J123: 687.00 | K123: RC[-1]-RC[-2] -> -103
A124: CANADA | B124: EAST | C124: EDUCATION | D124: OFFICE | E124: DESK | F124: 1 | G124: Jan | H124: 1993 | I124: 386.00 | J124: 240.00 | K124: RC[-1]-RC[-2] -> -146
A125: CANADA | B125: EAST | C125: EDUCATION | D125: OFFICE | E125: DESK | F125: 1 | G125: Feb | H125: 1993 | I125: 113.00 | J125: 605.00 | K125: RC[-1]-RC[-2] -> 492
A126: CANADA | B126: EAST | C126: EDUCATION | D126: OFFICE | E126: DESK | F126: 1 | G126: Mar | H126: 1993 | I126: 68.00 | J126: 274.00 | K126: RC[-1]-RC[-2] -> 206
A127: CANADA | B127: EAST | C127: EDUCATION | D127: OFFICE | E127: DESK | F127: 2 | G127: Apr | H127: 1993 | I127: 885.00 | J127: 422.00 | K127: RC[-1]-RC[-2] -> -463
A128: CANADA | B128: EAST | C128: EDUCATION | D128: OFFICE | E128: DESK | F128: 2 | G128: May | H128: 1993 | I128: 575.00 | J128: 763.00 | K128: RC[-1]-RC[-2] -> 188
A129: CANADA | B129: EAST | C129: EDUCATION | D129: OFFICE | E129: DESK | F129: 2 | G129: Jun | H129: 1993 | I129: 743.00 | J129: 561.00 | K129: RC[-1]-RC[-2] -> -182
A130: CANADA | B130: EAST | C130: EDUCATION | D130: OFFICE | E130: DESK | F130: 3 | G130: Jul | H130: 1993 | I130: 816.00 | J130: 339.00 | K130: RC[-1]-RC[-2] -> -477
A131: CANADA | B131: EAST | C131: EDUCATION | D131: OFFICE | E131: DESK | F131: 3 | G131: Aug | H131: 1993 | I131: 203.00 | J131: 877.00 | K131: RC[-1]-RC[-2] -> 674
A132: CANADA | B132: EAST | C132: EDUCATION | D132: OFFICE | E132: DESK | F132: 3 | G132: Sep | H132: 1993 | I132: 581.00 | J132: 192.00 | K132: RC[-1]-RC[-2] -> -389
A133: CANADA | B133: EAST | C133: EDUCATION | D133: OFFICE | E133: DESK | F133: 4 | G133: Oct | H133: 1993 | I133: 815.00 | J133: 604.00 | K133: RC[-1]-RC[-2] -> -211
A134: CANADA | B134: EAST | C134: EDUCATION | D134: OFFICE | E134: DESK | F134: 4 | G134: Nov | H134: 1993 | I134: 333.00 | J134: 55.00 | K134: RC[-1]-RC[-2] -> -278
A135: CANADA | B135: EAST | C135: EDUCATION | D135: OFFICE | E135: DESK | F135: 4 | G135: Dec | H135: 1993 | I135: 40.00 | J135: 87.00 | K135: RC[-1]-RC[-2] -> 47
A136: CANADA | B136: WEST | C136: CONSUMER | D136: FURNITURE | E136: SOFA | F136: 1 | G136: Jan | H136: 1993 | I136: 730.00 | J136: 951.00 | K136: RC[-1]-RC[-2] -> 221
A137: CANADA | B137: WEST | C137: CONSUMER | D137: FURNITURE | E137: SOFA | F137: 1 | G137: Feb | H137: 1993 | I137: 408.00 | J137: 394.00 | K137: RC[-1]-RC[-2] -> -14
A138: CANADA | B138: WEST | C138: CONSUMER | D138: FURNITURE | E138: SOFA | F138: 1 | G138: Mar | H138: 1993 | I138: 982.00 | J138: 615.00 | K138: RC[-1]-RC[-2] -> -367
A139: CANADA | B139: WEST | C139: CONSUMER | D139: FURNITURE | E139: SOFA | F139: 2 | G139: Apr | H139: 1993 | I139: 499.00 | J139: 653.00 | K139: RC[-1]-RC[-2] -> 154
A140: CANADA | B140: WEST | C140: CONSUMER | D140: FURNITURE | E140: SOFA | F140: 2 | G140: May | H140: 1993 | I140: 307.00 | J140: 180.00 | K140: RC[-1]-RC[-2] -> -127
A141: CANADA | B141: WEST | C141: CONSUMER | D141: FURNITURE | E141: SOFA | F141: 2 | G141: Jun | H141: 1993 | I141: 741.00 | J141: 649.00 | K141: RC[-1]-RC[-2] -> -92
A142: CANADA | B142: WEST | C142: CONSUMER | D142: FURNITURE | E142: SOFA | F142: 3 | G142: Jul | H142: 1993 | I142: 640.00 | J142: 921.00 | K142: RC[-1]-RC[-2] -> 281
A143: CANADA | B143: WEST | C143: CONSUMER | D143: FURNITURE | E143: SOFA | F143: 3 | G143: Aug | H143: 1993 | I143: 300.00 | J143: 11.00 | K143: RC[-1]-RC[-2] -> -289
A144: CANADA | B144: WEST | C144: CONSUMER | D144: FURNITURE | E144: SOFA | F144: 3 | G144: Sep | H144: 1993 | I144: 929.00 | J144: 696.00 | K144: RC[-1]-RC[-2] -> -233
A145: CANADA | B145: WEST | C145: CONSUMER | D145: FURNITURE | E145: SOFA | F145: 4 | G145: Oct | H145: 1993 | I145: 309.00 | J145: 795.00 | K145: RC[-1]-RC[-2] -> 486
A146: CANADA | B146: WEST | C146: CONSUMER | D146: FURNITURE | E146: SOFA | F146: 4 | G146: Nov | H146: 1993 | I146: 340.00 | J146: 550.00 | K146: RC[-1]-RC[-2] -> 210
A147: CANADA | B147: WEST | C147: CONSUMER | D147: FURNITURE | E147: SOFA | F147: 4 | G147: Dec | H147: 1993 | I147: 228.00 | J147: 320.00 | K147: RC[-1]-RC[-2] -> 92
A148: CANADA | B148: WEST | C148: CONSUMER | D148: FURNITURE | E148: BED | F148: 1 | G148: Jan | H148: 1993 | I148: 570.00 | J148: 141.00 | K148: RC[-1]-RC[-2] -> -429
A149: CANADA | B149: WEST | C149: CONSUMER | D149: FURNITURE | E149: BED | F149: 1 | G149: Feb | H149: 1993 | I149: 375.00 | J149: 64.00 | K149: RC[-1]-RC[-2] -> -311
A150: CANADA | B150: WEST | C150: CONSUMER | D150: FURNITURE | E150: BED | F150: 1 | G150: Mar | H150: 1993 | I150: 298.00 | J150: 207.00 | K150: RC[-1]-RC[-2] -> -91
A151: CANADA | B151: WEST | C151: CONSUMER | D151: FURNITURE | E151: BED | F151: 2 | G151: Apr | H151: 1993 | I151: 32.00 | J151: 435.00 | K151: RC[-1]-RC[-2] -> 403
A152: CANADA | B152: WEST | C152: CONSUMER | D152: FURNITURE | E152: BED | F152: 2 | G152: May | H152: 1993 | I152: 760.00 | J152: 96.00 | K152: RC[-1]-RC[-2] -> -664
A153: CANADA | B153: WEST | C153: CONSUMER | D153: FURNITURE | E153: BED | F153: 2 | G153: Jun | H153: 1993 | I153: 338.00 | J153: 252.00 | K153: RC[-1]-RC[-2] -> -86
A154: CANADA | B154: WEST | C154: CONSUMER | D154: FURNITURE | E154: BED | F154: 3 | G154: Jul | H154: 1993 | I154: 149.00 | J154: 956.00 | K154: RC[-1]-RC[-2] -> 807
A155: CANADA | B155: WEST | C155: CONSUMER | D155: FURNITURE | E155: BED | F155: 3 | G155: Aug | H155: 1993 | I155: 343.00 | J155: 633.00 | K155: RC[-1]-RC[-2] -> 290
A156: CANADA | B156: WEST | C156: CONSUMER | D156: FURNITURE | E156: BED | F156: 3 | G156: Sep | H156: 1993 | I156: 151.00 | J156: 190.00 | K156: RC[-1]-RC[-2] -> 39
A157: CANADA | B157: WEST | C157: CONSUMER | D157: FURNITURE | E157: BED | F157: 4 | G157: Oct | H157: 1993 | I157: 44.00 | J157: 227.00 | K157: RC[-1]-RC[-2] -> 183
A158: CANADA | B158: WEST | C158: CONSUMER | D158: FURNITURE | E158: BED | F158: 4 | G158: Nov | H158: 1993 | I158: 583.00 | J158: 24.00 | K158: RC[-1]-RC[-2] -> -559
A159: CANADA | B159: WEST | C159: CONSUMER | D159: FURNITURE | E159: BED | F159: 4 | G159: Dec | H159: 1993 | I159: 230.00 | J159: 420.00 | K159: RC[-1]-RC[-2] -> 190
A160: CANADA | B160: WEST | C160: CONSUMER | D160: OFFICE | E160: TABLE | F160: 1 | G160: Jan | H160: 1993 | I160: 133.00 | J160: 795.00 | K160: RC[-1]-RC[-2] -> 662
A161: CANADA | B161: WEST | C161: CONSUMER | D161: OFFICE | E161: TABLE | F161: 1 | G161: Feb | H161: 1993 | I161: 273.00 | J161: 301.00 | K161: RC[-1]-RC[-2] -> 28
A162: CANADA | B162: WEST | C162: CONSUMER | D162: OFFICE | E162: TABLE | F162: 1 | G162: Mar | H162: 1993 | I162: 86.00 | J162: 304.00 | K162: RC[-1]-RC[-2] -> 218
A163: CANADA | B163: WEST | C163: CONSUMER | D163: OFFICE | E163: TABLE | F163: 2 | G163: Apr | H163: 1993 | I163: 400.00 | J163: 49.00 | K163: RC[-1]-RC[-2] -> -351
A164: CANADA | B164: WEST | C164: CONSUMER | D164: OFFICE | E164: TABLE | F164: 2 | G164: May | H164: 1993 | I164: 364.00 | J164: 576.00 | K164: RC[-1]-RC[-2] -> 212
A165: CANADA | B165: WEST | C165: CONSUMER | D165: OFFICE | E165: TABLE | F165: 2 | G165: Jun | H165: 1993 | I165: 63.00 | J165: 669.00 | K165: RC[-1]-RC[-2] -> 606
A166: CANADA | B166: WEST | C166: CONSUMER | D166: OFFICE | E166: TABLE | F166: 3 | G166: Jul | H166: 1993 | I166: 929.00 | J166: 325.00 | K166: RC[-1]-RC[-2] -> -604
A167: CANADA | B167: WEST | C167: CONSUMER | D167: OFFICE | E167: TABLE | F167: 3 | G167: Aug | H167: 1993 | I167: 344.00 | J167: 272.00 | K167: RC[-1]-RC[-2] -> -72
A168: CANADA | B168: WEST | C168: CONSUMER | D168: OFFICE | E168: TABLE | F168: 3 | G168: Sep | H168: 1993 | I168: 768.00 | J168: 80.00 | K168: RC[-1]-RC[-2] -> -688
A169: CANADA | B169: WEST | C169: CONSUMER | D169: OFFICE | E169: TABLE | F169: 4 | G169: Oct | H169: 1993 | I169: 668.00 | J169: 46.00 | K169: RC[-1]-RC[-2] -> -622
A170: CANADA | B170: WEST | C170: CONSUMER | D170: OFFICE | E170: TABLE | F170: 4 | G170: Nov | H170: 1993 | I170: 407.00 | J170: 223.00 | K170: RC[-1]-RC[-2] -> -184
A171: CANADA | B171: WEST | C171: CONSUMER | D171: OFFICE | E171: TABLE | F171: 4 | G171: Dec | H171: 1993 | I171: 536.00 | J171: 774.00 | K171: RC[-1]-RC[-2] -> 238
A172: CANADA | B172: WEST | C172: CONSUMER | D172: OFFICE | E172: CHAIR | F172: 1 | G172: Jan | H172: 1993 | I172: 445.00 | J172: 292.00 | K172: RC[-1]-RC[-2] -> -153
A173: CANADA | B173: WEST | C173: CONSUMER | D173: OFFICE | E173: CHAIR | F173: 1 | G173: Feb | H173: 1993 | I173: 632.00 | J173: 540.00 | K173: RC[-1]-RC[-2] -> -92
A174: CANADA | B174: WEST | C174: CONSUMER | D174: OFFICE | E174: CHAIR | F174: 1 | G174: Mar | H174: 1993 | I174: 855.00 | J174: 21.00 | K174: RC[-1]-RC[-2] -> -834
A175: CANADA | B175: WEST | C175: CONSUMER | D175: OFFICE | E175: CHAIR | F175: 2 | G175: Apr | H175: 1993 | I175: 36.00 | J175: 100.00 | K175: RC[-1]-RC[-2] -> 64
A176: CANADA | B176: WEST | C176: CONSUMER | D176: OFFICE | E176: CHAIR | F176: 2 | G176: May | H176: 1993 | I176: 250.00 | J176: 49.00 | K176: RC[-1]-RC[-2] -> -201
A177: CANADA | B177: WEST | C177: CONSUMER | D177: OFFICE | E177: CHAIR | F177: 2 | G177: Jun | H177: 1993 | I177: 427.00 | J177: 353.00 | K177: RC[-1]-RC[-2] -> -74
A178: CANADA | B178: WEST | C178: CONSUMER | D178: OFFICE | E178: CHAIR | F178: 3 | G178: Jul | H178: 1993 | I178: 367.00 | J178: 911.00 | K178: RC[-1]-RC[-2] -> 544
A179: CANADA | B179: WEST | C179: CONSUMER | D179: OFFICE | E179: CHAIR | F179: 3 | G179: Aug | H179: 1993 | I179: 245.00 | J179: 823.00 | K179: RC[-1]-RC[-2] -> 578
A180: CANADA | B180: WEST | C180: CONSUMER | D180: OFFICE | E180: CHAIR | F180: 3 | G180: Sep | H180: 1993 | I180: 893.00 | J180: 278.00 | K180: RC[-1]-RC[-2] -> -615
A181: CANADA | B181: WEST | C181: CONSUMER | D181: OFFICE | E181: CHAIR | F181: 4 | G181: Oct | H181: 1993 | I181: 490.00 | J181: 576.00 | K181: RC[-1]-RC[-2] -> 86
A182: CANADA | B182: WEST | C182: CONSUMER | D182: OFFICE | E182: CHAIR | F182: 4 | G182: Nov | H182: 1993 | I182: 88.00 | J182: 655.00 | K182: RC[-1]-RC[-2] -> 567
A183: CANADA | B183: WEST | C183: CONSUMER | D183: OFFICE | E183: CHAIR | F183: 4 | G183: Dec | H183: 1993 | I183: 964.00 | J183: 763.00 | K183: RC[-1]-RC[-2] -> -201
A184: CANADA | B184: WEST | C184: CONSUMER | D184: OFFICE | E184: DESK | F184: 1 | G184: Jan | H184: 1993 | I184: 873.00 | J184: 693.00 | K184: RC[-1]-RC[-2] -> -180
A185: CANADA | B185: WEST | C185: CONSUMER | D185: OFFICE | E185: DESK | F185: 1 | G185: Feb | H185: 1993 | I185: 459.00 | J185: 903.00 | K185: RC[-1]-RC[-2] -> 444
A186: CANADA | B186: WEST | C186: CONSUMER | D186: OFFICE | E186: DESK | F186: 1 | G186: Mar | H186: 1993 | I186: 224.00 | J186: 791.00 | K186: RC[-1]-RC[-2] -> 567
A187: CANADA | B187: WEST | C187: CONSUMER | D187: OFFICE | E187: DESK | F187: 2 | G187: Apr | H187: 1993 | I187: 562.00 | J187: 108.00 | K187: RC[-1]-RC[-2] -> -454
A188: CANADA | B188: WEST | C188: CONSUMER | D188: OFFICE | E188: DESK | F188: 2 | G188: May | H188: 1993 | I188: 199.00 | J188: 845.00 | K188: RC[-1]-RC[-2] -> 646
A189: CANADA | B189: WEST | C189: CONSUMER | D189: OFFICE | E189: DESK | F189: 2 | G189: Jun | H189: 1993 | I189: 275.00 | J189: 452.00 | K189: RC[-1]-RC[-2] -> 177
A190: CANADA | B190: WEST | C190: CONSUMER | D190: OFFICE | E190: DESK | F190: 3 | G190: Jul | H190: 1993 | I190: 355.00 | J190: 479.00 | K190: RC[-1]-RC[-2] -> 124
A191: CANADA | B191: WEST | C191: CONSUMER | D191: OFFICE | E191: DESK | F191: 3 | G191: Aug | H191: 1993 | I191: 947.00 | J191: 410.00 | K191: RC[-1]-RC[-2] -> -537
A192: CANADA | B192: WEST | C192: CONSUMER | D192: OFFICE | E192: DESK | F192: 3 | G192: Sep | H192: 1993 | I192: 454.00 | J192: 379.00 | K192: RC[-1]-RC[-2] -> -75
A193: CANADA | B193: WEST | C193: CONSUMER | D193: OFFICE | E193: DESK | F193: 4 | G193: Oct | H193: 1993 | I193: 450.00 | J193: 740.00 | K193: RC[-1]-RC[-2] -> 290
A194: CANADA | B194: WEST | C194: CONSUMER | D194: OFFICE | E194: DESK | F194: 4 | G194: Nov | H194: 1993 | I194: 575.00 | J194: 471.00 | K194: RC[-1]-RC[-2] -> -104
A195: CANADA | B195: WEST | C195: CONSUMER | D195: OFFICE | E195: DESK | F195: 4 | G195: Dec | H195: 1993 | I195: 6.00 | J195: 325.00 | K195: RC[-1]-RC[-2] -> 319
A196: CANADA | B196: WEST | C196: EDUCATION | D196: FURNITURE | E196: SOFA | F196: 1 | G196: Jan | H196: 1993 | I196: 421.00 | J196: 72.00 | K196: RC[-1]-RC[-2] -> -349
A197: CANADA | B197: WEST | C197: EDUCATION | D197: FURNITURE | E197: SOFA | F197: 1 | G197: Feb | H197: 1993 | I197: 433.00 | J197: 926.00 | K197: RC[-1]-RC[-2] -> 493
A198: CANADA | B198: WEST | C198: EDUCATION | D198: FURNITURE | E198: SOFA | F198: 1 | G198: Mar | H198: 1993 | I198: 394.00 | J198: 850.00 | K198: RC[-1]-RC[-2] -> 456
A199: CANADA | B199: WEST | C199: EDUCATION | D199: FURNITURE | E199: SOFA | F199: 2 | G199: Apr | H199: 1993 | I199: 338.00 | J199: 826.00 | K199: RC[-1]-RC[-2] -> 488
A200: CANADA | B200: WEST | C200: EDUCATION | D200: FURNITURE | E200: SOFA | F200: 2 | G200: May | H200: 1993 | I200: 764.00 | J200: 651.00 | K200: RC[-1]-RC[-2] -> -113
A201: CANADA | B201: WEST | C201: EDUCATION | D201: FURNITURE | E201: SOFA | F201: 2 | G201: Jun | H201: 1993 | I201: 216.00 | J201: 854.00 | K201: RC[-1]-RC[-2] -> 638
A202: CANADA | B202: WEST | C202: EDUCATION | D202: FURNITURE | E202: SOFA | F202: 3 | G202: Jul | H202: 1993 | I202: 96.00 | J202: 899.00 | K202: RC[-1]-RC[-2] -> 803
A203: CANADA | B203: WEST | C203: EDUCATION | D203: FURNITURE | E203: SOFA | F203: 3 | G203: Aug | H203: 1993 | I203: 550.00 | J203: 309.00 | K203: RC[-1]-RC[-2] -> -241
A204: CANADA | B204: WEST | C204: EDUCATION | D204: FURNITURE | E204: SOFA | F204: 3 | G204: Sep | H204: 1993 | I204: 636.00 | J204: 943.00 | K204: RC[-1]-RC[-2] -> 307
A205: CANADA | B205: WEST | C205: EDUCATION | D205: FURNITURE | E205: SOFA | F205: 4 | G205: Oct | H205: 1993 | I205: 427.00 | J205: 138.00 | K205: RC[-1]-RC[-2] -> -289
A206: CANADA | B206: WEST | C206: EDUCATION | D206: FURNITURE | E206: SOFA | F206: 4 | G206: Nov | H206: 1993 | I206: 652.00 | J206: 99.00 | K206: RC[-1]-RC[-2] -> -553
A207: CANADA | B207: WEST | C207: EDUCATION | D207: FURNITURE | E207: SOFA | F207: 4 | G207: Dec | H207: 1993 | I207: 478.00 | J207: 270.00 | K207: RC[-1]-RC[-2] -> -208
A208: CANADA | B208: WEST | C208: EDUCATION | D208: FURNITURE | E208: BED | F208: 1 | G208: Jan | H208: 1993 | I208: 305.00 | J208: 211.00 | K208: RC[-1]-RC[-2] -> -94
A209: CANADA | B209: WEST | C209: EDUCATION | D209: FURNITURE | E209: BED | F209: 1 | G209: Feb | H209: 1993 | I209: 318.00 | J209: 368.00 | K209: RC[-1]-RC[-2] -> 50
A210: CANADA | B210: WEST | C210: EDUCATION | D210: FURNITURE | E210: BED | F210: 1 | G210: Mar | H210: 1993 | I210: 417.00 | J210: 778.00 | K210: RC[-1]-RC[-2] -> 361
A211: CANADA | B211: WEST | C211: EDUCATION | D211: FURNITURE | E211: BED | F211: 2 | G211: Apr | H211: 1993 | I211: 623.00 | J211: 808.00 | K211: RC[-1]-RC[-2] -> 185
A212: CANADA | B212: WEST | C212: EDUCATION | D212: FURNITURE | E212: BED | F212: 2 | G212: May | H212: 1993 | I212: 761.00 | J212: 46.00 | K212: RC[-1]-RC[-2] -> -715
A213: CANADA | B213: WEST | C213: EDUCATION | D213: FURNITURE | E213: BED | F213: 2 | G213: Jun | H213: 1993 | I213: 272.00 | J213: 466.00 | K213: RC[-1]-RC[-2] -> 194
A214: CANADA | B214: WEST | C214: EDUCATION | D214: FURNITURE | E214: BED | F214: 3 | G214: Jul | H214: 1993 | I214: 988.00 | J214: 18.00 | K214: RC[-1]-RC[-2] -> -970
A215: CANADA | B215: WEST | C215: EDUCATION | D215: FURNITURE | E215: BED | F215: 3 | G215: Aug | H215: 1993 | I215: 821.00 | J215: 87.00 | K215: RC[-1]-RC[-2] -> -734
A216: CANADA | B216: WEST | C216: EDUCATION | D216: FURNITURE | E216: BED | F216: 3 | G216: Sep | H216: 1993 | I216: 962.00 | J216: 765.00 | K216: RC[-1]-RC[-2] -> -197
A217: CANADA | B217: WEST | C217: EDUCATION | D217: FURNITURE | E217: BED | F217: 4 | G217: Oct | H217: 1993 | I217: 615.00 | J217: 62.00 | K217: RC[-1]-RC[-2] -> -553
A218: CANADA | B218: WEST | C218: EDUCATION | D218: FURNITURE | E218: BED | F218: 4 | G218: Nov | H218: 1993 | I218: 523.00 | J218: 13.00 | K218: RC[-1]-RC[-2] -> -510
A219: CANADA | B219: WEST | C219: EDUCATION | D219: FURNITURE | E219: BED | F219: 4 | G219: Dec | H219: 1993 | I219: 806.00 | J219: 775.00 | K219: RC[-1]-RC[-2] -> -31
A220: CANADA | B220: WEST | C220: EDUCATION | D220: OFFICE | E220: TABLE | F220: 1 | G220: Jan | H220: 1993 | I220: 925.00 | J220: 155.00 | K220: RC[-1]-RC[-2] -> -770
A221: CANADA | B221: WEST | C221: EDUCATION | D221: OFFICE | E221: TABLE | F221: 1 | G221: Feb | H221: 1993 | I221: 395.00 | J221: 688.00 | K221: RC[-1]-RC[-2] -> 293
A222: CANADA | B222: WEST | C222: EDUCATION | D222: OFFICE | E222: TABLE | F222: 1 | G222: Mar | H222: 1993 | I222: 749.00 | J222: 730.00 | K222: RC[-1]-RC[-2] -> -19
A223: CANADA | B223: WEST | C223: EDUCATION | D223: OFFICE | E223: TABLE | F223: 2 | G223: Apr | H223: 1993 | I223: 279.00 | J223: 208.00 | K223: RC[-1]-RC[-2] -> -71
A224: CANADA | B224: WEST | C224: EDUCATION | D224: OFFICE | E224: TABLE | F224: 2 | G224: May | H224: 1993 | I224: 288.00 | J224: 525.00 | K224: RC[-1]-RC[-2] -> 237
A225: CANADA | B225: WEST | C225: EDUCATION | D225: OFFICE | E225: TABLE | F225: 2 | G225: Jun | H225: 1993 | I225: 509.00 | J225: 483.00 | K225: RC[-1]-RC[-2] -> -26
A226: CANADA | B226: WEST | C226: EDUCATION | D226: OFFICE | E226: TABLE | F226: 3 | G226: Jul | H226: 1993 | I226: 255.00 | J226: 748.00 | K226: RC[-1]-RC[-2] -> 493
A227: CANADA | B227: WEST | C227: EDUCATION | D227: OFFICE | E227: TABLE | F227: 3 | G227: Aug | H227: 1993 | I227: 214.00 | J227: 6.00 | K227: RC[-1]-RC[-2] -> -208
A228: CANADA | B228: WEST | C228: EDUCATION | D228: OFFICE | E228: TABLE | F228: 3 | G228: Sep | H228: 1993 | I228: 473.00 | J228: 168.00 | K228: RC[-1]-RC[-2] -> -305
A229: CANADA | B229: WEST | C229: EDUCATION | D229: OFFICE | E229: TABLE | F229: 4 | G229: Oct | H229: 1993 | I229: 702.00 | J229: 301.00 | K229: RC[-1]-RC[-2] -> -401
A230: CANADA | B230: WEST | C230: EDUCATION | D230: OFFICE | E230: TABLE | F230: 4 | G230: Nov | H230: 1993 | I230: 814.00 | J230: 9.00 | K230: RC[-1]-RC[-2] -> -805
A231: CANADA | B231: WEST | C231: EDUCATION | D231: OFFICE | E231: TABLE | F231: 4 | G231: Dec | H231: 1993 | I231: 231.00 | J231: 778.00 | K231: RC[-1]-RC[-2] -> 547
A232: CANADA | B232: WEST | C232: EDUCATION | D232: OFFICE | E232: CHAIR | F232: 1 | G232: Jan | H232: 1993 | I232: 555.00 | J232: 251.00 | K232: RC[-1]-RC[-2] -> -304
A233: CANADA | B233: WEST | C233: EDUCATION | D233: OFFICE | E233: CHAIR | F233: 1 | G233: Feb | H233: 1993 | I233: 455.00 | J233: 607.00 | K233: RC[-1]-RC[-2] -> 152
A234: CANADA | B234: WEST | C234: EDUCATION | D234: OFFICE | E234: CHAIR | F234: 1 | G234: Mar | H234: 1993 | I234: 888.00 | J234: 127.00 | K234: RC[-1]-RC[-2] -> -761
A235: CANADA | B235: WEST | C235: EDUCATION | D235: OFFICE | E235: CHAIR | F235: 2 | G235: Apr | H235: 1993 | I235: 652.00 | J235: 513.00 | K235: RC[-1]-RC[-2] -> -139
A236: CANADA | B236: WEST | C236: EDUCATION | D236: OFFICE | E236: CHAIR | F236: 2 | G236: May | H236: 1993 | I236: 799.00 | J236: 146.00 | K236: RC[-1]-RC[-2] -> -653
A237: CANADA | B237: WEST | C237: EDUCATION | D237: OFFICE | E237: CHAIR | F237: 2 | G237: Jun | H237: 1993 | I237: 249.00 | J237: 917.00 | K237: RC[-1]-RC[-2] -> 668
A238: CANADA | B238: WEST | C238: EDUCATION | D238: OFFICE | E238: CHAIR | F238: 3 | G238: Jul | H238: 1993 | I238: 539.00 | J238: 776.00 | K238: RC[-1]-RC[-2] -> 237
A239: CANADA | B239: WEST | C239: EDUCATION | D239: OFFICE | E239: CHAIR | F239: 3 | G239: Aug | H239: 1993 | I239: 198.00 | J239: 330.00 | K239: RC[-1]-RC[-2] -> 132
A240: CANADA | B240: WEST | C240: EDUCATION | D240: OFFICE | E240: CHAIR | F240: 3 | G240: Sep | H240: 1993 | I240: 340.00 | J240: 981.00 | K240: RC[-1]-RC[-2] -> 641
A241: CANADA | B241: WEST | C241: EDUCATION | D241: OFFICE | E241: CHAIR | F241: 4 | G241: Oct | H241: 1993 | I241: 152.00 | J241: 862.00 | K241: RC[-1]-RC[-2] -> 710
A242: CANADA | B242: WEST | C242: EDUCATION | D242: OFFICE | E242: CHAIR | F242: 4 | G242: Nov | H242: 1993 | I242: 347.00 | J242: 612.00 | K242: RC[-1]-RC[-2] -> 265
A243: CANADA | B243: WEST | C243: EDUCATION | D243: OFFICE | E243: CHAIR | F243: 4 | G243: Dec | H243: 1993 | I243: 565.00 | J243: 607.00 | K243: RC[-1]-RC[-2] -> 42
A244: CANADA | B244: WEST | C244: EDUCATION | D244: OFFICE | E244: DESK | F244: 1 | G244: Jan | H244: 1993 | I244: 363.00 | J244: 586.00 | K244: RC[-1]-RC[-2] -> 223
A245: CANADA | B245: WEST | C245: EDUCATION | D245: OFFICE | E245: DESK | F245: 1 | G245: Feb | H245: 1993 | I245: 910.00 | J245: 441.00 | K245: RC[-1]-RC[-2] -> -469
A246: CANADA | B246: WEST | C246: EDUCATION | D246: OFFICE | E246: DESK | F246: 1 | G246: Mar | H246: 1993 | I246: 998.00 | J246: 597.00 | K246: RC[-1]-RC[-2] -> -401
A247: CANADA | B247: WEST | C247: EDUCATION | D247: OFFICE | E247: DESK | F247: 2 | G247: Apr | H247: 1993 | I247: 95.00 | J247: 717.00 | K247: RC[-1]-RC[-2] -> 622
A248: CANADA | B248: WEST | C248: EDUCATION | D248: OFFICE | E248: DESK | F248: 2 | G248: May | H248: 1993 | I248: 731.00 | J248: 713.00 | K248: RC[-1]-RC[-2] -> -18
A249: CANADA | B249: WEST | C249: EDUCATION | D249: OFFICE | E249: DESK | F249: 2 | G249: Jun | H249: 1993 | I249: 718.00 | J249: 591.00 | K249: RC[-1]-RC[-2] -> -127
A250: CANADA | B250: WEST | C250: EDUCATION | D250: OFFICE | E250: DESK | F250: 3 | G250: Jul | H250: 1993 | I250: 467.00 | J250: 492.00 | K250: RC[-1]-RC[-2] -> 25
A251: CANADA | B251: WEST | C251: EDUCATION | D251: OFFICE | E251: DESK | F251: 3 | G251: Aug | H251: 1993 | I251: 126.00 | J251: 170.00 | K251: RC[-1]-RC[-2] -> 44
A252: CANADA | B252: WEST | C252: EDUCATION | D252: OFFICE | E252: DESK | F252: 3 | G252: Sep | H252: 1993 | I252: 127.00 | J252: 684.00 | K252: RC[-1]-RC[-2] -> 557
A253: CANADA | B253: WEST | C253: EDUCATION | D253: OFFICE | E253: DESK | F253: 4 | G253: Oct | H253: 1993 | I253: 746.00 | J253: 981.00 | K253: RC[-1]-RC[-2] -> 235
A254: CANADA | B254: WEST | C254: EDUCATION | D254: OFFICE | E254: DESK | F254: 4 | G254: Nov | H254: 1993 | I254: 878.00 | J254: 966.00 | K254: RC[-1]-RC[-2] -> 88
A255: CANADA | B255: WEST | C255: EDUCATION | D255: OFFICE | E255: DESK | F255: 4 | G255: Dec | H255: 1993 | I255: 27.00 | J255: 439.00 | K255: RC[-1]-RC[-2] -> 412
I256: =SUBTOTAL(9,R[-240]C:R[-1]C) -> 119329.00 | J256: =SUBTOTAL(9,R[-240]C:R[-1]C) -> 121020.00 | K256: RC[-1]-RC[-2] -> 1691

Sheet: Germany
D1: Total Predicted Sales | E1: Total Actual Sales
A2: Region | B2: Division | C2: Product type | D2: 12866 | E2: 13040
A3: EAST | B3: CONSUMER | C3: FURNITURE
C4: OFFICE | D4: 16812 | E4: 18208
B5: EDUCATION | C5: FURNITURE | D5: 12817 | E5: 13228
C6: OFFICE | D6: 17428 | E6: 18696
B7: Division Total | D7: 59923 | E7: 63172
A8: WEST | B8: Division | C8: Product type | D8: 11532 | E8: 15364
B9: CONSUMER | C9: FURNITURE
C10: OFFICE | D10: 14322 | E10: 17470
B11: EDUCATION | C11: FURNITURE | D11: 12865 | E11: 12614
C12: OFFICE | D12: 18477 | E12: 18784
B13: Division Total | D13: 57196 | E13: 64232
A14: Grand Total | D14: 117119 | E14: 127404
A15: Country | B15: Region | C15: Division | D15: Product Type | E15: Product | F15: Quarter | G15: Month | H15: Year | I15: Predicted Sales | J15: Actual Sales | K15: Difference
A16: GERMANY | B16: EAST | C16: CONSUMER | D16: FURNITURE | E16: SOFA | F16: 1 | G16: Jan | H16: 1993 | I16: 874.00 | J16: 873.00 | K16: RC[-1]-RC[-2] -> -1
A17: GERMANY | B17: EAST | C17: CONSUMER | D17: FURNITURE | E17: SOFA | F17: 1 | G17: Feb | H17: 1993 | I17: 578.00 | J17: 498.00 | K17: RC[-1]-RC[-2] -> -80
A18: GERMANY | B18: EAST | C18: CONSUMER | D18: FURNITURE | E18: SOFA | F18: 1 | G18: Mar | H18: 1993 | I18: 768.00 | J18: 808.00 | K18: RC[-1]-RC[-2] -> 40
A19: GERMANY | B19: EAST | C19: CONSUMER | D19: FURNITURE | E19: SOFA | F19: 2 | G19: Apr | H19: 1993 | I19: 178.00 | J19: 742.00 | K19: RC[-1]-RC[-2] -> 564
A20: GERMANY | B20: EAST | C20: CONSUMER | D20: FURNITURE | E20: SOFA | F20: 2 | G20: May | H20: 1993 | I20: 916.00 | J20: 744.00 | K20: RC[-1]-RC[-2] -> -172
A21: GERMANY | B21: EAST | C21: CONSUMER | D21: FURNITURE | E21: SOFA | F21: 2 | G21: Jun | H21: 1993 | I21: 917.00 | J21: 30.00 | K21: RC[-1]-RC[-2] -> -887
A22: GERMANY | B22: EAST | C22: CONSUMER | D22: FURNITURE | E22: SOFA | F22: 3 | G22: Jul | H22: 1993 | I22: 633.00 | J22: 747.00 | K22: RC[-1]-RC[-2] -> 114
A23: GERMANY | B23: EAST | C23: CONSUMER | D23: FURNITURE | E23: SOFA | F23: 3 | G23: Aug | H23: 1993 | I23: 107.00 | J23: 672.00 | K23: RC[-1]-RC[-2] -> 565
A24: GERMANY | B24: EAST | C24: CONSUMER | D24: FURNITURE | E24: SOFA | F24: 3 | G24: Sep | H24: 1993 | I24: 523.00 | J24: 564.00 | K24: RC[-1]-RC[-2] -> 41
A25: GERMANY | B25: EAST | C25: CONSUMER | D25: FURNITURE | E25: SOFA | F25: 4 | G25: Oct | H25: 1993 | I25: 924.00 | J25: 785.00 | K25: RC[-1]-RC[-2] -> -139
A26: GERMANY | B26: EAST | C26: CONSUMER | D26: FURNITURE | E26: SOFA | F26: 4 | G26: Nov | H26: 1993 | I26: 481.00 | J26: 825.00 | K26: RC[-1]-RC[-2] -> 344
A27: GERMANY | B27: EAST | C27: CONSUMER | D27: FURNITURE | E27: SOFA | F27: 4 | G27: Dec | H27: 1993 | I27: 240.00 | J27: 243.00 | K27: RC[-1]-RC[-2] -> 3
A28: GERMANY | B28: EAST | C28: CONSUMER | D28: FURNITURE | E28: BED | F28: 1 | G28: Jan | H28: 1993 | I28: 232.00 | J28: 143.00 | K28: RC[-1]-RC[-2] -> -89
A29: GERMANY | B29: EAST | C29: CONSUMER | D29: FURNITURE | E29: BED | F29: 1 | G29: Feb | H29: 1993 | I29: 993.00 | J29: 15.00 | K29: RC[-1]-RC[-2] -> -978
A30: GERMANY | B30: EAST | C30: CONSUMER | D30: FURNITURE | E30: BED | F30: 1 | G30: Mar | H30: 1993 | I30: 652.00 | J30: 742.00 | K30: RC[-1]-RC[-2] -> 90
A31: GERMANY | B31: EAST | C31: CONSUMER | D31: FURNITURE | E31: BED | F31: 2 | G31: Apr | H31: 1993 | I31: 761.00 | J31: 339.00 | K31: RC[-1]-RC[-2] -> -422
A32: GERMANY | B32: EAST | C32: CONSUMER | D32: FURNITURE | E32: BED | F32: 2 | G32: May | H32: 1993 | I32: 428.00 | J32: 39.00 | K32: RC[-1]-RC[-2] -> -389
A33: GERMANY | B33: EAST | C33: CONSUMER | D33: FURNITURE | E33: BED | F33: 2 | G33: Jun | H33: 1993 | I33: 4.00 | J33: 465.00 | K33: RC[-1]-RC[-2] -> 461
A34: GERMANY | B34: EAST | C34: CONSUMER | D34: FURNITURE | E34: BED | F34: 3 | G34: Jul | H34: 1993 | I34: 101.00 | J34: 889.00 | K34: RC[-1]-RC[-2] -> 788
A35: GERMANY | B35: EAST | C35: CONSUMER | D35: FURNITURE | E35: BED | F35: 3 | G35: Aug | H35: 1993 | I35: 869.00 | J35: 856.00 | K35: RC[-1]-RC[-2] -> -13
A36: GERMANY | B36: EAST | C36: CONSUMER | D36: FURNITURE | E36: BED | F36: 3 | G36: Sep | H36: 1993 | I36: 271.00 | J36: 358.00 | K36: RC[-1]-RC[-2] -> 87
A37: GERMANY | B37: EAST | C37: CONSUMER | D37: FURNITURE | E37: BED | F37: 4 | G37: Oct | H37: 1993 | I37: 633.00 | J37: 452.00 | K37: RC[-1]-RC[-2] -> -181
A38: GERMANY | B38: EAST | C38: CONSUMER | D38: FURNITURE | E38: BED | F38: 4 | G38: Nov | H38: 1993 | I38: 481.00 | J38: 387.00 | K38: RC[-1]-RC[-2] -> -94
A39: GERMANY | B39: EAST | C39: CONSUMER | D39: FURNITURE | E39: BED | F39: 4 | G39: Dec | H39: 1993 | I39: 302.00 | J39: 824.00 | K39: RC[-1]-RC[-2] -> 522
A40: GERMANY | B40: EAST | C40: CONSUMER | D40: OFFICE | E40: TABLE | F40: 1 | G40: Jan | H40: 1993 | I40: 982.00 | J40: 166.00 | K40: RC[-1]-RC[-2] -> -816
A41: GERMANY | B41: EAST | C41: CONSUMER | D41: OFFICE | E41: TABLE | F41: 1 | G41: Feb | H41: 1993 | I41: 614.00 | J41: 531.00 | K41: RC[-1]-RC[-2] -> -83
A42: GERMANY | B42: EAST | C42: CONSUMER | D42: OFFICE | E42: TABLE | F42: 1 | G42: Mar | H42: 1993 | I42: 839.00 | J42: 963.00 | K42: RC[-1]-RC[-2] -> 124
A43: GERMANY | B43: EAST | C43: CONSUMER | D43: OFFICE | E43: TABLE | F43: 2 | G43: Apr | H43: 1993 | I43: 388.00 | J43: 994.00 | K43: RC[-1]-RC[-2] -> 606
A44: GERMANY | B44: EAST | C44: CONSUMER | D44: OFFICE | E44: TABLE | F44: 2 | G44: May | H44: 1993 | I44: 296.00 | J44: 978.00 | K44: RC[-1]-RC[-2] -> 682
A45: GERMANY | B45: EAST | C45: CONSUMER | D45: OFFICE | E45: TABLE | F45: 2 | G45: Jun | H45: 1993 | I45: 429.00 | J45: 72.00 | K45: RC[-1]-RC[-2] -> -357
A46: GERMANY | B46: EAST | C46: CONSUMER | D46: OFFICE | E46: TABLE | F46: 3 | G46: Jul | H46: 1993 | I46: 901.00 | J46: 33.00 | K46: RC[-1]-RC[-2] -> -868
A47: GERMANY | B47: EAST | C47: CONSUMER | D47: OFFICE | E47: TABLE | F47: 3 | G47: Aug | H47: 1993 | I47: 350.00 | J47: 428.00 | K47: RC[-1]-RC[-2] -> 78
A48: GERMANY | B48: EAST | C48: CONSUMER | D48: OFFICE | E48: TABLE | F48: 3 | G48: Sep | H48: 1993 | I48: 581.00 | J48: 413.00 | K48: RC[-1]-RC[-2] -> -168
A49: GERMANY | B49: EAST | C49: CONSUMER | D49: OFFICE | E49: TABLE | F49: 4 | G49: Oct | H49: 1993 | I49: 583.00 | J49: 737.00 | K49: RC[-1]-RC[-2] -> 154
A50: GERMANY | B50: EAST | C50: CONSUMER | D50: OFFICE | E50: TABLE | F50: 4 | G50: Nov | H50: 1993 | I50: 92.00 | J50: 85.00 | K50: RC[-1]-RC[-2] -> -7
A51: GERMANY | B51: EAST | C51: CONSUMER | D51: OFFICE | E51: TABLE | F51: 4 | G51: Dec | H51: 1993 | I51: 647.00 | J51: 916.00 | K51: RC[-1]-RC[-2] -> 269
A52: GERMANY | B52: EAST | C52: CONSUMER | D52: OFFICE | E52: CHAIR | F52: 1 | G52: Jan | H52: 1993 | I52: 336.00 | J52: 697.00 | K52: RC[-1]-RC[-2] -> 361
A53: GERMANY | B53: EAST | C53: CONSUMER | D53: OFFICE | E53: CHAIR | F53: 1 | G53: Feb | H53: 1993 | I53: 299.00 | J53: 215.00 | K53: RC[-1]-RC[-2] -> -84
A54: GERMANY | B54: EAST | C54: CONSUMER | D54: OFFICE | E54: CHAIR | F54: 1 | G54: Mar | H54: 1993 | I54: 747.00 | J54: 197.00 | K54: RC[-1]-RC[-2] -> -550
A55: GERMANY | B55: EAST | C55: CONSUMER | D55: OFFICE | E55: CHAIR | F55: 2 | G55: Apr | H55: 1993 | I55: 154.00 | J55: 205.00 | K55: RC[-1]-RC[-2] -> 51
A56: GERMANY | B56: EAST | C56: CONSUMER | D56: OFFICE | E56: CHAIR | F56: 2 | G56: May | H56: 1993 | I56: 486.00 | J56: 256.00 | K56: RC[-1]-RC[-2] -> -230
A57: GERMANY | B57: EAST | C57: CONSUMER | D57: OFFICE | E57: CHAIR | F57: 2 | G57: Jun | H57: 1993 | I57: 251.00 | J57: 377.00 | K57: RC[-1]-RC[-2] -> 126
A58: GERMANY | B58: EAST | C58: CONSUMER | D58: OFFICE | E58: CHAIR | F58: 3 | G58: Jul | H58: 1993 | I58: 225.00 | J58: 577.00 | K58: RC[-1]-RC[-2] -> 352
A59: GERMANY | B59: EAST | C59: CONSUMER | D59: OFFICE | E59: CHAIR | F59: 3 | G59: Aug | H59: 1993 | I59: 77.00 | J59: 686.00 | K59: RC[-1]-RC[-2] -> 609
A60: GERMANY | B60: EAST | C60: CONSUMER | D60: OFFICE | E60: CHAIR | F60: 3 | G60: Sep | H60: 1993 | I60: 74.00 | J60: 332.00 | K60: RC[-1]-RC[-2] -> 258
A61: GERMANY | B61: EAST | C61: CONSUMER | D61: OFFICE | E61: CHAIR | F61: 4 | G61: Oct | H61: 1993 | I61: 596.00 | J61: 534.00 | K61: RC[-1]-RC[-2] -> -62
A62: GERMANY | B62: EAST | C62: CONSUMER | D62: OFFICE | E62: CHAIR | F62: 4 | G62: Nov | H62: 1993 | I62: 493.00 | J62: 485.00 | K62: RC[-1]-RC[-2] -> -8
A63: GERMANY | B63: EAST | C63: CONSUMER | D63: OFFICE | E63: CHAIR | F63: 4 | G63: Dec | H63: 1993 | I63: 782.00 | J63: 594.00 | K63: RC[-1]-RC[-2] -> -188
A64: GERMANY | B64: EAST | C64: CONSUMER | D64: OFFICE | E64: DESK | F64: 1 | G64: Jan | H64: 1993 | I64: 511.00 | J64: 956.00 | K64: RC[-1]-RC[-2] -> 445
A65: GERMANY | B65: EAST | C65: CONSUMER | D65: OFFICE | E65: DESK | F65: 1 | G65: Feb | H65: 1993 | I65: 505.00 | J65: 205.00 | K65: RC[-1]-RC[-2] -> -300
A66: GERMANY | B66: EAST | C66: CONSUMER | D66: OFFICE | E66: DESK | F66: 1 | G66: Mar | H66: 1993 | I66: 720.00 | J66: 629.00 | K66: RC[-1]-RC[-2] -> -91
A67: GERMANY | B67: EAST | C67: CONSUMER | D67: OFFICE | E67: DESK | F67: 2 | G67: Apr | H67: 1993 | I67: 823.00 | J67: 277.00 | K67: RC[-1]-RC[-2] -> -546
A68: GERMANY | B68: EAST | C68: CONSUMER | D68: OFFICE | E68: DESK | F68: 2 | G68: May | H68: 1993 | I68: 21.00 | J68: 266.00 | K68: RC[-1]-RC[-2] -> 245
A69: GERMANY | B69: EAST | C69: CONSUMER | D69: OFFICE | E69: DESK | F69: 2 | G69: Jun | H69: 1993 | I69: 142.00 | J69: 872.00 | K69: RC[-1]-RC[-2] -> 730
A70: GERMANY | B70: EAST | C70: CONSUMER | D70: OFFICE | E70: DESK | F70: 3 | G70: Jul | H70: 1993 | I70: 95.00 | J70: 435.00 | K70: RC[-1]-RC[-2] -> 340
A71: GERMANY | B71: EAST | C71: CONSUMER | D71: OFFICE | E71: DESK | F71: 3 | G71: Aug | H71: 1993 | I71: 398.00 | J71: 988.00 | K71: RC[-1]-RC[-2] -> 590
A72: GERMANY | B72: EAST | C72: CONSUMER | D72: OFFICE | E72: DESK | F72: 3 | G72: Sep | H72: 1993 | I72: 328.00 | J72: 953.00 | K72: RC[-1]-RC[-2] -> 625
A73: GERMANY | B73: EAST | C73: CONSUMER | D73: OFFICE | E73: DESK | F73: 4 | G73: Oct | H73: 1993 | I73: 151.00 | J73: 556.00 | K73: RC[-1]-RC[-2] -> 405
A74: GERMANY | B74: EAST | C74: CONSUMER | D74: OFFICE | E74: DESK | F74: 4 | G74: Nov | H74: 1993 | I74: 978.00 | J74: 211.00 | K74: RC[-1]-RC[-2] -> -767
A75: GERMANY | B75: EAST | C75: CONSUMER | D75: OFFICE | E75: DESK | F75: 4 | G75: Dec | H75: 1993 | I75: 918.00 | J75: 389.00 | K75: RC[-1]-RC[-2] -> -529
A76: GERMANY | B76: EAST | C76: EDUCATION | D76: FURNITURE | E76: SOFA | F76: 1 | G76: Jan | H76: 1993 | I76: 977.00 | J76: 996.00 | K76: RC[-1]-RC[-2] -> 19
A77: GERMANY | B77: EAST | C77: EDUCATION | D77: FURNITURE | E77: SOFA | F77: 1 | G77: Feb | H77: 1993 | I77: 549.00 | J77: 554.00 | K77: RC[-1]-RC[-2] -> 5
A78: GERMANY | B78: EAST | C78: EDUCATION | D78: FURNITURE | E78: SOFA | F78: 1 | G78: Mar | H78: 1993 | I78: 951.00 | J78: 540.00 | K78: RC[-1]-RC[-2] -> -411
A79: GERMANY | B79: EAST | C79: EDUCATION | D79: FURNITURE | E79: SOFA | F79: 2 | G79: Apr | H79: 1993 | I79: 390.00 | J79: 140.00 | K79: RC[-1]-RC[-2] -> -250
A80: GERMANY | B80: EAST | C80: EDUCATION | D80: FURNITURE | E80: SOFA | F80: 2 | G80: May | H80: 1993 | I80: 204.00 | J80: 554.00 | K80: RC[-1]-RC[-2] -> 350
A81: GERMANY | B81: EAST | C81: EDUCATION | D81: FURNITURE | E81: SOFA | F81: 2 | G81: Jun | H81: 1993 | I81: 78.00 | J81: 724.00 | K81: RC[-1]-RC[-2] -> 646
A82: GERMANY | B82: EAST | C82: EDUCATION | D82: FURNITURE | E82: SOFA | F82: 3 | G82: Jul | H82: 1993 | I82: 613.00 | J82: 693.00 | K82: RC[-1]-RC[-2] -> 80
A83: GERMANY | B83: EAST | C83: EDUCATION | D83: FURNITURE | E83: SOFA | F83: 3 | G83: Aug | H83: 1993 | I83: 745.00 | J83: 866.00 | K83: RC[-1]-RC[-2] -> 121
A84: GERMANY | B84: EAST | C84: EDUCATION | D84: FURNITURE | E84: SOFA | F84: 3 | G84: Sep | H84: 1993 | I84: 56.00 | J84: 833.00 | K84: RC[-1]-RC[-2] -> 777
A85: GERMANY | B85: EAST | C85: EDUCATION | D85: FURNITURE | E85: SOFA | F85: 4 | G85: Oct | H85: 1993 | I85: 887.00 | J85: 164.00 | K85: RC[-1]-RC[-2] -> -723
A86: GERMANY | B86: EAST | C86: EDUCATION | D86: FURNITURE | E86: SOFA | F86: 4 | G86: Nov | H86: 1993 | I86: 651.00 | J86: 753.00 | K86: RC[-1]-RC[-2] -> 102
A87: GERMANY | B87: EAST | C87: EDUCATION | D87: FURNITURE | E87: SOFA | F87: 4 | G87: Dec | H87: 1993 | I87: 691.00 | J87: 60.00 | K87: RC[-1]-RC[-2] -> -631
A88: GERMANY | B88: EAST | C88: EDUCATION | D88: FURNITURE | E88: BED | F88: 1 | G88: Jan | H88: 1993 | I88: 325.00 | J88: 641.00 | K88: RC[-1]-RC[-2] -> 316
A89: GERMANY | B89: EAST | C89: EDUCATION | D89: FURNITURE | E89: BED | F89: 1 | G89: Feb | H89: 1993 | I89: 648.00 | J89: 494.00 | K89: RC[-1]-RC[-2] -> -154
A90: GERMANY | B90: EAST | C90: EDUCATION | D90: FURNITURE | E90: BED | F90: 1 | G90: Mar | H90: 1993 | I90: 365.00 | J90: 428.00 | K90: RC[-1]-RC[-2] -> 63
A91: GERMANY | B91: EAST | C91: EDUCATION | D91: FURNITURE | E91: BED | F91: 2 | G91: Apr | H91: 1993 | I91: 120.00 | J91: 936.00 | K91: RC[-1]-RC[-2] -> 816
A92: GERMANY | B92: EAST | C92: EDUCATION | D92: FURNITURE | E92: BED | F92: 2 | G92: May | H92: 1993 | I92: 347.00 | J92: 597.00 | K92: RC[-1]-RC[-2] -> 250
A93: GERMANY | B93: EAST | C93: EDUCATION | D93: FURNITURE | E93: BED | F93: 2 | G93: Jun | H93: 1993 | I93: 638.00 | J93: 728.00 | K93: RC[-1]-RC[-2] -> 90
A94: GERMANY | B94: EAST | C94: EDUCATION | D94: FURNITURE | E94: BED | F94: 3 | G94: Jul | H94: 1993 | I94: 732.00 | J94: 933.00 | K94: RC[-1]-RC[-2] -> 201
A95: GERMANY | B95: EAST | C95: EDUCATION | D95: FURNITURE | E95: BED | F95: 3 | G95: Aug | H95: 1993 | I95: 465.00 | J95: 663.00 | K95: RC[-1]-RC[-2] -> 198
A96: GERMANY | B96: EAST | C96: EDUCATION | D96: FURNITURE | E96: BED | F96: 3 | G96: Sep | H96: 1993 | I96: 262.00 | J96: 394.00 | K96: RC[-1]-RC[-2] -> 132
A97: GERMANY | B97: EAST | C97: EDUCATION | D97: FURNITURE | E97: BED | F97: 4 | G97: Oct | H97: 1993 | I97: 947.00 | J97: 334.00 | K97: RC[-1]-RC[-2] -> -613
A98: GERMANY | B98: EAST | C98: EDUCATION | D98: FURNITURE | E98: BED | F98: 4 | G98: Nov | H98: 1993 | I98: 694.00 | J98: 114.00 | K98: RC[-1]-RC[-2] -> -580
A99: GERMANY | B99: EAST | C99: EDUCATION | D99: FURNITURE | E99: BED | F99: 4 | G99: Dec | H99: 1993 | I99: 482.00 | J99: 89.00 | K99: RC[-1]-RC[-2] -> -393
A100: GERMANY | B100: EAST | C100: EDUCATION | D100: OFFICE | E100: TABLE | F100: 1 | G100: Jan | H100: 1993 | I100: 408.00 | J100: 597.00 | K100: RC[-1]-RC[-2] -> 189
A101: GERMANY | B101: EAST | C101: EDUCATION | D101: OFFICE | E101: TABLE | F101: 1 | G101: Feb | H101: 1993 | I101: 45.00 | J101: 185.00 | K101: RC[-1]-RC[-2] -> 140
A102: GERMANY | B102: EAST | C102: EDUCATION | D102: OFFICE | E102: TABLE | F102: 1 | G102: Mar | H102: 1993 | I102: 522.00 | J102: 175.00 | K102: RC[-1]-RC[-2] -> -347
A103: GERMANY | B103: EAST | C103: EDUCATION | D103: OFFICE | E103: TABLE | F103: 2 | G103: Apr | H103: 1993 | I103: 166.00 | J103: 576.00 | K103: RC[-1]-RC[-2] -> 410
A104: GERMANY | B104: EAST | C104: EDUCATION | D104: OFFICE | E104: TABLE | F104: 2 | G104: May | H104: 1993 | I104: 885.00 | J104: 957.00 | K104: RC[-1]-RC[-2] -> 72
A105: GERMANY | B105: EAST | C105: EDUCATION | D105: OFFICE | E105: TABLE | F105: 2 | G105: Jun | H105: 1993 | I105: 713.00 | J105: 993.00 | K105: RC[-1]-RC[-2] -> 280
A106: GERMANY | B106: EAST | C106: EDUCATION | D106: OFFICE | E106: TABLE | F106: 3 | G106: Jul | H106: 1993 | I106: 838.00 | J106: 500.00 | K106: RC[-1]-RC[-2] -> -338
A107: GERMANY | B107: EAST | C107: EDUCATION | D107: OFFICE | E107: TABLE | F107: 3 | G107: Aug | H107: 1993 | I107: 267.00 | J107: 410.00 | K107: RC[-1]-RC[-2] -> 143
A108: GERMANY | B108: EAST | C108: EDUCATION | D108: OFFICE | E108: TABLE | F108: 3 | G108: Sep | H108: 1993 | I108: 967.00 | J108: 592.00 | K108: RC[-1]-RC[-2] -> -375
A109: GERMANY | B109: EAST | C109: EDUCATION | D109: OFFICE | E109: TABLE | F109: 4 | G109: Oct | H109: 1993 | I109: 529.00 | J109: 64.00 | K109: RC[-1]-RC[-2] -> -465
A110: GERMANY | B110: EAST | C110: EDUCATION | D110: OFFICE | E110: TABLE | F110: 4 | G110: Nov | H110: 1993 | I110: 656.00 | J110: 208.00 | K110: RC[-1]-RC[-2] -> -448
A111: GERMANY | B111: EAST | C111: EDUCATION | D111: OFFICE | E111: TABLE | F111: 4 | G111: Dec | H111: 1993 | I111: 665.00 | J111: 273.00 | K111: RC[-1]-RC[-2] -> -392
A112: GERMANY | B112: EAST | C112: EDUCATION | D112: OFFICE | E112: CHAIR | F112: 1 | G112: Jan | H112: 1993 | I112: 304.00 | J112: 468.00 | K112: RC[-1]-RC[-2] -> 164
A113: GERMANY | B113: EAST | C113: EDUCATION | D113: OFFICE | E113: CHAIR | F113: 1 | G113: Feb | H113: 1993 | I113: 846.00 | J113: 430.00 | K113: RC[-1]-RC[-2] -> -416
A114: GERMANY | B114: EAST | C114: EDUCATION | D114: OFFICE | E114: CHAIR | F114: 1 | G114: Mar | H114: 1993 | I114: 912.00 | J114: 893.00 | K114: RC[-1]-RC[-2] -> -19
A115: GERMANY | B115: EAST | C115: EDUCATION | D115: OFFICE | E115: CHAIR | F115: 2 | G115: Apr | H115: 1993 | I115: 810.00 | J115: 519.00 | K115: RC[-1]-RC[-2] -> -291
A116: GERMANY | B116: EAST | C116: EDUCATION | D116: OFFICE | E116: CHAIR | F116: 2 | G116: May | H116: 1993 | I116: 122.00 | J116: 267.00 | K116: RC[-1]-RC[-2] -> 145
A117: GERMANY | B117: EAST | C117: EDUCATION | D117: OFFICE | E117: CHAIR | F117: 2 | G117: Jun | H117: 1993 | I117: 102.00 | J117: 908.00 | K117: RC[-1]-RC[-2] -> 806
A118: GERMANY | B118: EAST | C118: EDUCATION | D118: OFFICE | E118: CHAIR | F118: 3 | G118: Jul | H118: 1993 | I118: 161.00 | J118: 176.00 | K118: RC[-1]-RC[-2] -> 15
A119: GERMANY | B119: EAST | C119: EDUCATION | D119: OFFICE | E119: CHAIR | F119: 3 | G119: Aug | H119: 1993 | I119: 450.00 | J119: 673.00 | K119: RC[-1]-RC[-2] -> 223
A120: GERMANY | B120: EAST | C120: EDUCATION | D120: OFFICE | E120: CHAIR | F120: 3 | G120: Sep | H120: 1993 | I120: 215.00 | J120: 798.00 | K120: RC[-1]-RC[-2] -> 583
A121: GERMANY | B121: EAST | C121: EDUCATION | D121: OFFICE | E121: CHAIR | F121: 4 | G121: Oct | H121: 1993 | I121: 765.00 | J121: 291.00 | K121: RC[-1]-RC[-2] -> -474
A122: GERMANY | B122: EAST | C122: EDUCATION | D122: OFFICE | E122: CHAIR | F122: 4 | G122: Nov | H122: 1993 | I122: 557.00 | J122: 583.00 | K122: RC[-1]-RC[-2] -> 26
A123: GERMANY | B123: EAST | C123: EDUCATION | D123: OFFICE | E123: CHAIR | F123: 4 | G123: Dec | H123: 1993 | I123: 739.00 | J123: 442.00 | K123: RC[-1]-RC[-2] -> -297
A124: GERMANY | B124: EAST | C124: EDUCATION | D124: OFFICE | E124: DESK | F124: 1 | G124: Jan | H124: 1993 | I124: 339.00 | J124: 352.00 | K124: RC[-1]-RC[-2] -> 13
A125: GERMANY | B125: EAST | C125: EDUCATION | D125: OFFICE | E125: DESK | F125: 1 | G125: Feb | H125: 1993 | I125: 70.00 | J125: 234.00 | K125: RC[-1]-RC[-2] -> 164
A126: GERMANY | B126: EAST | C126: EDUCATION | D126: OFFICE | E126: DESK | F126: 1 | G126: Mar | H126: 1993 | I126: 528.00 | J126: 167.00 | K126: RC[-1]-RC[-2] -> -361
A127: GERMANY | B127: EAST | C127: EDUCATION | D127: OFFICE | E127: DESK | F127: 2 | G127: Apr | H127: 1993 | I127: 220.00 | J127: 606.00 | K127: RC[-1]-RC[-2] -> 386
A128: GERMANY | B128: EAST | C128: EDUCATION | D128: OFFICE | E128: DESK | F128: 2 | G128: May | H128: 1993 | I128: 691.00 | J128: 670.00 | K128: RC[-1]-RC[-2] -> -21
A129: GERMANY | B129: EAST | C129: EDUCATION | D129: OFFICE | E129: DESK | F129: 2 | G129: Jun | H129: 1993 | I129: 197.00 | J129: 764.00 | K129: RC[-1]-RC[-2] -> 567
A130: GERMANY | B130: EAST | C130: EDUCATION | D130: OFFICE | E130: DESK | F130: 3 | G130: Jul | H130: 1993 | I130: 239.00 | J130: 659.00 | K130: RC[-1]-RC[-2] -> 420
A131: GERMANY | B131: EAST | C131: EDUCATION | D131: OFFICE | E131: DESK | F131: 3 | G131: Aug | H131: 1993 | I131: 50.00 | J131: 996.00 | K131: RC[-1]-RC[-2] -> 946
A132: GERMANY | B132: EAST | C132: EDUCATION | D132: OFFICE | E132: DESK | F132: 3 | G132: Sep | H132: 1993 | I132: 135.00 | J132: 424.00 | K132: RC[-1]-RC[-2] -> 289
A133: GERMANY | B133: EAST | C133: EDUCATION | D133: OFFICE | E133: DESK | F133: 4 | G133: Oct | H133: 1993 | I133: 972.00 | J133: 899.00 | K133: RC[-1]-RC[-2] -> -73
A134: GERMANY | B134: EAST | C134: EDUCATION | D134: OFFICE | E134: DESK | F134: 4 | G134: Nov | H134: 1993 | I134: 475.00 | J134: 392.00 | K134: RC[-1]-RC[-2] -> -83
A135: GERMANY | B135: EAST | C135: EDUCATION | D135: OFFICE | E135: DESK | F135: 4 | G135: Dec | H135: 1993 | I135: 868.00 | J135: 555.00 | K135: RC[-1]-RC[-2] -> -313
A136: GERMANY | B136: WEST | C136: CONSUMER | D136: FURNITURE | E136: SOFA | F136: 1 | G136: Jan | H136: 1993 | I136: 923.00 | J136: 872.00 | K136: RC[-1]-RC[-2] -> -51
A137: GERMANY | B137: WEST | C137: CONSUMER | D137: FURNITURE | E137: SOFA | F137: 1 | G137: Feb | H137: 1993 | I137: 854.00 | J137: 748.00 | K137: RC[-1]-RC[-2] -> -106
A138: GERMANY | B138: WEST | C138: CONSUMER | D138: FURNITURE | E138: SOFA | F138: 1 | G138: Mar | H138: 1993 | I138: 769.00 | J138: 749.00 | K138: RC[-1]-RC[-2] -> -20
A139: GERMANY | B139: WEST | C139: CONSUMER | D139: FURNITURE | E139: SOFA | F139: 2 | G139: Apr | H139: 1993 | I139: 271.00 | J139: 876.00 | K139: RC[-1]-RC[-2] -> 605
A140: GERMANY | B140: WEST | C140: CONSUMER | D140: FURNITURE | E140: SOFA | F140: 2 | G140: May | H140: 1993 | I140: 383.00 | J140: 860.00 | K140: RC[-1]-RC[-2] -> 477
A141: GERMANY | B141: WEST | C141: CONSUMER | D141: FURNITURE | E141: SOFA | F141: 2 | G141: Jun | H141: 1993 | I141: 29.00 | J141: 900.00 | K141: RC[-1]-RC[-2] -> 871
A142: GERMANY | B142: WEST | C142: CONSUMER | D142: FURNITURE | E142: SOFA | F142: 3 | G142: Jul | H142: 1993 | I142: 185.00 | J142: 705.00 | K142: RC[-1]-RC[-2] -> 520
A143: GERMANY | B143: WEST | C143: CONSUMER | D143: FURNITURE | E143: SOFA | F143: 3 | G143: Aug | H143: 1993 | I143: 351.00 | J143: 913.00 | K143: RC[-1]-RC[-2] -> 562
A144: GERMANY | B144: WEST | C144: CONSUMER | D144: FURNITURE | E144: SOFA | F144: 3 | G144: Sep | H144: 1993 | I144: 560.00 | J144: 315.00 | K144: RC[-1]-RC[-2] -> -245
A145: GERMANY | B145: WEST | C145: CONSUMER | D145: FURNITURE | E145: SOFA | F145: 4 | G145: Oct | H145: 1993 | I145: 840.00 | J145: 466.00 | K145: RC[-1]-RC[-2] -> -374
A146: GERMANY | B146: WEST | C146: CONSUMER | D146: FURNITURE | E146: SOFA | F146: 4 | G146: Nov | H146: 1993 | I146: 517.00 | J146: 233.00 | K146: RC[-1]-RC[-2] -> -284
A147: GERMANY | B147: WEST | C147: CONSUMER | D147: FURNITURE | E147: SOFA | F147: 4 | G147: Dec | H147: 1993 | I147: 949.00 | J147: 906.00 | K147: RC[-1]-RC[-2] -> -43
A148: GERMANY | B148: WEST | C148: CONSUMER | D148: FURNITURE | E148: BED | F148: 1 | G148: Jan | H148: 1993 | I148: 528.00 | J148: 494.00 | K148: RC[-1]-RC[-2] -> -34
A149: GERMANY | B149: WEST | C149: CONSUMER | D149: FURNITURE | E149: BED | F149: 1 | G149: Feb | H149: 1993 | I149: 124.00 | J149: 771.00 | K149: RC[-1]-RC[-2] -> 647
A150: GERMANY | B150: WEST | C150: CONSUMER | D150: FURNITURE | E150: BED | F150: 1 | G150: Mar | H150: 1993 | I150: 126.00 | J150: 49.00 | K150: RC[-1]-RC[-2] -> -77
A151: GERMANY | B151: WEST | C151: CONSUMER | D151: FURNITURE | E151: BED | F151: 2 | G151: Apr | H151: 1993 | I151: 440.00 | J151: 322.00 | K151: RC[-1]-RC[-2] -> -118
A152: GERMANY | B152: WEST | C152: CONSUMER | D152: FURNITURE | E152: BED | F152: 2 | G152: May | H152: 1993 | I152: 881.00 | J152: 878.00 | K152: RC[-1]-RC[-2] -> -3
A153: GERMANY | B153: WEST | C153: CONSUMER | D153: FURNITURE | E153: BED | F153: 2 | G153: Jun | H153: 1993 | I153: 292.00 | J153: 827.00 | K153: RC[-1]-RC[-2] -> 535
A154: GERMANY | B154: WEST | C154: CONSUMER | D154: FURNITURE | E154: BED | F154: 3 | G154: Jul | H154: 1993 | I154: 873.00 | J154: 852.00 | K154: RC[-1]-RC[-2] -> -21
A155: GERMANY | B155: WEST | C155: CONSUMER | D155: FURNITURE | E155: BED | F155: 3 | G155: Aug | H155: 1993 | I155: 357.00 | J155: 716.00 | K155: RC[-1]-RC[-2] -> 359
A156: GERMANY | B156: WEST | C156: CONSUMER | D156: FURNITURE | E156: BED | F156: 3 | G156: Sep | H156: 1993 | I156: 247.00 | J156: 81.00 | K156: RC[-1]-RC[-2] -> -166
A157: GERMANY | B157: WEST | C157: CONSUMER | D157: FURNITURE | E157: BED | F157: 4 | G157: Oct | H157: 1993 | I157: 18.00 | J157: 916.00 | K157: RC[-1]-RC[-2] -> 898
A158: GERMANY | B158: WEST | C158: CONSUMER | D158: FURNITURE | E158: BED | F158: 4 | G158: Nov | H158: 1993 | I158: 395.00 | J158: 673.00 | K158: RC[-1]-RC[-2] -> 278
A159: GERMANY | B159: WEST | C159: CONSUMER | D159: FURNITURE | E159: BED | F159: 4 | G159: Dec | H159: 1993 | I159: 620.00 | J159: 242.00 | K159: RC[-1]-RC[-2] -> -378
A160: GERMANY | B160: WEST | C160: CONSUMER | D160: OFFICE | E160: TABLE | F160: 1 | G160: Jan | H160: 1993 | I160: 59.00 | J160: 505.00 | K160: RC[-1]-RC[-2] -> 446
A161: GERMANY | B161: WEST | C161: CONSUMER | D161: OFFICE | E161: TABLE | F161: 1 | G161: Feb | H161: 1993 | I161: 790.00 | J161: 823.00 | K161: RC[-1]-RC[-2] -> 33
A162: GERMANY | B162: WEST | C162: CONSUMER | D162: OFFICE | E162: TABLE | F162: 1 | G162: Mar | H162: 1993 | I162: 574.00 | J162: 891.00 | K162: RC[-1]-RC[-2] -> 317
A163: GERMANY | B163: WEST | C163: CONSUMER | D163: OFFICE | E163: TABLE | F163: 2 | G163: Apr | H163: 1993 | I163: 96.00 | J163: 840.00 | K163: RC[-1]-RC[-2] -> 744
A164: GERMANY | B164: WEST | C164: CONSUMER | D164: OFFICE | E164: TABLE | F164: 2 | G164: May | H164: 1993 | I164: 376.00 | J164: 436.00 | K164: RC[-1]-RC[-2] -> 60
A165: GERMANY | B165: WEST | C165: CONSUMER | D165: OFFICE | E165: TABLE | F165: 2 | G165: Jun | H165: 1993 | I165: 352.00 | J165: 168.00 | K165: RC[-1]-RC[-2] -> -184
A166: GERMANY | B166: WEST | C166: CONSUMER | D166: OFFICE | E166: TABLE | F166: 3 | G166: Jul | H166: 1993 | I166: 741.00 | J166: 177.00 | K166: RC[-1]-RC[-2] -> -564
A167: GERMANY | B167: WEST | C167: CONSUMER | D167: OFFICE | E167: TABLE | F167: 3 | G167: Aug | H167: 1993 | I167: 12.00 | J167: 727.00 | K167: RC[-1]-RC[-2] -> 715
A168: GERMANY | B168: WEST | C168: CONSUMER | D168: OFFICE | E168: TABLE | F168: 3 | G168: Sep | H168: 1993 | I168: 157.00 | J168: 278.00 | K168: RC[-1]-RC[-2] -> 121
A169: GERMANY | B169: WEST | C169: CONSUMER | D169: OFFICE | E169: TABLE | F169: 4 | G169: Oct | H169: 1993 | I169: 10.00 | J169: 443.00 | K169: RC[-1]-RC[-2] -> 433
A170: GERMANY | B170: WEST | C170: CONSUMER | D170: OFFICE | E170: TABLE | F170: 4 | G170: Nov | H170: 1993 | I170: 544.00 | J170: 905.00 | K170: RC[-1]-RC[-2] -> 361
A171: GERMANY | B171: WEST | C171: CONSUMER | D171: OFFICE | E171: TABLE | F171: 4 | G171: Dec | H171: 1993 | I171: 817.00 | J171: 881.00 | K171: RC[-1]-RC[-2] -> 64
A172: GERMANY | B172: WEST | C172: CONSUMER | D172: OFFICE | E172: CHAIR | F172: 1 | G172: Jan | H172: 1993 | I172: 278.00 | J172: 168.00 | K172: RC[-1]-RC[-2] -> -110
A173: GERMANY | B173: WEST | C173: CONSUMER | D173: OFFICE | E173: CHAIR | F173: 1 | G173: Feb | H173: 1993 | I173: 376.00 | J173: 512.00 | K173: RC[-1]-RC[-2] -> 136
A174: GERMANY | B174: WEST | C174: CONSUMER | D174: OFFICE | E174: CHAIR | F174: 1 | G174: Mar | H174: 1993 | I174: 104.00 | J174: 291.00 | K174: RC[-1]-RC[-2] -> 187
A175: GERMANY | B175: WEST | C175: CONSUMER | D175: OFFICE | E175: CHAIR | F175: 2 | G175: Apr | H175: 1993 | I175: 543.00 | J175: 776.00 | K175: RC[-1]-RC[-2] -> 233
A176: GERMANY | B176: WEST | C176: CONSUMER | D176: OFFICE | E176: CHAIR | F176: 2 | G176: May | H176: 1993 | I176: 798.00 | J176: 271.00 | K176: RC[-1]-RC[-2] -> -527
A177: GERMANY | B177: WEST | C177: CONSUMER | D177: OFFICE | E177: CHAIR | F177: 2 | G177: Jun | H177: 1993 | I177: 333.00 | J177: 946.00 | K177: RC[-1]-RC[-2] -> 613
A178: GERMANY | B178: WEST | C178: CONSUMER | D178: OFFICE | E178: CHAIR | F178: 3 | G178: Jul | H178: 1993 | I178: 833.00 | J178: 195.00 | K178: RC[-1]-RC[-2] -> -638
A179: GERMANY | B179: WEST | C179: CONSUMER | D179: OFFICE | E179: CHAIR | F179: 3 | G179: Aug | H179: 1993 | I179: 132.00 | J179: 165.00 | K179: RC[-1]-RC[-2] -> 33
A180: GERMANY | B180: WEST | C180: CONSUMER | D180: OFFICE | E180: CHAIR | F180: 3 | G180: Sep | H180: 1993 | I180: 629.00 | J180: 238.00 | K180: RC[-1]-RC[-2] -> -391
A181: GERMANY | B181: WEST | C181: CONSUMER | D181: OFFICE | E181: CHAIR | F181: 4 | G181: Oct | H181: 1993 | I181: 337.00 | J181: 409.00 | K181: RC[-1]-RC[-2] -> 72
A182: GERMANY | B182: WEST | C182: CONSUMER | D182: OFFICE | E182: CHAIR | F182: 4 | G182: Nov | H182: 1993 | I182: 300.00 | J182: 720.00 | K182: RC[-1]-RC[-2] -> 420
A183: GERMANY | B183: WEST | C183: CONSUMER | D183: OFFICE | E183: CHAIR | F183: 4 | G183: Dec | H183: 1993 | I183: 470.00 | J183: 309.00 | K183: RC[-1]-RC[-2] -> -161
A184: GERMANY | B184: WEST | C184: CONSUMER | D184: OFFICE | E184: DESK | F184: 1 | G184: Jan | H184: 1993 | I184: 898.00 | J184: 636.00 | K184: RC[-1]-RC[-2] -> -262
A185: GERMANY | B185: WEST | C185: CONSUMER | D185: OFFICE | E185: DESK | F185: 1 | G185: Feb | H185: 1993 | I185: 330.00 | J185: 52.00 | K185: RC[-1]-RC[-2] -> -278
A186: GERMANY | B186: WEST | C186: CONSUMER | D186: OFFICE | E186: DESK | F186: 1 | G186: Mar | H186: 1993 | I186: 603.00 | J186: 184.00 | K186: RC[-1]-RC[-2] -> -419
A187: GERMANY | B187: WEST | C187: CONSUMER | D187: OFFICE | E187: DESK | F187: 2 | G187: Apr | H187: 1993 | I187: 280.00 | J187: 739.00 | K187: RC[-1]-RC[-2] -> 459
A188: GERMANY | B188: WEST | C188: CONSUMER | D188: OFFICE | E188: DESK | F188: 2 | G188: May | H188: 1993 | I188: 507.00 | J188: 841.00 | K188: RC[-1]-RC[-2] -> 334
A189: GERMANY | B189: WEST | C189: CONSUMER | D189: OFFICE | E189: DESK | F189: 2 | G189: Jun | H189: 1993 | I189: 202.00 | J189: 65.00 | K189: RC[-1]-RC[-2] -> -137
A190: GERMANY | B190: WEST | C190: CONSUMER | D190: OFFICE | E190: DESK | F190: 3 | G190: Jul | H190: 1993 | I190: 513.00 | J190: 623.00 | K190: RC[-1]-RC[-2] -> 110
A191: GERMANY | B191: WEST | C191: CONSUMER | D191: OFFICE | E191: DESK | F191: 3 | G191: Aug | H191: 1993 | I191: 132.00 | J191: 517.00 | K191: RC[-1]-RC[-2] -> 385
A192: GERMANY | B192: WEST | C192: CONSUMER | D192: OFFICE | E192: DESK | F192: 3 | G192: Sep | H192: 1993 | I192: 21.00 | J192: 636.00 | K192: RC[-1]-RC[-2] -> 615
A193: GERMANY | B193: WEST | C193: CONSUMER | D193: OFFICE | E193: DESK | F193: 4 | G193: Oct | H193: 1993 | I193: 657.00 | J193: 845.00 | K193: RC[-1]-RC[-2] -> 188
A194: GERMANY | B194: WEST | C194: CONSUMER | D194: OFFICE | E194: DESK | F194: 4 | G194: Nov | H194: 1993 | I194: 195.00 | J194: 232.00 | K194: RC[-1]-RC[-2] -> 37
A195: GERMANY | B195: WEST | C195: CONSUMER | D195: OFFICE | E195: DESK | F195: 4 | G195: Dec | H195: 1993 | I195: 323.00 | J195: 26.00 | K195: RC[-1]-RC[-2] -> -297
A196: GERMANY | B196: WEST | C196: EDUCATION | D196: FURNITURE | E196: SOFA | F196: 1 | G196: Jan | H196: 1993 | I196: 739.00 | J196: 982.00 | K196: RC[-1]-RC[-2] -> 243
A197: GERMANY | B197: WEST | C197: EDUCATION | D197: FURNITURE | E197: SOFA | F197: 1 | G197: Feb | H197: 1993 | I197: 683.00 | J197: 593.00 | K197: RC[-1]-RC[-2] -> -90
A198: GERMANY | B198: WEST | C198: EDUCATION | D198: FURNITURE | E198: SOFA | F198: 1 | G198: Mar | H198: 1993 | I198: 610.00 | J198: 702.00 | K198: RC[-1]-RC[-2] -> 92
A199: GERMANY | B199: WEST | C199: EDUCATION | D199: FURNITURE | E199: SOFA | F199: 2 | G199: Apr | H199: 1993 | I199: 248.00 | J199: 528.00 | K199: RC[-1]-RC[-2] -> 280
A200: GERMANY | B200: WEST | C200: EDUCATION | D200: FURNITURE | E200: SOFA | F200: 2 | G200: May | H200: 1993 | I200: 530.00 | J200: 873.00 | K200: RC[-1]-RC[-2] -> 343
A201: GERMANY | B201: WEST | C201: EDUCATION | D201: FURNITURE | E201: SOFA | F201: 2 | G201: Jun | H201: 1993 | I201: 889.00 | J201: 301.00 | K201: RC[-1]-RC[-2] -> -588
A202: GERMANY | B202: WEST | C202: EDUCATION | D202: FURNITURE | E202: SOFA | F202: 3 | G202: Jul | H202: 1993 | I202: 245.00 | J202: 769.00 | K202: RC[-1]-RC[-2] -> 524
A203: GERMANY | B203: WEST | C203: EDUCATION | D203: FURNITURE | E203: SOFA | F203: 3 | G203: Aug | H203: 1993 | I203: 473.00 | J203: 724.00 | K203: RC[-1]-RC[-2] -> 251
A204: GERMANY | B204: WEST | C204: EDUCATION | D204: FURNITURE | E204: SOFA | F204: 3 | G204: Sep | H204: 1993 | I204: 938.00 | J204: 466.00 | K204: RC[-1]-RC[-2] -> -472
A205: GERMANY | B205: WEST | C205: EDUCATION | D205: FURNITURE | E205: SOFA | F205: 4 | G205: Oct | H205: 1993 | I205: 150.00 | J205: 774.00 | K205: RC[-1]-RC[-2] -> 624
A206: GERMANY | B206: WEST | C206: EDUCATION | D206: FURNITURE | E206: SOFA | F206: 4 | G206: Nov | H206: 1993 | I206: 772.00 | J206: 111.00 | K206: RC[-1]-RC[-2] -> -661
A207: GERMANY | B207: WEST | C207: EDUCATION | D207: FURNITURE | E207: SOFA | F207: 4 | G207: Dec | H207: 1993 | I207: 201.00 | J207: 954.00 | K207: RC[-1]-RC[-2] -> 753
A208: GERMANY | B208: WEST | C208: EDUCATION | D208: FURNITURE | E208: BED | F208: 1 | G208: Jan | H208: 1993 | I208: 239.00 | J208: 597.00 | K208: RC[-1]-RC[-2] -> 358
A209: GERMANY | B209: WEST | C209: EDUCATION | D209: FURNITURE | E209: BED | F209: 1 | G209: Feb | H209: 1993 | I209: 637.00 | J209: 649.00 | K209: RC[-1]-RC[-2] -> 12
A210: GERMANY | B210: WEST | C210: EDUCATION | D210: FURNITURE | E210: BED | F210: 1 | G210: Mar | H210: 1993 | I210: 938.00 | J210: 3.00 | K210: RC[-1]-RC[-2] -> -935
A211: GERMANY | B211: WEST | C211: EDUCATION | D211: FURNITURE | E211: BED | F211: 2 | G211: Apr | H211: 1993 | I211: 788.00 | J211: 731.00 | K211: RC[-1]-RC[-2] -> -57
A212: GERMANY | B212: WEST | C212: EDUCATION | D212: FURNITURE | E212: BED | F212: 2 | G212: May | H212: 1993 | I212: 399.00 | J212: 181.00 | K212: RC[-1]-RC[-2] -> -218
A213: GERMANY | B213: WEST | C213: EDUCATION | D213: FURNITURE | E213: BED | F213: 2 | G213: Jun | H213: 1993 | I213: 576.00 | J213: 468.00 | K213: RC[-1]-RC[-2] -> -108
A214: GERMANY | B214: WEST | C214: EDUCATION | D214: FURNITURE | E214: BED | F214: 3 | G214: Jul | H214: 1993 | I214: 187.00 | J214: 891.00 | K214: RC[-1]-RC[-2] -> 704
A215: GERMANY | B215: WEST | C215: EDUCATION | D215: FURNITURE | E215: BED | F215: 3 | G215: Aug | H215: 1993 | I215: 703.00 | J215: 226.00 | K215: RC[-1]-RC[-2] -> -477
A216: GERMANY | B216: WEST | C216: EDUCATION | D216: FURNITURE | E216: BED | F216: 3 | G216: Sep | H216: 1993 | I216: 455.00 | J216: 28.00 | K216: RC[-1]-RC[-2] -> -427
A217: GERMANY | B217: WEST | C217: EDUCATION | D217: FURNITURE | E217: BED | F217: 4 | G217: Oct | H217: 1993 | I217: 244.00 | J217: 609.00 | K217: RC[-1]-RC[-2] -> 365
A218: GERMANY | B218: WEST | C218: EDUCATION | D218: FURNITURE | E218: BED | F218: 4 | G218: Nov | H218: 1993 | I218: 868.00 | J218: 224.00 | K218: RC[-1]-RC[-2] -> -644
A219: GERMANY | B219: WEST | C219: EDUCATION | D219: FURNITURE | E219: BED | F219: 4 | G219: Dec | H219: 1993 | I219: 353.00 | J219: 230.00 | K219: RC[-1]-RC[-2] -> -123
A220: GERMANY | B220: WEST | C220: EDUCATION | D220: OFFICE | E220: TABLE | F220: 1 | G220: Jan | H220: 1993 | I220: 441.00 | J220: 222.00 | K220: RC[-1]-RC[-2] -> -219
A221: GERMANY | B221: WEST | C221: EDUCATION | D221: OFFICE | E221: TABLE | F221: 1 | G221: Feb | H221: 1993 | I221: 183.00 | J221: 678.00 | K221: RC[-1]-RC[-2] -> 495
A222: GERMANY | B222: WEST | C222: EDUCATION | D222: OFFICE | E222: TABLE | F222: 1 | G222: Mar | H222: 1993 | I222: 459.00 | J222: 25.00 | K222: RC[-1]-RC[-2] -> -434
A223: GERMANY | B223: WEST | C223: EDUCATION | D223: OFFICE | E223: TABLE | F223: 2 | G223: Apr | H223: 1993 | I223: 810.00 | J223: 57.00 | K223: RC[-1]-RC[-2] -> -753
A224: GERMANY | B224: WEST | C224: EDUCATION | D224: OFFICE | E224: TABLE | F224: 2 | G224: May | H224: 1993 | I224: 268.00 | J224: 981.00 | K224: RC[-1]-RC[-2] -> 713
A225: GERMANY | B225: WEST | C225: EDUCATION | D225: OFFICE | E225: TABLE | F225: 2 | G225: Jun | H225: 1993 | I225: 916.00 | J225: 740.00 | K225: RC[-1]-RC[-2] -> -176
A226: GERMANY | B226: WEST | C226: EDUCATION | D226: OFFICE | E226: TABLE | F226: 3 | G226: Jul | H226: 1993 | I226: 742.00 | J226: 408.00 | K226: RC[-1]-RC[-2] -> -334
A227: GERMANY | B227: WEST | C227: EDUCATION | D227: OFFICE | E227: TABLE | F227: 3 | G227: Aug | H227: 1993 | I227: 522.00 | J227: 966.00 | K227: RC[-1]-RC[-2] -> 444
A228: GERMANY | B228: WEST | C228: EDUCATION | D228: OFFICE | E228: TABLE | F228: 3 | G228: Sep | H228: 1993 | I228: 299.00 | J228: 107.00 | K228: RC[-1]-RC[-2] -> -192
A229: GERMANY | B229: WEST | C229: EDUCATION | D229: OFFICE | E229: TABLE | F229: 4 | G229: Oct | H229: 1993 | I229: 677.00 | J229: 488.00 | K229: RC[-1]-RC[-2] -> -189
A230: GERMANY | B230: WEST | C230: EDUCATION | D230: OFFICE | E230: TABLE | F230: 4 | G230: Nov | H230: 1993 | I230: 709.00 | J230: 759.00 | K230: RC[-1]-RC[-2] -> 50
A231: GERMANY | B231: WEST | C231: EDUCATION | D231: OFFICE | E231: TABLE | F231: 4 | G231: Dec | H231: 1993 | I231: 310.00 | J231: 504.00 | K231: RC[-1]-RC[-2] -> 194
A232: GERMANY | B232: WEST | C232: EDUCATION | D232: OFFICE | E232: CHAIR | F232: 1 | G232: Jan | H232: 1993 | I232: 591.00 | J232: 774.00 | K232: RC[-1]-RC[-2] -> 183
A233: GERMANY | B233: WEST | C233: EDUCATION | D233: OFFICE | E233: CHAIR | F233: 1 | G233: Feb | H233: 1993 | I233: 378.00 | J233: 645.00 | K233: RC[-1]-RC[-2] -> 267
A234: GERMANY | B234: WEST | C234: EDUCATION | D234: OFFICE | E234: CHAIR | F234: 1 | G234: Mar | H234: 1993 | I234: 942.00 | J234: 986.00 | K234: RC[-1]-RC[-2] -> 44
A235: GERMANY | B235: WEST | C235: EDUCATION | D235: OFFICE | E235: CHAIR | F235: 2 | G235: Apr | H235: 1993 | I235: 686.00 | J235: 296.00 | K235: RC[-1]-RC[-2] -> -390
A236: GERMANY | B236: WEST | C236: EDUCATION | D236: OFFICE | E236: CHAIR | F236: 2 | G236: May | H236: 1993 | I236: 720.00 | J236: 936.00 | K236: RC[-1]-RC[-2] -> 216
A237: GERMANY | B237: WEST | C237: EDUCATION | D237: OFFICE | E237: CHAIR | F237: 2 | G237: Jun | H237: 1993 | I237: 546.00 | J237: 341.00 | K237: RC[-1]-RC[-2] -> -205
A238: GERMANY | B238: WEST | C238: EDUCATION | D238: OFFICE | E238: CHAIR | F238: 3 | G238: Jul | H238: 1993 | I238: 845.00 | J238: 32.00 | K238: RC[-1]-RC[-2] -> -813
A239: GERMANY | B239: WEST | C239: EDUCATION | D239: OFFICE | E239: CHAIR | F239: 3 | G239: Aug | H239: 1993 | I239: 667.00 | J239: 277.00 | K239: RC[-1]-RC[-2] -> -390
A240: GERMANY | B240: WEST | C240: EDUCATION | D240: OFFICE | E240: CHAIR | F240: 3 | G240: Sep | H240: 1993 | I240: 627.00 | J240: 548.00 | K240: RC[-1]-RC[-2] -> -79
A241: GERMANY | B241: WEST | C241: EDUCATION | D241: OFFICE | E241: CHAIR | F241: 4 | G241: Oct | H241: 1993 | I241: 142.00 | J241: 727.00 | K241: RC[-1]-RC[-2] -> 585
A242: GERMANY | B242: WEST | C242: EDUCATION | D242: OFFICE | E242: CHAIR | F242: 4 | G242: Nov | H242: 1993 | I242: 655.00 | J242: 812.00 | K242: RC[-1]-RC[-2] -> 157
A243: GERMANY | B243: WEST | C243: EDUCATION | D243: OFFICE | E243: CHAIR | F243: 4 | G243: Dec | H243: 1993 | I243: 556.00 | J243: 168.00 | K243: RC[-1]-RC[-2] -> -388
A244: GERMANY | B244: WEST | C244: EDUCATION | D244: OFFICE | E244: DESK | F244: 1 | G244: Jan | H244: 1993 | I244: 285.00 | J244: 100.00 | K244: RC[-1]-RC[-2] -> -185
A245: GERMANY | B245: WEST | C245: EDUCATION | D245: OFFICE | E245: DESK | F245: 1 | G245: Feb | H245: 1993 | I245: 94.00 | J245: 465.00 | K245: RC[-1]-RC[-2] -> 371
A246: GERMANY | B246: WEST | C246: EDUCATION | D246: OFFICE | E246: DESK | F246: 1 | G246: Mar | H246: 1993 | I246: 561.00 | J246: 350.00 | K246: RC[-1]-RC[-2] -> -211
A247: GERMANY | B247: WEST | C247: EDUCATION | D247: OFFICE | E247: DESK | F247: 2 | G247: Apr | H247: 1993 | I247: 143.00 | J247: 991.00 | K247: RC[-1]-RC[-2] -> 848
A248: GERMANY | B248: WEST | C248: EDUCATION | D248: OFFICE | E248: DESK | F248: 2 | G248: May | H248: 1993 | I248: 95.00 | J248: 910.00 | K248: RC[-1]-RC[-2] -> 815
A249: GERMANY | B249: WEST | C249: EDUCATION | D249: OFFICE | E249: DESK | F249: 2 | G249: Jun | H249: 1993 | I249: 341.00 | J249: 206.00 | K249: RC[-1]-RC[-2] -> -135
A250: GERMANY | B250: WEST | C250: EDUCATION | D250: OFFICE | E250: DESK | F250: 3 | G250: Jul | H250: 1993 | I250: 388.00 | J250: 263.00 | K250: RC[-1]-RC[-2] -> -125
A251: GERMANY | B251: WEST | C251: EDUCATION | D251: OFFICE | E251: DESK | F251: 3 | G251: Aug | H251: 1993 | I251: 272.00 | J251: 374.00 | K251: RC[-1]-RC[-2] -> 102
A252: GERMANY | B252: WEST | C252: EDUCATION | D252: OFFICE | E252: DESK | F252: 3 | G252: Sep | H252: 1993 | I252: 890.00 | J252: 875.00 | K252: RC[-1]-RC[-2] -> -15
A253: GERMANY | B253: WEST | C253: EDUCATION | D253: OFFICE | E253: DESK | F253: 4 | G253: Oct | H253: 1993 | I253: 734.00 | J253: 810.00 | K253: RC[-1]-RC[-2] -> 76
A254: GERMANY | B254: WEST | C254: EDUCATION | D254: OFFICE | E254: DESK | F254: 4 | G254: Nov | H254: 1993 | I254: 364.00 | J254: 398.00 | K254: RC[-1]-RC[-2] -> 34
A255: GERMANY | B255: WEST | C255: EDUCATION | D255: OFFICE | E255: DESK | F255: 4 | G255: Dec | H255: 1993 | I255: 619.00 | J255: 565.00 | K255: RC[-1]-RC[-2] -> -54
I256: =SUBTOTAL(9,R[-240]C:R[-1]C) -> 117119.00 | J256: =SUBTOTAL(9,R[-240]C:R[-1]C) -> 127404.00 | K256: RC[-1]-RC[-2] -> 10285

Sheet: United States
D1: Total Predicted Sales | E1: Total Actual Sales
A2: Region | B2: Division | C2: Product type | D2: 11770 | E2: 12129
A3: EAST | B3: CONSUMER | C3: FURNITURE
C4: OFFICE | D4: 19881 | E4: 20413
B5: EDUCATION | C5: FURNITURE | D5: 11879 | E5: 10234
C6: OFFICE | D6: 19749 | E6: 17451
B7: Division Total | D7: 63279 | E7: 60227
A8: WEST | B8: Division | C8: Product type | D8: 13627 | E8: 12746
B9: CONSUMER | C9: FURNITURE
C10: OFFICE | D10: 17635 | E10: 18162
B11: EDUCATION | C11: FURNITURE | D11: 12890 | E11: 10976
C12: OFFICE | D12: 16332 | E12: 18942
B13: Division Total | D13: 60484 | E13: 60826
A14: Grand Total | D14: 123763 | E14: 121053
A15: Country | B15: Region | C15: Division | D15: Product Type | E15: Product | F15: Quarter | G15: Month | H15: Year | I15: Predicted Sales | J15: Actual Sales | K15: Difference
A16: U.S.A. | B16: EAST | C16: CONSUMER | D16: FURNITURE | E16: SOFA | F16: 1 | G16: Jan | H16: 1993 | I16: 204.00 | J16: 521.00 | K16: RC[-1]-RC[-2] -> 317
A17: U.S.A. | B17: EAST | C17: CONSUMER | D17: FURNITURE | E17: SOFA | F17: 1 | G17: Feb | H17: 1993 | I17: 805.00 | J17: 751.00 | K17: RC[-1]-RC[-2] -> -54
A18: U.S.A. | B18: EAST | C18: CONSUMER | D18: FURNITURE | E18: SOFA | F18: 1 | G18: Mar | H18: 1993 | I18: 549.00 | J18: 45.00 | K18: RC[-1]-RC[-2] -> -504
A19: U.S.A. | B19: EAST | C19: CONSUMER | D19: FURNITURE | E19: SOFA | F19: 2 | G19: Apr | H19: 1993 | I19: 912.00 | J19: 144.00 | K19: RC[-1]-RC[-2] -> -768
A20: U.S.A. | B20: EAST | C20: CONSUMER | D20: FURNITURE | E20: SOFA | F20: 2 | G20: May | H20: 1993 | I20: 427.00 | J20: 119.00 | K20: RC[-1]-RC[-2] -> -308
A21: U.S.A. | B21: EAST | C21: CONSUMER | D21: FURNITURE | E21: SOFA | F21: 2 | G21: Jun | H21: 1993 | I21: 1.00 | J21: 728.00 | K21: RC[-1]-RC[-2] -> 727
A22: U.S.A. | B22: EAST | C22: CONSUMER | D22: FURNITURE | E22: SOFA | F22: 3 | G22: Jul | H22: 1993 | I22: 540.00 | J22: 120.00 | K22: RC[-1]-RC[-2] -> -420
A23: U.S.A. | B23: EAST | C23: CONSUMER | D23: FURNITURE | E23: SOFA | F23: 3 | G23: Aug | H23: 1993 | I23: 940.00 | J23: 657.00 | K23: RC[-1]-RC[-2] -> -283
A24: U.S.A. | B24: EAST | C24: CONSUMER | D24: FURNITURE | E24: SOFA | F24: 3 | G24: Sep | H24: 1993 | I24: 644.00 | J24: 409.00 | K24: RC[-1]-RC[-2] -> -235
A25: U.S.A. | B25: EAST | C25: CONSUMER | D25: FURNITURE | E25: SOFA | F25: 4 | G25: Oct | H25: 1993 | I25: 821.00 | J25: 881.00 | K25: RC[-1]-RC[-2] -> 60
A26: U.S.A. | B26: EAST | C26: CONSUMER | D26: FURNITURE | E26: SOFA | F26: 4 | G26: Nov | H26: 1993 | I26: 560.00 | J26: 113.00 | K26: RC[-1]-RC[-2] -> -447
A27: U.S.A. | B27: EAST | C27: CONSUMER | D27: FURNITURE | E27: SOFA | F27: 4 | G27: Dec | H27: 1993 | I27: 309.00 | J27: 831.00 | K27: RC[-1]-RC[-2] -> 522
A28: U.S.A. | B28: EAST | C28: CONSUMER | D28: FURNITURE | E28: BED | F28: 1 | G28: Jan | H28: 1993 | I28: 278.00 | J28: 622.00 | K28: RC[-1]-RC[-2] -> 344
A29: U.S.A. | B29: EAST | C29: CONSUMER | D29: FURNITURE | E29: BED | F29: 1 | G29: Feb | H29: 1993 | I29: 447.00 | J29: 689.00 | K29: RC[-1]-RC[-2] -> 242
A30: U.S.A. | B30: EAST | C30: CONSUMER | D30: FURNITURE | E30: BED | F30: 1 | G30: Mar | H30: 1993 | I30: 170.00 | J30: 120.00 | K30: RC[-1]-RC[-2] -> -50
A31: U.S.A. | B31: EAST | C31: CONSUMER | D31: FURNITURE | E31: BED | F31: 2 | G31: Apr | H31: 1993 | I31: 87.00 | J31: 374.00 | K31: RC[-1]-RC[-2] -> 287
A32: U.S.A. | B32: EAST | C32: CONSUMER | D32: FURNITURE | E32: BED | F32: 2 | G32: May | H32: 1993 | I32: 384.00 | J32: 926.00 | K32: RC[-1]-RC[-2] -> 542
A33: U.S.A. | B33: EAST | C33: CONSUMER | D33: FURNITURE | E33: BED | F33: 2 | G33: Jun | H33: 1993 | I33: 574.00 | J33: 687.00 | K33: RC[-1]-RC[-2] -> 113
A34: U.S.A. | B34: EAST | C34: CONSUMER | D34: FURNITURE | E34: BED | F34: 3 | G34: Jul | H34: 1993 | I34: 585.00 | J34: 600.00 | K34: RC[-1]-RC[-2] -> 15
A35: U.S.A. | B35: EAST | C35: CONSUMER | D35: FURNITURE | E35: BED | F35: 3 | G35: Aug | H35: 1993 | I35: 947.00 | J35: 779.00 | K35: RC[-1]-RC[-2] -> -168
A36: U.S.A. | B36: EAST | C36: CONSUMER | D36: FURNITURE | E36: BED | F36: 3 | G36: Sep | H36: 1993 | I36: 984.00 | J36: 223.00 | K36: RC[-1]-RC[-2] -> -761
A37: U.S.A. | B37: EAST | C37: CONSUMER | D37: FURNITURE | E37: BED | F37: 4 | G37: Oct | H37: 1993 | I37: 189.00 | J37: 628.00 | K37: RC[-1]-RC[-2] -> 439
A38: U.S.A. | B38: EAST | C38: CONSUMER | D38: FURNITURE | E38: BED | F38: 4 | G38: Nov | H38: 1993 | I38: 364.00 | J38: 326.00 | K38: RC[-1]-RC[-2] -> -38
A39: U.S.A. | B39: EAST | C39: CONSUMER | D39: FURNITURE | E39: BED | F39: 4 | G39: Dec | H39: 1993 | I39: 49.00 | J39: 836.00 | K39: RC[-1]-RC[-2] -> 787
A40: U.S.A. | B40: EAST | C40: CONSUMER | D40: OFFICE | E40: TABLE | F40: 1 | G40: Jan | H40: 1993 | I40: 649.00 | J40: 805.00 | K40: RC[-1]-RC[-2] -> 156
A41: U.S.A. | B41: EAST | C41: CONSUMER | D41: OFFICE | E41: TABLE | F41: 1 | G41: Feb | H41: 1993 | I41: 838.00 | J41: 860.00 | K41: RC[-1]-RC[-2] -> 22
A42: U.S.A. | B42: EAST | C42: CONSUMER | D42: OFFICE | E42: TABLE | F42: 1 | G42: Mar | H42: 1993 | I42: 439.00 | J42: 104.00 | K42: RC[-1]-RC[-2] -> -335
A43: U.S.A. | B43: EAST | C43: CONSUMER | D43: OFFICE | E43: TABLE | F43: 2 | G43: Apr | H43: 1993 | I43: 207.00 | J43: 434.00 | K43: RC[-1]-RC[-2] -> 227
A44: U.S.A. | B44: EAST | C44: CONSUMER | D44: OFFICE | E44: TABLE | F44: 2 | G44: May | H44: 1993 | I44: 804.00 | J44: 912.00 | K44: RC[-1]-RC[-2] -> 108
A45: U.S.A. | B45: EAST | C45: CONSUMER | D45: OFFICE | E45: TABLE | F45: 2 | G45: Jun | H45: 1993 | I45: 875.00 | J45: 571.00 | K45: RC[-1]-RC[-2] -> -304
A46: U.S.A. | B46: EAST | C46: CONSUMER | D46: OFFICE | E46: TABLE | F46: 3 | G46: Jul | H46: 1993 | I46: 473.00 | J46: 267.00 | K46: RC[-1]-RC[-2] -> -206
A47: U.S.A. | B47: EAST | C47: CONSUMER | D47: OFFICE | E47: TABLE | F47: 3 | G47: Aug | H47: 1993 | I47: 845.00 | J47: 415.00 | K47: RC[-1]-RC[-2] -> -430
A48: U.S.A. | B48: EAST | C48: CONSUMER | D48: OFFICE | E48: TABLE | F48: 3 | G48: Sep | H48: 1993 | I48: 91.00 | J48: 261.00 | K48: RC[-1]-RC[-2] -> 170
A49: U.S.A. | B49: EAST | C49: CONSUMER | D49: OFFICE | E49: TABLE | F49: 4 | G49: Oct | H49: 1993 | I49: 630.00 | J49: 746.00 | K49: RC[-1]-RC[-2] -> 116
A50: U.S.A. | B50: EAST | C50: CONSUMER | D50: OFFICE | E50: TABLE | F50: 4 | G50: Nov | H50: 1993 | I50: 185.00 | J50: 30.00 | K50: RC[-1]-RC[-2] -> -155
A51: U.S.A. | B51: EAST | C51: CONSUMER | D51: OFFICE | E51: TABLE | F51: 4 | G51: Dec | H51: 1993 | I51: 317.00 | J51: 662.00 | K51: RC[-1]-RC[-2] -> 345
A52: U.S.A. | B52: EAST | C52: CONSUMER | D52: OFFICE | E52: CHAIR | F52: 1 | G52: Jan | H52: 1993 | I52: 789.00 | J52: 816.00 | K52: RC[-1]-RC[-2] -> 27
A53: U.S.A. | B53: EAST | C53: CONSUMER | D53: OFFICE | E53: CHAIR | F53: 1 | G53: Feb | H53: 1993 | I53: 988.00 | J53: 437.00 | K53: RC[-1]-RC[-2] -> -551
A54: U.S.A. | B54: EAST | C54: CONSUMER | D54: OFFICE | E54: CHAIR | F54: 1 | G54: Mar | H54: 1993 | I54: 220.00 | J54: 715.00 | K54: RC[-1]-RC[-2] -> 495
A55: U.S.A. | B55: EAST | C55: CONSUMER | D55: OFFICE | E55: CHAIR | F55: 2 | G55: Apr | H55: 1993 | I55: 946.00 | J55: 780.00 | K55: RC[-1]-RC[-2] -> -166
A56: U.S.A. | B56: EAST | C56: CONSUMER | D56: OFFICE | E56: CHAIR | F56: 2 | G56: May | H56: 1993 | I56: 986.00 | J56: 245.00 | K56: RC[-1]-RC[-2] -> -741
A57: U.S.A. | B57: EAST | C57: CONSUMER | D57: OFFICE | E57: CHAIR | F57: 2 | G57: Jun | H57: 1993 | I57: 129.00 | J57: 201.00 | K57: RC[-1]-RC[-2] -> 72
A58: U.S.A. | B58: EAST | C58: CONSUMER | D58: OFFICE | E58: CHAIR | F58: 3 | G58: Jul | H58: 1993 | I58: 433.00 | J58: 815.00 | K58: RC[-1]-RC[-2] -> 382
A59: U.S.A. | B59: EAST | C59: CONSUMER | D59: OFFICE | E59: CHAIR | F59: 3 | G59: Aug | H59: 1993 | I59: 492.00 | J59: 865.00 | K59: RC[-1]-RC[-2] -> 373
A60: U.S.A. | B60: EAST | C60: CONSUMER | D60: OFFICE | E60: CHAIR | F60: 3 | G60: Sep | H60: 1993 | I60: 306.00 | J60: 634.00 | K60: RC[-1]-RC[-2] -> 328
A61: U.S.A. | B61: EAST | C61: CONSUMER | D61: OFFICE | E61: CHAIR | F61: 4 | G61: Oct | H61: 1993 | I61: 154.00 | J61: 901.00 | K61: RC[-1]-RC[-2] -> 747
A62: U.S.A. | B62: EAST | C62: CONSUMER | D62: OFFICE | E62: CHAIR | F62: 4 | G62: Nov | H62: 1993 | I62: 206.00 | J62: 789.00 | K62: RC[-1]-RC[-2] -> 583
A63: U.S.A. | B63: EAST | C63: CONSUMER | D63: OFFICE | E63: CHAIR | F63: 4 | G63: Dec | H63: 1993 | I63: 81.00 | J63: 882.00 | K63: RC[-1]-RC[-2] -> 801
A64: U.S.A. | B64: EAST | C64: CONSUMER | D64: OFFICE | E64: DESK | F64: 1 | G64: Jan | H64: 1993 | I64: 619.00 | J64: 384.00 | K64: RC[-1]-RC[-2] -> -235
A65: U.S.A. | B65: EAST | C65: CONSUMER | D65: OFFICE | E65: DESK | F65: 1 | G65: Feb | H65: 1993 | I65: 332.00 | J65: 161.00 | K65: RC[-1]-RC[-2] -> -171
A66: U.S.A. | B66: EAST | C66: CONSUMER | D66: OFFICE | E66: DESK | F66: 1 | G66: Mar | H66: 1993 | I66: 669.00 | J66: 977.00 | K66: RC[-1]-RC[-2] -> 308
A67: U.S.A. | B67: EAST | C67: CONSUMER | D67: OFFICE | E67: DESK | F67: 2 | G67: Apr | H67: 1993 | I67: 487.00 | J67: 615.00 | K67: RC[-1]-RC[-2] -> 128
A68: U.S.A. | B68: EAST | C68: CONSUMER | D68: OFFICE | E68: DESK | F68: 2 | G68: May | H68: 1993 | I68: 994.00 | J68: 783.00 | K68: RC[-1]-RC[-2] -> -211
A69: U.S.A. | B69: EAST | C69: CONSUMER | D69: OFFICE | E69: DESK | F69: 2 | G69: Jun | H69: 1993 | I69: 331.00 | J69: 977.00 | K69: RC[-1]-RC[-2] -> 646
A70: U.S.A. | B70: EAST | C70: CONSUMER | D70: OFFICE | E70: DESK | F70: 3 | G70: Jul | H70: 1993 | I70: 739.00 | J70: 375.00 | K70: RC[-1]-RC[-2] -> -364
A71: U.S.A. | B71: EAST | C71: CONSUMER | D71: OFFICE | E71: DESK | F71: 3 | G71: Aug | H71: 1993 | I71: 665.00 | J71: 298.00 | K71: RC[-1]-RC[-2] -> -367
A72: U.S.A. | B72: EAST | C72: CONSUMER | D72: OFFICE | E72: DESK | F72: 3 | G72: Sep | H72: 1993 | I72: 921.00 | J72: 104.00 | K72: RC[-1]-RC[-2] -> -817
A73: U.S.A. | B73: EAST | C73: CONSUMER | D73: OFFICE | E73: DESK | F73: 4 | G73: Oct | H73: 1993 | I73: 862.00 | J73: 713.00 | K73: RC[-1]-RC[-2] -> -149
A74: U.S.A. | B74: EAST | C74: CONSUMER | D74: OFFICE | E74: DESK | F74: 4 | G74: Nov | H74: 1993 | I74: 662.00 | J74: 556.00 | K74: RC[-1]-RC[-2] -> -106
A75: U.S.A. | B75: EAST | C75: CONSUMER | D75: OFFICE | E75: DESK | F75: 4 | G75: Dec | H75: 1993 | I75: 517.00 | J75: 323.00 | K75: RC[-1]-RC[-2] -> -194
A76: U.S.A. | B76: EAST | C76: EDUCATION | D76: FURNITURE | E76: SOFA | F76: 1 | G76: Jan | H76: 1993 | I76: 975.00 | J76: 4.00 | K76: RC[-1]-RC[-2] -> -971
A77: U.S.A. | B77: EAST | C77: EDUCATION | D77: FURNITURE | E77: SOFA | F77: 1 | G77: Feb | H77: 1993 | I77: 455.00 | J77: 813.00 | K77: RC[-1]-RC[-2] -> 358
A78: U.S.A. | B78: EAST | C78: EDUCATION | D78: FURNITURE | E78: SOFA | F78: 1 | G78: Mar | H78: 1993 | I78: 260.00 | J78: 773.00 | K78: RC[-1]-RC[-2] -> 513
A79: U.S.A. | B79: EAST | C79: EDUCATION | D79: FURNITURE | E79: SOFA | F79: 2 | G79: Apr | H79: 1993 | I79: 69.00 | J79: 205.00 | K79: RC[-1]-RC[-2] -> 136
A80: U.S.A. | B80: EAST | C80: EDUCATION | D80: FURNITURE | E80: SOFA | F80: 2 | G80: May | H80: 1993 | I80: 147.00 | J80: 657.00 | K80: RC[-1]-RC[-2] -> 510
A81: U.S.A. | B81: EAST | C81: EDUCATION | D81: FURNITURE | E81: SOFA | F81: 2 | G81: Jun | H81: 1993 | I81: 533.00 | J81: 154.00 | K81: RC[-1]-RC[-2] -> -379
A82: U.S.A. | B82: EAST | C82: EDUCATION | D82: FURNITURE | E82: SOFA | F82: 3 | G82: Jul | H82: 1993 | I82: 881.00 | J82: 747.00 | K82: RC[-1]-RC[-2] -> -134
A83: U.S.A. | B83: EAST | C83: EDUCATION | D83: FURNITURE | E83: SOFA | F83: 3 | G83: Aug | H83: 1993 | I83: 457.00 | J83: 787.00 | K83: RC[-1]-RC[-2] -> 330
A84: U.S.A. | B84: EAST | C84: EDUCATION | D84: FURNITURE | E84: SOFA | F84: 3 | G84: Sep | H84: 1993 | I84: 441.00 | J84: 867.00 | K84: RC[-1]-RC[-2] -> 426
A85: U.S.A. | B85: EAST | C85: EDUCATION | D85: FURNITURE | E85: SOFA | F85: 4 | G85: Oct | H85: 1993 | I85: 859.00 | J85: 307.00 | K85: RC[-1]-RC[-2] -> -552
A86: U.S.A. | B86: EAST | C86: EDUCATION | D86: FURNITURE | E86: SOFA | F86: 4 | G86: Nov | H86: 1993 | I86: 177.00 | J86: 571.00 | K86: RC[-1]-RC[-2] -> 394
A87: U.S.A. | B87: EAST | C87: EDUCATION | D87: FURNITURE | E87: SOFA | F87: 4 | G87: Dec | H87: 1993 | I87: 633.00 | J87: 92.00 | K87: RC[-1]-RC[-2] -> -541
A88: U.S.A. | B88: EAST | C88: EDUCATION | D88: FURNITURE | E88: BED | F88: 1 | G88: Jan | H88: 1993 | I88: 378.00 | J88: 129.00 | K88: RC[-1]-RC[-2] -> -249
A89: U.S.A. | B89: EAST | C89: EDUCATION | D89: FURNITURE | E89: BED | F89: 1 | G89: Feb | H89: 1993 | I89: 569.00 | J89: 187.00 | K89: RC[-1]-RC[-2] -> -382
A90: U.S.A. | B90: EAST | C90: EDUCATION | D90: FURNITURE | E90: BED | F90: 1 | G90: Mar | H90: 1993 | I90: 186.00 | J90: 670.00 | K90: RC[-1]-RC[-2] -> 484
A91: U.S.A. | B91: EAST | C91: EDUCATION | D91: FURNITURE | E91: BED | F91: 2 | G91: Apr | H91: 1993 | I91: 875.00 | J91: 678.00 | K91: RC[-1]-RC[-2] -> -197
A92: U.S.A. | B92: EAST | C92: EDUCATION | D92: FURNITURE | E92: BED | F92: 2 | G92: May | H92: 1993 | I92: 636.00 | J92: 423.00 | K92: RC[-1]-RC[-2] -> -213
A93: U.S.A. | B93: EAST | C93: EDUCATION | D93: FURNITURE | E93: BED | F93: 2 | G93: Jun | H93: 1993 | I93: 360.00 | J93: 389.00 | K93: RC[-1]-RC[-2] -> 29
A94: U.S.A. | B94: EAST | C94: EDUCATION | D94: FURNITURE | E94: BED | F94: 3 | G94: Jul | H94: 1993 | I94: 677.00 | J94: 257.00 | K94: RC[-1]-RC[-2] -> -420
A95: U.S.A. | B95: EAST | C95: EDUCATION | D95: FURNITURE | E95: BED | F95: 3 | G95: Aug | H95: 1993 | I95: 708.00 | J95: 780.00 | K95: RC[-1]-RC[-2] -> 72
A96: U.S.A. | B96: EAST | C96: EDUCATION | D96: FURNITURE | E96: BED | F96: 3 | G96: Sep | H96: 1993 | I96: 158.00 | J96: 159.00 | K96: RC[-1]-RC[-2] -> 1
A97: U.S.A. | B97: EAST | C97: EDUCATION | D97: FURNITURE | E97: BED | F97: 4 | G97: Oct | H97: 1993 | I97: 384.00 | J97: 97.00 | K97: RC[-1]-RC[-2] -> -287
A98: U.S.A. | B98: EAST | C98: EDUCATION | D98: FURNITURE | E98: BED | F98: 4 | G98: Nov | H98: 1993 | I98: 927.00 | J98: 479.00 | K98: RC[-1]-RC[-2] -> -448
A99: U.S.A. | B99: EAST | C99: EDUCATION | D99: FURNITURE | E99: BED | F99: 4 | G99: Dec | H99: 1993 | I99: 134.00 | J99: 9.00 | K99: RC[-1]-RC[-2] -> -125
A100: U.S.A. | B100: EAST | C100: EDUCATION | D100: OFFICE | E100: TABLE | F100: 1 | G100: Jan | H100: 1993 | I100: 579.00 | J100: 956.00 | K100: RC[-1]-RC[-2] -> 377
A101: U.S.A. | B101: EAST | C101: EDUCATION | D101: OFFICE | E101: TABLE | F101: 1 | G101: Feb | H101: 1993 | I101: 131.00 | J101: 276.00 | K101: RC[-1]-RC[-2] -> 145
A102: U.S.A. | B102: EAST | C102: EDUCATION | D102: OFFICE | E102: TABLE | F102: 1 | G102: Mar | H102: 1993 | I102: 689.00 | J102: 889.00 | K102: RC[-1]-RC[-2] -> 200
A103: U.S.A. | B103: EAST | C103: EDUCATION | D103: OFFICE | E103: TABLE | F103: 2 | G103: Apr | H103: 1993 | I103: 908.00 | J103: 708.00 | K103: RC[-1]-RC[-2] -> -200
A104: U.S.A. | B104: EAST | C104: EDUCATION | D104: OFFICE | E104: TABLE | F104: 2 | G104: May | H104: 1993 | I104: 524.00 | J104: 14.00 | K104: RC[-1]-RC[-2] -> -510
A105: U.S.A. | B105: EAST | C105: EDUCATION | D105: OFFICE | E105: TABLE | F105: 2 | G105: Jun | H105: 1993 | I105: 336.00 | J105: 904.00 | K105: RC[-1]-RC[-2] -> 568
A106: U.S.A. | B106: EAST | C106: EDUCATION | D106: OFFICE | E106: TABLE | F106: 3 | G106: Jul | H106: 1993 | I106: 916.00 | J106: 272.00 | K106: RC[-1]-RC[-2] -> -644
A107: U.S.A. | B107: EAST | C107: EDUCATION | D107: OFFICE | E107: TABLE | F107: 3 | G107: Aug | H107: 1993 | I107: 236.00 | J107: 257.00 | K107: RC[-1]-RC[-2] -> 21
A108: U.S.A. | B108: EAST | C108: EDUCATION | D108: OFFICE | E108: TABLE | F108: 3 | G108: Sep | H108: 1993 | I108: 965.00 | J108: 343.00 | K108: RC[-1]-RC[-2] -> -622
A109: U.S.A. | B109: EAST | C109: EDUCATION | D109: OFFICE | E109: TABLE | F109: 4 | G109: Oct | H109: 1993 | I109: 350.00 | J109: 80.00 | K109: RC[-1]-RC[-2] -> -270
A110: U.S.A. | B110: EAST | C110: EDUCATION | D110: OFFICE | E110: TABLE | F110: 4 | G110: Nov | H110: 1993 | I110: 599.00 | J110: 530.00 | K110: RC[-1]-RC[-2] -> -69
A111: U.S.A. | B111: EAST | C111: EDUCATION | D111: OFFICE | E111: TABLE | F111: 4 | G111: Dec | H111: 1993 | I111: 901.00 | J111: 340.00 | K111: RC[-1]-RC[-2] -> -561
A112: U.S.A. | B112: EAST | C112: EDUCATION | D112: OFFICE | E112: CHAIR | F112: 1 | G112: Jan | H112: 1993 | I112: 524.00 | J112: 229.00 | K112: RC[-1]-RC[-2] -> -295
A113: U.S.A. | B113: EAST | C113: EDUCATION | D113: OFFICE | E113: CHAIR | F113: 1 | G113: Feb | H113: 1993 | I113: 902.00 | J113: 786.00 | K113: RC[-1]-RC[-2] -> -116
A114: U.S.A. | B114: EAST | C114: EDUCATION | D114: OFFICE | E114: CHAIR | F114: 1 | G114: Mar | H114: 1993 | I114: 212.00 | J114: 92.00 | K114: RC[-1]-RC[-2] -> -120
A115: U.S.A. | B115: EAST | C115: EDUCATION | D115: OFFICE | E115: CHAIR | F115: 2 | G115: Apr | H115: 1993 | I115: 762.00 | J115: 455.00 | K115: RC[-1]-RC[-2] -> -307
A116: U.S.A. | B116: EAST | C116: EDUCATION | D116: OFFICE | E116: CHAIR | F116: 2 | G116: May | H116: 1993 | I116: 182.00 | J116: 409.00 | K116: RC[-1]-RC[-2] -> 227
A117: U.S.A. | B117: EAST | C117: EDUCATION | D117: OFFICE | E117: CHAIR | F117: 2 | G117: Jun | H117: 1993 | I117: 442.00 | J117: 166.00 | K117: RC[-1]-RC[-2] -> -276
A118: U.S.A. | B118: EAST | C118: EDUCATION | D118: OFFICE | E118: CHAIR | F118: 3 | G118: Jul | H118: 1993 | I118: 919.00 | J118: 277.00 | K118: RC[-1]-RC[-2] -> -642
A119: U.S.A. | B119: EAST | C119: EDUCATION | D119: OFFICE | E119: CHAIR | F119: 3 | G119: Aug | H119: 1993 | I119: 67.00 | J119: 92.00 | K119: RC[-1]-RC[-2] -> 25
A120: U.S.A. | B120: EAST | C120: EDUCATION | D120: OFFICE | E120: CHAIR | F120: 3 | G120: Sep | H120: 1993 | I120: 741.00 | J120: 631.00 | K120: RC[-1]-RC[-2] -> -110
A121: U.S.A. | B121: EAST | C121: EDUCATION | D121: OFFICE | E121: CHAIR | F121: 4 | G121: Oct | H121: 1993 | I121: 617.00 | J121: 390.00 | K121: RC[-1]-RC[-2] -> -227
A122: U.S.A. | B122: EAST | C122: EDUCATION | D122: OFFICE | E122: CHAIR | F122: 4 | G122: Nov | H122: 1993 | I122: 214.00 | J122: 403.00 | K122: RC[-1]-RC[-2] -> 189
A123: U.S.A. | B123: EAST | C123: EDUCATION | D123: OFFICE | E123: CHAIR | F123: 4 | G123: Dec | H123: 1993 | I123: 202.00 | J123: 964.00 | K123: RC[-1]-RC[-2] -> 762
A124: U.S.A. | B124: EAST | C124: EDUCATION | D124: OFFICE | E124: DESK | F124: 1 | G124: Jan | H124: 1993 | I124: 975.00 | J124: 794.00 | K124: RC[-1]-RC[-2] -> -181
A125: U.S.A. | B125: EAST | C125: EDUCATION | D125: OFFICE | E125: DESK | F125: 1 | G125: Feb | H125: 1993 | I125: 820.00 | J125: 892.00 | K125: RC[-1]-RC[-2] -> 72
A126: U.S.A. | B126: EAST | C126: EDUCATION | D126: OFFICE | E126: DESK | F126: 1 | G126: Mar | H126: 1993 | I126: 123.00 | J126: 728.00 | K126: RC[-1]-RC[-2] -> 605
A127: U.S.A. | B127: EAST | C127: EDUCATION | D127: OFFICE | E127: DESK | F127: 2 | G127: Apr | H127: 1993 | I127: 135.00 | J127: 744.00 | K127: RC[-1]-RC[-2] -> 609
A128: U.S.A. | B128: EAST | C128: EDUCATION | D128: OFFICE | E128: DESK | F128: 2 | G128: May | H128: 1993 | I128: 535.00 | J128: 678.00 | K128: RC[-1]-RC[-2] -> 143
A129: U.S.A. | B129: EAST | C129: EDUCATION | D129: OFFICE | E129: DESK | F129: 2 | G129: Jun | H129: 1993 | I129: 971.00 | J129: 768.00 | K129: RC[-1]-RC[-2] -> -203
A130: U.S.A. | B130: EAST | C130: EDUCATION | D130: OFFICE | E130: DESK | F130: 3 | G130: Jul | H130: 1993 | I130: 166.00 | J130: 234.00 | K130: RC[-1]-RC[-2] -> 68
A131: U.S.A. | B131: EAST | C131: EDUCATION | D131: OFFICE | E131: DESK | F131: 3 | G131: Aug | H131: 1993 | I131: 814.00 | J131: 333.00 | K131: RC[-1]-RC[-2] -> -481
A132: U.S.A. | B132: EAST | C132: EDUCATION | D132: OFFICE | E132: DESK | F132: 3 | G132: Sep | H132: 1993 | I132: 557.00 | J132: 968.00 | K132: RC[-1]-RC[-2] -> 411
A133: U.S.A. | B133: EAST | C133: EDUCATION | D133: OFFICE | E133: DESK | F133: 4 | G133: Oct | H133: 1993 | I133: 820.00 | J133: 119.00 | K133: RC[-1]-RC[-2] -> -701
A134: U.S.A. | B134: EAST | C134: EDUCATION | D134: OFFICE | E134: DESK | F134: 4 | G134: Nov | H134: 1993 | I134: 486.00 | J134: 469.00 | K134: RC[-1]-RC[-2] -> -17
A135: U.S.A. | B135: EAST | C135: EDUCATION | D135: OFFICE | E135: DESK | F135: 4 | G135: Dec | H135: 1993 | I135: 429.00 | J135: 261.00 | K135: RC[-1]-RC[-2] -> -168
A136: U.S.A. | B136: WEST | C136: CONSUMER | D136: FURNITURE | E136: SOFA | F136: 1 | G136: Jan | H136: 1993 | I136: 596.00 | J136: 197.00 | K136: RC[-1]-RC[-2] -> -399
A137: U.S.A. | B137: WEST | C137: CONSUMER | D137: FURNITURE | E137: SOFA | F137: 1 | G137: Feb | H137: 1993 | I137: 263.00 | J137: 828.00 | K137: RC[-1]-RC[-2] -> 565
A138: U.S.A. | B138: WEST | C138: CONSUMER | D138: FURNITURE | E138: SOFA | F138: 1 | G138: Mar | H138: 1993 | I138: 194.00 | J138: 461.00 | K138: RC[-1]-RC[-2] -> 267
A139: U.S.A. | B139: WEST | C139: CONSUMER | D139: FURNITURE | E139: SOFA | F139: 2 | G139: Apr | H139: 1993 | I139: 895.00 | J139: 35.00 | K139: RC[-1]-RC[-2] -> -860
A140: U.S.A. | B140: WEST | C140: CONSUMER | D140: FURNITURE | E140: SOFA | F140: 2 | G140: May | H140: 1993 | I140: 502.00 | J140: 88.00 | K140: RC[-1]-RC[-2] -> -414
A141: U.S.A. | B141: WEST | C141: CONSUMER | D141: FURNITURE | E141: SOFA | F141: 2 | G141: Jun | H141: 1993 | I141: 342.00 | J141: 832.00 | K141: RC[-1]-RC[-2] -> 490
A142: U.S.A. | B142: WEST | C142: CONSUMER | D142: FURNITURE | E142: SOFA | F142: 3 | G142: Jul | H142: 1993 | I142: 421.00 | J142: 900.00 | K142: RC[-1]-RC[-2] -> 479
A143: U.S.A. | B143: WEST | C143: CONSUMER | D143: FURNITURE | E143: SOFA | F143: 3 | G143: Aug | H143: 1993 | I143: 901.00 | J143: 368.00 | K143: RC[-1]-RC[-2] -> -533
A144: U.S.A. | B144: WEST | C144: CONSUMER | D144: FURNITURE | E144: SOFA | F144: 3 | G144: Sep | H144: 1993 | I144: 474.00 | J144: 201.00 | K144: RC[-1]-RC[-2] -> -273
A145: U.S.A. | B145: WEST | C145: CONSUMER | D145: FURNITURE | E145: SOFA | F145: 4 | G145: Oct | H145: 1993 | I145: 571.00 | J145: 758.00 | K145: RC[-1]-RC[-2] -> 187
A146: U.S.A. | B146: WEST | C146: CONSUMER | D146: FURNITURE | E146: SOFA | F146: 4 | G146: Nov | H146: 1993 | I146: 511.00 | J146: 504.00 | K146: RC[-1]-RC[-2] -> -7
A147: U.S.A. | B147: WEST | C147: CONSUMER | D147: FURNITURE | E147: SOFA | F147: 4 | G147: Dec | H147: 1993 | I147: 379.00 | J147: 864.00 | K147: RC[-1]-RC[-2] -> 485
A148: U.S.A. | B148: WEST | C148: CONSUMER | D148: FURNITURE | E148: BED | F148: 1 | G148: Jan | H148: 1993 | I148: 912.00 | J148: 585.00 | K148: RC[-1]-RC[-2] -> -327
A149: U.S.A. | B149: WEST | C149: CONSUMER | D149: FURNITURE | E149: BED | F149: 1 | G149: Feb | H149: 1993 | I149: 429.00 | J149: 127.00 | K149: RC[-1]-RC[-2] -> -302
A150: U.S.A. | B150: WEST | C150: CONSUMER | D150: FURNITURE | E150: BED | F150: 1 | G150: Mar | H150: 1993 | I150: 580.00 | J150: 669.00 | K150: RC[-1]-RC[-2] -> 89
A151: U.S.A. | B151: WEST | C151: CONSUMER | D151: FURNITURE | E151: BED | F151: 2 | G151: Apr | H151: 1993 | I151: 179.00 | J151: 708.00 | K151: RC[-1]-RC[-2] -> 529
A152: U.S.A. | B152: WEST | C152: CONSUMER | D152: FURNITURE | E152: BED | F152: 2 | G152: May | H152: 1993 | I152: 119.00 | J152: 830.00 | K152: RC[-1]-RC[-2] -> 711
A153: U.S.A. | B153: WEST | C153: CONSUMER | D153: FURNITURE | E153: BED | F153: 2 | G153: Jun | H153: 1993 | I153: 369.00 | J153: 550.00 | K153: RC[-1]-RC[-2] -> 181
A154: U.S.A. | B154: WEST | C154: CONSUMER | D154: FURNITURE | E154: BED | F154: 3 | G154: Jul | H154: 1993 | I154: 882.00 | J154: 762.00 | K154: RC[-1]-RC[-2] -> -120
A155: U.S.A. | B155: WEST | C155: CONSUMER | D155: FURNITURE | E155: BED | F155: 3 | G155: Aug | H155: 1993 | I155: 727.00 | J155: 468.00 | K155: RC[-1]-RC[-2] -> -259
A156: U.S.A. | B156: WEST | C156: CONSUMER | D156: FURNITURE | E156: BED | F156: 3 | G156: Sep | H156: 1993 | I156: 823.00 | J156: 151.00 | K156: RC[-1]-RC[-2] -> -672
A157: U.S.A. | B157: WEST | C157: CONSUMER | D157: FURNITURE | E157: BED | F157: 4 | G157: Oct | H157: 1993 | I157: 783.00 | J157: 103.00 | K157: RC[-1]-RC[-2] -> -680
A158: U.S.A. | B158: WEST | C158: CONSUMER | D158: FURNITURE | E158: BED | F158: 4 | G158: Nov | H158: 1993 | I158: 884.00 | J158: 876.00 | K158: RC[-1]-RC[-2] -> -8
A159: U.S.A. | B159: WEST | C159: CONSUMER | D159: FURNITURE | E159: BED | F159: 4 | G159: Dec | H159: 1993 | I159: 891.00 | J159: 881.00 | K159: RC[-1]-RC[-2] -> -10
A160: U.S.A. | B160: WEST | C160: CONSUMER | D160: OFFICE | E160: TABLE | F160: 1 | G160: Jan | H160: 1993 | I160: 516.00 | J160: 755.00 | K160: RC[-1]-RC[-2] -> 239
A161: U.S.A. | B161: WEST | C161: CONSUMER | D161: OFFICE | E161: TABLE | F161: 1 | G161: Feb | H161: 1993 | I161: 779.00 | J161: 331.00 | K161: RC[-1]-RC[-2] -> -448
A162: U.S.A. | B162: WEST | C162: CONSUMER | D162: OFFICE | E162: TABLE | F162: 1 | G162: Mar | H162: 1993 | I162: 987.00 | J162: 482.00 | K162: RC[-1]-RC[-2] -> -505
A163: U.S.A. | B163: WEST | C163: CONSUMER | D163: OFFICE | E163: TABLE | F163: 2 | G163: Apr | H163: 1993 | I163: 318.00 | J163: 632.00 | K163: RC[-1]-RC[-2] -> 314
A164: U.S.A. | B164: WEST | C164: CONSUMER | D164: OFFICE | E164: TABLE | F164: 2 | G164: May | H164: 1993 | I164: 427.00 | J164: 750.00 | K164: RC[-1]-RC[-2] -> 323
A165: U.S.A. | B165: WEST | C165: CONSUMER | D165: OFFICE | E165: TABLE | F165: 2 | G165: Jun | H165: 1993 | I165: 86.00 | J165: 618.00 | K165: RC[-1]-RC[-2] -> 532
A166: U.S.A. | B166: WEST | C166: CONSUMER | D166: OFFICE | E166: TABLE | F166: 3 | G166: Jul | H166: 1993 | I166: 553.00 | J166: 935.00 | K166: RC[-1]-RC[-2] -> 382
A167: U.S.A. | B167: WEST | C167: CONSUMER | D167: OFFICE | E167: TABLE | F167: 3 | G167: Aug | H167: 1993 | I167: 315.00 | J167: 716.00 | K167: RC[-1]-RC[-2] -> 401
A168: U.S.A. | B168: WEST | C168: CONSUMER | D168: OFFICE | E168: TABLE | F168: 3 | G168: Sep | H168: 1993 | I168: 328.00 | J168: 205.00 | K168: RC[-1]-RC[-2] -> -123
A169: U.S.A. | B169: WEST | C169: CONSUMER | D169: OFFICE | E169: TABLE | F169: 4 | G169: Oct | H169: 1993 | I169: 521.00 | J169: 215.00 | K169: RC[-1]-RC[-2] -> -306
A170: U.S.A. | B170: WEST | C170: CONSUMER | D170: OFFICE | E170: TABLE | F170: 4 | G170: Nov | H170: 1993 | I170: 156.00 | J170: 871.00 | K170: RC[-1]-RC[-2] -> 715
A171: U.S.A. | B171: WEST | C171: CONSUMER | D171: OFFICE | E171: TABLE | F171: 4 | G171: Dec | H171: 1993 | I171: 841.00 | J171: 552.00 | K171: RC[-1]-RC[-2] -> -289
A172: U.S.A. | B172: WEST | C172: CONSUMER | D172: OFFICE | E172: CHAIR | F172: 1 | G172: Jan | H172: 1993 | I172: 588.00 | J172: 792.00 | K172: RC[-1]-RC[-2] -> 204
A173: U.S.A. | B173: WEST | C173: CONSUMER | D173: OFFICE | E173: CHAIR | F173: 1 | G173: Feb | H173: 1993 | I173: 506.00 | J173: 175.00 | K173: RC[-1]-RC[-2] -> -331
A174: U.S.A. | B174: WEST | C174: CONSUMER | D174: OFFICE | E174: CHAIR | F174: 1 | G174: Mar | H174: 1993 | I174: 382.00 | J174: 208.00 | K174: RC[-1]-RC[-2] -> -174
A175: U.S.A. | B175: WEST | C175: CONSUMER | D175: OFFICE | E175: CHAIR | F175: 2 | G175: Apr | H175: 1993 | I175: 132.00 | J175: 354.00 | K175: RC[-1]-RC[-2] -> 222
A176: U.S.A. | B176: WEST | C176: CONSUMER | D176: OFFICE | E176: CHAIR | F176: 2 | G176: May | H176: 1993 | I176: 652.00 | J176: 163.00 | K176: RC[-1]-RC[-2] -> -489
A177: U.S.A. | B177: WEST | C177: CONSUMER | D177: OFFICE | E177: CHAIR | F177: 2 | G177: Jun | H177: 1993 | I177: 723.00 | J177: 336.00 | K177: RC[-1]-RC[-2] -> -387
A178: U.S.A. | B178: WEST | C178: CONSUMER | D178: OFFICE | E178: CHAIR | F178: 3 | G178: Jul | H178: 1993 | I178: 682.00 | J178: 804.00 | K178: RC[-1]-RC[-2] -> 122
A179: U.S.A. | B179: WEST | C179: CONSUMER | D179: OFFICE | E179: CHAIR | F179: 3 | G179: Aug | H179: 1993 | I179: 382.00 | J179: 863.00 | K179: RC[-1]-RC[-2] -> 481
A180: U.S.A. | B180: WEST | C180: CONSUMER | D180: OFFICE | E180: CHAIR | F180: 3 | G180: Sep | H180: 1993 | I180: 125.00 | J180: 326.00 | K180: RC[-1]-RC[-2] -> 201
A181: U.S.A. | B181: WEST | C181: CONSUMER | D181: OFFICE | E181: CHAIR | F181: 4 | G181: Oct | H181: 1993 | I181: 321.00 | J181: 568.00 | K181: RC[-1]-RC[-2] -> 247
A182: U.S.A. | B182: WEST | C182: CONSUMER | D182: OFFICE | E182: CHAIR | F182: 4 | G182: Nov | H182: 1993 | I182: 922.00 | J182: 691.00 | K182: RC[-1]-RC[-2] -> -231
A183: U.S.A. | B183: WEST | C183: CONSUMER | D183: OFFICE | E183: CHAIR | F183: 4 | G183: Dec | H183: 1993 | I183: 884.00 | J183: 152.00 | K183: RC[-1]-RC[-2] -> -732
A184: U.S.A. | B184: WEST | C184: CONSUMER | D184: OFFICE | E184: DESK | F184: 1 | G184: Jan | H184: 1993 | I184: 342.00 | J184: 793.00 | K184: RC[-1]-RC[-2] -> 451
A185: U.S.A. | B185: WEST | C185: CONSUMER | D185: OFFICE | E185: DESK | F185: 1 | G185: Feb | H185: 1993 | I185: 215.00 | J185: 129.00 | K185: RC[-1]-RC[-2] -> -86
A186: U.S.A. | B186: WEST | C186: CONSUMER | D186: OFFICE | E186: DESK | F186: 1 | G186: Mar | H186: 1993 | I186: 52.00 | J186: 481.00 | K186: RC[-1]-RC[-2] -> 429
A187: U.S.A. | B187: WEST | C187: CONSUMER | D187: OFFICE | E187: DESK | F187: 2 | G187: Apr | H187: 1993 | I187: 292.00 | J187: 406.00 | K187: RC[-1]-RC[-2] -> 114
A188: U.S.A. | B188: WEST | C188: CONSUMER | D188: OFFICE | E188: DESK | F188: 2 | G188: May | H188: 1993 | I188: 862.00 | J188: 512.00 | K188: RC[-1]-RC[-2] -> -350
A189: U.S.A. | B189: WEST | C189: CONSUMER | D189: OFFICE | E189: DESK | F189: 2 | G189: Jun | H189: 1993 | I189: 309.00 | J189: 668.00 | K189: RC[-1]-RC[-2] -> 359
A190: U.S.A. | B190: WEST | C190: CONSUMER | D190: OFFICE | E190: DESK | F190: 3 | G190: Jul | H190: 1993 | I190: 886.00 | J190: 551.00 | K190: RC[-1]-RC[-2] -> -335
A191: U.S.A. | B191: WEST | C191: CONSUMER | D191: OFFICE | E191: DESK | F191: 3 | G191: Aug | H191: 1993 | I191: 172.00 | J191: 124.00 | K191: RC[-1]-RC[-2] -> -48
A192: U.S.A. | B192: WEST | C192: CONSUMER | D192: OFFICE | E192: DESK | F192: 3 | G192: Sep | H192: 1993 | I192: 912.00 | J192: 655.00 | K192: RC[-1]-RC[-2] -> -257
A193: U.S.A. | B193: WEST | C193: CONSUMER | D193: OFFICE | E193: DESK | F193: 4 | G193: Oct | H193: 1993 | I193: 666.00 | J193: 523.00 | K193: RC[-1]-RC[-2] -> -143
A194: U.S.A. | B194: WEST | C194: CONSUMER | D194: OFFICE | E194: DESK | F194: 4 | G194: Nov | H194: 1993 | I194: 656.00 | J194: 739.00 | K194: RC[-1]-RC[-2] -> 83
A195: U.S.A. | B195: WEST | C195: CONSUMER | D195: OFFICE | E195: DESK | F195: 4 | G195: Dec | H195: 1993 | I195: 145.00 | J195: 87.00 | K195: RC[-1]-RC[-2] -> -58
A196: U.S.A. | B196: WEST | C196: EDUCATION | D196: FURNITURE | E196: SOFA | F196: 1 | G196: Jan | H196: 1993 | I196: 896.00 | J196: 404.00 | K196: RC[-1]-RC[-2] -> -492
A197: U.S.A. | B197: WEST | C197: EDUCATION | D197: FURNITURE | E197: SOFA | F197: 1 | G197: Feb | H197: 1993 | I197: 973.00 | J197: 22.00 | K197: RC[-1]-RC[-2] -> -951
A198: U.S.A. | B198: WEST | C198: EDUCATION | D198: FURNITURE | E198: SOFA | F198: 1 | G198: Mar | H198: 1993 | I198: 161.00 | J198: 744.00 | K198: RC[-1]-RC[-2] -> 583
A199: U.S.A. | B199: WEST | C199: EDUCATION | D199: FURNITURE | E199: SOFA | F199: 2 | G199: Apr | H199: 1993 | I199: 934.00 | J199: 804.00 | K199: RC[-1]-RC[-2] -> -130
A200: U.S.A. | B200: WEST | C200: EDUCATION | D200: FURNITURE | E200: SOFA | F200: 2 | G200: May | H200: 1993 | I200: 697.00 | J200: 101.00 | K200: RC[-1]-RC[-2] -> -596
A201: U.S.A. | B201: WEST | C201: EDUCATION | D201: FURNITURE | E201: SOFA | F201: 2 | G201: Jun | H201: 1993 | I201: 116.00 | J201: 293.00 | K201: RC[-1]-RC[-2] -> 177
A202: U.S.A. | B202: WEST | C202: EDUCATION | D202: FURNITURE | E202: SOFA | F202: 3 | G202: Jul | H202: 1993 | I202: 84.00 | J202: 266.00 | K202: RC[-1]-RC[-2] -> 182
A203: U.S.A. | B203: WEST | C203: EDUCATION | D203: FURNITURE | E203: SOFA | F203: 3 | G203: Aug | H203: 1993 | I203: 604.00 | J203: 372.00 | K203: RC[-1]-RC[-2] -> -232
A204: U.S.A. | B204: WEST | C204: EDUCATION | D204: FURNITURE | E204: SOFA | F204: 3 | G204: Sep | H204: 1993 | I204: 371.00 | J204: 38.00 | K204: RC[-1]-RC[-2] -> -333
A205: U.S.A. | B205: WEST | C205: EDUCATION | D205: FURNITURE | E205: SOFA | F205: 4 | G205: Oct | H205: 1993 | I205: 783.00 | J205: 385.00 | K205: RC[-1]-RC[-2] -> -398
A206: U.S.A. | B206: WEST | C206: EDUCATION | D206: FURNITURE | E206: SOFA | F206: 4 | G206: Nov | H206: 1993 | I206: 335.00 | J206: 262.00 | K206: RC[-1]-RC[-2] -> -73
A207: U.S.A. | B207: WEST | C207: EDUCATION | D207: FURNITURE | E207: SOFA | F207: 4 | G207: Dec | H207: 1993 | I207: 321.00 | J207: 961.00 | K207: RC[-1]-RC[-2] -> 640
A208: U.S.A. | B208: WEST | C208: EDUCATION | D208: FURNITURE | E208: BED | F208: 1 | G208: Jan | H208: 1993 | I208: 846.00 | J208: 18.00 | K208: RC[-1]-RC[-2] -> -828
A209: U.S.A. | B209: WEST | C209: EDUCATION | D209: FURNITURE | E209: BED | F209: 1 | G209: Feb | H209: 1993 | I209: 933.00 | J209: 512.00 | K209: RC[-1]-RC[-2] -> -421
A210: U.S.A. | B210: WEST | C210: EDUCATION | D210: FURNITURE | E210: BED | F210: 1 | G210: Mar | H210: 1993 | I210: 237.00 | J210: 337.00 | K210: RC[-1]-RC[-2] -> 100
A211: U.S.A. | B211: WEST | C211: EDUCATION | D211: FURNITURE | E211: BED | F211: 2 | G211: Apr | H211: 1993 | I211: 964.00 | J211: 167.00 | K211: RC[-1]-RC[-2] -> -797
A212: U.S.A. | B212: WEST | C212: EDUCATION | D212: FURNITURE | E212: BED | F212: 2 | G212: May | H212: 1993 | I212: 382.00 | J212: 749.00 | K212: RC[-1]-RC[-2] -> 367
A213: U.S.A. | B213: WEST | C213: EDUCATION | D213: FURNITURE | E213: BED | F213: 2 | G213: Jun | H213: 1993 | I213: 610.00 | J213: 890.00 | K213: RC[-1]-RC[-2] -> 280
A214: U.S.A. | B214: WEST | C214: EDUCATION | D214: FURNITURE | E214: BED | F214: 3 | G214: Jul | H214: 1993 | I214: 148.00 | J214: 910.00 | K214: RC[-1]-RC[-2] -> 762
A215: U.S.A. | B215: WEST | C215: EDUCATION | D215: FURNITURE | E215: BED | F215: 3 | G215: Aug | H215: 1993 | I215: 837.00 | J215: 403.00 | K215: RC[-1]-RC[-2] -> -434
A216: U.S.A. | B216: WEST | C216: EDUCATION | D216: FURNITURE | E216: BED | F216: 3 | G216: Sep | H216: 1993 | I216: 85.00 | J216: 403.00 | K216: RC[-1]-RC[-2] -> 318
A217: U.S.A. | B217: WEST | C217: EDUCATION | D217: FURNITURE | E217: BED | F217: 4 | G217: Oct | H217: 1993 | I217: 425.00 | J217: 661.00 | K217: RC[-1]-RC[-2] -> 236
A218: U.S.A. | B218: WEST | C218: EDUCATION | D218: FURNITURE | E218: BED | F218: 4 | G218: Nov | H218: 1993 | I218: 633.00 | J218: 485.00 | K218: RC[-1]-RC[-2] -> -148
A219: U.S.A. | B219: WEST | C219: EDUCATION | D219: FURNITURE | E219: BED | F219: 4 | G219: Dec | H219: 1993 | I219: 515.00 | J219: 789.00 | K219: RC[-1]-RC[-2] -> 274
A220: U.S.A. | B220: WEST | C220: EDUCATION | D220: OFFICE | E220: TABLE | F220: 1 | G220: Jan | H220: 1993 | I220: 556.00 | J220: 608.00 | K220: RC[-1]-RC[-2] -> 52
A221: U.S.A. | B221: WEST | C221: EDUCATION | D221: OFFICE | E221: TABLE | F221: 1 | G221: Feb | H221: 1993 | I221: 202.00 | J221: 840.00 | K221: RC[-1]-RC[-2] -> 638
A222: U.S.A. | B222: WEST | C222: EDUCATION | D222: OFFICE | E222: TABLE | F222: 1 | G222: Mar | H222: 1993 | I222: 964.00 | J222: 112.00 | K222: RC[-1]-RC[-2] -> -852
A223: U.S.A. | B223: WEST | C223: EDUCATION | D223: OFFICE | E223: TABLE | F223: 2 | G223: Apr | H223: 1993 | I223: 112.00 | J223: 288.00 | K223: RC[-1]-RC[-2] -> 176
A224: U.S.A. | B224: WEST | C224: EDUCATION | D224: OFFICE | E224: TABLE | F224: 2 | G224: May | H224: 1993 | I224: 445.00 | J224: 408.00 | K224: RC[-1]-RC[-2] -> -37
A225: U.S.A. | B225: WEST | C225: EDUCATION | D225: OFFICE | E225: TABLE | F225: 2 | G225: Jun | H225: 1993 | I225: 884.00 | J225: 876.00 | K225: RC[-1]-RC[-2] -> -8
A226: U.S.A. | B226: WEST | C226: EDUCATION | D226: OFFICE | E226: TABLE | F226: 3 | G226: Jul | H226: 1993 | I226: 348.00 | J226: 224.00 | K226: RC[-1]-RC[-2] -> -124
A227: U.S.A. | B227: WEST | C227: EDUCATION | D227: OFFICE | E227: TABLE | F227: 3 | G227: Aug | H227: 1993 | I227: 564.00 | J227: 133.00 | K227: RC[-1]-RC[-2] -> -431
A228: U.S.A. | B228: WEST | C228: EDUCATION | D228: OFFICE | E228: TABLE | F228: 3 | G228: Sep | H228: 1993 | I228: 568.00 | J228: 662.00 | K228: RC[-1]-RC[-2] -> 94
A229: U.S.A. | B229: WEST | C229: EDUCATION | D229: OFFICE | E229: TABLE | F229: 4 | G229: Oct | H229: 1993 | I229: 882.00 | J229: 68.00 | K229: RC[-1]-RC[-2] -> -814
A230: U.S.A. | B230: WEST | C230: EDUCATION | D230: OFFICE | E230: TABLE | F230: 4 | G230: Nov | H230: 1993 | I230: 542.00 | J230: 626.00 | K230: RC[-1]-RC[-2] -> 84
A231: U.S.A. | B231: WEST | C231: EDUCATION | D231: OFFICE | E231: TABLE | F231: 4 | G231: Dec | H231: 1993 | I231: 119.00 | J231: 678.00 | K231: RC[-1]-RC[-2] -> 559
A232: U.S.A. | B232: WEST | C232: EDUCATION | D232: OFFICE | E232: CHAIR | F232: 1 | G232: Jan | H232: 1993 | I232: 261.00 | J232: 251.00 | K232: RC[-1]-RC[-2] -> -10
A233: U.S.A. | B233: WEST | C233: EDUCATION | D233: OFFICE | E233: CHAIR | F233: 1 | G233: Feb | H233: 1993 | I233: 122.00 | J233: 783.00 | K233: RC[-1]-RC[-2] -> 661
A234: U.S.A. | B234: WEST | C234: EDUCATION | D234: OFFICE | E234: CHAIR | F234: 1 | G234: Mar | H234: 1993 | I234: 296.00 | J234: 425.00 | K234: RC[-1]-RC[-2] -> 129
A235: U.S.A. | B235: WEST | C235: EDUCATION | D235: OFFICE | E235: CHAIR | F235: 2 | G235: Apr | H235: 1993 | I235: 391.00 | J235: 859.00 | K235: RC[-1]-RC[-2] -> 468
A236: U.S.A. | B236: WEST | C236: EDUCATION | D236: OFFICE | E236: CHAIR | F236: 2 | G236: May | H236: 1993 | I236: 75.00 | J236: 314.00 | K236: RC[-1]-RC[-2] -> 239
A237: U.S.A. | B237: WEST | C237: EDUCATION | D237: OFFICE | E237: CHAIR | F237: 2 | G237: Jun | H237: 1993 | I237: 731.00 | J237: 153.00 | K237: RC[-1]-RC[-2] -> -578
A238: U.S.A. | B238: WEST | C238: EDUCATION | D238: OFFICE | E238: CHAIR | F238: 3 | G238: Jul | H238: 1993 | I238: 883.00 | J238: 955.00 | K238: RC[-1]-RC[-2] -> 72
A239: U.S.A. | B239: WEST | C239: EDUCATION | D239: OFFICE | E239: CHAIR | F239: 3 | G239: Aug | H239: 1993 | I239: 707.00 | J239: 654.00 | K239: RC[-1]-RC[-2] -> -53
A240: U.S.A. | B240: WEST | C240: EDUCATION | D240: OFFICE | E240: CHAIR | F240: 3 | G240: Sep | H240: 1993 | I240: 97.00 | J240: 693.00 | K240: RC[-1]-RC[-2] -> 596
A241: U.S.A. | B241: WEST | C241: EDUCATION | D241: OFFICE | E241: CHAIR | F241: 4 | G241: Oct | H241: 1993 | I241: 390.00 | J241: 757.00 | K241: RC[-1]-RC[-2] -> 367
A242: U.S.A. | B242: WEST | C242: EDUCATION | D242: OFFICE | E242: CHAIR | F242: 4 | G242: Nov | H242: 1993 | I242: 237.00 | J242: 221.00 | K242: RC[-1]-RC[-2] -> -16
A243: U.S.A. | B243: WEST | C243: EDUCATION | D243: OFFICE | E243: CHAIR | F243: 4 | G243: Dec | H243: 1993 | I243: 496.00 | J243: 942.00 | K243: RC[-1]-RC[-2] -> 446
A244: U.S.A. | B244: WEST | C244: EDUCATION | D244: OFFICE | E244: DESK | F244: 1 | G244: Jan | H244: 1993 | I244: 144.00 | J244: 796.00 | K244: RC[-1]-RC[-2] -> 652
A245: U.S.A. | B245: WEST | C245: EDUCATION | D245: OFFICE | E245: DESK | F245: 1 | G245: Feb | H245: 1993 | I245: 142.00 | J245: 257.00 | K245: RC[-1]-RC[-2] -> 115
A246: U.S.A. | B246: WEST | C246: EDUCATION | D246: OFFICE | E246: DESK | F246: 1 | G246: Mar | H246: 1993 | I246: 273.00 | J246: 611.00 | K246: RC[-1]-RC[-2] -> 338
A247: U.S.A. | B247: WEST | C247: EDUCATION | D247: OFFICE | E247: DESK | F247: 2 | G247: Apr | H247: 1993 | I247: 915.00 | J247: 6.00 | K247: RC[-1]-RC[-2] -> -909
A248: U.S.A. | B248: WEST | C248: EDUCATION | D248: OFFICE | E248: DESK | F248: 2 | G248: May | H248: 1993 | I248: 920.00 | J248: 125.00 | K248: RC[-1]-RC[-2] -> -795
A249: U.S.A. | B249: WEST | C249: EDUCATION | D249: OFFICE | E249: DESK | F249: 2 | G249: Jun | H249: 1993 | I249: 294.00 | J249: 745.00 | K249: RC[-1]-RC[-2] -> 451
A250: U.S.A. | B250: WEST | C250: EDUCATION | D250: OFFICE | E250: DESK | F250: 3 | G250: Jul | H250: 1993 | I250: 681.00 | J250: 437.00 | K250: RC[-1]-RC[-2] -> -244
A251: U.S.A. | B251: WEST | C251: EDUCATION | D251: OFFICE | E251: DESK | F251: 3 | G251: Aug | H251: 1993 | I251: 86.00 | J251: 906.00 | K251: RC[-1]-RC[-2] -> 820
A252: U.S.A. | B252: WEST | C252: EDUCATION | D252: OFFICE | E252: DESK | F252: 3 | G252: Sep | H252: 1993 | I252: 764.00 | J252: 844.00 | K252: RC[-1]-RC[-2] -> 80
A253: U.S.A. | B253: WEST | C253: EDUCATION | D253: OFFICE | E253: DESK | F253: 4 | G253: Oct | H253: 1993 | I253: 269.00 | J253: 413.00 | K253: RC[-1]-RC[-2] -> 144
A254: U.S.A. | B254: WEST | C254: EDUCATION | D254: OFFICE | E254: DESK | F254: 4 | G254: Nov | H254: 1993 | I254: 138.00 | J254: 869.00 | K254: RC[-1]-RC[-2] -> 731
A255: U.S.A. | B255: WEST | C255: EDUCATION | D255: OFFICE | E255: DESK | F255: 4 | G255: Dec | H255: 1993 | I255: 834.00 | J255: 403.00 | K255: RC[-1]-RC[-2] -> -431
I256: =SUBTOTAL(9,R[-240]C:R[-1]C) -> 123763.00 | J256: =SUBTOTAL(9,R[-240]C:R[-1]C) -> 121053.00 | K256: RC[-1]-RC[-2] -> -2710